ID,Source,ADMN1_ES,ADM1_PCODE,ADM2_ES,ADM2_PCODE,ADM3_ES,ADM3_PCODE,Location,X_DD,Y_DD,Georegion,Date,Hora,month,day,year,Factor involved,Flash Flood identifiers,Heavy precipitation,Short duration rain,Artificial waterway overflow,Small stream overflow,Surface runoff,Urban,Slope,River bank failure,Strong current,Short flood,Deaths,Injured,Missing,Houses_Destroyed,Houses_Damaged,Household_Affected,Directly_Affected,Indirectly_Affected,Relocated,Evacuated,Ha_crops_affected,Ha_crop_lost,FFCI,FFSI,EFFCI,Estim_affected,Estim_household,Impact_severity,ReportDateTimeUTC
3026,Desinventar,ORELLANA,EC22,ORELLANA,EC2201,DAYUMA,EC220151,Mandaripanga,-76.66554,-0.632382,El Oriente,3/20/15,10:00:00 AM,3,20,2015,,Urban,0,0,0,0,0,1,0,0,0,0,,,,,4.0,,22.0,22.0,,,,,1,1,1,22.0,4.0,3.0,2015-03-20 15:00:00
2622,Desinventar/SNGRE_2021,ESMERALDAS,EC08,RIOVERDE,EC0807,RIOVERDE,EC080750,Barrio el Progreso,-79.409418,1.05523,La Costa,2/15/14,12:40:00 PM,2,15,2014,Rain ,Urban,0,0,0,0,0,1,0,0,0,0,,,,,1.0,,,,,,,,1,1,1,,1.0,,2014-02-15 17:40:00
2735,Desinventar,ESMERALDAS,EC08,RIOVERDE,EC0807,RIOVERDE,EC080750,Palestina,-79.413553,1.068246,La Costa,4/2/14,4:27:00 AM,4,2,2014,Rain ,Urban,0,0,0,0,0,1,0,0,0,0,,,,,10.0,,30.0,30.0,,,,,1,1,1,30.0,10.0,3.0,2014-04-02 09:27:00
2247,Desinventar/SNGRE_2021,LOS RIOS,EC12,QUEVEDO,EC1205,SAN CARLOS,EC120553,Barrio Santa Rosa,-79.4235,-1.1134,La Costa,4/9/13,8:40:00 PM,4,9,2013,Rain ,Urban,0,0,0,0,0,1,0,0,0,0,,,,,1.0,,5.0,5.0,,,,,1,1,1,5.0,1.0,1.0,2013-04-10 01:40:00
2553,Desinventar,ESMERALDAS,EC08,QUININDE,EC0804,ROSA ZARATE (QUININDE),EC080450,Barrios asentados en zonas bajas,-79.521741,0.299329,La Costa,1/22/14,6:00:00 AM,1,22,2014,Rain ,Urban,0,0,0,0,0,1,0,0,0,0,,,,,,,,,,,,,1,1,1,,,,2014-01-22 11:00:00
4565,Desinventar,EL ORO,EC07,PASAJE,EC0709,TRES CERRITOS,EC070950,Tierra Prometida,-79.767653,-3.32506,La Costa,1/7/19,8:12:00 PM,1,7,2019,Rain,Urban,0,0,0,0,0,1,0,0,0,0,,,,,2.0,2.0,9.0,9.0,,,,,1,1,1,9.0,2.0,2.0,2019-01-08 01:12:00
3217,SNGRE,EL ORO,EC07,PASAJE,EC0709,LA PEANA,EC070953,Barrio Fatima,-79.852055,-3.312756,La Costa,7/4/15,7:05:00 PM,7,4,2015,,Artificial waterway overflow,0,0,1,0,0,0,0,0,0,0,,,,,,,3.0,,,,,,1,1,1,3.0,,1.0,2015-07-05 00:05:00
2018,Desinventar/SNGRE_2021,EL ORO,EC07,MACHALA,EC0701,MACHALA,EC070150,Barrio San Marcos - via Ferroviaria cerca de caseta de bombe,-79.9026,-3.2679,La Costa,3/5/13,5:35:00 PM,3,5,2013,Overflow,Artificial waterway overflow,0,0,1,0,0,0,0,0,0,0,,,,,20.0,,,,,,,,1,1,1,,20.0,,2013-03-05 22:35:00
5133,SNGRE_2021,EL ORO,EC07,MACHALA,EC0701,MACHALA,EC070150,"Varios Sectores (Manuel Estomba y Junin; Santa Rosa y Manuel Estomba, 13 Oeste y 25 de Junio, Cdla. Venecia, Federico Paez, 18 de Octubre, 1ero de Enero, Cdla. Los Esteros, Los Sauces 2, 8 de Noviembre, Ave. Gran Colombia, 1ro Enero, Cdla. Mario Minuche, Cdla. Gonzalez Rubio, Cdla. Alcides Pesantez, Cdla. Los Girasoles, Cdla. Tiwinza, Los Sauces 1, 10 de Septiembre, Cdla. Harry Alvarez, Barrio Minuche, San Estuardo, El Pacifico, Barrio Independiente)",-79.949118,-3.251151,La Costa,2/23/20,1:00:00 AM,2,23,2020,Rain,Urban,0,0,0,0,0,1,0,0,0,0,,,,,636.0,636.0,2558.0,,,283.0,,,1,1,1,2558.0,636.0,,2020-02-23 06:00:00
5120,SNGRE_2021,EL ORO,EC07,MACHALA,EC0701,MACHALA,EC070150,"Varios sectores: Colon Tinoco, Los Vergeles, 14ava Norte y Buena Vista, Ursesa 2 Sector 1, Ciudadela Iess, Oro City 3, Cdla Brisas del Mar",-79.962507,-3.259695,La Costa,2/20/20,9:42:00 PM,2,20,2020,Rain,Urban,0,0,0,0,0,1,0,0,0,0,,,,,8.0,9.0,32.0,,,7.0,,,1,1,1,32.0,9.0,3.0,2020-02-21 02:42:00
5219,SNGRE_2021,GUAYAS,EC09,COLIMES,EC0905,COLIMES,EC090550,Cdla. Desmon Balton,-80.010003,-1.5467541,La Costa,3/15/20,10:15:00 PM,3,15,2020,Rain,Urban,0,0,0,0,0,1,0,0,0,0,,,,,5.0,5.0,20.0,,,,,,1,1,1,20.0,5.0,3.0,2020-03-16 03:15:00
4414,Desinventar,GUAYAS,EC09,LOMAS DE SARGENTILLO,EC0924,LOMAS DE SARGENTILLO,EC092450,Av. El Telegrafo - entrada Monserrate,-80.097343,-1.873793,La Costa,3/17/18,10:57:00 PM,3,18,2018,Rain,Urban,0,0,0,0,0,1,0,0,0,0,,,,,,,30.0,10.0,,,,,1,1,1,30.0,,3.0,2018-03-18 03:57:00
3515,Desinventar,EL ORO,EC07,HUAQUILLAS,EC0707,HUAQUILLAS,EC070750,Varios Sectores/Ciudadela Primero de Mayo La Lagartera Brisa,-80.241646,-3.486559,La Costa,3/7/16,6:00:00 AM,3,7,2016,Rain / Overflow,Artificial waterway overflow,0,0,1,0,0,0,0,0,0,0,,,,,,,,,,,,,1,1,1,,,,2016-03-07 11:00:00
2859,SNGRE,MANABI,EC13,ROCAFUERTE,EC1312,ROCAFUERTE,EC131250,Comunidad El Pueblito,-80.488335,-0.917559,La Costa,9/8/14,5:34:00 AM,9,8,2014,,Artificial waterway overflow,0,0,1,0,0,0,0,0,0,0,,,,,,,,,,,,,1,1,1,,,,2014-09-08 10:34:00
2441,Desinventar/SNGRE_2021,SUCUMBIOS,EC21,PUTUMAYO,EC2103,PUERTO RODRIGUEZ,EC210353,Bajo Rodriguez; Buen Samaritano; Nuevo Sinai; Pto Rodriguez;,-75.4905,-0.0586,El Oriente,7/19/13,12:00:00 PM,7,19,2013,Rain / Overflow,Heavy precipitation,1,0,0,0,0,0,0,0,0,0,,,,,,,449.0,449.0,,,,,2,1,2,,,,2013-07-19 17:00:00
2855,Desinventar,SUCUMBIOS,EC21,PUTUMAYO,EC2103,PUERTO EL CARMEN DEL PUTUMAYO,EC210350,Riveras del Rio Putumayo,-75.58797,-0.012826,El Oriente,7/16/14,11:00:00 AM,7,16,2014,Rain / Overflow,Heavy precipitation,1,0,0,0,0,0,0,0,0,0,,,,,57.0,,266.0,266.0,,,,,2,1,2,266.0,57.0,5.0,2014-07-16 16:00:00
4471,SNGRE,SUCUMBIOS,EC21,CUYABENO,EC2107,CUYABENO,EC210751,Comunidad Zabalo  ,-75.668113,-0.355505,El Oriente,5/24/18,4:00:00 PM,5,24,2018,Rain ,Heavy precipitation,1,0,0,0,0,0,0,0,0,0,,,,,,,9.0,,,,,,2,1,2,9.0,,2.0,2018-05-24 21:00:00
4494,Desinventar,SUCUMBIOS,EC21,CUYABENO,EC2107,CUYABENO,EC210751,Comunidad Zabalo,-75.668113,-0.355505,El Oriente,7/22/18,11:00:00 PM,7,22,2018,Rain ,Heavy precipitation,1,0,0,0,0,0,0,0,0,0,,,,,45.0,,135.0,135.0,,,,,2,1,2,135.0,45.0,5.0,2018-07-23 04:00:00
4978,SNGRE,SUCUMBIOS,EC21,CUYABENO,EC2107,CUYABENO,EC210751,Comunidad Zabalo,-75.74241,-0.317101,El Oriente,6/23/19,6:00:00 AM,6,23,2019,Rain / Overflow,Heavy precipitation/urban,1,0,0,0,0,1,0,0,0,0,,,,,,52.0,208.0,,,,,,3,1,2,208.0,52.0,5.0,2019-06-23 11:00:00
3237,Desinventar,SUCUMBIOS,EC21,PUTUMAYO,EC2103,PUERTO EL CARMEN DEL PUTUMAYO,EC210350,"Puerto El Carmen, Tigre Playa, Yanamarun, Santa Rosa, Loroca",-75.998783,0.271396,El Oriente,7/24/15,9:14:00 PM,7,24,2015,Rain / Overflow,Heavy precipitation,1,0,0,0,0,0,0,0,0,0,,,,,,,280.0,280.0,,,,,2,1,2,280.0,,5.0,2015-07-25 02:14:00
3262,Desinventar,SUCUMBIOS,EC21,PUTUMAYO,EC2103,PALMA ROJA,EC210351,Lorocachi 2,-76.047044,0.108939,El Oriente,11/8/15,6:04:00 PM,11,8,2015,Rain / Overflow,Heavy precipitation,1,0,0,0,0,0,0,0,0,0,,,,,,,24.0,24.0,,,,,2,1,2,24.0,,3.0,2015-11-08 23:04:00
3235,Desinventar,SUCUMBIOS,EC21,SHUSHUFINDI,EC2104,LIMONCOCHA,EC210451,Comuna El Pilchi,-76.598081,-0.411971,El Oriente,7/23/15,8:25:00 AM,7,23,2015,Rain / Overflow,Heavy precipitation,1,0,0,0,0,0,0,0,0,0,,,,,,,66.0,66.0,,,,,2,1,2,66.0,,4.0,2015-07-23 13:25:00
2846,Desinventar,SUCUMBIOS,EC21,LAGO AGRIO,EC2101,GENERAL FARFAN,EC210153,Sosoranga,-76.743673,0.180044,El Oriente,6/30/14,10:00:00 PM,6,30,2014,Rain / Overflow,Heavy precipitation,1,0,0,0,0,0,0,0,0,0,,,,,16.0,,71.0,71.0,67.0,,,,2,1,2,71.0,16.0,4.0,2014-07-01 03:00:00
2447,Desinventar/SNGRE_2021,SUCUMBIOS,EC21,LAGO AGRIO,EC2101,GENERAL FARFAN,EC210153,18 de Noviembre y Fuerzas Unidas,-76.845,0.2367,El Oriente,7/26/13,5:00:00 AM,7,26,2013,Rain / Overflow,Heavy precipitation,1,0,0,0,0,0,0,0,0,0,,,,,2.0,,241.0,241.0,,,,,2,1,2,241.0,2.0,5.0,2013-07-26 10:00:00
4310,Desinventar,SUCUMBIOS,EC21,LAGO AGRIO,EC2101,NUEVA LOJA,EC210150,Puerto Aguarico - Comunidad Pullupungo Via a Pusino,-76.865707,0.054618,El Oriente,10/22/17,6:00:00 PM,10,22,2017,Rain / Overflow,Heavy precipitation,1,0,0,0,0,0,0,0,0,0,,,,,,,46.0,,,46.0,,,2,1,2,46.0,,3.0,2017-10-22 23:00:00
4179,SNGRE,SUCUMBIOS,EC21,LAGO AGRIO,EC2101,NUEVA LOJA,EC210150,Barrio San Francisco - Paraiso - Velasco Ibarra - Los Ceibos- Lotizacion El Chofer        ,-76.867115,0.092925,El Oriente,4/12/17,10:00:00 AM,4,12,2017,Rain ,Heavy precipitation/ Urban ,1,0,0,0,0,1,0,0,0,0,,,,,,,16.0,,,,,,3,1,2,16.0,,3.0,2017-04-12 15:00:00
3673,Desinventar,SUCUMBIOS,EC21,LAGO AGRIO,EC2101,NUEVA LOJA,EC210150,21 Barrios del Canton Lago Agrio,-76.87208,0.100091,El Oriente,12/3/16,6:00:00 AM,12,3,2016,Rain ,Heavy precipitation/ Urban ,1,0,0,0,0,1,0,0,0,0,,,,,21.0,,,,,,,,3,1,2,,21.0,,2016-12-03 11:00:00
3260,Desinventar,SUCUMBIOS,EC21,LAGO AGRIO,EC2101,NUEVA LOJA,EC210150,Comunidad El Condor,-76.878204,0.118435,El Oriente,11/7/15,3:00:00 AM,11,7,2015,Rain / Overflow,Heavy precipitation,1,0,0,0,0,0,0,0,0,0,,,,,,,,,,,,,2,1,2,,,,2015-11-07 08:00:00
5008,SNGRE_2021,SUCUMBIOS,EC21,LAGO AGRIO,EC2101,NUEVA LOJA,EC210150,Barrio La Pampa,-76.88125,0.067786,El Oriente,9/18/19,10:00:00 AM,9,18,2019,,Heavy precipitation,1,0,0,0,0,0,0,0,0,0,,,,,1.0,1.0,2.0,,,,,,2,1,2,2.0,1.0,1.0,2019-09-18 15:00:00
5290,SNGRE_2021,SUCUMBIOS,EC21,LAGO AGRIO,EC2101,NUEVA LOJA,EC210150,Barrio Mirador,-76.88244,0.09765608,El Oriente,5/21/20,9:00:00 AM,5,21,2020,Rain,Short duration rain,0,1,0,0,0,0,0,0,0,0,,,,,1.0,,,,,,,,3,1,2,,1.0,,2020-05-21 14:00:00
5229,SNGRE_2021,SUCUMBIOS,EC21,LAGO AGRIO,EC2101,NUEVA LOJA,EC210150,Varios Sectores de Lago Agrio.,-76.89361,0.08664491,El Oriente,3/28/20,6:00:00 AM,3,28,2020,Rain,Heavy precipitation/Urban,1,0,0,0,0,1,0,0,0,0,,,,,,,,,,,,,3,1,2,,,,2020-03-28 11:00:00
4435,SNGRE,SUCUMBIOS,EC21,LAGO AGRIO,EC2101,NUEVA LOJA,EC210150,Barrio El Condado  ,-76.923085,0.082635,El Oriente,4/9/18,8:00:00 AM,4,9,2018,Rain ,Heavy precipitation/ Urban ,1,0,0,0,0,1,0,0,0,0,,,,,,,40.0,,,,,,3,1,2,40.0,,3.0,2018-04-09 13:00:00
4472,Desinventar,PASTAZA,EC16,ARAJUNO,EC1604,CURARAY,EC160451,Varios Sectores,-76.945265,-1.372239,El Oriente,5/25/18,12:30:00 PM,5,25,2018,Rain / Overflow,Heavy precipitation,1,0,0,0,0,0,0,0,0,0,,,,,,,1100.0,,,,,,2,1,2,1100.0,,6.0,2018-05-25 17:30:00
1711,SNGRE_2021,ORELLANA,EC22,ORELLANA,EC2201,EL COCA,EC220150,Nucanchi Wasi,-76.989025,-0.43965,El Oriente,9/28/12,11:00:00 AM,9,28,2012,Rain/ Overflow,Artificial waterway overflow/ Urban,0,0,1,0,0,1,0,0,0,0,,,,,1.0,,5.0,,,,,,2,1,2,5.0,1.0,1.0,2012-09-28 16:00:00
2864,Desinventar,ORELLANA,EC22,ORELLANA,EC2201,PTO. FCO. DE ORELLANA (EL COCA,EC220150,Invasion El Ultimo Paraiso,-77.004259,-0.490238,El Oriente,9/12/14,4:00:00 PM,9,12,2014,Rain / Overflow,Heavy precipitation,1,0,0,0,0,0,0,0,0,0,,,,,,,240.0,240.0,,,,,2,1,2,240.0,,5.0,2014-09-12 21:00:00
4474,Desinventar,PASTAZA,EC16,PASTAZA,EC1601,MONTALVO (ANDOAS),EC160156,Varios Sectores,-77.007041,-2.050775,El Oriente,5/25/18,11:00:00 AM,5,25,2018,Rain / Overflow,Heavy precipitation,1,0,0,0,0,0,0,0,0,0,,,,,,,1328.0,,,,,332.0,2,1,2,1328.0,,6.0,2018-05-25 16:00:00
3693,Desinventar,ORELLANA,EC22,ORELLANA,EC2201,GARCÍA MORENO,EC220156,"Caspizapa, Puerto Colon",-77.021089,-0.567952,El Oriente,1/7/17,3:34:00 AM,1,7,2017,Rain ,Heavy precipitation,1,0,0,0,0,0,0,0,0,0,,,,,,,40.0,40.0,,,27.0,27.0,2,1,2,40.0,,3.0,2017-01-07 08:34:00
3694,Desinventar,ORELLANA,EC22,ORELLANA,EC2201,LA BELLEZA,EC220158,"Comuna Palma Roja, Ingaurco",-77.098934,-0.614853,El Oriente,1/7/17,3:34:00 AM,1,7,2017,Rain ,Heavy precipitation,1,0,0,0,0,0,0,0,0,0,,,,,,,204.0,204.0,,,118.0,67.0,2,1,2,204.0,,5.0,2017-01-07 08:34:00
2862,Desinventar,ORELLANA,EC22,ORELLANA,EC2201,LA BELLEZA,EC220158,Comunidad Palma Roja,-77.106758,-0.609194,El Oriente,9/12/14,3:00:00 AM,9,12,2014,Rain ,Heavy precipitation,1,0,0,0,0,0,0,0,0,0,,,,,,,50.0,50.0,,,40.0,,2,1,2,50.0,,3.0,2014-09-12 08:00:00
4498,Desinventar,ORELLANA,EC22,LORETO,EC2204,PUERTO MURIALDO,EC220452,Comunidad Turupunta,-77.132645,-0.690009,El Oriente,7/22/18,10:00:00 AM,7,22,2018,Rain / Overflow,Small stream overflow,0,0,0,1,0,0,0,0,0,0,,,,,,,76.0,76.0,,,,42.0,4,1,2,76.0,,4.0,2018-07-22 15:00:00
4470,SNGRE,SUCUMBIOS,EC21,CASCALES,EC2106,SEVILLA,EC210652,EL DORADO DE CASCALES. Comunidad Allishunko  ,-77.155053,0.073641,El Oriente,5/23/18,5:50:00 AM,5,23,2018,Rain / Overflow,Small stream overflow,0,0,0,1,0,0,0,0,0,0,,,,,,,80.0,,,80.0,,,4,1,2,80.0,,4.0,2018-05-23 10:50:00
4467,SNGRE,SUCUMBIOS,EC21,CASCALES,EC2106,SEVILLA,EC210652,EL DORADO DE CASCALES. Comunidad Allishunko  ,-77.155059,0.073641,El Oriente,5/22/18,12:00:00 PM,5,22,2018,Overflow,Small stream overflow,0,0,0,1,0,0,0,0,0,0,,,,,,,6.0,,,,,,4,1,2,6.0,,2.0,2018-05-22 17:00:00
3234,Desinventar,NAPO,EC15,TENA,EC1501,CHONTAPUNTA,EC150153,Comunidad Agua Santa y Cruz chicta,-77.332407,-0.911633,El Oriente,7/23/15,3:38:00 AM,7,23,2015,Rain,Short duration rain,0,1,0,0,0,0,0,0,0,0,,,,,2.0,,,,,,,,3,1,2,,2.0,,2015-07-23 08:38:00
2452,Desinventar/SNGRE_2021,SUCUMBIOS,EC21,GONZALO PIZARRO,EC2102,LUMBAQUI,EC210250,Calle Chiriboga y Rafael Ferrer,-77.3486,0.0594,La Sierra,9/29/13,8:20:00 PM,9,29,2013,Rain,Heavy precipitation,1,0,0,0,0,0,0,0,0,0,,,,,9.0,,33.0,33.0,,,,,2,1,2,33.0,9.0,3.0,2013-09-30 01:20:00
4186,Desinventar,MORONA SANTIAGO,EC14,TIWINTZA,EC1412,SAN JOSE DE MORONA,EC141251,"Mangosiza, Puerto Kashpaime, San Pedro",-77.69371,-2.874259,La Sierra,4/14/17,3:03:00 AM,4,14,2017,Rain / Overflow,Heavy precipitation,1,0,0,0,0,0,0,0,0,0,,,,,2.0,,154.0,154.0,,,43.5,25.0,2,1,2,154.0,2.0,5.0,2017-04-14 08:03:00
2940,Desinventar,MORONA SANTIAGO,EC14,TIWINTZA,EC1412,SAN JOSE DE MORONA,EC141251,La Paz,-77.797474,-2.904652,La Sierra,2/1/15,5:30:00 AM,2,1,2015,Rain / Overflow,Heavy precipitation,1,0,0,0,0,0,0,0,0,0,,,,,3.0,,7.0,7.0,,,,,2,1,2,7.0,3.0,2.0,2015-02-01 10:30:00
5099,SNGRE_2021,MORONA SANTIAGO,EC14,PALORA,EC1404,16 DE AGOSTO,EC140455,Shiram Alto,-77.890077,-1.734415,La Sierra,1/29/20,10:00:00 AM,1,29,2020,Rain/Overflow,Small stream overflow,0,0,0,1,0,0,0,0,0,0,,,,,,1.0,4.0,,,,,,4,1,2,4.0,1.0,1.0,2020-01-29 15:00:00
4328,SNGRE,MORONA SANTIAGO,EC14,TIWINTZA,EC1412,SANTIAGO,EC141250,Kiim,-78.040576,-3.032992,La Sierra,11/20/17,9:47:00 PM,11,20,2017,Rain,Heavy precipitation,1,0,0,0,0,0,0,0,0,0,,,,,,,128.0,,,,,,2,1,2,128.0,,5.0,2017-11-21 02:47:00
3646,Desinventar,MORONA SANTIAGO,EC14,TIWINTZA,EC1412,SANTIAGO,EC141250,Pitiu ,-78.06698,-3.045124,La Sierra,7/9/16,7:17:00 AM,7,9,2016,Rain / Overflow,Short duration rain,0,1,0,0,0,0,0,0,0,0,,,,,,,,,,,0.05,,3,1,2,,,,2016-07-09 12:17:00
2900,Desinventar,PASTAZA,EC16,MERA,EC1602,SHELL,EC160252,Moravia,-78.078076,-1.486901,La Sierra,11/1/14,8:15:00 PM,11,1,2014,Rain ,Urban / Short duration rain,0,1,0,0,0,1,0,0,0,0,,,,,2.0,,,,,,,,4,1,2,,2.0,,2014-11-02 01:15:00
4237,SNGRE,ESMERALDAS,EC08,SAN LORENZO,EC0805,CARONDELET,EC080554,La Boca ,-78.772132,1.128253,La Costa,5/2/17,1:00:00 AM,5,2,2017,Rain / Overflow,Heavy precipitation,1,0,0,0,0,0,0,0,0,0,,,,,,,22.0,,,,,,2,1,2,22.0,,3.0,2017-05-02 06:00:00
3339,Desinventar,ESMERALDAS,EC08,SAN LORENZO,EC0805,CARONDELET,EC080554,NAJURUNGO,-78.776348,1.128365,La Costa,1/25/16,6:00:00 AM,1,25,2016,Rain,Heavy precipitation,1,0,0,0,0,0,0,0,0,0,,,,,,,,,,,4.0,0.6,2,1,2,,,,2016-01-25 11:00:00
3250,Desinventar,ESMERALDAS,EC08,ELOY ALFARO,EC0802,LUIS V. TORRES (CAB. EN PLAYA ,EC080255,PLAYA DE OROR,-78.828939,0.881464,La Costa,10/25/15,2:00:00 AM,10,25,2015,Rain / Overflow,Heavy precipitation,1,0,0,0,0,0,0,0,0,0,,,,,20.0,,33.0,33.0,,,,,2,1,2,33.0,20.0,3.0,2015-10-25 07:00:00
1832,Desinventar/SNGRE_2021,ESMERALDAS,EC08,ELOY ALFARO,EC0802,MALDONADO,EC080256,Riveras del rio Santiago,-78.8979,1.0472,La Costa,1/24/13,4:00:00 PM,1,24,2013,Rain / Overflow,Small stream overflow,0,0,0,1,0,0,0,0,0,0,,,,,60.0,,304.0,304.0,,29.0,,,4,1,2,304.0,60.0,5.0,2013-01-24 21:00:00
2305,Desinventar/SNGRE_2021,ESMERALDAS,EC08,ELOY ALFARO,EC0802,MALDONADO,EC080256,Cabecera Parroquial,-78.9052,1.0692,La Costa,4/19/13,7:00:00 PM,4,19,2013,Rain ,Heavy precipitation ,1,0,0,0,0,0,0,0,0,0,,,,,74.0,,,,,,,,2,1,2,,74.0,,2013-04-20 00:00:00
4945,SNGRE,ESMERALDAS,EC08,ELOY ALFARO,EC0802,COLON ELOY DEL MARIA,EC080262,Varios sectores (Recintos: Colon Eloy y Valdez),-78.90795,1.018565,La Costa,5/17/19,9:43:00 AM,5,17,2019,Rain / Overflow,Heavy precipitation,1,0,0,0,0,0,0,0,0,0,,,,,,16.0,64.0,,,,,,2,1,2,64.0,16.0,4.0,2019-05-17 14:43:00
2956,Desinventar,ESMERALDAS,EC08,ELOY ALFARO,EC0802,COLON ELOY DEL MARIA,EC080262,RECINTO CEJA VALDEZ,-78.911938,1.000087,La Costa,2/7/15,6:00:00 AM,2,7,2015,Rain ,Heavy precipitation,1,0,0,0,0,0,0,0,0,0,,,,,25.0,,,,,,,,2,1,2,,25.0,,2015-02-07 11:00:00
4951,SNGRE,ESMERALDAS,EC08,ELOY ALFARO,EC0802,TELEMBI,EC080261,Varios sectores (Recintos: Telembi y Zapallo Grande),-78.927998,0.803415,La Costa,5/17/19,8:19:00 AM,5,17,2019,Rain / Overflow,Heavy precipitation,1,0,0,0,0,0,0,0,0,0,,,,,,36.0,194.0,,,,,,2,1,2,194.0,36.0,5.0,2019-05-17 13:19:00
3399,Desinventar,ESMERALDAS,EC08,ELOY ALFARO,EC0802,TELEMBI,EC080261,VARIOS SECTORES (JEYAMBi ZAPALLO GRANDE LOMA LINDA TSEJPI),-78.933514,0.76369,La Costa,1/25/16,6:00:00 AM,1,25,2016,Rain,Heavy precipitation,1,0,0,0,0,0,0,0,0,0,,,,,,,,,,,58.25,21.0,2,1,2,,,,2016-01-25 11:00:00
5282,SNGRE_2021,ESMERALDAS,EC08,ELOY ALFARO,EC0802,TELEMBI,EC080261,"Varios sectores: Telembi, Zapallo, Chispero, Guadual, Loma Linda, El Tigre, San Miguel, Agua Blanca, Viruela.",-78.938298,0.810311,La Costa,5/15/20,6:00:00 AM,5,15,2020,Rain/Overflow,Heavy precipitation,1,0,0,0,0,0,0,0,0,0,,,,,188.0,188.0,752.0,,,,,,2,1,2,752.0,188.0,6.0,2020-05-15 11:00:00
4943,SNGRE,ESMERALDAS,EC08,ELOY ALFARO,EC0802,ATAHUALPA (CAB. EN CAMARONES),EC080252,Varios sectores: Juan Montalvo y Santa Maria,-78.963308,0.851658,La Costa,5/17/19,8:19:00 AM,5,17,2019,Rain / Overflow,Heavy precipitation,1,0,0,0,0,0,0,0,0,0,,,,,,53.0,212.0,,,,,,2,1,2,212.0,53.0,5.0,2019-05-17 13:19:00
3384,Desinventar,ESMERALDAS,EC08,ELOY ALFARO,EC0802,SAN JOSE DE CAYAPAS,EC080263,PICHIYACU CHACHI,-78.970542,0.879695,La Costa,1/25/16,6:00:00 AM,1,25,2016,Rain,Heavy precipitation,1,0,0,0,0,0,0,0,0,0,,,,,,,,,,,50.0,,2,1,2,,,,2016-01-25 11:00:00
5280,SNGRE_2021,ESMERALDAS,EC08,ELOY ALFARO,EC0802,SAN JOSE DE CAYAPAS,EC080263,"Varios sectores: Punta de Venado, Pichiyacu Negro, Pichiyacu Chachi, Playa Grande, Luz del Carmen, La Herradura.",-78.975881,0.870317,La Costa,5/15/20,6:00:00 AM,5,15,2020,Rain/Overflow,Heavy precipitation,1,0,0,0,0,0,0,0,0,0,,,,,90.0,90.0,480.0,,,,,,2,1,2,480.0,90.0,5.0,2020-05-15 11:00:00
4031,Desinventar,ESMERALDAS,EC08,ELOY ALFARO,EC0802,BORBON,EC080253,Varios Sectores,-78.987106,1.087769,La Costa,3/26/17,10:00:00 AM,3,26,2017,Rain / Overflow,Heavy precipitation,1,0,0,0,0,0,0,0,0,0,,,,,133.0,,671.0,671.0,,,,,2,1,2,671.0,133.0,6.0,2017-03-26 15:00:00
5278,SNGRE_2021,ESMERALDAS,EC08,ELOY ALFARO,EC0802,BORBON,EC080253,"Varios sectores: Patere, Santa Rosa",-78.98996,1.089202,La Costa,5/15/20,6:00:00 AM,5,15,2020,Rain/Overflow,Heavy precipitation,1,0,0,0,0,0,0,0,0,0,,,,,25.0,25.0,167.0,,,,,,2,1,2,167.0,25.0,5.0,2020-05-15 11:00:00
4949,SNGRE,ESMERALDAS,EC08,ELOY ALFARO,EC0802,SAN JOSE DE CAYAPAS,EC080263,"Varios sectores: (Recintos: Punta de Venado, Pinchi Yacu negro, Pinchi Yacu Chachi, La Herradura y Playa Grande)",-78.999091,0.910938,La Costa,5/17/19,8:19:00 AM,5,17,2019,Rain / Overflow,Heavy precipitation,1,0,0,0,0,0,0,0,0,0,,,,,,76.0,346.0,,,,,,2,1,2,346.0,76.0,5.0,2019-05-17 13:19:00
3335,Desinventar,ESMERALDAS,EC08,ELOY ALFARO,EC0802,BORBON,EC080253,Varios Sectores,-79.002931,1.088838,La Costa,1/25/16,9:00:00 AM,1,25,2016,Rain ,Heavy precipitation,1,0,0,0,0,0,0,0,0,0,,,,,,,,,,,,,2,1,2,,,,2016-01-25 14:00:00
4236,SNGRE,ESMERALDAS,EC08,ELOY ALFARO,EC0802,SAN FRANCISCO DE ONZOLE,EC080258,RECINTO  ZANCUDO ,-79.057187,0.822087,La Costa,5/1/17,2:00:00 AM,5,1,2017,Rain / Overflow,Heavy precipitation,1,0,0,0,0,0,0,0,0,0,,,,,,,213.0,,,,,,2,1,2,213.0,,5.0,2017-05-01 07:00:00
4947,SNGRE,ESMERALDAS,EC08,ELOY ALFARO,EC0802,SAN FRANCISCO DE ONZOLE,EC080258,"Varios sectores (Recintos: Arenales, Boca de Iscuande, San Francisco, Tagare, Los Vernaza, Pintor 1 y Pintor 2)",-79.064321,0.889135,La Costa,5/17/19,8:19:00 AM,5,17,2019,Rain / Overflow,Heavy precipitation,1,0,0,0,0,0,0,0,0,0,,,,,,124.0,325.0,,,,,,2,1,2,325.0,124.0,5.0,2019-05-17 13:19:00
4950,SNGRE,ESMERALDAS,EC08,ELOY ALFARO,EC0802,SANTO DOMINGO DE ONZOLE,EC080259,"Varios Sectores: (Recintos Santo Domingo, Zancudo y Colon).",-79.064694,0.792171,La Costa,5/17/19,8:19:00 AM,5,17,2019,Rain / Overflow,Heavy precipitation,1,0,0,0,0,0,0,0,0,0,,,,,,169.0,543.0,,,,,,2,1,2,543.0,169.0,6.0,2019-05-17 13:19:00
5281,SNGRE_2021,ESMERALDAS,EC08,ELOY ALFARO,EC0802,SANTO DOMINGO DE ONZOLE,EC080259,Varios Sectores,-79.068919,0.780515,La Costa,5/15/20,6:00:00 AM,5,15,2020,Rain/Overflow,Heavy precipitation,1,0,0,0,0,0,0,0,0,0,,,,,138.0,138.0,552.0,,,,,,2,1,2,552.0,138.0,6.0,2020-05-15 11:00:00
5279,SNGRE_2021,ESMERALDAS,EC08,ELOY ALFARO,EC0802,SAN FRANCISCO DE ONZOLE,EC080258,"Varios sectores: San Francisco, Vayan Viendo, Pintor uno, Pintor dos, Arenales, Icuande",-79.084747,0.885829,La Costa,5/15/20,6:00:00 AM,5,15,2020,Rain/Overflow,Heavy precipitation,1,0,0,0,0,0,0,0,0,0,,,,,288.0,288.0,1552.0,,,,,,2,1,2,1552.0,288.0,6.0,2020-05-15 11:00:00
3454,Desinventar,PICHINCHA,EC17,PUERTO QUITO,EC1709,PUERTO QUITO,EC170950,Recinto Nueva Esperanza.,-79.215114,0.317272,La Costa,2/22/16,10:14:00 PM,2,22,2016,Rain / Overflow,Heavy precipitation,1,0,0,0,0,0,0,0,0,0,,,,,10.0,,23.0,23.0,,,,,2,1,2,23.0,10.0,3.0,2016-02-23 03:14:00
4060,Desinventar,GUAYAS,EC09,CRNEL MARCELINO MARIDUENA,EC0923,CORONEL MARCELINO MARIDUENA (SAN CARLOS),EC092350,Rcto. La Modelo,-79.382071,-2.2392,La Costa,3/29/17,3:00:00 PM,3,29,2017,Rain / Overflow,Heavy precipitation,1,0,0,0,0,0,0,0,0,0,,,,,27.0,,139.0,94.0,,,12.0,,2,1,2,139.0,27.0,5.0,2017-03-29 20:00:00
4717,Desinventar,ESMERALDAS,EC08,QUININDE,EC0804,LA UNION,EC080455,Barrio La Alborada,-79.396122,0.136506,La Costa,3/6/19,6:00:00 AM,3,6,2019,Rain / Overflow,Small stream overflow,0,0,0,1,0,0,0,0,0,0,,,,,11.0,11.0,58.0,58.0,,,,,4,1,2,58.0,11.0,4.0,2019-03-06 11:00:00
4715,Desinventar,ESMERALDAS,EC08,QUININDE,EC0804,LA UNION,EC080455,Barrio San Francisco,-79.40015,0.136796,La Costa,3/6/19,6:00:00 AM,3,6,2019,Rain / Overflow,Small stream overflow,0,0,0,1,0,0,0,0,0,0,,,,,8.0,8.0,33.0,33.0,,,,,4,1,2,33.0,8.0,3.0,2019-03-06 11:00:00
4716,Desinventar,ESMERALDAS,EC08,QUININDE,EC0804,LA UNION,EC080455,Barrio 7 de Septiembre,-79.401103,0.13383,La Costa,3/6/19,6:00:00 AM,3,6,2019,Rain / Overflow,Small stream overflow,0,0,0,1,0,0,0,0,0,0,,,,,2.0,2.0,5.0,5.0,,,,,4,1,2,5.0,2.0,1.0,2019-03-06 11:00:00
4544,Desinventar,ESMERALDAS,EC08,QUININDE,EC0804,LA UNION,EC080455,"La Independencia, barrio San Pedro",-79.401624,0.135593,La Costa,12/11/18,8:51:00 PM,12,11,2018,Rain,Heavy precipitation,1,0,0,0,0,0,0,0,0,0,,,,,2.0,,8.0,8.0,,,,,2,1,2,8.0,2.0,2.0,2018-12-12 01:51:00
2723,Desinventar,ESMERALDAS,EC08,RIOVERDE,EC0807,RIOVERDE,EC080750,Palestina,-79.408466,1.053792,La Costa,3/30/14,4:00:00 AM,3,30,2014,Rain ,Heavy precipitation/ Urban ,1,0,0,0,0,1,0,0,0,0,,,,,,,,,,,,,3,1,2,,,,2014-03-30 09:00:00
3367,Desinventar,ESMERALDAS,EC08,RIOVERDE,EC0807,RIOVERDE,EC080750,Varios Sectores,-79.408688,1.059941,La Costa,1/25/16,6:00:00 AM,1,25,2016,Rain ,Heavy precipitation,1,0,0,0,0,0,0,0,0,0,,,,,,,,,,,,,2,1,2,,,,2016-01-25 11:00:00
2724,Desinventar,ESMERALDAS,EC08,RIOVERDE,EC0807,RIOVERDE,EC080750,Palestina,-79.414119,1.068436,La Costa,3/30/14,8:30:00 AM,3,30,2014,Rain ,Heavy precipitation,1,0,0,0,0,0,0,0,0,0,,,,,4.0,,20.0,20.0,,,,,2,1,2,20.0,4.0,3.0,2014-03-30 13:30:00
2607,Desinventar/SNGRE_2021,ESMERALDAS,EC08,RIOVERDE,EC0807,RIOVERDE,EC080750,Barrio el Progreso ,-79.414407,1.068599,La Costa,2/5/14,4:30:00 AM,2,5,2014,Rain,Heavy precipitation,1,0,0,0,0,0,0,0,0,0,,,,,4.0,,18.0,,,,,,2,1,2,18.0,4.0,3.0,2014-02-05 09:30:00
2725,SNGRE,ESMERALDAS,EC08,RIOVERDE,EC0807,RIOVERDE,EC080750,Palestina / Barrio Duran.,-79.416725,1.069197,La Costa,3/30/14,9:30:00 AM,3,30,2014,Rain ,Heavy precipitation,1,0,0,0,0,0,0,0,0,0,,,,,,,15.0,,,,,,2,1,2,15.0,,3.0,2014-03-30 14:30:00
5113,SNGRE_2021,ESMERALDAS,EC08,RIOVERDE,EC0807,RIOVERDE,EC080750,Vuelta Larga,-79.4205,1.07020732,La Costa,2/15/20,8:45:00 AM,2,15,2020,Rain/Overflow,Heavy precipitation,1,0,0,0,0,0,0,0,0,0,,,,,4.0,4.0,16.0,,,,,,2,1,2,16.0,4.0,3.0,2020-02-15 13:45:00
3368,Desinventar,ESMERALDAS,EC08,RIOVERDE,EC0807,RIOVERDE,EC080750,VARIOS SECTORES ( LA COLOMBIA SANDOVAL SAN VICENTE GUAYABILL,-79.428117,1.034665,La Costa,1/25/16,6:00:00 AM,1,25,2016,Rain,Heavy precipitation,1,0,0,0,0,0,0,0,0,0,,,,,,,,,,,27.5,10.0,2,1,2,,,,2016-01-25 11:00:00
3342,Desinventar,ESMERALDAS,EC08,RIOVERDE,EC0807,CHONTADURO,EC080751,VARIOS SECTORES (EL OLIVO ZAPALLO LA CIERPE PORVENIR JULIAN ,-79.434874,0.916582,La Costa,1/25/16,6:00:00 AM,1,25,2016,,Heavy precipitation,1,0,0,0,0,0,0,0,0,0,,,,,,,,,,,21.5,12.0,2,1,2,,,,2016-01-25 11:00:00
3387,Desinventar,LOS RIOS,EC12,QUEVEDO,EC1205,SAN CAMILO,EC120550,Cruz Maria,-79.448718,-1.038504,La Costa,1/25/16,6:02:00 AM,1,25,2016,Rain ,Heavy precipitation,1,0,0,0,0,0,0,0,0,0,,,,,,,229.0,229.0,,229.0,,,2,1,2,229.0,,5.0,2016-01-25 11:02:00
3549,Desinventar,LOS RIOS,EC12,QUEVEDO,EC1205,QUEVEDO CABECERA CANTONAL,EC120550,La Atascoso,-79.458994,-1.022778,La Costa,3/27/16,4:20:00 AM,3,27,2016,Rain,Heavy precipitation,1,0,0,0,0,0,0,0,0,0,,,,,2.0,,15.0,15.0,,,,,2,1,2,15.0,2.0,3.0,2016-03-27 09:20:00
4232,SNGRE,ESMERALDAS,EC08,QUININDE,EC0804,ROSA ZARATE (QUININDE),EC080450,VARIOS SECTORES,-79.464765,0.326879,La Costa,4/26/17,10:30:00 PM,4,26,2017,Rain,Heavy precipitation,1,0,0,0,0,0,0,0,0,0,,,,,,,120.0,,,,,,2,1,2,120.0,,5.0,2017-04-27 03:30:00
2831,SNGRE,ESMERALDAS,EC08,QUININDE,EC0804,ROSA ZARATE (QUININDE),EC080450,Pichincha ,-79.46582,0.359302,La Costa,5/22/14,7:00:00 AM,5,22,2014,Rain ,Heavy precipitation,1,0,0,0,0,0,0,0,0,0,,,,,,,14.0,,,,,,2,1,2,14.0,,3.0,2014-05-22 12:00:00
2743,Desinventar,ESMERALDAS,EC08,QUININDE,EC0804,ROSA ZARATE (QUININDE),EC080450,Varios sectores,-79.470982,0.327151,La Costa,4/8/14,8:30:00 PM,4,8,2014,Rain ,Heavy precipitation,1,0,0,0,0,0,0,0,0,0,,,,,70.0,,271.0,271.0,,,668.0,380.0,2,1,2,271.0,70.0,5.0,2014-04-09 01:30:00
1945,SNGRE_2021,ESMERALDAS,EC08,QUININDE,EC0804,ROSA ZARATE (QUININDE),EC080450,Barrios asentados en zonas bajas ,-79.481,0.3268,La Costa,2/28/13,3:00:00 AM,2,28,2013,Rain,Heavy precipitation,1,0,0,0,0,0,0,0,0,0,,,,,26.0,,,,,,,,2,1,2,,26.0,,2013-02-28 08:00:00
3344,Desinventar,ESMERALDAS,EC08,QUININDE,EC0804,CHURA (CHANCAMA) (CAB. EN EL Y,EC080452,VARIOS SECTORES ( CHAMANGA AFUERA CHURA EL AGRADO),-79.481132,0.589794,La Costa,1/25/16,6:00:00 AM,1,25,2016,Rain,Heavy precipitation,1,0,0,0,0,0,0,0,0,0,,,,,,,,,,,31.0,38.0,2,1,2,,,,2016-01-25 11:00:00
3360,Desinventar,ESMERALDAS,EC08,ESMERALDAS,EC0801,MAJUA,EC080159,VARIOS SECTORES (ISLA DEL MUERTO ISLA SAN JUAN),-79.497746,0.667502,La Costa,1/25/16,6:00:00 AM,1,25,2016,Rain,Heavy precipitation,1,0,0,0,0,0,0,0,0,0,,,,,,,,,,,28.5,59.0,2,1,2,,,,2016-01-25 11:00:00
3359,Desinventar,ESMERALDAS,EC08,ESMERALDAS,EC0801,MAJUA,EC080159,VARIOS SECTORES,-79.529535,0.700297,La Costa,1/25/16,6:00:00 AM,1,25,2016,Rain,Heavy precipitation,1,0,0,0,0,0,0,0,0,0,,,,,104.0,,454.0,454.0,454.0,,,,2,1,2,454.0,104.0,5.0,2016-01-25 11:00:00
3437,Desinventar,ESMERALDAS,EC08,QUININDE,EC0804,VICHE,EC080454,ACHIOTE KM 57,-79.538911,0.649999,La Costa,2/8/16,12:53:00 AM,2,8,2016,Rain,Heavy precipitation,1,0,0,0,0,0,0,0,0,0,,,,,,,,,,,,,2,1,2,,,,2016-02-08 05:53:00
3048,Desinventar,ESMERALDAS,EC08,QUININDE,EC0804,VICHE,EC080454,PALMA REAL,-79.539231,0.623366,La Costa,3/20/15,11:00:00 PM,3,20,2015,Rain ,Heavy precipitation,1,0,0,0,0,0,0,0,0,0,,,,,16.0,,10.0,10.0,,10.0,,,2,1,2,10.0,16.0,2.0,2015-03-21 04:00:00
3341,Desinventar,ESMERALDAS,EC08,ESMERALDAS,EC0801,CHINCA,EC080154,VARIOS SECTORES (ESTERO SECO TAHIGUE CHINCA ESTERO ANCHO PAL,-79.583249,0.767129,La Costa,1/25/16,6:00:00 AM,1,25,2016,Rain,Heavy precipitation,1,0,0,0,0,0,0,0,0,0,,,,,,,,,,,11.5,65.0,2,1,2,,,,2016-01-25 11:00:00
2748,SNGRE,ESMERALDAS,EC08,ESMERALDAS,EC0801,CHINCA,EC080154,Isla del Encanto ,-79.590546,0.818107,La Costa,4/11/14,8:00:00 AM,4,11,2014,Rain / Overflow,Heavy precipitation,1,0,0,0,0,0,0,0,0,0,,,,,,,,,,,5.0,,2,1,2,,,,2014-04-11 13:00:00
3921,Desinventar,GUAYAS,EC09,SAN JACINTO DE YAGUACHI,EC0920,GRAL. PEDRO J. MONTERO (BOLICH,EC092053,Recinto San Juan,-79.591505,-2.262706,La Costa,3/10/17,5:10:00 PM,3,10,2017,Rain ,Heavy precipitation,1,0,0,0,0,0,0,0,0,0,,,,,30.0,,110.0,110.0,,,,,2,1,2,110.0,30.0,5.0,2017-03-10 22:10:00
3398,Desinventar,ESMERALDAS,EC08,ESMERALDAS,EC0801,TACHINA,EC080166,MALECoN TACHINA,-79.597795,0.935355,La Costa,1/25/16,6:00:00 AM,1,25,2016,Rain ,Heavy precipitation,1,0,0,0,0,0,0,0,0,0,,,,,16.0,,87.0,87.0,87.0,,,,2,1,2,87.0,16.0,4.0,2016-01-25 11:00:00
3502,Desinventar,GUAYAS,EC09,SAN JACINTO DE YAGUACHI,EC0920,GRAL. PEDRO J. MONTERO (BOLICH,EC092053,Varios Sectores (Sector La Almeida Recinto Vuelta Larga).,-79.623605,-2.285951,La Costa,3/6/16,9:45:00 AM,3,6,2016,Rain / Overflow,Short duration rain ,0,1,0,0,0,0,0,0,0,0,,,,,30.0,,120.0,120.0,,,,,3,1,2,120.0,30.0,5.0,2016-03-06 14:45:00
3388,Desinventar,ESMERALDAS,EC08,ESMERALDAS,EC0801,SAN MATEO,EC080163,SAN MATEO,-79.629677,0.890686,La Costa,1/25/16,11:15:00 AM,1,25,2016,Rain,Heavy precipitation,1,0,0,0,0,0,0,0,0,0,1.0,,,,5.0,,20.0,20.0,20.0,,,,2,1,2,20.0,5.0,3.0,2016-01-25 16:15:00
4014,Desinventar,ESMERALDAS,EC08,ESMERALDAS,EC0801,SAN MATEO,EC080163,Timbre,-79.630018,0.890252,La Costa,3/24/17,8:30:00 AM,3,24,2017,Rain,Heavy precipitation/Urban,1,0,0,0,0,1,0,0,0,0,,,,,40.0,,180.0,180.0,,,,,3,1,2,180.0,40.0,5.0,2017-03-24 13:30:00
3391,Desinventar,ESMERALDAS,EC08,ESMERALDAS,EC0801,SAN MATEO,EC080163,VARIOS SECTORES (TIMBIRe LA VICTORIA ISLA DEL ENCANTO),-79.634379,0.888695,La Costa,1/25/16,6:00:00 AM,1,25,2016,Rain,Heavy precipitation,1,0,0,0,0,0,0,0,0,0,,,,,,,,,,,182.25,240.0,2,1,2,,,,2016-01-25 11:00:00
3067,Desinventar,GUAYAS,EC09,SAMBORONDON,EC0916,SAMBORONDON CABECERA CANTONAL,EC091650,RecintoLos Chijos,-79.667223,-1.907013,La Costa,3/22/15,11:00:00 AM,3,22,2015,Overflow,Small stream overflow,0,0,0,1,0,0,0,0,0,0,,,,,4.0,,14.0,14.0,,,,,4,1,2,14.0,4.0,3.0,2015-03-22 16:00:00
3512,Desinventar,GUAYAS,EC09,SAN JACINTO DE YAGUACHI,EC0920,VIRGEN DE FATIMA,EC092056,Varios Sectores (Recintos El Paraiso y Belgica),-79.670943,-2.264866,La Costa,3/6/16,9:45:00 AM,3,6,2016,Rain / Overflow,Short duration rain ,0,1,0,0,0,0,0,0,0,0,,,,,12.0,,48.0,48.0,,,,,3,1,2,48.0,12.0,3.0,2016-03-06 14:45:00
2786,Desinventar,GUAYAS,EC09,SAN JACINTO DE YAGUACHI,EC0920,SAN JACINTO DE YAGUACHI,EC092050,Cdla. Los Tamarindos como referencia diagonal a la escuela J,-79.688478,-2.09978,La Costa,5/7/14,7:40:00 PM,5,7,2014,Rain,Heavy precipitation,1,0,0,0,0,0,0,0,0,0,,,,,1.0,,3.0,3.0,,,,,2,1,2,3.0,1.0,1.0,2014-05-08 00:40:00
4836,Desinventar,GUAYAS,EC09,SAN JACINTO DE YAGUACHI,EC0920,SAN JACINTO DE YAGUACHI,EC092050,Varios Sectores,-79.692305,-2.09836,La Costa,3/19/19,7:48:00 AM,3,19,2019,Rain,Heavy precipitation,1,0,0,0,0,0,0,0,0,0,,,,,,,,,,,,,2,1,2,,,,2019-03-19 12:48:00
4800,SNGRE,GUAYAS,EC09,SAN JACINTO DE YAGUACHI,EC0920,SAN JACINTO DE YAGUACHI,EC092050,Cascol,-79.695637,-2.096765,La Costa,3/17/19,7:00:00 AM,3,17,2019,Rain,Heavy precipitation,1,0,0,0,0,0,0,0,0,0,,,,,,,,,,,81.0,,2,1,2,,,,2019-03-17 12:00:00
4784,Desinventar,GUAYAS,EC09,SAMBORONDON,EC0916,SAMBORONDON CABECERA CANTONAL,EC091650,Varios Sectores,-79.727151,-1.960626,La Costa,3/16/19,7:00:00 AM,3,16,2019,Rain,Heavy precipitation,1,0,0,0,0,0,0,0,0,0,,,,,,,,,,,,14.0,2,1,2,,,,2019-03-16 12:00:00
1846,Desinventar/SNGRE_2021,GUAYAS,EC09,GUAYAQUIL,EC0901,TENGUEL,EC090158,Virgen del Cisne; Cdla 10 de Agosto; Barrio Avenida de las A,-79.7941,-3.0075,La Costa,1/24/13,3:00:00 AM,1,24,2013,Overflow,Short duration rain,0,1,0,0,0,0,0,0,0,0,,,,,250.0,,1250.0,1250.0,,,,,3,1,2,1250.0,250.0,6.0,2013-01-24 08:00:00
3767,Desinventar,GUAYAS,EC09,DURAN,EC0907,ELOY ALFARO (DURAN),EC090750,"Coop. Hermano Gregorio II, varias manzanas",-79.812743,-2.163025,La Costa,2/3/17,9:00:00 AM,2,3,2017,Rain,Heavy precipitation,1,0,0,0,0,0,0,0,0,0,,,,,20.0,,82.0,82.0,,2.0,,,2,1,2,82.0,20.0,4.0,2017-02-03 14:00:00
4782,SNGRE,GUAYAS,EC09,DURAN,EC0907,ELOY ALFARO (DURAN),EC090750,Isabel Ana,-79.813898,-2.133312,La Costa,3/16/19,7:00:00 AM,3,16,2019,Rain,Heavy precipitation,1,0,0,0,0,0,0,0,0,0,,,,,,,,,,,11.0,,2,1,2,,,,2019-03-16 12:00:00
3892,Desinventar,GUAYAS,EC09,DURAN,EC0907,ELOY ALFARO (DURAN),EC090750,Coop. 16 de Octubre Mz C Sl 8 y Mz D Sl2,-79.820817,-2.151173,La Costa,3/2/17,6:00:00 PM,3,2,2017,Rain ,Heavy precipitation,1,0,0,0,0,0,0,0,0,0,,,,,2.0,,15.0,15.0,,,,,2,1,2,15.0,2.0,3.0,2017-03-02 23:00:00
3879,Desinventar,GUAYAS,EC09,DURAN,EC0907,ELOY ALFARO (DURAN),EC090750,Barrio El Gallinazo,-79.830554,-2.162767,La Costa,2/28/17,8:30:00 AM,2,28,2017,Rain,Heavy precipitation,1,0,0,0,0,0,0,0,0,0,,,,,26.0,,86.0,86.0,,,,,2,1,2,86.0,26.0,4.0,2017-02-28 13:30:00
4639,SNGRE,GUAYAS,EC09,DURAN,EC0907,EL RECREO,EC090750,Coop. Una Sola Fuerza Mz. A3,-79.839721,-2.168974,La Costa,2/12/19,3:32:00 PM,2,12,2019,Rain,Heavy precipitation,1,0,0,0,0,0,0,0,0,0,,,,,,1.0,3.0,,,,,,2,1,2,3.0,1.0,1.0,2019-02-12 20:32:00
2783,Desinventar,GUAYAS,EC09,DURAN,EC0907,ELOY ALFARO (DURAN),EC090750,Varios Sectores,-79.840763,-2.170554,La Costa,5/7/14,6:30:00 PM,5,7,2014,Rain,Heavy precipitation,1,0,0,0,0,0,0,0,0,0,,,,,,,,,,,,,2,1,2,,,,2014-05-07 23:30:00
3564,Desinventar,EL ORO,EC07,PASAJE,EC0709,BUENAVISTA,EC070951,Buenavista,-79.841294,-3.364355,La Costa,4/2/16,8:30:00 PM,4,2,2016,Rain ,Heavy precipitation,1,0,0,0,0,0,0,0,0,0,,,,,3.0,,200.0,200.0,,,,,2,1,2,200.0,3.0,5.0,2016-04-03 01:30:00
2295,Desinventar/SNGRE_2021,EL ORO,EC07,PASAJE,EC0709,BUENAVISTA,EC070951,Barrio 3 de Abril; Sector Chofer 2 y Macario Valarezo,-79.8441,-3.3602,La Costa,4/18/13,9:20:00 PM,4,18,2013,Overflow / failure,River bank failure,0,0,0,0,0,0,0,1,0,0,,,,,12.0,,20.0,20.0,,,,,4,1,2,20.0,12.0,3.0,2013-04-19 02:20:00
4030,Desinventar,EL ORO,EC07,PASAJE,EC0709,BUENAVISTA,EC070951,"Varios Sectores (Macario Valarezo, Vega Rivera)",-79.845104,-3.362261,La Costa,3/26/17,8:00:00 AM,3,26,2017,Rain ,Heavy precipitation,1,0,0,0,0,0,0,0,0,0,,,,,16.0,,56.0,56.0,,,,,2,1,2,56.0,16.0,4.0,2017-03-26 13:00:00
2951,Desinventar,GUAYAS,EC09,BALZAR,EC0904,BALZAR,EC090450,Calle 27 de Mayo y Baltazar Arauz,-79.875382,-1.288062,La Costa,2/7/15,9:30:00 PM,2,7,2015,Rain,Heavy precipitation,1,0,0,0,0,0,0,0,0,0,,,,,3.0,,3.0,7.0,,,,,2,1,2,7.0,3.0,2.0,2015-02-08 02:30:00
4548,SNGRE,GUAYAS,EC09,BALZAR,EC0904,BALZAR,EC090450,Varios Sectores,-79.899679,-1.366428,La Costa,1/5/19,7:00:00 AM,1,5,2019,Rain,Heavy precipitation,1,0,0,0,0,0,0,0,0,0,,,,,,,,,,,301.0,,2,1,2,,,,2019-01-05 12:00:00
3524,Desinventar,EL ORO,EC07,MACHALA,EC0701,LA PROVIDENCIA,EC070150,24 de Septiembre,-79.902607,-3.267916,La Costa,3/9/16,1:30:00 PM,3,9,2016,Rain / Overflow,Artificial waterway overflow / Urban,0,0,1,0,0,1,0,0,0,0,,,,,,,,,,,,,2,1,2,,,,2016-03-09 18:30:00
4003,Desinventar,EL ORO,EC07,MACHALA,EC0701,LA PROVIDENCIA,EC070150,Predios Kathias,-79.902607,-3.267916,La Costa,3/24/17,2:15:00 AM,3,24,2017,Rain / Overflow,Heavy precipitation/ Artificial waterway overflow,1,0,1,0,0,0,0,0,0,0,,,,,23.0,,93.0,93.0,93.0,93.0,,,3,1,2,93.0,23.0,4.0,2017-03-24 07:15:00
2232,Desinventar/SNGRE_2021,GUAYAS,EC09,BALZAR,EC0904,BALZAR,EC090450,Recinto Santa Genara; Recinto La Palma,-79.9073,-1.2902,La Costa,4/4/13,11:35:00 AM,4,4,2013,Long duration rain / Overflow,Heavy precipitation,1,0,0,0,0,0,0,0,0,0,,,,,,,90.0,90.0,,,,,2,1,2,90.0,,4.0,2013-04-04 16:35:00
3560,Desinventar,GUAYAS,EC09,BALZAR,EC0904,BALZAR,EC090450,Barrio Amazonas,-79.909288,-1.367412,La Costa,4/1/16,12:45:00 AM,4,1,2016,Rain / Overflow,Small stream overflow,0,0,0,1,0,0,0,0,0,0,,,,,15.0,,73.0,73.0,,,,,4,1,2,73.0,15.0,4.0,2016-04-01 05:45:00
3497,Desinventar,GUAYAS,EC09,BALZAR,EC0904,BALZAR,EC090450,Calle 27 de Mayo (Referencia para el Parque de la Madre).,-79.90945,-1.366454,La Costa,3/6/16,5:25:00 AM,3,6,2016,Rain,Heavy precipitation,1,0,0,0,0,0,0,0,0,0,,,,,,,,,,,,,2,1,2,,,,2016-03-06 10:25:00
4145,SNGRE,GUAYAS,EC09,BALZAR,EC0904,BALZAR,EC090450,"Tachuela, Agua Frias",-79.92014,-1.358516,La Costa,4/8/17,10:30:00 PM,4,8,2017,Rain ,Heavy precipitation,1,0,0,0,0,0,0,0,0,0,,,,,,,11.0,,,11.0,,,2,1,2,11.0,,3.0,2017-04-09 03:30:00
2797,Desinventar,GUAYAS,EC09,GUAYAQUIL,EC0901,TARQUI,EC090150,Coop. Janeth Toral,-79.938153,-2.125561,La Costa,5/7/14,7:40:00 PM,5,7,2014,Rain,Heavy precipitation,1,0,0,0,0,0,0,0,0,0,,,,2.0,1.0,,10.0,13.0,,,,,2,1,2,13.0,1.0,3.0,2014-05-08 00:40:00
3847,Desinventar,EL ORO,EC07,MACHALA,EC0701,MACHALA,EC070150,Barrio 10 de septiembre,-79.942935,-3.247006,La Costa,2/20/17,5:50:00 PM,2,20,2017,Rain,Short duration rain,0,1,0,0,0,0,0,0,0,0,,,,,1.0,,1.0,1.0,,1.0,,,3,1,2,1.0,1.0,1.0,2017-02-20 22:50:00
2792,Desinventar,GUAYAS,EC09,GUAYAQUIL,EC0901,TARQUI,EC090150,Lomas de la Florida Mz. 930 Solar. 10,-79.953481,-2.129,La Costa,5/7/14,5:48:00 PM,5,7,2014,Rain,Heavy precipitation,1,0,0,0,0,0,0,0,0,0,,,,,1.0,,6.0,6.0,,,,,2,1,2,6.0,1.0,2.0,2014-05-07 22:48:00
4637,Desinventar,GUAYAS,EC09,GUAYAQUIL,EC0901,PASCUALES,EC090150,Coop. Flor de Bastion Bloque 21 Mz. 1718,-79.956082,-2.103037,La Costa,2/10/19,12:30:00 PM,2,10,2019,Rain,Heavy precipitation,1,0,0,0,0,0,0,0,0,0,,,,,1.0,1.0,4.0,4.0,,,,,2,1,2,4.0,1.0,1.0,2019-02-10 17:30:00
3477,Desinventar,GUAYAS,EC09,GUAYAQUIL,EC0901,PASCUALES,EC090150,Km. 16 via a Daule Coop. San Francisco 1 Mz. 747 Sl. 18 y Mz,-79.958655,-2.055082,La Costa,3/2/16,7:00:00 AM,3,2,2016,Rain,Short duration rain,0,1,0,0,0,0,0,0,0,0,,,,,2.0,,8.0,8.0,,,,,3,1,2,8.0,2.0,2.0,2016-03-02 12:00:00
5088,SNGRE_2021,GUAYAS,EC09,GUAYAQUIL,EC0901,TARQUI,EC090150,Coop. Flor de Bastion Bloque 6 Mz. 737 Sl 8,-79.961253,-2.0968384,La Costa,1/22/20,3:55:00 AM,1,22,2020,Rain,Heavy precipitation,1,0,0,0,0,0,0,0,0,0,,,,,1.0,1.0,5.0,,,,,,2,1,2,5.0,1.0,1.0,2020-01-22 08:55:00
2070,Desinventar/SNGRE_2021,GUAYAS,EC09,DAULE,EC0906,DAULE,EC090650,Recinto Comejen ingresando por el Recinto Las Maravillas,-79.9702,-1.8773,La Costa,3/8/13,7:36:00 AM,3,8,2013,Rain,Heavy precipitation,1,0,0,0,0,0,0,0,0,0,,,,,1.0,,394.0,394.0,,,,,2,1,2,394.0,1.0,5.0,2013-03-08 12:36:00
3816,Desinventar,GUAYAS,EC09,DAULE,EC0906,LOS LOJAS (ENRIQUE BAQUERIZO M,EC090656,Rcto. El Tape,-79.97447,-1.968768,La Costa,2/10/17,6:20:00 AM,2,10,2017,Rain ,Heavy precipitation,1,0,0,0,0,0,0,0,0,0,,,,,10.0,,40.0,40.0,,,,,2,1,2,40.0,10.0,3.0,2017-02-10 11:20:00
4797,SNGRE,GUAYAS,EC09,PALESTINA,EC0913,PALESTINA,EC091350,Av. Fausto Espinoza Pinto (Via a Balzar),-79.976619,-1.625388,La Costa,3/17/19,1:00:00 PM,3,17,2019,Rain,Small stream overflow,0,0,0,1,0,0,0,0,0,0,,,,,,3.0,9.0,,,,,,4,1,2,9.0,3.0,2.0,2019-03-17 18:00:00
4884,Desinventar,GUAYAS,EC09,PALESTINA,EC0913,PALESTINA,EC091350,Recinto El Carmen y Pijio,-79.97662,-1.625388,La Costa,3/25/19,7:00:00 AM,3,25,2019,Overflow,Heavy precipitation,1,0,0,0,0,0,0,0,0,0,,,,,161.0,151.0,489.0,489.0,,33.0,,,2,1,2,489.0,161.0,5.0,2019-03-25 12:00:00
4886,SNGRE,GUAYAS,EC09,PALESTINA,EC0913,PALESTINA,EC091350,"La Mayiya, La Mayiya de Adentro, Cristo del Consuelo",-79.97662,-1.625388,La Costa,3/25/19,7:00:00 AM,3,25,2019,Overflow,Heavy precipitation,1,0,0,0,0,0,0,0,0,0,,,,,,208.0,652.0,,,,,,2,1,2,652.0,208.0,6.0,2019-03-25 12:00:00
2999,Desinventar,GUAYAS,EC09,DAULE,EC0906,DAULE,EC090650,Hospital de Daule,-79.979935,-1.865596,La Costa,3/14/15,4:30:00 AM,3,14,2015,Rain,Short duration rain,0,1,0,0,0,0,0,0,0,0,,,,,,,,,,,,,3,1,2,,,,2015-03-14 09:30:00
4627,Desinventar,GUAYAS,EC09,DAULE,EC0906,DAULE,EC090650,Pedro Isaias - Calles 11 de Octubre y Leon Rugel,-79.98262,-1.854652,La Costa,2/7/19,10:30:00 PM,2,7,2019,Rain,Heavy precipitation,1,0,0,0,0,0,0,0,0,0,,,,,1.0,33.0,105.0,8.0,,,,,2,1,2,105.0,33.0,5.0,2019-02-08 03:30:00
4815,SNGRE,GUAYAS,EC09,SANTA LUCIA,EC0918,SANTA LUCIA,EC091850,"Coop. 3 de Abril y sector Morichal
Rcto. Jagual y Rcto. Picadura",-79.984251,-1.716487,La Costa,3/18/19,10:56:00 AM,3,18,2019,Rain,Heavy precipitation,1,0,0,0,0,0,0,0,0,0,,,,,,255.0,974.0,,,40.0,,,2,1,2,974.0,255.0,6.0,2019-03-18 15:56:00
2354,Desinventar/SNGRE_2021,GUAYAS,EC09,SANTA LUCIA,EC0918,SANTA LUCIA,EC091850,Recinto Monte Oscuro,-79.985,-1.714,La Costa,4/23/13,4:00:00 PM,4,23,2013,Rain / Overflow,Heavy precipitation,1,0,0,0,0,0,0,0,0,0,,,,,,,,,,,46.0,46.0,2,1,2,,,,2013-04-23 21:00:00
5200,SNGRE_2021,GUAYAS,EC09,SANTA LUCIA,EC0918,SANTA LUCIA,EC091850,"Sectores Morochal y Jaime Roldos, Espinal",-79.985009,-1.7139925,La Costa,3/7/20,7:00:00 AM,3,7,2020,Rain/Overflow,Heavy precipitation,1,0,0,0,0,0,0,0,0,0,,,,,13.0,13.0,43.0,,,4.0,,,2,1,2,43.0,13.0,3.0,2020-03-07 12:00:00
3416,Desinventar,GUAYAS,EC09,SANTA LUCIA,EC0918,SANTA LUCIA,EC091850,Sector Morochal calles Antonio Saa entre Carlos Cepeda y Mat,-79.988556,-1.71734,La Costa,1/26/16,8:00:00 AM,1,26,2016,Rain / Overflow,Heavy precipitation/ Urban ,1,0,0,0,0,1,0,0,0,0,,,,,6.0,,24.0,24.0,24.0,24.0,,,3,1,2,24.0,6.0,3.0,2016-01-26 13:00:00
5101,SNGRE_2021,GUAYAS,EC09,SANTA LUCIA,EC0918,SANTA LUCIA,EC091850,Recinto El Mangle,-79.99047,-1.6893632,La Costa,1/29/20,6:00:00 PM,1,29,2020,Rain,Heavy precipitation,1,0,0,0,0,0,0,0,0,0,,,,,1.0,1.0,3.0,,,,,,2,1,2,3.0,1.0,1.0,2020-01-29 23:00:00
4662,Desinventar,GUAYAS,EC09,DAULE,EC0906,DAULE,EC090650,Coop. Riberas del Daule,-79.999448,-1.870333,La Costa,2/20/19,8:30:00 PM,2,20,2019,Rain,Heavy precipitation,1,0,0,0,0,0,0,0,0,0,,,,,1.0,1.0,6.0,,,,,,2,1,2,6.0,1.0,2.0,2019-02-21 01:30:00
4166,Desinventar,GUAYAS,EC09,SANTA LUCIA,EC0918,SANTA LUCIA,EC091850,"Tres de Abril, Valles del Daule",-80.000235,-1.696875,La Costa,4/9/17,11:00:00 PM,4,9,2017,Rain / Overflow,Heavy precipitation,1,0,0,0,0,0,0,0,0,0,,,,,3.0,,63.0,13.0,3.0,,32.0,,2,1,2,63.0,3.0,4.0,2017-04-10 04:00:00
2341,Desinventar/SNGRE_2021,GUAYAS,EC09,COLIMES,EC0905,COLIMES,EC090550,Recinto San Eduardo,-80.0066,-1.5438,La Costa,4/22/13,3:00:00 PM,4,22,2013,Rain / Overflow,Heavy precipitation,1,0,0,0,0,0,0,0,0,0,,,,,,,,,,,,,2,1,2,,,,2013-04-22 20:00:00
4609,Desinventar,GUAYAS,EC09,NOBOL,EC0925,NARCISA DE JESUS,EC092550,Sector Petrillo Libre Mz. 21 solar 42,-80.012778,-1.971668,La Costa,1/15/19,5:00:00 AM,1,15,2019,Rain,Heavy precipitation,1,0,0,0,0,0,0,0,0,0,,,,,1.0,1.0,1.0,1.0,,,,,2,1,2,1.0,1.0,1.0,2019-01-15 10:00:00
4409,Desinventar,GUAYAS,EC09,ISIDRO AYORA,EC0928,ISIDRO AYORA,EC092850,Sector La Quirigua,-80.137067,-1.88323,La Costa,3/4/18,6:00:00 PM,3,4,2018,Rain ,Heavy precipitation,1,0,0,0,0,0,0,0,0,0,,,,,1.0,,2.0,2.0,,,,,2,1,2,2.0,1.0,1.0,2018-03-04 23:00:00
4829,Desinventar,GUAYAS,EC09,ISIDRO AYORA,EC0928,ISIDRO AYORA,EC092850,Escuela De Educacion Basica Mariscal Sucre,-80.145579,-1.886599,La Costa,3/19/19,7:00:00 AM,3,19,2019,Rain,Heavy precipitation,1,0,0,0,0,0,0,0,0,0,,,,,,,,,,,,,2,1,2,,,,2019-03-19 12:00:00
5138,SNGRE_2021,GUAYAS,EC09,ISIDRO AYORA,EC0928,ISIDRO AYORA,EC092850,"Isidro Ayora Varios Sectores: San Agustin, san felipe, Corosal, Las Palmas, campin 1, campin 2, La seca",-80.14565,-1.8841718,La Costa,2/24/20,8:02:00 AM,2,24,2020,Rain/Overflow,Heavy precipitation,1,0,0,0,0,0,0,0,0,0,,1.0,,,160.0,170.0,680.0,,,8.0,13.0,47.0,2,1,2,680.0,170.0,6.0,2020-02-24 13:02:00
3845,Desinventar,EL ORO,EC07,HUAQUILLAS,EC0707,UNION LOJANA,EC070750,Ciudadela San Francisco,-80.21758,-3.480314,La Costa,2/17/17,4:00:00 PM,2,17,2017,Rain ,Short duration rain,0,1,0,0,0,0,0,0,0,0,,,,,3.0,,11.0,11.0,,7.0,,,3,1,2,11.0,3.0,3.0,2017-02-17 21:00:00
5107,SNGRE_2021,EL ORO,EC07,HUAQUILLAS,EC0707,HUAQUILLAS,EC070750,"Varios Sectores (El Pescador, El Bosque, Manuel Aguirre, Brisas del Mar, Cdla. 8 de Septiembre, 18 de Noviembre, 12 de octubre, El Carmen)",-80.218271,-3.482014,La Costa,2/9/20,11:00:00 AM,2,9,2020,Rain,Heavy precipitation/Urban,1,0,0,0,0,1,0,0,0,0,,,,,5.0,5.0,21.0,,,,,,3,1,2,21.0,5.0,3.0,2020-02-09 16:00:00
5217,SNGRE_2021,EL ORO,EC07,HUAQUILLAS,EC0707,UNION LOJANA,EC070750,"Varios Sectores (Primero de Octubre, Manuel Aguirre, 8 de Septiembre, San Francisco, El Pescador 2)",-80.225823,-3.481433,La Costa,3/12/20,1:30:00 AM,3,12,2020,Rain,Heavy precipitation/Urban,1,0,0,0,0,1,0,0,0,0,,,,,57.0,55.0,188.0,,5.0,12.0,,,3,1,2,188.0,57.0,5.0,2020-03-12 06:30:00
3932,Desinventar,LOJA,EC11,ZAPOTILLO,EC1113,GARZAREAL,EC111352,Malvas,-80.306694,-4.31754,La Costa,3/14/17,3:00:00 AM,3,14,2017,Rain / Overflow,small stream overflow,0,0,0,1,0,0,0,0,0,0,,,,,,,16.0,16.0,,,19.5,,4,1,2,16.0,,3.0,2017-03-14 08:00:00
2413,Desinventar/SNGRE_2021,SUCUMBIOS,EC21,CUYABENO,EC2107,TARAPOA,EC210750,Precooperativa Rey de los Andes,-76.2557,-0.1906,El Oriente,5/28/13,9:00:00 AM,5,28,2013,Rain / Overflow,Heavy precipitation,1,0,0,0,0,0,0,0,0,0,,,,,4.0,,,,,,,,2,2,2,,4.0,,2013-05-28 14:00:00
4319,SNGRE/Desinventar,ORELLANA,EC22,LORETO,EC2204,LORETO,EC220450,El Progreso,-77.312778,-0.642776,El Oriente,11/1/17,9:30:00 AM,11,1,2017,Rain ,Urban,0,0,0,0,0,1,0,0,0,0,,,,,,,1.0,,,,,,1,2,2,1.0,,1.0,2017-11-01 14:30:00
4493,Desinventar,SUCUMBIOS,EC21,GONZALO PIZARRO,EC2102,PUERTO LIBRE,EC210254,Recinto Amarilla,-77.496292,0.200345,La Sierra,7/21/18,9:30:00 AM,7,21,2018,Rain ,Heavy precipitation,1,0,0,0,0,0,0,0,0,0,,,,,,,,,,,2.0,2.0,2,2,2,,,,2018-07-21 14:30:00
1720,SNGRE_2021,NAPO,EC15,TENA,EC1501,AHUANO,EC150151,"Paushiyacu, Chontayacu, Rio Blanco, San Alberto",-77.544466,-1.014051,La Sierra,10/9/12,11:00:00 PM,10,9,2012,Rain/ Overflow,Heavy precipitation,1,0,0,0,0,0,0,0,0,0,,,,,,,,,,,8.25,,2,2,2,,,,2012-10-10 04:00:00
1721,SNGRE_2021,NAPO,EC15,TENA,EC1501,AHUANO,EC150151,Nuevo Mundo,-77.544466,-1.014051,La Sierra,10/9/12,11:00:00 PM,10,9,2012,Rain/ Overflow,Heavy precipitation,1,0,0,0,0,0,0,0,0,0,,,,,,,,,,,,,2,2,2,,,,2012-10-10 04:00:00
1717,SNGRE_2021,NAPO,EC15,TENA,EC1501,AHUANO,EC150151,Patasyacu - Rio Bueno,-77.544466,-1.014051,La Sierra,10/8/12,11:00:00 PM,10,8,2012,Rain/ Overflow,Heavy precipitation,1,0,0,0,0,0,0,0,0,0,,,,,,,,,,,9.5,,2,2,2,,,,2012-10-09 04:00:00
2323,Desinventar/SNGRE_2021,NAPO,EC15,TENA,EC1501,PUERTO MISAHUALLI,EC150155,Barrio chino y Punta Ahuano,-77.6703,-1.0301,La Sierra,4/20/13,3:00:00 AM,4,20,2013,Rain / Overflow,Heavy precipitation,1,0,0,0,0,0,0,0,0,0,,,,,,,,,,,,,2,2,2,,,,2013-04-20 08:00:00
4499,Desinventar,NAPO,EC15,TENA,EC1501,PUERTO MISAHUALLI,EC150155,"La Isla, Santo Hurco, Chiripuno, Ahuarina, Union Muyuna, Chi",-77.693541,-1.043899,La Sierra,7/22/18,9:00:00 AM,7,22,2018,Rain / Overflow,Urban,0,0,0,0,0,1,0,0,0,0,,,,1.0,,,800.0,800.0,,1.0,,150.0,1,2,2,800.0,,6.0,2018-07-22 14:00:00
5074,SNGRE_2021,MORONA SANTIAGO,EC14,MORONA,EC1401,SINAI,EC140158,Playas de San Luis,-78.099121,-2.141269,La Sierra,1/18/20,4:00:00 PM,1,18,2020,Rain/Overflow,Heavy precipitation,1,0,0,0,0,0,0,0,0,0,,,,,,,,,,,5.0,,2,2,2,,,,2020-01-18 21:00:00
3627,Desinventar,MORONA SANTIAGO,EC14,SANTIAGO,EC1405,SANTIAGO DE MENDEZ,EC140550,Centro De La Ciudad ,-78.318844,-2.718842,La Sierra,5/9/16,2:00:00 AM,5,9,2016,Rain ,Urban,0,0,0,0,0,1,0,0,0,0,,,,,,,,,,,,,1,2,2,,,,2016-05-09 07:00:00
3160,Desinventar,ZAMORA CHINCHIPE,EC19,YANTZAZA,EC1905,LOS ENCUENTROS,EC190553,El Pincho,-78.593229,-3.717695,La Sierra,4/26/15,11:00:00 AM,4,26,2015,Rain ,Heavy precipitation,1,0,0,0,0,0,0,0,0,0,,,,,2.0,,3.0,3.0,,,,,2,2,2,3.0,2.0,1.0,2015-04-26 16:00:00
3272,Desinventar,ESMERALDAS,EC08,SAN LORENZO,EC0805,SAN LORENZO,EC080550,BARRIO 9 DE OCTUBRE,-78.833915,1.283358,La Costa,12/4/15,7:00:00 PM,12,4,2015,Rain ,Heavy precipitation,1,0,0,0,0,0,0,0,0,0,,,,,1.0,,2.0,2.0,,,,,2,2,2,2.0,1.0,1.0,2015-12-05 00:00:00
3385,Desinventar,ESMERALDAS,EC08,SAN LORENZO,EC0805,SAN LORENZO,EC080550,Varios Sectores,-78.835694,1.290177,La Costa,1/25/16,3:00:00 AM,1,25,2016,Rain ,Heavy precipitation,1,0,0,0,0,0,0,0,0,0,,,,,,,,,,,,,2,2,2,,,,2016-01-25 08:00:00
5276,SNGRE_2021,ESMERALDAS,EC08,ELOY ALFARO,EC0802,ANCHAYACU,EC080251,"Varios sectores: Anchayacu, San Agustin, Guapilar, Papayal, Tangare, Bella Vista.",-79.058208,0.960983,La Costa,5/15/20,6:00:00 AM,5,15,2020,Rain/Overflow,Heavy precipitation,1,0,0,0,0,0,0,0,0,0,,,,,143.0,143.0,572.0,,,,,,2,2,2,572.0,143.0,6.0,2020-05-15 11:00:00
2570,Desinventar/SNGRE_2021,SANTO DOMINGO DE LOS TSACHILAS,EC23,SANTO DOMINGO,EC2301,RIO TOACHI,EC230150,"Brisas del Colorado # 1, Av. Esmeraldas",-79.165675,-0.223534,La Costa,1/23/14,1:00:00 AM,1,23,2014,Rain,Heavy precipitation,1,0,0,0,0,0,0,0,0,0,,,,,1.0,,6.0,6.0,,,,,2,2,2,6.0,1.0,2.0,2014-01-23 06:00:00
3343,Desinventar,ESMERALDAS,EC08,RIOVERDE,EC0807,CHUMUNDE,EC080752,VARIOS SECTORES (MEDIANIA EL TORO NACHE GUAYABAL MERIBE PLAY,-79.416546,0.828722,La Costa,1/25/16,6:00:00 AM,1,25,2016,Rain,Heavy precipitation,1,0,0,0,0,0,0,0,0,0,,,,,,,,,,,21.5,12.0,2,2,2,,,,2016-01-25 11:00:00
2575,Desinventar/SNGRE_2021,LOS RIOS,EC12,VENTANAS,EC1207,VENTANAS,EC120750,Los Girasoles,-79.446092,-1.456818,La Costa,1/23/14,4:30:00 PM,1,23,2014,Rain ,Heavy precipitation,1,0,0,0,0,0,0,0,0,0,,,,,1.0,,7.0,,,,,,2,2,2,7.0,1.0,2.0,2014-01-23 21:30:00
2006,SNGRE_2021,ESMERALDAS,EC08,LA CONCORDIA,EC0808,LA VILLEGAS,EC080852,Barrio La Loma,-79.4489,-0.077,La Costa,3/4/13,6:00:00 PM,3,4,2013,Rain ,Heavy precipitation,1,0,0,0,0,0,0,0,0,0,,,,,4.0,,20.0,,,8.0,,,2,2,2,20.0,4.0,3.0,2013-03-04 23:00:00
3511,Desinventar,LOS RIOS,EC12,VENTANAS,EC1207,VENTANAS,EC120750,Los Girasoles,-79.475916,-1.416275,La Costa,3/6/16,7:09:00 PM,3,6,2016,Rain / Overflow,Heavy precipitation,1,0,0,0,0,0,0,0,0,0,,,,,5.0,,8.0,8.0,9.0,17.0,,,2,2,2,8.0,5.0,2.0,2016-03-07 00:09:00
3475,Desinventar,GUAYAS,EC09,NARANJAL,EC0911,SANTA ROSA DE FLANDES,EC091153,Varios Sectores (Recinto Villa Nueva y Recinto El Rosario),-79.683118,-2.629587,La Costa,3/1/16,10:00:00 AM,3,1,2016,Rain ,Artificial waterway overflow,0,0,1,0,0,0,0,0,0,0,,,,,40.0,,160.0,160.0,,40.0,,,1,2,2,160.0,40.0,5.0,2016-03-01 15:00:00
4041,SNGRE,LOS RIOS,EC12,BABA,EC1202,BABA,EC120250,Versalles,-79.685339,-1.799933,La Costa,3/27/17,11:30:00 AM,3,27,2017,Rain ,Heavy precipitation,1,0,0,0,0,0,0,0,0,0,,,,,,,,,,,320.0,50.0,2,2,2,,,,2017-03-27 16:30:00
3178,Desinventar,GUAYAS,EC09,SALITRE,EC0919,LA VICTORIA (NAUZA),EC091952,Barrio Centenario,-79.721332,-1.898937,La Costa,5/6/15,7:15:00 AM,5,6,2015,Rain ,Heavy precipitation,1,0,0,0,0,0,0,0,0,0,,,,,,,,,,,,,2,2,2,,,,2015-05-06 12:15:00
4134,Desinventar,GUAYAS,EC09,SALITRE,EC0919,LA VICTORIA (NAUZA),EC091952,Recinto Julia Maria y Recinto Nueva Angelica.,-79.721879,-1.900376,La Costa,4/6/17,7:00:00 AM,4,6,2017,Rain / Overflow,Heavy precipitation,1,0,0,0,0,0,0,0,0,0,,,,,4.0,,12.0,,,,,,2,2,2,12.0,4.0,3.0,2017-04-06 12:00:00
4171,Desinventar,LOS RIOS,EC12,BABA,EC1202,GUARE,EC120251,Guayabo,-79.734101,-1.738317,La Costa,4/10/17,1:30:00 PM,4,10,2017,Rain ,Heavy precipitation,1,0,0,0,0,0,0,0,0,0,,,,,,,,,,,22.0,14.0,2,2,2,,,,2017-04-10 18:30:00
3460,Desinventar,LOS RIOS,EC12,VINCES,EC1208,VINCES,EC120850,La Granja,-79.746948,-1.547682,La Costa,2/24/16,10:10:00 AM,2,24,2016,Rain ,Heavy precipitation,1,0,0,0,0,0,0,0,0,0,,,,,4.0,,12.0,12.0,,12.0,,,2,2,2,12.0,4.0,3.0,2016-02-24 15:10:00
4133,SNGRE,GUAYAS,EC09,SALITRE,EC0919,GRAL. VERNAZA (DOS ESTEROS),EC091951,Rcto. Las Yucas ,-79.781068,-1.770526,La Costa,4/5/17,11:00:00 PM,4,5,2017,Rain ,Heavy precipitation,1,0,0,0,0,0,0,0,0,0,,,,,,,44.0,,,,,,2,2,2,44.0,,3.0,2017-04-06 04:00:00
4794,Desinventar,GUAYAS,EC09,SALITRE,EC0919,GRAL. VERNAZA (DOS ESTEROS),EC091951,Varios Sectores,-79.792667,-1.773695,La Costa,3/17/19,2:00:00 AM,3,17,2019,Rain / Overflow,Heavy precipitation,1,0,0,0,0,0,0,0,0,0,,,,,,24.0,88.0,88.0,,,,,2,2,2,88.0,24.0,4.0,2019-03-17 07:00:00
3177,Desinventar,GUAYAS,EC09,SALITRE,EC0919,EL SALITRE (LAS RAMAS),EC091950,Coop. Virgen del Carmen,-79.819957,-1.831087,La Costa,5/6/15,7:00:00 AM,5,6,2015,Rain ,Heavy precipitation,1,0,0,0,0,0,0,0,0,0,,,,,,,,,,,,,2,2,2,,,,2015-05-06 12:00:00
3292,Desinventar,GUAYAS,EC09,SALITRE,EC0919,EL SALITRE (LAS RAMAS),EC091950,Coop. Virgen del Carmen,-79.819957,-1.831087,La Costa,1/12/16,7:00:00 AM,1,12,2016,Rain,Urban,0,0,0,0,0,1,0,0,0,0,,,,,,,,,,,,,1,2,2,,,,2016-01-12 12:00:00
3070,Desinventar,EL ORO,EC07,BALSAS,EC0704,BALSAS,EC070450,Cabecera Cantonal,-79.821992,-3.790745,La Sierra,3/24/15,4:51:00 PM,3,24,2015,Rain / Overflow,Heavy precipitation,1,0,0,0,0,0,0,0,0,0,,,,,42.0,,108.0,108.0,68.0,,,,2,2,2,108.0,42.0,5.0,2015-03-24 21:51:00
4132,SNGRE,GUAYAS,EC09,SALITRE,EC0919,EL SALITRE (LAS RAMAS),EC091950,Av. Carlos Romero R. y callejon S/N,-79.82242,-1.830094,La Costa,4/5/17,8:00:00 AM,4,5,2017,Rain,Heavy precipitation,1,0,0,0,0,0,0,0,0,0,,,,,,,5.0,,,,,,2,2,2,5.0,,1.0,2017-04-05 13:00:00
2820,Desinventar,GUAYAS,EC09,SALITRE,EC0919,EL SALITRE (LAS RAMAS),EC091950,Recinto Briseno,-79.822498,-1.835864,La Costa,5/12/14,8:00:00 AM,5,12,2014,Rain,Heavy precipitation,1,0,0,0,0,0,0,0,0,0,,,,,,,,,,,,,2,2,2,,,,2014-05-12 13:00:00
5212,SNGRE_2021,GUAYAS,EC09,BALAO,EC0903,BALAO,EC090350,Cdla. Brisas del Mar,-79.830085,-2.9146347,La Costa,3/12/20,11:00:00 AM,3,12,2020,Rain,Urban,0,0,0,0,0,1,0,0,0,0,,,,,12.0,12.0,62.0,,,,,,1,2,2,62.0,12.0,4.0,2020-03-12 16:00:00
3192,Desinventar,EL ORO,EC07,MARCABELI,EC0708,MARCABELI,EC070850,Barrio 24 de julio - calles Leon y calle Quito,-79.912107,-3.786646,La Sierra,5/17/15,8:20:00 PM,5,17,2015,Overflow,Heavy precipitation,1,0,0,0,0,0,0,0,0,0,,,,,2.0,,8.0,8.0,,6.0,,,2,2,2,8.0,2.0,2.0,2015-05-18 01:20:00
1963,Desinventar/SNGRE_2021,GUAYAS,EC09,GUAYAQUIL,EC0901,TARQUI,EC090150,Cdla La Prosperina calle 11 entre avenida 5ta y 6ta del sola,-80.0453,-2.3506,La Costa,3/2/13,8:00:00 PM,3,2,2013,Rain,Heavy precipitation,1,0,0,0,0,0,0,0,0,0,,,,,1.0,,4.0,4.0,,,,,2,2,2,4.0,1.0,1.0,2013-03-03 01:00:00
2110,Desinventar/SNGRE_2021,GUAYAS,EC09,GUAYAQUIL,EC0901,TARQUI,EC090150,Noroeste,-80.0453,-2.3506,La Costa,3/14/13,6:30:00 PM,3,14,2013,Rain,Heavy precipitation,1,0,0,0,0,0,0,0,0,0,,,,,,,,,,,,,2,2,2,,,,2013-03-14 23:30:00
1931,SNGRE_2021,GUAYAS,EC09,GUAYAQUIL,EC0901,TARQUI,EC090150,Monte Sinai Cooperativa San Felipe Mey Mz 1 Sl 12 (por la escuela San Felipe estacion 132 alborruta).,-80.0453,-2.3506,La Costa,2/23/13,10:32:00 AM,2,23,2013,Rain ,Heavy precipitation,1,0,0,0,0,0,0,0,0,0,,,,,22.0,,,,,,,,2,2,2,,22.0,,2013-02-23 15:32:00
2791,Desinventar,GUAYAS,EC09,GUAYAQUIL,EC0901,TARQUI,EC090150,Socio Vivienda Mz14,-80.045331,-2.350555,La Costa,5/7/14,7:00:00 PM,5,7,2014,Rain,Heavy precipitation,1,0,0,0,0,0,0,0,0,0,,,,,6.0,,28.0,28.0,,,,,2,2,2,28.0,6.0,3.0,2014-05-08 00:00:00
2794,Desinventar,GUAYAS,EC09,GUAYAQUIL,EC0901,TARQUI,EC090150,Flor de Bastion bloque,-80.045331,-2.350555,La Costa,5/7/14,7:00:00 PM,5,7,2014,Rain,Heavy precipitation,1,0,0,0,0,0,0,0,0,0,,,,,2.0,,11.0,11.0,,,,,2,2,2,11.0,2.0,3.0,2014-05-08 00:00:00
2795,Desinventar,GUAYAS,EC09,GUAYAQUIL,EC0901,TARQUI,EC090150,Cooperativa de Vivienda Flor del Fortin Bloq. 1 Mz.1140,-80.045331,-2.350555,La Costa,5/7/14,5:48:00 PM,5,7,2014,Rain,Heavy precipitation,1,0,0,0,0,0,0,0,0,0,,,,,3.0,,7.0,7.0,,,,,2,2,2,7.0,3.0,2.0,2014-05-07 22:48:00
2796,Desinventar,GUAYAS,EC09,GUAYAQUIL,EC0901,TARQUI,EC090150,"Cooperativa Balerio Estacio 3, Mz., 272 solar, 14",-80.045331,-2.350555,La Costa,5/7/14,5:48:00 PM,5,7,2014,Rain,Heavy precipitation,1,0,0,0,0,0,0,0,0,0,2.0,,,2.0,6.0,,16.0,16.0,4.0,,,,2,2,2,16.0,6.0,3.0,2014-05-07 22:48:00
2798,Desinventar,GUAYAS,EC09,GUAYAQUIL,EC0901,TARQUI,EC090150,Coop. Flor de Bastion Bloq. 10 solar 13 Mz. 2413,-80.045331,-2.350555,La Costa,5/7/14,7:10:00 AM,5,7,2014,Rain,Heavy precipitation,1,0,0,0,0,0,0,0,0,0,,,,,1.0,,4.0,,,,,,2,2,2,4.0,1.0,1.0,2014-05-07 12:10:00
2800,Desinventar,GUAYAS,EC09,GUAYAQUIL,EC0901,TARQUI,EC090150,COOP EL FORTIN,-80.045331,-2.350555,La Costa,5/7/14,5:48:00 PM,5,7,2014,Rain,Heavy precipitation,1,0,0,0,0,0,0,0,0,0,,,,,15.0,,74.0,74.0,,,,,2,2,2,74.0,15.0,4.0,2014-05-07 22:48:00
2802,SNGRE,GUAYAS,EC09,GUAYAQUIL,EC0901,TARQUI,EC090150,Monte Sinai - Coop. Cerro Porteno Mz. 12,-80.045331,-2.350555,La Costa,5/7/14,9:00:00 PM,5,7,2014,Rain,Heavy precipitation,1,0,0,0,0,0,0,0,0,0,,,,,,,,,,,,,2,2,2,,,,2014-05-08 02:00:00
2803,SNGRE,GUAYAS,EC09,GUAYAQUIL,EC0901,TARQUI,EC090150,Fortin Blq 1 Mz. 1140,-80.045331,-2.350555,La Costa,5/7/14,7:00:00 PM,5,7,2014,Rain,Heavy precipitation,1,0,0,0,0,0,0,0,0,0,,,,,,,7.0,,,,,,2,2,2,7.0,,2.0,2014-05-08 00:00:00
2813,SNGRE,GUAYAS,EC09,GUAYAQUIL,EC0901,TARQUI,EC090150,Flor de Bastion bloque 3 MZ 663 Solar 30 como referencia por la entrada del antiguo subcentro Casa del tigre.,-80.045331,-2.350555,La Costa,5/10/14,3:29:00 AM,5,10,2014,Rain,Heavy precipitation,1,0,0,0,0,0,0,0,0,0,,,,,,,3.0,,,,,,2,2,2,3.0,,1.0,2014-05-10 08:29:00
3908,SNGRE,GUAYAS,EC09,GUAYAQUIL,EC0901,TARQUI,EC090150,Mapasingue Oeste #453 y calle cuarta ,-80.045331,-2.350555,La Costa,3/7/17,3:00:00 PM,3,7,2017,Rain,Heavy precipitation,1,0,0,0,0,0,0,0,0,0,,,,,,,5.0,,,,,,2,2,2,5.0,,1.0,2017-03-07 20:00:00
4073,Desinventar,EL ORO,EC07,ARENILLAS,EC0702,ARENILLAS,EC070250,La Cuca,-80.069692,-3.497556,La Costa,3/30/17,7:00:00 PM,3,30,2017,Rain ,Heavy precipitation,1,0,0,0,0,0,0,0,0,0,,,,,11.0,,53.0,53.0,,,,,2,2,2,53.0,11.0,4.0,2017-03-31 00:00:00
5151,SNGRE_2021,GUAYAS,EC09,GUAYAQUIL,EC0901,TARQUI,EC090150,Centro de Salud el Chongon,-80.080635,-2.23314,La Costa,2/24/20,3:00:00 AM,2,24,2020,Rain,Heavy precipitation,1,0,0,0,0,0,0,0,0,0,,,,,,,,,,,,,2,2,2,,,,2020-02-24 08:00:00
5158,SNGRE_2021,GUAYAS,EC09,LOMAS DE SARGENTILLO,EC0924,LOMAS DE SARGENTILLO,EC092450,"Varios Sectores de Lomas de Sargentillo: Recintos Hacienda El Principe, Recinto Las Chacras, Recinto Puerto Las Canas",-80.088313,-1.875328,La Costa,2/25/20,11:18:00 AM,2,25,2020,Rain/Overflow,Heavy precipitation,1,0,0,0,0,0,0,0,0,0,,,,,5.0,5.0,20.0,,,,,,2,2,2,20.0,5.0,3.0,2020-02-25 16:18:00
4273,Desinventar,EL ORO,EC07,SANTA ROSA,EC0712,JAMBELI,EC071252,"Isla Las Huacas, Las Casitas",-80.162985,-3.350737,La Costa,5/28/17,4:00:00 AM,5,28,2017,,Urban,0,0,0,0,0,1,0,0,0,0,,,,,3.0,,217.0,217.0,,6.0,,,1,2,2,217.0,3.0,5.0,2017-05-28 09:00:00
3824,Desinventar,GUAYAS,EC09,PEDRO CARBO,EC0914,SABANILLA,EC091452,Sector Simon Bolivar y recinto Pasaje,-80.227898,-1.845522,La Costa,2/11/17,1:00:00 PM,2,11,2017,Rain / Overflow,Heavy precipitation,1,0,0,0,0,0,0,0,0,0,,,,,2.0,,,,,6.0,,,2,2,2,,2.0,,2017-02-11 18:00:00
5204,SNGRE_2021,GUAYAS,EC09,GUAYAQUIL,EC0901,POSORJA,EC090156,Barrio 8 de Julio,-80.251542,-2.7166911,La Costa,3/8/20,5:19:00 AM,3,8,2020,Rain,Heavy precipitation,1,0,0,0,0,0,0,0,0,0,,,,,15.0,19.0,83.0,,,,,,2,2,2,83.0,19.0,4.0,2020-03-08 10:19:00
3101,Desinventar,GUAYAS,EC09,GUAYAQUIL,EC0901,POSORJA,EC090156,"SECTOR Barrio Martha de Roldos, La Fortaleza, Arbolito, Ciud",-80.254593,-2.714667,La Costa,3/30/15,11:00:00 AM,3,30,2015,Rain,Heavy precipitation,1,0,0,0,0,0,0,0,0,0,,,,,7.0,,34.0,34.0,,,,,2,2,2,34.0,7.0,3.0,2015-03-30 16:00:00
3779,Desinventar,GUAYAS,EC09,PEDRO CARBO,EC0914,SABANILLA,EC091452,San Bartolo ,-80.263235,-1.929111,La Costa,2/4/17,3:00:00 AM,2,4,2017,Rain / Overflow,Heavy precipitation,1,0,0,0,0,0,0,0,0,0,,1.0,,,9.0,,40.0,40.0,,,,,2,2,2,40.0,9.0,3.0,2017-02-04 08:00:00
3748,Desinventar,GUAYAS,EC09,GUAYAQUIL,EC0901,JUAN GOMEZ RENDON (PROGRESO),EC090152,Cerecita ,-80.269614,-2.332719,La Costa,1/31/17,5:04:00 PM,1,31,2017,Rain ,Heavy precipitation,1,0,0,0,0,0,0,0,0,0,,,,,1.0,,4.0,4.0,,,,,2,2,2,4.0,1.0,1.0,2017-01-31 22:04:00
2564,Desinventar/SNGRE_2021,GUAYAS,EC09,PLAYAS,EC0921,GENERAL VILLAMIL (PLAYAS),EC092150,Barrio San Cayetano,-80.379896,-2.633327,La Costa,1/23/14,7:40:00 AM,1,23,2014,Rain,Heavy precipitation,1,0,0,0,0,0,0,0,0,0,,,,,,,,,,,,,2,2,2,,,,2014-01-23 12:40:00
2557,Desinventar,GUAYAS,EC09,PLAYAS,EC0921,GENERAL VILLAMIL (PLAYAS),EC092150,Barrio Venecia,-80.38146,-2.635726,La Costa,1/23/14,7:30:00 AM,1,23,2014,Rain,Heavy precipitation,1,0,0,0,0,0,0,0,0,0,,,,,,,,,,,,,2,2,2,,,,2014-01-23 12:30:00
2563,Desinventar,GUAYAS,EC09,PLAYAS,EC0921,GENERAL VILLAMIL (PLAYAS),EC092150,Barrio Duran,-80.381462,-2.631392,La Costa,1/23/14,7:45:00 AM,1,23,2014,Rain,Heavy precipitation,1,0,0,0,0,0,0,0,0,0,,,,,,,,,,,,,2,2,2,,,,2014-01-23 12:45:00
4791,Desinventar,GUAYAS,EC09,PLAYAS,EC0921,GENERAL VILLAMIL (PLAYAS),EC092150,Varios Sectores,-80.381755,-2.639326,La Costa,3/17/19,2:00:00 AM,3,17,2019,Rain,Heavy precipitation,1,0,0,0,0,0,0,0,0,0,,,,,,,,,,,,,2,2,2,,,,2019-03-17 07:00:00
2567,Desinventar/SNGRE_2021,GUAYAS,EC09,PLAYAS,EC0921,GENERAL VILLAMIL (PLAYAS),EC092150,Barrio Guayaquil,-80.383008,-2.633709,La Costa,1/23/14,7:00:00 AM,1,23,2014,Rain,Heavy precipitation,1,0,0,0,0,0,0,0,0,0,,,,,,,,,,,,,2,2,2,,,,2014-01-23 12:00:00
3894,SNGRE,GUAYAS,EC09,PLAYAS,EC0921,GENERAL VILLAMIL (PLAYAS),EC092150,Barrio Las Villas del Carmen,-80.387135,-2.638442,La Costa,3/3/17,8:30:00 PM,3,3,2017,Rain / Overflow,Heavy precipitation,1,0,0,0,0,0,0,0,0,0,,,,,,,4.0,,,4.0,,,2,2,2,4.0,,1.0,2017-03-04 01:30:00
2566,Desinventar/SNGRE_2021,GUAYAS,EC09,PLAYAS,EC0921,GENERAL VILLAMIL (PLAYAS),EC092150,Barrio Ecuador,-80.38718,-2.63799,La Costa,1/23/14,7:20:00 AM,1,23,2014,Rain ,Heavy precipitation,1,0,0,0,0,0,0,0,0,0,,,,,,,,,,,,,2,2,2,,,,2014-01-23 12:20:00
4379,Desinventar,GUAYAS,EC09,PLAYAS,EC0921,GENERAL VILLAMIL (PLAYAS),EC092150,"Aguas Verdes, (varios sectores)",-80.387727,-2.624249,La Costa,2/21/18,8:49:00 AM,2,21,2018,Rain / Overflow,Heavy precipitation,1,0,0,0,0,0,0,0,0,0,,,,,70.0,,237.0,237.0,,38.0,,,2,2,2,237.0,70.0,5.0,2018-02-21 13:49:00
3353,Desinventar,MANABI,EC13,24 DE MAYO,EC1316,NOBOA,EC131652,Noboa,-80.396738,-1.409942,La Costa,1/25/16,3:00:00 AM,1,25,2016,Rain ,Heavy precipitation,1,0,0,0,0,0,0,0,0,0,,,,,,,,,,,50.0,,2,2,2,,,,2016-01-25 08:00:00
3012,Desinventar,GUAYAS,EC09,PLAYAS,EC0921,GENERAL VILLAMIL (PLAYAS),EC092150,Sector Playa Dos,-80.443365,-2.534463,La Costa,3/18/15,10:50:00 AM,3,18,2015,Rain,Urban,0,0,0,0,0,1,0,0,0,0,,,,,5.0,,13.0,13.0,,,,,1,2,2,13.0,5.0,3.0,2015-03-18 15:50:00
5273,SNGRE_2021,SUCUMBIOS,EC21,CUYABENO,EC2107,CUYABENO,EC210751,Comunidad Cofan Zabalo.,-75.66692,-0.356702,El Oriente,5/10/20,7:00:00 PM,5,10,2020,Rain/Overflow,Heavy precipitation/Short duration rain,1,1,0,0,0,0,0,0,0,0,,,,,44.0,44.0,208.0,,,,20.0,,5,1,3,208.0,44.0,5.0,2020-05-11 00:00:00
4981,SNGRE,SUCUMBIOS,EC21,PUTUMAYO,EC2103,PALMA ROJA,EC210351,"Comunidades: Tigre Playa, La Gabarra, Espiritu Santo, Singue, Lorocachi , Lorocachi 2, Lorocachi Central y Singue 
",-76.047368,0.121247,El Oriente,6/23/19,6:00:00 AM,6,23,2019,Rain / Overflow,Heavy precipitation/ Short duration rain,1,1,0,0,0,0,0,0,0,0,,,,,,52.0,191.0,,,,,,5,1,3,191.0,52.0,5.0,2019-06-23 11:00:00
5274,SNGRE_2021,SUCUMBIOS,EC21,LAGO AGRIO,EC2101,PACAYACU,EC210156,Comunidad Espiritu Noteno.,-76.28002,0.22297784,El Oriente,5/10/20,8:25:00 AM,5,10,2020,Rain/Overflow,Heavy precipitation/Short duration rain,1,1,0,0,0,0,0,0,0,0,,,,,16.0,16.0,64.0,,,,,,5,1,3,64.0,16.0,4.0,2020-05-10 13:25:00
5272,SNGRE_2021,SUCUMBIOS,EC21,CUYABENO,EC2107,TARAPOA,EC210750,Recinto Centro Union,-76.32444,-0.286971,El Oriente,5/9/20,10:15:00 AM,5,9,2020,Rain/Overflow,Heavy precipitation/Short duration rain,1,1,0,0,0,0,0,0,0,0,,,,,8.0,8.0,48.0,,,,,,5,1,3,48.0,8.0,3.0,2020-05-09 15:15:00
4986,SNGRE,SUCUMBIOS,EC21,PUTUMAYO,EC2103,SANTA ELENA,EC210354,"Comunidades: Bocana del Cuembi, Real Cuembi, La Ceiba, El Palmar, Los Chiparos, San Jose de Wisuya, Santa Elena, Nueva Union, Bajo Restrepo, El Porvenir, Alto Yocara, Santa Rosa.",-76.382109,0.253176,El Oriente,6/23/19,6:00:00 AM,6,23,2019,Rain / Overflow,Heavy precipitation/ Short duration rain,1,1,0,0,0,0,0,0,0,0,,,,,,345.0,1443.0,,,,,,5,1,3,1443.0,345.0,6.0,2019-06-23 11:00:00
4301,Desinventar,SUCUMBIOS,EC21,LAGO AGRIO,EC2101,DURENO,EC210152,Rio Para - Huaco via [ E 10 ] km 19 tramo Lago Agrio Tarapoa,-76.72108,0.059582,El Oriente,9/10/17,7:00:00 AM,9,10,2017,Rain ,Heavy precipitation/ Short duration rain,1,1,0,0,0,0,0,0,0,0,,,,,,,3.0,,,,,,5,1,3,3.0,,1.0,2017-09-10 12:00:00
3228,SNGRE,SUCUMBIOS,EC21,LAGO AGRIO,EC2101,GENERAL FARFAN,EC210153,"Cochas del Betano, Salinas y Fronteras del Oriente",-76.728068,0.260598,El Oriente,7/22/15,2:25:00 PM,7,22,2015,Rain ,Heavy precipitation/ Short duration rain,1,1,0,0,0,0,0,0,0,0,,,,,,,58.0,,300.0,,,,5,1,3,58.0,,4.0,2015-07-22 19:25:00
1773,SNGRE_2021,ORELLANA,EC22,ORELLANA,EC2201,DAYUMA,EC220151,Mandaripanga,-76.777427,-0.712459,El Oriente,11/21/12,12:30:00 AM,11,21,2012,Rain/ Overflow,Heavy precipitation/ Short duration rain,1,1,0,0,0,0,0,0,0,0,,,,,8.0,,45.0,,,,,6.3325,5,1,3,45.0,8.0,3.0,2012-11-21 05:30:00
5269,SNGRE_2021,SUCUMBIOS,EC21,LAGO AGRIO,EC2101,NUEVA LOJA,EC210150,"Antiguas Gabarras, sector Puerto Aguarico.",-76.87647,0.059266,El Oriente,5/9/20,10:15:00 AM,5,9,2020,Rain,Heavy precipitation/Short duration rain,1,1,0,0,0,0,0,0,0,0,,,,,8.0,8.0,32.0,,,,,,5,1,3,32.0,8.0,3.0,2020-05-09 15:15:00
2396,Desinventar/SNGRE_2021,SUCUMBIOS,EC21,LAGO AGRIO,EC2101,NUEVA LOJA,EC210150,Barrio Abdon Calderon                        Avenida Progres,-76.8989,0.0909,El Oriente,5/13/13,10:00:00 AM,5,13,2013,Rain ,Heavy precipitation/Short duration rain,1,1,0,0,0,0,0,0,0,0,,,,,2.0,,,,,,,,5,1,3,,2.0,,2013-05-13 15:00:00
2156,Desinventar/SNGRE_2021,SUCUMBIOS,EC21,LAGO AGRIO,EC2101,NUEVA LOJA,EC210150,Calles Canar y Guayas; Barrios: Julio Marin; Naranjal y Barr,-76.9082,0.1264,El Oriente,3/18/13,7:30:00 AM,3,18,2013,Rain ,Heavy precipitation/ Short duration rain,1,1,0,0,0,0,0,0,0,0,,,,,4.0,,,,,,,,5,1,3,,4.0,,2013-03-18 12:30:00
1786,SNGRE_2021,SUCUMBIOS,EC21,LAGO AGRIO,EC2101,NUEVA LOJA,EC210150,"Barrios: Heroes del Cenepa, Las Arcacias, El Pondo y Julio Marin.",-76.908226,0.126392,El Oriente,12/27/12,2:00:00 AM,12,27,2012,Rain,Heavy precipitation/ Short duration rain,1,1,0,0,0,0,0,0,0,0,,,,,4.0,,,,,,,,5,1,3,,4.0,,2012-12-27 07:00:00
3667,Desinventar,SUCUMBIOS,EC21,LAGO AGRIO,EC2101,NUEVA LOJA,EC210150,Via Quito Km 6-margen izquierdo a lado de la panaderia 4 Esq,-76.930374,0.077473,El Oriente,11/3/16,6:00:00 AM,11,3,2016,Rain ,Heavy precipitation/ Short duration rain,1,1,0,0,0,0,0,0,0,0,,,,,1.0,,4.0,4.0,,,,,5,1,3,4.0,1.0,1.0,2016-11-03 11:00:00
3566,Desinventar,PASTAZA,EC16,PASTAZA,EC1601,MONTALVO (ANDOAS),EC160156,Comunidad Jatun Molino,-76.965417,-2.06248,El Oriente,4/2/16,11:00:00 PM,4,2,2016,Rain / Overflow,Heavy precipitation/ Short duration rain,1,1,0,0,0,0,0,0,0,0,,,,,2.0,,102.0,102.0,,,3.0,,5,1,3,102.0,2.0,5.0,2016-04-03 04:00:00
2870,SNGRE,SUCUMBIOS,EC21,CASCALES,EC2106,EL DORADO DE CASCALES,EC210650,Loroyacu KM.41 Via Lago Agrio - Quito.,-77.230487,0.078335,El Oriente,9/22/14,11:00:00 PM,9,22,2014,Rain ,Heavy precipitation / Short duration rain,1,1,0,0,0,0,0,0,0,0,,,,,,,7.0,,,,,,5,1,3,7.0,,2.0,2014-09-23 04:00:00
3665,Desinventar,PASTAZA,EC16,PASTAZA,EC1601,POMONA,EC160157,Varios sectores,-77.892134,-1.645457,La Sierra,11/3/16,8:00:00 AM,11,3,2016,Rain / Overflow,Heavy precipitation/ Short duration rain,1,1,0,0,0,0,0,0,0,0,,,,,30.0,,154.0,154.0,,,,,5,1,3,154.0,30.0,5.0,2016-11-03 13:00:00
2595,Desinventar/SNGRE_2021,MORONA SANTIAGO,EC14,TIWINTZA,EC1412,SANTIAGO,EC141250,Yumisim,-77.940352,-3.021349,La Sierra,2/2/14,4:00:00 AM,2,2,2014,Rain / Overflow,Heavy precipitation/ Short duration rain,1,1,0,0,0,0,0,0,0,0,,,,,4.0,,20.0,200.0,20.0,,,,5,1,3,200.0,4.0,5.0,2014-02-02 09:00:00
2844,Desinventar,MORONA SANTIAGO,EC14,PALORA,EC1404,CUMANDA (CAB EN COLONIA AGRICO,EC140452,Otto 1,-78.024169,-1.666689,La Sierra,6/15/14,6:30:00 PM,6,15,2014,Rain / Overflow,Heavy precipitation / Short duration rain,1,1,0,0,0,0,0,0,0,0,,,,,,,,,,,10.0,,5,1,3,,,,2014-06-15 23:30:00
4265,SNGRE,ESMERALDAS,EC08,ELOY ALFARO,EC0802,SELVA ALEGRE,EC080260,SELVA ALEGRE,-78.858804,0.931805,La Costa,5/17/17,10:00:00 AM,5,17,2017,Rain,Heavy precipitation/Short duration rain,1,1,0,0,0,0,0,0,0,0,,,,,,,741.0,,,,,,5,1,3,741.0,,6.0,2017-05-17 15:00:00
2819,Desinventar,PICHINCHA,EC17,SAN MIGUEL DE LOS BANCOS,EC1707,SAN MIGUEL DE LOS BANCOS,EC170750,Recinto Rio Blanco,-78.908712,0.010605,La Sierra,5/11/14,8:38:00 PM,5,11,2014,Rain / Overflow,Heavy precipitation/ Short duration rain,1,1,0,0,0,0,0,0,0,0,,,,,,,,,,,,,5,1,3,,,,2014-05-12 01:38:00
4267,SNGRE,ESMERALDAS,EC08,ELOY ALFARO,EC0802,BORBON,EC080253,Santa Rosa de los Eperas ,-79.014867,1.053899,La Costa,5/20/17,4:00:00 AM,5,20,2017,Rain / Overflow,Heavy precipitation/ Short duration rain,1,1,0,0,0,0,0,0,0,0,,,,,,,255.0,,,,,,5,1,3,255.0,,5.0,2017-05-20 09:00:00
2239,Desinventar/SNGRE_2021,PICHINCHA,EC17,PEDRO VICENTE MALDONADO,EC1708,PEDRO VICENTE MALDONADO,EC170850,29 de Junio y Coronel Donoso - (Escuela del Milenio),-79.0264,0.0957,La Costa,4/8/13,5:20:00 PM,4,8,2013,Rain ,Heavy precipitation/ Short duration rain,1,1,0,0,0,0,0,0,0,0,,,,,12.0,,35.0,35.0,,,,,5,1,3,35.0,12.0,3.0,2013-04-08 22:20:00
4193,Desinventar,ESMERALDAS,EC08,ELOY ALFARO,EC0802,SAN FRANCISCO DE ONZOLE,EC080258,VARIOS SECTORES,-79.082624,0.879608,La Costa,4/17/17,10:00:00 PM,4,17,2017,Rain / Overflow,Heavy precipitation/Short duration rain,1,1,0,0,0,0,0,0,0,0,,,,,23.0,,81.0,81.0,,,,,5,1,3,81.0,23.0,4.0,2017-04-18 03:00:00
3045,Desinventar,SANTO DOMINGO DE LOS TSACHILAS,EC23,SANTO DOMINGO,EC2301,VALLE HERMOSO,EC230155,"Valle Hermoso, calle Amazonas",-79.279327,-0.098161,La Costa,3/20/15,12:27:00 AM,3,20,2015,Rain / Overflow,Heavy precipitation/ Short duration rain,1,1,0,0,0,0,0,0,0,0,,,,,34.0,,50.0,50.0,50.0,,,,5,1,3,50.0,34.0,3.0,2015-03-20 05:27:00
3144,Desinventar,SANTO DOMINGO DE LOS TSACHILAS,EC23,SANTO DOMINGO,EC2301,VALLE HERMOSO,EC230155,Barrio el Rosario.,-79.280383,-0.086299,La Costa,4/22/15,8:00:00 PM,4,22,2015,Rain / Overflow,Heavy precipitation/ Short duration rain,1,1,0,0,0,0,0,0,0,0,,,,,6.0,,34.0,34.0,,,,,5,1,3,34.0,6.0,3.0,2015-04-23 01:00:00
3280,Desinventar,SANTO DOMINGO DE LOS TSACHILAS,EC23,SANTO DOMINGO,EC2301,VALLE HERMOSO,EC230155,Calle Guayaquil y Tena,-79.280383,-0.086299,La Costa,12/27/15,11:30:00 PM,12,27,2015,Rain / Overflow,Heavy precipitation/ Short duration rain,1,1,0,0,0,0,0,0,0,0,,,,,5.0,,18.0,18.0,,,,,5,1,3,18.0,5.0,3.0,2015-12-28 04:30:00
2005,Desinventar/SNGRE_2021,ESMERALDAS,EC08,LA CONCORDIA,EC0808,LA CONCORDIA,EC080850,barrio Santa Rosa sector 5 y 3 de la nueva Concordia,-79.3763,-0.003,La Costa,3/4/13,7:00:00 PM,3,4,2013,Rain,Heavy precipitation/ Short duration rain,1,1,0,0,0,0,0,0,0,0,,,,,5.0,,22.0,22.0,,16.0,,,5,1,3,22.0,5.0,3.0,2013-03-05 00:00:00
2286,Desinventar/SNGRE_2021,ESMERALDAS,EC08,LA CONCORDIA,EC0808,LA CONCORDIA,EC080850,Nueva Concordia; Barrio 12 de Octubre,-79.3763,-0.003,La Costa,4/17/13,7:50:00 PM,4,17,2013,Rain,Heavy precipitation/ Short duration rain,1,1,0,0,0,0,0,0,0,0,,,,,1.0,,7.0,7.0,,,,,5,1,3,7.0,1.0,2.0,2013-04-18 00:50:00
2287,Desinventar/SNGRE_2021,ESMERALDAS,EC08,LA CONCORDIA,EC0808,LA CONCORDIA,EC080850,Nueva Concordia; Barrio Belgica sector 3,-79.3763,-0.003,La Costa,4/17/13,6:30:00 PM,4,17,2013,Rain,Heavy precipitation/ Short duration rain,1,1,0,0,0,0,0,0,0,0,,,,,2.0,,11.0,11.0,,,,,5,1,3,11.0,2.0,3.0,2013-04-17 23:30:00
2500,Desinventar/SNGRE_2021,ESMERALDAS,EC08,LA CONCORDIA,EC0808,LA CONCORDIA,EC080850,Barrio Central calle Esmeraldas entre la 10 de Agosto y 1 de,-79.3763,-0.003,La Costa,12/19/13,4:31:00 PM,12,19,2013,Rain ,Heavy precipitation/ Short duration rain,1,1,0,0,0,0,0,0,0,0,,,,,1.0,,2.0,2.0,,,,,5,1,3,2.0,1.0,1.0,2013-12-19 21:31:00
3999,SNGRE,GUAYAS,EC09,CRNEL MARCELINO MARIDUENA,EC0923,CORONEL MARCELINO MARIDUENA (SAN CARLOS),EC092350,Rcto. La Modelo ,-79.382071,-2.2392,La Costa,3/24/17,2:11:00 PM,3,24,2017,Rain / Overflow,Heavy precipitation/ Short duration rain,1,1,0,0,0,0,0,0,0,0,,,,,,,71.0,,,,10.0,,5,1,3,71.0,,4.0,2017-03-24 19:11:00
3037,Desinventar,ESMERALDAS,EC08,LA CONCORDIA,EC0808,LA CONCORDIA,EC080850,Camal Municipal,-79.386551,0.008125,La Costa,3/20/15,12:27:00 AM,3,20,2015,Rain / Overflow,Heavy precipitation/ Short duration rain,1,1,0,0,0,0,0,0,0,0,,,,,3.0,,11.0,11.0,,,,,5,1,3,11.0,3.0,3.0,2015-03-20 05:27:00
3110,Desinventar,ESMERALDAS,EC08,QUININDE,EC0804,LA UNION,EC080455,BARRIO BELLAVISTA,-79.410546,0.217513,La Costa,4/3/15,4:30:00 PM,4,3,2015,Rain ,Heavy precipitation/ Short duration rain,1,1,0,0,0,0,0,0,0,0,,,,,5.0,,,2.0,,,,,5,1,3,2.0,5.0,1.0,2015-04-03 21:30:00
3113,Desinventar,ESMERALDAS,EC08,QUININDE,EC0804,LA UNION,EC080455,BARRIO SAN JUAN,-79.410546,0.217513,La Costa,4/4/15,10:30:00 PM,4,4,2015,Rain ,Heavy precipitation/ Short duration rain,1,1,0,0,0,0,0,0,0,0,,,,,5.0,,,,,,,,5,1,3,,5.0,,2015-04-05 03:30:00
3115,Desinventar,ESMERALDAS,EC08,QUININDE,EC0804,LA UNION,EC080455,BARRIO SAN RAMON,-79.410546,0.217513,La Costa,4/5/15,3:20:00 AM,4,5,2015,Rain ,Heavy precipitation/ Short duration rain,1,1,0,0,0,0,0,0,0,0,,,,,10.0,,,,,,,,5,1,3,,10.0,,2015-04-05 08:20:00
3991,SNGRE,LOS RIOS,EC12,QUEVEDO,EC1205,SAN CARLOS,EC120553,"Santa Martha, Calle Atahualpa diagonal al Estadio.",-79.423452,-1.113359,La Costa,3/23/17,8:10:00 PM,3,23,2017,Rain ,Heavy precipitation/ Short duration rain,1,1,0,0,0,0,0,0,0,0,,,,,,,5.0,,,,,,5,1,3,5.0,,1.0,2017-03-24 01:10:00
4683,Desinventar,LOS RIOS,EC12,QUEVEDO,EC1205,SIETE DE OCTUBRE,EC120550,Via El Empalme y Km 4 y medio,-79.466025,-1.024303,La Costa,2/25/19,11:40:00 PM,2,25,2019,Rain,Heavy precipitation/ Short duration rain,1,1,0,0,0,0,0,0,0,0,,,,,1.0,1.0,1.0,1.0,,,,,5,1,3,1.0,1.0,1.0,2019-02-26 04:40:00
2618,Desinventar/SNGRE_2021,ESMERALDAS,EC08,QUININDE,EC0804,ROSA ZARATE (QUININDE),EC080450,Barrio Rogelio Sanchez,-79.471889,0.32631,La Costa,2/8/14,2:30:00 AM,2,8,2014,Rain ,Heavy precipitation/ Short duration rain,1,1,0,0,0,0,0,0,0,0,,,,,1.0,,,,,,,,5,1,3,,1.0,,2014-02-08 07:30:00
1794,Desinventar/SNGRE_2021,ESMERALDAS,EC08,QUININDE,EC0804,ROSA ZARATE (QUININDE),EC080450,Barrios asentados en zonas bajas,-79.5217,0.2993,La Costa,1/7/13,6:00:00 AM,1,7,2013,Rain ,Heavy precipitation / Short duration rain,1,1,0,0,0,0,0,0,0,0,,,,,26.0,,130.0,130.0,,,,,5,1,3,130.0,26.0,5.0,2013-01-07 11:00:00
3517,Desinventar,GUAYAS,EC09,NARANJAL,EC0911,SAN CARLOS,EC091152,Varios Sectores (Rcto. Puerto Inca Lechugal Trovador),-79.535649,-2.53514,La Costa,3/7/16,7:00:00 AM,3,7,2016,Rain,Heavy precipitation/ Short duration rain,1,1,0,0,0,0,0,0,0,0,,,,,9.0,,40.0,40.0,,24.0,,,5,1,3,40.0,9.0,3.0,2016-03-07 12:00:00
3459,Desinventar,GUAYAS,EC09,GUAYAQUIL,EC0901,TENGUEL,EC090158,Recintos San Rafael Virgen Del Cisne y El Pedregal ,-79.772188,-2.977182,La Costa,2/24/16,9:45:00 AM,2,24,2016,Rain / Overflow,Heavy precipitation/ Short duration rain,1,1,0,0,0,0,0,0,0,0,,,,,13.0,,59.0,59.0,,,,,5,1,3,59.0,13.0,4.0,2016-02-24 14:45:00
3711,Desinventar,GUAYAS,EC09,GUAYAQUIL,EC0901,TENGUEL,EC090158,"Recinto San Rafael, Calle Kennedy.",-79.772188,-2.977182,La Costa,1/10/17,7:00:00 AM,1,10,2017,Rain,Heavy precipitation/ Short duration rain,1,1,0,0,0,0,0,0,0,0,,,,,15.0,,60.0,60.0,,,,,5,1,3,60.0,15.0,4.0,2017-01-10 12:00:00
2591,Desinventar,EL ORO,EC07,PASAJE,EC0709,PROGRESO,EC070954,Sitio Santa Lucia,-79.77292,-3.305958,La Sierra,2/2/14,2:30:00 AM,2,2,2014,Rain / Overflow,Urban/ Small stream overflow,0,0,0,1,0,1,0,0,0,0,,,,,,,,,,,,,5,1,3,,,,2014-02-02 07:30:00
4771,Desinventar,GUAYAS,EC09,GUAYAQUIL,EC0901,TENGUEL,EC090158,Recinto San Francisco,-79.777713,-3.009226,La Costa,3/14/19,7:50:00 AM,3,14,2019,Rain,Heavy precipitation/ Short duration rain,1,1,0,0,0,0,0,0,0,0,,,,,1.0,1.0,6.0,6.0,,,,,5,1,3,6.0,1.0,2.0,2019-03-14 12:50:00
3838,Desinventar,EL ORO,EC07,MACHALA,EC0701,LA PROVIDENCIA,EC070150,"Urseza 2 Sector 2 ""Por La Iglesia""",-79.902607,-3.267916,La Costa,2/16/17,9:58:00 PM,2,16,2017,Rain ,Heavy precipitation/ Short duration rain,1,1,0,0,0,0,0,0,0,0,,,,,2.0,,9.0,9.0,,6.0,,,5,1,3,9.0,2.0,2.0,2017-02-17 02:58:00
3311,Desinventar,GUAYAS,EC09,GUAYAQUIL,EC0901,PASCUALES,EC090150,Unidad Educativa Vergeles ,-79.909149,-2.096586,La Costa,1/20/16,3:00:00 AM,1,20,2016,Rain ,Heavy precipitation/ Short duration rain,1,1,0,0,0,0,0,0,0,0,,,,,,,,,,,,,5,1,3,,,,2016-01-20 08:00:00
2824,Desinventar,GUAYAS,EC09,GUAYAQUIL,EC0901,PASCUALES,EC090150,Cooperativa Assad Bucaram MZ 215 como referencia al frente d,-79.935096,-2.073121,La Costa,5/16/14,9:50:40 AM,5,16,2014,Rain ,Heavy precipitation/ Short duration rain,1,1,0,0,0,0,0,0,0,0,,,,,6.0,,,,,,,,5,1,3,,6.0,,2014-05-16 14:50:40
2537,Desinventar/SNGRE_2021,GUAYAS,EC09,GUAYAQUIL,EC0901,TARQUI,EC090150,Horizontes del Fortin MZ 2055 Avenida Casuarina como referen,-79.954508,-2.126015,La Costa,1/21/14,12:00:00 AM,1,21,2014,Rain,Heavy precipitation/ Short duration rain,1,1,0,0,0,0,0,0,0,0,,,,,6.0,,25.0,25.0,,,,,5,1,3,25.0,6.0,3.0,2014-01-21 05:00:00
3907,SNGRE,GUAYAS,EC09,GUAYAQUIL,EC0901,PASCUALES,EC090150,"Cooperativa San Francisco I Mz. 1121, 1126 y 1128",-79.960087,-2.051166,La Costa,3/7/17,3:00:00 PM,3,7,2017,Rain,Heavy precipitation/ Short duration rain,1,1,0,0,0,0,0,0,0,0,,,,,,,11.0,,,,,,5,1,3,11.0,,3.0,2017-03-07 20:00:00
3372,Desinventar,GUAYAS,EC09,GUAYAQUIL,EC0901,PASCUALES,EC090150,Monte Sinai (IE Arnulfo Jaramillo Sierra UE Bernandita Corre,-79.960454,-2.069509,La Costa,1/25/16,6:46:00 AM,1,25,2016,Rain / Overflow,Heavy precipitation/ Short duration rain,1,1,0,0,0,0,0,0,0,0,,,,,,,,,,,,,5,1,3,,,,2016-01-25 11:46:00
3769,Desinventar,GUAYAS,EC09,GUAYAQUIL,EC0901,PASCUALES,EC090150,Prosperina (Varios Sectores),-79.960454,-2.069509,La Costa,2/3/17,8:00:00 PM,2,3,2017,Rain,Heavy precipitation/ Short duration rain,1,1,0,0,0,0,0,0,0,0,,,,,8.0,,32.0,32.0,,,,,5,1,3,32.0,8.0,3.0,2017-02-04 01:00:00
3901,Desinventar,GUAYAS,EC09,GUAYAQUIL,EC0901,PASCUALES,EC090150,Cooperativa 31 de Octubre (Monte Sinai ),-79.960454,-2.069509,La Costa,3/6/17,5:50:00 PM,3,6,2017,Rain,Heavy precipitation/ Short duration rain,1,1,0,0,0,0,0,0,0,0,,,,,3.0,,16.0,12.0,,,,,5,1,3,16.0,3.0,3.0,2017-03-06 22:50:00
3770,Desinventar,GUAYAS,EC09,GUAYAQUIL,EC0901,PASCUALES,EC090150,"Coop. Maria Auxiliadora, Bloque 9; Mz. 1340 Sl. 5",-79.962769,-2.088997,La Costa,2/3/17,5:05:00 AM,2,3,2017,Rain,Heavy precipitation/ Short duration rain,1,1,0,0,0,0,0,0,0,0,,,,,1.0,,10.0,10.0,,,,,5,1,3,10.0,1.0,2.0,2017-02-03 10:05:00
5243,SNGRE_2021,GUAYAS,EC09,GUAYAQUIL,EC0901,TARQUI,EC090150,Coop. Flor De Bastion Bl. 8 25 Mz 1285 Sl. 25,-79.967465,-2.0897471,La Costa,4/17/20,4:00:00 AM,4,17,2020,Rain,Heavy precipitation/Short duration rain,1,1,0,0,0,0,0,0,0,0,,,,,,,,,,,,,5,1,3,,,,2020-04-17 09:00:00
2647,Desinventar,GUAYAS,EC09,PALESTINA,EC0913,PALESTINA,EC091350,"Ciudadela San Juan, calles Amable Cabrera y Sucre",-79.978328,-1.62741,La Costa,2/25/14,4:01:00 AM,2,25,2014,Rain ,Heavy precipitation/ Short duration rain,1,1,0,0,0,0,0,0,0,0,,,,,1.0,,,,,,,,5,1,3,,1.0,,2014-02-25 09:01:00
3188,Desinventar,GUAYAS,EC09,DAULE,EC0906,DAULE,EC090650,Soledad y Piedrahita,-79.984051,-1.867624,La Costa,5/15/15,6:00:00 AM,5,15,2015,Rain ,Heavy precipitation/ Short duration rain,1,1,0,0,0,0,0,0,0,0,,,,,,,,,,,,,5,1,3,,,,2015-05-15 11:00:00
2774,Desinventar,LOJA,EC11,MACARA,EC1108,MACARA,EC110850,La Alborada,-80.007847,-4.299453,La Sierra,4/28/14,4:00:00 PM,4,28,2014,Rain ,Heavy precipitation / Short duration rain,1,1,0,0,0,0,0,0,0,0,,,,,1.0,,2.0,2.0,,,,,5,1,3,2.0,1.0,1.0,2014-04-28 21:00:00
2645,Desinventar/SNGRE_2021,GUAYAS,EC09,COLIMES,EC0905,COLIMES,EC090550,Barrio 6 de febrero,-80.009262,-1.546393,La Costa,2/25/14,2:00:00 AM,2,25,2014,Rain,Heavy precipitation/ Short duration rain,1,1,0,0,0,0,0,0,0,0,,,,,3.0,,18.0,18.0,,,,,5,1,3,18.0,3.0,3.0,2014-02-25 07:00:00
2640,Desinventar/SNGRE_2021,GUAYAS,EC09,COLIMES,EC0905,COLIMES,EC090550,Ciudadela Adolfo Santistevan,-80.009639,-1.54727,La Costa,2/24/14,2:00:00 AM,2,24,2014,Rain,Heavy precipitation/ Short duration rain,1,1,0,0,0,0,0,0,0,0,,,,,1.0,,9.0,9.0,,,,,5,1,3,9.0,1.0,2.0,2014-02-24 07:00:00
2644,Desinventar/SNGRE_2021,GUAYAS,EC09,COLIMES,EC0905,COLIMES,EC090550,Cdla. Adolfo Santisteban - calle Santa Rosa,-80.009639,-1.54727,La Costa,2/25/14,2:00:00 AM,2,25,2014,Rain,Heavy precipitation/ Short duration rain,1,1,0,0,0,0,0,0,0,0,,,,,2.0,,11.0,11.0,,,,,5,1,3,11.0,2.0,3.0,2014-02-25 07:00:00
2194,Desinventar/SNGRE_2021,GUAYAS,EC09,NOBOL,EC0925,NARCISA DE JESUS,EC092550,Recinto Los Kioscos,-80.0102,-1.9194,La Costa,3/25/13,10:30:00 AM,3,25,2013,Rain,Heavy precipitation/Short duration rain,1,1,0,0,0,0,0,0,0,0,,,,,,,,,,,,,5,1,3,,,,2013-03-25 15:30:00
3995,SNGRE,MANABI,EC13,BOLIVAR,EC1302,CALCETA,EC130250,Varios sectores,-80.158575,-0.838793,La Costa,3/24/17,7:00:00 AM,3,24,2017,Rain ,Heavy precipitation/ Short duration rain,1,1,0,0,0,0,0,0,0,0,,,,,,,1152.0,,,,,,5,1,3,1152.0,,6.0,2017-03-24 12:00:00
3598,Desinventar,MANABI,EC13,ROCAFUERTE,EC1312,ROCAFUERTE,EC131250,Varios Sectores,-80.440461,-0.962044,La Costa,4/11/16,10:00:00 PM,4,11,2016,Rain ,Heavy precipitation/ Short duration rain,1,1,0,0,0,0,0,0,0,0,,,,,30.0,,,,,,,,5,1,3,,30.0,,2016-04-12 03:00:00
4744,SNGRE,MANABI,EC13,ROCAFUERTE,EC1312,ROCAFUERTE,EC131250,"Algunos Sectores (Comunidad Puerto Higueron, Buenos Aires)",-80.486211,-0.922644,La Costa,3/7/19,8:15:00 AM,3,7,2019,Rain,Heavy precipitation/ Short duration rain,1,1,0,0,0,0,0,0,0,0,,,,,,100.0,400.0,,,,3070.0,,5,1,3,400.0,100.0,5.0,2019-03-07 13:15:00
3049,SNGRE_2021,SANTA ELENA,EC24,SANTA ELENA,EC2401,COLONCHE,EC240152,Comuna Las Balsas Recinto Los Ceibitos ,-80.539616,-2.2201858,La Costa,3/21/15,3:30:00 PM,3,21,2015,Rain,Slope,0,0,0,0,0,0,1,0,0,0,,,,,,,6.0,,,,,,5,1,3,6.0,,2.0,2015-03-21 20:30:00
4495,SNGRE,NAPO,EC15,TENA,EC1501,AHUANO,EC150151,"Isla Santa Maria, San Ramon, San Jose de Huambuno, Nuevo Paraiso, San Venancio, 
Isla San Rafael, Isla Anaconda, Zancudo, Barrio Caracol, Isla Guadalupana y Campana Cocha",-77.503849,-1.027718,La Sierra,7/22/18,9:00:00 AM,7,22,2018,Long duration Rain / Overflow,Small stream overflow,0,0,0,1,0,0,0,0,0,0,,,,,,,2088.0,,,,235.47,386.28,4,2,3,2088.0,,,2018-07-22 14:00:00
3207,Desinventar,MORONA SANTIAGO,EC14,HUAMBOYA,EC1407,CHIGUAZA,EC140751,San Carlos,-77.913223,-1.994265,La Sierra,6/10/15,8:00:00 AM,6,10,2015,Overflow,Small stream overflow ,0,0,0,1,0,0,0,0,0,0,,,,,1.0,,4.0,4.0,,,,,4,2,3,4.0,1.0,1.0,2015-06-10 13:00:00
2690,Desinventar,MORONA SANTIAGO,EC14,MORONA,EC1401,SAN ISIDRO,EC140156,Huachito,-78.150641,-2.181824,La Sierra,3/11/14,6:50:00 PM,3,11,2014,Rain ,Heavy precipitation/ Urban ,1,0,0,0,0,1,0,0,0,0,,,,,4.0,,10.0,10.0,,,,,3,2,3,10.0,4.0,2.0,2014-03-11 23:50:00
4333,SNGRE,MORONA SANTIAGO,EC14,GUALAQUIZA,EC1402,MERCEDES MOLINA,EC140250,Sector Centro Parroquial Mercedes Molina,-78.566058,-3.430557,La Sierra,12/1/17,11:27:00 AM,12,1,2017,Rain ,Heavy precipitation/ Urban ,1,0,0,0,0,1,0,0,0,0,,,,,,,4.0,,,,,,3,2,3,4.0,,1.0,2017-12-01 16:27:00
3652,Desinventar,MORONA SANTIAGO,EC14,GUALAQUIZA,EC1402,GUALAQUIZA,EC140250,Recinto Ferial Coliseo Barrio Manantial Barrio Maria Auxilia,-78.576815,-3.402704,La Sierra,8/11/16,1:45:00 AM,8,11,2016,Rain / Overflow,Heavy precipitation/ Urban,1,0,0,0,0,1,0,0,0,0,,,,,10.0,,40.0,40.0,,,,,3,2,3,40.0,10.0,3.0,2016-08-11 06:45:00
3675,Desinventar,ZAMORA CHINCHIPE,EC19,NANGARITZA,EC1903,ZURMI,EC190351,Zurmi,-78.66625,-4.10072,La Sierra,12/11/16,7:30:00 PM,12,11,2016,Overflow,Small stream overflow,0,0,0,1,0,0,0,0,0,0,,,,,16.0,,86.0,86.0,,,,,4,2,3,86.0,16.0,4.0,2016-12-12 00:30:00
3676,Desinventar,ZAMORA CHINCHIPE,EC19,NANGARITZA,EC1903,ZURMI,EC190351,ZURMI,-78.66625,-4.10072,La Sierra,12/16/16,12:30:00 AM,12,16,2016,Overflow,Small stream overflow,0,0,0,1,0,0,0,0,0,0,,,,,15.0,,80.0,80.0,,,,,4,2,3,80.0,15.0,4.0,2016-12-16 05:30:00
4443,Desinventar,ESMERALDAS,EC08,SAN LORENZO,EC0805,SAN LORENZO,EC080550,Bahia Del Pailon,-78.841659,1.279116,La Costa,4/26/18,4:00:00 AM,4,26,2018,Rain ,Heavy precipitation/ Urban ,1,0,0,0,0,1,0,0,0,0,,,,,1.0,,6.0,6.0,,,,,3,2,3,6.0,1.0,2.0,2018-04-26 09:00:00
4081,SNGRE,LOS RIOS,EC12,VENTANAS,EC1207,VENTANAS,EC120750,Los Girasoles,-79.446092,-1.456818,La Costa,3/30/17,9:50:00 AM,3,30,2017,Overflow,Short duration rain,0,1,0,0,0,0,0,0,0,0,,,,,,,15.0,,,,,,3,2,3,15.0,,3.0,2017-03-30 14:50:00
2121,Desinventar/SNGRE_2021,LOS RIOS,EC12,VENTANAS,EC1207,10 DE NOVIEMBRE,EC120750,La Poza de la Ciudadela 24 de Mayo y Sector Cdla Carlos Carr,-79.4606,-1.4393,La Costa,3/16/13,11:00:00 PM,3,16,2013,Rain / Overflow,Heavy precipitation/ Urban ,1,0,0,0,0,1,0,0,0,0,,,,,23.0,,104.0,104.0,,,,,3,2,3,104.0,23.0,5.0,2013-03-17 04:00:00
2968,Desinventar,LOS RIOS,EC12,VENTANAS,EC1207,VENTANAS,EC120750,Los Girasoles,-79.461215,-1.458662,La Costa,2/9/15,4:00:00 PM,2,9,2015,Overflow,Small stream overflow,0,0,0,1,0,0,0,0,0,0,,,,,4.0,,11.0,11.0,11.0,11.0,,,4,2,3,11.0,4.0,3.0,2015-02-09 21:00:00
4396,Desinventar,LOS RIOS,EC12,VENTANAS,EC1207,10 DE NOVIEMBRE,EC120750,"Los Girasoles, 5 de Agosto",-79.475865,-1.439174,La Costa,2/25/18,6:54:00 AM,2,25,2018,Rain / Overflow,Short duration rain,0,1,0,0,0,0,0,0,0,0,,,,,3.0,,31.0,15.0,,,,,3,2,3,31.0,3.0,3.0,2018-02-25 11:54:00
4076,SNGRE,LOS RIOS,EC12,MOCACHE,EC1212,MOCACHE,EC121250,"San Ignacio, Las Campanas ,Lotizacion Ochoa, Barrio Bolivar",-79.502951,-1.180575,La Costa,3/30/17,9:21:00 PM,3,30,2017,Rain / Overflow,Small stream overflow,0,0,0,1,0,0,0,0,0,0,,,,,,,154.0,,,,,,4,2,3,154.0,,5.0,2017-03-31 02:21:00
3522,Desinventar,EL ORO,EC07,PASAJE,EC0709,UZHCURRUMI,EC070955,Cabecera parroquial,-79.596144,-3.32733,La Sierra,3/8/16,9:13:00 PM,3,8,2016,Rain / Overflow,Short duration rain,0,1,0,0,0,0,0,0,0,0,,,,,2.0,,6.0,6.0,,6.0,0.5,,3,2,3,6.0,2.0,2.0,2016-03-09 02:13:00
4405,Desinventar,LOS RIOS,EC12,BABAHOYO,EC1201,PIMOCHA,EC120154,"Crespin Cerezo, El Aromo, Las Trancas, Nuevo Progreso",-79.600083,-1.833822,La Costa,3/2/18,4:30:00 AM,3,2,2018,Rain,Short duration rain,0,1,0,0,0,0,0,0,0,0,,,,,,,936.0,,,,216.0,50.0,3,2,3,936.0,,6.0,2018-03-02 09:30:00
4709,Desinventar,GUAYAS,EC09,SALITRE,EC0919,GRAL. VERNAZA (DOS ESTEROS),EC091951,"Recinto Tres Marias, via Poza de Cacao",-79.758464,-1.787484,La Costa,3/4/19,2:00:00 AM,3,4,2019,Rain,Small stream overflow,0,0,0,1,0,0,0,0,0,0,,,,,7.0,7.0,18.0,18.0,,,,,4,2,3,18.0,7.0,3.0,2019-03-04 07:00:00
3307,Desinventar,GUAYAS,EC09,SALITRE,EC0919,EL SALITRE (LAS RAMAS),EC091950,UE Salitre,-79.818859,-1.8319,La Costa,1/20/16,7:00:00 AM,1,20,2016,Rain ,Short duration rain ,0,1,0,0,0,0,0,0,0,0,,,,,,,,,,,,,3,2,3,,,,2016-01-20 12:00:00
3332,Desinventar,GUAYAS,EC09,SALITRE,EC0919,EL SALITRE (LAS RAMAS),EC091950,Coop. Virgen del Carmen,-79.819957,-1.831087,La Costa,1/25/16,6:50:00 AM,1,25,2016,Rain,Heavy precipitation/Urban,1,0,0,0,0,1,0,0,0,0,,,,,,,,,,,,,3,2,3,,,,2016-01-25 11:50:00
1815,Desinventar/SNGRE_2021,LOJA,EC11,CELICA,EC1104,CELICA,EC110450,Calle Garcia Moreno,-79.9503,-4.1493,La Sierra,1/23/13,9:30:00 PM,1,23,2013,Rain,Heavy precipitation/ Urban,1,0,0,0,0,1,0,0,0,0,,,,,2.0,,6.0,6.0,,,,,3,2,3,6.0,2.0,2.0,2013-01-24 02:30:00
1816,Desinventar/SNGRE_2021,LOJA,EC11,CELICA,EC1104,CELICA,EC110450,Barrio Maximiliano Rodriguez,-79.9503,-4.1493,La Sierra,1/23/13,9:30:00 PM,1,23,2013,Rain,Heavy precipitation/ Urban,1,0,0,0,0,1,0,0,0,0,,,,,,,,,,,,,3,2,3,,,,2013-01-24 02:30:00
4026,Desinventar,ESMERALDAS,EC08,MUISNE,EC0803,SAN GREGORIO,EC080357,San Gregorio,-79.97041,0.527942,La Costa,3/25/17,2:30:00 PM,3,25,2017,Rain,Heavy precipitation/Urban,1,0,0,0,0,1,0,0,0,0,,,,,103.0,,752.0,752.0,,,,,3,2,3,752.0,103.0,6.0,2017-03-25 19:30:00
2527,Desinventar/SNGRE_2021,GUAYAS,EC09,GUAYAQUIL,EC0901,TARQUI,EC090150,Coop Sergio Toral 1 Mz. 3447 Sl. 13,-80.045331,-2.350555,La Costa,1/20/14,10:00:00 PM,1,20,2014,Rain,Short duration rain,0,1,0,0,0,0,0,0,0,0,,,,1.0,,,4.0,,,,,,3,2,3,4.0,,1.0,2014-01-21 03:00:00
3898,Desinventar,EL ORO,EC07,ARENILLAS,EC0702,ARENILLAS,EC070250,Varios sectores,-80.065843,-3.556684,La Costa,3/5/17,5:35:00 PM,3,5,2017,Rain ,Urban/ Short duration rain,0,1,0,0,0,1,0,0,0,0,,,,,9.0,,27.0,27.0,,,,,4,2,3,27.0,9.0,3.0,2017-03-05 22:35:00
3103,Desinventar,GUAYAS,EC09,GUAYAQUIL,EC0901,CHONGON,EC090150,"Guayaquil, Chongon. Rcto. Daular. Km. 33 via a la costa",-80.076452,-2.210353,La Costa,3/31/15,11:00:00 AM,3,31,2015,Rain / Overflow,Heavy precipitation/ Urban ,1,0,0,0,0,1,0,0,0,0,,,,,80.0,,419.0,419.0,19.0,,31.5,6.0,3,2,3,419.0,80.0,5.0,2015-03-31 16:00:00
3104,SNGRE,GUAYAS,EC09,GUAYAQUIL,EC0901,CHONGON,EC090150,Km 22 via a la costa,-80.079778,-2.207075,La Costa,3/31/15,6:00:00 PM,3,31,2015,Rain / Overflow,Small stream overflow,0,0,0,1,0,0,0,0,0,0,,,,,,,8.0,,,,,,4,2,3,8.0,,2.0,2015-03-31 23:00:00
3705,Desinventar,GUAYAS,EC09,LOMAS DE SARGENTILLO,EC0924,LOMAS DE SARGENTILLO,EC092450,"Barrio Ruminahui, Calle San Vicente y Ceferino Hungria",-80.083459,-1.878164,La Costa,1/9/17,12:05:00 AM,1,9,2017,Rain,Heavy precipitation/ Urban ,1,0,0,0,0,1,0,0,0,0,,,,,5.0,,20.0,20.0,,,,,3,2,3,20.0,5.0,3.0,2017-01-09 05:05:00
3596,Desinventar,GUAYAS,EC09,GUAYAQUIL,EC0901,JUAN GOMEZ RENDON (PROGRESO),EC090152,Recinto Cerecita Barrio Lindo (Km 51 via a al Costa sector b,-80.271755,-2.331318,La Costa,4/11/16,11:44:00 AM,4,11,2016,Rain,Short duration rain,0,1,0,0,0,0,0,0,0,0,,,,,1.0,,7.0,7.0,,,,,3,2,3,7.0,1.0,2.0,2016-04-11 16:44:00
2317,Desinventar/SNGRE_2021,GUAYAS,EC09,PLAYAS,EC0921,GENERAL VILLAMIL (PLAYAS),EC092150,Ecuador 1; Ecuador2; Monica de Verduga; Aguas Verdes; Altami,-80.3833,-2.6334,La Costa,4/20/13,12:19:00 PM,4,20,2013,,Short duration rain,0,1,0,0,0,0,0,0,0,0,,,,,,,,,,,,,3,2,3,,,,2013-04-20 17:19:00
2561,Desinventar,GUAYAS,EC09,PLAYAS,EC0921,GENERAL VILLAMIL (PLAYAS),EC092150,Barrio Garay,-80.383698,-2.639246,La Costa,1/23/14,7:10:00 AM,1,23,2014,Rain,Heavy precipitation/ Urban ,1,0,0,0,0,1,0,0,0,0,,,,,,,,,,,,,3,2,3,,,,2014-01-23 12:10:00
4422,Desinventar,MANABI,EC13,PAJAN,EC1310,CAMPOZANO (LA PALMA DE PAJAN),EC131051,"Varios Sectores (El Aji, Los dos Rios, La Veracruz, La Balsa",-80.384435,-1.561969,La Costa,4/1/18,3:00:00 AM,4,1,2018,Rain / Overflow,Small stream overflow,0,0,0,1,0,0,0,0,0,0,,,,,,,840.0,840.0,,,,,4,2,3,840.0,,6.0,2018-04-01 08:00:00
4812,SNGRE,MANABI,EC13,PORTOVIEJO,EC1301,PICOAZA,EC130150,"Av. Reales Tamarindo y Primero de Mayo, al frente de la Clinica Bambini.",-80.480723,-1.033848,La Costa,3/18/19,3:00:00 PM,3,18,2019,Rain,Short duration rain,0,1,0,0,0,0,0,0,0,0,,,,,,1.0,4.0,,,,,,3,2,3,4.0,1.0,1.0,2019-03-18 20:00:00
3000,Desinventar,MANABI,EC13,PORTOVIEJO,EC1301,PICOAZA,EC130150,Entrada El Milagro de Picoaza.,-80.49913,-1.034311,La Costa,3/14/15,6:15:00 PM,3,14,2015,Rain ,Heavy precipitation/ Urban ,1,0,0,0,0,1,0,0,0,0,,,,,1.0,,5.0,5.0,,,,,3,2,3,5.0,1.0,1.0,2015-03-14 23:15:00
4152,Desinventar,MANABI,EC13,PORTOVIEJO,EC1301,PICOAZA,EC130150,Varios Sectores,-80.512164,-1.023882,La Costa,4/8/17,9:00:00 AM,4,8,2017,Rain / Overflow,Heavy precipitation/Urban,1,0,0,0,0,1,0,0,0,0,,,,,116.0,,580.0,580.0,,,,,3,2,3,580.0,116.0,6.0,2017-04-08 14:00:00
5007,SNGRE_2021,SUCUMBIOS,EC21,CUYABENO,EC2107,TARAPOA,EC210750,Barrio Los Rios,-76.348203,-0.1251851,El Oriente,9/14/19,6:00:00 AM,9,14,2019,,Heavy precipitation/ Urban,1,0,0,0,0,1,0,0,0,0,,,,,,,,,,,,,3,3,3,,,,2019-09-14 11:00:00
3236,Desinventar,SUCUMBIOS,EC21,SHUSHUFINDI,EC2104,SAN ROQUE (CAB EN SAN VICENTE),EC210453,"Cumanda, Brisas del Aguarico",-76.511017,-0.247441,El Oriente,7/23/15,6:00:00 AM,7,23,2015,Rain / Overflow,Heavy precipitation,1,0,0,0,0,0,0,0,0,0,,,,,5.0,,332.0,332.0,,24.0,,,2,3,3,332.0,5.0,5.0,2015-07-23 11:00:00
1776,SNGRE_2021,ORELLANA,EC22,ORELLANA,EC2201,TARACOA (CAB EN NUEVA ESPERANZ,EC220152,"Recinto Shuar Charapa  
Coordenadas:",-76.782064,-0.543348,El Oriente,11/21/12,3:00:00 AM,11,21,2012,Rain/ Overflow,Heavy precipitation,1,0,0,0,0,0,0,0,0,0,,,,1.0,7.0,,25.0,,,,,2.0,2,3,3,25.0,7.0,3.0,2012-11-21 08:00:00
3245,Desinventar,ORELLANA,EC22,ORELLANA,EC2201,INÉS ARANGO (CAB. EN WESTERN),EC220157,La Western,-76.922486,-0.961509,El Oriente,10/15/15,5:00:00 PM,10,15,2015,Rain ,Short duration rain,0,1,0,0,0,0,0,0,0,0,,,,,8.0,,23.0,23.0,,,,,3,3,3,23.0,8.0,3.0,2015-10-15 22:00:00
3197,Desinventar,ORELLANA,EC22,LORETO,EC2204,SAN JOSE DE DAHUANO,EC220454,Sarayacu,-77.372992,-0.830413,La Sierra,5/28/15,8:00:00 AM,5,28,2015,Rain / Overflow,Heavy precipitation,1,0,0,0,0,0,0,0,0,0,,,,,1.0,,8.0,8.0,,,,,2,3,3,8.0,1.0,2.0,2015-05-28 13:00:00
2241,Desinventar/SNGRE_2021,PASTAZA,EC16,PASTAZA,EC1601,SARAYACU,EC160161,Comunidad de Moretecocha,-77.4336,-1.8021,La Sierra,4/8/13,3:30:00 PM,4,8,2013,Rain ,Heavy precipitation,1,0,0,0,0,0,0,0,0,0,,,,,10.0,,30.0,30.0,,,1.0,1.0,2,3,3,30.0,10.0,3.0,2013-04-08 20:30:00
4188,Desinventar,MORONA SANTIAGO,EC14,TAISHA,EC1409,TAISHA,EC140950,San Jose,-77.503583,-2.385596,La Sierra,4/14/17,12:00:00 PM,4,14,2017,Rain,Heavy precipitation,1,0,0,0,0,0,0,0,0,0,,,,,1.0,,4.0,4.0,,,,,2,3,3,4.0,1.0,1.0,2017-04-14 17:00:00
4185,Desinventar,MORONA SANTIAGO,EC14,MORONA,EC1401,RIO BLANCO,EC140164,Troncal Amazonica Macas-Sucua (E45) junto a la discoteca Pla,-78.153855,-2.344699,La Sierra,4/14/17,9:11:00 AM,4,14,2017,Rain ,Heavy precipitation,1,0,0,0,0,0,0,0,0,0,,,,,5.0,,22.0,22.0,,,,,2,3,3,22.0,5.0,3.0,2017-04-14 14:11:00
5009,SNGRE_2021,PICHINCHA,EC17,QUITO,EC1701,PIFO,EC170175,Barrio Calluma,-78.339591,-0.22564,La Sierra,9/20/19,5:00:00 PM,9,20,2019,Rain/ Overflow,Artificial waterway overflow,0,0,1,0,0,0,0,0,0,0,,,,,1.0,,,3.0,,3.0,,,1,3,3,3.0,1.0,1.0,2019-09-20 22:00:00
3155,Desinventar,ZAMORA CHINCHIPE,EC19,EL PANGUI,EC1906,EL PANGUI,EC190650,"Playa la Rosa, El Remolino, Los Achales",-78.574847,-3.609556,La Sierra,4/26/15,11:00:00 AM,4,26,2015,Rain ,Heavy precipitation,1,0,0,0,0,0,0,0,0,0,,,,,4.0,,12.0,12.0,,,,,2,3,3,12.0,4.0,3.0,2015-04-26 16:00:00
2693,Desinventar,ZAMORA CHINCHIPE,EC19,EL PANGUI,EC1906,EL PANGUI,EC190650,Centro de El Pangui,-78.588446,-3.629389,La Sierra,3/12/14,12:30:00 PM,3,12,2014,Rain,Heavy precipitation/ Urban,1,0,0,0,0,1,0,0,0,0,,,,,5.0,,,,,,,,3,3,3,,5.0,,2014-03-12 17:30:00
3404,Desinventar,ESMERALDAS,EC08,SAN LORENZO,EC0805,TULULBI  (CAB EN RICAURTE),EC080561,RICAURTE,-78.730432,1.178617,La Costa,1/25/16,6:00:00 AM,1,25,2016,Rain,Heavy precipitation,1,0,0,0,0,0,0,0,0,0,,,,,,,,,,,1.0,2.0,2,3,3,,,,2016-01-25 11:00:00
2851,Desinventar,ZAMORA CHINCHIPE,EC19,YANTZAZA,EC1905,YANTZAZA (YANZATZA),EC190550,Gran Colombia y Playa Rica.,-78.755165,-3.827896,La Sierra,7/8/14,4:00:00 AM,7,8,2014,Long duration rain / Overflow,Heavy precipitation,1,0,0,0,0,0,0,0,0,0,,,,,30.0,,100.0,100.0,,,10.0,,2,3,3,100.0,30.0,4.0,2014-07-08 09:00:00
3663,Desinventar,ZAMORA CHINCHIPE,EC19,YANTZAZA,EC1905,YANTZAZA (YANZATZA),EC190550,Unidad Educativa Dr. Victor Emilio Uzcategui,-78.758484,-3.818494,La Sierra,10/13/16,8:40:00 AM,10,13,2016,Rain,Urban,0,0,0,0,0,1,0,0,0,0,,,,,,,,,,,,,1,3,3,,,,2016-10-13 13:40:00
3625,Desinventar,ZAMORA CHINCHIPE,EC19,YANTZAZA,EC1905,YANTZAZA (YANZATZA),EC190550,Barrio San Francisco,-78.759397,-3.820295,La Sierra,5/8/16,7:00:00 AM,5,8,2016,Rain ,Urban,0,0,0,0,0,1,0,0,0,0,,,,,8.0,,21.0,21.0,,,,,1,3,3,21.0,8.0,3.0,2016-05-08 12:00:00
3336,Desinventar,ESMERALDAS,EC08,SAN LORENZO,EC0805,CALDERON,EC080553,LA CHIQUITA,-78.764662,1.171783,La Costa,1/25/16,6:00:00 AM,1,25,2016,Rain,Heavy precipitation,1,0,0,0,0,0,0,0,0,0,,,,,,,,,,,1.0,2.0,2,3,3,,,,2016-01-25 11:00:00
3518,Desinventar,SANTO DOMINGO DE LOS TSACHILAS,EC23,SANTO DOMINGO,EC2301,SANTA MARIA DEL TOACHI,EC230157,Santa Maria del Toachi Recinto El Bimbe del Toachi ,-79.22455,-0.637724,La Costa,3/7/16,5:40:00 AM,3,7,2016,Rain / Overflow,Short duration rain,0,1,0,0,0,0,0,0,0,0,,,,,8.0,,37.0,37.0,,,,,3,3,3,37.0,8.0,3.0,2016-03-07 10:40:00
2038,Desinventar/SNGRE_2021,ESMERALDAS,EC08,RIOVERDE,EC0807,LAGARTO,EC080753,Sector urbano y rurales,-79.2463,1.0619,La Costa,3/6/13,6:00:00 AM,3,6,2013,Rain/ Overflow,Heavy precipitation,1,0,0,0,0,0,0,0,0,0,,,,,45.0,,225.0,225.0,,,,,2,3,3,225.0,45.0,5.0,2013-03-06 11:00:00
4552,SNGRE,LOS RIOS,EC12,BUENA FE,EC1210,PATRICIA PILAR,EC121051,Sector Uno,-79.370055,-0.57778,La Costa,1/5/19,8:37:00 PM,1,5,2019,Rain,Urban,0,0,0,0,0,1,0,0,0,0,,,,,,1.0,3.0,,,,,,1,3,3,3.0,1.0,1.0,2019-01-06 01:37:00
3007,Desinventar,GUAYAS,EC09,EL TRIUNFO,EC0909,EL TRIUNFO,EC090950,Cdla. Cristo Peregrino,-79.391495,-2.321214,La Costa,3/17/15,7:40:00 AM,3,17,2015,Rain,Heavy precipitation,1,0,0,0,0,0,0,0,0,0,,,,,1.0,,2.0,2.0,2.0,,,,2,3,3,2.0,1.0,1.0,2015-03-17 12:40:00
3293,Desinventar,GUAYAS,EC09,EL TRIUNFO,EC0909,EL TRIUNFO,EC090950,Varios Sectores,-79.393168,-2.320999,La Costa,1/12/16,7:00:00 AM,1,12,2016,Rain ,Urban,0,0,0,0,0,1,0,0,0,0,,,,,,,,,,,,,1,3,3,,,,2016-01-12 12:00:00
3291,Desinventar,GUAYAS,EC09,EL TRIUNFO,EC0909,EL TRIUNFO,EC090950,Av. Simon Bolivar y Adolfo Rodriguez,-79.397071,-2.33597,La Costa,1/11/16,8:00:00 PM,1,11,2016,Rain,Short duration rain,0,1,0,0,0,0,0,0,0,0,,,,,,,,,,,,,3,3,3,,,,2016-01-12 01:00:00
3006,Desinventar,GUAYAS,EC09,EL TRIUNFO,EC0909,EL TRIUNFO,EC090950,Cdla. Patria Nueva,-79.419958,-2.312852,La Costa,3/17/15,7:40:00 AM,3,17,2015,Rain,Short duration rain,0,1,0,0,0,0,0,0,0,0,,,,,3.0,,15.0,15.0,5.0,,,,3,3,3,15.0,3.0,3.0,2015-03-17 12:40:00
3063,Desinventar,LOS RIOS,EC12,BABAHOYO,EC1201,BARREIRO,EC120150,La Puntilla,-79.475094,-1.782312,La Costa,3/22/15,11:50:00 PM,3,22,2015,Rain ,Heavy precipitation,1,0,0,0,0,0,0,0,0,0,,,,,16.0,,61.0,61.0,41.0,41.0,,,2,3,3,61.0,16.0,4.0,2015-03-23 04:50:00
3330,Desinventar,LOS RIOS,EC12,URDANETA,EC1206,CATARAMA,EC120650,Manabi Chiquito,-79.475414,-1.63259,La Costa,1/25/16,6:02:00 AM,1,25,2016,Rain ,Heavy precipitation,1,0,0,0,0,0,0,0,0,0,,,,,4.0,,20.0,20.0,16.0,,,,2,3,3,20.0,4.0,3.0,2016-01-25 11:02:00
2653,Desinventar/SNGRE_2021,LOS RIOS,EC12,BABAHOYO,EC1201,CLEMENTE BAQUERIZO,EC120150,Cdla. Cristo del Consuelo,-79.478556,-1.842264,La Costa,2/26/14,6:00:00 AM,2,26,2014,Rain ,Heavy precipitation,1,0,0,0,0,0,0,0,0,0,,,,,,,,,,,,,2,3,3,,,,2014-02-26 11:00:00
2053,Desinventar/SNGRE_2021,LOS RIOS,EC12,BABAHOYO,EC1201,CLEMENTE BAQUERIZO,EC120150,Puertas Negras,-79.4786,-1.8423,La Costa,3/7/13,4:30:00 PM,3,7,2013,Rain,Heavy precipitation,1,0,0,0,0,0,0,0,0,0,,,,,1.0,,3.0,3.0,,,,,2,3,3,3.0,1.0,1.0,2013-03-07 21:30:00
3095,Desinventar,LOS RIOS,EC12,BABAHOYO,EC1201,CLEMENTE BAQUERIZO,EC120150,La Virginia,-79.527647,-1.804372,La Costa,3/29/15,2:00:00 PM,3,29,2015,Rain ,Heavy precipitation,1,0,0,0,0,0,0,0,0,0,,,,,,,22.0,22.0,22.0,22.0,,,2,3,3,22.0,,3.0,2015-03-29 19:00:00
2032,Desinventar/SNGRE_2021,LOS RIOS,EC12,BABAHOYO,EC1201,EL SALTO,EC120150,Nueva Esperanza,-79.5364,-1.7951,La Costa,3/6/13,4:30:00 PM,3,6,2013,Rain ,Heavy precipitation,1,0,0,0,0,0,0,0,0,0,,,,,1.0,,3.0,3.0,,,,,2,3,3,3.0,1.0,1.0,2013-03-06 21:30:00
4403,Desinventar,LOS RIOS,EC12,BABAHOYO,EC1201,PIMOCHA,EC120154,El Tesoro,-79.54408,-1.795438,La Costa,3/1/18,8:00:00 AM,3,1,2018,Rain ,Heavy precipitation,1,0,0,0,0,0,0,0,0,0,,,,,1.0,,4.0,4.0,,,,,2,3,3,4.0,1.0,1.0,2018-03-01 13:00:00
3092,Desinventar,LOS RIOS,EC12,PUEBLOVIEJO,EC1204,SAN JUAN,EC120452,Cristo del consuelo,-79.547735,-1.632417,La Costa,3/28/15,10:00:00 AM,3,28,2015,Rain ,Heavy precipitation,1,0,0,0,0,0,0,0,0,0,,,,,3.0,,40.0,40.0,28.0,40.0,,,2,3,3,40.0,3.0,3.0,2015-03-28 15:00:00
4656,SNGRE,LOS RIOS,EC12,PUEBLOVIEJO,EC1204,SAN JUAN,EC120452,Rcto. Jorge Manuel Marun y Cristo del Consuelo,-79.552503,-1.622422,La Costa,2/18/19,8:23:00 AM,2,18,2019,Rain,Heavy precipitation,1,0,0,0,0,0,0,0,0,0,,,,,,64.0,205.0,,,,,,2,3,3,205.0,64.0,5.0,2019-02-18 13:23:00
1944,SNGRE_2021,LOS RIOS,EC12,BABAHOYO,EC1201,PIMOCHA,EC120154,La Delia (km 78 via Babahoyo - Pueblo Viejo),-79.5718,-1.783,La Costa,2/28/13,2:00:00 PM,2,28,2013,Long duration rain,Artificial waterway overflow,0,0,1,0,0,0,0,0,0,0,,,,,140.0,,700.0,,,,,,1,3,3,700.0,140.0,6.0,2013-02-28 19:00:00
4418,Desinventar,LOS RIOS,EC12,BABA,EC1202,BABA,EC120250,Rcto. La Hornilla,-79.634731,-1.790842,La Costa,3/22/18,12:12:00 PM,3,22,2018,Rain ,Heavy precipitation,1,0,0,0,0,0,0,0,0,0,,,,1.0,1.0,,142.0,5.0,,,,,2,3,3,142.0,1.0,5.0,2018-03-22 17:12:00
5211,SNGRE_2021,EL ORO,EC07,EL GUABO,EC0706,TENDALES (CAB. EN PUERTO TENDA,EC070653,Barrio 24 de Mayo,-79.844946,-3.121058,La Costa,3/11/20,4:00:00 AM,3,11,2020,Rain,Short duration rain,0,1,0,0,0,0,0,0,0,0,,,,,1.0,1.0,8.0,,,,,,3,3,3,8.0,1.0,2.0,2020-03-11 09:00:00
3982,Desinventar,EL ORO,EC07,EL GUABO,EC0706,TENDALES (CAB. EN PUERTO TENDA,EC070653,Ciudadela 12 de Octubre,-79.84626,-3.119906,La Costa,3/22/17,7:30:00 PM,3,22,2017,Rain / Overflow,Heavy precipitation,1,0,0,0,0,0,0,0,0,0,,,,,50.0,,150.0,150.0,16.0,16.0,,,2,3,3,150.0,50.0,5.0,2017-03-23 00:30:00
2369,Desinventar/SNGRE_2021,GUAYAS,EC09,GUAYAQUIL,EC0901,XIMENA,EC090150,Guasmo Sur Coop Valle Independiente,-79.873,-2.2794,La Costa,5/2/13,5:00:00 PM,5,2,2013,Rain,Heavy precipitation,1,0,0,0,0,0,0,0,0,0,,,,,1.0,,2.0,2.0,,,,,2,3,3,2.0,1.0,1.0,2013-05-02 22:00:00
2979,Desinventar,EL ORO,EC07,MACHALA,EC0701,EL RETIRO,EC070152,La Maria,-79.896895,-3.353794,La Costa,2/19/15,5:00:00 AM,2,19,2015,Rain,short duration rain,0,1,0,0,0,0,0,0,0,0,,,,,6.0,,26.0,26.0,,,,,3,3,3,26.0,6.0,3.0,2015-02-19 10:00:00
3309,Desinventar,GUAYAS,EC09,GUAYAQUIL,EC0901,FEBRES CORDERO,EC090150,Unidad Educativa Eloy Alfaro,-79.910363,-2.19824,La Costa,1/20/16,6:45:00 AM,1,20,2016,Rain ,Heavy precipitation,1,0,0,0,0,0,0,0,0,0,,,,,,,,,,,,,2,3,3,,,,2016-01-20 11:45:00
2790,Desinventar,GUAYAS,EC09,GUAYAQUIL,EC0901,TARQUI,EC090150,Varios Sectores,-79.919442,-2.151328,La Costa,5/7/14,6:30:00 PM,5,7,2014,Rain,Heavy precipitation,1,0,0,0,0,0,0,0,0,0,,,,,,,,,,,,,2,3,3,,,,2014-05-07 23:30:00
2858,Desinventar,GUAYAS,EC09,GUAYAQUIL,EC0901,FEBRES CORDERO,EC090150,Varios Sectores,-79.921218,-2.196303,La Costa,8/5/14,6:30:00 PM,8,5,2014,Rain,Heavy precipitation,1,0,0,0,0,0,0,0,0,0,,,,,,,,,,,,,2,3,3,,,,2014-08-05 23:30:00
4827,Desinventar,GUAYAS,EC09,GUAYAQUIL,EC0901,FEBRES CORDERO,EC090150,Varios Sectores,-79.924416,-2.194379,La Costa,3/19/19,7:48:00 AM,3,19,2019,Rain,Heavy precipitation,1,0,0,0,0,0,0,0,0,0,,,,,,,,,,,,,2,3,3,,,,2019-03-19 12:48:00
3112,Desinventar,GUAYAS,EC09,GUAYAQUIL,EC0901,TARQUI,EC090150,"Cerro San Eduardo, coop. 25 de Julio Mz. 654 solar 9.",-79.929477,-2.177115,La Costa,4/3/15,9:34:00 AM,4,3,2015,Rain,Heavy precipitation,1,0,0,0,0,0,0,0,0,0,,,,,1.0,,3.0,3.0,,,,,2,3,3,3.0,1.0,1.0,2015-04-03 14:34:00
3088,Desinventar,LOJA,EC11,MACARA,EC1108,MACARA,EC110850,La Alborada,-79.949627,-4.3842,La Sierra,3/28/15,1:00:00 PM,3,28,2015,Long duration rain,Urban,0,0,0,0,0,1,0,0,0,0,,,,,4.0,,16.0,16.0,,,,,1,3,3,16.0,4.0,3.0,2015-03-28 18:00:00
2650,Desinventar/SNGRE_2021,GUAYAS,EC09,GUAYAQUIL,EC0901,TARQUI,EC090150,Lomas de la Florida MZ 929 y 930 como referencia por la entr,-79.954693,-2.132402,La Costa,2/25/14,8:49:00 AM,2,25,2014,Rain,Heavy precipitation,1,0,0,0,0,0,0,0,0,0,,,,,5.0,,,,,,,,2,3,3,,5.0,,2014-02-25 13:49:00
1902,SNGRE_2021,EL ORO,EC07,MACHALA,EC0701,EL RETIRO,EC070152,Sitio Bella India - Hacienda Guayas,-79.9568,-3.3791,La Costa,2/12/13,2:30:00 AM,2,12,2013,,Urban,0,0,0,0,0,1,0,0,0,0,,,,,1.0,,5.0,,,5.0,,,1,3,3,5.0,1.0,1.0,2013-02-12 07:30:00
4610,Desinventar,EL ORO,EC07,SANTA ROSA,EC0712,SANTA ROSA,EC071250,"VARIOS SECTORES, (Lot. Teodoro Vite, Plaza Garibaldi, Cdla. ",-79.9649,-3.467452,La Costa,1/16/19,9:23:00 PM,1,16,2019,Rain,Heavy precipitation/ Urban ,1,0,0,0,0,1,0,0,0,0,,,,,2.0,2.0,9.0,9.0,,,,,3,3,3,9.0,2.0,2.0,2019-01-17 02:23:00
2659,Desinventar/SNGRE_2021,EL ORO,EC07,SANTA ROSA,EC0712,SANTA ROSA CABECERA CANTONAL,EC071250,Cdla. Libertad(Calle Pinas y Lomas),-79.975065,-3.461839,La Costa,3/1/14,2:51:00 AM,3,1,2014,Rain ,Urban,0,0,0,0,0,1,0,0,0,0,,,,,1.0,,,,,,,,1,3,3,,1.0,,2014-03-01 07:51:00
3717,Desinventar,EL ORO,EC07,SANTA ROSA,EC0712,SANTA ROSA CABECERA CANTONAL,EC071250,Varios sectores,-79.978006,-3.438365,La Costa,1/15/17,1:00:00 AM,1,15,2017,Rain ,Short duration rain,0,1,0,0,0,0,0,0,0,0,,,,,5.0,,20.0,20.0,,,,,3,3,3,20.0,5.0,3.0,2017-01-15 06:00:00
2649,Desinventar,GUAYAS,EC09,PEDRO CARBO,EC0914,PEDRO CARBO,EC091450,Recinto Mis Ensuenos como referencia entrando por la calle S,-80.226903,-1.815931,La Costa,2/25/14,8:00:00 PM,2,25,2014,Rain,Heavy precipitation,1,0,0,0,0,0,0,0,0,0,,,,,28.0,,95.0,95.0,,,,,2,3,3,95.0,28.0,4.0,2014-02-26 01:00:00
4369,Desinventar,GUAYAS,EC09,PEDRO CARBO,EC0914,PEDRO CARBO,EC091450,Calles Quito y El Oro,-80.230563,-1.814621,La Costa,2/12/18,10:15:00 AM,2,12,2018,Rain,Short duration rain,0,1,0,0,0,0,0,0,0,0,,,,,1.0,,7.0,7.0,,,,,3,3,3,7.0,1.0,2.0,2018-02-12 15:15:00
3753,Desinventar,GUAYAS,EC09,PEDRO CARBO,EC0914,SABANILLA,EC091452,"Sector Madre de la Buena Esperanza, Barrio Matecito",-80.237018,-1.836154,La Costa,2/1/17,9:00:00 AM,2,1,2017,Rain,Heavy precipitation,1,0,0,0,0,0,0,0,0,0,,,,,1.0,,2.0,2.0,,2.0,,,2,3,3,2.0,1.0,1.0,2017-02-01 14:00:00
3749,Desinventar,GUAYAS,EC09,GUAYAQUIL,EC0901,JUAN GOMEZ RENDON (PROGRESO),EC090152,Km 63 Via a la Costa ,-80.360412,-2.393249,La Costa,1/31/17,4:49:00 PM,1,31,2017,Rain ,Heavy precipitation,1,0,0,0,0,0,0,0,0,0,,,,,1.0,,2.0,2.0,,,,,2,3,3,2.0,1.0,1.0,2017-01-31 21:49:00
4122,SNGRE,GUAYAS,EC09,GUAYAQUIL,EC0901,JUAN GOMEZ RENDON (PROGRESO),EC090152,Varios Sectores: Barrio Nuevo Progreso y El Caimito  ,-80.363491,-2.404721,La Costa,4/3/17,6:30:00 PM,4,3,2017,Rain / Overflow,Heavy precipitation/ Urban ,1,0,0,0,0,1,0,0,0,0,,,,,,,40.0,,,,,,3,3,3,40.0,,3.0,2017-04-03 23:30:00
4151,SNGRE,GUAYAS,EC09,GUAYAQUIL,EC0901,JUAN GOMEZ RENDON (PROGRESO),EC090152,Sector La Colina / Via Progreso - General Villamil Playas Km. 68,-80.366826,-2.389099,La Costa,4/8/17,11:10:00 PM,4,8,2017,Rain,Heavy precipitation,1,0,0,0,0,0,0,0,0,0,,,,,,,5.0,,,,,,2,3,3,5.0,,1.0,2017-04-09 04:10:00
4371,Desinventar,MANABI,EC13,PORTOVIEJO,EC1301,COLON,EC130150,La Moconta de los Angeles,-80.387058,-1.098514,La Costa,2/19/18,7:38:00 PM,2,19,2018,Rain ,Short duration rain,0,1,0,0,0,0,0,0,0,0,,,,1.0,1.0,,6.0,6.0,6.0,6.0,,,3,3,3,6.0,1.0,2.0,2018-02-20 00:38:00
3275,Desinventar,MANABI,EC13,PORTOVIEJO,EC1301,COLON,EC130150,Estancia Vieja,-80.390863,-1.094698,La Costa,12/6/15,5:00:00 PM,12,6,2015,Rain / Overflow,Heavy precipitation/ Urban ,1,0,0,0,0,1,0,0,0,0,,,,,30.0,,,,,,8.0,,3,3,3,,30.0,,2015-12-06 22:00:00
3833,Desinventar,MANABI,EC13,SANTA ANA,EC1313,LODANA,EC131350,Beldaco ,-80.392487,-1.18266,La Costa,2/15/17,4:00:00 PM,2,15,2017,Rain ,Heavy precipitation,1,0,0,0,0,0,0,0,0,0,,,,,3.0,,720.0,15.0,,,,,2,3,3,720.0,3.0,6.0,2017-02-15 21:00:00
2012,SNGRE_2021,MANABI,EC13,SANTA ANA,EC1313,LODANA,EC131350,El Nispero,-80.3934,-1.1779,La Costa,3/5/13,9:45:00 AM,3,5,2013,Rain,Short duration rain,0,1,0,0,0,0,0,0,0,0,,,,,1.0,,2.0,,,,,,3,3,3,2.0,1.0,1.0,2013-03-05 14:45:00
4062,SNGRE,MANABI,EC13,PORTOVIEJO,EC1301,FRANCISCO PACHECO,EC130150,Varios Sectores  ,-80.412645,-1.061586,La Costa,3/29/17,8:00:00 AM,3,29,2017,Rain ,Heavy precipitation,1,0,0,0,0,0,0,0,0,0,,,,,,,20.0,,,,,,2,3,3,20.0,,3.0,2017-03-29 13:00:00
4684,SNGRE,MANABI,EC13,24 DE MAYO,EC1316,SUCRE,EC131650,El tropezon- Los ttilales,-80.423956,-1.247532,La Costa,2/25/19,9:26:00 AM,2,25,2019,Rain,Short duration rain,0,1,0,0,0,0,0,0,0,0,,,,,,29.0,54.0,,,10.0,,,3,3,3,54.0,29.0,4.0,2019-02-25 14:26:00
4069,SNGRE,MANABI,EC13,PORTOVIEJO,EC1301,SAN PABLO,EC130150,Calle 20 de Julio,-80.443906,-1.04661,La Costa,3/29/17,8:30:00 AM,3,29,2017,Rain ,Heavy precipitation,1,0,0,0,0,0,0,0,0,0,,,,,,,8.0,,,,,,2,3,3,8.0,,2.0,2017-03-29 13:30:00
3913,Desinventar,MANABI,EC13,PORTOVIEJO,EC1301,FRANCISCO PACHECO,EC130150,Varios Sectores,-80.447024,-1.055707,La Costa,3/9/17,3:10:00 PM,3,9,2017,Rain ,Heavy precipitation,1,0,0,0,0,0,0,0,0,0,,,,,18.0,,72.0,72.0,,11.0,,,2,3,3,72.0,18.0,4.0,2017-03-09 20:10:00
2117,Desinventar/SNGRE_2021,MANABI,EC13,PORTOVIEJO,EC1301,PORTOVIEJO,EC130150,Portoviejo,-80.4517,-1.0591,La Costa,3/15/13,4:50:00 PM,3,15,2013,Rain,Urban,0,0,0,0,0,1,0,0,0,0,,,,,,,,,,,,,1,3,3,,,,2013-03-15 21:50:00
4142,Desinventar,MANABI,EC13,PORTOVIEJO,EC1301,18 DE OCTUBRE,EC130150,Varios Sectores,-80.452444,-1.054107,La Costa,4/8/17,8:00:00 AM,4,8,2017,Rain / Overflow,Heavy precipitation/Urban,1,0,0,0,0,1,0,0,0,0,,,,,55.0,,275.0,275.0,,,,,3,3,3,275.0,55.0,5.0,2017-04-08 13:00:00
4636,SNGRE,MANABI,EC13,PORTOVIEJO,EC1301,PORTOVIEJO,EC130150,Varios Sectores,-80.45249,-1.054723,La Costa,2/10/19,6:00:00 AM,2,10,2019,Rain,Urban,0,0,0,0,0,1,0,0,0,0,,,,,,3.0,11.0,36.0,,,,,1,3,3,36.0,3.0,3.0,2019-02-10 11:00:00
4631,SNGRE,MANABI,EC13,ROCAFUERTE,EC1312,ROCAFUERTE,EC131250,El Cerrito,-80.486877,-0.899091,La Costa,2/8/19,6:00:00 PM,2,8,2019,Rain / Overflow,Heavy precipitation,1,0,0,0,0,0,0,0,0,0,,,,,,4.0,16.0,,,5.0,,,2,3,3,16.0,4.0,3.0,2019-02-08 23:00:00
3818,Desinventar,MANABI,EC13,SUCRE,EC1314,CHARAPOTO,EC131453,Santa Teresa- El Pueblito de Charapoto ,-80.50327,-0.797363,La Costa,2/11/17,12:36:00 AM,2,11,2017,Rain ,Urban,0,0,0,0,0,1,0,0,0,0,,,,,15.0,,64.0,64.0,,,,,1,3,3,64.0,15.0,4.0,2017-02-11 05:36:00
3306,Desinventar,SANTA ELENA,EC24,SANTA ELENA,EC2401,CHANDUY,EC240153,Calle principal entre 5 de Junio y Cesareo Carrera Escuela d,-80.681233,-2.401458,La Costa,1/20/16,5:00:00 AM,1,20,2016,Rain,Heavy precipitation/ Urban,1,0,0,0,0,1,0,0,0,0,,,,,,,,,,,,,3,3,3,,,,2016-01-20 10:00:00
3827,Desinventar,SANTA ELENA,EC24,SANTA ELENA,EC2401,MANGLARALTO,EC240154,Sitio Nuevo,-80.692896,-1.792768,La Costa,2/12/17,5:00:00 AM,2,12,2017,Rain ,Heavy precipitation,1,0,0,0,0,0,0,0,0,0,,,,,6.0,,21.0,21.0,,,,,2,3,3,21.0,6.0,3.0,2017-02-12 10:00:00
1859,SNGRE_2021,SANTA ELENA,EC24,LA LIBERTAD,EC2402,LA LIBERTAD,EC240250,San Raymundo ,-80.9069,-2.2237,La Costa,2/2/13,10:00:00 AM,2,2,2013,Rain / Overflow,Heavy precipitation,1,0,0,0,0,0,0,0,0,0,,,,,15.0,,75.0,,,,,,2,3,3,75.0,15.0,4.0,2013-02-02 15:00:00
3577,Desinventar,SANTA ELENA,EC24,LA LIBERTAD,EC2402,LA LIBERTAD,EC240250,General Enriquez (av.11 entre la calle 39 y 40),-80.914544,-2.227019,La Costa,4/4/16,5:00:00 AM,4,4,2016,Rain ,Short duration rain,0,1,0,0,0,0,0,0,0,0,,,,,1.0,,8.0,8.0,,,,,3,3,3,8.0,1.0,2.0,2016-04-04 10:00:00
4632,Desinventar,SANTA ELENA,EC24,SALINAS,EC2403,JOSE LUIS TAMAYO (MUEY),EC240352,San Raymundo dos,-80.927745,-2.253211,La Costa,2/9/19,6:00:00 AM,2,9,2019,Rain,Short duration rain,0,1,0,0,0,0,0,0,0,0,,,,,5.0,8.0,19.0,19.0,,,,,3,3,3,19.0,8.0,3.0,2019-02-09 11:00:00
4638,Desinventar,SANTA ELENA,EC24,SALINAS,EC2403,JOSE LUIS TAMAYO (MUEY),EC240352,San Raymundo uno y dos/ Barrio 10 de Mayo,-80.927745,-2.253211,La Costa,2/11/19,3:00:00 AM,2,11,2019,Rain,Short duration rain,0,1,0,0,0,0,0,0,0,0,,,,,9.0,9.0,30.0,30.0,,,,,3,3,3,30.0,9.0,3.0,2019-02-11 08:00:00
4374,Desinventar,SANTA ELENA,EC24,SALINAS,EC2403,JOSE LUIS TAMAYO (MUEY),EC240352,"Cdla. Vinicio Yagual, Barrio Lenin Moreno.",-80.930677,-2.246779,La Costa,2/19/18,9:00:00 AM,2,19,2018,Long duration rain,Urban,0,0,0,0,0,1,0,0,0,0,,,,,28.0,,81.0,81.0,,,,,1,3,3,81.0,28.0,4.0,2018-02-19 14:00:00
1861,SNGRE_2021,SANTA ELENA,EC24,SALINAS,EC2402,SALINAS,EC240350,Avenida 40 entre calles 16 y 17,-80.9746,-2.2029,La Costa,2/2/13,1:40:00 AM,2,2,2013,Rain,Urban,0,0,0,0,0,1,0,0,0,0,,,,,3.0,,15.0,,,,,,1,3,3,15.0,3.0,3.0,2013-02-02 06:40:00
4984,SNGRE,SUCUMBIOS,EC21,PUTUMAYO,EC2103,PUERTO EL CARMEN DEL PUTUMAYO,EC210350,"Comunidades: Puerto El Carmen, Manzaya Uno, Manzaya dos, Aguas Blancas, Papaya Chica, Sandiyacu, Nueva Montepa, Lorenzo, San Rafael.",-75.862659,0.119346,El Oriente,6/23/19,12:00:00 AM,6,23,2019,Rain / Overflow,Heavy precipitation/ Urban/ Short duration rain,1,1,0,0,0,1,0,0,0,0,,,,,,235.0,936.0,,,,,,6,1,4,936.0,235.0,6.0,2019-06-23 05:00:00
4982,SNGRE,SUCUMBIOS,EC21,SHUSHUFINDI,EC2104,PANACOCHA,EC210452,Comunidad Panacocha,-76.062387,-0.470219,El Oriente,6/23/19,12:00:00 AM,6,23,2019,Rain / Overflow,Heavy precipitation/ Urban/ Short duration rain,1,1,0,0,0,1,0,0,0,0,,,,,,150.0,600.0,,,,,,6,1,4,600.0,150.0,6.0,2019-06-23 05:00:00
2423,Desinventar/SNGRE_2021,SUCUMBIOS,EC21,LAGO AGRIO,EC2101,NUEVA LOJA,EC210150,Calle Manuelita Saenz y 12 de Febrero,-76.8839,0.093,El Oriente,6/14/13,6:00:00 AM,6,14,2013,Rain,Heavy precipitation/ Urban/ Short duration rain,1,1,0,0,0,1,0,0,0,0,,,,,1.0,,,,7.0,,,,6,1,4,,1.0,,2013-06-14 11:00:00
2868,SNGRE,SUCUMBIOS,EC21,LAGO AGRIO,EC2101,NUEVA LOJA,EC210150,Av. Aguarico y Villacis Cesar.,-76.888193,0.071156,El Oriente,9/18/14,12:00:00 PM,9,18,2014,Rain ,Heavy precipitation/ Urban / Short duration rain,1,1,0,0,0,1,0,0,0,0,,,,,,,5.0,,,,,,6,1,4,5.0,,1.0,2014-09-18 17:00:00
1770,SNGRE_2021,ORELLANA,EC22,LA JOYA DE LOS SACHAS,EC2203,SAN CARLOS,EC220353,Arroyo Negro en la via Lago Agrio - Coca.,-76.892326,-0.398271,El Oriente,11/18/12,12:00:00 PM,11,18,2012,Rain,Heavy precipitation/ Short duration rain/ Urban,1,1,0,0,0,1,0,0,0,0,,,,,,,,,,,,,6,1,4,,,,2012-11-18 17:00:00
2766,Desinventar,ORELLANA,EC22,ORELLANA,EC2201,PTO. FCO. DE ORELLANA (EL COCA,EC220150,Alejandro Labaca y Camilo Torrano.,-77.012721,-0.445117,El Oriente,4/24/14,3:28:00 AM,4,24,2014,Rain ,Heavy precipitation/ Urban/ Short duration rain,1,1,0,0,0,1,0,0,0,0,,,,,1.0,,,,,,,,6,1,4,,1.0,,2014-04-24 08:28:00
2674,Desinventar/SNGRE_2021,SUCUMBIOS,EC21,CASCALES,EC2106,SEVILLA,EC210652,Comunidad Allishunko,-77.151373,0.081819,El Oriente,3/3/14,1:00:00 AM,3,3,2014,Rain / Overflow,Heavy precipitation / Small stream overflow,1,0,0,1,0,0,0,0,0,0,,,,,18.0,,88.0,88.0,,,,,6,1,4,88.0,18.0,4.0,2014-03-03 06:00:00
4332,SNGRE_2021,MORONA SANTIAGO,EC14,TIWINTZA,EC1412,SANTIAGO,EC141250,Seguridad a las personas que transitan por la via.,-78.216038,-2.9981663,La Sierra,11/23/17,11:30:00 AM,11,23,2017,Rain,Surface runoff,0,0,0,0,1,0,0,0,0,0,,,,,,,,,,,,,6,1,4,,,,2017-11-23 16:30:00
2902,Desinventar,PICHINCHA,EC17,PEDRO VICENTE MALDONADO,EC1708,PEDRO VICENTE MALDONADO,EC170850,Barrio Santa Clara,-79.057919,0.148949,La Costa,11/9/14,10:30:00 PM,11,9,2014,,Surface runoff,0,0,0,0,1,0,0,0,0,0,,,,,2.0,,5.0,5.0,,,,,6,1,4,5.0,2.0,1.0,2014-11-10 03:30:00
4714,Desinventar,ESMERALDAS,EC08,QUININDE,EC0804,LA UNION,EC080455,Barrio San Ramon,-79.399926,0.13666,La Costa,3/6/19,6:00:00 AM,3,6,2019,Rain / Overflow,Heavy precipitation/ Small stream overflow,1,0,0,1,0,0,0,0,0,0,1.0,,,,26.0,26.0,113.0,113.0,,23.0,,,6,1,4,113.0,26.0,5.0,2019-03-06 11:00:00
4562,Desinventar,ESMERALDAS,EC08,RIOVERDE,EC0807,RIOVERDE,EC080750,Varios sectores,-79.40791,1.065286,La Costa,1/7/19,6:24:00 AM,1,7,2019,Rain,Surface runoff,0,0,0,0,1,0,0,0,0,0,,,,,9.0,9.0,24.0,24.0,,,,,6,1,4,24.0,9.0,3.0,2019-01-07 11:24:00
5186,SNGRE_2021,ESMERALDAS,EC08,RIOVERDE,EC0807,RIOVERDE,EC080750,Vuelta Larga,-79.414405,1.06805,La Costa,2/29/20,10:17:00 PM,2,29,2020,Rain,Heavy precipitation/Small stream overflow,1,0,0,1,0,0,0,0,0,0,,,,,10.0,10.0,40.0,,,,,,6,1,4,40.0,10.0,3.0,2020-03-01 03:17:00
4587,Desinventar,LOS RIOS,EC12,QUEVEDO,EC1205,LA ESPERANZA,EC120555,La Italia,-79.415251,-0.966536,La Costa,1/11/19,3:00:00 AM,1,11,2019,Overflow,Heavy precipitation/ Small stream overflow,1,0,0,1,0,0,0,0,0,0,,,,,7.0,7.0,25.0,25.0,,,,,6,1,4,25.0,7.0,3.0,2019-01-11 08:00:00
5114,SNGRE_2021,ESMERALDAS,EC08,RIOVERDE,EC0807,RIOVERDE,EC080750,Punta Arena,-79.417967,1.069227,La Costa,2/15/20,8:41:00 AM,2,15,2020,Rain/Overflow,Heavy precipitation/Small stream overflow,1,0,0,1,0,0,0,0,0,0,,,,,2.0,2.0,9.0,,,,,,6,1,4,9.0,2.0,2.0,2020-02-15 13:41:00
4282,SNGRE,ESMERALDAS,EC08,QUININDE,EC0804,ROSA ZARATE (QUININDE),EC080450,MARCOS PROANO,-79.468744,0.335309,La Costa,6/20/17,1:44:00 AM,6,20,2017,Rain,Heavy precipitation/ Urban/ Short duration rain,1,1,0,0,0,1,0,0,0,0,,,,,,,2.0,,,,,,6,1,4,2.0,,1.0,2017-06-20 06:44:00
2765,SNGRE,ESMERALDAS,EC08,QUININDE,EC0804,ROSA ZARATE (QUININDE),EC080450,El Mirador (Union Manabita),-79.521741,0.299329,La Costa,4/23/14,2:00:00 AM,4,23,2014,Rain / Landslide,Surface runoff,0,0,0,0,1,0,0,0,0,0,,,,,,,,,,,,,6,1,4,,,,2014-04-23 07:00:00
4961,SNGRE,ESMERALDAS,EC08,QUININDE,EC0804,VICHE,EC080454,Recinto Palma Real,-79.548864,0.619405,La Costa,6/6/19,8:49:00 AM,6,6,2019,Rain,Surface runoff,0,0,0,0,1,0,0,0,0,0,,,,,,,,,,,,,6,1,4,,,,2019-06-06 13:49:00
3295,Desinventar,GUAYAS,EC09,SAN JACINTO DE YAGUACHI,EC0920,VIRGEN DE FATIMA,EC092056,Via a Milagro UE Eloy Alfaro,-79.670943,-2.264866,La Costa,1/12/16,7:00:00 AM,1,12,2016,Rain ,Heavy precipitation/ Urban/ Short duration rain,1,1,0,0,0,1,0,0,0,0,,,,,,,,,,,,,6,1,4,,,,2016-01-12 12:00:00
3457,Desinventar,GUAYAS,EC09,BALZAR,EC0904,BALZAR,EC090450,Barrio Amazonas,-79.909288,-1.367412,La Costa,2/24/16,7:00:00 AM,2,24,2016,Rain,Heavy precipitation/ Urban/ Short duration rain,1,1,0,0,0,1,0,0,0,0,,,,,6.0,,6.0,6.0,,,,,6,1,4,6.0,6.0,2.0,2016-02-24 12:00:00
2669,Desinventar/SNGRE_2021,LOJA,EC11,MACARA,EC1108,MACARA,EC110850,Barrio Amazonas,-80.007847,-4.299453,La Sierra,3/2/14,7:40:00 PM,3,2,2014,Rain,Heavy precipitation/ Urban/Short duration rain,1,1,0,0,0,1,0,0,0,0,,,,,1.0,,,,,,,,6,1,4,,1.0,,2014-03-03 00:40:00
4173,Desinventar,MANABI,EC13,ROCAFUERTE,EC1312,ROCAFUERTE,EC131250,Via Rocafuerte. El Ceibal,-80.448663,-0.928672,La Costa,4/10/17,2:00:00 AM,4,10,2017,Rain / Overflow,Heavy precipitation/Small stream overflow,1,0,0,1,0,0,0,0,0,0,,,,,,,,,,,,,6,1,4,,,,2017-04-10 07:00:00
2867,SNGRE,SUCUMBIOS,EC21,CUYABENO,EC2107,AGUAS NEGRAS,EC210752,B. central calle Cuyabeno a lado de la Iglesia Catolica  ,-76.301079,-0.132527,El Oriente,9/13/14,4:40:00 AM,9,13,2014,Rain ,Heavy precipitation / Short duration rain,1,1,0,0,0,0,0,0,0,0,,,,,,,5.0,,,,,,5,2,4,5.0,,1.0,2014-09-13 09:40:00
3167,Desinventar,PASTAZA,EC16,ARAJUNO,EC1604,CURARAY,EC160451,"JAIME ROLDOS, NUEVO SAN JOSE,  PLAYAS,  SAN JOSE DE CURARAY,",-76.955289,-1.385839,El Oriente,4/29/15,3:00:00 AM,4,29,2015,Rain / Overflow,Heavy precipitation/ Short duration rain,1,1,0,0,0,0,0,0,0,0,,,,,,,980.0,980.0,,,,176.0,5,2,4,980.0,,6.0,2015-04-29 08:00:00
3230,Desinventar/SNGRE_2021,MORONA SANTIAGO,EC14,MORONA,EC1401,MACAS,EC140150,Rio Upano,-78.115801,-2.3104656,La Sierra,7/22/15,4:30:00 PM,7,22,2015,Rain / Overflow,Heavy precipitation/ Short duration rain,1,1,0,0,0,0,0,0,0,0,,,,,,,20.0,20.0,,,,,5,2,4,20.0,,3.0,2015-07-22 21:30:00
2694,Desinventar,MORONA SANTIAGO,EC14,GUALAQUIZA,EC1402,BOMBOIZA,EC140253,Chuchumbletza  (a los limites con el Pangui de Zamora Chinch,-78.529309,-3.466342,La Sierra,3/13/14,4:00:00 AM,3,13,2014,Rain / Overflow,Heavy precipitation/ Short duration rain,1,1,0,0,0,0,0,0,0,0,,,,,6.0,,10.0,10.0,,,,,5,2,4,10.0,6.0,2.0,2014-03-13 09:00:00
4465,Desinventar,ESMERALDAS,EC08,ELOY ALFARO,EC0802,ANCHAYACU,EC080251,Varios sectores,-79.048649,0.951085,La Costa,5/19/18,7:00:00 PM,5,19,2018,Rain / Overflow,Heavy precipitation/ Short duration rain,1,1,0,0,0,0,0,0,0,0,,,,,20.0,,65.0,65.0,,,,,5,2,4,65.0,20.0,4.0,2018-05-20 00:00:00
3038,Desinventar,SANTO DOMINGO DE LOS TSACHILAS,EC23,SANTO DOMINGO,EC2301,RIO TOACHI,EC230150,Barrio el Evano 2 tras el Camal Municipal.,-79.121979,-0.181359,La Costa,3/20/15,12:40:00 AM,3,20,2015,Rain / Overflow,Heavy precipitation/ Short duration rain,1,1,0,0,0,0,0,0,0,0,,,,,1.0,,1.0,1.0,,,,,5,2,4,1.0,1.0,1.0,2015-03-20 05:40:00
2943,Desinventar,ESMERALDAS,EC08,RIOVERDE,EC0807,CHUMUNDE,EC080752,RECINTO LA HONDA,-79.414194,0.799881,La Costa,2/6/15,8:00:00 AM,2,6,2015,Rain ,Heavy precipitation/ Short duration rain,1,1,0,0,0,0,0,0,0,0,,,,,,,,,,,,,5,2,4,,,,2015-02-06 13:00:00
3559,Desinventar,LOS RIOS,EC12,VENTANAS,EC1207,VENTANAS,EC120750,Rcto. 24 de Mayo (La Poza) Rcto. La Paz de Dios,-79.446092,-1.456818,La Costa,3/31/16,10:08:00 PM,3,31,2016,Rain ,Heavy precipitation/ Short duration rain,1,1,0,0,0,0,0,0,0,0,,,,,9.0,,7.0,7.0,31.0,38.0,,,5,2,4,7.0,9.0,2.0,2016-04-01 03:08:00
3589,Desinventar,LOS RIOS,EC12,VENTANAS,EC1207,VENTANAS,EC120750,Cdla 24 de Mayo,-79.446092,-1.456818,La Costa,4/10/16,12:40:00 PM,4,10,2016,Rain ,Heavy precipitation/ Short duration rain,1,1,0,0,0,0,0,0,0,0,,,,,16.0,,12.0,12.0,48.0,60.0,,,5,2,4,12.0,16.0,3.0,2016-04-10 17:40:00
3605,Desinventar,LOS RIOS,EC12,VENTANAS,EC1207,10 DE NOVIEMBRE,EC120750,Cdla. Los Girasoles,-79.460608,-1.439279,La Costa,4/13/16,3:57:00 PM,4,13,2016,Rain / Overflow,Heavy precipitation/ Short duration rain,1,1,0,0,0,0,0,0,0,0,,,,,1.0,,15.0,15.0,,,,,5,2,4,15.0,1.0,3.0,2016-04-13 20:57:00
3835,Desinventar,LOS RIOS,EC12,VENTANAS,EC1207,10 DE NOVIEMBRE,EC120750,Juan Montesdeoca,-79.463906,-1.450951,La Costa,2/16/17,10:00:00 AM,2,16,2017,Rain,Heavy precipitation/ Short duration rain,1,1,0,0,0,0,0,0,0,0,,,,,11.0,,49.0,49.0,,,,,5,2,4,49.0,11.0,3.0,2017-02-16 15:00:00
2578,Desinventar/SNGRE_2021,LOS RIOS,EC12,VENTANAS,EC1207,VENTANAS,EC120750,Cdlas. Carlos Carriel y 20 de Noviembre,-79.469919,-1.44911,La Costa,1/23/14,7:00:00 AM,1,23,2014,Rain ,Heavy precipitation / Short duration rain,1,1,0,0,0,0,0,0,0,0,,,,,,,30.0,30.0,,,,,5,2,4,30.0,,3.0,2014-01-23 12:00:00
4659,SNGRE,LOS RIOS,EC12,BABA,EC1202,BABA,EC120250,Recinto:. El Sarten,-79.679282,-1.791528,La Costa,2/19/19,11:40:00 AM,2,19,2019,Rain,Heavy precipitation/ Short duration rain,1,1,0,0,0,0,0,0,0,0,,2.0,,,,15.0,47.0,,,,,,5,2,4,47.0,15.0,3.0,2019-02-19 16:40:00
3354,Desinventar,GUAYAS,EC09,SALITRE,EC0919,LA VICTORIA (NAUZA),EC091952,Av. Enrique Decker Acosta,-79.721395,-1.898612,La Costa,1/25/16,7:30:00 AM,1,25,2016,Rain,Heavy precipitation/ Short duration rain,1,1,0,0,0,0,0,0,0,0,,,,,,,,,,,,,5,2,4,,,,2016-01-25 12:30:00
4139,SNGRE,GUAYAS,EC09,SALITRE,EC0919,LA VICTORIA (NAUZA),EC091952,Recinto Nueva Victoria,-79.725675,-1.886943,La Costa,4/7/17,11:00:00 PM,4,7,2017,Rain ,Heavy precipitation/ Short duration rain,1,1,0,0,0,0,0,0,0,0,,,,,,,112.0,,,,,,5,2,4,112.0,,5.0,2017-04-08 04:00:00
4120,SNGRE,GUAYAS,EC09,SALITRE,EC0919,EL SALITRE (LAS RAMAS),EC091950,La Fortuna y Cooperativa de Vivienda Santa Marianita,-79.803223,-1.824834,La Costa,4/3/17,11:00:00 PM,4,3,2017,Rain ,Heavy precipitation/ Short duration rain,1,1,0,0,0,0,0,0,0,0,,,,,,,19.0,,,,,,5,2,4,19.0,,3.0,2017-04-04 04:00:00
3563,Desinventar,GUAYAS,EC09,BALAO,EC0903,BALAO,EC090350,Barrios Julio Loaiza Santa Clara y 9 de Octubre,-79.816774,-2.911654,La Costa,4/2/16,5:35:00 AM,4,2,2016,Rain,Heavy precipitation/ Short duration rain,1,1,0,0,0,0,0,0,0,0,,,,,3.0,,12.0,12.0,,,,,5,2,4,12.0,3.0,3.0,2016-04-02 10:35:00
1964,Desinventar/SNGRE_2021,GUAYAS,EC09,GUAYAQUIL,EC0901,TARQUI,EC090150,Norte de Guayaquil,-80.0453,-2.3506,La Costa,3/2/13,6:53:00 PM,3,2,2013,Rain,Heavy precipitation/ Short duration rain,1,1,0,0,0,0,0,0,0,0,3.0,,,57.0,187.0,,847.0,847.0,151.0,238.0,,,5,2,4,847.0,187.0,6.0,2013-03-02 23:53:00
2310,Desinventar/SNGRE_2021,GUAYAS,EC09,GUAYAQUIL,EC0901,TARQUI,EC090150,Flor de Bastion bloque 22 Mz 1333;1334 como referencia La Ladrill,-80.0453,-2.3506,La Costa,4/19/13,8:00:00 PM,4,19,2013,Rain,Heavy precipitation/ Short duration rain,1,1,0,0,0,0,0,0,0,0,,,,,12.0,,60.0,60.0,,,,,5,2,4,60.0,12.0,4.0,2013-04-20 01:00:00
2538,Desinventar,GUAYAS,EC09,GUAYAQUIL,EC0901,TARQUI,EC090150,"Flor de Bastion Bloque 7 MZ 3162, como referencia a 2 cuadra",-80.045331,-2.350555,La Costa,1/21/14,12:00:00 AM,1,21,2014,Rain ,Heavy precipitation/ Short duration rain,1,1,0,0,0,0,0,0,0,0,,,,,20.0,,,,,,,,5,2,4,,20.0,,2014-01-21 05:00:00
2601,Desinventar/SNGRE_2021,GUAYAS,EC09,GUAYAQUIL,EC0901,TARQUI,EC090150,Flor de Bastion Bloque 4 MZ 702 como referencia en el sector,-80.045331,-2.350555,La Costa,2/4/14,7:19:00 AM,2,4,2014,Rain,Heavy precipitation/ Short duration rain,1,1,0,0,0,0,0,0,0,0,,,,,,,,,,,,,5,2,4,,,,2014-02-04 12:19:00
3476,Desinventar,GUAYAS,EC09,GUAYAQUIL,EC0901,TARQUI,EC090150,Monte Sinai Coop. Ma. Paydal o Ciudad de Israel Mz. 53 y Mz.,-80.045331,-2.350555,La Costa,3/1/16,11:00:00 PM,3,1,2016,Rain,Heavy precipitation/ Short duration rain,1,1,0,0,0,0,0,0,0,0,,,,,2.0,,8.0,8.0,,,,,5,2,4,8.0,2.0,2.0,2016-03-02 04:00:00
3773,Desinventar,GUAYAS,EC09,GUAYAQUIL,EC0901,TARQUI,EC090150,Flor de Bastion (Varios bloques y Coop. Las Delicias),-80.045331,-2.350555,La Costa,2/3/17,8:00:00 PM,2,3,2017,Rain / Overflow,Heavy precipitation/ Short duration rain,1,1,0,0,0,0,0,0,0,0,,,,,15.0,,60.0,60.0,,,,,5,2,4,60.0,15.0,4.0,2017-02-04 01:00:00
3774,Desinventar,GUAYAS,EC09,GUAYAQUIL,EC0901,TARQUI,EC090150,Paraiso de la Flor (Varios Sectores),-80.045331,-2.350555,La Costa,2/3/17,8:00:00 PM,2,3,2017,Rain,Heavy precipitation/ Short duration rain,1,1,0,0,0,0,0,0,0,0,,,,,10.0,,40.0,40.0,,,,,5,2,4,40.0,10.0,3.0,2017-02-04 01:00:00
3775,Desinventar,GUAYAS,EC09,GUAYAQUIL,EC0901,TARQUI,EC090150,Cooperativa Sergio Toral (Varios Sectores),-80.045331,-2.350555,La Costa,2/3/17,8:00:00 PM,2,3,2017,Rain,Heavy precipitation/ Short duration rain,1,1,0,0,0,0,0,0,0,0,,,,,4.0,,16.0,16.0,,,,,5,2,4,16.0,4.0,3.0,2017-02-04 01:00:00
3737,Desinventar,EL ORO,EC07,ARENILLAS,EC0702,ARENILLAS,EC070250,Cdla. Las Mercedes,-80.063993,-3.55253,La Costa,1/25/17,11:00:00 AM,1,25,2017,Rain,Heavy precipitation/Short duration rain,1,1,0,0,0,0,0,0,0,0,,,,,1.0,,2.0,2.0,,,,,5,2,4,2.0,1.0,1.0,2017-01-25 16:00:00
3768,Desinventar,GUAYAS,EC09,ISIDRO AYORA,EC0928,ISIDRO AYORA,EC092850,"Camino que une la C. Cantonal con los recintos Carrizal, Ros",-80.138729,-1.847245,La Costa,2/3/17,6:00:00 AM,2,3,2017,Rain / Overflow,Heavy precipitation/ Short duration rain,1,1,0,0,0,0,0,0,0,0,,,,,,,,,,,2.0,,5,2,4,,,,2017-02-03 11:00:00
4077,SNGRE,GUAYAS,EC09,PEDRO CARBO,EC0914,SABANILLA,EC091452,"Sector Santa Cruz, Barrio Colombia, 9 de Octubre",-80.227505,-1.839949,La Costa,3/30/17,5:00:00 AM,3,30,2017,Rain,Heavy precipitation/ Short duration rain,1,1,0,0,0,0,0,0,0,0,,,,,,,16.0,,,,,,5,2,4,16.0,,3.0,2017-03-30 10:00:00
3742,Desinventar,GUAYAS,EC09,GUAYAQUIL,EC0901,POSORJA,EC090156,"Nuevo Amanecer, Brisas del Mar",-80.244907,-2.710752,La Costa,1/29/17,10:00:00 AM,1,29,2017,Rain,Heavy precipitation/ Short duration rain,1,1,0,0,0,0,0,0,0,0,,,,,6.0,,19.0,19.0,,,,,5,2,4,19.0,6.0,3.0,2017-01-29 15:00:00
4124,SNGRE,GUAYAS,EC09,GUAYAQUIL,EC0901,POSORJA,EC090156,Varios Sectores ,-80.250165,-2.703926,La Costa,4/3/17,6:50:00 AM,4,3,2017,Rain / Overflow,Heavy precipitation/ Short duration rain,1,1,0,0,0,0,0,0,0,0,,,,,,,245.0,,,7.0,,,5,2,4,245.0,,5.0,2017-04-03 11:50:00
3458,Desinventar,GUAYAS,EC09,GUAYAQUIL,EC0901,POSORJA,EC090156,Varios Sectores ,-80.251052,-2.709779,La Costa,2/24/16,8:00:00 PM,2,24,2016,Rain,Heavy precipitation/ Short duration rain,1,1,0,0,0,0,0,0,0,0,,,,,,,,,,,,,5,2,4,,,,2016-02-25 01:00:00
4270,SNGRE,MANABI,EC13,PAJAN,EC1310,CAMPOZANO (LA PALMA DE PAJAN),EC131051,Varios Sectores,-80.380657,-1.60219,La Costa,5/22/17,1:05:00 AM,5,22,2017,Rain / Overflow,Heavy precipitation/ Short duration rain,1,1,0,0,0,0,0,0,0,0,,,,,,,256.0,,8.0,,,,5,2,4,256.0,,5.0,2017-05-22 06:05:00
3492,Desinventar,LOJA,EC11,ZAPOTILLO,EC1113,CAZADEROS (CAB EN MANGAURCO),EC111351,Varios Sectores,-80.388847,-4.103474,La Costa,3/4/16,11:30:00 AM,3,4,2016,Rain ,Heavy precipitation/ Short duration rain,1,1,0,0,0,0,0,0,0,0,,,,,2.0,,7.0,7.0,,,,,5,2,4,7.0,2.0,2.0,2016-03-04 16:30:00
3893,Desinventar,GUAYAS,EC09,PLAYAS,EC0921,GENERAL VILLAMIL (PLAYAS),EC092150,Varios Sectores (Barrio Aguas Verdes- La Planta- Altamira),-80.389684,-2.632473,La Costa,3/3/17,6:15:00 PM,3,3,2017,Rain / Overflow,Heavy precipitation/ Short duration rain,1,1,0,0,0,0,0,0,0,0,,,,1.0,19.0,,56.0,56.0,60.0,60.0,,,5,2,4,56.0,19.0,4.0,2017-03-03 23:15:00
4687,SNGRE,MANABI,EC13,PORTOVIEJO,EC1301,PORTOVIEJO,EC130150,12 De Marzo. Mejia,-80.461845,-0.989874,La Costa,2/26/19,6:42:00 AM,2,26,2019,Rain / Overflow,Heavy precipitation/ Short duration rain,1,1,0,0,0,0,0,0,0,0,,,,,,,,,,,,,5,2,4,,,,2019-02-26 11:42:00
3594,Desinventar,GUAYAS,EC09,PLAYAS,EC0921,GENERAL VILLAMIL (PLAYAS),EC092150,Via de acceso a Puerto Engabao,-80.479861,-2.55596,La Costa,4/11/16,7:40:00 AM,4,11,2016,Rain / Overflow,Heavy precipitation/ Short duration rain,1,1,0,0,0,0,0,0,0,0,,,,,,,,,,,,,5,2,4,,,,2016-04-11 12:40:00
3793,Desinventar,SANTA ELENA,EC24,SALINAS,EC2403,ANCONCITO,EC240351,"las Conchas, Nuevo Amanecer",-80.89351,-2.327178,La Costa,2/8/17,4:00:00 AM,2,8,2017,Rain,Heavy precipitation/Short duration rain,1,1,0,0,0,0,0,0,0,0,,,,2.0,1.0,,13.0,13.0,2.0,,,,5,2,4,13.0,1.0,3.0,2017-02-08 09:00:00
1784,SNGRE_2021,SUCUMBIOS,EC21,SHUSHUFINDI,EC2104,SHUSHUFINDI,EC210450,Centro de la ciudad,-76.6237,-0.153389,El Oriente,12/2/12,1:00:00 AM,12,2,2012,Rain,Heavy precipitation/ Short duration rain,1,1,0,0,0,0,0,0,0,0,,,,,2.0,,,,,,,,5,3,4,,2.0,,2012-12-02 06:00:00
1772,SNGRE_2021,ORELLANA,EC22,ORELLANA,EC2201,TARACOA (CAB EN NUEVA ESPERANZ,EC220152,Barrio El Cisne y Barrio La Libertad,-76.782064,-0.543348,El Oriente,11/19/12,10:00:00 AM,11,19,2012,Rain,Heavy precipitation/ Short duration rain,1,1,0,0,0,0,0,0,0,0,,,,,14.0,,91.0,,,,,,5,3,4,91.0,14.0,4.0,2012-11-19 15:00:00
2914,Desinventar,PASTAZA,EC16,PASTAZA,EC1601,SARAYACU,EC160161,sapino,-77.433589,-1.802077,La Sierra,12/15/14,1:30:00 PM,12,15,2014,Rain / Overflow,Heavy precipitation/ Short duration rain,1,1,0,0,0,0,0,0,0,0,,,,,,,34.0,34.0,,,,,5,3,4,34.0,,3.0,2014-12-15 18:30:00
2685,Desinventar,MORONA SANTIAGO,EC14,MORONA,EC1401,MACAS,EC140150,Barrio Sangay,-78.160205,-2.299902,La Sierra,3/9/14,12:45:00 AM,3,9,2014,Rain ,Heavy precipitation/ Short duration rain,1,1,0,0,0,0,0,0,0,0,,,,,1.0,,4.0,,,,,,5,3,4,4.0,1.0,1.0,2014-03-09 05:45:00
3439,Desinventar,ZAMORA CHINCHIPE,EC19,EL PANGUI,EC1906,EL GUISME,EC190651,Los Achales,-78.556496,-3.597017,La Sierra,2/10/16,6:06:00 AM,2,10,2016,Rain / Overflow,Small stream overflow,0,0,0,1,0,0,0,0,0,0,,,,,1.0,,8.0,8.0,,,,,4,3,4,8.0,1.0,2.0,2016-02-10 11:06:00
4178,Desinventar,ZAMORA CHINCHIPE,EC19,EL PANGUI,EC1906,EL PANGUI,EC190650,Callamaza,-78.585219,-3.621345,La Sierra,4/12/17,12:00:00 AM,4,12,2017,Rain / Overflow,Small stream overflow,0,0,0,1,0,0,0,0,0,0,,,,,1.0,,8.0,8.0,,,,,4,3,4,8.0,1.0,2.0,2017-04-12 05:00:00
4534,SNGRE,ZAMORA CHINCHIPE,EC19,EL PANGUI,EC1906,EL PANGUI,EC190650,Jorge Mosquera,-78.591041,-3.620918,La Sierra,11/22/18,12:49:00 AM,11,22,2018,Rain / Overflow,Small stream overflow,0,0,0,1,0,0,0,0,0,0,,,,,,,20.0,,,,,,4,3,4,20.0,,3.0,2018-11-22 05:49:00
3296,Desinventar,ZAMORA CHINCHIPE,EC19,NANGARITZA,EC1903,ZURMI,EC190351,Nuevo San Lucas,-78.658325,-4.22938,La Sierra,1/12/16,2:00:00 PM,1,12,2016,Rain / Overflow,Small stream overflow,0,0,0,1,0,0,0,0,0,0,,,,5.0,3.0,,22.0,22.0,7.0,,,,4,3,4,22.0,3.0,3.0,2016-01-12 19:00:00
4266,Desinventar,ZAMORA CHINCHIPE,EC19,CENTINELA DEL CONDOR,EC1907,ZUMBI,EC190750,El Dorado,-78.744522,-3.956155,La Sierra,5/17/17,4:45:00 AM,5,17,2017,Rain / Overflow,Small stream overflow,0,0,0,1,0,0,0,0,0,0,,,,,1.0,,2.0,2.0,,,,,4,3,4,2.0,1.0,1.0,2017-05-17 09:45:00
3726,Desinventar,ESMERALDAS,EC08,SAN LORENZO,EC0805,CALDERON,EC080553,Cabecera Parroquial Calderon,-78.764662,1.171783,La Costa,1/20/17,7:34:00 AM,1,20,2017,Rain,Short duration rain/ urban,0,1,0,0,0,1,0,0,0,0,,,,,74.0,,387.0,387.0,,,,,4,3,4,387.0,74.0,5.0,2017-01-20 12:34:00
4999,SNGRE_2021,ZAMORA CHINCHIPE,EC19,CENTINELA DEL CONDOR,EC1907,ZUMBI,EC190750,Zumbi - Nanguipa Bajo,-78.770926,-3.8882129,La Sierra,7/27/19,4:25:00 PM,7,27,2019,Rain,Small stream overflow,0,0,0,1,0,0,0,0,0,0,,,,,1.0,3.0,7.0,,,,,,4,3,4,7.0,3.0,2.0,2019-07-27 21:25:00
4340,SNGRE/Desinventar,ZAMORA CHINCHIPE,EC19,CENTINELA DEL CONDOR,EC1907,ZUMBI,EC190750,Barrio Jaime Roldos,-78.779995,-3.893963,La Sierra,12/25/17,10:00:00 PM,12,25,2017,Rain / Overflow,Small stream overflow,0,0,0,1,0,0,0,0,0,0,,,,,,,65.0,65.0,,,,,4,3,4,65.0,,4.0,2017-12-26 03:00:00
4701,Desinventar,AZUAY,EC01,SANTA ISABEL,EC0108,SANTA ISABEL (CHAGUARURCO),EC010850,Shushupali Grande,-79.33431,-3.340107,La Sierra,3/1/19,7:30:00 PM,3,1,2019,Rain / Overflow,Small stream overflow,0,0,0,1,0,0,0,0,0,0,,,,,1.0,1.0,5.0,5.0,,,,,4,3,4,5.0,1.0,1.0,2019-03-02 00:30:00
3830,Desinventar,LOS RIOS,EC12,MONTALVO,EC1203,MONTALVO,EC120350,Ciudadela San Miguel Calle Moises Encalada y Quito,-79.339502,-1.851603,La Costa,2/13/17,10:30:00 PM,2,13,2017,Rain / Overflow,Heavy precipitation/ Short duration rain,1,1,0,0,0,0,0,0,0,0,,,,,2.0,,3.0,3.0,,,,,5,3,4,3.0,2.0,1.0,2017-02-14 03:30:00
2545,Desinventar/SNGRE_2021,GUAYAS,EC09,EL TRIUNFO,EC0909,EL TRIUNFO,EC090950,Patron Santiago,-79.360126,-2.294968,La Costa,1/22/14,9:00:00 AM,1,22,2014,Rain / Overflow / Landslide,Small stream overflow,0,0,0,1,0,0,0,0,0,0,,,,,1.0,,3.0,3.0,,,,,4,3,4,3.0,1.0,1.0,2014-01-22 14:00:00
4919,Desinventar,LOS RIOS,EC12,BUENA FE,EC1210,PATRICIA PILAR,EC121051,Sector Numero 7 calle ingreso al cementerio.,-79.370722,-0.57778,La Costa,4/20/19,11:45:00 PM,4,20,2019,Rain,Heavy precipitation/ Short duration rain,1,1,0,0,0,0,0,0,0,0,,,,,1.0,1.0,3.0,3.0,,3.0,,,5,3,4,3.0,1.0,1.0,2019-04-21 04:45:00
2945,Desinventar,ESMERALDAS,EC08,RIOVERDE,EC0807,CHUMUNDE,EC080752,RECINTO BUSINGA,-79.409473,0.74705,La Costa,2/6/15,7:00:00 AM,2,6,2015,Rain / Overflow,Heavy precipitation/ Short duration rain,1,1,0,0,0,0,0,0,0,0,,,,,1.0,,7.0,7.0,,,,,5,3,4,7.0,1.0,2.0,2015-02-06 12:00:00
1890,SNGRE_2021,LOS RIOS,EC12,BABAHOYO,EC1201,LA UNION,EC120155,Las Malvinas - Los Roblecitos ,-79.431,-1.7511,La Costa,2/9/13,3:30:00 PM,2,9,2013,Overflow,River bank failure,0,0,0,0,0,0,0,1,0,0,,,,,30.0,,120.0,,,,400.0,,4,3,4,120.0,30.0,5.0,2013-02-09 20:30:00
4365,Desinventar,LOS RIOS,EC12,BABAHOYO,EC1201,LA UNION,EC120155,La Esperanza,-79.445039,-1.754586,La Costa,2/9/18,12:37:00 PM,2,9,2018,Rain / Overflow,Heavy precipitation/ Short duration rain,1,1,0,0,0,0,0,0,0,0,,,,,,,136.0,,,,416.0,14.0,5,3,4,136.0,,5.0,2018-02-09 17:37:00
4390,Desinventar,LOS RIOS,EC12,BABAHOYO,EC1201,CARACOL,EC120152,La Uva,-79.448627,-1.685186,La Costa,2/24/18,6:00:00 AM,2,24,2018,Rain ,Heavy precipitation/ Short duration rain,1,1,0,0,0,0,0,0,0,0,,,,,1.0,,,5.0,,5.0,130.0,39.0,5,3,4,5.0,1.0,1.0,2018-02-24 11:00:00
4660,SNGRE,LOS RIOS,EC12,BABAHOYO,EC1201,CARACOL,EC120152,Recinto:. San Vicente,-79.463619,-1.672238,La Costa,2/19/19,1:00:00 PM,2,19,2019,Rain,Heavy precipitation/ Short duration rain,1,1,0,0,0,0,0,0,0,0,,,,,,3.0,9.0,,,,,,5,3,4,9.0,3.0,2.0,2019-02-19 18:00:00
2983,Desinventar,GUAYAS,EC09,EL TRIUNFO,EC0909,EL TRIUNFO,EC090950,Rcto. San Francisco,-79.475497,-2.331517,La Costa,2/24/15,7:00:00 AM,2,24,2015,Rain,Heavy precipitation/ Short duration rain,1,1,0,0,0,0,0,0,0,0,,,,,5.0,,24.0,24.0,,,,,5,3,4,24.0,5.0,3.0,2015-02-24 12:00:00
4413,Desinventar,LOS RIOS,EC12,BABAHOYO,EC1201,CLEMENTE BAQUERIZO,EC120150,Cdla. La Ventura,-79.508103,-1.813714,La Costa,3/17/18,2:10:00 PM,3,17,2018,Rain,Heavy precipitation/ Short duration rain,1,1,0,0,0,0,0,0,0,0,,,,,18.0,,60.0,54.0,,,,,5,3,4,60.0,18.0,4.0,2018-03-17 19:10:00
3008,Desinventar,GUAYAS,EC09,EL TRIUNFO,EC0909,EL TRIUNFO,EC090950,Cdla. El Paraiso,-79.518364,-2.309747,La Costa,3/17/15,7:40:00 AM,3,17,2015,Rain / Overflow,Urban/ Small stream overflow,0,0,0,1,0,1,0,0,0,0,,,,,2.0,,9.0,9.0,9.0,,,,5,3,4,9.0,2.0,2.0,2015-03-17 12:40:00
4763,Desinventar,LOS RIOS,EC12,BABAHOYO,EC1201,CLEMENTE BAQUERIZO,EC120150,Ciudadela la Aventurra,-79.52343,-1.800167,La Costa,3/13/19,12:30:00 PM,3,13,2019,Rain,Heavy precipitation/ Short duration rain,1,1,0,0,0,0,0,0,0,0,,,,,1.0,4.0,19.0,19.0,,3.0,,3.0,5,3,4,19.0,4.0,3.0,2019-03-13 17:30:00
4848,Desinventar,LOS RIOS,EC12,BABAHOYO,EC1201,EL SALTO,EC120150,Jorge Yanez Icaza,-79.536838,-1.795492,La Costa,3/21/19,3:22:00 PM,3,21,2019,Rain,Heavy precipitation/ Short duration rain,1,1,0,0,0,0,0,0,0,0,,,,,3.0,3.0,13.0,13.0,,,,,5,3,4,13.0,3.0,3.0,2019-03-21 20:22:00
1831,Desinventar/SNGRE_2021,GUAYAS,EC09,NARANJAL,EC0911,NARANJAL,EC091150,Jambeli Quirola-Santa Carla,-79.6417,-2.7115,La Costa,1/24/13,7:00:00 AM,1,24,2013,Rain / Overflow,Heavy precipitation/ Short duration rain,1,1,0,0,0,0,0,0,0,0,,,,,,,,,,,200.0,,5,3,4,,,,2013-01-24 12:00:00
1766,SNGRE_2021,LOJA,EC11,PALTAS,EC1109,CATACOCHA,EC110950,Barrio Lourdes - Calles Juan Benigno Ulla y Naun Briones,-79.685137,-4.103335,La Sierra,11/16/12,9:00:00 PM,11,16,2012,Rain,Heavy precipitation/ Short duration rain,1,1,0,0,0,0,0,0,0,0,,,,,1.0,,12.0,,,,,,5,3,4,12.0,1.0,3.0,2012-11-17 02:00:00
1824,Desinventar/SNGRE_2021,GUAYAS,EC09,BALAO,EC0903,BALAO,EC090350,Cdla Barrio Nuevo; margen derecha del rio Balao,-79.7341,-2.8926,La Costa,1/24/13,12:00:00 PM,1,24,2013,Failure,River Bank Failure,0,0,0,0,0,0,0,1,0,0,,,,,1.0,,8.0,8.0,,,,,4,3,4,8.0,1.0,2.0,2013-01-24 17:00:00
2853,Desinventar,GUAYAS,EC09,GUAYAQUIL,EC0901,FEBRES CORDERO,EC090150,Callejon Colon y la 18ava.,-79.913237,-2.190554,La Costa,7/14/14,8:00:00 PM,7,14,2014,,Small stream overflow,0,0,0,1,0,0,0,0,0,0,,,,,6.0,,20.0,20.0,,,,,4,3,4,20.0,6.0,3.0,2014-07-15 01:00:00
2535,Desinventar/SNGRE_2021,GUAYAS,EC09,GUAYAQUIL,EC0901,TARQUI,EC090150,Mapasingue Este Cooperativa 26 de Febrero MZ 245,-79.93039,-2.15679,La Costa,1/21/14,12:00:00 AM,1,21,2014,Rain ,Heavy precipitation/ Short duration rain,1,1,0,0,0,0,0,0,0,0,,,,,2.0,,,,,,,,5,3,4,,2.0,,2014-01-21 05:00:00
2445,Desinventar/SNGRE_2021,GUAYAS,EC09,GUAYAQUIL,EC0901,FEBRES CORDERO,EC090150,La 12 ava y la F;  a orillas del Estero Puerto Liza,-79.9318,-2.2212,La Costa,7/24/13,9:08:00 AM,7,24,2013,,Small stream overflow,0,0,0,1,0,0,0,0,0,0,,,,,7.0,,33.0,33.0,,,,,4,3,4,33.0,7.0,3.0,2013-07-24 14:08:00
2534,Desinventar,GUAYAS,EC09,GUAYAQUIL,EC0901,TARQUI,EC090150,Mapasingue Oeste Ciudadela Guayas 2 entre la 5ta y la 6ta co,-79.932723,-2.162933,La Costa,1/21/14,12:00:00 AM,1,21,2014,Rain,Heavy precipitation/ Short duration rain,1,1,0,0,0,0,0,0,0,0,,,,,,,,4.0,,,,,5,3,4,4.0,,1.0,2014-01-21 05:00:00
2506,Desinventar/SNGRE_2021,GUAYAS,EC09,GUAYAQUIL,EC0901,TARQUI,EC090150,Flor de Bastion Sector San Eduardo Bloque 22 Mz 1444/1345/13,-79.952113,-2.130545,La Costa,1/6/14,8:00:00 PM,1,6,2014,Rain,Heavy precipitation/ Short duration rain,1,1,0,0,0,0,0,0,0,0,,,,,2.0,,6.0,6.0,,,,,5,3,4,6.0,2.0,2.0,2014-01-07 01:00:00
2505,Desinventar/SNGRE_2021,GUAYAS,EC09,GUAYAQUIL,EC0901,TARQUI,EC090150,Lomas de la Florida MZ 930 solares 14 y 15 como referencia e,-79.952167,-2.130446,La Costa,1/6/14,9:00:00 PM,1,6,2014,Rain ,Heavy precipitation/ Short duration rain,1,1,0,0,0,0,0,0,0,0,,,,,1.0,,7.0,7.0,,,,,5,3,4,7.0,1.0,2.0,2014-01-07 02:00:00
2536,Desinventar,GUAYAS,EC09,GUAYAQUIL,EC0901,TARQUI,EC090150,Lomas de la Florida MZ 929,-79.952436,-2.132029,La Costa,1/21/14,12:00:00 AM,1,21,2014,Rain,Heavy precipitation/ Short duration rain,1,1,0,0,0,0,0,0,0,0,,,,,8.0,,,,,,,,5,3,4,,8.0,,2014-01-21 05:00:00
2035,SNGRE_2021,GUAYAS,EC09,GUAYAQUIL,EC0901,JUAN GOMEZ RENDON (PROGRESO),EC090152,Via a  la costa Km. 90 sector Cerecita,-80.3307,-2.3985,La Costa,3/6/13,8:15:00 AM,3,6,2013,Rain/ Overflow,Small stream overflow,0,0,0,1,0,0,0,0,0,0,,,,,6.0,,30.0,,,,,,4,3,4,30.0,6.0,3.0,2013-03-06 13:15:00
3189,Desinventar,GUAYAS,EC09,PLAYAS,EC0921,GENERAL VILLAMIL (PLAYAS),EC092150,Varios Sectores,-80.421646,-2.544356,La Costa,5/15/15,6:00:00 AM,5,15,2015,Rain / Overflow,Heavy precipitation/ Short duration rain,1,1,0,0,0,0,0,0,0,0,,,,,2.0,,14.0,14.0,,,,,5,3,4,14.0,2.0,3.0,2015-05-15 11:00:00
3442,Desinventar,MANABI,EC13,24 DE MAYO,EC1316,SUCRE,EC131650,Los Algodones,-80.423415,-1.303305,La Costa,2/12/16,2:30:00 PM,2,12,2016,Rain ,Heavy precipitation/ Short duration rain,1,1,0,0,0,0,0,0,0,0,,,,,,,,,,,25.0,,5,3,4,,,,2016-02-12 19:30:00
4269,SNGRE,MANABI,EC13,PAJAN,EC1310,PAJAN,EC131050,Varios Sectores,-80.424576,-1.553079,La Costa,5/21/17,9:12:00 PM,5,21,2017,Rain ,Heavy precipitation/Short duration rain,1,1,0,0,0,0,0,0,0,0,,,,,,,340.0,,,,,,5,3,4,340.0,,5.0,2017-05-22 02:12:00
4149,Desinventar,MANABI,EC13,SANTA ANA,EC1313,LODANA,EC131350,Varios Sectores,-80.433872,-1.189396,La Costa,4/8/17,4:00:00 AM,4,8,2017,Rain ,Small stream overflow,0,0,0,1,0,0,0,0,0,0,,,,,100.0,,400.0,40.0,,,,,4,3,4,400.0,100.0,5.0,2017-04-08 09:00:00
4170,SNGRE,MANABI,EC13,SANTA ANA,EC1313,LODANA,EC131350,"Via 24 de mayo, Entrada a Lodana via Portoviejo -  Santa Ana, Facultad de Ingenieria Agricola UTM",-80.433872,-1.189396,La Costa,4/10/17,11:00:00 PM,4,10,2017,Rain / Overflow,Small stream overflow,0,0,0,1,0,0,0,0,0,0,,,,,,,4000.0,,,,,,4,3,4,4000.0,,,2017-04-11 04:00:00
3756,Desinventar,MANABI,EC13,SUCRE,EC1314,CHARAPOTO,EC131453,Varios Sectores ,-80.487942,-0.836969,La Costa,2/2/17,2:00:00 AM,2,2,2017,Rain ,Heavy precipitation/ Short duration rain,1,1,0,0,0,0,0,0,0,0,,,,,500.0,,2000.0,2000.0,,,,,5,3,4,2000.0,500.0,6.0,2017-02-02 07:00:00
1990,Desinventar/SNGRE_2021,SANTA ELENA,EC24,SANTA ELENA,EC2401,MANGLARALTO,EC240154,Comuna 2 Mangas - Salanguillo,-80.6929,-1.7928,La Costa,3/3/13,7:10:00 PM,3,3,2013,Rain / Overflow,Heavy precipitation/ Short duration rain,1,1,0,0,0,0,0,0,0,0,,,,,,,200.0,200.0,,,,,5,3,4,200.0,,5.0,2013-03-04 00:10:00
3375,Desinventar,SANTA ELENA,EC24,SANTA ELENA,EC2401,MANGLARALTO,EC240154,Comuna Olon Unidad Educativa Emiliano Crespo Toral ,-80.745662,-1.80304,La Costa,1/25/16,6:36:00 AM,1,25,2016,Rain ,Heavy precipitation/ Short duration rain,1,1,0,0,0,0,0,0,0,0,,,,,,,,,,,,,5,3,4,,,,2016-01-25 11:36:00
5152,SNGRE_2021,SANTA ELENA,EC24,SANTA ELENA,EC2401,SANTA ELENA,EC240150,"Barrios 11 de Enero, Marques de La Plata, 12 de Octubre, Alborada, 24 de Julio, El Faro.",-80.8602,-2.224578,La Costa,2/24/20,4:00:00 AM,2,24,2020,Rain,Heavy precipitation/Short duration rain,1,1,0,0,0,0,0,0,0,0,,,,,7.0,7.0,28.0,,,,,,5,3,4,28.0,7.0,3.0,2020-02-24 09:00:00
1860,SNGRE_2021,SANTA ELENA,EC24,LA LIBERTAD,EC2402,LA LIBERTAD,EC240250,Jaime Roldos,-80.8911,-2.2199,La Costa,2/2/13,10:00:00 AM,2,2,2013,Rain,Heavy precipitation/ Short duration rain,1,1,0,0,0,0,0,0,0,0,,,,,2.0,,3.0,,,,,,5,3,4,3.0,2.0,1.0,2013-02-02 15:00:00
5144,SNGRE_2021,SANTA ELENA,EC24,LA LIBERTAD,EC2402,LA LIBERTAD,EC240250,Varios sectores,-80.904044,-2.231384,La Costa,2/24/20,4:00:00 AM,2,24,2020,Rain,Heavy precipitation/Short duration rain,1,1,0,0,0,0,0,0,0,0,,,,,26.0,26.0,104.0,,,,,,5,3,4,104.0,26.0,5.0,2020-02-24 09:00:00
4008,SNGRE,SANTA ELENA,EC24,LA LIBERTAD,EC2402,LA LIBERTAD,EC240250,Barrio Puerto Rico,-80.904633,-2.222757,La Costa,3/24/17,3:00:00 AM,3,24,2017,Rain ,Heavy precipitation/ Short duration rain,1,1,0,0,0,0,0,0,0,0,,,,,,,12.0,,,,,,5,3,4,12.0,,3.0,2017-03-24 08:00:00
5139,SNGRE_2021,SANTA ELENA,EC24,SALINAS,EC2403,JOSE LUIS TAMAYO (MUEY),EC240352,"Cdla Santa Paula, Puertas del Sol, Vinicio Yagual, Brisas del Mar, Vicente Rocafuerte, La Carolina, Via a Punta Carnero.",-80.931361,-2.237634,La Costa,2/24/20,4:00:00 AM,2,24,2020,Rain,Heavy precipitation/Short duration rain,1,1,0,0,0,0,0,0,0,0,,,,,7.0,7.0,28.0,,,,,,5,3,4,28.0,7.0,3.0,2020-02-24 09:00:00
5154,SNGRE_2021,SANTA ELENA,EC24,SALINAS,EC2403,SALINAS,EC240350,Vicente Rocafuerte-Cdla. Frank Vargas,-80.962475,-2.207669,La Costa,2/24/20,4:00:00 AM,2,24,2020,Rain,Heavy precipitation/Short duration rain,1,1,0,0,0,0,0,0,0,0,,,,,2.0,2.0,8.0,,,,,,5,3,4,8.0,2.0,2.0,2020-02-24 09:00:00
5135,SNGRE_2021,SANTA ELENA,EC24,SALINAS,EC2403,SALINAS,EC240350,Carlos Espinoza Larrea- Pueblo Nuevo,-80.967403,-2.208544,La Costa,2/24/20,4:00:00 AM,2,24,2020,Rain,Heavy precipitation/Short duration rain,1,1,0,0,0,0,0,0,0,0,,,,,1.0,1.0,4.0,,,,,,5,3,4,4.0,1.0,1.0,2020-02-24 09:00:00
5137,SNGRE_2021,SANTA ELENA,EC24,SALINAS,EC2403,SALINAS,EC240350,Gral. Alberto Enriquez Gallo- Coreza,-80.968822,-2.20659,La Costa,2/24/20,4:00:00 AM,2,24,2020,Rain,Heavy precipitation/Short duration rain,1,1,0,0,0,0,0,0,0,0,,,,,2.0,2.0,8.0,,,,,,5,3,4,8.0,2.0,2.0,2020-02-24 09:00:00
2845,Desinventar,SUCUMBIOS,EC21,LAGO AGRIO,EC2101,GENERAL FARFAN,EC210153,Union Balsarena,-76.775399,0.230175,El Oriente,6/30/14,10:00:00 PM,6,30,2014,Rain / Overflow,Heavy precipitation,1,0,0,0,0,0,0,0,0,0,,,,,8.0,,53.0,53.0,,,,,2,4,4,53.0,8.0,4.0,2014-07-01 03:00:00
3649,Desinventar,ORELLANA,EC22,LA JOYA DE LOS SACHAS,EC2203,ENOKANQUI (CAB EN EL PARAISO),EC220351,Centro de la parroquia,-76.84236,-0.223012,El Oriente,7/17/16,4:00:00 PM,7,17,2016,Rain,Urban,0,0,0,0,0,1,0,0,0,0,,,,,1.0,,5.0,5.0,,,,,1,4,4,5.0,1.0,1.0,2016-07-17 21:00:00
3700,Desinventar,ORELLANA,EC22,ORELLANA,EC2201,SAN LUIS DE ARMENIA,EC220161,"Comuna Patasyacu, Alto Manduro, Estrellayacu",-77.029965,-0.504537,El Oriente,1/7/17,3:34:00 AM,1,7,2017,Rain ,Heavy precipitation,1,0,0,0,0,0,0,0,0,0,,,,,,,,,,,38.0,38.0,2,4,4,,,,2017-01-07 08:34:00
2907,Desinventar,ORELLANA,EC22,ORELLANA,EC2201,SAN LUIS DE ARMENIA,EC220161,Comunidad Manduro Yaku,-77.059584,-0.505128,El Oriente,11/14/14,12:00:00 AM,11,14,2014,Rain / Overflow,Short duration rain,0,1,0,0,0,0,0,0,0,0,,,,,,,3.0,3.0,,,0.25,,3,4,4,3.0,,1.0,2014-11-14 05:00:00
2878,Desinventar,PASTAZA,EC16,ARAJUNO,EC1604,CURARAY,EC160451,Comunidad Pandanuque,-77.459649,-1.486189,La Sierra,10/11/14,5:00:00 PM,10,11,2014,Rain ,Heavy precipitation,1,0,0,0,0,0,0,0,0,0,,,,,16.0,,74.0,74.0,,,5.0,,2,4,4,74.0,16.0,4.0,2014-10-11 22:00:00
2406,Desinventar/SNGRE_2021,PASTAZA,EC16,PASTAZA,EC1601,SARAYACU,EC160161,Comunidad de MASHIENT y SHAIMI,-77.5898,-1.6299,La Sierra,5/26/13,2:00:00 AM,5,26,2013,Rain / Overflow,Heavy precipitation ,1,0,0,0,0,0,0,0,0,0,,,,,18.0,,,,,,,,2,4,4,,18.0,,2013-05-26 07:00:00
2865,Desinventar,NAPO,EC15,TENA,EC1501,PUERTO MISAHUALLI,EC150155,Puni Bocana,-77.638009,-1.108633,La Sierra,9/12/14,2:00:00 AM,9,12,2014,Rain / Overflow,Heavy precipitation,1,0,0,0,0,0,0,0,0,0,,,,75.0,,,505.0,505.0,,,201.6,10.0,2,4,4,505.0,,6.0,2014-09-12 07:00:00
2861,Desinventar,PASTAZA,EC16,ARAJUNO,EC1604,ARAJUNO,EC160450,"Comunidad 20 de Marzo, Killukaspi",-77.683514,-1.169,La Sierra,9/12/14,11:44:00 AM,9,12,2014,Rain / Overflow,Heavy precipitation,1,0,0,0,0,0,0,0,0,0,,,,,,,100.0,100.0,,,,,2,4,4,100.0,,4.0,2014-09-12 16:44:00
2875,Desinventar,PASTAZA,EC16,ARAJUNO,EC1604,ARAJUNO,EC160450,Comunidad Killu Kaspi,-77.684349,-1.191446,La Sierra,10/11/14,6:00:00 AM,10,11,2014,Rain / Overflow,Heavy precipitation,1,0,0,0,0,0,0,0,0,0,,,,1.0,5.0,,1805.0,1805.0,,21.0,,102.0,2,4,4,1805.0,5.0,6.0,2014-10-11 11:00:00
4444,Desinventar,PASTAZA,EC16,ARAJUNO,EC1604,ARAJUNO,EC160450,Barrio Central / REF. Cerca de la antigua pista,-77.686728,-1.234938,La Sierra,4/29/18,6:00:00 PM,4,29,2018,Rain ,Urban/ Short duration rain,0,1,0,0,0,1,0,0,0,0,,,,,2.0,,12.0,12.0,,,,,4,4,4,12.0,2.0,3.0,2018-04-29 23:00:00
5003,SNGRE_2021,PASTAZA,EC16,ARAJUNO,EC1604,ARAJUNO,EC160450,Barrio Central,-77.68837,-1.229866,La Sierra,8/28/19,4:00:00 AM,8,28,2019,Rain,Urban,0,0,0,0,0,1,0,0,0,0,,,,1.0,,1.0,11.0,,,,,,1,4,4,11.0,1.0,3.0,2019-08-28 09:00:00
3159,Desinventar,ZAMORA CHINCHIPE,EC19,NANGARITZA,EC1903,GUAYZIMI,EC190350,Wanguintza,-78.682253,-4.048328,La Sierra,4/26/15,6:00:00 PM,4,26,2015,Rain ,Heavy precipitation,1,0,0,0,0,0,0,0,0,0,,,,,3.0,,17.0,17.0,,,,,2,4,4,17.0,3.0,3.0,2015-04-26 23:00:00
5049,SNGRE_2021,ZAMORA CHINCHIPE,EC19,YANTZAZA,EC1905,CHICANA,EC190551,La Yona,-78.714809,-3.759708,La Sierra,12/5/19,5:00:00 AM,12,5,2019,Rain/ Overflow,Small stream overflow,0,0,0,1,0,0,0,0,0,0,,,,,1.0,1.0,8.0,,,,,,4,4,4,8.0,1.0,2.0,2019-12-05 10:00:00
4022,Desinventar,ESMERALDAS,EC08,SAN LORENZO,EC0805,MATAJE (CAB EN SANTANDER),EC080557,Mataje Alto y Las Delicias,-78.719201,1.362286,La Costa,3/25/17,6:00:00 AM,3,25,2017,Rain,Heavy precipitation/Urban,1,0,0,0,0,1,0,0,0,0,,,,,99.0,,587.0,587.0,,,,,3,4,4,587.0,99.0,6.0,2017-03-25 11:00:00
3405,Desinventar,ESMERALDAS,EC08,SAN LORENZO,EC0805,URBINA,EC080562,LOS AJOS,-78.742999,1.039157,La Costa,1/25/16,6:00:00 AM,1,25,2016,Rain,Heavy precipitation,1,0,0,0,0,0,0,0,0,0,,,,,,,,,,,4.0,0.6,2,4,4,,,,2016-01-25 11:00:00
3319,Desinventar,ESMERALDAS,EC08,SAN LORENZO,EC0805,5 DE JUNIO (CAB EN UIMBI),EC080555,WIMBI,-78.76474,0.949854,La Costa,1/25/16,6:00:00 AM,1,25,2016,Rain,Heavy precipitation,1,0,0,0,0,0,0,0,0,0,,,,,,,,,,,3.0,0.5,2,4,4,,,,2016-01-25 11:00:00
3383,Desinventar,ESMERALDAS,EC08,SAN LORENZO,EC0805,SAN JAVIER DE CACHAVI,EC080558,SAN JAVIER DE CACHAVI,-78.782333,1.068346,La Costa,1/25/16,6:00:00 AM,1,25,2016,Rain,Heavy precipitation,1,0,0,0,0,0,0,0,0,0,,,,,,,,,,,4.0,0.6,2,4,4,,,,2016-01-25 11:00:00
3157,Desinventar,ZAMORA CHINCHIPE,EC19,ZAMORA,EC1901,GUADALUPE,EC190152,El Progreso,-78.889598,-3.847496,La Sierra,4/26/15,7:00:00 AM,4,26,2015,Rain ,Heavy precipitation,1,0,0,0,0,0,0,0,0,0,,,,,1.0,,13.0,13.0,,,,,2,4,4,13.0,1.0,3.0,2015-04-26 12:00:00
3158,Desinventar,ZAMORA CHINCHIPE,EC19,ZAMORA,EC1901,GUADALUPE,EC190152,Conchay,-78.890593,-3.842083,La Sierra,4/26/15,6:30:00 PM,4,26,2015,Rain ,Heavy precipitation,1,0,0,0,0,0,0,0,0,0,,,,,1.0,,1.0,1.0,,,,,2,4,4,1.0,1.0,1.0,2015-04-26 23:30:00
3616,Desinventar,SANTO DOMINGO DE LOS TSACHILAS,EC23,SANTO DOMINGO,EC2301,ALLURIQUIN,EC230151,Centro de Alluriquin.,-79.005567,-0.320208,La Sierra,4/26/16,12:45:00 AM,4,26,2016,Rain / Overflow,Short duration rain ,0,1,0,0,0,0,0,0,0,0,4.0,,3.0,30.0,52.0,,300.0,300.0,,,,,3,4,4,300.0,52.0,5.0,2016-04-26 05:45:00
2206,Desinventar/SNGRE_2021,CHIMBORAZO,EC06,CUMANDA,EC0610,CUMANDA,EC061050,Copalillo; Guagal; Placer; Sacramento,-79.1304,-2.2088,La Sierra,3/26/13,12:30:00 AM,3,26,2013,Rain,Heavy precipitation,1,0,0,0,0,0,0,0,0,0,,,,,28.0,,925.0,925.0,,,,,2,4,4,925.0,28.0,6.0,2013-03-26 05:30:00
2830,SNGRE,ESMERALDAS,EC08,QUININDE,EC0804,MALIMPIA,EC080453,La Quinta,-79.197143,0.43982,La Costa,5/22/14,7:00:00 AM,5,22,2014,Rain / Overflow,Heavy precipitation,1,0,0,0,0,0,0,0,0,0,,,,,,,46.0,,,,,,2,4,4,46.0,,3.0,2014-05-22 12:00:00
1905,SNGRE_2021,SANTO DOMINGO DE LOS TSACHILAS,EC23,SANTO DOMINGO,EC2301,ABRAHAM CALAZACON,EC230150,Plan de vivienda - Barrio 9 de mayo,-79.2335,-0.2819,La Costa,2/13/13,7:00:00 PM,2,13,2013,Rain ,Heavy precipitation,1,0,0,0,0,0,0,0,0,0,,,,,1.0,,8.0,,,8.0,,,2,4,4,8.0,1.0,2.0,2013-02-14 00:00:00
2151,SNGRE_2021,SANTO DOMINGO DE LOS TSACHILAS,EC23,SANTO DOMINGO,EC2301,ABRAHAM CALAZACON,EC230150,Plan de Vivienda - Barrio 14 de Junio,-79.2335,-0.2819,La Costa,3/17/13,7:00:00 PM,3,17,2013,Rain ,Heavy precipitation/ Urban,1,0,0,0,0,1,0,0,0,0,,,,,,,,,,,,,3,4,4,,,,2013-03-18 00:00:00
3895,Desinventar,BOLIVAR,EC02,CALUMA,EC0206,CALUMA,EC020650,Establecimiento Educativo Basico Alfredo Noboa Montenegro,-79.258404,-1.631897,La Sierra,3/4/17,10:00:00 AM,3,4,2017,,Urban,0,0,0,0,0,1,0,0,0,0,,,,,,,,,,,,,1,4,4,,,,2017-03-04 15:00:00
3389,Desinventar,LOS RIOS,EC12,VALENCIA,EC1211,VALENCIA,EC121150,San Pablo 1,-79.352983,-0.952104,La Costa,1/25/16,6:16:00 AM,1,25,2016,Rain ,Heavy precipitation,1,0,0,0,0,0,0,0,0,0,,,,,3.0,,16.0,16.0,,16.0,,,2,4,4,16.0,3.0,3.0,2016-01-25 11:16:00
1896,SNGRE_2021,SANTO DOMINGO DE LOS TSACHILAS,EC23,SANTO DOMINGO,EC2301,PUERTO LIMON,EC230152,"Cabecera Parroquial, calle Ballarino Donoso y Manabi, Colegio Puerto Limon",-79.3653,-0.3637,La Costa,2/10/13,11:30:00 AM,2,10,2013,Rain ,Heavy precipitation,1,0,0,0,0,0,0,0,0,0,,,,,,,,,,,,,2,4,4,,,,2013-02-10 16:30:00
2727,Desinventar,ESMERALDAS,EC08,RIOVERDE,EC0807,ROCAFUERTE,EC080755,Barrio Antonio Lara,-79.370552,1.068621,La Costa,3/30/14,8:30:00 AM,3,30,2014,Rain ,Heavy precipitation,1,0,0,0,0,0,0,0,0,0,,,,,30.0,,150.0,150.0,,,,,2,4,4,150.0,30.0,5.0,2014-03-30 13:30:00
2747,Desinventar,ESMERALDAS,EC08,QUININDE,EC0804,VICHE,EC080454,Comunidad Viche,-79.543158,0.65795,La Costa,4/10/14,2:30:00 AM,4,10,2014,Rain ,Heavy precipitation,1,0,0,0,0,0,0,0,0,0,,,,1.0,8.0,,5.0,31.0,,,,,2,4,4,31.0,8.0,3.0,2014-04-10 07:30:00
3407,Desinventar,ESMERALDAS,EC08,QUININDE,EC0804,VICHE,EC080454,NUEVO VICHE,-79.547332,0.659829,La Costa,1/25/16,6:00:00 AM,1,25,2016,Rain ,Heavy precipitation,1,0,0,0,0,0,0,0,0,0,,,,,,,112.0,112.0,,,,,2,4,4,112.0,,5.0,2016-01-25 11:00:00
3789,Desinventar,GUAYAS,EC09,EMPALME,EC0908,VELASCO IBARRA (CAB. EL EMPALM,EC090850,Varios Sectores: San Vicente y Wacho Giler,-79.637836,-1.04719,La Costa,2/6/17,6:00:00 AM,2,6,2017,Rain,Heavy precipitation/ Urban ,1,0,0,0,0,1,0,0,0,0,,,,,2.0,,8.0,8.0,,,,,3,4,4,8.0,2.0,2.0,2017-02-06 11:00:00
2043,Desinventar/SNGRE_2021,EL ORO,EC07,PINAS,EC0710,PINAS,EC071050,Barrio Valparaiso (calle Francisco Carrion),-79.6979,-3.6691,La Sierra,3/6/13,11:30:00 PM,3,6,2013,,Urban,0,0,0,0,0,1,0,0,0,0,,,,,1.0,,8.0,8.0,,,,,1,4,4,8.0,1.0,2.0,2013-03-07 04:30:00
1937,SNGRE_2021,EL ORO,EC07,PINAS,EC0710,PINAS,EC071050,Cdla Guiricuna,-79.6979,-3.6691,La Sierra,2/26/13,6:00:00 PM,2,26,2013,Rain,Heavy precipitation/ Urban,1,0,0,0,0,1,0,0,0,0,,,,,1.0,,2.0,,,,,,3,4,4,2.0,1.0,1.0,2013-02-26 23:00:00
3467,Desinventar,EL ORO,EC07,PASAJE,EC0709,PASAJE,EC070950, Varios sectores (Barrio 15 de abril barrio Las Colinas del ,-79.754742,-3.402282,La Costa,2/26/16,1:00:00 AM,2,26,2016,Rain ,Short duration rain,0,1,0,0,0,0,0,0,0,0,,,,,6.0,,17.0,17.0,,,,,3,4,4,17.0,6.0,3.0,2016-02-26 06:00:00
3765,Desinventar,EL ORO,EC07,PASAJE,EC0709,PASAJE,EC070950,Lotizacion Tierra Prometida,-79.754742,-3.402282,La Costa,2/2/17,3:45:00 PM,2,2,2017,Rain,Heavy precipitation,1,0,0,0,0,0,0,0,0,0,,,,,3.0,,3.0,3.0,,3.0,,,2,4,4,3.0,3.0,1.0,2017-02-02 20:45:00
4244,Desinventar,EL ORO,EC07,PASAJE,EC0709,PASAJE,EC070950,"Varios sectores (San Pedro, Eloy Alfaro, Machala, Ochoa Leon",-79.754742,-3.402282,La Costa,5/9/17,10:00:00 AM,5,9,2017,Rain / Overflow,Heavy precipitation/ Artificial waterway overflow,1,0,1,0,0,0,0,0,0,0,,,,,32.0,,135.0,135.0,,,,,3,4,4,135.0,32.0,5.0,2017-05-09 15:00:00
4992,SNGRE_2021,GUAYAS,EC09,BALAO,EC0903,BALAO,EC090350,Reciento San Rafael,-79.755839,-2.9712936,La Costa,7/7/19,10:10:00 AM,7,7,2019,Overflow,Artificial waterway overflow,0,0,1,0,0,0,0,0,0,0,,,,,1.0,1.0,5.0,,,,,,1,4,4,5.0,1.0,1.0,2019-07-07 15:10:00
3739,Desinventar,EL ORO,EC07,PASAJE,EC0709,PASAJE,EC070950,PALENQUE/Sitio San Gregorio,-79.75943,-3.383981,La Costa,1/25/17,2:30:00 AM,1,25,2017,Overflow,Small stream overflow,0,0,0,1,0,0,0,0,0,0,,,,,,,275.0,275.0,,,,,4,4,4,275.0,,5.0,2017-01-25 07:30:00
3536,Desinventar,EL ORO,EC07,PASAJE,EC0709,PASAJE,EC070950,Varios Sectores (Cdla El Chofer 1 El Arenal Ochoa Leon San P,-79.790585,-3.343752,La Costa,3/13/16,9:30:00 PM,3,13,2016,Rain / Overflow,Short duration rain,0,1,0,0,0,0,0,0,0,0,,,,,3.0,,12.0,12.0,,,,,3,4,4,12.0,3.0,3.0,2016-03-14 02:30:00
5097,SNGRE_2021,EL ORO,EC07,PASAJE,EC0709,LOMA DE FRANCO,EC070950,Lotizacion San Pedro,-79.794579,-3.340778,La Costa,1/28/20,4:12:00 AM,1,28,2020,Rain,Heavy precipitation,1,0,0,0,0,0,0,0,0,0,,,,,1.0,1.0,9.0,,,9.0,,,2,4,4,9.0,1.0,2.0,2020-01-28 09:12:00
5094,SNGRE_2021,EL ORO,EC07,PASAJE,EC0709,PASAJE,EC070950,Bolivar- Varios Sectores,-79.802569,-3.327971,La Costa,1/28/20,10:45:00 AM,1,28,2020,Rain/Overflow,Artificial waterway overflow,0,0,1,0,0,0,0,0,0,0,,,,,,,,,,,,,1,4,4,,,,2020-01-28 15:45:00
3738,Desinventar,EL ORO,EC07,PASAJE,EC0709,BUENAVISTA,EC070951,Calichana,-79.806762,-3.385298,La Costa,1/25/17,8:05:00 AM,1,25,2017,Rain / Overflow,Short duration rain,0,1,0,0,0,0,0,0,0,0,,,,,11.0,,36.0,36.0,,4.0,182.0,9.0,3,4,4,36.0,11.0,3.0,2017-01-25 13:05:00
2990,Desinventar,MANABI,EC13,PEDERNALES,EC1317,COJIMIES,EC131751,Barrios Nueva Esperanza y Alejo Centeno,-79.853704,0.315571,La Costa,2/27/15,9:00:00 AM,2,27,2015,Rain ,Urban,0,0,0,0,0,1,0,0,0,0,,,,,,,,300.0,,,,,1,4,4,300.0,,5.0,2015-02-27 14:00:00
2235,Desinventar/SNGRE_2021,GUAYAS,EC09,PALESTINA,EC0913,PALESTINA,EC091350,Recinto Las Canas,-79.8552,-1.5793,La Costa,4/4/13,6:00:00 PM,4,4,2013,Rain,Heavy precipitation,1,0,0,0,0,0,0,0,0,0,,,,,,,,,,,,,2,4,4,,,,2013-04-04 23:00:00
2044,Desinventar/SNGRE_2021,GUAYAS,EC09,PALESTINA,EC0913,PALESTINA,EC091350,Recinto La Corona,-79.8635,-1.7055,La Costa,3/6/13,7:30:00 PM,3,6,2013,Rain,Heavy precipitation,1,0,0,0,0,0,0,0,0,0,,,,7.0,,,,353.0,,,,,2,4,4,353.0,,5.0,2013-03-07 00:30:00
2237,Desinventar/SNGRE_2021,GUAYAS,EC09,PALESTINA,EC0913,PALESTINA,EC091350,Recinto La Corona,-79.8635,-1.7055,La Costa,4/6/13,7:30:00 PM,4,6,2013,Rain,Heavy precipitation,1,0,0,0,0,0,0,0,0,0,,,,,,,,,,,,,2,4,4,,,,2013-04-07 00:30:00
4126,SNGRE,GUAYAS,EC09,PALESTINA,EC0913,PALESTINA,EC091350,Recinto La Corona,-79.863777,-1.703656,La Costa,4/4/17,6:30:00 PM,4,4,2017,Rain / Overflow,Heavy precipitation/Urban,1,0,0,0,0,1,0,0,0,0,,,,,,,800.0,,,,,,3,4,4,800.0,,6.0,2017-04-04 23:30:00
2064,Desinventar/SNGRE_2021,GUAYAS,EC09,PALESTINA,EC0913,PALESTINA,EC091350,Recinto San Jacinto de la Corona,-79.8651,-1.7002,La Costa,3/7/13,7:45:00 AM,3,7,2013,Long duration rain,Heavy precipitation,1,0,0,0,0,0,0,0,0,0,,,,2.0,3.0,,82.0,82.0,,,,,2,4,4,82.0,3.0,4.0,2013-03-07 12:45:00
2065,Desinventar/SNGRE_2021,GUAYAS,EC09,PALESTINA,EC0913,PALESTINA,EC091350,Recinto Jacinto de la Corona,-79.8651,-1.7002,La Costa,3/7/13,7:45:00 AM,3,7,2013,Rain,Heavy precipitation,1,0,0,0,0,0,0,0,0,0,,,,,,,,,,,,,2,4,4,,,,2013-03-07 12:45:00
4885,Desinventar,GUAYAS,EC09,PALESTINA,EC0913,PALESTINA,EC091350,Recinto Macul,-79.865258,-1.613419,La Costa,3/25/19,7:00:00 AM,3,25,2019,Rain / Overflow,Heavy precipitation,1,0,0,0,0,0,0,0,0,0,,,,,76.0,73.0,285.0,285.0,,13.0,,,2,4,4,285.0,76.0,5.0,2019-03-25 12:00:00
4795,Desinventar,GUAYAS,EC09,SALITRE,EC0919,JUNQUILLAL,EC091953,Pachay,-79.865458,-1.719197,La Costa,3/17/19,2:00:00 AM,3,17,2019,Rain / Overflow,Heavy precipitation,1,0,0,0,0,0,0,0,0,0,,,,,85.0,85.0,272.0,272.0,,,,30.0,2,4,4,272.0,85.0,5.0,2019-03-17 07:00:00
3583,Desinventar,GUAYAS,EC09,PALESTINA,EC0913,PALESTINA,EC091350,Via Macul Cabuyal (a la altura del recinto El Carmen),-79.869086,-1.646257,La Costa,4/6/16,12:15:00 PM,4,6,2016,Rain / Overflow,Small stream overflow,0,0,0,1,0,0,0,0,0,0,,,,,,,,,,,,,4,4,4,,,,2016-04-06 17:15:00
1922,SNGRE_2021,GUAYAS,EC09,PALESTINA,EC0913,PALESTINA,EC091350,Recinto El Carmen  Ref. la entrada por Macul a 4 km via fluvial,-79.8691,-1.6466,La Costa,2/21/13,8:00:00 PM,2,21,2013,Long duration rain,Heavy precipitation,1,0,0,0,0,0,0,0,0,0,,,,,6.0,,189.0,,,,,,2,4,4,189.0,6.0,5.0,2013-02-22 01:00:00
3380,Desinventar,ESMERALDAS,EC08,MUISNE,EC0803,SAN GREGORIO,EC080357, BOCA DEL RIO SUCIO,-79.874828,0.50984,La Costa,1/25/16,6:00:00 AM,1,25,2016,Rain,Heavy precipitation,1,0,0,0,0,0,0,0,0,0,,,,,,,,,,,65.0,,2,4,4,,,,2016-01-25 11:00:00
2608,Desinventar/SNGRE_2021,ESMERALDAS,EC08,ATACAMES,EC0806,SUA (CAB EN LA BOCANA),EC080652,Barrio el Porvenir,-79.875425,0.862448,La Costa,2/5/14,4:30:00 AM,2,5,2014,Rain,Heavy precipitation,1,0,0,0,0,0,0,0,0,0,,,,,30.0,,150.0,150.0,,,,,2,4,4,150.0,30.0,5.0,2014-02-05 09:30:00
2072,Desinventar/SNGRE_2021,GUAYAS,EC09,PALESTINA,EC0913,PALESTINA,EC091350,Recinto La Mayiya  Ref entrada Vinces a 11 km por Macul via ,-79.8767,-1.6792,La Costa,3/8/13,7:50:00 AM,3,8,2013,Rain,Heavy precipitation,1,0,0,0,0,0,0,0,0,0,,,,,,,,314.0,,,,,2,4,4,314.0,,5.0,2013-03-08 12:50:00
3183,Desinventar,EL ORO,EC07,SANTA ROSA,EC0712,BELLAMARIA,EC071257,Sitio El Recreo,-79.877523,-3.535919,La Costa,5/14/15,7:57:00 PM,5,14,2015,Rain / Overflow,Heavy precipitation,1,0,0,0,0,0,0,0,0,0,,,,,3.0,,21.0,21.0,27.0,21.0,,,2,4,4,21.0,3.0,3.0,2015-05-15 00:57:00
1982,Desinventar/SNGRE_2021,GUAYAS,EC09,PALESTINA,EC0913,PALESTINA,EC091350,Recinto Cristo del Consuelo,-79.8792,-1.6764,La Costa,3/3/13,7:00:00 PM,3,3,2013,Rain,Heavy precipitation,1,0,0,0,0,0,0,0,0,0,,,,,,,,,,,,,2,4,4,,,,2013-03-04 00:00:00
3120,Desinventar,MANABI,EC13,PEDERNALES,EC1317,COJIMIES,EC131751,Varios Sectores,-79.886357,0.310943,La Costa,4/6/15,10:00:00 PM,4,6,2015,Rain ,Urban,0,0,0,0,0,1,0,0,0,0,,,,,210.0,,630.0,630.0,,,,,1,4,4,630.0,210.0,6.0,2015-04-07 03:00:00
3396,Desinventar,ESMERALDAS,EC08,ATACAMES,EC0806,SUA (CAB EN LA BOCANA),EC080652,VARIOS SECTORES (GUACHAL CASCAJAL),-79.887822,0.814601,La Costa,1/25/16,6:00:00 AM,1,25,2016,Rain,Heavy precipitation,1,0,0,0,0,0,0,0,0,0,,,,,,,,,,,51.0,18.0,2,4,4,,,,2016-01-25 11:00:00
4085,SNGRE,GUAYAS,EC09,SALITRE,EC0919,JUNQUILLAL,EC091953,Recinto Laurel,-79.905836,-1.782015,La Costa,3/31/17,2:00:00 PM,3,31,2017,Rain / Overflow/Failure,River bank failure,0,0,0,0,0,0,0,1,0,0,,,,,,,50.0,,,,10.0,,4,4,4,50.0,,3.0,2017-03-31 19:00:00
4172,Desinventar,GUAYAS,EC09,DAULE,EC0906,LAUREL,EC090653,Recintos Guarumal y Laurel,-79.916486,-1.812545,La Costa,4/10/17,10:00:00 AM,4,10,2017,Rain / Overflow,Heavy precipitation/ Urban ,1,0,0,0,0,1,0,0,0,0,,,,,59.0,,229.0,229.0,,,,,3,4,4,229.0,59.0,5.0,2017-04-10 15:00:00
3294,Desinventar,GUAYAS,EC09,DAULE,EC0906,LOS LOJAS (ENRIQUE BAQUERIZO M,EC090656,Los Lojas,-79.919763,-1.976345,La Costa,1/12/16,7:30:00 AM,1,12,2016,Rain,Short duration rain,0,1,0,0,0,0,0,0,0,0,,,,,,,,,,,,,3,4,4,,,,2016-01-12 12:30:00
4881,Desinventar,GUAYAS,EC09,DAULE,EC0906,LOS LOJAS (ENRIQUE BAQUERIZO M,EC090656,Recinto Lechugal,-79.934626,-1.951774,La Costa,3/24/19,2:00:00 AM,3,24,2019,Rain / Overflow,Urban,0,0,0,0,0,1,0,0,0,0,,,,,67.0,67.0,248.0,248.0,,,,,1,4,4,248.0,67.0,5.0,2019-03-24 07:00:00
3401,Desinventar,ESMERALDAS,EC08,ATACAMES,EC0806,TONCHIGUE,EC080653,TONCHIGUE,-79.938418,0.795808,La Costa,1/25/16,6:00:00 AM,1,25,2016,Rain,Heavy precipitation,1,0,0,0,0,0,0,0,0,0,,,,,,,,,,,250.0,45.0,2,4,4,,,,2016-01-25 11:00:00
3366,Desinventar,ESMERALDAS,EC08,MUISNE,EC0803,MUISNE,EC080350,GUDURNAL,-79.945896,0.606257,La Costa,1/25/16,6:00:00 AM,1,25,2016,Rain,Heavy precipitation,1,0,0,0,0,0,0,0,0,0,,,,,,,,,,,90.0,,2,4,4,,,,2016-01-25 11:00:00
1941,SNGRE_2021,ESMERALDAS,EC08,MUISNE,EC0803,MUISNE,EC080350,Barrios La Invasion,-79.9459,0.6063,La Costa,2/28/13,9:00:00 PM,2,28,2013,,Short duration rain,0,1,0,0,0,0,0,0,0,0,,,,,20.0,,100.0,,,,,,3,4,4,100.0,20.0,4.0,2013-03-01 02:00:00
2793,Desinventar,GUAYAS,EC09,GUAYAQUIL,EC0901,TARQUI,EC090150,"Fortin de la Flor, bloque 9 Solar 18-20-23-9-10-8-10-11",-79.959632,-2.127195,La Costa,5/7/14,5:00:00 PM,5,7,2014,Rain,Heavy precipitation,1,0,0,0,0,0,0,0,0,0,,,,,35.0,,141.0,141.0,,,,,2,4,4,141.0,35.0,5.0,2014-05-07 22:00:00
2789,Desinventar,GUAYAS,EC09,GUAYAQUIL,EC0901,TARQUI,EC090150,Varios Sectores,-79.961404,-2.126264,La Costa,5/7/14,6:30:00 PM,5,7,2014,Rain,Heavy precipitation,1,0,0,0,0,0,0,0,0,0,,,,,,,,,,,,,2,4,4,,,,2014-05-07 23:30:00
2799,Desinventar,GUAYAS,EC09,GUAYAQUIL,EC0901,TARQUI,EC090150,Coop Nueva Prosperina,-79.961404,-2.126264,La Costa,5/7/14,6:30:00 PM,5,7,2014,Rain,Heavy precipitation,1,0,0,0,0,0,0,0,0,0,,,,1.0,4.0,,5.0,16.0,,,,,2,4,4,16.0,4.0,3.0,2014-05-07 23:30:00
3187,Desinventar,GUAYAS,EC09,GUAYAQUIL,EC0901,TARQUI,EC090150,"Nueva Prosperina Lamina 6 Mz. 1045 Solares 1, 4,16, 18",-79.96705,-2.127417,La Costa,5/14/15,8:25:00 PM,5,14,2015,Rain ,Heavy precipitation,1,0,0,0,0,0,0,0,0,0,,,,,4.0,,,,,,,,2,4,4,,4.0,,2015-05-15 01:25:00
2801,SNGRE,GUAYAS,EC09,GUAYAQUIL,EC0901,TARQUI,EC090150,"Nueva Prosperina. Coop. Lamina VI, como referencia detras de la Coop. Socio ",-79.967707,-2.127055,La Costa,5/7/14,6:40:00 PM,5,7,2014,Rain,Heavy precipitation,1,0,0,0,0,0,0,0,0,0,,,,,,,175.0,,,,,,2,4,4,175.0,,5.0,2014-05-07 23:40:00
5087,SNGRE_2021,GUAYAS,EC09,GUAYAQUIL,EC0901,TARQUI,EC090150,Coop. Sergio Toral 2 Mz 5570 solares 12-18-9.,-79.98926,-2.0990188,La Costa,1/22/20,3:55:00 AM,1,22,2020,Rain,Short duration rain,0,1,0,0,0,0,0,0,0,0,,,,,3.0,3.0,6.0,,,,,,3,4,4,6.0,3.0,2.0,2020-01-22 08:55:00
4367,Desinventar,GUAYAS,EC09,GUAYAQUIL,EC0901,TARQUI,EC090150,Monte Sinai Coop. Valle Hermoso Mz 25-26-29,-79.990335,-2.118965,La Costa,2/11/18,8:00:00 PM,2,11,2018,Rain ,Heavy precipitation,1,0,0,0,0,0,0,0,0,0,,,,,3.0,,14.0,14.0,,,,,2,4,4,14.0,3.0,3.0,2018-02-12 01:00:00
3117,Desinventar,GUAYAS,EC09,GUAYAQUIL,EC0901,PASCUALES,EC090150,Cooperativa Janeth Toral 2 Mz. 4823.,-79.991936,-2.116626,La Costa,4/5/15,11:50:00 AM,4,5,2015,Rain,Heavy precipitation,1,0,0,0,0,0,0,0,0,0,,,,,8.0,,32.0,32.0,,,,,2,4,4,32.0,8.0,3.0,2015-04-05 16:50:00
3615,Desinventar,GUAYAS,EC09,GUAYAQUIL,EC0901,PASCUALES,EC090150,Cooperativa Maria Paydar Bloque 1 Mz 84 Sl 16 (Monte Sinai),-79.992422,-2.116298,La Costa,4/15/16,11:44:00 AM,4,15,2016,Rain,Heavy precipitation,1,0,0,0,0,0,0,0,0,0,,,,,1.0,,2.0,2.0,,,,,2,4,4,2.0,1.0,1.0,2016-04-15 16:44:00
5166,SNGRE_2021,GUAYAS,EC09,GUAYAQUIL,EC0901,PASCUALES,EC090150,"Monte Sinai - Coop. Maria Paidal Mz. 101 Sl. 5, sector Guayacanes",-79.995487,-2.1181276,La Costa,2/26/20,5:15:00 PM,2,26,2020,Rain,Heavy precipitation,1,0,0,0,0,0,0,0,0,0,,,,,1.0,1.0,7.0,,,,12.0,18.0,2,4,4,7.0,1.0,2.0,2020-02-26 22:15:00
3494,Desinventar,GUAYAS,EC09,GUAYAQUIL,EC0901,PASCUALES,EC090150,Varios Sectores ( Coop. Sergio Toral Monte Sinai: Coop. Mari,-79.996479,-2.114356,La Costa,3/4/16,7:00:00 AM,3,4,2016,Rain,Heavy precipitation,1,0,0,0,0,0,0,0,0,0,,,,,3.0,,14.0,14.0,,,,,2,4,4,14.0,3.0,3.0,2016-03-04 12:00:00
3108,Desinventar,GUAYAS,EC09,GUAYAQUIL,EC0901,TARQUI,EC090150,"Monte Sinai, Coop. Una Sola Fuerza , Zhiblon",-80.025706,-2.106652,La Costa,4/2/15,7:00:00 PM,4,2,2015,Rain / Overflow,Heavy precipitation,1,0,0,0,0,0,0,0,0,0,,,,,5.0,,20.0,20.0,13.0,,,,2,4,4,20.0,5.0,3.0,2015-04-03 00:00:00
3173,Desinventar,GUAYAS,EC09,GUAYAQUIL,EC0901,TARQUI,EC090150,"Flor De Bastion Boque 9 Y 12 ; Las Iguanas , Socio Vivienda ",-80.062256,-2.097422,La Costa,5/3/15,5:00:00 PM,5,3,2015,Rain ,Heavy precipitation/ Urban,1,0,0,0,0,1,0,0,0,0,,,,,,,,,,,,,3,4,4,,,,2015-05-03 22:00:00
4803,Desinventar,EL ORO,EC07,ARENILLAS,EC0702,ARENILLAS,EC070250,"Varios Sectores (Cdla. Las Brisas, Franklin Jimenez, Cdla. T",-80.07604,-3.550679,La Costa,3/18/19,8:50:00 PM,3,18,2019,Rain,Urban,0,0,0,0,0,1,0,0,0,0,,,,,11.0,11.0,38.0,38.0,,,,,1,4,4,38.0,11.0,3.0,2019-03-19 01:50:00
3979,Desinventar,EL ORO,EC07,ARENILLAS,EC0702,PALMALES,EC070254,Varios sectores (Casa Blanca y Palmales Viejo)Varios sectore,-80.113428,-3.68132,La Sierra,3/22/17,10:00:00 AM,3,22,2017,Rain,Heavy precipitation,1,0,0,0,0,0,0,0,0,0,,,,,,,16.0,16.0,,,9.6,2.0,2,4,4,16.0,,3.0,2017-03-22 15:00:00
3179,Desinventar,MANABI,EC13,CHONE,EC1303,CHONE,EC130350,Varios Sectores.,-80.119198,-0.697619,La Costa,5/11/15,11:00:00 PM,5,11,2015,Rain ,Short duration rain,0,1,0,0,0,0,0,0,0,0,,,,,,,,,,,,,3,4,4,,,,2015-05-12 04:00:00
3424,Desinventar,EL ORO,EC07,ARENILLAS,EC0702,PALMALES,EC070254,Manabi de El Oro,-80.1255,-3.729384,La Sierra,2/3/16,1:30:00 PM,2,3,2016,Rain ,Short duration rain,0,1,0,0,0,0,0,0,0,0,,,,,17.0,,64.0,64.0,,,,,3,4,4,64.0,17.0,4.0,2016-02-03 18:30:00
4745,SNGRE,MANABI,EC13,CHONE,EC1303,SAN ANTONIO,EC130357,"Varios Sectores (La Segua, Greda, Playita)",-80.165553,-0.705983,La Costa,3/7/19,10:00:00 AM,3,7,2019,Rain,Short duration rain,0,1,0,0,0,0,0,0,0,0,,,,,,50.0,200.0,,,32.0,20.0,,3,4,4,200.0,50.0,5.0,2019-03-07 15:00:00
3481,Desinventar,EL ORO,EC07,HUAQUILLAS,EC0707,HUAQUILLAS,EC070750,Varios sectores (BARRIO SIMON BOLIVAR BARRIO EL PESCADOR 3 B,-80.170761,-3.454229,La Costa,3/3/16,11:30:00 AM,3,3,2016,Rain ,Short duration rain,0,1,0,0,0,0,0,0,0,0,,,,,3.0,,42.0,42.0,,,,,3,4,4,42.0,3.0,3.0,2016-03-03 16:30:00
3432,Desinventar,MANABI,EC13,CHONE,EC1303,SAN ANTONIO,EC130357,Badeal,-80.19522,-0.663461,La Costa,2/5/16,6:30:00 AM,2,5,2016,Rain ,Heavy precipitation,1,0,0,0,0,0,0,0,0,0,,,,,,,,,,,28.0,8.0,2,4,4,,,,2016-02-05 11:30:00
4128,SNGRE,MANABI,EC13,CHONE,EC1303,SAN ANTONIO,EC130357,Las Margaritas y San Pablo via a Barquero ,-80.19522,-0.663461,La Costa,4/4/17,4:22:00 AM,4,4,2017,Rain ,Urban/ Short duration rain,0,1,0,0,0,1,0,0,0,0,,,,,,,236.0,,,,,,4,4,4,236.0,,5.0,2017-04-04 09:22:00
3557,Desinventar,MANABI,EC13,SUCRE,EC1314,SAN ISIDRO,EC131457,Centro,-80.204541,-0.366689,La Costa,3/30/16,7:00:00 AM,3,30,2016,Rain ,Short duration rain,0,1,0,0,0,0,0,0,0,0,,,,,1.0,,2.0,2.0,,,,,3,4,4,2.0,1.0,1.0,2016-03-30 12:00:00
3418,Desinventar,MANABI,EC13,TOSAGUA,EC1315,TOSAGUA,EC131550,San Pedro y Jose Rolando Andrade ,-80.232582,-0.787135,La Costa,1/28/16,12:48:00 PM,1,28,2016,Rain ,Short duration rain,0,1,0,0,0,0,0,0,0,0,,,,,15.0,,60.0,60.0,,,,,3,4,4,60.0,15.0,4.0,2016-01-28 17:48:00
3402,Desinventar,MANABI,EC13,TOSAGUA,EC1315,TOSAGUA,EC131550,Tosagua ,-80.234389,-0.784069,La Costa,1/25/16,6:00:00 AM,1,25,2016,Rain ,Heavy precipitation,1,0,0,0,0,0,0,0,0,0,,,,,,,,,,,60.0,20.0,2,4,4,,,,2016-01-25 11:00:00
3265,Desinventar,GUAYAS,EC09,PEDRO CARBO,EC0914,PEDRO CARBO,EC091450,Calles Uruguay - 9 de Octubre  y Cristobal Colon,-80.235661,-1.813691,La Costa,11/24/15,6:45:00 PM,11,24,2015,Rain,Short duration rain,0,1,0,0,0,0,0,0,0,0,,,,,1.0,,3.0,3.0,,,,,3,4,4,3.0,1.0,1.0,2015-11-24 23:45:00
4702,SNGRE,MANABI,EC13,TOSAGUA,EC1315,TOSAGUA,EC131550,"Varios Sectores( Barrio San Pedro, Calle Bolivar)",-80.236223,-0.780165,La Costa,3/1/19,7:22:00 AM,3,1,2019,Rain,Heavy precipitation/ Urban ,1,0,0,0,0,1,0,0,0,0,,,,,,,,,,,,,3,4,4,,,,2019-03-01 12:22:00
3809,Desinventar,MANABI,EC13,TOSAGUA,EC1315,TOSAGUA,EC131550,Varios Sectores,-80.236815,-0.785444,La Costa,2/8/17,8:29:00 AM,2,8,2017,Rain ,Heavy precipitation,1,0,0,0,0,0,0,0,0,0,,,,,20.0,,80.0,796.0,,,,,2,4,4,796.0,20.0,6.0,2017-02-08 13:29:00
3752,Desinventar,GUAYAS,EC09,PEDRO CARBO,EC0914,PEDRO CARBO,EC091450,Varios Sectores ,-80.237081,-1.814768,La Costa,2/1/17,3:10:00 PM,2,1,2017,Rain,Heavy precipitation/ Urban ,1,0,0,0,0,1,0,0,0,0,,,,,12.0,,50.0,50.0,,5.0,,,3,4,4,50.0,12.0,3.0,2017-02-01 20:10:00
3474,Desinventar,MANABI,EC13,TOSAGUA,EC1315,TOSAGUA,EC131550,Santa Lucia ,-80.239001,-0.773313,La Costa,2/29/16,10:00:00 AM,2,29,2016,Rain ,Short duration rain,0,1,0,0,0,0,0,0,0,0,,,,,2.0,,9.0,9.0,9.0,,,,3,4,4,9.0,2.0,2.0,2016-02-29 15:00:00
4626,SNGRE,MANABI,EC13,SANTA ANA,EC1313,AYACUCHO,EC131351,Rio Ciego-Via Ayacucho-Poza Honda,-80.256266,-1.133438,La Costa,2/7/19,7:30:00 PM,2,7,2019,Rain,Heavy precipitation,1,0,0,0,0,0,0,0,0,0,,,,,,,,,,5.0,,,2,4,4,,,,2019-02-08 00:30:00
3321,Desinventar,MANABI,EC13,SANTA ANA,EC1313,AYACUCHO,EC131351,La Poza,-80.272147,-1.148928,La Costa,1/25/16,3:00:00 AM,1,25,2016,Rain ,Heavy precipitation,1,0,0,0,0,0,0,0,0,0,,,,,,,,,,,9.0,2.0,2,4,4,,,,2016-01-25 08:00:00
3882,Desinventar,MANABI,EC13,PORTOVIEJO,EC1301,PUEBLO NUEVO,EC130154,Majaguas,-80.282108,-0.97752,La Costa,2/28/17,6:40:00 PM,2,28,2017,Rain / Overflow,small stream overflow,0,0,0,1,0,0,0,0,0,0,,,,20.0,90.0,,360.0,360.0,,,,,4,4,4,360.0,90.0,5.0,2017-02-28 23:40:00
3004,Desinventar,MANABI,EC13,TOSAGUA,EC1315,TOSAGUA,EC131550,Barrio San Agustin,-80.286247,-0.757846,La Costa,3/16/15,5:20:00 PM,3,16,2015,Rain,Heavy precipitation,1,0,0,0,0,0,0,0,0,0,,,,,1.0,,2.0,2.0,,,,,2,4,4,2.0,1.0,1.0,2015-03-16 22:20:00
1956,Desinventar/SNGRE_2021,GUAYAS,EC09,PEDRO CARBO,EC0914,PEDRO CARBO,EC091450,Recinto Zamora Nuevo; Botija; Pasaje ; Canitas,-80.3243,-1.8272,La Costa,3/2/13,4:36:00 AM,3,2,2013,Overflow,Small stream overflow,0,0,0,1,0,0,0,0,0,0,,,,,6.0,,,,,,,,4,4,4,,6.0,,2013-03-02 09:36:00
2173,Desinventar/SNGRE_2021,GUAYAS,EC09,PEDRO CARBO,EC0914,PEDRO CARBO,EC091450,Valle de la Virgen,-80.3243,-1.8272,La Costa,3/20/13,6:15:00 PM,3,20,2013,Rain,Heavy precipitation,1,0,0,0,0,0,0,0,0,0,,,,,1.0,,3.0,3.0,,,,,2,4,4,3.0,1.0,1.0,2013-03-20 23:15:00
1839,Desinventar/SNGRE_2021,MANABI,EC13,SAN VICENTE,EC1322,SAN VICENTE,EC132250,Los Perales,-80.3289,-0.5545,La Costa,1/24/13,11:00:00 AM,1,24,2013,Rain ,Urban,0,0,0,0,0,1,0,0,0,0,,,,,,,,,,,,,1,4,4,,,,2013-01-24 16:00:00
3850,Desinventar,MANABI,EC13,PORTOVIEJO,EC1301,ABDON CALDERON (SAN FRANCISCO),EC130151,"Varios sectores. (Arreaga, Pimpiguasi, Juan Dama)",-80.360724,-1.005789,La Costa,2/21/17,6:06:00 AM,2,21,2017,Rain / Overflow,Small stream overflow,0,0,0,1,0,0,0,0,0,0,,,,,40.0,,160.0,160.0,,,,,4,4,4,160.0,40.0,5.0,2017-02-21 11:06:00
3877,Desinventar,MANABI,EC13,PORTOVIEJO,EC1301,ABDON CALDERON (SAN FRANCISCO),EC130151,Pimpiguasi - Arreaga,-80.360724,-1.005789,La Costa,2/28/17,6:40:00 PM,2,28,2017,Rain / Overflow,Short duration rain,0,1,0,0,0,0,0,0,0,0,,,,25.0,39.0,,160.0,160.0,69.0,266.0,,,3,4,4,160.0,39.0,5.0,2017-02-28 23:40:00
3873,Desinventar,MANABI,EC13,PORTOVIEJO,EC1301,RIOCHICO (RIO CHICO),EC130155,La Encantada,-80.387138,-0.98658,La Costa,2/26/17,10:00:00 AM,2,26,2017,Rain ,Short duration rain,0,1,0,0,0,0,0,0,0,0,,,,,50.0,,200.0,20.0,,,,,3,4,4,200.0,50.0,5.0,2017-02-26 15:00:00
4729,SNGRE,MANABI,EC13,PORTOVIEJO,EC1301,COLON,EC130150,El Cady,-80.405885,-1.121939,La Costa,3/7/19,6:30:00 AM,3,7,2019,Rain,Heavy precipitation,1,0,0,0,0,0,0,0,0,0,,,,,,6.0,24.0,,,24.0,11.5,,2,4,4,24.0,6.0,3.0,2019-03-07 11:30:00
3172,Desinventar,MANABI,EC13,PORTOVIEJO,EC1301,RIOCHICO (RIO CHICO),EC130155,Las Chacras,-80.41511,-0.993351,La Costa,5/3/15,11:00:00 PM,5,3,2015,Rain / Overflow,Small stream overflow,0,0,0,1,0,0,0,0,0,0,,,,,2.0,,12.0,12.0,6.0,,,,4,4,4,12.0,2.0,3.0,2015-05-04 04:00:00
2255,Desinventar/SNGRE_2021,MANABI,EC13,PORTOVIEJO,EC1301,RIOCHICO (RIO CHICO),EC130155,Rio Chico,-80.4159,-0.9934,La Costa,4/10/13,9:00:00 PM,4,10,2013,Rain / Overflow,Artificial waterway overflow,0,0,1,0,0,0,0,0,0,0,,,,,1.0,,6.0,6.0,,,,,1,4,4,6.0,1.0,2.0,2013-04-11 02:00:00
3602,Desinventar,MANABI,EC13,PORTOVIEJO,EC1301,RIOCHICO (RIO CHICO),EC130155,Varios Sectores,-80.417447,-0.99545,La Costa,4/12/16,10:00:00 AM,4,12,2016,Rain ,Heavy precipitation,1,0,0,0,0,0,0,0,0,0,,,,,4.0,,,,10.0,,,,2,4,4,,4.0,,2016-04-12 15:00:00
3551,Desinventar,MANABI,EC13,PORTOVIEJO,EC1301,COLON,EC130150,Pachinche Afuera ,-80.418096,-1.135011,La Costa,3/29/16,8:15:00 PM,3,29,2016,Rain ,Artificial waterway overflow,0,0,1,0,0,0,0,0,0,0,,,,,4.0,,,,,,,,1,4,4,,4.0,,2016-03-30 01:15:00
4138,Desinventar,MANABI,EC13,PORTOVIEJO,EC1301,COLON,EC130150,Estancia Vieja,-80.418096,-1.135011,La Costa,4/7/17,4:55:00 PM,4,7,2017,Rain / Overflow,Small stream overflow,0,0,0,1,0,0,0,0,0,0,,,,,30.0,,120.0,120.0,98.0,10.0,,,4,4,4,120.0,30.0,5.0,2017-04-07 21:55:00
4585,SNGRE,MANABI,EC13,PORTOVIEJO,EC1301,COLON,EC130150,Estancia Vieja,-80.419063,-1.145917,La Costa,1/11/19,4:15:00 PM,1,11,2019,Rain / Overflow,Small stream overflow,0,0,0,1,0,0,0,0,0,0,,,,,,1.0,7.0,,,,,,4,4,4,7.0,1.0,2.0,2019-01-11 21:15:00
4156,Desinventar,MANABI,EC13,PORTOVIEJO,EC1301,RIOCHICO (RIO CHICO),EC130155,Varios Sectores,-80.420314,-0.991796,La Costa,4/8/17,9:00:00 AM,4,8,2017,Rain / Overflow,Heavy precipitation/Urban,1,0,0,0,0,1,0,0,0,0,,,,,390.0,,1950.0,1950.0,,,,,3,4,4,1950.0,390.0,6.0,2017-04-08 14:00:00
4688,SNGRE,MANABI,EC13,PORTOVIEJO,EC1301,RIOCHICO (RIO CHICO),EC130155,"Los Ebanitos, Las Chacras.",-80.420613,-0.99067,La Costa,2/26/19,6:42:00 AM,2,26,2019,Rain,Short duration rain,0,1,0,0,0,0,0,0,0,0,,,,,,6.0,24.0,,,,,,3,4,4,24.0,6.0,3.0,2019-02-26 11:42:00
3331,Desinventar,MANABI,EC13,PORTOVIEJO,EC1301,CRUCITA,EC130153,Los Arenales ,-80.531897,-0.856534,La Costa,1/25/16,9:00:00 AM,1,25,2016,Rain ,Heavy precipitation/ Urban,1,0,0,0,0,1,0,0,0,0,,,,,20.0,,60.0,60.0,,,,,3,4,4,60.0,20.0,4.0,2016-01-25 14:00:00
3744,Desinventar,MANABI,EC13,JARAMIJO,EC1321,JARAMIJO,EC132150,Bellavista Estadio Colisa - Albergue ,-80.633849,-0.960985,La Costa,1/30/17,3:07:00 PM,1,30,2017,Rain,Heavy precipitation,1,0,0,0,0,0,0,0,0,0,,,,,,,290.0,290.0,,,,,2,4,4,290.0,,5.0,2017-01-30 20:07:00
3436,Desinventar,MANABI,EC13,JARAMIJO,EC1321,JARAMIJO,EC132150,Redondel del Imperio via principal ,-80.637444,-0.962162,La Costa,2/8/16,2:00:00 AM,2,8,2016,Rain ,Short duration rain,0,1,0,0,0,0,0,0,0,0,,,,,5.0,,30.0,30.0,,,,,3,4,4,30.0,5.0,3.0,2016-02-08 07:00:00
2957,Desinventar,MANABI,EC13,MANTA,EC1308,LOS ESTEROS,EC130850,Barrio Villa Marina,-80.685693,-0.951214,La Costa,2/7/15,2:00:00 AM,2,7,2015,Rain ,Heavy precipitation,1,0,0,0,0,0,0,0,0,0,,,,,1.0,,,,,7.0,,,2,4,4,,1.0,,2015-02-07 07:00:00
1947,SNGRE_2021,SANTA ELENA,EC24,SANTA ELENA,EC2401,SANTA ELENA,EC240150,Barrio 12 de Octubre - calle Aurelio Lainez (llegando al cerro el Tablazo) ,-80.7067,-2.2216,La Costa,2/28/13,10:20:00 AM,2,28,2013,Rain ,Heavy precipitation,1,0,0,0,0,0,0,0,0,0,,,,,4.0,,20.0,,,,,,2,4,4,20.0,4.0,3.0,2013-02-28 15:20:00
3395,Desinventar,MANABI,EC13,MANTA,EC1308,SANTA MARIANITA (BOCA DE PACOC,EC130852,Parroquia Santa Marianita,-80.837559,-0.973359,La Costa,1/25/16,7:00:00 AM,1,25,2016,Rain ,Heavy precipitation,1,0,0,0,0,0,0,0,0,0,,,,,,,,,,,,,2,4,4,,,,2016-01-25 12:00:00
2574,Desinventar,SANTA ELENA,EC24,SANTA ELENA,EC2401,SANTA ELENA,EC240150,"Calles Juan Montalvo y Aurelio Lainez, detras de la ""Escuela",-80.854261,-2.226091,La Costa,1/23/14,11:20:00 AM,1,23,2014,Rain,Short duration rain,0,1,0,0,0,0,0,0,0,0,,,,,6.0,,21.0,21.0,,,,,3,4,4,21.0,6.0,3.0,2014-01-23 16:20:00
3801,Desinventar,SANTA ELENA,EC24,LA LIBERTAD,EC2402,LA LIBERTAD,EC240250,"Sector las Minas, av. 45 y calle 43",-80.89071,-2.244985,La Costa,2/8/17,9:30:00 AM,2,8,2017,Rain,Heavy precipitation,1,0,0,0,0,0,0,0,0,0,,,,,1.0,,4.0,4.0,,,,,2,4,4,4.0,1.0,1.0,2017-02-08 14:30:00
1862,SNGRE_2021,SANTA ELENA,EC24,LA LIBERTAD,EC2402,LA LIBERTAD,EC240250,Avenida 23 entre la 19 y la 20 ,-80.8947,-2.2396,La Costa,2/2/13,2:00:00 AM,2,2,2013,,Urban,0,0,0,0,0,1,0,0,0,0,,,,,7.0,,25.0,,,,,,1,4,4,25.0,7.0,3.0,2013-02-02 07:00:00
2439,Desinventar/SNGRE_2021,SUCUMBIOS,EC21,PUTUMAYO,EC2103,PUERTO EL CARMEN DEL PUTUMAYO,EC210350,Nueva Montepa; Litoral; Lorenzo Afro; San Rafael,-75.8932,0.1251,El Oriente,7/19/13,12:00:00 PM,7,19,2013,Rain / Overflow,Heavy precipitation/ Slope,1,0,0,0,0,0,1,0,0,0,,,,,96.0,,314.0,314.0,,,,,7,1,5,314.0,96.0,5.0,2013-07-19 17:00:00
2443,Desinventar/SNGRE_2021,SUCUMBIOS,EC21,PUTUMAYO,EC2103,SANTA ELENA,EC210354,Los Chiparos; Nueva Union; Bajo Restrepo; San Jose de Wisuya,-76.3892,0.3785,El Oriente,7/19/13,12:00:00 PM,7,19,2013,Rain / Overflow,Heavy precipitation/Slope,1,0,0,0,0,0,1,0,0,0,,,,,,,908.0,908.0,,,,,7,1,5,908.0,,6.0,2013-07-19 17:00:00
5303,SNGRE_2021,ORELLANA,EC22,ORELLANA,EC2201,DAYUMA,EC220151,Via al Pindo - Comunidad Miwaguno,-76.722241,-0.685451,El Oriente,6/21/20,9:46:00 AM,6,21,2020,Rain/Overflow,Short duration flood,0,0,0,0,0,0,0,0,0,1,,,,,,42.0,115.0,,,32.0,,,7,1,5,115.0,42.0,5.0,2020-06-21 14:46:00
3224,Desinventar,ORELLANA,EC22,ORELLANA,EC2201,GARCÍA MORENO,EC220156,"La Puntilla , Puerto Colon",-77.061835,-0.544756,El Oriente,7/22/15,12:00:00 AM,7,22,2015,Rain / Overflow,Strong current,0,0,0,0,0,0,0,0,1,0,,,,,,,,,,,1.0,1.0,7,1,5,,,,2015-07-22 05:00:00
3225,Desinventar,ORELLANA,EC22,ORELLANA,EC2201,LA BELLEZA,EC220158,"Palma Roja, Alto San Miguel",-77.166503,-0.771009,El Oriente,7/22/15,12:00:00 AM,7,22,2015,Rain / Overflow,Strong current,0,0,0,0,0,0,0,0,1,0,,,,,,,,,,,1.04,1.0,7,1,5,,,,2015-07-22 05:00:00
2863,Desinventar,NAPO,EC15,TENA,EC1501,CHONTAPUNTA,EC150153,Varios sectores,-77.421926,-0.944248,La Sierra,9/12/14,2:00:00 AM,9,12,2014,Overflow,Strong current,0,0,0,0,0,0,0,0,1,0,,,,,,,205.0,205.0,,,79.6,171.0,7,1,5,205.0,,5.0,2014-09-12 07:00:00
2307,Desinventar/SNGRE_2021,MORONA SANTIAGO,EC14,TIWINTZA,EC1412,SAN JOSE DE MORONA,EC141251,La Paz,-77.7944,-2.8916,La Sierra,4/19/13,2:00:00 AM,4,19,2013,Overflow,Short duration flood,0,0,0,0,0,0,0,0,0,1,,,,,36.0,,295.0,295.0,,,,,7,1,5,295.0,36.0,5.0,2013-04-19 07:00:00
4955,SNGRE,MORONA SANTIAGO,EC14,TIWINTZA,EC1412,SANTIAGO,EC141250,"Varios Sectores: Chimius, Shariana y Tsaapa",-78.056667,-3.081663,La Sierra,5/29/19,8:32:00 AM,5,29,2019,Rain / Overflow,Strong current,0,0,0,0,0,0,0,0,1,0,,,,,,43.0,215.0,,,,,,7,1,5,215.0,43.0,5.0,2019-05-29 13:32:00
1925,SNGRE_2021,ESMERALDAS,EC08,LA CONCORDIA,EC0808,LA CONCORDIA,EC080850,barrio Santa Rosa sector 5 y 3 de la nueva Concordia ,-79.3763,-0.003,La Costa,2/22/13,7:00:00 PM,2,22,2013,Rain ,Heavy precipitation/ small stream overflow/ Urban,1,0,0,1,0,1,0,0,0,0,,,,,5.0,,22.0,,,16.0,,,7,1,5,22.0,5.0,3.0,2013-02-23 00:00:00
2822,Desinventar,ESMERALDAS,EC08,LA CONCORDIA,EC0808,LA CONCORDIA,EC080850,La Concordia Camal Municipal,-79.382431,0.012073,La Costa,5/12/14,3:42:00 AM,5,12,2014,Rain / Overflow,Strong current,0,0,0,0,0,0,0,0,1,0,,,,1.0,,,4.0,4.0,,,,,7,1,5,4.0,,1.0,2014-05-12 08:42:00
4468,Desinventar,ESMERALDAS,EC08,ESMERALDAS,EC0801,CHINCA,EC080154,Recinto  Chaflu,-79.583293,0.744672,La Costa,5/23/18,8:28:00 AM,5,23,2018,Overflow,Short duration rain/ Small stream overflow,0,1,0,1,0,0,0,0,0,0,,,,,19.0,,95.0,95.0,,,,,7,1,5,95.0,19.0,4.0,2018-05-23 13:28:00
3390,Desinventar,ESMERALDAS,EC08,ESMERALDAS,EC0801,SAN MATEO,EC080163,TONTA VACA,-79.617202,0.845723,La Costa,1/25/16,9:00:00 AM,1,25,2016,Rain,Strong current,0,0,0,0,0,0,0,0,1,0,,,,3.0,,,,,11.0,,,,7,1,5,,,,2016-01-25 14:00:00
4603,Desinventar,EL ORO,EC07,PASAJE,EC0709,TRES CERRITOS,EC070950,Tierra Prometida,-79.767653,-3.32506,La Costa,1/13/19,7:18:00 PM,1,13,2019,Rain,Short duration flood,0,0,0,0,0,0,0,0,0,1,,,,,1.0,1.0,1.0,1.0,,,,,7,1,5,1.0,1.0,1.0,2019-01-14 00:18:00
4397,Desinventar,LOS RIOS,EC12,VINCES,EC1208,ANTONIO SOTOMAYOR (CAB. EN PLAYAS DE VINCES),EC120851,La Soberana,-79.800581,-1.637587,La Costa,2/25/18,1:55:00 AM,2,25,2018,Rain / Overflow/ Failure,River bank failure/ Short duration rain,0,1,0,0,0,0,0,1,0,0,,,,,18.0,,56.0,56.0,,56.0,7.0,3.0,7,1,5,56.0,18.0,4.0,2018-02-25 06:55:00
3495,Desinventar,EL ORO,EC07,MACHALA,EC0701,LA PROVIDENCIA,EC070150,24 de Septiembre,-79.902607,-3.267916,La Costa,3/5/16,6:00:00 PM,3,5,2016,Rain / Overflow,Short duration flood,0,0,0,0,0,0,0,0,0,1,,,,,,,,,,,,,7,1,5,,,,2016-03-05 23:00:00
2125,Desinventar/SNGRE_2021,GUAYAS,EC09,BALZAR,EC0904,BALZAR,EC090450,Recinto Santa Genara,-79.9073,-1.2902,La Costa,3/16/13,10:00:00 AM,3,16,2013,Overflow,Strong current,0,0,0,0,0,0,0,0,1,0,,,,1.0,,,5.0,5.0,,,,,7,1,5,5.0,,1.0,2013-03-16 15:00:00
5165,SNGRE_2021,GUAYAS,EC09,NOBOL,EC0925,NARCISA DE JESUS,EC092550,Varios sectores,-80.011251,-1.9106228,La Costa,2/26/20,12:00:00 AM,2,26,2020,Rain,strong current,0,0,0,0,0,0,0,0,1,0,,,,,,,,,,,28.0,,7,1,5,,,,2020-02-26 05:00:00
4724,SNGRE,MANABI,EC13,BOLIVAR,EC1302,CALCETA,EC130250,La Pastora,-80.159315,-0.840434,La Costa,3/7/19,7:00:00 AM,3,7,2019,Rain,Strong current,0,0,0,0,0,0,0,0,1,0,,,,,,,,,,,4.75,,7,1,5,,,,2019-03-07 12:00:00
4990,SNGRE_2021,NAPO,EC15,EL CHACO,EC1504,GONZALO DIAZ DE PINEDA (EL BOMBON),EC150451,"500 metros antes del ingreso a la cascada de San Rafael, via El Chaco - Lago Agrio [E45].",-77.596988,-0.109091,La Sierra,6/28/19,12:40:00 PM,6,28,2019,Rain,Surface runoff,0,0,0,0,1,0,0,0,0,0,1.0,,,,,,,,,,,,6,2,5,,,,2019-06-28 17:40:00
4297,Desinventar,NAPO,EC15,TENA,EC1501,PUERTO MISAHUALLI,EC150155,Comunidad San Victor,-77.654263,-1.055888,La Sierra,9/2/17,9:30:00 PM,9,2,2017,Rain / Overflow,Heavy precipitation/Small stream overflow,1,0,0,1,0,0,0,0,0,0,,,,,,,4.0,4.0,,,,,6,2,5,4.0,,1.0,2017-09-03 02:30:00
2289,SNGRE_2021,SANTO DOMINGO DE LOS TSACHILAS,EC23,SANTO DOMINGO,EC2301,RIO TOACHI,EC230150,El Paraiso,-79.1222,-0.2539,La Costa,4/17/13,10:30:00 PM,4,17,2013,Rain ,Heavy precipitation/ Short duration rain/ Urban,1,1,0,0,0,1,0,0,0,0,,,,,1.0,,4.0,,,,,,6,2,5,4.0,1.0,1.0,2013-04-18 03:30:00
4399,Desinventar,GUAYAS,EC09,SALITRE,EC0919,EL SALITRE (LAS RAMAS),EC091950,Rcto. Briceno,-79.804465,-1.822393,La Costa,2/27/18,11:15:00 AM,2,27,2018,Rain / Overflow,Heavy precipitation/ Small stream overflow,1,0,0,1,0,0,0,0,0,0,,,,,15.0,,56.0,56.0,,,2.0,,6,2,5,56.0,15.0,4.0,2018-02-27 16:15:00
4700,SNGRE,EL ORO,EC07,BALSAS,EC0704,BALSAS,EC070450,"Varios Sectores(Av. 23 de Febrero, Entrada Al Camal, Los Vergeles, El Paraiso, Primero de Mayo, San Roquito Alto)",-79.825472,-3.758592,La Sierra,3/1/19,6:00:00 PM,3,1,2019,Rain / Overflow,Surface runoff,0,0,0,0,1,0,0,0,0,0,,,,,,38.0,191.0,,,34.0,,,6,2,5,191.0,38.0,5.0,2019-03-01 23:00:00
3421,Desinventar,EL ORO,EC07,ARENILLAS,EC0702,ARENILLAS,EC070250,Varios sectores( barrio brisas del mar barrio San Isidro),-80.042908,-3.560198,La Costa,1/30/16,10:30:00 AM,1,30,2016,Rain ,Surface runoff,0,0,0,0,1,0,0,0,0,0,,,,,12.0,,50.0,50.0,18.0,,,,6,2,5,50.0,12.0,3.0,2016-01-30 15:30:00
3708,Desinventar,GUAYAS,EC09,LOMAS DE SARGENTILLO,EC0924,LOMAS DE SARGENTILLO,EC092450,Barrio El Progreso,-80.093019,-1.871647,La Costa,1/10/17,9:35:00 AM,1,10,2017,Rain,Heavy precipitation/ Urban/ Short duration rain,1,1,0,0,0,1,0,0,0,0,,,,,15.0,,60.0,60.0,,,,,6,2,5,60.0,15.0,4.0,2017-01-10 14:35:00
4809,Desinventar,GUAYAS,EC09,GUAYAQUIL,EC0901,JUAN GOMEZ RENDON (PROGRESO),EC090152,Recinto San Isidro / El Tigre Km. 53 via a la Costa,-80.282509,-2.353306,La Costa,3/18/19,9:45:00 AM,3,18,2019,Rain / Overflow,Heavy precipitation/ Small stream overflow,1,0,0,1,0,0,0,0,0,0,,,,,,4.0,20.0,20.0,,,,,6,2,5,20.0,4.0,3.0,2019-03-18 14:45:00
4753,SNGRE,MANABI,EC13,PORTOVIEJO,EC1301,PICOAZA,EC130150,"Varios Sectores (Pisloy, )",-80.469501,-0.996218,La Costa,3/8/19,7:00:00 AM,3,8,2019,Rain / Overflow,Surface runoff,0,0,0,0,1,0,0,0,0,0,,,,,,80.0,320.0,,,,24.5,,6,2,5,320.0,80.0,5.0,2019-03-08 12:00:00
5012,SNGRE_2021,AZUAY,EC01,SEVILLA DE ORO,EC0113,AMALUZA,EC011351,Puente Sopladora km 115 - via Paute Guarumales-Mendez [E547],-78.618638,-2.600873,La Sierra,10/10/19,7:00:00 AM,10,10,2019,Rain,Surface runoff,0,0,0,0,1,0,0,0,0,0,,,,,,,,,,,,,6,3,5,,,,2019-10-10 12:00:00
4640,SNGRE_2021,ZAMORA CHINCHIPE,EC19,YANTZAZA,EC1905,YANTZAZA (YANZATZA),EC190550,"La Zarza Km 14, via La Zarza - los Encuentros [E45]",-78.737563,-3.8184471,La Sierra,2/12/19,9:00:00 AM,2,12,2019,Rain,Surface runoff,0,0,0,0,1,0,0,0,0,0,,,,,,,,,,,,,6,3,5,,,,2019-02-12 14:00:00
5065,SNGRE_2021,ZAMORA CHINCHIPE,EC19,CENTINELA DEL CONDOR,EC1907,ZUMBI,EC190750,"Nanguipa Alto y Barrio 10 de Agosto, Via Zumbi a Nanguipa [E45]",-78.746481,-3.947088,La Sierra,12/12/19,6:54:00 AM,12,12,2019,Rain/ Overflow/ Landslide,Heavy precipitation/ Small stream overflow,1,0,0,1,0,0,0,0,0,0,,,,,2.0,2.0,8.0,,,,,,6,3,5,8.0,2.0,2.0,2019-12-12 11:54:00
3165,SNGRE,ZAMORA CHINCHIPE,EC19,YANTZAZA,EC1905,YANTZAZA (YANZATZA),EC190550,Varios Sectores,-78.752951,-3.827845,La Sierra,4/26/15,10:00:00 AM,4,26,2015,Rain / Overflow,Surface runoff,0,0,0,0,1,0,0,0,0,0,,,,,,,,,,,,,6,3,5,,,,2015-04-26 15:00:00
4845,Desinventar,LOS RIOS,EC12,BABAHOYO,EC1201,CARACOL,EC120152,"Recinto San Vicente, Recinto Mundo Celeste",-79.460943,-1.671381,La Costa,3/21/19,3:57:00 PM,3,21,2019,Rain,Heavy precipitation/ Urban/ Short duration rain,1,1,0,0,0,1,0,0,0,0,,,,,27.0,27.0,82.0,82.0,,7.0,,362.0,6,3,5,82.0,27.0,4.0,2019-03-21 20:57:00
4619,SNGRE_2021,EL ORO,EC07,ZARUMA,EC0713,ABANIN,EC071351,Ladera Baja,-79.497597,-3.334721,La Sierra,2/2/19,8:20:00 AM,2,2,2019,Rain / Landslide,Surface runoff,0,0,0,0,1,0,0,0,0,0,,,,,12.0,12.0,44.0,,,,,,6,3,5,44.0,12.0,3.0,2019-02-02 13:20:00
5202,SNGRE_2021,GUAYAS,EC09,BALAO,EC0903,BALAO,EC090350,Recinto Cien Familias y Entrada al Recinto 28 de Mayo,-79.707549,-2.8337573,La Costa,3/8/20,12:00:00 AM,3,8,2020,Rain/Overflow,Heavy precipitation/Small stream overflow,1,0,0,1,0,0,0,0,0,0,,,,,44.0,44.0,156.0,,,,,,6,3,5,156.0,44.0,5.0,2020-03-08 05:00:00
4799,SNGRE,MANABI,EC13,CHONE,EC1303,SAN ANTONIO,EC130357,Horconcitos/Barquero,-80.251442,-0.675478,La Costa,3/17/19,1:35:00 AM,3,17,2019,Rain,Surface runoff,0,0,0,0,1,0,0,0,0,0,,,,,,50.0,200.0,,,,,,6,3,5,200.0,50.0,5.0,2019-03-17 06:35:00
4801,SNGRE,MANABI,EC13,SAN VICENTE,EC1322,SAN VICENTE,EC132250,Salinas,-80.298027,-0.644713,La Costa,3/17/19,1:57:00 AM,3,17,2019,Rain,Surface runoff,0,0,0,0,1,0,0,0,0,0,,,,,,78.0,246.0,,,,,,6,3,5,246.0,78.0,5.0,2019-03-17 06:57:00
3487,Desinventar,GUAYAS,EC09,GUAYAQUIL,EC0901,MORRO,EC090153,Barrio 9 de Octubre calles 9 de Octubre y Simon Jacke,-80.317027,-2.565701,La Costa,3/3/16,7:00:00 AM,3,3,2016,Rain,Heavy precipitation/ Urban/ Short duration rain,1,1,0,0,0,1,0,0,0,0,,,,,2.0,,8.0,8.0,,,,,6,3,5,8.0,2.0,2.0,2016-03-03 12:00:00
3869,Desinventar,MANABI,EC13,PORTOVIEJO,EC1301,FRANCISCO PACHECO,EC130150,El Zapallo ,-80.412645,-1.061586,La Costa,2/26/17,8:00:00 AM,2,26,2017,Rain / Overflow,Surface runoff,0,0,0,0,1,0,0,0,0,0,,,,,2.0,,5.0,5.0,,,,,6,3,5,5.0,2.0,1.0,2017-02-26 13:00:00
3891,Desinventar,MANABI,EC13,PORTOVIEJO,EC1301,FRANCISCO PACHECO,EC130150,Las 4 esquinas Ref. Via al Zapallo,-80.439987,-1.054268,La Costa,3/2/17,7:59:00 AM,3,2,2017,Rain / Overflow,Heavy precipitation/Small stream overflow,1,0,0,1,0,0,0,0,0,0,,,,,8.0,,,32.0,,,,,6,3,5,32.0,8.0,3.0,2017-03-02 12:59:00
4726,SNGRE,MANABI,EC13,SUCRE,EC1314,CHARAPOTO,EC131453,"Varios Sectores (Pasadero, San Bartolo, San Ignacio)",-80.471857,-0.85255,La Costa,3/7/19,6:00:00 AM,3,7,2019,Rain,Surface runoff,0,0,0,0,1,0,0,0,0,0,,,,,,3.0,12.0,,,,74.0,,6,3,5,12.0,3.0,3.0,2019-03-07 11:00:00
3743,Desinventar,MANABI,EC13,SUCRE,EC1314,CHARAPOTO,EC131453,Canitas de Charapoto ,-80.479822,-0.863837,La Costa,1/30/17,12:14:00 PM,1,30,2017,Rain ,Surface runoff,0,0,0,0,1,0,0,0,0,0,,,,,10.0,,,,,,,,6,3,5,,10.0,,2017-01-30 17:14:00
4127,Desinventar,MANABI,EC13,JIPIJAPA,EC1306,PEDRO PABLO GOMEZ,EC130657,Pedro Pablo Gomes,-80.560071,-1.626473,La Costa,4/4/17,1:00:00 AM,4,4,2017,Rain ,urban/Slope,0,0,0,0,0,1,1,0,0,0,,,,,12.0,,48.0,48.0,,11.0,,,6,3,5,48.0,12.0,3.0,2017-04-04 06:00:00
3472,Desinventar,SANTA ELENA,EC24,SANTA ELENA,EC2401,SANTA ELENA,EC240150,Barrio 25 de diciembre Barrio Los Sauces Barrio Los Ceibos B,-80.859387,-2.226897,La Costa,2/28/16,3:43:00 AM,2,28,2016,Rain ,Heavy precipitation/ Urban/ Short duration rain,1,1,0,0,0,1,0,0,0,0,,,,,15.0,,75.0,75.0,,,,,6,3,5,75.0,15.0,4.0,2016-02-28 08:43:00
3470,Desinventar,SANTA ELENA,EC24,LA LIBERTAD,EC2402,LA LIBERTAD,EC240250,Barrio 10 de Agosto Barrio Abdon Calderon Barrio Velazco Iba,-80.90019,-2.230646,La Costa,2/28/16,3:43:00 AM,2,28,2016,Rain ,Heavy precipitation/ Urban/ Short duration rain,1,1,0,0,0,1,0,0,0,0,,,,1.0,5.0,,20.0,20.0,,,,,6,3,5,20.0,5.0,3.0,2016-02-28 08:43:00
3412,Desinventar,SANTA ELENA,EC24,LA LIBERTAD,EC2402,LA LIBERTAD,EC240250,Calle Ignacio Guerra y Malecon de La Libertad,-80.912485,-2.220857,La Costa,1/26/16,5:30:00 AM,1,26,2016,Rain ,Heavy precipitation/ Urban/ Short duration rain,1,1,0,0,0,1,0,0,0,0,,,,,,,,,,,,,6,3,5,,,,2016-01-26 10:30:00
3471,Desinventar,SANTA ELENA,EC24,SALINAS,EC2403,SALINAS,EC240350,Via Pta. Carnero; Cdla. Sta. Paula; sector Malecon (Av. 2da.,-80.958468,-2.223366,La Costa,2/28/16,3:43:00 AM,2,28,2016,Rain ,Heavy precipitation/ Urban/ Short duration rain,1,1,0,0,0,1,0,0,0,0,,,,,,,,,,,,,6,3,5,,,,2016-02-28 08:43:00
5270,SNGRE_2021,SUCUMBIOS,EC21,LAGO AGRIO,EC2101,PACAYACU,EC210156,Recinto El Petrolero,-76.57974,-0.0218053,El Oriente,5/9/20,10:39:00 AM,5,9,2020,Rain/Overflow,Heavy precipitation/Short duration rain,1,1,0,0,0,0,0,0,0,0,,,,,3.0,3.0,12.0,,,,,,5,4,5,12.0,3.0,3.0,2020-05-09 15:39:00
5271,SNGRE_2021,SUCUMBIOS,EC21,SHUSHUFINDI,EC2104,SHUSHUFINDI,EC210450,Brisas del Agurico.,-76.62677,-0.0482466,El Oriente,5/9/20,3:16:00 PM,5,9,2020,Rain/Overflow,Heavy precipitation/Short duration rain,1,1,0,0,0,0,0,0,0,0,,,,,6.0,6.0,24.0,,,,,,5,4,5,24.0,6.0,3.0,2020-05-09 20:16:00
4308,Desinventar,SUCUMBIOS,EC21,LAGO AGRIO,EC2101,DURENO,EC210152,Comunidad Cofan Dureno,-76.687691,0.005888,El Oriente,10/22/17,3:00:00 PM,10,22,2017,Rain / Overflow,Heavy precipitation/Short duration rain,1,1,0,0,0,0,0,0,0,0,,,,,2.0,,5.0,3.0,,,1.5,,5,4,5,5.0,2.0,1.0,2017-10-22 20:00:00
2887,Desinventar,PASTAZA,EC16,PASTAZA,EC1601,SARAYACU,EC160161,Comunidad Pakayaku.,-77.596668,-1.648173,La Sierra,10/16/14,1:41:00 PM,10,16,2014,Rain / Overflow,Heavy precipitation/ Short duration rain,1,1,0,0,0,0,0,0,0,0,,,,3.0,153.0,,21.0,61.0,,502.0,,20.0,5,4,5,61.0,153.0,4.0,2014-10-16 18:41:00
2483,Desinventar/SNGRE_2021,TUNGURAHUA,EC18,AMBATO,EC1801,UNAMUNCHO,EC180168,Samanga escuela Ernesto Bucheli,-78.589,-1.1663,La Sierra,11/18/13,11:10:00 AM,11,18,2013,Rain ,Heavy precipitation/ Short duration rain,1,1,0,0,0,0,0,0,0,0,,,,,,,,,,,,,5,4,5,,,,2013-11-18 16:10:00
5174,SNGRE_2021,LOS RIOS,EC12,VALENCIA,EC1211,VALENCIA,EC121150,Chipe,-79.348754,-0.954578,La Costa,2/27/20,8:00:00 PM,2,27,2020,Rain,Heavy precipitation/Short duration rain,1,1,0,0,0,0,0,0,0,0,,,,,5.0,5.0,15.0,,,,,,5,4,5,15.0,5.0,3.0,2020-02-28 01:00:00
3852,Desinventar,LOS RIOS,EC12,BABAHOYO,EC1201,FEBRES CORDERO (LAS JUNTAS) (CAB. EN MATA DE CACAO),EC120153,"Colombia de Latio, Valparaiso, Saltadero ",-79.353674,-1.993373,La Costa,2/21/17,11:00:00 PM,2,21,2017,Rain / Overflow,Heavy precipitation/ Short duration rain,1,1,0,0,0,0,0,0,0,0,,,,,40.0,,160.0,160.0,,,,,5,4,5,160.0,40.0,5.0,2017-02-22 04:00:00
3534,Desinventar,LOS RIOS,EC12,BABAHOYO,EC1201,FEBRES CORDERO (LAS JUNTAS) (CAB. EN MATA DE CACAO),EC120153,Mata de Cacao/ Cdla. Los Laureles,-79.378513,-1.962595,La Costa,3/13/16,11:47:00 AM,3,13,2016,Rain / Overflow,Heavy precipitation/ Short duration rain,1,1,0,0,0,0,0,0,0,0,,,,,4.0,,18.0,18.0,,18.0,,,5,4,5,18.0,4.0,3.0,2016-03-13 16:47:00
4840,SNGRE,LOS RIOS,EC12,BABAHOYO,EC1201,LA UNION,EC120155,"Coop. Vicente Rocafuerte, La Puntilla",-79.383957,-1.703669,La Costa,3/20/19,9:17:00 AM,3,20,2019,Rain,Heavy precipitation/ Short duration rain,1,1,0,0,0,0,0,0,0,0,,,,,,81.0,355.0,,,,7324.0,,5,4,5,355.0,81.0,5.0,2019-03-20 14:17:00
4792,Desinventar,LOS RIOS,EC12,BABAHOYO,EC1201,FEBRES CORDERO (LAS JUNTAS) (CAB. EN MATA DE CACAO),EC120153,Rcto. Las Palmas,-79.402944,-1.958611,La Costa,3/17/19,9:45:00 PM,3,17,2019,Rain,Heavy precipitation/ Short duration rain,1,1,0,0,0,0,0,0,0,0,,,,,6.0,66.0,198.0,18.0,,,,,5,4,5,198.0,66.0,5.0,2019-03-18 02:45:00
2745,Desinventar,ESMERALDAS,EC08,QUININDE,EC0804,CUBE,EC080451,Varios sectores,-79.569376,0.585928,La Costa,4/10/14,2:30:00 AM,4,10,2014,Rain / Overflow,Heavy precipitation / Short duration rain,1,1,0,0,0,0,0,0,0,0,,,,50.0,448.0,,146.0,2145.0,331.0,,2600.0,1070.0,5,4,5,2145.0,448.0,,2014-04-10 07:30:00
4088,SNGRE,GUAYAS,EC09,NARANJAL,EC0911,TAURA,EC091154,"Cooperativa Primero de Mayo, barrios San Zoilo y Apolo",-79.604326,-2.492734,La Costa,3/31/17,8:50:00 AM,3,31,2017,Rain / Overflow,Heavy precipitation/ Short duration rain,1,1,0,0,0,0,0,0,0,0,,,,,,,880.0,,,,,,5,4,5,880.0,,6.0,2017-03-31 13:50:00
3145,Desinventar,GUAYAS,EC09,EMPALME,EC0908,VELASCO IBARRA (CAB. EL EMPALM,EC090850,Varios sectores.,-79.632912,-1.045089,La Costa,4/22/15,9:45:00 PM,4,22,2015,Rain,Heavy precipitation/ Short duration rain,1,1,0,0,0,0,0,0,0,0,,,,,20.0,,77.0,77.0,,,,,5,4,5,77.0,20.0,4.0,2015-04-23 02:45:00
4164,SNGRE,GUAYAS,EC09,DURAN,EC0907,ELOY ALFARO (DURAN),EC090750,Cooperativa Magdalena Sector 1,-79.721659,-2.273362,La Costa,4/9/17,10:30:00 AM,4,9,2017,Rain,Heavy precipitation/ Short duration rain,1,1,0,0,0,0,0,0,0,0,,,,,,,39.0,,,,,,5,4,5,39.0,,3.0,2017-04-09 15:30:00
3510,Desinventar,GUAYAS,EC09,NARANJAL,EC0911,TAURA,EC091154,Varios Sectores (Rcto. 1ero. de Mayo Pocos Palos Las Aguas R,-79.731579,-2.310771,La Costa,3/6/16,8:00:00 PM,3,6,2016,Rain / Overflow,Heavy precipitation/ Short duration rain,1,1,0,0,0,0,0,0,0,0,,,,,41.0,,164.0,164.0,,24.0,,,5,4,5,164.0,41.0,5.0,2016-03-07 01:00:00
4230,Desinventar,EL ORO,EC07,PASAJE,EC0709,PASAJE,EC070950,"Varios Sectores (3 Cerritos, Lotizacion Santa Rita, 23 de Fe",-79.754742,-3.402282,La Costa,4/26/17,12:30:00 AM,4,26,2017,Rain ,Heavy precipitation/ Short duration rain,1,1,0,0,0,0,0,0,0,0,,,,,158.0,,676.0,676.0,,,,,5,4,5,676.0,158.0,6.0,2017-04-26 05:30:00
3352,Desinventar,GUAYAS,EC09,SALITRE,EC0919,JUNQUILLAL,EC091953,Av. Enrique Decker Acosta UE Otto Arosemena Gomez (Ex Lucila,-79.864722,-1.716438,La Costa,1/25/16,7:00:00 AM,1,25,2016,Rain ,Heavy precipitation/ Short duration rain ,1,1,0,0,0,0,0,0,0,0,,,,,,,,,,,,,5,4,5,,,,2016-01-25 12:00:00
1981,Desinventar/SNGRE_2021,GUAYAS,EC09,PALESTINA,EC0913,PALESTINA,EC091350,Recinto Cristo Consuelo como referencia a orillas del rio Pu,-79.8799,-1.6751,La Costa,3/3/13,7:00:00 PM,3,3,2013,Rain,Heavy precipitation/ Short duration rain,1,1,0,0,0,0,0,0,0,0,,,,,,,296.0,296.0,,,,,5,4,5,296.0,,5.0,2013-03-04 00:00:00
2708,Desinventar,ESMERALDAS,EC08,ATACAMES,EC0806,TONCHIGUE,EC080653,Barrios Colinas del Sol y Progreso,-79.945122,0.829641,La Costa,3/29/14,4:00:00 AM,3,29,2014,Rain ,Heavy precipitation/ Short duration rain,1,1,0,0,0,0,0,0,0,0,,,,,8.0,,40.0,40.0,,,,,5,4,5,40.0,8.0,3.0,2014-03-29 09:00:00
1935,SNGRE_2021,ESMERALDAS,EC08,MUISNE,EC0803,MUISNE,EC080350,Barrios La Invasion,-79.9459,0.6063,La Costa,2/26/13,3:00:00 AM,2,26,2013,Rain/ overflow,Heavy precipitation/ Short duration rain,1,1,0,0,0,0,0,0,0,0,,,,,10.0,,,,,,,,5,4,5,,10.0,,2013-02-26 08:00:00
2539,Desinventar/SNGRE_2021,GUAYAS,EC09,GUAYAQUIL,EC0901,TARQUI,EC090150,Cooperativa Balerio Estacio 5ta etapa MZ 1888 sector 4 Esqui,-79.967451,-2.119782,La Costa,1/21/14,12:00:00 AM,1,21,2014,Rain,Heavy precipitation/ Short duration rain,1,1,0,0,0,0,0,0,0,0,,,,,1.0,,,,,,,,5,4,5,,1.0,,2014-01-21 05:00:00
4363,Desinventar,GUAYAS,EC09,GUAYAQUIL,EC0901,PASCUALES,EC090150,Coop. Balerio Estacio bloque 1 Mz. 1776 S 6,-79.969133,-2.118517,La Costa,2/5/18,8:48:00 PM,2,5,2018,Rain ,Heavy precipitation/ Short duration rain,1,1,0,0,0,0,0,0,0,0,,,,,1.0,,1.0,1.0,,,,,5,4,5,1.0,1.0,1.0,2018-02-06 01:48:00
4218,Desinventar,GUAYAS,EC09,GUAYAQUIL,EC0901,PASCUALES,EC090150,"Monte Sinai, Varios Sectores",-80.000146,-2.11577,La Costa,4/24/17,10:00:00 PM,4,24,2017,Rain / Overflow,Heavy precipitation/ Short duration rain,1,1,0,0,0,0,0,0,0,0,,,,,39.0,,504.0,156.0,,,,,5,4,5,504.0,39.0,6.0,2017-04-25 03:00:00
3446,Desinventar,MANABI,EC13,CHONE,EC1303,CHONE,EC130350,San Pablo ,-80.122379,-0.736779,La Costa,2/17/16,7:00:00 PM,2,17,2016,Rain ,Heavy precipitation/ Short duration rain,1,1,0,0,0,0,0,0,0,0,,,,,3.0,,15.0,15.0,,,,,5,4,5,15.0,3.0,3.0,2016-02-18 00:00:00
3304,Desinventar,MANABI,EC13,CHONE,EC1303,SAN ANTONIO,EC130357,Diagonal al parque central,-80.19522,-0.663461,La Costa,1/19/16,12:20:00 AM,1,19,2016,Rain ,Heavy precipitation/ Short duration rain,1,1,0,0,0,0,0,0,0,0,,,,,2.0,,8.0,8.0,,,,,5,4,5,8.0,2.0,2.0,2016-01-19 05:20:00
3378,Desinventar,MANABI,EC13,CHONE,EC1303,SAN ANTONIO,EC130357,Las Margaritas Barquero las Brega y Badeal ,-80.19522,-0.663461,La Costa,1/25/16,10:00:00 AM,1,25,2016,Rain ,Heavy precipitation/ Short duration rain,1,1,0,0,0,0,0,0,0,0,,,,,54.0,,216.0,216.0,,,20.0,12.0,5,4,5,216.0,54.0,5.0,2016-01-25 15:00:00
3807,Desinventar,MANABI,EC13,CHONE,EC1303,SAN ANTONIO,EC130357,Varios Sectores,-80.19522,-0.663461,La Costa,2/8/17,7:00:00 PM,2,8,2017,Rain ,Heavy precipitation/ Short duration rain,1,1,0,0,0,0,0,0,0,0,,,,,37.0,,148.0,148.0,,,,,5,4,5,148.0,37.0,5.0,2017-02-09 00:00:00
5185,SNGRE_2021,MANABI,EC13,JAMA,EC1320,JAMA,EC132050,"Varios Sectores (El Matal, Voluntad de Dios, Bigua, Campamento, Cruz Roja, Salima)",-80.267273,-0.208694,La Costa,2/29/20,6:00:00 AM,2,29,2020,Rain,Heavy precipitation/Short duration rain,1,1,0,0,0,0,0,0,0,0,,,,,,41.0,,,,,,,5,4,5,,41.0,,2020-02-29 11:00:00
4383,Desinventar,MANABI,EC13,SANTA ANA,EC1313,AYACUCHO,EC131351,San Bartolo,-80.310164,-1.147621,La Costa,2/22/18,3:30:00 PM,2,22,2018,Rain / Overflow,Urban/ Small stream overflow,0,0,0,1,0,1,0,0,0,0,,,,,1.0,,7.0,7.0,7.0,7.0,,,5,4,5,7.0,1.0,2.0,2018-02-22 20:30:00
1919,SNGRE_2021,GUAYAS,EC09,PEDRO CARBO,EC0914,PEDRO CARBO,EC091450,"San Ramon, Santa Martha, El Arenoso  ",-80.3243,-1.8272,La Costa,2/18/13,6:00:00 PM,2,18,2013,Rain ,Heavy precipitation/ Short duration rain,1,1,0,0,0,0,0,0,0,0,,,,,13.0,,56.0,,,,,,5,4,5,56.0,13.0,4.0,2013-02-18 23:00:00
3912,SNGRE,MANABI,EC13,SAN VICENTE,EC1322,SAN VICENTE,EC132250,Barquero,-80.328931,-0.554501,La Costa,3/8/17,6:00:00 AM,3,8,2017,Rain ,Heavy precipitation/ Short duration rain,1,1,0,0,0,0,0,0,0,0,,,,,,,108.0,,,,,,5,4,5,108.0,,5.0,2017-03-08 11:00:00
1985,Desinventar/SNGRE_2021,MANABI,EC13,PORTOVIEJO,EC1301,RIOCHICO (RIO CHICO),EC130155,La Encantada,-80.3871,-0.9866,La Costa,3/3/13,9:40:00 AM,3,3,2013,Rain / Overflow,Heavy precipitation/ Short duration rain,1,1,0,0,0,0,0,0,0,0,,,,,1.0,,6.0,6.0,,,,,5,4,5,6.0,1.0,2.0,2013-03-03 14:40:00
3597,Desinventar,MANABI,EC13,PORTOVIEJO,EC1301,RIOCHICO (RIO CHICO),EC130155,Varios Sectores,-80.387138,-0.98658,La Costa,4/11/16,9:30:00 PM,4,11,2016,Rain ,Heavy precipitation/ Short duration rain,1,1,0,0,0,0,0,0,0,0,,,,,,,,,,,,,5,4,5,,,,2016-04-12 02:30:00
4067,Desinventar,MANABI,EC13,PORTOVIEJO,EC1301,RIOCHICO (RIO CHICO),EC130155,Varios Sectores (Sitio San Francisco -  Los Ebanitos  / Las ,-80.417375,-0.995143,La Costa,3/29/17,2:09:00 AM,3,29,2017,Rain / Overflow,Heavy precipitation/ Short duration rain,1,1,0,0,0,0,0,0,0,0,,,,,12.0,,350.0,48.0,,,,,5,4,5,350.0,12.0,5.0,2017-03-29 07:09:00
1968,Desinventar/SNGRE_2021,MANABI,EC13,PORTOVIEJO,EC1301,COLON,EC130150,La Mocora,-80.4181,-1.135,La Costa,3/3/13,8:00:00 AM,3,3,2013,Rain ,Heavy precipitation/ Short duration rain,1,1,0,0,0,0,0,0,0,0,,,,,,,,,,,,,5,4,5,,,,2013-03-03 13:00:00
4718,SNGRE,MANABI,EC13,PORTOVIEJO,EC1301,RIOCHICO (RIO CHICO),EC130155,"Las Chacras, pasando el puente",-80.420267,-0.974567,La Costa,3/6/19,8:30:00 AM,3,6,2019,Rain,Heavy precipitation/ Short duration rain,1,1,0,0,0,0,0,0,0,0,,,,,,,,,,,,,5,4,5,,,,2019-03-06 13:30:00
3423,Desinventar,MANABI,EC13,JIPIJAPA,EC1306,AMERICA,EC130651,Sambembe,-80.510608,-1.433652,La Costa,2/3/16,10:00:00 PM,2,3,2016,Rain ,Heavy precipitation/ Short duration rain,1,1,0,0,0,0,0,0,0,0,,,,,,,,,,,2.0,,5,4,5,,,,2016-02-04 03:00:00
4634,SNGRE,MANABI,EC13,JARAMIJO,EC1321,JARAMIJO,EC132150,Ciudadela Costa Mar,-80.638494,-0.956025,La Costa,2/10/19,10:00:00 AM,2,10,2019,Rain,Heavy precipitation/ Short duration rain,1,1,0,0,0,0,0,0,0,0,,,,,,5.0,20.0,,,,,,5,4,5,20.0,5.0,3.0,2019-02-10 15:00:00
3843,SNGRE,MANABI,EC13,MANTA,EC1308,MANTA,EC130850,Calle 15 Av. 10 ,-80.729229,-0.949296,La Costa,2/17/17,11:00:00 AM,2,17,2017,Rain ,Heavy precipitation/Short duration rain,1,1,0,0,0,0,0,0,0,0,,,,,,,3.0,,,,,,5,4,5,3.0,,1.0,2017-02-17 16:00:00
3100,Desinventar,MANABI,EC13,PUERTO LOPEZ,EC1319,SALANGO,EC131952,Playa de Ayampe,-80.801848,-1.677692,La Costa,3/30/15,1:00:00 PM,3,30,2015,Rain ,Heavy precipitation/ Short duration rain,1,1,0,0,0,0,0,0,0,0,,,,,20.0,,,,,,,,5,4,5,,20.0,,2015-03-30 18:00:00
2136,Desinventar/SNGRE_2021,SANTA ELENA,EC24,LA LIBERTAD,EC2402,LA LIBERTAD,EC240250,Velasco Ibarra,-80.8947,-2.2396,La Costa,3/16/13,3:30:00 AM,3,16,2013,Rain,Heavy precipitation/ Short duration rain,1,1,0,0,0,0,0,0,0,0,,,,,6.0,,30.0,6.0,,,,,5,4,5,30.0,6.0,3.0,2013-03-16 08:30:00
3261,Desinventar,SUCUMBIOS,EC21,SHUSHUFINDI,EC2104,SHUSHUFINDI,EC210450,"Barrio Central, Maria, 24 de Mayo,  Nuevo Shushufindi, La Un",-76.657172,-0.187333,El Oriente,11/7/15,5:00:00 AM,11,7,2015,Rain,Heavy precipitation,1,0,0,0,0,0,0,0,0,0,,,,,3.0,,12.0,12.0,,,,,2,5,5,12.0,3.0,3.0,2015-11-07 10:00:00
4283,SNGRE,SUCUMBIOS,EC21,SHUSHUFINDI,EC2104,SHUSHUFINDI,EC210450,"Barrio San Francisco 2, Barrio Eloy Alfaro, Barrio El Cisne, Barrio La Union, Barrio Central, Barrio 8 de Septiembre, Barrio Las Vegas, Barrio Amazonas, Pre cooperativa Atahualpa, Barrio 24 de Mayo, Barrio Los Independientes.    ",-76.661052,-0.187361,El Oriente,6/20/17,6:00:00 AM,6,20,2017,Rain ,Heavy precipitation/ Urban ,1,0,0,0,0,1,0,0,0,0,,,,,,,63.0,,6.0,,,,3,5,5,63.0,,4.0,2017-06-20 11:00:00
4284,Desinventar,ORELLANA,EC22,LA JOYA DE LOS SACHAS,EC2203,TRES DE NOVIEMBRE,EC220357,"El Porvenir, El Chamanal, Bella Sombra, Mercedes del Jivino",-76.889511,-0.169135,El Oriente,6/20/17,4:00:00 AM,6,20,2017,Rain ,Small stream overflow,0,0,0,1,0,0,0,0,0,0,,,,,,,52.0,52.0,,,15.0,,4,5,5,52.0,,4.0,2017-06-20 09:00:00
3243,Desinventar,ORELLANA,EC22,LA JOYA DE LOS SACHAS,EC2203,LA JOYA DE LOS SACHAS,EC220350,La Parker,-76.922729,-0.325835,El Oriente,8/4/15,6:00:00 PM,8,4,2015,Rain,Heavy precipitation,1,0,0,0,0,0,0,0,0,0,,,,,2.0,,6.0,6.0,,,,,2,5,5,6.0,2.0,2.0,2015-08-04 23:00:00
3686,Desinventar,NAPO,EC15,CARLOS JULIO AROSEMENA TOLA,EC1509,CARLOS JULIO AROSEMENA TOLA,EC150950,Varios,-77.832109,-1.118857,La Sierra,1/6/17,1:00:00 AM,1,6,2017,Rain / Overflow,Short duration rain,0,1,0,0,0,0,0,0,0,0,,,,,,,36.0,36.0,,,25.47,,3,5,5,36.0,,3.0,2017-01-06 06:00:00
2490,Desinventar/SNGRE_2021,NAPO,EC15,CARLOS JULIO AROSEMENA TOLA,EC1509,CARLOS JULIO AROSEMENA TOLA,EC150950,Nueva Esperanza,-77.8762,-1.1555,La Sierra,11/28/13,10:29:00 PM,11,28,2013,Rain ,Heavy precipitation/ Short duration rain,1,1,0,0,0,0,0,0,0,0,,,,,,,2.0,2.0,,,,,5,5,5,2.0,,1.0,2013-11-29 03:29:00
3443,Desinventar,MORONA SANTIAGO,EC14,MORONA,EC1401,SEVILLA DON BOSCO,EC140157,Saunts,-78.00888,-2.243675,La Sierra,2/12/16,9:00:00 AM,2,12,2016,Rain ,Heavy precipitation/ Urban ,1,0,0,0,0,1,0,0,0,0,,,,,2.0,,8.0,8.0,,,,,3,5,5,8.0,2.0,2.0,2016-02-12 14:00:00
3191,SNGRE,TUNGURAHUA,EC18,BAÑOS DE AGUA SANTA,EC1802,RÍO NEGRO,EC180252,Caserio San Francisco sector La Floresta.,-78.191923,-1.40451,La Sierra,5/16/15,9:00:00 PM,5,16,2015,Rain ,Urban,0,0,0,0,0,1,0,0,0,0,,,,,,,67.0,,,,,,1,5,5,67.0,,4.0,2015-05-17 02:00:00
5033,SNGRE_2021,CARCHI,EC04,MIRA,EC0404,JIJON Y CAAMAÑO (CAB. EN RIO B,EC040452,"Concepcion 2, via Rio Verde - Las Praderas",-78.2774,0.785,La Sierra,11/11/19,6:00:00 AM,11,11,2019,Overflow,Artificial waterway overflow,0,0,1,0,0,0,0,0,0,0,,,,,,,,,,,,,1,5,5,,,,2019-11-11 11:00:00
2379,Desinventar/SNGRE_2021,PICHINCHA,EC17,QUITO,EC1701,GUAYLLABAMBA,EC170163,Calle 10 de agosto barrio San Lorenzo,-78.3449,-0.0601,La Sierra,5/4/13,4:44:00 PM,5,4,2013,Rain,Heavy precipitation,1,0,0,0,0,0,0,0,0,0,,,,,1.0,,4.0,4.0,,,,,2,5,5,4.0,1.0,1.0,2013-05-04 21:44:00
4895,SNGRE,PICHINCHA,EC17,QUITO,EC1701,GUAYLLABAMBA,EC170163,Por la Unidad Educativa Luis Pasteur.,-78.34658,-0.059928,La Sierra,4/2/19,8:22:00 PM,4,2,2019,Rain / Overflow,Artificial waterway overflow/ Small stream overflow,0,0,1,1,0,0,0,0,0,0,,,,,,1.0,6.0,,,,,,5,5,5,6.0,1.0,2.0,2019-04-03 01:22:00
3210,Desinventar,ZAMORA CHINCHIPE,EC19,EL PANGUI,EC1906,EL GUISME,EC190651,Guisme,-78.56496,-3.556473,La Sierra,6/16/15,6:00:00 AM,6,16,2015,Rain / Overflow,Small stream overflow,0,0,0,1,0,0,0,0,0,0,,,,,1.0,,4.0,4.0,,,,,4,5,5,4.0,1.0,1.0,2015-06-16 11:00:00
3934,SNGRE,IMBABURA,EC10,OTAVALO,EC1004,SELVA ALEGRE (CAB.EN SAN MIGUEL DE PAMPLONA),EC100459,Quinde La Libertad ,-78.565663,0.263101,La Sierra,3/14/17,10:30:00 AM,3,14,2017,Rain / Overflow,Heavy precipitation,1,0,0,0,0,0,0,0,0,0,,,,,,,4.0,,,,,,2,5,5,4.0,,1.0,2017-03-14 15:30:00
2671,Desinventar/SNGRE_2021,IMBABURA,EC10,OTAVALO,EC1004,SELVA ALEGRE (CAB.EN SAN MIGUEL DE PAMPLONA),EC100459,Via Selva Alegre Km12,-78.565672,0.26377,La Sierra,3/2/14,6:30:00 PM,3,2,2014,Rain ,Urban,0,0,0,0,0,1,0,0,0,0,,,,,3.0,,10.0,6.0,,,,,1,5,5,10.0,3.0,2.0,2014-03-02 23:30:00
3151,Desinventar/SNGRE_2021,MORONA SANTIAGO,EC14,GUALAQUIZA,EC1402,BOMBOIZA,EC140253,"Ayampaz, Kampana, Narvaez, Condor, Santa Rosa",-78.584628,-3.5274923,La Sierra,4/26/15,3:00:00 PM,4,26,2015,Rain / Overflow,Heavy precipitation,1,0,0,0,0,0,0,0,0,0,,,,,,,,,,,,,2,5,5,,,,2015-04-26 20:00:00
5230,SNGRE_2021,COTOPAXI,EC05,LATACUNGA,EC0501,IGNACIO FLORES (PARQUE FLORES),EC050150,Complejo San Andres de la Ciudadela Mario Mogollon,-78.606832,-0.972561,La Sierra,4/1/20,5:23:00 PM,4,1,2020,Rain,Urban,0,0,0,0,0,1,0,0,0,0,,,,,1.0,1.0,,,,,,,1,5,5,,1.0,,2020-04-01 22:23:00
3393,Desinventar,ESMERALDAS,EC08,SAN LORENZO,EC0805,SANTA RITA,EC080559,VARIOS SECTORES ( TORTUGA SAN FRANCISCO),-78.723833,1.10086,La Costa,1/25/16,6:00:00 AM,1,25,2016,Rain,Heavy precipitation,1,0,0,0,0,0,0,0,0,0,,,,,,,,,,,17.0,6.0,2,5,5,,,,2016-01-25 11:00:00
3727,Desinventar,ESMERALDAS,EC08,SAN LORENZO,EC0805,CARONDELET,EC080554,Cabecera Parroquial Carondelet,-78.763092,1.123148,La Costa,1/20/17,7:34:00 AM,1,20,2017,Rain,Short duration rain/ urban,0,1,0,0,0,1,0,0,0,0,,,,,30.0,,150.0,150.0,,,,,4,5,5,150.0,30.0,5.0,2017-01-20 12:34:00
3209,Desinventar,ZAMORA CHINCHIPE,EC19,ZAMORA,EC1901,CUMBARATZA,EC190151,Barrio La Quebrada,-78.874437,-4.00218,La Sierra,6/16/15,10:00:00 AM,6,16,2015,Long duration rain,Urban,0,0,0,0,0,1,0,0,0,0,,,,,1.0,,5.0,5.0,,,,,1,5,5,5.0,1.0,1.0,2015-06-16 15:00:00
4354,Desinventar,ZAMORA CHINCHIPE,EC19,ZAMORA,EC1901,CUMBARATZA,EC190151,La Quebrada,-78.875131,-4.001847,La Sierra,1/15/18,3:10:00 PM,1,15,2018,Rain ,Urban,0,0,0,0,0,1,0,0,0,0,,,,,1.0,,5.0,5.0,,,,,1,5,5,5.0,1.0,1.0,2018-01-15 20:10:00
5319,SNGRE_2021,ZAMORA CHINCHIPE,EC19,ZAMORA,EC1901,CUMBARATZA,EC190151,Quebrada de Cumbaratza,-78.875777,-4.0031924,La Sierra,7/4/20,5:00:00 AM,7,4,2020,Rain/Overflow,Small stream overflow,0,0,0,1,0,0,0,0,0,0,,,,,2.0,3.0,9.0,,,,,,4,5,5,9.0,3.0,2.0,2020-07-04 10:00:00
3578,Desinventar,ZAMORA CHINCHIPE,EC19,ZAMORA,EC1901,TIMBARA,EC190156,Timbara ,-78.901865,-4.073041,La Sierra,4/4/16,7:45:00 PM,4,4,2016,Rain / Overflow,Urban/ Small stream overflow,0,0,0,1,0,1,0,0,0,0,,,,,,,,,,,,,5,5,5,,,,2016-04-05 00:45:00
5175,SNGRE_2021,ZAMORA CHINCHIPE,EC19,YACUAMBI,EC1904,28 DE MAYO (SAN JOSE DE YACUAM,EC190450,La Florida - Chorrera.,-78.903375,-3.6441144,La Sierra,2/28/20,1:53:00 PM,2,28,2020,Rain/Overflow,Small stream overflow,0,0,0,1,0,0,0,0,0,0,,,,1.0,,,,,4.0,,,,4,5,5,,,,2020-02-28 18:53:00
5317,SNGRE_2021,ZAMORA CHINCHIPE,EC19,ZAMORA,EC1901,ZAMORA,EC190150,"Tunantza, La Chacra",-78.921317,-4.050819,La Sierra,6/27/20,5:00:00 AM,6,27,2020,Rain/Overflow,Small stream overflow,0,0,0,1,0,0,0,0,0,0,,,,,1.0,1.0,7.0,,,7.0,,,4,5,5,7.0,1.0,2.0,2020-06-27 10:00:00
5322,SNGRE_2021,ZAMORA CHINCHIPE,EC19,ZAMORA,EC1901,ZAMORA,EC190150,"Tunantza, La Chacra",-78.921317,-4.050819,La Sierra,7/6/20,4:00:00 AM,7,6,2020,Rain/Overflow,Small stream overflow,0,0,0,1,0,0,0,0,0,0,,,,,2.0,2.0,12.0,,,,,,4,5,5,12.0,2.0,3.0,2020-07-06 09:00:00
3298,Desinventar,AZUAY,EC01,CUENCA,EC0101,LLACAO,EC010156,San Pedro. ,-78.927336,-2.841844,La Sierra,1/13/16,3:00:00 PM,1,13,2016,Rain ,Urban,0,0,0,0,0,1,0,0,0,0,,,,,1.0,,5.0,5.0,,,,,1,5,5,5.0,1.0,1.0,2016-01-13 20:00:00
2468,SNGRE_2021,AZUAY,EC01,CUENCA,EC0101,CUENCA,EC010150,"MACHANGARA-Ucubamba, Jardines del Rio  ",-78.9417,-2.8641,La Sierra,10/23/13,3:47:00 PM,10,23,2013,Rain / Overflow,Small stream overflow,0,0,0,1,0,0,0,0,0,0,,,,,6.0,,,,,,,,4,5,5,,6.0,,2013-10-23 20:47:00
2427,SNGRE_2021,AZUAY,EC01,CUENCA,EC0101,RICAURTE,EC010162,El Progreso ,-78.9423,-2.8641,La Sierra,7/3/13,3:30:00 PM,7,3,2013,Rain ,Heavy precipitation,1,0,0,0,0,0,0,0,0,0,,,,,2.0,,,,,,,,2,5,5,,2.0,,2013-07-03 20:30:00
2197,Desinventar,AZUAY,EC01,CUENCA,EC0101,MACHÁNGARA,EC010150,Ucubamba,-78.949513,-2.877544,La Sierra,3/25/13,3:10:00 PM,3,25,2013,Rain / Overflow,Heavy precipitation,1,0,0,0,0,0,0,0,0,0,,,,,,,,,,,,,2,5,5,,,,2013-03-25 20:10:00
2467,Desinventar,AZUAY,EC01,CUENCA,EC0101,MACHÁNGARA,EC010150,Ucubamba. Jardines del Rio,-78.956068,-2.887191,La Sierra,10/23/13,3:47:00 PM,10,23,2013,Overflow,Small stream overflow,0,0,0,1,0,0,0,0,0,0,,,,,6.0,,,,,,,,4,5,5,,6.0,,2013-10-23 20:47:00
5340,SNGRE_2021,AZUAY,EC01,CUENCA,EC0101,CUENCA,EC010150,Huaynacapac- Autopista Cuenca Azogues-Hernan Malo,-79.001028,-2.921538,La Sierra,9/18/20,6:58:00 PM,9,18,2020,Rain,Urban,0,0,0,0,0,1,0,0,0,0,,,,,2.0,2.0,12.0,,,,,,1,5,5,12.0,2.0,3.0,2020-09-18 23:58:00
5247,SNGRE_2021,ZAMORA CHINCHIPE,EC19,ZAMORA,EC1901,SABANILLA,EC190155,"El Retorno, Via Loja- Zamora [E50]",-79.01891,-3.9623266,La Sierra,4/30/20,12:39:00 PM,4,30,2020,Rain/Overflow,Small stream overflow,0,0,0,1,0,0,0,0,0,0,,,,,,,,,,,,,4,5,5,,,,2020-04-30 17:39:00
2718,Desinventar,ESMERALDAS,EC08,RIOVERDE,EC0807,LAGARTO,EC080753,Bocana de Lagarto,-79.217618,1.005573,La Costa,3/30/14,8:30:00 AM,3,30,2014,Rain ,Heavy precipitation,1,0,0,0,0,0,0,0,0,0,,,,,2.0,,10.0,10.0,,,,,2,5,5,10.0,2.0,2.0,2014-03-30 13:30:00
3355,Desinventar,ESMERALDAS,EC08,RIOVERDE,EC0807,LAGARTO,EC080753,VARIOS SECTORES (LAGARTO LAS DELICIAS PIQUIGUAL NARANJITO PI,-79.221556,0.989169,La Costa,1/25/16,6:00:00 AM,1,25,2016,Rain,Heavy precipitation,1,0,0,0,0,0,0,0,0,0,,,,,,,,,,,75.0,4.0,2,5,5,,,,2016-01-25 11:00:00
3532,Desinventar,PICHINCHA,EC17,PUERTO QUITO,EC1709,PUERTO QUITO,EC170950,Sector Turistico: Balneario la Playita Ecovillas Eco Aldea S,-79.250469,0.119794,La Costa,3/12/16,1:00:00 AM,3,12,2016,Rain / Overflow,Heavy precipitation,1,0,0,0,0,0,0,0,0,0,,,,,8.0,,22.0,22.0,,,,,2,5,5,22.0,8.0,3.0,2016-03-12 06:00:00
4469,Desinventar,ESMERALDAS,EC08,RIOVERDE,EC0807,LAGARTO,EC080753,Barrio Malecon,-79.279631,1.049319,La Costa,5/23/18,2:53:00 PM,5,23,2018,Long duration Rain / Overflow,Short duration rain,0,1,0,0,0,0,0,0,0,0,,,,,21.0,,80.0,80.0,46.0,80.0,,,3,5,5,80.0,21.0,4.0,2018-05-23 19:53:00
4231,Desinventar,CANAR,EC03,LA TRONCAL,EC0304,LA TRONCAL,EC030450,Cochancay - Los Helechos,-79.293225,-2.464594,La Costa,4/26/17,7:31:00 PM,4,26,2017,Rain / Overflow,Small stream overflow,0,0,0,1,0,0,0,0,0,0,,,,1.0,,,1.0,,,1.0,,,4,5,5,1.0,,1.0,2017-04-27 00:31:00
2216,Desinventar/SNGRE_2021,LOS RIOS,EC12,VALENCIA,EC1211,VALENCIA,EC121150,Luis Felipe Diaz - La Moderna,-79.3066,-0.7775,La Costa,3/27/13,7:20:00 PM,3,27,2013,Rain ,Heavy precipitation,1,0,0,0,0,0,0,0,0,0,,,,,14.0,,70.0,70.0,,,,,2,5,5,70.0,14.0,4.0,2013-03-28 00:20:00
3365,Desinventar,ESMERALDAS,EC08,RIOVERDE,EC0807,MONTALVO (CAB EN HORQUETA),EC080754,MONTALVO,-79.307024,1.050446,La Costa,1/25/16,6:00:00 AM,1,25,2016,Rain,Heavy precipitation,1,0,0,0,0,0,0,0,0,0,,,,,,,,,,,8.0,3.0,2,5,5,,,,2016-01-25 11:00:00
4024,Desinventar,ESMERALDAS,EC08,RIOVERDE,EC0807,MONTALVO (CAB EN HORQUETA),EC080754,Varios sectores,-79.312037,1.049626,La Costa,3/25/17,5:00:00 AM,3,25,2017,Rain,Heavy precipitation/Urban,1,0,0,0,0,1,0,0,0,0,,,,,80.0,,460.0,460.0,,,,,3,5,5,460.0,80.0,5.0,2017-03-25 10:00:00
3632,Desinventar,ESMERALDAS,EC08,RIOVERDE,EC0807,MONTALVO (CAB EN HORQUETA),EC080754,BARRIO SAN GREGORIO,-79.312772,1.053831,La Costa,5/25/16,2:00:00 AM,5,25,2016,Rain / Overflow,Heavy precipitation,1,0,0,0,0,0,0,0,0,0,,,,,50.0,,,,,,,,2,5,5,,50.0,,2016-05-25 07:00:00
4393,Desinventar,LOS RIOS,EC12,QUINSALOMA,EC1213,QUINSALOMA,EC121350,San Gabriel,-79.313923,-1.207071,La Costa,2/24/18,3:00:00 AM,2,24,2018,Rain / Overflow,Heavy precipitation/ Short duration rain,1,1,0,0,0,0,0,0,0,0,,,,,1.0,,,4.0,,,50.0,5.0,5,5,5,4.0,1.0,1.0,2018-02-24 08:00:00
3382,Desinventar,LOS RIOS,EC12,QUINSALOMA,EC1213,QUINSALOMA,EC121350,Estero de Damas,-79.314748,-1.210101,La Costa,1/25/16,6:52:00 AM,1,25,2016,Rain ,Heavy precipitation,1,0,0,0,0,0,0,0,0,0,,,,,1.0,,11.0,11.0,,,,,2,5,5,11.0,1.0,3.0,2016-01-25 11:52:00
3373,Desinventar,ESMERALDAS,EC08,RIOVERDE,EC0807,ROCAFUERTE,EC080755,VARIOS SECTORES ( CHUNGUILLO ROCAFUERTE-CABECERA PARROQUIAL),-79.365779,0.968518,La Costa,1/25/16,6:00:00 AM,1,25,2016,Rain,Heavy precipitation,1,0,0,0,0,0,0,0,0,0,,,,,,,,,,,27.5,10.0,2,5,5,,,,2016-01-25 11:00:00
3413,Desinventar,LOS RIOS,EC12,BABAHOYO,EC1201,LA UNION,EC120155,El Roble La Esperanza,-79.380431,-1.72047,La Costa,1/26/16,5:30:00 PM,1,26,2016,Rain ,Heavy precipitation,1,0,0,0,0,0,0,0,0,0,,,,,9.0,,31.0,31.0,,31.0,,,2,5,5,31.0,9.0,3.0,2016-01-26 22:30:00
3581,Desinventar,LOS RIOS,EC12,BABAHOYO,EC1201,LA UNION,EC120155,Beldacos via Tres Marias,-79.380431,-1.72047,La Costa,4/5/16,11:30:00 AM,4,5,2016,Overflow,River bank failure,0,0,0,0,0,0,0,1,0,0,,,,,2.0,,221.0,221.0,,2.0,,,4,5,5,221.0,2.0,5.0,2016-04-05 16:30:00
3715,Desinventar,LOS RIOS,EC12,BABAHOYO,EC1201,LA UNION,EC120155,Recinto La Esperanza y Recinto San Juan,-79.380431,-1.72047,La Costa,1/15/17,9:45:00 AM,1,15,2017,Rain ,Heavy precipitation/ Short duration rain,1,1,0,0,0,0,0,0,0,0,,,,,25.0,,83.0,83.0,,,,,5,5,5,83.0,25.0,4.0,2017-01-15 14:45:00
4198,Desinventar,SANTO DOMINGO DE LOS TSACHILAS,EC23,SANTO DOMINGO,EC2301,SAN JACINTO DEL BUA,EC230154,La colonia Recinto la flecha,-79.396135,-0.138532,La Costa,4/18/17,10:58:00 AM,4,18,2017,Rain ,Heavy precipitation/ Short duration rain,1,1,0,0,0,0,0,0,0,0,,,,,2.0,,7.0,7.0,,,,,5,5,5,7.0,2.0,2.0,2017-04-18 15:58:00
281,SNGRE_2021,LOS RIOS,EC12,MONTALVO,EC1203,MONTALVO,EC120350,Los Beldacos,-79.4,-1.79,La Costa,4/6/10,3:15:00 PM,4,6,2010,Overflow,River bank failure,0,0,0,0,0,0,0,1,0,0,,,,,,,,,,,,,4,5,5,,,,2010-04-06 20:15:00
3139,Desinventar,ESMERALDAS,EC08,QUININDE,EC0804,LA UNION,EC080455,Recinto Alto Tambo.,-79.406312,0.18772,La Costa,4/21/15,6:00:00 PM,4,21,2015,Rain ,Heavy precipitation,1,0,0,0,0,0,0,0,0,0,,,,,3.0,,,,,,,,2,5,5,,3.0,,2015-04-21 23:00:00
4366,Desinventar,LOS RIOS,EC12,MONTALVO,EC1203,MONTALVO,EC120350,Rcto. 24 de Mayo,-79.40896,-1.851143,La Costa,2/10/18,7:40:00 AM,2,10,2018,Rain / Overflow/Failure,River bank failure,0,0,0,0,0,0,0,1,0,0,,,,,1.0,,611.0,8.0,,8.0,493.0,50.0,4,5,5,611.0,1.0,6.0,2018-02-10 12:40:00
4018,SNGRE,ESMERALDAS,EC08,RIOVERDE,EC0807,CHUMUNDE,EC080752,Varios Sectores,-79.41872,0.830496,La Costa,3/25/17,5:00:00 AM,3,25,2017,Rain,Heavy precipitation/Urban,1,0,0,0,0,1,0,0,0,0,,,,,,,540.0,,,,,,3,5,5,540.0,,6.0,2017-03-25 10:00:00
2787,Desinventar,GUAYAS,EC09,SIMON BOLIVAR,EC0922,SIMON BOLIVAR,EC092250,Tres Postes,-79.451337,-2.003232,La Costa,5/7/14,4:40:00 PM,5,7,2014,Rain,Heavy precipitation,1,0,0,0,0,0,0,0,0,0,,,,,,,,,,,,,2,5,5,,,,2014-05-07 21:40:00
2330,Desinventar/SNGRE_2021,LOS RIOS,EC12,VENTANAS,EC1207,VENTANAS,EC120750,5 de Agosto; Los Girasoles y La poza,-79.4622,-1.3926,La Costa,4/20/13,8:40:00 AM,4,20,2013,Rain ,Heavy precipitation/ Short duration rain,1,1,0,0,0,0,0,0,0,0,,,,,32.0,,160.0,160.0,,,,,5,5,5,160.0,32.0,5.0,2013-04-20 13:40:00
2325,Desinventar/SNGRE_2021,LOS RIOS,EC12,URDANETA,EC1206,RICAURTE,EC120651,Ricaurte ( todo afectado por la inundacion),-79.4671,-1.5711,La Costa,4/20/13,9:00:00 AM,4,20,2013,Rain / Overflow,Heavy precipitation/ Short duration rain,1,1,0,0,0,0,0,0,0,0,,,,,160.0,,800.0,800.0,,,,,5,5,5,800.0,160.0,6.0,2013-04-20 14:00:00
1933,SNGRE_2021,LOS RIOS,EC12,URDANETA,EC1206,CATARAMA,EC120650,"El Roblecito, Los Cerritos, Guapara, y La America",-79.4859,-1.5817,La Costa,2/26/13,9:30:00 AM,2,26,2013,Overflow,River Bank Failure,0,0,0,0,0,0,0,1,0,0,,,,,15.0,,60.0,,,,50.0,,4,5,5,60.0,15.0,4.0,2013-02-26 14:30:00
4757,Desinventar,GUAYAS,EC09,ALFREDO BAQUERIZO MORENO,EC0902,ALFREDO BAQUERIZO MORENO (JUJA,EC090250,Recinto San Antonio Sector (La Pastora),-79.525187,-1.93043,La Costa,3/10/19,1:05:00 PM,3,10,2019,Rain / Overflow/ Failure,River Bank Failure,0,0,0,0,0,0,0,1,0,0,,,,,1.0,1.0,2.0,2.0,,2.0,,,4,5,5,2.0,1.0,1.0,2019-03-10 18:05:00
3504,Desinventar,GUAYAS,EC09,NARANJAL,EC0911,JESUS MARIA,EC091151,Coop. 12 de Octubre,-79.52813,-2.580933,La Costa,3/6/16,5:24:00 AM,3,6,2016,Rain,Heavy precipitation/ Urban,1,0,0,0,0,1,0,0,0,0,,,,,5.0,,20.0,20.0,,,,,3,5,5,20.0,5.0,3.0,2016-03-06 10:24:00
4199,Desinventar,MANABI,EC13,EL CARMEN,EC1304,EL CARMEN,EC130450,Varios Sectores  (Calle Latacunga y 18 de Octubre; el Antigu,-79.532754,-0.395226,La Costa,4/19/17,9:00:00 AM,4,19,2017,Rain ,Urban,0,0,0,0,0,1,0,0,0,0,,,,,16.0,,57.0,57.0,,,,,1,5,5,57.0,16.0,4.0,2017-04-19 14:00:00
4181,Desinventar,ESMERALDAS,EC08,LA CONCORDIA,EC0808,MONTERREY,EC080851,Varios Sectores de Monterrey,-79.53674,-0.05167,La Costa,4/13/17,7:56:00 PM,4,13,2017,Rain ,Heavy precipitation/Short duration rain,1,1,0,0,0,0,0,0,0,0,,1.0,,,3.0,,19.0,19.0,,,,,5,5,5,19.0,3.0,3.0,2017-04-14 00:56:00
1955,SNGRE_2021,ESMERALDAS,EC08,LA CONCORDIA,EC0808,MONTERREY,EC080851,Varios sectores,-79.5389,-0.0565,La Costa,3/2/13,6:00:00 PM,3,2,2013,Rain ,Heavy precipitation,1,0,0,0,0,0,0,0,0,0,,,,,6.0,,28.0,,,8.0,,,2,5,5,28.0,6.0,3.0,2013-03-02 23:00:00
4752,SNGRE,MANABI,EC13,EL CARMEN,EC1304,WILFRIDO LOOR MOREIRA (MAICITO),EC130451,Maicito,-79.587845,-0.268775,La Costa,3/7/19,7:34:00 AM,3,7,2019,Rain,Heavy precipitation,1,0,0,0,0,0,0,0,0,0,,,,,,,,,,,,,2,5,5,,,,2019-03-07 12:34:00
4873,Desinventar,GUAYAS,EC09,EMPALME,EC0908,VELASCO IBARRA (CAB. EL EMPALM,EC090850,TUNGURAHUA JUAN MONTALVO,-79.647334,-1.045864,La Costa,3/22/19,11:31:00 AM,3,22,2019,Rain,heavy precipitation / Surface runoof,1,0,0,0,0,0,0,0,0,0,,,,,,,,,,,,,2,5,5,,,,2019-03-22 16:31:00
5131,SNGRE_2021,ESMERALDAS,EC08,ESMERALDAS,EC0801,5 DE AGOSTO,EC080150,Propicia 2 (La Chamera),-79.661297,0.930903,La Costa,2/23/20,4:00:00 AM,2,23,2020,Rain,Heavy precipitation,1,0,0,0,0,0,0,0,0,0,,,,,2.0,2.0,5.0,,,,,,2,5,5,5.0,2.0,1.0,2020-02-23 09:00:00
2522,Desinventar,ESMERALDAS,EC08,ESMERALDAS,EC0801,5 DE AGOSTO,EC080150,"Codesa, primer semaforo a la izquierda una cuadra, hacia la ",-79.665378,0.932495,La Costa,1/19/14,9:24:00 AM,1,19,2014,Rain,Urban,0,0,0,0,0,1,0,0,0,0,,,,,10.0,,,,,,,,1,5,5,,10.0,,2014-01-19 14:24:00
2672,Desinventar,ESMERALDAS,EC08,ESMERALDAS,EC0801,5 DE AGOSTO,EC080150,islas Luis Vargas Torres y Roberto Luis Cervantes,-79.667297,0.94021,La Costa,3/3/14,6:00:00 PM,3,3,2014,Rain ,Heavy precipitation,1,0,0,0,0,0,0,0,0,0,,,,,,,15.0,,,,,,2,5,5,15.0,,3.0,2014-03-03 23:00:00
3410,Desinventar,ESMERALDAS,EC08,ESMERALDAS,EC0801,5 DE AGOSTO,EC080150,ISLA LUIS VARGAS TORRES,-79.667297,0.94021,La Costa,1/26/16,2:30:00 AM,1,26,2016,Rain / Overflow,Heavy precipitation/ Urban,1,0,0,0,0,1,0,0,0,0,,,,,138.0,,582.0,582.0,582.0,,,,3,5,5,582.0,138.0,6.0,2016-01-26 07:30:00
3316,Desinventar,ESMERALDAS,EC08,ESMERALDAS,EC0801,5 DE AGOSTO,EC080150,LA PROPICIA 1 (BARRIO LA CHAMERA),-79.66937,0.924935,La Costa,1/25/16,11:00:00 PM,1,25,2016,Rain / Overflow,Heavy precipitation,1,0,0,0,0,0,0,0,0,0,,,,,123.0,,551.0,551.0,551.0,,,,2,5,5,551.0,123.0,6.0,2016-01-26 04:00:00
5132,SNGRE_2021,ESMERALDAS,EC08,ESMERALDAS,EC0801,5 DE AGOSTO,EC080150,Codesa,-79.672078,0.931951,La Costa,2/23/20,11:34:00 PM,2,23,2020,Rain,Heavy precipitation/Urban,1,0,0,0,0,1,0,0,0,0,,,,,1.0,1.0,10.0,,,,,,3,5,5,10.0,1.0,2.0,2020-02-24 04:34:00
2517,Desinventar,ESMERALDAS,EC08,ESMERALDAS,EC0801,SIMON PLATA TORRES,EC080150,"La Tolita  2, via 14, manzana 14",-79.679311,0.916148,La Costa,1/16/14,11:00:00 AM,1,16,2014,Rain,Heavy precipitation,1,0,0,0,0,0,0,0,0,0,,,,,1.0,,3.0,3.0,,,,,2,5,5,3.0,1.0,1.0,2014-01-16 16:00:00
2924,Desinventar,ESMERALDAS,EC08,ESMERALDAS,EC0801,SIMON PLATA TORRES,EC080150,Barrio 31 de Mayo - San Rafael,-79.684553,0.904492,La Costa,1/15/15,11:39:00 AM,1,15,2015,Rain ,Urban / Short duration rain,0,1,0,0,0,1,0,0,0,0,,,,,6.0,,42.0,42.0,,,,,4,5,5,42.0,6.0,3.0,2015-01-15 16:39:00
3394,Desinventar,ESMERALDAS,EC08,ESMERALDAS,EC0801,SIMON PLATA TORRES,EC080150,50 CASAS,-79.690235,0.923496,La Costa,1/25/16,6:00:00 AM,1,25,2016,Rain/ Overflow,Heavy precipitation/ Urban,1,0,0,0,0,1,0,0,0,0,,,,,112.0,,426.0,426.0,426.0,,,,3,5,5,426.0,112.0,5.0,2016-01-25 11:00:00
5195,SNGRE_2021,ESMERALDAS,EC08,ESMERALDAS,EC0801,SIMON PLATA TORRES,EC080150,La Josefina,-79.698376,0.91794,La Costa,3/6/20,6:00:00 AM,3,6,2020,Rain,Heavy precipitation,1,0,0,0,0,0,0,0,0,0,,,,,2.0,2.0,7.0,,,,,,2,5,5,7.0,2.0,2.0,2020-03-06 11:00:00
5196,SNGRE_2021,ESMERALDAS,EC08,ESMERALDAS,EC0801,SIMON PLATA TORRES,EC080150,Lucha de los Pobres/ Los Ebanos,-79.698376,0.91794,La Costa,3/6/20,5:00:00 AM,3,6,2020,Rain,Heavy precipitation,1,0,0,0,0,0,0,0,0,0,,,,,1.0,1.0,3.0,,,,,,2,5,5,3.0,1.0,1.0,2020-03-06 10:00:00
2701,Desinventar,ESMERALDAS,EC08,ESMERALDAS,EC0801,SIMON PLATA TORRES,EC080150,La Floresta,-79.702536,0.899233,La Costa,3/24/14,1:30:00 AM,3,24,2014,Rain,Heavy precipitation/ Urban/ Strong current,1,0,0,0,0,0,0,0,0,0,,,,,4.0,,23.0,23.0,,,,,2,5,5,23.0,4.0,3.0,2014-03-24 06:30:00
3409,Desinventar,ESMERALDAS,EC08,ESMERALDAS,EC0801,VUELTA LARGA,EC080168,CABECERA PARROQUIAL,-79.710827,0.885106,La Costa,1/25/16,6:00:00 AM,1,25,2016,Rain ,Heavy precipitation,1,0,0,0,0,0,0,0,0,0,,,,,41.0,,203.0,203.0,203.0,203.0,,,2,5,5,203.0,41.0,5.0,2016-01-25 11:00:00
4029,SNGRE,ESMERALDAS,EC08,ESMERALDAS,EC0801,VUELTA LARGA,EC080168,Vuelta Larga,-79.710827,0.885106,La Costa,3/25/17,10:00:00 PM,3,25,2017,Rain,Heavy precipitation/Urban,1,0,0,0,0,1,0,0,0,0,,,,,,,2133.0,,,,,,3,5,5,2133.0,,,2017-03-26 03:00:00
2602,Desinventar,ESMERALDAS,EC08,ESMERALDAS,EC0801,SIMON PLATA TORRES,EC080150,Ciudadela Gatazo,-79.711919,0.894623,La Costa,2/4/14,10:20:00 AM,2,4,2014,Rain ,Urban,0,0,0,0,0,1,0,0,0,0,,,,,8.0,,40.0,40.0,,,,,1,5,5,40.0,8.0,3.0,2014-02-04 15:20:00
2706,Desinventar,ESMERALDAS,EC08,ESMERALDAS,EC0801,SIMON PLATA TORRES,EC080150,Barrio Judiciales,-79.715802,0.890012,La Costa,3/29/14,5:30:00 AM,3,29,2014,Rain ,Heavy precipitation/ Urban ,1,0,0,0,0,1,0,0,0,0,,,,,80.0,,400.0,400.0,,,,,3,5,5,400.0,80.0,5.0,2014-03-29 10:30:00
3848,Desinventar,EL ORO,EC07,PINAS,EC0710,MOROMORO (CAB. EN EL VADO),EC071053,La Florida,-79.764296,-3.668861,La Sierra,2/20/17,12:57:36 PM,2,20,2017,Rain,Short duration rain,0,1,0,0,0,0,0,0,0,0,,,,,1.0,,1.0,1.0,,1.0,,,3,5,5,1.0,1.0,1.0,2017-02-20 17:57:36
3603,Desinventar,EL ORO,EC07,PINAS,EC0710,SARACAY,EC071056,El Triunfo,-79.836815,-3.667494,La Sierra,4/12/16,9:10:00 PM,4,12,2016,Rain ,Heavy precipitation/ Urban,1,0,0,0,0,1,0,0,0,0,,,,1.0,,,10.0,10.0,,,,,3,5,5,10.0,,2.0,2016-04-13 02:10:00
3890,Desinventar,EL ORO,EC07,SANTA ROSA,EC0712,VICTORIA,EC071256,Rio Negro,-79.838152,-3.395322,La Costa,3/1/17,2:40:00 AM,3,1,2017,Rain ,Short duration rain,0,1,0,0,0,0,0,0,0,0,,,,,12.0,,40.0,40.0,,,,,3,5,5,40.0,12.0,3.0,2017-03-01 07:40:00
3944,Desinventar,EL ORO,EC07,PINAS,EC0710,SARACAY,EC071056,Ciudadela Central,-79.858926,-3.646776,La Sierra,3/16/17,11:30:00 AM,3,16,2017,Rain ,Urban,0,0,0,0,0,1,0,0,0,0,,,,,2.0,,8.0,8.0,,,,,1,5,5,8.0,2.0,2.0,2017-03-16 16:30:00
3199,Desinventar,ESMERALDAS,EC08,MUISNE,EC0803,SAN GREGORIO,EC080357,RECINTOS VILSA Y BALSALITO,-79.859208,0.585234,La Costa,5/30/15,8:30:00 AM,5,30,2015,Rain / Overflow,Heavy precipitation/ Short duration rain,1,1,0,0,0,0,0,0,0,0,,,,,,,65.0,65.0,,,,,5,5,5,65.0,,4.0,2015-05-30 13:30:00
3575,Desinventar,EL ORO,EC07,MACHALA,EC0701,EL RETIRO,EC070152,El Retiro,-79.915787,-3.383907,La Costa,4/4/16,1:00:00 AM,4,4,2016,Rain / Overflow,Heavy precipitation/ Urban,1,0,0,0,0,1,0,0,0,0,,,,,14.0,,56.0,56.0,,,500.0,,3,5,5,56.0,14.0,4.0,2016-04-04 06:00:00
5207,SNGRE_2021,MANABI,EC13,PEDERNALES,EC1317,PEDERNALES,EC131750,Sector la Violeta,-80.03048,0.08161492,La Costa,3/9/20,3:28:00 AM,3,9,2020,Rain,Heavy precipitation/Short duration rain,1,1,0,0,0,0,0,0,0,0,,,,,2.0,2.0,8.0,,,,,,5,5,5,8.0,2.0,2.0,2020-03-09 08:28:00
3730,Desinventar,MANABI,EC13,PEDERNALES,EC1317,PEDERNALES,EC131750,Via Escuela Milenium ,-80.032451,0.075932,La Costa,1/20/17,3:00:00 AM,1,20,2017,Rain ,Heavy precipitation/ Short duration rain,1,1,0,0,0,0,0,0,0,0,,,,,,,489.0,489.0,,,,,5,5,5,489.0,,5.0,2017-01-20 08:00:00
2572,Desinventar/SNGRE_2021,GUAYAS,EC09,SANTA LUCIA,EC0918,SANTA LUCIA,EC091850,Varios Recintos.,-80.035168,-1.714516,La Costa,1/23/14,2:00:00 AM,1,23,2014,Rain,Heavy precipitation/ Short duration rain,1,1,0,0,0,0,0,0,0,0,,,,,,,,,,,60.0,,5,5,5,,,,2014-01-23 07:00:00
2573,SNGRE_2021,GUAYAS,EC09,SANTA LUCIA,EC0918,SANTA LUCIA,EC091850,Varios Recintos.,-80.03516847,-1.71451629,La Costa,1/23/14,2:00:00 AM,1,23,2014,Rain,Heavy precipitation / Short duration rain,1,1,0,0,0,0,0,0,0,0,,,,,,,,,,,60.0,,5,5,5,,,,2014-01-23 07:00:00
1958,Desinventar/SNGRE_2021,GUAYAS,EC09,SANTA LUCIA,EC0918,SANTA LUCIA,EC091850,Coop 3 de Abril ; Coop La Voz de Santa Lucia,-80.0352,-1.7145,La Costa,3/2/13,1:16:00 AM,3,2,2013,Rain,Heavy precipitation,1,0,0,0,0,0,0,0,0,0,,,,,9.0,,1966.0,1966.0,,37.0,1053.84112,1053.0,2,5,5,1966.0,9.0,6.0,2013-03-02 06:16:00
4880,SNGRE,MANABI,EC13,PEDERNALES,EC1317,COJIMIES,EC131751,Varios Sectores,-80.037402,0.364074,La Costa,3/24/19,7:26:00 AM,3,24,2019,Rain,Urban,0,0,0,0,0,1,0,0,0,0,,,,,,,,,,,,,1,5,5,,,,2019-03-24 12:26:00
3314,Desinventar,MANABI,EC13,PEDERNALES,EC1317,PEDERNALES,EC131750,Santa: Coaque ,-80.043441,0.069483,La Costa,1/24/16,2:00:00 PM,1,24,2016,Rain /Overflow,Short duration rain,0,1,0,0,0,0,0,0,0,0,,,,,3.0,,20.0,20.0,,,,,3,5,5,20.0,3.0,3.0,2016-01-24 19:00:00
4551,SNGRE,MANABI,EC13,PEDERNALES,EC1317,PEDERNALES,EC131750,"Calle Ambato entre Tungurahua y Los Rios, por el Centro Comercial Municipal.",-80.045788,0.072757,La Costa,1/5/19,10:20:00 AM,1,5,2019,Rain,Heavy precipitation,1,0,0,0,0,0,0,0,0,0,,,,,,5.0,13.0,,,9.0,,,2,5,5,13.0,5.0,3.0,2019-01-05 15:20:00
3301,Desinventar,MANABI,EC13,PEDERNALES,EC1317,PEDERNALES,EC131750,Frente a la Cabanas Portomon,-80.046594,0.1045,La Costa,1/18/16,10:20:00 PM,1,18,2016,Rain ,Heavy precipitation/ Short duration rain,1,1,0,0,0,0,0,0,0,0,,,,,3.0,,23.0,23.0,,,,,5,5,5,23.0,3.0,3.0,2016-01-19 03:20:00
3445,Desinventar,MANABI,EC13,CHONE,EC1303,CHONE,EC130350,San Andres,-80.0492,-0.666866,La Costa,2/15/16,3:00:00 PM,2,15,2016,Rain ,Heavy precipitation,1,0,0,0,0,0,0,0,0,0,,,,,,,,,,,1.0,,2,5,5,,,,2016-02-15 20:00:00
2057,Desinventar/SNGRE_2021,GUAYAS,EC09,NOBOL,EC0925,NARCISA DE JESUS,EC092550,Rio Perdido Central,-80.0494,-1.9652,La Costa,3/7/13,9:30:00 AM,3,7,2013,Rain,Heavy precipitation/Short duration rain,1,1,0,0,0,0,0,0,0,0,,,,,2.0,,,,,,,,5,5,5,,2.0,,2013-03-07 14:30:00
2135,Desinventar/SNGRE_2021,GUAYAS,EC09,NOBOL,EC0925,NARCISA DE JESUS,EC092550,Comuna Petrillo,-80.0494,-1.9652,La Costa,3/16/13,6:00:00 AM,3,16,2013,Rain ,Heavy precipitation/ Short duration rain,1,1,0,0,0,0,0,0,0,0,,,,,10.0,,16.0,16.0,,,,,5,5,5,16.0,10.0,3.0,2013-03-16 11:00:00
2159,Desinventar/SNGRE_2021,GUAYAS,EC09,NOBOL,EC0925,NARCISA DE JESUS,EC092550,Sector Barrio Lindo en la Comuna Petrillo,-80.0494,-1.9652,La Costa,3/19/13,6:00:00 PM,3,19,2013,Long duration rain,Heavy precipitation,1,0,0,0,0,0,0,0,0,0,,,,,1.0,,6.0,6.0,,,,,2,5,5,6.0,1.0,2.0,2013-03-19 23:00:00
3871,Desinventar,MANABI,EC13,PEDERNALES,EC1317,PEDERNALES,EC131750,Barrio San Pedro (Brisas del Pacifico),-80.051006,0.073246,La Costa,2/26/17,6:00:00 AM,2,26,2017,Rain ,Heavy precipitation/Artificial waterway overflow,1,0,1,0,0,0,0,0,0,0,,,,,50.0,,200.0,20.0,,,,,3,5,5,200.0,50.0,5.0,2017-02-26 11:00:00
4833,SNGRE,MANABI,EC13,PEDERNALES,EC1317,PEDERNALES,EC131750,"La Violeta, Km 6 via Chamanga.",-80.051393,0.073118,La Costa,3/19/19,4:36:00 AM,3,19,2019,Rain / Overflow,Short duration rain,0,1,0,0,0,0,0,0,0,0,,,,,,,,,,6.0,,,3,5,5,,,,2019-03-19 09:36:00
4361,Desinventar,MANABI,EC13,PEDERNALES,EC1317,PEDERNALES,EC131750,"Varios Sectores ( Geronimo 4ta Etapa, Geronimo 3era Etapa y ",-80.054987,0.071735,La Costa,2/1/18,7:30:00 AM,2,1,2018,Rain ,Heavy precipitation/ Short duration rain,1,1,0,0,0,0,0,0,0,0,,,,,22.0,,88.0,88.0,,28.0,,,5,5,5,88.0,22.0,4.0,2018-02-01 12:30:00
3381,Desinventar,MANABI,EC13,SANTA ANA,EC1313,SAN PABLO (CAB EN PUEBLO NUEVO,EC131355,San Pablo ,-80.060049,-1.214011,La Costa,1/25/16,3:00:00 AM,1,25,2016,Rain ,Heavy precipitation,1,0,0,0,0,0,0,0,0,0,,,,,,,,,,,20.0,,2,5,5,,,,2016-01-25 08:00:00
4355,Desinventar,MANABI,EC13,PEDERNALES,EC1317,PEDERNALES,EC131750,Varios sectores (Brisas del Pacifico/Nuevo Pedernales - Punt,-80.06037,0.061776,La Costa,1/15/18,5:06:00 AM,1,15,2018,Rain ,Heavy precipitation/ Short duration rain,1,1,0,0,0,0,0,0,0,0,,,,,2.0,,4.0,4.0,,,,,5,5,5,4.0,2.0,1.0,2018-01-15 10:06:00
3024,SNGRE,GUAYAS,EC09,NOBOL,EC0925,NARCISA DE JESUS,EC092550,Cdla. Primavera,-80.072976,-1.98876,La Costa,3/19/15,9:00:00 AM,3,19,2015,Rain,Artificial waterway overflow,0,0,1,0,0,0,0,0,0,0,,,,,,,,,,,,,1,5,5,,,,2015-03-19 14:00:00
5121,SNGRE_2021,MANABI,EC13,PEDERNALES,EC1317,PEDERNALES,EC131750,Coaque,-80.084019,-0.010061,La Costa,2/20/20,1:42:00 PM,2,20,2020,Rain,Heavy precipitation,1,0,0,0,0,0,0,0,0,0,,,,,50.0,50.0,200.0,,,200.0,,,2,5,5,200.0,50.0,5.0,2020-02-20 18:42:00
3328,Desinventar,MANABI,EC13,CHONE,EC1303,CHONE,EC130350,Urbano,-80.090979,-0.703131,La Costa,1/25/16,10:00:00 AM,1,25,2016,Rain ,Heavy precipitation,1,0,0,0,0,0,0,0,0,0,,,,,,,,,,,,,2,5,5,,,,2016-01-25 15:00:00
3782,Desinventar,MANABI,EC13,CHONE,EC1303,CHONE,EC130350,Calle Pichincha y Cdla. Jorge Gallardo ,-80.09142,-0.70096,La Costa,2/6/17,6:00:00 AM,2,6,2017,Rain ,Heavy precipitation/Short duration rain,1,1,0,0,0,0,0,0,0,0,,,,,,,,,,,,,5,5,5,,,,2017-02-06 11:00:00
2888,Desinventar,MANABI,EC13,CHONE,EC1303,CHONE,EC130350,Centro,-80.09213,-0.698536,La Costa,10/19/14,1:02:00 AM,10,19,2014,Rain ,Short duration rain,0,1,0,0,0,0,0,0,0,0,,,,,,,,,,,,,3,5,5,,,,2014-10-19 06:02:00
3302,Desinventar,MANABI,EC13,CHONE,EC1303,CHONE,EC130350,sector Centro Urbano,-80.093433,-0.697451,La Costa,1/19/16,4:20:00 AM,1,19,2016,Rain ,Heavy precipitation/ Short duration rain,1,1,0,0,0,0,0,0,0,0,,,,,,,,,,,,,5,5,5,,,,2016-01-19 09:20:00
3329,Desinventar,MANABI,EC13,CHONE,EC1303,CHONE,EC130350,La Fortuna San Andres,-80.096139,-0.691435,La Costa,1/25/16,10:00:00 AM,1,25,2016,Rain ,Heavy precipitation,1,0,0,0,0,0,0,0,0,0,,,,,,,,,,,18.0,,2,5,5,,,,2016-01-25 15:00:00
3205,Desinventar,MANABI,EC13,CHONE,EC1303,CHONE,EC130350,zona urbana,-80.097084,-0.693928,La Costa,6/6/15,1:00:00 AM,6,6,2015,Rain ,Heavy precipitation/ Short duration rain,1,1,0,0,0,0,0,0,0,0,,,,,,,,,,,,,5,5,5,,,,2015-06-06 06:00:00
3206,Desinventar,MANABI,EC13,CHONE,EC1303,CHONE,EC130350,Zona urbana,-80.097084,-0.693928,La Costa,6/8/15,4:00:00 AM,6,8,2015,Rain ,Heavy precipitation/ Short duration rain,1,1,0,0,0,0,0,0,0,0,,,,,,,,,,,,,5,5,5,,,,2015-06-08 09:00:00
3218,Desinventar,MANABI,EC13,CHONE,EC1303,CHONE,EC130350,Zona Urbana,-80.097084,-0.693928,La Costa,7/13/15,3:00:00 AM,7,13,2015,Rain ,Heavy precipitation/ Short duration rain,1,1,0,0,0,0,0,0,0,0,,,,,,,,,,,,,5,5,5,,,,2015-07-13 08:00:00
4728,SNGRE,MANABI,EC13,CHONE,EC1303,CHONE,EC130350,Cdla. Jorge Gallardo,-80.098399,-0.692649,La Costa,3/7/19,10:00:00 AM,3,7,2019,Rain,Heavy precipitation,1,0,0,0,0,0,0,0,0,0,,,,,,1.0,4.0,,,4.0,,,2,5,5,4.0,1.0,1.0,2019-03-07 15:00:00
1854,SNGRE_2021,MANABI,EC13,CHONE,EC1303,CHONE,EC130350,"El Mate, El Viejo Camino Real, El Guabal, La Fortuna",-80.0997,-0.702,La Costa,2/1/13,11:25:00 AM,2,1,2013,Rain / Overflow,Short duration rain,0,1,0,0,0,0,0,0,0,0,,,,,,,,,,,20.0,,3,5,5,,,,2013-02-01 16:25:00
267,SNGRE_2021,MANABI,EC13,CHONE,EC1303,CHONE,EC130350,Centro de Chone,-80.1,-0.7,La Costa,4/5/10,2:00:00 AM,4,5,2010,Rain,Urban,0,0,0,0,0,1,0,0,0,0,,,,,,,,,,,,,1,5,5,,,,2010-04-05 07:00:00
3593,Desinventar,MANABI,EC13,CHONE,EC1303,CHONE,EC130350,Varios Sectores ,-80.109282,-0.712678,La Costa,4/11/16,7:00:00 AM,4,11,2016,Rain / Overflow,Short duration rain,0,1,0,0,0,0,0,0,0,0,,,,,70.0,,,,,,,,3,5,5,,70.0,,2016-04-11 12:00:00
3937,Desinventar,MANABI,EC13,SANTA ANA,EC1313,LA UNION,EC131353,Escobero,-80.174706,-1.222166,La Costa,3/15/17,5:00:00 PM,3,15,2017,Rain ,Heavy precipitation/ Short duration rain,1,1,0,0,0,0,0,0,0,0,,,,,27.0,,108.0,108.0,,,,,5,5,5,108.0,27.0,5.0,2017-03-15 22:00:00
4147,Desinventar,MANABI,EC13,SANTA ANA,EC1313,LA UNION,EC131353,Varios Sectores,-80.174706,-1.222166,La Costa,4/8/17,3:00:00 AM,4,8,2017,Rain / Overflow,Heavy precipitation/Urban,1,0,0,0,0,1,0,0,0,0,,,,,300.0,,1200.0,1200.0,,,153.0,,3,5,5,1200.0,300.0,6.0,2017-04-08 08:00:00
3422,Desinventar,MANABI,EC13,JUNIN,EC1307,JUNIN,EC130750,El Algodon- Gramalote -Tablones,-80.20703,-0.928119,La Costa,2/1/16,5:30:00 AM,2,1,2016,Rain ,Heavy precipitation,1,0,0,0,0,0,0,0,0,0,,,,,,,,,,,13.0,,2,5,5,,,,2016-02-01 10:30:00
3361,Desinventar,MANABI,EC13,OLMEDO,EC1318,OLMEDO,EC131850,Yucas Abajo Boqueron La Margarita ,-80.213532,-1.361423,La Costa,1/25/16,3:00:00 AM,1,25,2016,Rain ,Heavy precipitation,1,0,0,0,0,0,0,0,0,0,,,,,,,,,,,14.5,8.0,2,5,5,,,,2016-01-25 08:00:00
3447,Desinventar,MANABI,EC13,OLMEDO,EC1318,OLMEDO,EC131850,Varios Sectores,-80.213532,-1.361423,La Costa,2/17/16,9:33:00 PM,2,17,2016,Rain ,Heavy precipitation/ Urban,1,0,0,0,0,1,0,0,0,0,,,,,,,,,,,,,3,5,5,,,,2016-02-18 02:33:00
3449,Desinventar,MANABI,EC13,OLMEDO,EC1318,OLMEDO,EC131850,La Clemencia Dos Bocas Las Delicias,-80.213532,-1.361423,La Costa,2/18/16,9:00:00 AM,2,18,2016,Rain ,Heavy precipitation/ Short duration rain,1,1,0,0,0,0,0,0,0,0,,,,,,,,,,,45.0,,5,5,5,,,,2016-02-18 14:00:00
3462,Desinventar,MANABI,EC13,OLMEDO,EC1318,OLMEDO,EC131850,La Clemencia Dos Bocas Las Delicias,-80.213532,-1.361423,La Costa,2/25/16,6:30:00 AM,2,25,2016,Rain ,Heavy precipitation/ Short duration rain,1,1,0,0,0,0,0,0,0,0,,,,,,,,,,,15.0,,5,5,5,,,,2016-02-25 11:30:00
3802,Desinventar,MANABI,EC13,OLMEDO,EC1318,OLMEDO,EC131850,La Clemencia,-80.213532,-1.361423,La Costa,2/8/17,8:29:00 AM,2,8,2017,Rain ,Short duration rain,0,1,0,0,0,0,0,0,0,0,,,,,6.0,,120.0,24.0,,,,,3,5,5,120.0,6.0,5.0,2017-02-08 13:29:00
3533,Desinventar,MANABI,EC13,PORTOVIEJO,EC1301,SAN PLACIDO,EC130156,El colegio San Placido,-80.242553,-1.06253,La Costa,3/12/16,12:11:00 AM,3,12,2016,Rain ,Short duration rain,0,1,0,0,0,0,0,0,0,0,,,,,10.0,,40.0,40.0,,,,,3,5,5,40.0,10.0,3.0,2016-03-12 05:11:00
3200,Desinventar,MANABI,EC13,PORTOVIEJO,EC1301,SAN PLACIDO,EC130156,"Varios Sectores ( Av. Oliva Miranda, Sector San Jose  y San ",-80.244845,-1.061065,La Costa,5/31/15,8:20:00 AM,5,31,2015,Rain ,Short duration rain,0,1,0,0,0,0,0,0,0,0,,,,,34.0,,119.0,119.0,,,,,3,5,5,119.0,34.0,5.0,2015-05-31 13:20:00
3952,Desinventar,MANABI,EC13,SANTA ANA,EC1313,SANTA ANA DE VUELTA LARGA,EC131350,Varios sectores,-80.37073,-1.204575,La Costa,3/17/17,10:43:00 PM,3,17,2017,Overflow,Artificial waterway overflow,0,0,1,0,0,0,0,0,0,0,,,,,35.0,,120.0,120.0,,,,,1,5,5,120.0,35.0,5.0,2017-03-18 03:43:00
2531,Desinventar/SNGRE_2021,MANABI,EC13,JIPIJAPA,EC1306,JIPIJAPA,EC130650,Calle Cotopaxi y Parrales,-80.554586,-1.302022,La Costa,1/21/14,10:00:00 AM,1,21,2014,Rain ,Heavy precipitation,1,0,0,0,0,0,0,0,0,0,,,,,1.0,,7.0,7.0,,,,,2,5,5,7.0,1.0,2.0,2014-01-21 15:00:00
3438,Desinventar,MANABI,EC13,JIPIJAPA,EC1306,JIPIJAPA,EC130650,Sancan,-80.554586,-1.302022,La Costa,2/10/16,11:00:00 PM,2,10,2016,Rain ,Heavy precipitation,1,0,0,0,0,0,0,0,0,0,,,,,,,,,,,10.0,,2,5,5,,,,2016-02-11 04:00:00
2210,Desinventar/SNGRE_2021,MANABI,EC13,MONTECRISTI,EC1309,LA PILA,EC130952,Centro,-80.5883,-1.1361,La Costa,3/27/13,3:37:00 PM,3,27,2013,Rain ,Urban,0,0,0,0,0,1,0,0,0,0,,,,,3.0,,10.0,10.0,,,,,1,5,5,10.0,3.0,2.0,2013-03-27 20:37:00
4247,SNGRE,MANABI,EC13,MONTECRISTI,EC1309,LA PILA,EC130952,"Sitio Carcel, Comuna Eloy Alfaro",-80.608914,-1.132225,La Costa,5/10/17,3:00:00 PM,5,10,2017,Rain ,Heavy precipitation/ Short duration rain,1,1,0,0,0,0,0,0,0,0,,,,,,,24.0,,,,,,5,5,5,24.0,,3.0,2017-05-10 20:00:00
3758,Desinventar,MANABI,EC13,MONTECRISTI,EC1309,EL COLORADO,EC130950,Varios Sectores,-80.688936,-1.055958,La Costa,2/2/17,1:45:00 AM,2,2,2017,Rain ,Heavy precipitation/Short duration rain,1,1,0,0,0,0,0,0,0,0,,,,,41.0,,200.0,200.0,,,,,5,5,5,200.0,41.0,5.0,2017-02-02 06:45:00
4764,SNGRE,MANABI,EC13,MANTA,EC1308,ELOY ALFARO,EC130850,Barrio 15 de Abril,-80.701343,-0.986267,La Costa,3/13/19,7:00:00 AM,3,13,2019,Rain,Heavy precipitation,1,0,0,0,0,0,0,0,0,0,,,,,,,,,,,,,2,5,5,,,,2019-03-13 12:00:00
3431,Desinventar,MANABI,EC13,MONTECRISTI,EC1309,LEONIDAS PROAÑO,EC130950,Tierra Santa,-80.705855,-1.005276,La Costa,2/5/16,8:00:00 AM,2,5,2016,Rain ,Heavy precipitation/ Short duration rain/ Small stream,1,1,0,0,0,0,0,0,0,0,,,,,6.0,,,,,,,,5,5,5,,6.0,,2016-02-05 13:00:00
1972,Desinventar/SNGRE_2021,MANABI,EC13,MONTECRISTI,EC1309,LEONIDAS PROAÑO,EC130950,Leonidas Proano,-80.7059,-1.0053,La Costa,3/3/13,8:30:00 AM,3,3,2013,Rain ,Short duration rain,0,1,0,0,0,0,0,0,0,0,,,,,1.0,,5.0,5.0,,,,,3,5,5,5.0,1.0,1.0,2013-03-03 13:30:00
4765,SNGRE,MANABI,EC13,MANTA,EC1308,MANTA,EC130850,calle 15 AVENIDA 30,-80.70891,-0.967653,La Costa,3/13/19,7:00:00 AM,3,13,2019,Rain,Heavy precipitation,1,0,0,0,0,0,0,0,0,0,,,,,,,,,,,,,2,5,5,,,,2019-03-13 12:00:00
3349,Desinventar,MANABI,EC13,PUERTO LOPEZ,EC1319,MACHALILLA,EC131951, Cdla. 5 de Junio ,-80.738253,-1.469095,La Costa,1/25/16,7:30:00 AM,1,25,2016,Rain ,Heavy precipitation,1,0,0,0,0,0,0,0,0,0,,,,,,,,,,,,,2,5,5,,,,2016-01-25 12:30:00
3351,Desinventar,MANABI,EC13,MANTA,EC1308,MANTA,EC130850,Barrio Porvenir,-80.787826,-1.026737,La Costa,1/25/16,8:00:00 AM,1,25,2016,Rain ,Heavy precipitation,1,0,0,0,0,0,0,0,0,0,,,,,6.0,,24.0,24.0,,,,,2,5,5,24.0,6.0,3.0,2016-01-25 13:00:00
3369,Desinventar,MANABI,EC13,PUERTO LOPEZ,EC1319,PUERTO LOPEZ,EC131950,Centro Calle Gonzalo Suarez Abdon Calderon ,-80.810364,-1.559563,La Costa,1/25/16,7:30:00 AM,1,25,2016,Rain ,Heavy precipitation/ Urban,1,0,0,0,0,1,0,0,0,0,,,,,,,,,,,,,3,5,5,,,,2016-01-25 12:30:00
5134,SNGRE_2021,MANABI,EC13,PUERTO LOPEZ,EC1319,PUERTO LOPEZ,EC131950,"Varios Sectores (Barrio 12 de octubre, calle Abdon Calderon y Juan Montalvo, Malecon Izurieta).",-80.810439,-1.556814,La Costa,2/23/20,11:00:00 PM,2,23,2020,Rain,Short duration rain,0,1,0,0,0,0,0,0,0,0,,,,,,14.0,50.0,,,,,,3,5,5,50.0,14.0,3.0,2020-02-24 04:00:00
3116,Desinventar,MANABI,EC13,PUERTO LOPEZ,EC1319,PUERTO LOPEZ,EC131950,Ciudadela los Alamos - Rio Buena Vista.,-80.811865,-1.559971,La Costa,4/5/15,3:00:00 AM,4,5,2015,Rain / Overflow,Heavy precipitation/ Short duration rain,1,1,0,0,0,0,0,0,0,0,,,,,18.0,,148.0,148.0,59.0,,,,5,5,5,148.0,18.0,5.0,2015-04-05 08:00:00
3860,Desinventar,MANABI,EC13,PUERTO LOPEZ,EC1319,SALANGO,EC131952,Las Tunas,-80.817664,-1.656966,La Costa,2/22/17,6:04:00 AM,2,22,2017,Rain / Overflow,Heavy precipitation/ Short duration rain,1,1,0,0,0,0,0,0,0,0,,,,,15.0,,60.0,60.0,,,,,5,5,5,60.0,15.0,4.0,2017-02-22 11:04:00
3377,Desinventar,MANABI,EC13,PUERTO LOPEZ,EC1319,SALANGO,EC131952,Comunidad Las Tunas ,-80.84091,-1.591946,La Costa,1/25/16,7:30:00 AM,1,25,2016,Rain ,Heavy precipitation,1,0,0,0,0,0,0,0,0,0,,,,,,,,,,,,,2,5,5,,,,2016-01-25 12:30:00
5258,SNGRE_2021,NAPO,EC15,TENA,EC1501,AHUANO,EC150151,"Varios sectores, Unidad Educativa C I B Honorable Consejo Provincial de Napo",-77.492649,-1.0287678,La Sierra,5/3/20,7:00:00 AM,5,3,2020,Overflow,strong current,0,0,0,0,0,0,0,0,1,0,,,,,,176.0,704.0,,,,,39.5,7,2,6,704.0,176.0,6.0,2020-05-03 12:00:00
3685,Desinventar,NAPO,EC15,TENA,EC1501,AHUANO,EC150151,"Isla San Rafael, La Punta de Ahuano, Isla Anaconda( Barrio S",-77.542815,-1.070928,La Sierra,1/6/17,1:00:00 AM,1,6,2017,Rain,Strong current,0,0,0,0,0,0,0,0,1,0,,,,9.0,11.0,,61.0,976.0,,,932.51,,7,2,6,976.0,11.0,6.0,2017-01-06 06:00:00
5285,SNGRE_2021,MORONA SANTIAGO,EC14,TIWINTZA,EC1412,SAN JOSE DE MORONA,EC141251,PuertoMorona/Mangosisa,-77.672449,-2.924228,La Sierra,5/16/20,5:00:00 AM,5,16,2020,Rain/Overflow,Strong current,0,0,0,0,0,0,0,0,1,0,,,,,,,,,,,49.5,12.5,7,2,6,,,,2020-05-16 10:00:00
4500,Desinventar,NAPO,EC15,TENA,EC1501,PUERTO NAPO,EC150156,"Barrio San Gabriel, Balsayacu, Cindy, Atahualpa, Cuyaloma, Q",-77.752512,-1.046734,La Sierra,7/22/18,9:00:00 AM,7,22,2018,Rain / Overflow,Short duration flood,0,0,0,0,0,0,0,0,0,1,,,,,3.0,,1356.0,1356.0,,,,182.0,7,2,6,1356.0,3.0,6.0,2018-07-22 14:00:00
4501,SNGRE,NAPO,EC15,TENA,EC1501,TALAG,EC150157,"Ichiurku, Nueva Jerusalen, Ila Yaku, Limon Chicta, Jatum Yaku",-77.840083,-1.07191,La Sierra,7/22/18,9:00:00 AM,7,22,2018,Rain / Overflow,Short duration flood,0,0,0,0,0,0,0,0,0,1,,,,,,,384.0,,,,,133.0,7,2,6,384.0,,5.0,2018-07-22 14:00:00
2926,Desinventar,MORONA SANTIAGO,EC14,HUAMBOYA,EC1407,HUAMBOYA,EC140750,Tsentzak,-77.995174,-1.93792,La Sierra,1/16/15,6:30:00 PM,1,16,2015,,Short duration flood,0,0,0,0,0,0,0,0,0,1,,,,,1.0,,3.0,3.0,,,,,7,2,6,3.0,1.0,1.0,2015-01-16 23:30:00
5342,SNGRE_2021,MORONA SANTIAGO,EC14,MORONA,EC1401,MACAS,EC140150,"Puente sobre el rio va Upano, via Macas-Puyo [E45].",-78.108861,-2.302462,La Sierra,9/25/20,9:00:00 AM,9,25,2020,Rain/Overflow,strong current,0,0,0,0,0,0,0,0,1,0,,,,1.0,,,,,1.0,,,,7,2,6,,,,2020-09-25 14:00:00
4483,Desinventar,CARCHI,EC04,MIRA,EC0404,JIJON Y CAAMAÑO (CAB. EN RIO B,EC040452,La Florida,-78.365705,0.837323,La Sierra,6/5/18,8:20:00 AM,6,5,2018,Rain / Overflow,Strong current,0,0,0,0,0,0,0,0,1,0,,,,1.0,,,9.0,,,,,,7,2,6,9.0,,2.0,2018-06-05 13:20:00
3148,SNGRE,MORONA SANTIAGO,EC14,GUALAQUIZA,EC1402,BOMBOIZA,EC140253,Napurak,-78.55853,-3.438788,La Sierra,4/25/15,8:20:00 PM,4,25,2015,Rain ,Strong current,0,0,0,0,0,0,0,0,1,0,,,,,,,53.0,,53.0,53.0,,,7,2,6,53.0,,4.0,2015-04-26 01:20:00
5266,SNGRE_2021,ZAMORA CHINCHIPE,EC19,NANGARITZA,EC1903,ZURMI,EC190351,"Playas de Zurmi, La Wuantza, Nankaish y Sumayaku",-78.660168,-4.10324,La Sierra,5/8/20,7:26:00 AM,5,8,2020,Rain/Overflow,strong current,0,0,0,0,0,0,0,0,1,0,,,,,5.0,58.0,232.0,,,9.0,56.55,9.37,7,2,6,232.0,58.0,5.0,2020-05-08 12:26:00
4598,Desinventar,LOS RIOS,EC12,VENTANAS,EC1207,VENTANAS,EC120750,Ciudadela 5 de Agosto,-79.464984,-1.436501,La Costa,1/12/19,4:56:00 AM,1,12,2019,Rain,Short duration flood,0,0,0,0,0,0,0,0,0,1,,,,,3.0,3.0,25.0,25.0,,,,,7,2,6,25.0,3.0,3.0,2019-01-12 09:56:00
4894,Desinventar,LOS RIOS,EC12,VENTANAS,EC1207,VENTANAS,EC120750,Luis Florencia 123 y 9 De Octubre,-79.465212,-1.452937,La Costa,3/31/19,11:00:00 AM,3,31,2019,Rain,Strong current,0,0,0,0,0,0,0,0,1,0,,,,,,,,,,,,,7,2,6,,,,2019-03-31 16:00:00
5140,SNGRE_2021,LOS RIOS,EC12,MOCACHE,EC1212,MOCACHE,EC121250,"La Yuca, San Ignacio, Santa Barbara y La Propicia",-79.530703,-1.191424,La Costa,2/24/20,8:00:00 PM,2,24,2020,Rain/Overflow,Short duration flood,0,0,0,0,0,0,0,0,0,1,,,,,42.0,44.0,144.0,,,,,,7,2,6,144.0,44.0,5.0,2020-02-25 01:00:00
3840,Desinventar,GUAYAS,EC09,GUAYAQUIL,EC0901,TARQUI,EC090150,"Bastion Popular bloq. 1A mz. 485 solares 36, 37 y 38",-80.045331,-2.350555,La Costa,2/16/17,4:44:00 PM,2,16,2017,Rain ,Strong current,0,0,0,0,0,0,0,0,1,0,,,,,3.0,,12.0,12.0,,,,,7,2,6,12.0,3.0,3.0,2017-02-16 21:44:00
3190,Desinventar,EL ORO,EC07,ARENILLAS,EC0702,ARENILLAS,EC070250,Los Alamos,-80.057926,-3.560186,La Costa,5/16/15,6:00:00 PM,5,16,2015,Rain / Overflow,Heavy precipitation/ Urban/ Small stream overflow,1,0,0,1,0,1,0,0,0,0,,,,,1.0,,5.0,5.0,5.0,,,,7,2,6,5.0,1.0,1.0,2015-05-16 23:00:00
3928,Desinventar,GUAYAS,EC09,GUAYAQUIL,EC0901,JUAN GOMEZ RENDON (PROGRESO),EC090152,Recinto El Tigre,-80.290987,-2.358277,La Costa,3/12/17,6:36:00 PM,3,12,2017,Overflow,Short duration flood,0,0,0,0,0,0,0,0,0,1,,,,,30.0,,138.0,138.0,,,,,7,2,6,138.0,30.0,5.0,2017-03-12 23:36:00
3251,Desinventar,ESMERALDAS,EC08,RIOVERDE,EC0807,CHUMUNDE,EC080752,EL ALTO,-79.371491,0.673923,La Costa,10/29/15,7:00:00 PM,10,29,2015,Overflow,Strong current,0,0,0,0,0,0,0,0,1,0,,,,,,,4.0,4.0,,,,,7,3,6,4.0,,1.0,2015-10-30 00:00:00
4577,SNGRE,LOS RIOS,EC12,BABAHOYO,EC1201,LA UNION,EC120155,"Recintos:: La Esperanza, Los Robles de la ausencia, 3 Marias y La Malvina",-79.436529,-1.74926,La Costa,1/10/19,6:30:00 PM,1,10,2019,Overflow,Short duration flood,0,0,0,0,0,0,0,0,0,1,,,,,,55.0,165.0,,,,352.0,,7,3,6,165.0,55.0,5.0,2019-01-10 23:30:00
5246,SNGRE_2021,LOS RIOS,EC12,BABAHOYO,EC1201,DR. CAMILO PONCE,EC120150,El Pireo,-79.538242,-1.810762,La Costa,4/29/20,9:04:00 AM,4,29,2020,Rain,Short duration flood,0,0,0,0,0,0,0,0,0,1,,,,,,,,,,,,,7,3,6,,,,2020-04-29 14:04:00
1823,Desinventar/SNGRE_2021,GUAYAS,EC09,BALAO,EC0903,BALAO,EC090350,Comuna 24 de Junio,-79.7341,-2.8926,La Costa,1/24/13,4:30:00 AM,1,24,2013,Overflow,Strong current,0,0,0,0,0,0,0,0,1,0,,,,1.0,,,5.0,,5.0,,4.0,,7,3,6,5.0,,1.0,2013-01-24 09:30:00
4025,SNGRE,GUAYAS,EC09,PEDRO CARBO,EC0914,PEDRO CARBO,EC091450,Varios Sectores ( Barrio Guayaquil y Barrio Narcisa de Jesus),-80.235928,-1.819933,La Costa,3/25/17,5:00:00 PM,3,25,2017,Rain ,Short duration flood,0,0,0,0,0,0,0,0,0,1,,,,,,,27.0,,,,,,7,3,6,27.0,,3.0,2017-03-25 22:00:00
3889,Desinventar,MANABI,EC13,SAN VICENTE,EC1322,SAN VICENTE,EC132250,Salinas,-80.303922,-0.649992,La Costa,3/1/17,8:45:00 AM,3,1,2017,Rain / Overflow,Heavy precipitation/Small stream overflow/Urban,1,0,0,1,0,1,0,0,0,0,,,,,100.0,,500.0,500.0,100.0,,,,7,3,6,500.0,100.0,5.0,2017-03-01 13:45:00
4245,Desinventar,SANTA ELENA,EC24,SANTA ELENA,EC2401,MANGLARALTO,EC240154,Comuna San Antonio - Calle Eloy Alfaro,-80.735929,-1.873581,La Costa,5/9/17,4:00:00 AM,5,9,2017,Rain ,Strong current,0,0,0,0,0,0,0,0,1,0,,,,,1.0,,4.0,4.0,,,,,7,3,6,4.0,1.0,1.0,2017-05-09 09:00:00
2860,Desinventar,NAPO,EC15,TENA,EC1501,AHUANO,EC150151,"Estero Pangayacu, Comunidad Cristal, Isla San Rafael , Campo",-77.580445,-1.08122,La Sierra,9/12/14,2:00:00 AM,9,12,2014,Rain ,Heavy precipitation / Small stream overflow,1,0,0,1,0,0,0,0,0,0,,,,3.0,10.0,,332.0,332.0,4.0,4.0,94.0,119.0,6,4,6,332.0,10.0,5.0,2014-09-12 07:00:00
4935,SNGRE,MORONA SANTIAGO,EC14,MORONA,EC1401,SEVILLA DON BOSCO,EC140157,Miazal,-77.784833,-2.62067,La Sierra,5/6/19,8:43:00 AM,5,6,2019,Rain / Overflow,Strong current,0,0,0,0,0,0,0,0,1,0,,,,,,44.0,192.0,,,,2.0,,7,4,6,192.0,44.0,5.0,2019-05-06 13:43:00
5287,SNGRE_2021,MORONA SANTIAGO,EC14,TIWINTZA,EC1412,SANTIAGO,EC141250,"Varios sectores (Puerto Chinkianas, Kusums, Yamaram, Tarimiat, Kiim)",-77.919845,-2.942089,La Sierra,5/16/20,8:05:00 AM,5,16,2020,Rain/Overflow,strong current,0,0,0,0,0,0,0,0,1,0,,,,6.0,19.0,43.0,138.0,,31.0,,68.0,63.0,7,4,6,138.0,43.0,5.0,2020-05-16 13:05:00
4976,SNGRE,TUNGURAHUA,EC18,﻿SANTIAGO DE PILLARO,EC1808,﻿SAN ANDRES,EC180855,"Varios sectores (Cooperativa, El Estadio, Huagrahuasi, Censo)",-78.537672,-1.138181,La Sierra,6/22/19,10:00:00 AM,6,22,2019,Rain,Strong current,0,0,0,0,0,0,0,0,1,0,,,,,,38.0,152.0,,,,60.0,,7,4,6,152.0,38.0,5.0,2019-06-22 15:00:00
4305,SNGRE_2021,TUNGURAHUA,EC18,﻿SANTIAGO DE PILLARO,EC1808,PRESIDENTE URBINA (CHAGRAPAMBA-PATZUCUL),EC180854, Via Guapante Tres Esquina ,-78.552023,-1.1438302,La Sierra,10/9/17,7:32:00 PM,10,9,2017,Rain,Surface runoff,0,0,0,0,1,0,0,0,0,0,,,,,,,,,,,,,6,4,6,,,,2017-10-10 00:32:00
4335,SNGRE_2021,TUNGURAHUA,EC18,AMBATO,EC1801,UNAMUNCHO,EC180168,En la via Unamuncho-Bario el Condor,-78.590123,-1.1597807,La Sierra,12/9/17,10:30:00 PM,12,9,2017,Rain,Surface runoff,0,0,0,0,1,0,0,0,0,0,,,,,,,,,,,,,6,4,6,,,,2017-12-10 03:30:00
5264,SNGRE_2021,ZAMORA CHINCHIPE,EC19,NANGARITZA,EC1903,GUAYZIMI,EC190350,"La Brisa, Santa Elena, Santa Ros, Playa.",-78.683465,-4.051771,La Sierra,5/8/20,4:00:00 PM,5,8,2020,Rain/Overflow,strong current,0,0,0,0,0,0,0,0,1,0,,,,,,20.0,80.0,,,13.0,106.3,,7,4,6,80.0,20.0,4.0,2020-05-08 21:00:00
2812,Desinventar,LOS RIOS,EC12,VALENCIA,EC1211,VALENCIA,EC121150,12 de Octubre,-79.35301,-0.952547,La Costa,5/10/14,7:00:00 PM,5,10,2014,Overflow,Short duration flood,0,0,0,0,0,0,0,0,0,1,,,,,6.0,,19.0,19.0,,,,,7,4,6,19.0,6.0,3.0,2014-05-11 00:00:00
4591,SNGRE,LOS RIOS,EC12,QUINSALOMA,EC1213,QUINSALOMA,EC121350,"Recintos: La Lorena Sector, San Gabriel, Chipe, El Guabito, El Mamaey, San Felipe , Buenaventura de Minuape",-79.36653,-1.155992,La Costa,1/11/19,3:30:00 AM,1,11,2019,Rain / Overflow,Strong current,0,0,0,0,0,0,0,0,1,0,,,,,,74.0,314.0,,,58.0,390.0,,7,4,6,314.0,74.0,5.0,2019-01-11 08:30:00
1898,SNGRE_2021,EL ORO,EC07,PINAS,EC0710,PINAS,EC071050,Cerro La Cruz ,-79.6979,-3.6691,La Sierra,2/11/13,11:30:00 PM,2,11,2013,Rain,Heavy precipitation/ Short duration rain/ Artificial waterway overflow,1,1,1,0,0,0,0,0,0,0,,,,,,,,,,,,,6,4,6,,,,2013-02-12 04:30:00
3327,Desinventar,ESMERALDAS,EC08,ATACAMES,EC0806,ATACAMES,EC080650,VARIOS SECTORES ,-79.856311,0.866793,La Costa,1/25/16,9:45:00 AM,1,25,2016,Rain / Overflow,Heavy precipitation/ urban/ small stream overflow,1,0,0,1,0,1,0,0,0,0,,,,,103.0,,463.0,463.0,463.0,463.0,,,7,4,6,463.0,103.0,5.0,2016-01-25 14:45:00
2333,Desinventar/SNGRE_2021,GUAYAS,EC09,SALITRE,EC0919,JUNQUILLAL,EC091953,Recintos La Florida; Providencia y Hcda Nueva,-79.8593,-1.7286,La Costa,4/21/13,1:10:00 AM,4,21,2013,Rain/ Failure,Heavy precipitation/ River Bank Failure,1,0,0,0,0,0,0,1,0,0,,,,,,,50.0,50.0,,,,,6,4,6,50.0,,3.0,2013-04-21 06:10:00
2365,Desinventar/SNGRE_2021,GUAYAS,EC09,SALITRE,EC0919,JUNQUILLAL,EC091953,Recintos Providencia; Tintal y La Pelea,-79.8593,-1.7286,La Costa,4/25/13,5:30:00 PM,4,25,2013,Overflow,Strong current,0,0,0,0,0,0,0,0,1,0,,,,,,,,,,,,60.0,7,4,6,,,,2013-04-25 22:30:00
1923,SNGRE_2021,GUAYAS,EC09,PALESTINA,EC0913,PALESTINA,EC091350,Recinto El Carmen,-79.8691,-1.6466,La Costa,2/21/13,8:00:00 PM,2,21,2013,Rain ,Heavy precipitation/ small stream overflow,1,0,0,1,0,0,0,0,0,0,,,,,,,,,,,,,6,4,6,,,,2013-02-22 01:00:00
2707,Desinventar,ESMERALDAS,EC08,ATACAMES,EC0806,SUA (CAB EN LA BOCANA),EC080652,Redondel de Sua ( detras del UPC),-79.874249,0.860838,La Costa,3/29/14,5:00:00 AM,3,29,2014,Rain ,Heavy precipitation/ Short duration rain/ Urban,1,1,0,0,0,1,0,0,0,0,,,,,1.0,,4.0,4.0,,,,,6,4,6,4.0,1.0,1.0,2014-03-29 10:00:00
2588,Desinventar/SNGRE_2021,ESMERALDAS,EC08,MUISNE,EC0803,SAN GREGORIO,EC080357,Recinto San Jose de Bilsa,-79.874828,0.50984,La Costa,1/29/14,12:30:00 PM,1,29,2014,Rain / Overflow,Heavy precipitation / Small stream overflow,1,0,0,1,0,0,0,0,0,0,,,,,30.0,,,,,,,,6,4,6,,30.0,,2014-01-29 17:30:00
3400,Desinventar,ESMERALDAS,EC08,ATACAMES,EC0806,TONCHIGUE,EC080653,CENTENARIO,-79.937843,0.794479,La Costa,1/25/16,6:00:00 AM,1,25,2016,Rain / Overflow,Heavy precipitation/ urban/ small stream overflow,1,0,0,1,0,1,0,0,0,0,,,,,4.0,,14.0,14.0,14.0,14.0,,,7,4,6,14.0,4.0,3.0,2016-01-25 11:00:00
4415,Desinventar,GUAYAS,EC09,GUAYAQUIL,EC0901,PASCUALES,EC090150,"Monte Sinai, Cooperativa Maria Paidal Bloque 8 Mz. 36 Sl 12;",-79.994819,-2.12255,La Costa,3/17/18,11:04:00 AM,3,17,2018,Rain ,Short duration flood,0,0,0,0,0,0,0,0,0,1,,,,,3.0,,9.0,9.0,,,,,7,4,6,9.0,3.0,2.0,2018-03-17 16:04:00
2098,Desinventar/SNGRE_2021,LOJA,EC11,PINDAL,EC1114,PINDAL,EC111450,La Union; Panecillo y  Barrio Central,-80.1125,-4.1274,La Sierra,3/13/13,7:30:00 PM,3,13,2013,Rain,Heavy precipitation/ Urban / Short duration rain,1,1,0,0,0,1,0,0,0,0,,,,,4.0,,20.0,20.0,,,,,6,4,6,20.0,4.0,3.0,2013-03-14 00:30:00
4564,SNGRE,MANABI,EC13,CHONE,EC1303,SAN ANTONIO,EC130357,Varios Sectores(Barquero/Horconcito),-80.167642,-0.70544,La Costa,1/7/19,3:06:00 PM,1,7,2019,Rain,Strong current,0,0,0,0,0,0,0,0,1,0,,,,,,15.0,59.0,,,,5.0,,7,4,6,59.0,15.0,4.0,2019-01-07 20:06:00
3888,Desinventar,MANABI,EC13,CHONE,EC1303,SAN ANTONIO,EC130357,Comunidad Horconcitos,-80.19522,-0.663461,La Costa,3/1/17,8:29:00 AM,3,1,2017,Rain / Overflow,Heavy precipitation/Small stream overflow,1,0,0,1,0,0,0,0,0,0,,,,,25.0,,110.0,110.0,,,,,6,4,6,110.0,25.0,5.0,2017-03-01 13:29:00
3322,Desinventar,MANABI,EC13,TOSAGUA,EC1315,BACHILLERO,EC131551,Bachillero ,-80.214235,-0.76552,La Costa,1/25/16,3:00:00 AM,1,25,2016,Rain ,Heavy precipitation/ Small stream overflow,1,0,0,1,0,0,0,0,0,0,,,,,,,,,,,15.0,,6,4,6,,,,2016-01-25 08:00:00
4732,SNGRE,MANABI,EC13,SANTA ANA,EC1313,HONORATO VASQUEZ (CAB EN VASQUEZ),EC131352,Varios Sectores,-80.222219,-1.110337,La Costa,3/7/19,2:00:00 PM,3,7,2019,Rain / Overflow,Short duration flood,0,0,0,0,0,0,0,0,0,1,,,,,,50.0,200.0,,,8.0,,,7,4,6,200.0,50.0,5.0,2019-03-07 19:00:00
4016,SNGRE,MANABI,EC13,TOSAGUA,EC1315,TOSAGUA,EC131550,El Juncal ,-80.243967,-0.742782,La Costa,3/24/17,9:00:00 AM,3,24,2017,Rain / Overflow,Heavy precipitation/Small stream overflow/Urban,1,0,0,1,0,1,0,0,0,0,,,,,,,1200.0,,,,,,7,4,6,1200.0,,6.0,2017-03-24 14:00:00
4733,SNGRE,MANABI,EC13,JAMA,EC1320,JAMA,EC132050,Varios Sectores,-80.266911,-0.202703,La Costa,3/7/19,9:00:00 AM,3,7,2019,Rain,Surface runoff,0,0,0,0,1,0,0,0,0,0,,,,,,15.0,60.0,,,60.0,,,6,4,6,60.0,15.0,4.0,2019-03-07 14:00:00
4741,SNGRE,MANABI,EC13,PORTOVIEJO,EC1301,PUEBLO NUEVO,EC130154,Pueblo Nuevo,-80.296195,-0.97016,La Costa,3/7/19,7:00:00 AM,3,7,2019,Rain,Surface runoff,0,0,0,0,1,0,0,0,0,0,,,,,,,,,,,,,6,4,6,,,,2019-03-07 12:00:00
4743,SNGRE,MANABI,EC13,PORTOVIEJO,EC1301,RIOCHICO (RIO CHICO),EC130155,"Varios Sectores (La Encantada, Las Chacras,San Clemente, Chacras, Tomatal, Pechinche, San Vicente, San Gabriel.)",-80.416872,-0.994788,La Costa,3/7/19,5:00:00 PM,3,7,2019,Rain / Overflow,Surface runoff,0,0,0,0,1,0,0,0,0,0,,,,,,16.0,68.0,,,,861.25,,6,4,6,68.0,16.0,4.0,2019-03-07 22:00:00
3837,Desinventar,MANABI,EC13,PORTOVIEJO,EC1301,COLON,EC130150,Estancia Vieja ,-80.419059,-1.164011,La Costa,2/16/17,6:10:00 AM,2,16,2017,Rain / Overflow,Heavy precipitation/ Small stream overflow,1,0,0,1,0,0,0,0,0,0,,,,,8.0,,36.0,36.0,,,,,6,4,6,36.0,8.0,3.0,2017-02-16 11:10:00
2976,Desinventar,MANABI,EC13,PORTOVIEJO,EC1301,RIOCHICO (RIO CHICO),EC130155,Quebrada Grande,-80.423199,-0.997134,La Costa,2/15/15,3:55:00 AM,2,15,2015,Rain ,Heavy precipitation/ Urban/ Short duration rain,1,1,0,0,0,1,0,0,0,0,,,,,40.0,,80.0,80.0,,,,,6,4,6,80.0,40.0,4.0,2015-02-15 08:55:00
260,SNGRE_2021,MANABI,EC13,PORTOVIEJO,EC1301,RIOCHICO (RIO CHICO),EC130155,"Valle Hermoso, San Pedro de Resbalon, La Morlaca y Pasquisha",-80.44,-0.98,La Costa,4/3/10,10:00:00 AM,4,3,2010,Rain,strong current,0,0,0,0,0,0,0,0,1,0,,,,,,,46.0,,,,,,7,4,6,46.0,,3.0,2010-04-03 15:00:00
4730,SNGRE,MANABI,EC13,PORTOVIEJO,EC1301,CRUCITA,EC130153,"Varias Sectores (Correagua, San Silvestre, Los Arenales, Las Gilces, Virgen de Monserrate, Los Ranchos)",-80.526263,-0.852533,La Costa,3/7/19,10:00:00 AM,3,7,2019,Rain / Overflow,Heavy precipitation/ Small stream overflow,1,0,0,1,0,0,0,0,0,0,,,,,,250.0,1000.0,,,,,,6,4,6,1000.0,250.0,6.0,2019-03-07 15:00:00
3430,Desinventar,MANABI,EC13,JARAMIJO,EC1321,JARAMIJO,EC132150,Varios Sectores ,-80.63136,-0.957456,La Costa,2/5/16,8:00:00 AM,2,5,2016,Rain ,Heavy precipitation/ Urban / Short duration rain,1,1,0,0,0,1,0,0,0,0,,,,,8.0,,32.0,32.0,,,,,6,4,6,32.0,8.0,3.0,2016-02-05 13:00:00
4734,SNGRE,MANABI,EC13,JARAMIJO,EC1321,JARAMIJO,EC132150,Varios Sectores,-80.638166,-0.955901,La Costa,3/7/19,5:00:00 AM,3,7,2019,Rain,Strong current,0,0,0,0,0,0,0,0,1,0,,,,,,60.0,240.0,,,82.0,,,7,4,6,240.0,60.0,5.0,2019-03-07 10:00:00
2950,Desinventar,MANABI,EC13,MONTECRISTI,EC1309,ANIBAL SAN ANDRES,EC130950,Guillermo Balda y 9 de Octubre,-80.64014,-1.032642,La Costa,2/7/15,3:00:00 AM,2,7,2015,Rain ,Heavy precipitation/ Urban/ Short duration rain,1,1,0,0,0,1,0,0,0,0,,,,,,,,,,,,,6,4,6,,,,2015-02-07 08:00:00
5178,SNGRE_2021,SANTA ELENA,EC24,SANTA ELENA,EC2401,COLONCHE,EC240152,Comuna San Marcos-Recinto Los Manguitos y La Sequita.,-80.645492,-2.00833,La Costa,2/28/20,7:19:00 AM,2,28,2020,Rain,Short duration rain// River bank failure,0,1,0,0,0,0,0,1,0,0,,,,,110.0,110.0,412.0,,,,,,7,4,6,412.0,110.0,5.0,2020-02-28 12:19:00
4373,Desinventar,MANABI,EC13,MONTECRISTI,EC1309,LEONIDAS PROAÑO,EC130950,Cerca del Comisariato El Descuento,-80.653964,-1.043542,La Costa,2/19/18,6:51:00 AM,2,19,2018,Rain ,Heavy precipitation/ Urban/ Short duration rain,1,1,0,0,0,1,0,0,0,0,,,,,6.0,,24.0,24.0,,,,,6,4,6,24.0,6.0,3.0,2018-02-19 11:51:00
5177,SNGRE_2021,SANTA ELENA,EC24,SANTA ELENA,EC2401,COLONCHE,EC240152,Manantial de Colonche,-80.676282,-1.984184,La Costa,2/28/20,4:00:00 AM,2,28,2020,Rain,strong current,0,0,0,0,0,0,0,0,1,0,,,,,8.0,11.0,34.0,,,,,,7,4,6,34.0,11.0,3.0,2020-02-28 09:00:00
4892,SNGRE_2021,TUNGURAHUA,EC18,BAÑOS DE AGUA SANTA,EC1802,RÍO NEGRO,EC180252,"Rio Santa Lucia, Las Estancias",-78.225008,-1.44482,La Sierra,3/30/19,1:00:00 AM,3,30,2019,Rain,Surface runoff,0,0,0,0,1,0,0,0,0,0,,,,,,1.0,5.0,,,,,,6,5,6,5.0,1.0,1.0,2019-03-30 06:00:00
5047,SNGRE_2021,PICHINCHA,EC17,QUITO,EC1701,GUAYLLABAMBA,EC170163,"Parada de camionetas Chuquibamba, rio Pisque, via Guayllabamba - Cusubamba.",-78.305456,-0.049225,La Sierra,12/1/19,1:05:00 PM,12,1,2019,Rain/ Antropogenic,Surface runoff,0,0,0,0,1,0,0,0,0,0,,,,,1.0,1.0,5.0,,,,,,6,5,6,5.0,1.0,1.0,2019-12-01 18:05:00
4842,SNGRE,COTOPAXI,EC05,LATACUNGA,EC0501,LATACUNGA,EC050150,Juan Montalvo (San Sebastian). Calle Laguna Cuyabeno parte posterior del Colegio Trajano Naranjo.,-78.605217,-0.937521,La Sierra,3/20/19,3:30:00 PM,3,20,2019,Rain / Overflow,Surface runoff,0,0,0,0,1,0,0,0,0,0,,,,,,1.0,6.0,,,,,,6,5,6,6.0,1.0,2.0,2019-03-20 20:30:00
5171,SNGRE_2021,COTOPAXI,EC05,LATACUNGA,EC0501,IGNACIO FLORES (PARQUE FLORES),EC050150,"Topalan, Pishigloma, San Carlos, Sigsicalle Sur y Unidad Nacional",-78.610305,-0.95122,La Sierra,2/27/20,10:00:00 PM,2,27,2020,Rain,Surface runoff,0,0,0,0,1,0,0,0,0,0,,,,,,,,,,,,,6,5,6,,,,2020-02-28 03:00:00
2469,SNGRE_2021,AZUAY,EC01,CUENCA,EC0101,RICAURTE,EC010162,4 Esquinas  ,-78.9632,-2.8565,La Sierra,10/23/13,3:09:00 PM,10,23,2013,Rain ,Heavy precipitation/ Short duration rain/ Urban,1,1,0,0,0,1,0,0,0,0,,,,,1.0,,,,,,,,6,5,6,,1.0,,2013-10-23 20:09:00
4948,SNGRE,PICHINCHA,EC17,PUERTO QUITO,EC1709,PUERTO QUITO,EC170950,"Rcto. La Abundancia, Rcto. Puerto Rico, Rcto. San Francisco, Barrio 12 de Octubre.",-79.266667,0.116667,La Costa,5/17/19,4:02:00 AM,5,17,2019,Rain / Overflow / Failure,Heavy precipitation/ River Bank Failure,1,0,0,0,0,0,0,1,0,0,,,,,,32.0,,,,,,,6,5,6,,32.0,,2019-05-17 09:02:00
1913,SNGRE_2021,LOS RIOS,EC12,URDANETA,EC1206,CATARAMA,EC120650,"El Roblecito, Los Cerritos, Guapara, y La America",-79.483,-1.5869,La Costa,2/14/13,10:00:00 AM,2,14,2013,Rain/ Overflow,Heavy precipitation / River bank failure,1,0,0,0,0,0,0,1,0,0,,,,,23.0,,,,,,30.0,6.0,6,5,6,,23.0,,2013-02-14 15:00:00
3954,Desinventar,ESMERALDAS,EC08,ESMERALDAS,EC0801,SIMON PLATA TORRES,EC080150,50 CASAS,-79.689831,0.923984,La Costa,3/17/17,6:00:00 AM,3,17,2017,Rain,Heavy precipitation/Urban/Short duration rain,1,1,0,0,0,1,0,0,0,0,,,,,112.0,,406.0,406.0,,,,,6,5,6,406.0,112.0,5.0,2017-03-17 11:00:00
4738,SNGRE,MANABI,EC13,PEDERNALES,EC1317,PEDERNALES,EC131750,Centro,-80.047273,0.07329,La Costa,3/7/19,7:00:00 AM,3,7,2019,Rain,Surface runoff,0,0,0,0,1,0,0,0,0,0,,,,,,,,,,,,,6,5,6,,,,2019-03-07 12:00:00
2991,Desinventar,MANABI,EC13,PEDERNALES,EC1317,PEDERNALES,EC131750,Zona Urbana,-80.05142,0.073373,La Costa,2/27/15,8:20:00 AM,2,27,2015,Rain ,Heavy precipitation/ Urban/ Short duration rain,1,1,0,0,0,1,0,0,0,0,,,,,1.0,,307.0,307.0,,7.0,,,6,5,6,307.0,1.0,5.0,2015-02-27 13:20:00
4727,SNGRE,MANABI,EC13,CHONE,EC1303,CHONE,EC130350,"El Hipodromo, El Limon, La Victoria, la Gallardo, unidas venceremos.",-80.095083,-0.732505,La Costa,3/7/19,8:15:00 AM,3,7,2019,Rain / Overflow,Heavy precipitation/ Small stream overflow/ Strong curent,1,0,0,1,0,0,0,0,0,0,,,,,,30.0,120.0,,,13.0,150.0,,6,5,6,120.0,30.0,5.0,2019-03-07 13:15:00
4783,SNGRE,MANABI,EC13,OLMEDO,EC1318,OLMEDO,EC131850,La Clemencia,-80.211906,-1.393529,La Costa,3/16/19,6:00:00 PM,3,16,2019,Rain,Surface runoff,0,0,0,0,1,0,0,0,0,0,,,,,,10.0,40.0,,,,,,6,5,6,40.0,10.0,3.0,2019-03-16 23:00:00
4376,Desinventar,MANABI,EC13,MANTA,EC1308,TARQUI,EC130850,"Tecnico de la Unidad de Gestion de Riesgos, informa que prod",-80.71279,-0.954641,La Costa,2/19/18,6:26:00 AM,2,19,2018,Rain ,Heavy precipitation/ Urban/ Short duration rain,1,1,0,0,0,1,0,0,0,0,,,,,25.0,,100.0,10.0,,,,,6,5,6,100.0,25.0,4.0,2018-02-19 11:26:00
3736,Desinventar,MANABI,EC13,MANTA,EC1308,TARQUI,EC130850,Urbirrios 2,-80.723362,-0.978256,La Costa,1/21/17,9:30:00 AM,1,21,2017,Rain ,Surface runoff,0,0,0,0,1,0,0,0,0,0,,,,,1.0,,5.0,5.0,,,,,6,5,6,5.0,1.0,1.0,2017-01-21 14:30:00
3247,Desinventar/SNGRE_2021,SUCUMBIOS,EC21,GONZALO PIZARRO,EC2102,GONZALO PIZARRO,EC210252,Recinto Amazonas via a Quito en la choza de Santy via a Dash,-77.356034,-0.0338534,La Sierra,10/18/15,5:00:00 PM,10,18,2015,Rain / Overflow,Heavy precipitation,1,0,0,0,0,0,0,0,0,0,,,,,1.0,,7.0,7.0,,,,,2,6,6,7.0,1.0,2.0,2015-10-18 22:00:00
2930,Desinventar,PASTAZA,EC16,PASTAZA,EC1601,SARAYACU,EC160161,Comunidad Raya yacu,-77.411581,-1.570639,La Sierra,1/18/15,11:00:00 AM,1,18,2015,Rain / Overflow,Small stream overflow,0,0,0,1,0,0,0,0,0,0,,,,,8.0,,85.0,85.0,,,5.0,,4,6,6,85.0,8.0,4.0,2015-01-18 16:00:00
3572,Desinventar,PASTAZA,EC16,ARAJUNO,EC1604,CURARAY,EC160451,Paparawa Pandanuke Santa Cecilia Yanapuma Jaime Roldos Calla,-77.484785,-1.502807,La Sierra,4/3/16,7:00:00 AM,4,3,2016,Rain / Overflow,Heavy precipitation / Short duration rain,1,1,0,0,0,0,0,0,0,0,,,,,14.0,,437.0,437.0,,,55.5,,5,6,6,437.0,14.0,5.0,2016-04-03 12:00:00
2866,Desinventar,NAPO,EC15,TENA,EC1501,PUERTO NAPO,EC150156,"Capirona Bajo, Santa Barandilla, Rumi Yacu, San Gabriel de A",-77.747482,-1.084663,La Sierra,9/12/14,2:00:00 AM,9,12,2014,Rain / Overflow,Heavy precipitation/ Small stream/ Short duration rain,1,1,0,0,0,0,0,0,0,0,,,,,,,419.0,419.0,,,,,5,6,6,419.0,,5.0,2014-09-12 07:00:00
2816,Desinventar,NAPO,EC15,EL CHACO,EC1504,EL CHACO,EC150450,Varios Sectores,-77.785215,-0.337779,La Sierra,5/11/14,8:45:00 PM,5,11,2014,Long duration rain,Urban,0,0,0,0,0,1,0,0,0,0,,,,,7.0,,,,,,,,1,6,6,,7.0,,2014-05-12 01:45:00
3664,Desinventar,PASTAZA,EC16,MERA,EC1602,MADRE TIERRA,EC160251,La Encanada.,-77.961502,-1.619478,La Sierra,11/3/16,8:00:00 AM,11,3,2016,Rain / Overflow,Heavy precipitation/ small stream,1,0,0,0,0,0,0,0,0,0,,,,,6.0,,24.0,24.0,,,,,2,6,6,24.0,6.0,3.0,2016-11-03 13:00:00
3691,Desinventar,PASTAZA,EC16,PASTAZA,EC1601,TARQUI,EC160163,Barrio Salome,-77.962753,-1.571211,La Sierra,1/6/17,1:00:00 PM,1,6,2017,Overflow,Surface runoff,0,0,0,0,1,0,0,0,0,0,,,,,2.0,,27.0,27.0,,,,,6,6,6,27.0,2.0,3.0,2017-01-06 18:00:00
5235,SNGRE_2021,MORONA SANTIAGO,EC14,MORONA,EC1401,SEVILLA DON BOSCO,EC140157,San Luis de Ininkis,-78.119369,-2.390636,La Sierra,4/11/20,12:30:00 PM,4,11,2020,Rain,Small stream overflow,0,0,0,1,0,0,0,0,0,0,,,,,,,,,,,,,4,6,6,,,,2020-04-11 17:30:00
2356,Desinventar/SNGRE_2021,IMBABURA,EC10,SAN MIGUEL DE URCUQUI,EC1006,URCUQUI,EC100650,Barrio Santa Rosa,-78.1859,0.4091,La Sierra,4/23/13,8:00:00 PM,4,23,2013,Rain ,Heavy precipitation/ Short duration rain,1,1,0,0,0,0,0,0,0,0,,,,,10.0,,30.0,30.0,,,,,5,6,6,30.0,10.0,3.0,2013-04-24 01:00:00
4905,SNGRE_2021,MORONA SANTIAGO,EC14,LIMON INDANZA,EC1403,YUNGANZA (CAB EN EL ROSARIO),EC140358,"El Rosario, via Macas-Gualaquiza-tramo Bella Union-Limon [E45]",-78.372424,-2.864769,La Sierra,4/3/19,3:40:00 PM,4,3,2019,Rain,Surface runoff,0,0,0,0,1,0,0,0,0,0,,,,,,,,,,,,,6,6,6,,,,2019-04-03 20:40:00
2842,Desinventar,PICHINCHA,EC17,QUITO,EC1701,TUMBACO,EC170184,Francisco de la Tola Grande y Ferrero Pietro  - El Arenal,-78.385965,-0.226136,La Sierra,6/8/14,10:20:00 PM,6,8,2014,Overflow,Artificial waterway overflow,0,0,1,0,0,0,0,0,0,0,,,,,,,,,,,,,1,6,6,,,,2014-06-09 03:20:00
5127,SNGRE_2021,PICHINCHA,EC17,PUERTO QUITO,EC1709,TUMBACO,EC170184,"Centro de Salud de Tumbaco, calles: San Francisco y Los Caramelos (barrio La Dolorosa)",-78.408459,-0.2157762,La Sierra,2/21/20,4:18:00 PM,2,21,2020,Rain,Heavy precipitation,1,0,0,0,0,0,0,0,0,0,,,,,,,,,,,,,2,6,6,,,,2020-02-21 21:18:00
2276,Desinventar/SNGRE_2021,PICHINCHA,EC17,QUITO,EC1701,ALANGASI,EC170151,Gaspar de Villarroel SN y  San Juan de las Lomas,-78.4175,-0.304,La Sierra,4/17/13,5:00:00 PM,4,17,2013,Rain ,Heavy precipitation,1,0,0,0,0,0,0,0,0,0,,,,,1.0,,,,,,,,2,6,6,,1.0,,2013-04-17 22:00:00
4517,Desinventar,PICHINCHA,EC17,QUITO,EC1701,CALDERON (CARAPUNGO),EC170155,San Jorge y Leonidas Proano,-78.436363,-0.106804,La Sierra,9/16/18,6:07:00 PM,9,16,2018,Rain ,Heavy precipitation/Short duration rain,1,1,0,0,0,0,0,0,0,0,,,,,9.0,,,39.0,,,,,5,6,6,39.0,9.0,3.0,2018-09-16 23:07:00
2739,Desinventar,PICHINCHA,EC17,QUITO,EC1701,CONOCOTO,EC170156,"Ponce Enrique, en el sector de los Hornos.",-78.479411,-0.292025,La Sierra,4/4/14,6:57:00 PM,4,4,2014,Rain ,Heavy precipitation/ Small stream overflow,1,0,0,1,0,0,0,0,0,0,,,,,1.0,,,,,,,,6,6,6,,1.0,,2014-04-04 23:57:00
3631,Desinventar,TUNGURAHUA,EC18,PATATE,EC1805,LOS ANDES (CAB EN POATUG),EC180552,Plazuela Pamba,-78.486691,-1.247227,La Sierra,5/17/16,3:00:00 AM,5,17,2016,Rain / Overflow,Short duration rain,0,1,0,0,0,0,0,0,0,0,,,,,13.0,,52.0,52.0,,,,,3,6,6,52.0,13.0,4.0,2016-05-17 08:00:00
3204,Desinventar,TUNGURAHUA,EC18,PATATE,EC1805,LOS ANDES (CAB EN POATUG),EC180552,Varios Sectores,-78.495303,-1.251323,La Sierra,6/5/15,6:00:00 AM,6,5,2015,Rain ,Heavy precipitation,1,0,0,0,0,0,0,0,0,0,,,,,,,,,,,7.0,,2,6,6,,,,2015-06-05 11:00:00
3628,Desinventar,PICHINCHA,EC17,QUITO,EC1701,LA ARGELIA,EC170150,En el primer puente de Guajalo sobre la Simon Bolivar San Pe,-78.514913,-0.279532,La Sierra,5/11/16,6:58:00 PM,5,11,2016,Rain ,Heavy precipitation,1,0,0,0,0,0,0,0,0,0,,,,,2.0,,,,8.0,,,,2,6,6,,2.0,,2016-05-11 23:58:00
2918,Desinventar,TUNGURAHUA,EC18,AMBATO,EC1801,CUNCHIBAMBA,EC180167,"Barrio San Pablo, en la Hacienda San Pablo. A 300m de la igl",-78.584235,-1.134303,La Sierra,12/22/14,10:15:00 AM,12,22,2014,Rain / Overflow,Heavy precipitation / Artificial waterway overflow,1,0,1,0,0,0,0,0,0,0,,,,,,,,,,,,,3,6,6,,,,2014-12-22 15:15:00
3855,Desinventar,TUNGURAHUA,EC18,AMBATO,EC1801,CUNCHIBAMBA,EC180167,Pucarumi,-78.593046,-1.132541,La Sierra,2/22/17,1:47:00 AM,2,22,2017,Rain / Overflow,Heavy precipitation/ Short duration rain,1,1,0,0,0,0,0,0,0,0,,,,,1.0,,14.0,14.0,4.0,,10.0,3.0,5,6,6,14.0,1.0,3.0,2017-02-22 06:47:00
4841,Desinventar,COTOPAXI,EC05,LATACUNGA,EC0501,LA MATRIZ,EC050150,Unidad Educativa Velasco Ibarra,-78.625296,-0.920174,La Sierra,3/20/19,3:30:00 PM,3,20,2019,Rain / Overflow,Surface runoff,0,0,0,0,1,0,0,0,0,0,,,,,,,,,,,,,6,6,6,,,,2019-03-20 20:30:00
5320,SNGRE_2021,COTOPAXI,EC05,LATACUNGA,EC0501,ELOY ALFARO (SAN FELIPE),EC050150,Varios Sectores,-78.632781,-0.917144,La Sierra,7/5/20,4:00:00 PM,7,5,2020,Rain,Surface runoff,0,0,0,0,1,0,0,0,0,0,,,,,1.0,3.0,6.0,,,,,,6,6,6,6.0,3.0,2.0,2020-07-05 21:00:00
5176,SNGRE_2021,COTOPAXI,EC05,LATACUNGA,EC0501,ELOY ALFARO (SAN FELIPE),EC050150,"San Felipe, via Latacunga - Pujili [E-30]",-78.636469,-0.92873,La Sierra,2/28/20,6:57:00 AM,2,28,2020,Rain,Surface runoff,0,0,0,0,1,0,0,0,0,0,,,,,,,,,,,,,6,6,6,,,,2020-02-28 11:57:00
1826,Desinventar/SNGRE_2021,COTOPAXI,EC05,LATACUNGA,EC0501,ELOY ALFARO (SAN FELIPE),EC050150,Santa Rosa de Pichul; Ciudadela Valle Hermoso,-78.6396,-0.9329,La Sierra,1/24/13,3:00:00 PM,1,24,2013,,Surface runoff,0,0,0,0,1,0,0,0,0,0,,,,,2.0,,10.0,10.0,,,,,6,6,6,10.0,2.0,2.0,2013-01-24 20:00:00
2920,Desinventar,COTOPAXI,EC05,LATACUNGA,EC0501,POALO,EC050158,San Jose de Poalo (centro parroquial),-78.676456,-0.884727,La Sierra,12/22/14,9:40:00 AM,12,22,2014,Rain / Overflow,Artificial waterway overflow,0,0,1,0,0,0,0,0,0,0,,,,,1.0,,,,,,0.3,,1,6,6,,1.0,,2014-12-22 14:40:00
3655,Desinventar,ZAMORA CHINCHIPE,EC19,ZAMORA,EC1901,ZAMORA,EC190150,Varios Sectores,-78.954196,-4.068565,La Sierra,9/1/16,2:00:00 AM,9,1,2016,Rain ,Urban,0,0,0,0,0,1,0,0,0,0,,,,,4.0,,16.0,16.0,,,,,1,6,6,16.0,4.0,3.0,2016-09-01 07:00:00
3617,Desinventar,ZAMORA CHINCHIPE,EC19,ZAMORA,EC1901,ZAMORA,EC190150,02 de Noviembre,-78.9604,-4.068508,La Sierra,4/27/16,7:30:00 PM,4,27,2016,Rain / Overflow,Small stream overflow,0,0,0,1,0,0,0,0,0,0,,,,,1.0,,9.0,9.0,,,,,4,6,6,9.0,1.0,2.0,2016-04-28 00:30:00
3333,Desinventar,ESMERALDAS,EC08,ELOY ALFARO,EC0802,ATAHUALPA (CAB. EN CAMARONES),EC080252,SANTA MARiA 2,-78.968094,0.853552,La Costa,1/25/16,6:00:00 AM,1,25,2016,Rain,Heavy precipitation,1,0,0,0,0,0,0,0,0,0,,,,,,,,,,,15.0,,2,6,6,,,,2016-01-25 11:00:00
5277,SNGRE_2021,ESMERALDAS,EC08,ELOY ALFARO,EC0802,ATAHUALPA (CAB. EN CAMARONES),EC080252,Varios sectores: Santa Maria,-78.984595,0.830345,La Costa,5/15/20,6:00:00 AM,5,15,2020,Rain/Overflow,Heavy precipitation,1,0,0,0,0,0,0,0,0,0,,,,,50.0,150.0,200.0,,,,,,2,6,6,200.0,150.0,5.0,2020-05-15 11:00:00
162,Desinventar/SNGRE_2021,BOLIVAR,EC02,CHILLANES,EC0202,CHILLANES,EC020250,Sector: Sur de la Ciudad,-79.07,-1.94,La Sierra,2/26/10,3:00:00 AM,2,26,2010,,Urban,0,0,0,0,0,1,0,0,0,0,,,,,,,,,,,,,1,6,6,,,,2010-02-26 08:00:00
5024,SNGRE_2021,ZAMORA CHINCHIPE,EC19,PALANDA,EC1908,PALANDA,EC190850,"Palanuma, via Palanda- Zumba [E682]",-79.127695,-4.711277,La Sierra,10/26/19,6:03:00 PM,10,26,2019,Rain,Surface runoff,0,0,0,0,1,0,0,0,0,0,,,,,,,,,,,,,6,6,6,,,,2019-10-26 23:03:00
5027,SNGRE_2021,ZAMORA CHINCHIPE,EC19,PALANDA,EC1908,PALANDA,EC190850,"Palanuma, via Palanda- Zumba [E682]",-79.127695,-4.711277,La Sierra,11/2/19,9:44:00 AM,11,2,2019,,Surface runoff,0,0,0,0,1,0,0,0,0,0,,,,,,,,,,,,,6,6,6,,,,2019-11-02 14:44:00
2384,SNGRE_2021,SANTO DOMINGO DE LOS TSACHILAS,EC23,SANTO DOMINGO,EC2301,CHIGUILPE,EC230150,"Coop. Unificados, calle  Gualaceo",-79.1513,-0.2658,La Costa,5/7/13,6:00:00 AM,5,7,2013,Rain ,Heavy precipitation,1,0,0,0,0,0,0,0,0,0,,,,,,,,,,,,,2,6,6,,,,2013-05-07 11:00:00
3945,Desinventar,SANTO DOMINGO DE LOS TSACHILAS,EC23,SANTO DOMINGO,EC2301,SANTO DOMINGO DE LOS COLORADOS,EC230150,Barrio la Merced calle Calceta y Celica.,-79.15182,-0.259621,La Costa,3/16/17,4:04:00 PM,3,16,2017,Rain ,Heavy precipitation/ Short duration rain,1,1,0,0,0,0,0,0,0,0,,,,,1.0,,2.0,2.0,,,,,5,6,6,2.0,1.0,1.0,2017-03-16 21:04:00
4549,SNGRE,SANTO DOMINGO DE LOS TSACHILAS,EC23,SANTO DOMINGO,EC2301,CHIGUILPE,EC230150,Coop. Unificados Barrio 15 de Noviembre calle Pasaje y Bahia de Caraquez,-79.156174,-0.266037,La Costa,1/5/19,10:00:00 PM,1,5,2019,Rain,Heavy precipitation/ Urban ,1,0,0,0,0,1,0,0,0,0,,,,,,1.0,2.0,,,,,,3,6,6,2.0,1.0,1.0,2019-01-06 03:00:00
4855,SNGRE,SANTO DOMINGO DE LOS TSACHILAS,EC23,SANTO DOMINGO,EC2301,SANTO DOMINGO DE LOS COLORADOS,EC230150,Coop. 10 de Agosto calle Ambato y Pupusa.,-79.171862,-0.250677,La Costa,3/21/19,11:30:00 PM,3,21,2019,Rain,Heavy precipitation/ Urban,1,0,0,0,0,1,0,0,0,0,,,,,,12.0,46.0,,,,,,3,6,6,46.0,12.0,3.0,2019-03-22 04:30:00
3854,Desinventar,SANTO DOMINGO DE LOS TSACHILAS,EC23,SANTO DOMINGO,EC2301,SANTO DOMINGO DE LOS COLORADOS,EC230150,"Coop. La Cadena, a dos cuadras de la gallera de la parada de",-79.17235,-0.279419,La Costa,2/21/17,3:00:00 PM,2,21,2017,Rain ,Heavy precipitation/ Short duration rain,1,1,0,0,0,0,0,0,0,0,,,,,2.0,,5.0,5.0,,,,,5,6,6,5.0,2.0,1.0,2017-02-21 20:00:00
2753,SNGRE,SANTO DOMINGO DE LOS TSACHILAS,EC23,SANTO DOMINGO,EC2301,RIO VERDE,EC230150,Coop. Liberacion popular calle Manuelita Saenz y Cansacoto.,-79.174815,-0.257138,La Costa,4/13/14,10:45:00 PM,4,13,2014,Rain / Overflow,Heavy precipitation/ Short duration rain,1,1,0,0,0,0,0,0,0,0,,,,,,,2.0,,,,,,5,6,6,2.0,,1.0,2014-04-14 03:45:00
2533,Desinventar,SANTO DOMINGO DE LOS TSACHILAS,EC23,SANTO DOMINGO,EC2301,RIO VERDE,EC230150,"Coop. Rumunahui, calle Rio de Janeiro y Maracaibo.",-79.175208,-0.269897,La Costa,1/21/14,9:37:00 PM,1,21,2014,Rain ,Heavy precipitation/ Urban ,1,0,0,0,0,1,0,0,0,0,,,,,1.0,,16.0,16.0,,,,,3,6,6,16.0,1.0,3.0,2014-01-22 02:37:00
2754,SNGRE,SANTO DOMINGO DE LOS TSACHILAS,EC23,SANTO DOMINGO,EC2301,RIO VERDE,EC230150,Coop. Liberacion Popular calle La Rabida y Rodrigo de Triana,-79.175272,-0.261325,La Costa,4/13/14,10:45:00 PM,4,13,2014,Rain ,Heavy precipitation/ Short duration rain,1,1,0,0,0,0,0,0,0,0,,,,,,,9.0,,,,,,5,6,6,9.0,,2.0,2014-04-14 03:45:00
2751,SNGRE,SANTO DOMINGO DE LOS TSACHILAS,EC23,SANTO DOMINGO,EC2301,RIO VERDE,EC230150,Urbanizacion Las Palmeras,-79.178632,-0.259426,La Costa,4/13/14,11:00:00 PM,4,13,2014,Rain / Overflow,Heavy precipitation/ Short duration rain,1,1,0,0,0,0,0,0,0,0,,,,,,,,,,,,,5,6,6,,,,2014-04-14 04:00:00
2852,Desinventar,SANTO DOMINGO DE LOS TSACHILAS,EC23,SANTO DOMINGO,EC2301,RIO VERDE,EC230150,Urb. Ciudad Verde,-79.179158,-0.286446,La Costa,7/13/14,4:20:00 AM,7,13,2014,Rain / Overflow,Heavy precipitation/ Short duration rain,1,1,0,0,0,0,0,0,0,0,,,,,5.0,,11.0,11.0,,,,,5,6,6,11.0,5.0,3.0,2014-07-13 09:20:00
2779,SNGRE,SANTO DOMINGO DE LOS TSACHILAS,EC23,SANTO DOMINGO,EC2301,BOMBOLI,EC230150,Coop. 24 de Septiembre,-79.180063,-0.235093,La Costa,5/4/14,2:45:00 AM,5,4,2014,Rain,Short duration rain,0,1,0,0,0,0,0,0,0,0,,,,,,,4.0,,,,,,3,6,6,4.0,,1.0,2014-05-04 07:45:00
4225,Desinventar,SANTO DOMINGO DE LOS TSACHILAS,EC23,SANTO DOMINGO,EC2301,RIO VERDE,EC230150,Coop Santa Martha sector 6,-79.181871,-0.279004,La Costa,4/25/17,6:55:00 PM,4,25,2017,Rain ,Heavy precipitation/ Short duration rain,1,1,0,0,0,0,0,0,0,0,,,,,1.0,,4.0,4.0,,,,,5,6,6,4.0,1.0,1.0,2017-04-25 23:55:00
4174,SNGRE,SANTO DOMINGO DE LOS TSACHILAS,EC23,SANTO DOMINGO,EC2301,RIO VERDE,EC230150,Santa Martha sector 6 av. Ernesto Novoa y s/n,-79.182653,-0.280515,La Costa,4/10/17,8:47:00 AM,4,10,2017,Rain ,Heavy precipitation/ Short duration rain,1,1,0,0,0,0,0,0,0,0,,,,,,,3.0,,,,,,5,6,6,3.0,,1.0,2017-04-10 13:47:00
2756,SNGRE,SANTO DOMINGO DE LOS TSACHILAS,EC23,SANTO DOMINGO,EC2301,RIO VERDE,EC230150,  Coop. Ciudad Verde,-79.183406,-0.289223,La Costa,4/13/14,11:00:00 PM,4,13,2014,Rain / Overflow,Heavy precipitation/ Short duration rain,1,1,0,0,0,0,0,0,0,0,,,,,,,,,,,,,5,6,6,,,,2014-04-14 04:00:00
2839,Desinventar,SANTO DOMINGO DE LOS TSACHILAS,EC23,SANTO DOMINGO,EC2301,RIO VERDE,EC230150,"Coop. Santa Martha sector 1, Barrio La Inmaculada",-79.185017,-0.264274,La Costa,5/26/14,9:00:00 PM,5,26,2014,Rain ,Short duration rain,0,1,0,0,0,0,0,0,0,0,,,,,1.0,,5.0,5.0,,,,,3,6,6,5.0,1.0,1.0,2014-05-27 02:00:00
3194,Desinventar,SANTO DOMINGO DE LOS TSACHILAS,EC23,SANTO DOMINGO,EC2301,BOMBOLI,EC230150,Cooperativa Che Guevara,-79.185417,-0.232688,La Costa,5/24/15,11:00:00 PM,5,24,2015,Rain,Heavy precipitation / Urban / Small stream,1,0,0,0,0,1,0,0,0,0,,,,,1.0,,3.0,3.0,,,,,3,6,6,3.0,1.0,1.0,2015-05-25 04:00:00
2192,SNGRE_2021,COTOPAXI,EC05,LA MANA,EC0502,LA MANA,EC050250,El Moral / Toquillal ,-79.1869,-0.9687,La Costa,3/25/13,7:30:00 PM,3,25,2013,Rain ,Heavy precipitation/ Short duration rain,1,1,0,0,0,0,0,0,0,0,,,,,8.0,,40.0,,,,,,5,6,6,40.0,8.0,3.0,2013-03-26 00:30:00
2218,Desinventar/SNGRE_2021,COTOPAXI,EC05,LA MANA,EC0502,LA MANA,EC050250,Calles San Pablo y Sigchos,-79.1869,-0.9687,La Costa,3/28/13,12:30:00 PM,3,28,2013,Rain ,Heavy precipitation,1,0,0,0,0,0,0,0,0,0,,,,,1.0,,6.0,6.0,,,,,2,6,6,6.0,1.0,2.0,2013-03-28 17:30:00
2229,Desinventar/SNGRE_2021,COTOPAXI,EC05,LA MANA,EC0502,LA MANA,EC050250,Barrio Centro,-79.1869,-0.9687,La Costa,4/3/13,4:00:00 AM,4,3,2013,Rain ,Heavy precipitation/ Short duration rain,1,1,0,0,0,0,0,0,0,0,,,,,5.0,,20.0,20.0,,,,,5,6,6,20.0,5.0,3.0,2013-04-03 09:00:00
2230,Desinventar/SNGRE_2021,COTOPAXI,EC05,LA MANA,EC0502,LA MANA,EC050250,Pucayacu Chico,-79.1869,-0.9687,La Costa,4/3/13,4:00:00 AM,4,3,2013,Rain ,Heavy precipitation,1,0,0,0,0,0,0,0,0,0,,,,,3.0,,10.0,10.0,,,,,2,6,6,10.0,3.0,2.0,2013-04-03 09:00:00
4852,SNGRE,SANTO DOMINGO DE LOS TSACHILAS,EC23,SANTO DOMINGO,EC2301,RIO VERDE,EC230150,"Coop. Los Pinos Barrio El Vergel, en direccion a las palmeras.",-79.188283,-0.262857,La Costa,3/21/19,10:00:00 PM,3,21,2019,Rain,Heavy precipitation/ Urban,1,0,0,0,0,1,0,0,0,0,,,,,,10.0,38.0,,,,,,3,6,6,38.0,10.0,3.0,2019-03-22 03:00:00
3853,Desinventar,SANTO DOMINGO DE LOS TSACHILAS,EC23,SANTO DOMINGO,EC2301,SANTA MARIA DEL TOACHI,EC230157,Santa Maria del Toachi-Recinto Provincias Unidas- Varios Sec,-79.189877,-0.60251,La Costa,2/21/17,5:53:00 PM,2,21,2017,Rain / Overflow,Heavy precipitation/ Short duration rain,1,1,0,0,0,0,0,0,0,0,,,,,3.0,,12.0,,,,,,5,6,6,12.0,3.0,3.0,2017-02-21 22:53:00
2757,SNGRE,SANTO DOMINGO DE LOS TSACHILAS,EC23,SANTO DOMINGO,EC2301,RIO VERDE,EC230150,"Urb. Cristo Vive, Barrio Honduras",-79.194562,-0.287317,La Costa,4/14/14,3:00:00 AM,4,14,2014,Rain ,Small stream overflow,0,0,0,1,0,0,0,0,0,0,,,,,,,45.0,,,,,,4,6,6,45.0,,3.0,2014-04-14 08:00:00
2730,SNGRE,SANTO DOMINGO DE LOS TSACHILAS,EC23,SANTO DOMINGO,EC2301,RIO VERDE,EC230150,"Coop. Alejandro Montesdeoca, Barrio 9 de Octubre",-79.200671,-0.282353,La Costa,3/30/14,7:00:00 AM,3,30,2014,Rain,Heavy precipitation/ Urban/ Short duration rain,1,1,0,0,0,1,0,0,0,0,,,,,,,5.0,,,,,,6,6,6,5.0,,1.0,2014-03-30 12:00:00
2407,SNGRE_2021,SANTO DOMINGO DE LOS TSACHILAS,EC23,SANTO DOMINGO,EC2301,ABRAHAM CALAZACON,EC230150,"Coop. Modelo, Barrio 5 de Junio, calle Rio Verde y Av. Los Colonos",-79.2023,-0.2632,La Costa,5/27/13,3:00:00 AM,5,27,2013,Rain,Short duration rain/ urban,0,1,0,0,0,1,0,0,0,0,,,,,,,,,,,,,4,6,6,,,,2013-05-27 08:00:00
1790,Desinventar/SNGRE_2021,SANTO DOMINGO DE LOS TSACHILAS,EC23,SANTO DOMINGO,EC2301,EL ESFUERZO,EC230156,El Esfuerzo; calles Eudomilia Piedra y 8 de Septiembre,-79.2072,-0.4619,La Costa,1/5/13,6:00:00 PM,1,5,2013,Rain ,Heavy precipitation/ Urban/ Short duration rain,1,1,0,0,0,1,0,0,0,0,,,,,1.0,,9.0,9.0,,,,,6,6,6,9.0,1.0,2.0,2013-01-05 23:00:00
3812,Desinventar,SANTO DOMINGO DE LOS TSACHILAS,EC23,SANTO DOMINGO,EC2301,ABRAHAM CALAZACON,EC230150,"Via Quevedo km. 2 , Invasion Chilachito, entrando por la fa",-79.210005,-0.275509,La Costa,2/10/17,7:50:00 PM,2,10,2017,Rain,Heavy precipitation/ Short duration rain,1,1,0,0,0,0,0,0,0,0,,,,,3.0,,3.0,3.0,,,,,5,6,6,3.0,3.0,1.0,2017-02-11 00:50:00
2952,Desinventar,SANTO DOMINGO DE LOS TSACHILAS,EC23,SANTO DOMINGO,EC2301,ABRAHAM CALAZACON,EC230150,Via Quevedo Km 6  1/2  Cooperativa Nueva Aurora,-79.211611,-0.275455,La Costa,2/7/15,6:56:00 AM,2,7,2015,Rain,Heavy precipitation/ Short duration rain,1,1,0,0,0,0,0,0,0,0,,,,,1.0,,3.0,3.0,,,,,5,6,6,3.0,1.0,1.0,2015-02-07 11:56:00
2750,SNGRE,SANTO DOMINGO DE LOS TSACHILAS,EC23,SANTO DOMINGO,EC2301,ABRAHAM CALAZACON,EC230150,Coop. Plan de Vivienda Barrio 14 de junio.,-79.212819,-0.258129,La Costa,4/13/14,10:15:00 PM,4,13,2014,Rain ,Heavy precipitation / Short duration rain,1,1,0,0,0,0,0,0,0,0,,,,,,,13.0,,,,,,5,6,6,13.0,,3.0,2014-04-14 03:15:00
2829,Desinventar,SANTO DOMINGO DE LOS TSACHILAS,EC23,SANTO DOMINGO,EC2301,ABRAHAM CALAZACON,EC230150,Coop. Plan de Vivienda Barrio 14 de junio.|,-79.212819,-0.258129,La Costa,5/20/14,8:30:00 PM,5,20,2014,Rain ,Heavy precipitation/ Urban/ Short duration rain,1,1,0,0,0,1,0,0,0,0,,,,,7.0,,29.0,29.0,,,,,6,6,6,29.0,7.0,3.0,2014-05-21 01:30:00
2185,SNGRE_2021,SANTO DOMINGO DE LOS TSACHILAS,EC23,SANTO DOMINGO,EC2301,ABRAHAM CALAZACON,EC230150,"Plan de Vivienda Municipal, Barrio 9 de Mayo ",-79.2152,-0.2555,La Costa,3/23/13,8:00:00 PM,3,23,2013,Rain ,Heavy precipitation/ Urban,1,0,0,0,0,1,0,0,0,0,,,,,1.0,,4.0,,,,,,3,6,6,4.0,1.0,1.0,2013-03-24 01:00:00
4697,Desinventar,COTOPAXI,EC05,LA MANA,EC0502,LA MANA,EC050250,Pucayacu Chico,-79.2259,-0.9589,La Costa,2/28/19,5:00:00 AM,2,28,2019,Rain,Urban,0,0,0,0,0,1,0,0,0,0,,,,,4.0,4.0,19.0,19.0,,19.0,,,1,6,6,19.0,4.0,3.0,2019-02-28 10:00:00
3143,Desinventar,SANTO DOMINGO DE LOS TSACHILAS,EC23,SANTO DOMINGO,EC2301,SANTA MARIA DEL TOACHI,EC230157,Barrio Fuerzas Unidas.,-79.229768,-0.579419,La Costa,4/21/15,3:30:00 PM,4,21,2015,Rain / Overflow,Heavy precipitation/ Short duration rain,1,1,0,0,0,0,0,0,0,0,,,,,2.0,,,,,,,,5,6,6,,2.0,,2015-04-21 20:30:00
3825,Desinventar,BOLIVAR,EC02,CHILLANES,EC0202,SAN JOSE DEL TAMBO (TAMBOPAMBA,EC020251,Barrio San Jose ,-79.234162,-1.95638,La Costa,2/11/17,10:40:00 PM,2,11,2017,Rain / Overflow,Short duration rain,0,1,0,0,0,0,0,0,0,0,,,,4.0,66.0,,264.0,264.0,,,,,3,6,6,264.0,66.0,5.0,2017-02-12 03:40:00
5098,SNGRE_2021,GUAYAS,EC09,GNRAL. ANTONIO ELIZALDE,EC0927,GRAL. ANTONIO ELIZALDE (BUCAY),EC092750,Recinto Matilde Esther - Barrio El Carmen,-79.23709,-2.1060154,La Costa,1/28/20,3:15:00 AM,1,28,2020,Rain/Overflow,Heavy precipitation/Small stream overflow,1,0,0,1,0,0,0,0,0,0,,,,,6.0,6.0,24.0,,,,,,6,6,6,24.0,6.0,3.0,2020-01-28 08:15:00
5086,SNGRE_2021,BOLIVAR,EC02,CHILLANES,EC0202,SAN JOSE DEL TAMBO (TAMBOPAMBA,EC020251,"La Margarita, via Chillanes - San Jose del Tambo",-79.240258,-1.965811,La Costa,1/22/20,11:30:00 AM,1,22,2020,Rain,Surface runoff,0,0,0,0,1,0,0,0,0,0,,,,,,,,,,,,,6,6,6,,,,2020-01-22 16:30:00
4191,Desinventar,BOLIVAR,EC02,ECHEANDIA,EC0204,ECHEANDIA,EC020450,Recinto Camaron,-79.243996,-1.425659,La Sierra,4/17/17,6:30:00 PM,4,17,2017,Rain / Overflow,Heavy precipitation/Short duration rain,1,1,0,0,0,0,0,0,0,0,,,,4.0,80.0,,61.0,320.0,,,,,5,6,6,320.0,80.0,5.0,2017-04-17 23:30:00
5268,SNGRE_2021,GUAYAS,EC09,GNRAL. ANTONIO ELIZALDE,EC0927,GRAL. ANTONIO ELIZALDE (BUCAY),EC092750,"Matilde Esther, By pass",-79.245917,-2.1073827,La Costa,5/9/20,9:15:00 PM,5,9,2020,Rain,Heavy precipitation,1,0,0,0,0,0,0,0,0,0,,,,,5.0,5.0,25.0,,,,,,2,6,6,25.0,5.0,3.0,2020-05-10 02:15:00
4079,Desinventar,BOLIVAR,EC02,CHILLANES,EC0202,SAN JOSE DEL TAMBO (TAMBOPAMBA,EC020251,La Marcelina - El Atio - San Antonio,-79.254017,-1.946409,La Costa,3/30/17,1:00:00 AM,3,30,2017,Long duration rain / Overflow,Heavy precipitation,1,0,0,0,0,0,0,0,0,0,,,,,,,,,,,0.5,5.5,2,6,6,,,,2017-03-30 06:00:00
2131,Desinventar/SNGRE_2021,BOLIVAR,EC02,ECHEANDIA,EC0204,ECHEANDIA,EC020450,Sabanetillas,-79.2791,-1.4278,La Sierra,3/16/13,9:30:00 AM,3,16,2013,Rain,Heavy precipitation,1,0,0,0,0,0,0,0,0,0,,,,,2.0,,4.0,4.0,,,,,2,6,6,4.0,2.0,1.0,2013-03-16 14:30:00
3587,Desinventar,COTOPAXI,EC05,PANGUA,EC0503,MORASPUNGO,EC050351,Comunidad Guampara,-79.279453,-1.126755,La Costa,4/10/16,5:00:00 PM,4,10,2016,Rain / Overflow,Heavy precipitation,1,0,0,0,0,0,0,0,0,0,,,,,1.0,,,,,,,,2,6,6,,1.0,,2016-04-10 22:00:00
3813,Desinventar,SANTO DOMINGO DE LOS TSACHILAS,EC23,SANTO DOMINGO,EC2301,BOMBOLI,EC230150,Coop. Luz del dia a una cuadra del colegio Julio Jaramillo.,-79.298497,-0.217815,La Costa,2/10/17,7:00:00 PM,2,10,2017,Rain,Heavy precipitation/ Short duration rain,1,1,0,0,0,0,0,0,0,0,,,,,4.0,,11.0,11.0,,,,,5,6,6,11.0,4.0,3.0,2017-02-11 00:00:00
3716,Desinventar,LOS RIOS,EC12,MONTALVO,EC1203,MONTALVO,EC120350,"La maravilla, Lola Grande y Lola Chica",-79.300246,-1.772998,La Costa,1/15/17,6:30:00 AM,1,15,2017,Overflow,River bank failure,0,0,0,0,0,0,0,1,0,0,,,,,,,,,,,1143.0,92.0,4,6,6,,,,2017-01-15 11:30:00
4686,Desinventar,LOS RIOS,EC12,BABAHOYO,EC1201,FEBRES CORDERO (LAS JUNTAS) (CAB. EN MATA DE CACAO),EC120153,"Rctos. El Saltadero, San Francisco, Colombia del Atio, La Ro",-79.309763,-1.962257,La Costa,2/26/19,12:59:00 AM,2,26,2019,Rain / Overflow,Heavy precipitation/ Short duration rain,1,1,0,0,0,0,0,0,0,0,,,,,74.0,74.0,303.0,,,,,5.0,5,6,6,303.0,74.0,5.0,2019-02-26 05:59:00
2717,SNGRE,LOS RIOS,EC12,BABAHOYO,EC1201,FEBRES CORDERO (LAS JUNTAS) (CAB. EN MATA DE CACAO),EC120153,"Isla Maria, Monserrate y La Mestiza",-79.319185,-1.976892,La Costa,3/30/14,5:30:00 AM,3,30,2014,Rain / Overflow,Short duration rain,0,1,0,0,0,0,0,0,0,0,,,,,,,29.0,,23.0,,,,3,6,6,29.0,,3.0,2014-03-30 10:30:00
2055,Desinventar/SNGRE_2021,LOS RIOS,EC12,BABAHOYO,EC1201,FEBRES CORDERO (LAS JUNTAS) (CAB. EN MATA DE CACAO),EC120153,Mata de Cacao (Pedro Emilio Alvarado),-79.3192,-1.9769,La Costa,3/7/13,5:30:00 AM,3,7,2013,Overflow,Small stream overflow,0,0,0,1,0,0,0,0,0,0,,,,,80.0,,320.0,320.0,,,,,4,6,6,320.0,80.0,5.0,2013-03-07 10:30:00
2552,Desinventar/SNGRE_2021,BOLIVAR,EC02,LAS NAVES,EC0207,LAS NAVES,EC020750,La Playita,-79.319785,-1.288664,La Costa,1/22/14,5:45:00 AM,1,22,2014,Rain / Overflow,Heavy precipitation/ Short duration rain,1,1,0,0,0,0,0,0,0,0,,,,,8.0,,27.0,,12.0,,31.0,,5,6,6,27.0,8.0,3.0,2014-01-22 10:45:00
2965,Desinventar,LOS RIOS,EC12,MONTALVO,EC1203,MONTALVO,EC120350,"La Ernestina, Bosque de Oro, Salvador Allende",-79.340159,-1.802194,La Costa,2/9/15,7:00:00 AM,2,9,2015,Rain / Overflow,Heavy precipitation,1,0,0,0,0,0,0,0,0,0,,,,,6.0,,22.0,22.0,13.0,22.0,,,2,6,6,22.0,6.0,3.0,2015-02-09 12:00:00
3883,Desinventar,CANAR,EC03,LA TRONCAL,EC0304,LA TRONCAL,EC030450,San Gerardo,-79.34415,-2.420672,La Costa,2/28/17,11:48:00 PM,2,28,2017,Rain / Overflow,Small stream overflow,0,0,0,1,0,0,0,0,0,0,,,,1.0,2.0,,3.0,12.0,,3.0,,,4,6,6,12.0,2.0,3.0,2017-03-01 04:48:00
2928,Desinventar,CANAR,EC03,LA TRONCAL,EC0304,LA TRONCAL,EC030450,San Pedro,-79.353777,-2.41518,La Costa,1/17/15,5:23:00 PM,1,17,2015,Rain ,Heavy precipitation/ Short duration rain,1,1,0,0,0,0,0,0,0,0,,,,,3.0,,200.0,200.0,,,,,5,6,6,200.0,3.0,5.0,2015-01-17 22:23:00
3002,Desinventar,ESMERALDAS,EC08,LA CONCORDIA,EC0808,LA CONCORDIA,EC080850,"Barrio La Florida y Barrio los Angeles, tras la Gasolinera l",-79.394756,0.005218,La Costa,3/16/15,8:00:00 PM,3,16,2015,Rain,Heavy precipitation/ Short duration rain,1,1,0,0,0,0,0,0,0,0,,,,,2.0,,7.0,7.0,,,,,5,6,6,7.0,2.0,2.0,2015-03-17 01:00:00
3180,Desinventar,ESMERALDAS,EC08,LA CONCORDIA,EC0808,LA CONCORDIA,EC080850,Barrio 9 de Octubre av. Principal calle Loja y 9 de Octubre.,-79.39817,0.00719,La Costa,5/12/15,8:20:00 PM,5,12,2015,Rain,Heavy precipitation/ Short duration rain,1,1,0,0,0,0,0,0,0,0,,,,,1.0,,,,,,,,5,6,6,,1.0,,2015-05-13 01:20:00
3111,Desinventar,ESMERALDAS,EC08,LA CONCORDIA,EC0808,LA CONCORDIA,EC080850,"Calle Esmeraldas y Tarqui, Barrio Urdesa, Cooperativa 5 de S",-79.398789,0.003473,La Costa,4/3/15,7:00:00 PM,4,3,2015,Rain,Heavy precipitation/ Short duration rain,1,1,0,0,0,0,0,0,0,0,,,,,8.0,,,,,,,,5,6,6,,8.0,,2015-04-04 00:00:00
3441,Desinventar,ESMERALDAS,EC08,LA CONCORDIA,EC0808,LA CONCORDIA,EC080850,Calle Esmeraldas Por el Terminal Terrestre.,-79.401368,0.004721,La Costa,2/12/16,5:30:00 PM,2,12,2016,Rain,Heavy precipitation/ Short duration rain,1,1,0,0,0,0,0,0,0,0,,,,,1.0,,3.0,3.0,,3.0,,,5,6,6,3.0,1.0,1.0,2016-02-12 22:30:00
2648,Desinventar/SNGRE_2021,ESMERALDAS,EC08,LA CONCORDIA,EC0808,LA CONCORDIA,EC080850,Coop. Virgen del Cisne etapa 2 calle 3 y E,-79.402212,0.021316,La Costa,2/25/14,2:00:00 AM,2,25,2014,Rain,Heavy precipitation/ Short duration rain,1,1,0,0,0,0,0,0,0,0,,,,,,,6.0,,,,,,5,6,6,6.0,,2.0,2014-02-25 07:00:00
4226,Desinventar,SANTO DOMINGO DE LOS TSACHILAS,EC23,SANTO DOMINGO,EC2301,SANTO DOMINGO DE LOS COLORADOS,EC230150,Producto de las fuertes lluvias del dia 25/04/2017; en horas,-79.405726,-0.261176,La Costa,4/25/17,8:00:00 PM,4,25,2017,Rain ,Heavy precipitation/ Short duration rain,1,1,0,0,0,0,0,0,0,0,,,,,2.0,,6.0,6.0,,,,,5,6,6,6.0,2.0,2.0,2017-04-26 01:00:00
4832,SNGRE,GUAYAS,EC09,NARANJITO,EC0912,NARANJITO,EC091250,Ismael Perez Pazmino,-79.437169,-2.175361,La Costa,3/19/19,7:00:00 AM,3,19,2019,Rain,Heavy precipitation,1,0,0,0,0,0,0,0,0,0,,,,,,,,,,,,,2,6,6,,,,2019-03-19 12:00:00
4251,Desinventar,MANABI,EC13,EL CARMEN,EC1304,EL CARMEN,EC130450,Barrio La Pradera,-79.444672,-0.237178,La Costa,5/12/17,5:20:00 PM,5,12,2017,Rain ,Heavy precipitation/Short duration rain,1,1,0,0,0,0,0,0,0,0,,,,,1.0,,5.0,5.0,,,,,5,6,6,5.0,1.0,1.0,2017-05-12 22:20:00
2689,Desinventar,LOJA,EC11,LOJA,EC1101,EL CISNE,EC110153,Chaquircuna,-79.451731,-3.838404,La Sierra,3/11/14,10:00:00 AM,3,11,2014,Rain / Overflow,Heavy precipitation,1,0,0,0,0,0,0,0,0,0,,,,,,,,,,,,,2,6,6,,,,2014-03-11 15:00:00
4075,Desinventar,GUAYAS,EC09,NARANJITO,EC0912,NARANJITO,EC091250,Cdla. Xavier Marcos,-79.465047,-2.167531,La Costa,3/30/17,5:00:00 AM,3,30,2017,Rain / Overflow,Heavy precipitation/ Small stream overflow,1,0,0,1,0,0,0,0,0,0,,,,,34.0,,143.0,,,,,,6,6,6,143.0,34.0,5.0,2017-03-30 10:00:00
2283,Desinventar/SNGRE_2021,ESMERALDAS,EC08,QUININDE,EC0804,LA UNION,EC080455,Barrio 3 de Julio,-79.4671,0.0963,La Costa,4/17/13,9:00:00 PM,4,17,2013,Rain / Overflow,Heavy precipitation,1,0,0,0,0,0,0,0,0,0,,,,,75.0,,,,,,,,2,6,6,,75.0,,2013-04-18 02:00:00
3929,SNGRE,MANABI,EC13,EL CARMEN,EC1304,EL CARMEN,EC130450,Varios Sectores,-79.47329,-0.26784,La Costa,3/13/17,9:00:00 AM,3,13,2017,Rain ,Heavy precipitation/Urban,1,0,0,0,0,1,0,0,0,0,,,,,,,1600.0,,,,,,3,6,6,1600.0,,6.0,2017-03-13 14:00:00
5181,SNGRE_2021,GUAYAS,EC09,MILAGRO,EC0910,MARISCAL SUCRE (HUAQUES),EC091053,Mariscal Sucre,-79.503053,-2.1110373,La Costa,2/28/20,8:00:00 AM,2,28,2020,Rain,Heavy precipitation,1,0,0,0,0,0,0,0,0,0,,,,,,,,,,,,,2,6,6,,,,2020-02-28 13:00:00
3356,Desinventar,GUAYAS,EC09,MILAGRO,EC0910,MARISCAL SUCRE (HUAQUES),EC091053,Via a Lorenzo de Garaicoa UE Mariscal Sucre ,-79.50391,-2.112022,La Costa,1/25/16,7:00:00 AM,1,25,2016,Rain ,Heavy precipitation/ Urban/ Short duration rain,1,1,0,0,0,1,0,0,0,0,,,,,,,,,,,,,6,6,6,,,,2016-01-25 12:00:00
1970,Desinventar/SNGRE_2021,MANABI,EC13,EL CARMEN,EC1304,EL CARMEN,EC130450,Barrio Paraiso 2,-79.5073,-0.2425,La Costa,3/3/13,9:30:00 AM,3,3,2013,Rain / Overflow,Heavy precipitation/ Short duration rain,1,1,0,0,0,0,0,0,0,0,,,,,2.0,,10.0,10.0,,,,,5,6,6,10.0,2.0,2.0,2013-03-03 14:30:00
2697,Desinventar,ESMERALDAS,EC08,ESMERALDAS,EC0801,CAMARONES (CAB. EN SAN VICENTE,EC080152,Recinto Banderas,-79.518121,1.01056,La Costa,3/15/14,10:30:00 AM,3,15,2014,Rain ,Urban,0,0,0,0,0,1,0,0,0,0,,,,,100.0,,500.0,500.0,,,,,1,6,6,500.0,100.0,5.0,2014-03-15 15:30:00
3969,SNGRE,GUAYAS,EC09,ALFREDO BAQUERIZO MORENO,EC0902,ALFREDO BAQUERIZO MORENO (JUJA,EC090250,Recinto La Otilia,-79.536162,-1.956619,La Costa,3/20/17,8:53:00 AM,3,20,2017,Rain / Overflow,Heavy precipitation,1,0,0,0,0,0,0,0,0,0,,,,,,,149.0,,,,,,2,6,6,149.0,,5.0,2017-03-20 13:53:00
2049,Desinventar/SNGRE_2021,GUAYAS,EC09,ALFREDO BAQUERIZO MORENO,EC0902,ALFREDO BAQUERIZO MORENO (JUJA,EC090250,Los Amarillos Recinto San Antonio en km 8  1/2  via Simon Boliva,-79.5474,-1.9469,La Costa,3/7/13,2:30:00 PM,3,7,2013,Rain / Overflow,Heavy precipitation,1,0,0,0,0,0,0,0,0,0,,,,,,,,,,,,,2,6,6,,,,2013-03-07 19:30:00
3580,Desinventar,GUAYAS,EC09,ALFREDO BAQUERIZO MORENO,EC0902,ALFREDO BAQUERIZO MORENO (JUJA,EC090250,Rcto. Puerto Canoa,-79.54742,-1.946947,La Costa,4/5/16,11:07:00 AM,4,5,2016,Overflow,River bank failure,0,0,0,0,0,0,0,1,0,0,,,,,20.0,,80.0,80.0,,,,,4,6,6,80.0,20.0,4.0,2016-04-05 16:07:00
3062,Desinventar,GUAYAS,EC09,ALFREDO BAQUERIZO MORENO,EC0902,ALFREDO BAQUERIZO MORENO (JUJA,EC090250,Boca de Nauza,-79.550179,-1.957909,La Costa,3/22/15,2:00:00 PM,3,22,2015,Rain / Overflow,Heavy precipitation,1,0,0,0,0,0,0,0,0,0,,,,1.0,,,,,,,,,2,6,6,,,,2015-03-22 19:00:00
3123,Desinventar,GUAYAS,EC09,ALFREDO BAQUERIZO MORENO,EC0902,ALFREDO BAQUERIZO MORENO (JUJA,EC090250,Recinto Los Amarillos.,-79.553725,-1.894454,La Costa,4/13/15,1:30:00 PM,4,13,2015,Rain / Overflow/ Failure,Heavy precipitation/ River Bank Failure,1,0,0,0,0,0,0,1,0,0,,,,,8.0,,33.0,33.0,,,,,6,6,6,33.0,8.0,3.0,2015-04-13 18:30:00
3478,Desinventar,GUAYAS,EC09,ALFREDO BAQUERIZO MORENO,EC0902,ALFREDO BAQUERIZO MORENO (JUJA,EC090250,Recinto El Recreo,-79.553725,-1.894454,La Costa,3/3/16,10:00:00 PM,3,3,2016,Rain / Overflow,Short duration rain,0,1,0,0,0,0,0,0,0,0,,,,,2.0,,7.0,7.0,5.0,7.0,,,3,6,6,7.0,2.0,2.0,2016-03-04 03:00:00
3175,Desinventar,GUAYAS,EC09,ALFREDO BAQUERIZO MORENO,EC0902,ALFREDO BAQUERIZO MORENO (JUJA,EC090250,Cabecera Cantonal,-79.553887,-1.894264,La Costa,5/5/15,10:00:00 PM,5,5,2015,Rain,Heavy precipitation,1,0,0,0,0,0,0,0,0,0,,,,,,,429.0,,,,,,2,6,6,429.0,,5.0,2015-05-06 03:00:00
3435,Desinventar,ESMERALDAS,EC08,ESMERALDAS,EC0801,CAMARONES (CAB. EN SAN VICENTE,EC080152,TACUSA,-79.554818,0.99345,La Costa,2/8/16,4:00:00 AM,2,8,2016,Landslide/ Rain,Heavy precipitation,1,0,0,0,0,0,0,0,0,0,,,,,,,,,,,,,2,6,6,,,,2016-02-08 09:00:00
4772,Desinventar,GUAYAS,EC09,ALFREDO BAQUERIZO MORENO,EC0902,ALFREDO BAQUERIZO MORENO (JUJA,EC090250,Varios sectores,-79.555079,-1.89078,La Costa,3/15/19,7:00:00 AM,3,15,2019,Rain,Heavy precipitation,1,0,0,0,0,0,0,0,0,0,,,,,,,,,,,,,2,6,6,,,,2019-03-15 12:00:00
3992,Desinventar,GUAYAS,EC09,ALFREDO BAQUERIZO MORENO,EC0902,ALFREDO BAQUERIZO MORENO (JUJA,EC090250,Varios Sectores (Zona Urbana y Rural),-79.557108,-1.890197,La Costa,3/24/17,7:00:00 PM,3,24,2017,Rain / Overflow,Heavy precipitation/Urban,1,0,0,0,0,1,0,0,0,0,,,,,414.0,,1401.0,1401.0,,,,,3,6,6,1401.0,414.0,6.0,2017-03-25 00:00:00
4787,Desinventar,GUAYAS,EC09,ALFREDO BAQUERIZO MORENO,EC0902,ALFREDO BAQUERIZO MORENO (JUJA,EC090250,Cooperativa Jujan 3er Callejon-Sector La Playita,-79.557827,-1.901386,La Costa,3/17/19,7:00:00 AM,3,17,2019,Rain / Overflow,Heavy precipitation,1,0,0,0,0,0,0,0,0,0,,,,,3.0,3.0,10.0,10.0,,,,,2,6,6,10.0,3.0,2.0,2019-03-17 12:00:00
4554,Desinventar,ESMERALDAS,EC08,ESMERALDAS,EC0801,CAMARONES (CAB. EN SAN VICENTE,EC080152,"Varios sectores ( Banderas, El Eden, 3 de Abril y Algarrobo)",-79.566701,0.983848,La Costa,1/6/19,5:00:00 AM,1,6,2019,Rain,Heavy precipitation/ Urban ,1,0,0,0,0,1,0,0,0,0,,,,1.0,15.0,14.0,10.0,57.0,,,,,3,6,6,57.0,15.0,4.0,2019-01-06 10:00:00
4830,Desinventar,GUAYAS,EC09,MILAGRO,EC0910,MILAGRO,EC091050,Varios Sectores,-79.56944,-2.148542,La Costa,3/19/19,7:00:00 AM,3,19,2019,Rain,Heavy precipitation,1,0,0,0,0,0,0,0,0,0,,,,,,,,,,,,,2,6,6,,,,2019-03-19 12:00:00
3186,Desinventar,ESMERALDAS,EC08,QUININDE,EC0804,ROSA ZARATE (QUININDE),EC080450,EL VERGEL,-79.572193,0.439112,La Costa,5/14/15,12:59:00 PM,5,14,2015,Rain ,Heavy precipitation/ Urban/ Short duration rain,1,1,0,0,0,1,0,0,0,0,,,,,,,,,,,5.0,,6,6,6,,,,2015-05-14 17:59:00
3013,Desinventar,GUAYAS,EC09,MILAGRO,EC0910,MILAGRO,EC091050,Cdla. Bellavista,-79.574077,-2.104801,La Costa,3/18/15,2:40:00 AM,3,18,2015,Rain,Heavy precipitation,1,0,0,0,0,0,0,0,0,0,,,,,2.0,,16.0,16.0,16.0,,,,2,6,6,16.0,2.0,3.0,2015-03-18 07:40:00
4007,SNGRE,GUAYAS,EC09,MILAGRO,EC0910,MILAGRO,EC091050,Sector Las Pozas Dos ,-79.58103,-2.136659,La Costa,3/24/17,4:00:00 AM,3,24,2017,Rain,Heavy precipitation/ Short duration rain,1,1,0,0,0,0,0,0,0,0,,,,,,,5.0,,5.0,5.0,,,5,6,6,5.0,,1.0,2017-03-24 09:00:00
3014,SNGRE,GUAYAS,EC09,MILAGRO,EC0910,MILAGRO,EC091050,Las Pozas,-79.584098,-2.101034,La Costa,3/18/15,4:40:00 PM,3,18,2015,Rain,Heavy precipitation,1,0,0,0,0,0,0,0,0,0,,,,,,,10.0,,10.0,,,,2,6,6,10.0,,2.0,2015-03-18 21:40:00
3486,Desinventar,GUAYAS,EC09,MILAGRO,EC0910,MILAGRO,EC091050,Varios Sectores,-79.58451,-2.136056,La Costa,3/3/16,5:40:00 PM,3,3,2016,Rain / Overflow,Heavy precipitation/ Short duration rain,1,1,0,0,0,0,0,0,0,0,,,,,573.0,,2433.0,2433.0,241.0,788.0,,,5,6,6,2433.0,573.0,,2016-03-03 22:40:00
4203,Desinventar,GUAYAS,EC09,MILAGRO,EC0910,MILAGRO,EC091050,Cdla. Las Pozas 2,-79.585942,-2.142977,La Costa,4/19/17,3:10:00 PM,4,19,2017,Rain ,Heavy precipitation / Urban,1,0,0,0,0,1,0,0,0,0,,,,,1.0,,22.0,7.0,,,,,3,6,6,22.0,1.0,3.0,2017-04-19 20:10:00
4074,SNGRE,GUAYAS,EC09,MILAGRO,EC0910,MILAGRO,EC091050,Varios sectores ,-79.587714,-2.131492,La Costa,3/30/17,10:00:00 AM,3,30,2017,Rain / Overflow,Heavy precipitation/ Short duration rain,1,1,0,0,0,0,0,0,0,0,1.0,,,,,,16086.0,,481.0,601.0,,,5,6,6,16086.0,,,2017-03-30 15:00:00
3358,Desinventar,GUAYAS,EC09,MILAGRO,EC0910,MILAGRO,EC091050,Varios Sectores (UE: Paulino Milan Vicente Anda Aguirre y Jo,-79.597816,-2.135526,La Costa,1/25/16,7:00:00 AM,1,25,2016,Rain ,Heavy precipitation/ Urban/ Short duration rain,1,1,0,0,0,1,0,0,0,0,,,,1.0,,,,,,,,,6,6,6,,,,2016-01-25 12:00:00
3357,Desinventar,GUAYAS,EC09,MILAGRO,EC0910,MILAGRO,EC091050,Varios Sectores (UE Gorky Elizalde y EEB Tnte. Hugo Ortiz) ,-79.601477,-2.152651,La Costa,1/25/16,7:00:00 AM,1,25,2016,Rain ,Heavy precipitation/ Urban/ Short duration rain,1,1,0,0,0,1,0,0,0,0,,,,,,,,,,,,,6,6,6,,,,2016-01-25 12:00:00
4674,SNGRE,GUAYAS,EC09,MILAGRO,EC0910,CHOBO,EC091051,Margaritas 2,-79.617045,-2.136891,La Costa,2/23/19,5:00:00 AM,2,23,2019,Rain,Heavy precipitation/ Short duration rain,1,1,0,0,0,0,0,0,0,0,,,,,,40.0,84.0,,,,,,5,6,6,84.0,40.0,4.0,2019-02-23 10:00:00
2008,Desinventar/SNGRE_2021,ESMERALDAS,EC08,ESMERALDAS,EC0801,TACHINA,EC080166,Barrios asentados en zonas bajas,-79.627,0.9661,La Costa,3/4/13,3:00:00 AM,3,4,2013,Rain,Urban/ Heavy precipitation,1,0,0,0,0,1,0,0,0,0,,,,,217.0,,217.0,217.0,,,,,3,6,6,217.0,217.0,5.0,2013-03-04 08:00:00
3961,Desinventar,ESMERALDAS,EC08,ESMERALDAS,EC0801,TACHINA,EC080166,21 DE NOVIEMBRE,-79.629918,0.964554,La Costa,3/18/17,5:57:00 AM,3,18,2017,Rain ,Heavy precipitation/ Urban ,1,0,0,0,0,1,0,0,0,0,,,,,1.0,,3.0,3.0,,,,,3,6,6,3.0,1.0,1.0,2017-03-18 10:57:00
4040,Desinventar,ESMERALDAS,EC08,ESMERALDAS,EC0801,TACHINA,EC080166,Tachina,-79.629953,0.966517,La Costa,3/26/17,8:30:00 AM,3,26,2017,Rain,Heavy precipitation/Urban,1,0,0,0,0,1,0,0,0,0,,,,,97.0,,324.0,324.0,,,,,3,6,6,324.0,97.0,5.0,2017-03-26 13:30:00
2628,Desinventar,ESMERALDAS,EC08,ESMERALDAS,EC0801,TACHINA,EC080166,Calles Eugenia Bautista y Velasco Ibarra,-79.630135,0.961886,La Costa,2/18/14,11:00:00 AM,2,18,2014,Rain ,Heavy precipitation/ Urban ,1,0,0,0,0,1,0,0,0,0,,,,,2.0,,10.0,10.0,,,,,3,6,6,10.0,2.0,2.0,2014-02-18 16:00:00
4777,Desinventar,GUAYAS,EC09,EMPALME,EC0908,VELASCO IBARRA (CAB. EL EMPALM,EC090850,Wacho Giler,-79.634343,-1.041219,La Costa,3/15/19,5:45:00 PM,3,15,2019,Rain,Heavy precipitation/ Urban/ Short duration rain,1,1,0,0,0,1,0,0,0,0,,,,,10.0,10.0,53.0,53.0,,,,,6,6,6,53.0,10.0,4.0,2019-03-15 22:45:00
3544,Desinventar,GUAYAS,EC09,EMPALME,EC0908,VELASCO IBARRA (CAB. EL EMPALM,EC090850,Ciudadela San Vicente atras del Estadio LDC Ciudadela Wacho ,-79.637696,-1.038462,La Costa,3/20/16,3:10:00 AM,3,20,2016,Rain / Overflow,Heavy precipitation/ Short duration rain,1,1,0,0,0,0,0,0,0,0,,,,,7.0,,39.0,39.0,,,,,5,6,6,39.0,7.0,3.0,2016-03-20 08:10:00
3450,Desinventar,GUAYAS,EC09,EMPALME,EC0908,VELASCO IBARRA (CAB. EL EMPALM,EC090850,Cdla. Las Tecas,-79.638449,-1.042966,La Costa,2/18/16,10:24:00 PM,2,18,2016,Rain,Heavy precipitation,1,0,0,0,0,0,0,0,0,0,,,,,1.0,,1.0,1.0,,,,,2,6,6,1.0,1.0,1.0,2016-02-19 03:24:00
3451,Desinventar,GUAYAS,EC09,EMPALME,EC0908,VELASCO IBARRA (CAB. EL EMPALM,EC090850,Calles Av. Manabi y Tungurahua,-79.641486,-1.041683,La Costa,2/18/16,10:30:00 PM,2,18,2016,Rain,Heavy precipitation,1,0,0,0,0,0,0,0,0,0,,,,,1.0,,6.0,6.0,,,,,2,6,6,6.0,1.0,2.0,2016-02-19 03:30:00
3440,Desinventar,ESMERALDAS,EC08,QUININDE,EC0804,CUBE,EC080451,KM 57 VIA QUININDE- ESMERALDAS,-79.644313,0.581583,La Costa,2/12/16,5:00:00 PM,2,12,2016,Landslide/ Rain,Heavy precipitation,1,0,0,0,0,0,0,0,0,0,,,,,,,,,,,,,2,6,6,,,,2016-02-12 22:00:00
2785,Desinventar,LOJA,EC11,CHAGUARPAMBA,EC1105,CHAGUARPAMBA,EC110550,"Barrio ""10 de Agosto"" y Barrio ""La Union""",-79.646458,-3.876452,La Sierra,5/7/14,4:00:00 AM,5,7,2014,Rain ,Heavy precipitation/ Urban,1,0,0,0,0,1,0,0,0,0,,,,,4.0,,20.0,20.0,,,,,3,6,6,20.0,4.0,3.0,2014-05-07 09:00:00
5129,SNGRE_2021,ESMERALDAS,EC08,ESMERALDAS,EC0801,LUIS TELLO (LAS PALMAS),EC080150,Las Palmas - calle Barbisotti,-79.65471,0.988976,La Costa,2/22/20,10:09:00 PM,2,22,2020,Rain,Heavy precipitation,1,0,0,0,0,0,0,0,0,0,,,,,,,,,,,,,2,6,6,,,,2020-02-23 03:09:00
5112,SNGRE_2021,ESMERALDAS,EC08,ESMERALDAS,EC0801,LUIS TELLO (LAS PALMAS),EC080150,Tercer Piso,-79.660073,0.985674,La Costa,2/15/20,7:16:00 AM,2,15,2020,Rain,Urban,0,0,0,0,0,1,0,0,0,0,,,,,2.0,2.0,10.0,,,,,,1,6,6,10.0,2.0,2.0,2020-02-15 12:16:00
3033,Desinventar,ESMERALDAS,EC08,ESMERALDAS,EC0801,ESMERALDAS,EC080150,Isla Luis Vargas Torres,-79.672741,0.965791,La Costa,3/20/15,6:30:00 PM,3,20,2015,Rain ,Heavy precipitation,1,0,0,0,0,0,0,0,0,0,,,,,50.0,,,,,,,,2,6,6,,50.0,,2015-03-20 23:30:00
2927,Desinventar,AZUAY,EC01,CAMILO PONCE ENRIQUEZ,EC0115,CAMILO PONCE ENRIQUEZ,EC011550,Varios Sectores,-79.729624,-3.073527,La Sierra,1/17/15,9:30:00 PM,1,17,2015,Rain ,Heavy precipitation/ Short duration rain,1,1,0,0,0,0,0,0,0,0,,,,,15.0,,,,,,,,5,6,6,,15.0,,2015-01-18 02:30:00
3519,Desinventar,AZUAY,EC01,CAMILO PONCE ENRIQUEZ,EC0115,CAMILO PONCE ENRIQUEZ,EC011550,Barrio La Florida,-79.74379,-3.051598,La Sierra,3/8/16,9:40:00 PM,3,8,2016,Rain ,Short duration rain,0,1,0,0,0,0,0,0,0,0,,,,,4.0,,28.0,28.0,,,,,3,6,6,28.0,4.0,3.0,2016-03-09 02:40:00
2590,Desinventar,ESMERALDAS,EC08,ATACAMES,EC0806,TONSUPA,EC080654,"Club del Pacifico, por la parada de buses Inter playas",-79.763395,0.928859,La Costa,1/29/14,6:30:00 AM,1,29,2014,Rain,Heavy precipitation/ Urban ,1,0,0,0,0,1,0,0,0,0,,,,,,,,,,,,,3,6,6,,,,2014-01-29 11:30:00
1819,Desinventar/SNGRE_2021,EL ORO,EC07,EL GUABO,EC0706,RIO BONITO,EC070654,Sitios San Jacinto de Chimborazo y Pagua,-79.768,-3.0819,La Sierra,1/23/13,11:50:00 PM,1,23,2013,Rain / Overflow,Short duration rain,0,1,0,0,0,0,0,0,0,0,,,,,7.0,,73.0,76.0,,,,,3,6,6,76.0,7.0,4.0,2013-01-24 04:50:00
2592,Desinventar/SNGRE_2021,EL ORO,EC07,PASAJE,EC0709,PROGRESO,EC070954,Sitio Rosa de Oro,-79.784305,-3.275346,La Sierra,2/2/14,2:30:00 AM,2,2,2014,,Artificial waterway overflow,0,0,1,0,0,0,0,0,0,0,,,,,3.0,,6.0,6.0,,,,,1,6,6,6.0,3.0,2.0,2014-02-02 07:30:00
3403,Desinventar,ESMERALDAS,EC08,ATACAMES,EC0806,TONSUPA,EC080654,SaLIMA,-79.784731,0.889013,La Costa,1/25/16,6:00:00 AM,1,25,2016,Rain,Heavy precipitation,1,0,0,0,0,0,0,0,0,0,,,,,,,,,,,80.0,20.0,2,6,6,,,,2016-01-25 11:00:00
2744,Desinventar,ESMERALDAS,EC08,ATACAMES,EC0806,TONSUPA,EC080654,Barrio Valverde,-79.807251,0.885837,La Costa,4/8/14,9:00:00 AM,4,8,2014,Rain ,Heavy precipitation/ surface overflow,1,0,0,0,0,0,0,0,0,0,,,,,15.0,,40.0,40.0,,,,,2,6,6,40.0,15.0,3.0,2014-04-08 14:00:00
5123,SNGRE_2021,ESMERALDAS,EC08,ATACAMES,EC0806,TONSUPA,EC080654,Varios Sectores,-79.812135,0.888703,La Costa,2/20/20,8:30:00 AM,2,20,2020,Rain,Heavy precipitation,1,0,0,0,0,0,0,0,0,0,,,,,35.0,35.0,140.0,,,,,,2,6,6,140.0,35.0,5.0,2020-02-20 13:30:00
1792,Desinventar/SNGRE_2021,ESMERALDAS,EC08,ATACAMES,EC0806,ATACAMES,EC080650,Barrios asentados en zonas bajas,-79.8179,0.812,La Costa,1/7/13,5:00:00 AM,1,7,2013,Rain,Short duration rain,0,1,0,0,0,0,0,0,0,0,,,,,75.0,,375.0,375.0,,,,,3,6,6,375.0,75.0,5.0,2013-01-07 10:00:00
3704,Desinventar,ESMERALDAS,EC08,ATACAMES,EC0806,TONSUPA,EC080654,ALBERGUE DE TONSUPA,-79.818863,0.8777,La Costa,1/8/17,2:30:00 AM,1,8,2017,Rain ,Urban,0,0,0,0,0,1,0,0,0,0,,,,,,,318.0,318.0,,,,,1,6,6,318.0,,5.0,2017-01-08 07:30:00
5117,SNGRE_2021,ESMERALDAS,EC08,ATACAMES,EC0806,ATACAMES,EC080650,Varios Sectores,-79.841836,0.871094,La Costa,2/20/20,8:30:00 AM,2,20,2020,Rain,Heavy precipitation,1,0,0,0,0,0,0,0,0,0,,,,,170.0,170.0,680.0,,,,,,2,6,6,680.0,170.0,6.0,2020-02-20 13:30:00
3348,Desinventar,ESMERALDAS,EC08,ATACAMES,EC0806,LA UNION,EC080651,VARIOS SECTORES (LA UNIoN DE ATACAMES LA LUCHA LAS VEGAS RIV,-79.842673,0.731913,La Costa,1/25/16,6:00:00 AM,1,25,2016,Rain,Heavy precipitation,1,0,0,0,0,0,0,0,0,0,,,,,,,,,,,50.0,,2,6,6,,,,2016-01-25 11:00:00
2004,Desinventar/SNGRE_2021,GUAYAS,EC09,PALESTINA,EC0913,PALESTINA,EC091350,Recinto Las Canas referencia a 13 km de Macul via Fluvial,-79.8558,-1.5784,La Costa,3/4/13,6:00:00 PM,3,4,2013,Rain,Heavy precipitation,1,0,0,0,0,0,0,0,0,0,,,,,8.0,,,171.0,,,,,2,6,6,171.0,8.0,5.0,2013-03-04 23:00:00
3953,Desinventar,EL ORO,EC07,SANTA ROSA,EC0712,TORATA,EC071255,Varios Sectores (El Guayabo y Playon),-79.861106,-3.587623,La Costa,3/17/17,12:00:00 PM,3,17,2017,Rain ,Urban,0,0,0,0,0,1,0,0,0,0,,,,,3.0,,,13.0,,,,,1,6,6,13.0,3.0,3.0,2017-03-17 17:00:00
2343,Desinventar/SNGRE_2021,ESMERALDAS,EC08,ATACAMES,EC0806,LA UNION,EC080651,zonas bajas cercanas a las riberas del rio Union,-79.8625,0.7875,La Costa,4/22/13,6:00:00 AM,4,22,2013,Rain / Overflow,Heavy precipitation,1,0,0,0,0,0,0,0,0,0,,,,,18.0,,90.0,90.0,,,70.0,,2,6,6,90.0,18.0,4.0,2013-04-22 11:00:00
2021,Desinventar/SNGRE_2021,GUAYAS,EC09,PALESTINA,EC0913,PALESTINA,EC091350,Recinto Pijigual,-79.8739,-1.5486,La Costa,3/5/13,4:30:00 PM,3,5,2013,Rain,Heavy precipitation/ Short duration rain,1,1,0,0,0,0,0,0,0,0,,,,,,,83.0,83.0,,,,,5,6,6,83.0,,4.0,2013-03-05 21:30:00
3567,Desinventar,MANABI,EC13,PEDERNALES,EC1317,PEDERNALES,EC131750,Beche,-79.917548,0.018553,La Costa,4/2/16,6:00:00 AM,4,2,2016,Rain / Overflow,Short duration rain,0,1,0,0,0,0,0,0,0,0,,,,,10.0,,40.0,40.0,,,,,3,6,6,40.0,10.0,3.0,2016-04-02 11:00:00
4002,Desinventar,EL ORO,EC07,SANTA ROSA,EC0712,LA AVANZADA,EC071253,Lotizacion Sol De Oriente,-79.954774,-3.543829,La Costa,3/24/17,12:30:00 AM,3,24,2017,Rain / Overflow,Small stream overflow,0,0,0,1,0,0,0,0,0,0,,,,,7.0,,25.0,25.0,,,,,4,6,6,25.0,7.0,3.0,2017-03-24 05:30:00
4924,SNGRE_2021,LOJA,EC11,CELICA,EC1104,CELICA,EC110450,"Los Pinos, Centro - Varios Sectores",-79.955929,-4.1030932,La Sierra,4/22/19,9:10:00 PM,4,22,2019,Rain,Surface runoff,0,0,0,0,1,0,0,0,0,0,,,,,12.0,12.0,27.0,,,,,,6,6,6,27.0,12.0,3.0,2019-04-23 02:10:00
5126,SNGRE_2021,EL ORO,EC07,MACHALA,EC0701,NUEVE DE MAYO,EC070150,"Varios Sectores (Brisas del Puerto, Mi Lindo Ecuador, Nueva Esperanza, Laguna de Oro)",-79.961584,-3.280476,La Costa,2/21/20,1:57:00 AM,2,21,2020,Rain/Overflow,Artificial waterway overflow,0,0,1,0,0,0,0,0,0,0,,,,,17.0,17.0,68.0,,,,,,1,6,6,68.0,17.0,4.0,2020-02-21 06:57:00
3750,Desinventar,EL ORO,EC07,SANTA ROSA,EC0712,SANTA ROSA,EC071250,Cdla. 10 de agosto,-79.96168,-3.45302,La Costa,1/31/17,6:19:00 AM,1,31,2017,Rain ,Short duration rain,0,1,0,0,0,0,0,0,0,0,,,,,5.0,,25.0,25.0,,25.0,,,3,6,6,25.0,5.0,3.0,2017-01-31 11:19:00
5179,SNGRE_2021,LOJA,EC11,CELICA,EC1104,CELICA,EC110450,"Celica, via Celica-El Empalme [E68]",-79.965281,-4.0987508,La Sierra,2/28/20,4:38:00 AM,2,28,2020,Rain,Surface runoff,0,0,0,0,1,0,0,0,0,0,,,,,,,,,,,,,6,6,6,,,,2020-02-28 09:38:00
3124,Desinventar,EL ORO,EC07,MACHALA,EC0701,NUEVE DE MAYO,EC070150,Cdla. Machalilla,-79.967721,-3.309401,La Costa,4/13/15,3:59:00 AM,4,13,2015,Rain,Short duration rain,0,1,0,0,0,0,0,0,0,0,,,,,1.0,,3.0,3.0,3.0,,,,3,6,6,3.0,1.0,1.0,2015-04-13 08:59:00
4850,Desinventar,LOJA,EC11,PUYANGO,EC1110,MERCADILLO,EC111054,Cuyura,-79.978155,-4.021216,La Sierra,3/21/19,4:00:00 PM,3,21,2019,Rain,Surface runoff,0,0,0,0,1,0,0,0,0,0,,,,,,,,1112.0,,,,,6,6,6,1112.0,,6.0,2019-03-21 21:00:00
372,SNGRE_2021,MANABI,EC13,FLAVIO ALFARO,EC1305,ZAPALLO,EC130552,"Zapallo, La ""T"" y Zapallo",-80.0,-0.44,La Costa,5/6/10,8:30:00 AM,5,6,2010,Rain,Urban,0,0,0,0,0,1,0,0,0,0,,,,,,,,,,,,,1,6,6,,,,2010-05-06 13:30:00
3434,SNGRE_2021,LOJA,EC11,CELICA,EC1104,CRUZPAMBA (CAB. EN CARLOS BUSTAMANTE),EC110451,Via Cruzpamba - Algarrobillo,-80.0159,-4.1661044,La Sierra,2/6/16,2:30:00 PM,2,6,2016,Rain,Urban,0,0,0,0,0,1,0,0,0,0,,,,,,,,,,,,,1,6,6,,,,2016-02-06 19:30:00
5205,SNGRE_2021,MANABI,EC13,CHONE,EC1303,CONVENTO,EC130353,17 de Abril,-80.034985,-0.278446,La Costa,3/9/20,7:00:00 AM,3,9,2020,Rain,Heavy precipitation,1,0,0,0,0,0,0,0,0,0,,,,,11.0,11.0,39.0,,,,,,2,6,6,39.0,11.0,3.0,2020-03-09 12:00:00
3555,Desinventar,MANABI,EC13,CHONE,EC1303,ELOY ALFARO,EC130355,El Colorado Balzar,-80.081822,-0.406548,La Costa,3/30/16,8:15:00 AM,3,30,2016,Rain / Overflow,Short duration rain,0,1,0,0,0,0,0,0,0,0,,,,,27.0,,2.0,2.0,,,,,3,6,6,2.0,27.0,1.0,2016-03-30 13:15:00
1998,Desinventar/SNGRE_2021,MANABI,EC13,CHONE,EC1303,CHONE,EC130350,San Pablo,-80.0977,-0.6782,La Costa,3/4/13,12:00:00 PM,3,4,2013,Rain / Overflow,Heavy precipitation/ Short duration rain,1,1,0,0,0,0,0,0,0,0,,,,,3.0,,,,,,,,5,6,6,,3.0,,2013-03-04 17:00:00
2598,Desinventar,MANABI,EC13,CHONE,EC1303,CHONE,EC130350,Barrio Las Marias,-80.097704,-0.67822,La Costa,2/3/14,10:30:00 PM,2,3,2014,Rain ,Heavy precipitation/ Short duration rain,1,1,0,0,0,0,0,0,0,0,,,,,1.0,,6.0,6.0,,,,,5,6,6,6.0,1.0,2.0,2014-02-04 03:30:00
2992,Desinventar,MANABI,EC13,CHONE,EC1303,CHONE,EC130350,La Fortuna - Rio Garrapata.,-80.102119,-0.681373,La Costa,3/1/15,9:50:00 AM,3,1,2015,Rain / Overflow,Heavy precipitation,1,0,0,0,0,0,0,0,0,0,,,,,200.0,,1000.0,1000.0,,,,,2,6,6,1000.0,200.0,6.0,2015-03-01 14:50:00
4125,SNGRE,GUAYAS,EC09,PEDRO CARBO,EC0914,VALLE DE LA VIRGEN,EC091451,Miraflores,-80.191057,-1.726464,La Costa,4/3/17,6:30:00 PM,4,3,2017,Rain / Overflow,Heavy precipitation/ Short duration rain,1,1,0,0,0,0,0,0,0,0,,,,,,,20.0,,,,,,5,6,6,20.0,,3.0,2017-04-03 23:30:00
3592,Desinventar,MANABI,EC13,PORTOVIEJO,EC1301,ALHAJUELA (BAJO GRANDE),EC130152,Varios Sectores,-80.276429,-1.05572,La Costa,4/11/16,6:38:00 AM,4,11,2016,Rain ,Heavy precipitation/ Short duration rain,1,1,0,0,0,0,0,0,0,0,,,,,44.0,,4.0,4.0,4.0,,,,5,6,6,4.0,44.0,1.0,2016-04-11 11:38:00
4385,Desinventar,MANABI,EC13,PORTOVIEJO,EC1301,ALHAJUELA (BAJO GRANDE),EC130152,Varios sectores,-80.280923,-1.051566,La Costa,2/23/18,3:36:00 PM,2,23,2018,Rain / Overflow,Surface runoff,0,0,0,0,1,0,0,0,0,0,,,,,8.0,,24.0,24.0,,,,,6,6,6,24.0,8.0,3.0,2018-02-23 20:36:00
3962,Desinventar,MANABI,EC13,PORTOVIEJO,EC1301,ALHAJUELA (BAJO GRANDE),EC130152,Varios Sectores,-80.288456,-1.043164,La Costa,3/19/17,3:15:00 PM,3,19,2017,Rain ,small stream overflow,0,0,0,1,0,0,0,0,0,0,,,,,22.0,,88.0,88.0,,,,,4,6,6,88.0,22.0,4.0,2017-03-19 20:15:00
1866,SNGRE_2021,MANABI,EC13,PORTOVIEJO,EC1301,ABDON CALDERON (SAN FRANCISCO),EC130151,Juan Damas,-80.3242,-1.0472,La Costa,2/3/13,7:30:00 AM,2,3,2013,,Artificial waterway overflow,0,0,1,0,0,0,0,0,0,0,,,,,,,,,,,,,1,6,6,,,,2013-02-03 12:30:00
4720,SNGRE,MANABI,EC13,PORTOVIEJO,EC1301,ABDON CALDERON (SAN FRANCISCO),EC130151,"Varios Sectores (Santa Rita, La Cienega, Naranjal y La Encantada)",-80.345354,-1.027528,La Costa,3/7/19,4:48:00 PM,3,7,2019,Rain,Surface runoff,0,0,0,0,1,0,0,0,0,0,,,,,,9.0,36.0,,,4.0,9.5,,6,6,6,36.0,9.0,3.0,2019-03-07 21:48:00
3591,Desinventar,MANABI,EC13,PORTOVIEJO,EC1301,ABDON CALDERON (SAN FRANCISCO),EC130151,Centro de Calderon ,-80.347598,-1.027155,La Costa,4/11/16,5:59:00 AM,4,11,2016,Rain / Overflow,Heavy precipitation/ Short duration rain,1,1,0,0,0,0,0,0,0,0,,,,,,,,,,,,,5,6,6,,,,2016-04-11 10:59:00
3923,Desinventar,MANABI,EC13,ROCAFUERTE,EC1312,ROCAFUERTE,EC131250,El Guarango,-80.396506,-0.891381,La Costa,3/10/17,7:30:00 PM,3,10,2017,Rain ,Heavy precipitation/ Small stream overflow,1,0,0,1,0,0,0,0,0,0,,,,,84.0,,336.0,336.0,,,,,6,6,6,336.0,84.0,5.0,2017-03-11 00:30:00
1820,SNGRE_2021,MANABI,EC13,ROCAFUERTE,EC1312,ROCAFUERTE,EC131250,Higueron de Rocafuerte,-80.4058,-0.9057,La Costa,1/23/13,5:00:00 AM,1,23,2013,Rain,Artificial waterway overflow,0,0,1,0,0,0,0,0,0,0,,,,,1.0,,5.0,,,,,,1,6,6,5.0,1.0,1.0,2013-01-23 10:00:00
1989,Desinventar/SNGRE_2021,MANABI,EC13,ROCAFUERTE,EC1312,ROCAFUERTE,EC131250,El Pueblito,-80.4058,-0.9057,La Costa,3/3/13,9:30:00 AM,3,3,2013,Rain / Overflow,Heavy precipitation/ Short duration rain,1,1,0,0,0,0,0,0,0,0,,,,,2.0,,9.0,9.0,,,,,5,6,6,9.0,2.0,2.0,2013-03-03 14:30:00
3374,Desinventar,MANABI,EC13,ROCAFUERTE,EC1312,ROCAFUERTE,EC131250,Los Rios El Guabal La Morlaca,-80.405822,-0.905705,La Costa,1/25/16,3:00:00 AM,1,25,2016,Rain ,Heavy precipitation,1,0,0,0,0,0,0,0,0,0,,,,,,,,,,,6.0,0.5,2,6,6,,,,2016-01-25 08:00:00
3310,Desinventar,MANABI,EC13,SUCRE,EC1314,LEONIDAS PLAZA GUTIERREZ,EC131450,Zona Urbana,-80.427395,-0.618669,La Costa,1/20/16,11:00:00 AM,1,20,2016,Rain ,Short duration rain,0,1,0,0,0,0,0,0,0,0,,,,,,,,,,,,,3,6,6,,,,2016-01-20 16:00:00
3806,Desinventar,MANABI,EC13,ROCAFUERTE,EC1312,ROCAFUERTE,EC131250,Varios Sectores,-80.450839,-0.91996,La Costa,2/8/17,5:29:00 AM,2,8,2017,Rain ,Heavy precipitation/ Urban ,1,0,0,0,0,1,0,0,0,0,,,,,500.0,,2000.0,2000.0,,,,,3,6,6,2000.0,500.0,6.0,2017-02-08 10:29:00
4158,Desinventar,MANABI,EC13,ROCAFUERTE,EC1312,ROCAFUERTE,EC131250,Varios Sectores,-80.453544,-0.923769,La Costa,4/8/17,4:00:00 AM,4,8,2017,Rain / Overflow,Heavy precipitation/Urban,1,0,0,0,0,1,0,0,0,0,,,,,90.0,,360.0,360.0,,,,,3,6,6,360.0,90.0,5.0,2017-04-08 09:00:00
3397,Desinventar,MANABI,EC13,24 DE MAYO,EC1316,SUCRE,EC131650,Los Algodones El Carmen 2 ,-80.478459,-1.230011,La Costa,1/25/16,3:00:00 AM,1,25,2016,Rain ,Heavy precipitation,1,0,0,0,0,0,0,0,0,0,,,,,,,,,,,3.0,,2,6,6,,,,2016-01-25 08:00:00
4163,Desinventar,MANABI,EC13,JIPIJAPA,EC1306,EL ANEGADO (CAB EN ELOY ALFARO,EC130652,Las Mercedes,-80.531057,-1.474813,La Costa,4/9/17,4:00:00 PM,4,9,2017,,Small stream overflow,0,0,0,1,0,0,0,0,0,0,,,,2.0,,,10.0,,,10.0,,,4,6,6,10.0,,2.0,2017-04-09 21:00:00
3428,Desinventar,MANABI,EC13,JIPIJAPA,EC1306,EL ANEGADO (CAB EN ELOY ALFARO,EC130652,Quinta Union,-80.533142,-1.50067,La Costa,2/5/16,10:00:00 PM,2,5,2016,Rain ,Heavy precipitation/ Short duration rain,1,1,0,0,0,0,0,0,0,0,,,,,,,,,,,2.0,,5,6,6,,,,2016-02-06 03:00:00
4593,SNGRE,NAPO,EC15,TENA,EC1501,TENA,EC150150,San Pedro de Uglo,-77.825325,-0.955747,La Sierra,1/11/19,10:00:00 AM,1,11,2019,Rain / Overflow,Small stream overflow,0,0,0,1,0,0,0,0,0,0,,,,,,1.0,11.0,,,,,,4,7,6,11.0,1.0,3.0,2019-01-11 15:00:00
2889,Desinventar,NAPO,EC15,QUIJOS,EC1507,BAEZA,EC150750,Logma Pamba entre Baeza -Cuyuja,-77.964857,-0.490395,La Sierra,10/22/14,10:00:00 AM,10,22,2014,Rain / Overflow,Small stream overflow,0,0,0,1,0,0,0,0,0,0,,,,,1.0,,10.0,10.0,,,,,4,7,6,10.0,1.0,2.0,2014-10-22 15:00:00
5355,SNGRE_2021,PASTAZA,EC16,PASTAZA,EC1601,PUYO,EC160150,"Sector Urbanizacion Bonanza, Barrio Juan Montalvo",-77.999803,-1.4928811,La Sierra,11/2/20,11:00:00 PM,11,2,2020,Rain/Overflow,Small stream overflow,0,0,0,1,0,0,0,0,0,0,,,,,2.0,2.0,6.0,,,,,,4,7,6,6.0,2.0,2.0,2020-11-03 04:00:00
4434,Desinventar,PASTAZA,EC16,PASTAZA,EC1601,PUYO,EC160150,Barrio el Dorado,-78.01559,-1.493964,La Sierra,4/7/18,4:45:00 PM,4,7,2018,Rain / Overflow,Small stream overflow,0,0,0,1,0,0,0,0,0,0,,,,,1.0,,8.0,8.0,,,,,4,7,6,8.0,1.0,2.0,2018-04-07 21:45:00
3683,Desinventar,NAPO,EC15,QUIJOS,EC1507,CUYUJA,EC150752,Cuyuja (Proyecto Hidroelectrico Victoria),-78.022682,-0.403847,La Sierra,1/2/17,2:00:00 PM,1,2,2017,Rain / Overflow,Small stream overflow,0,0,0,1,0,0,0,0,0,0,,,,,,,,,,,,,4,7,6,,,,2017-01-02 19:00:00
3662,Desinventar,CARCHI,EC04,MIRA,EC0404,MIRA (CHONTAHUASI),EC040450,Varios sectores ,-78.039772,0.545209,La Sierra,10/11/16,2:42:00 PM,10,11,2016,Rain / Overflow,Heavy precipitation/ Artificial waterway overflow/ Urban ,1,0,1,0,0,1,0,0,0,0,,,,,,,,,,,,,4,7,6,,,,2016-10-11 19:42:00
3829,Desinventar,IMBABURA,EC10,IBARRA,EC1001,CAROLINA,EC100153,Imbiola,-78.195907,0.613346,La Sierra,2/13/17,6:55:00 AM,2,13,2017,Rain / Overflow,Heavy precipitation/Urban/Artificial waterway overflow,1,0,1,0,0,1,0,0,0,0,,,,,2.0,,,,,,2.25,,4,7,6,,2.0,,2017-02-13 11:55:00
5005,SNGRE_2021,CHIMBORAZO,EC06,GUANO,EC0607,LA MATRIZ,EC060750,Por la entrada a la Unidad Educativa El Despertar.,-78.645274,-1.642898,La Sierra,9/9/19,4:00:00 PM,9,9,2019,Rain,Small stream overflow,0,0,0,1,0,0,0,0,0,0,,,,,1.0,1.0,4.0,,,,,,4,7,6,4.0,1.0,1.0,2019-09-09 21:00:00
3951,Desinventar,COTOPAXI,EC05,PANGUA,EC0503,MORASPUNGO,EC050351,Nueva Santa Rosa,-79.224497,-1.086403,La Costa,3/17/17,10:38:00 PM,3,17,2017,Rain / Overflow,small stream overflow,0,0,0,1,0,0,0,0,0,0,,,,,,,,,,,,,4,7,6,,,,2017-03-18 03:38:00
4691,Desinventar,LOS RIOS,EC12,QUEVEDO,EC1205,VENUS DEL RÍO QUEVEDO,EC120550,Nuevo Amanecer,-79.473909,-0.994299,La Costa,2/26/19,12:00:00 PM,2,26,2019,Rain / Overflow,Small stream overflow,0,0,0,1,0,0,0,0,0,0,,,,,1.0,,4.0,,,,,,4,7,6,4.0,1.0,1.0,2019-02-26 17:00:00
4785,Desinventar,GUAYAS,EC09,SAMBORONDON,EC0916,TARIFA,EC091651,Recinto Quevedo,-79.834004,-1.996038,La Costa,3/16/19,6:00:00 PM,3,16,2019,Rain / Overflow,Small stream overflow,0,0,0,1,0,0,0,0,0,0,,,,,1.0,1.0,5.0,5.0,,,,,4,7,6,5.0,1.0,1.0,2019-03-16 23:00:00
4189,Desinventar,MORONA SANTIAGO,EC14,TAISHA,EC1409,TUUTINENTZA,EC140953,"Yaas Nunka, Rio Macuma",-77.511945,-2.693579,La Sierra,4/14/17,1:00:00 AM,4,14,2017,Rain ,Heavy precipitation/ Surface runoff,1,0,0,0,1,0,0,0,0,0,,,,24.0,27.0,,111.0,1062.0,,,13.0,79.0,8,1,7,1062.0,27.0,6.0,2017-04-14 06:00:00
4933,SNGRE_2021,ESMERALDAS,EC08,RIOVERDE,EC0807,RIOVERDE,EC080750,Rioverde,-79.406348,1.065341,La Costa,5/5/19,8:42:00 AM,5,5,2019,Rain,Heavy precipitation/ Surface runoff,1,0,0,0,1,0,0,0,0,0,,,,,,,,,,,,,8,1,7,,,,2019-05-05 13:42:00
4113,Desinventar,NAPO,EC15,TENA,EC1501,PUERTO MISAHUALLI,EC150155,Comunidad Pucachipta. Via Pucachipta-Puyano,-77.641543,-1.052035,La Sierra,4/1/17,4:00:00 AM,4,1,2017,Rain / Overflow,Urban/ Strong current,0,0,0,0,0,1,0,0,1,0,,,,,,,,,,,,,8,2,7,,,,2017-04-01 09:00:00
4906,Desinventar,IMBABURA,EC10,COTACACHI,EC1003,GARCIA MORENO (LLURIMAGUA),EC100352,"Magdalena Bajo, Escuela General Basica Santa Isabel",-78.7827,0.2415,La Sierra,4/4/19,2:00:00 AM,4,4,2019,Rain / Overflow,Heavy precipitation/ Surface runoff,1,0,0,0,1,0,0,0,0,0,,,,,,,,,,,,,8,2,7,,,,2019-04-04 07:00:00
4190,Desinventar,LOS RIOS,EC12,BABA,EC1202,BABA,EC120250,Higuerillas,-79.681162,-1.783956,La Costa,4/17/17,8:00:00 PM,4,17,2017,Rain / Overflow,Urban/Short duration flood,0,0,0,0,0,1,0,0,0,1,,,,,74.0,,658.0,251.0,,,,,8,2,7,658.0,74.0,6.0,2017-04-18 01:00:00
1800,Desinventar/SNGRE_2021,GUAYAS,EC09,GUAYAQUIL,EC0901,TARQUI,EC090150,Flor de Bastion bloque 2 mz 1729 sl31; ingresando por la Bra,-80.0453,-2.3506,La Costa,1/12/13,4:50:00 PM,1,12,2013,Rain,Slope/ Short duration rain,0,1,0,0,0,0,1,0,0,0,,,,,2.0,,4.0,4.0,,,,,8,2,7,4.0,2.0,1.0,2013-01-12 21:50:00
4307,Desinventar,PASTAZA,EC16,PASTAZA,EC1601,SARAYACU,EC160161,Comunidad Raya yacu,-77.433589,-1.802077,La Sierra,10/21/17,8:30:00 AM,10,21,2017,Rain / Overflow,Heavy precipitation/ Surface runoff,1,0,0,0,1,0,0,0,0,0,,,,,6.0,,50.0,50.0,,,,8.0,8,3,7,50.0,6.0,3.0,2017-10-21 13:30:00
4180,Desinventar,MORONA SANTIAGO,EC14,MORONA,EC1401,RIO BLANCO,EC140164,Playas de Arapicos,-78.181469,-2.389132,La Sierra,4/13/17,3:38:00 PM,4,13,2017,Rain ,Heavy precipitationv/ Surface runoff,1,0,0,0,1,0,0,0,0,0,,,,,1.0,,6.0,6.0,,,,,8,3,7,6.0,1.0,2.0,2017-04-13 20:38:00
3005,Desinventar,GUAYAS,EC09,EL TRIUNFO,EC0909,EL TRIUNFO,EC090950,Cdla. San Pedro 1,-79.405569,-2.325824,La Costa,3/17/15,3:00:00 AM,3,17,2015,Rain / Overflow,Urban/ Small stream overflow / Short duration rain,0,1,0,1,0,1,0,0,0,0,,,,,3.0,,23.0,23.0,23.0,,,,8,3,7,23.0,3.0,3.0,2015-03-17 08:00:00
3622,Desinventar,MANABI,EC13,EL CARMEN,EC1304,EL CARMEN,EC130450,Varios Sectores,-79.595138,-0.440702,La Costa,5/5/16,4:30:00 PM,5,5,2016,Rain ,Urban/ Strong current,0,0,0,0,0,1,0,0,1,0,,,,,15.0,,,,,,,,8,3,7,,15.0,,2016-05-05 21:30:00
2981,Desinventar/SNGRE_2021,EL ORO,EC07,MACHALA,EC0701,EL RETIRO,EC070152,Buena Esperanza,-79.930141,-3.3525984,La Costa,2/19/15,3:00:00 AM,2,19,2015,Rain,Urban/ Strong current,0,0,0,0,0,1,0,0,1,0,,,,,,,,,,,,,8,3,7,,,,2015-02-19 08:00:00
3927,Desinventar,LOJA,EC11,ZAPOTILLO,EC1113,PALETILLAS,EC111354,Ceiba Grande,-80.253321,-4.143692,La Sierra,3/11/17,8:00:00 PM,3,11,2017,Rain / Overflow,Artificial waterway overflow/ Strong current,0,0,1,0,0,0,0,0,1,0,,,,,,,,,,,,,8,3,7,,,,2017-03-12 01:00:00
4740,SNGRE,MANABI,EC13,PORTOVIEJO,EC1301,PORTOVIEJO,EC130150,Varios Sectores,-80.45523,-1.056125,La Costa,3/7/19,7:00:00 AM,3,7,2019,Rain / Overflow,Heavy precipitationv/ Surface runoff,1,0,0,0,1,0,0,0,0,0,,,,,,,,,,,,,8,3,7,,,,2019-03-07 12:00:00
3326,Desinventar,MANABI,EC13,SUCRE,EC1314,CHARAPOTO,EC131453,Canitas- via a san Jacinto ,-80.47311,-0.854228,La Costa,1/25/16,8:12:00 AM,1,25,2016,Rain ,Heavy precipitation/ Surface runoff,1,0,0,0,1,0,0,0,0,0,,,,,,,,,,,,,8,3,7,,,,2016-01-25 13:12:00
3757,Desinventar,MANABI,EC13,SUCRE,EC1314,CHARAPOTO,EC131453,Santa Teresa,-80.503243,-0.799363,La Costa,2/2/17,11:50:00 PM,2,2,2017,Rain ,Heavy precipitation/ Surface runoff,1,0,0,0,1,0,0,0,0,0,,,,,5.0,,20.0,20.0,,,,,8,3,7,20.0,5.0,3.0,2017-02-03 04:50:00
4590,SNGRE,PASTAZA,EC16,SANTA CLARA,EC1603,SANTA CLARA,EC160350,Recinto San Vicente,-77.88316,-1.245121,La Sierra,1/11/19,2:00:00 AM,1,11,2019,Rain,Strong current,0,0,0,0,0,0,0,0,1,0,,,,,,,,,,,,,7,5,7,,,,2019-01-11 07:00:00
2925,Desinventar,MORONA SANTIAGO,EC14,HUAMBOYA,EC1407,HUAMBOYA,EC140750,A 2 km de la cabecera cantonal,-78.000261,-1.960183,La Sierra,1/16/15,6:30:00 PM,1,16,2015,,Short duration flood,0,0,0,0,0,0,0,0,0,1,,,,,1.0,,2.0,2.0,,,,,7,5,7,2.0,1.0,1.0,2015-01-16 23:30:00
4967,SNGRE_2021,TUNGURAHUA,EC18,BAÑOS DE AGUA SANTA,EC1802,ULBA,EC180254,"Rio Blanco, Reasentamiento Juive Grande, Vizcaya, via Rio Blanco - El Palacio.",-78.349242,-1.389931,La Sierra,6/20/19,9:43:00 AM,6,20,2019,Rain,Urban/Surface runoff,0,0,0,0,1,1,0,0,0,0,1.0,7.0,1.0,7.0,33.0,98.0,291.0,,,145.0,50.0,19.75,7,5,7,291.0,98.0,5.0,2019-06-20 14:43:00
3221,Desinventar,ESMERALDAS,EC08,SAN LORENZO,EC0805,CARONDELET,EC080554,Varios Sectores,-78.761788,1.124756,La Costa,7/19/15,3:00:00 PM,7,19,2015,Rain / Overflow,Strong current,0,0,0,0,0,0,0,0,1,0,,,,,5.0,,18.0,18.0,,,,,7,5,7,18.0,5.0,3.0,2015-07-19 20:00:00
4994,SNGRE,ZAMORA CHINCHIPE,EC19,ZAMORA,EC1901,CUMBARATZA,EC190151,El Chamico,-78.8419,-3.944145,La Sierra,7/14/19,4:25:00 PM,7,14,2019,Rain,Short duration flood,0,0,0,0,0,0,0,0,0,1,,,,,,1.0,3.0,,,,,,7,5,7,3.0,1.0,1.0,2019-07-14 21:25:00
5250,SNGRE_2021,ZAMORA CHINCHIPE,EC19,ZAMORA,EC1901,GUADALUPE,EC190152,"Guayabal, El Progreso, San Antonio, Guadalupe, Guayabal, San Sebastian, La Libertad, Piuntza, Guaguayme Bajo, Conchay, San Agustin",-78.859187,-3.9065353,La Sierra,5/1/20,4:00:00 PM,5,1,2020,Rain/Overflow,Strong current,0,0,0,0,0,0,0,0,1,0,,,,,13.0,15.0,62.0,,,,22.4,12.7,7,5,7,62.0,15.0,4.0,2020-05-01 21:00:00
3680,Desinventar,ZAMORA CHINCHIPE,EC19,ZAMORA,EC1901,TIMBARA,EC190156,Via Buena Ventura,-78.898607,-4.030784,La Sierra,12/28/16,4:00:00 AM,12,28,2016,Rain / Overflow,Strong current,0,0,0,0,0,0,0,0,1,0,,,,,,,,,,,,,7,5,7,,,,2016-12-28 09:00:00
5248,SNGRE_2021,ZAMORA CHINCHIPE,EC19,YACUAMBI,EC1904,28 DE MAYO (SAN JOSE DE YACUAM,EC190450,Curintza,-78.921437,-3.6477564,La Sierra,5/1/20,4:50:00 PM,5,1,2020,Rain/Overflow,Strong current,0,0,0,0,0,0,0,0,1,0,,,,,,12.0,36.0,,,,,28.0,7,5,7,36.0,12.0,3.0,2020-05-01 21:50:00
2198,SNGRE_2021,AZUAY,EC01,CUENCA,EC0101,CUENCA,EC010150,MACHANGARA- Ucubamba,-78.9417,-2.8641,La Sierra,3/25/13,3:10:00 PM,3,25,2013,Rain / Overflow,Heavy precipitation /Small stream overflow/ Urban,1,0,0,1,0,1,0,0,0,0,,,,,,,,,,,,,7,5,7,,,,2013-03-25 20:10:00
4893,Desinventar,LOS RIOS,EC12,QUINSALOMA,EC1213,QUINSALOMA,EC121350,Avenida Pedro Almeida y Hermano Padilla,-79.309912,-1.204501,La Costa,3/31/19,11:00:00 AM,3,31,2019,Rain,Strong current,0,0,0,0,0,0,0,0,1,0,,,,,,,,,,,,,7,5,7,,,,2019-03-31 16:00:00
3254,Desinventar,ESMERALDAS,EC08,RIOVERDE,EC0807,CHUMUNDE,EC080752,RENACER,-79.423266,0.8303,La Costa,10/29/15,7:00:00 PM,10,29,2015,Overflow,Strong current,0,0,0,0,0,0,0,0,1,0,,,,1.0,1.0,,5.0,5.0,,,,,7,5,7,5.0,1.0,1.0,2015-10-30 00:00:00
5084,SNGRE_2021,LOS RIOS,EC12,URDANETA,EC1206,RICAURTE,EC120651,via Caluma,-79.466166,-1.572694,La Costa,1/22/20,8:00:00 AM,1,22,2020,Rain,Short duration flood,0,0,0,0,0,0,0,0,0,1,,,,,,,,,,,,,7,5,7,,,,2020-01-22 13:00:00
4618,Desinventar,LOS RIOS,EC12,URDANETA,EC1206,RICAURTE,EC120651,Rcto. Roblecito,-79.469948,-1.572269,La Costa,1/30/19,9:00:00 AM,1,30,2019,Rain / Overflow/ Failure,Short duration rain/ River Bank Failure,0,1,0,0,0,0,0,1,0,0,,,,,20.0,20.0,60.0,60.0,,,,,7,5,7,60.0,20.0,4.0,2019-01-30 14:00:00
156,SNGRE_2021,MANABI,EC13,EL CARMEN,EC1304,WILFRIDO LOOR MOREIRA (MAICITO),EC130451,Parroquia Maicito,-79.58,-0.28,La Costa,2/24/10,8:00:00 PM,2,24,2010,Rain,Strong current,0,0,0,0,0,0,0,0,1,0,,,,1.0,,,,,,,,,7,5,7,,,,2010-02-25 01:00:00
4942,SNGRE,ESMERALDAS,EC08,ESMERALDAS,EC0801,SIMON PLATA TORRES,EC080150,Barrio San Jorge Alto,-79.680432,0.905147,La Costa,5/16/19,11:00:00 PM,5,16,2019,Rain,Strong current,0,0,0,0,0,0,0,0,1,0,,,,,,1.0,7.0,,,,,,7,5,7,7.0,1.0,2.0,2019-05-17 04:00:00
2082,Desinventar/SNGRE_2021,MANABI,EC13,PEDERNALES,EC1317,COJIMIES,EC131751,Chebe ; Beche y La Violeta,-79.8641,0.2242,La Costa,3/12/13,12:30:00 AM,3,12,2013,Rain / Overflow,Strong current,0,0,0,0,0,0,0,0,1,0,1.0,,,5.0,48.0,,155.0,155.0,,180.0,,,7,5,7,155.0,48.0,5.0,2013-03-12 05:30:00
4748,SNGRE,MANABI,EC13,SANTA ANA,EC1313,SANTA ANA DE VUELTA LARGA,EC131350,"Varios Sectores (Las Luchas, Santa Ana de Vuelta Larga)",-80.370241,-1.207246,La Costa,3/7/19,6:00:00 PM,3,7,2019,Rain / Overflow,Short duration flood,0,0,0,0,0,0,0,0,0,1,,,,,,200.0,800.0,,,4.0,830.24,,7,5,7,800.0,200.0,6.0,2019-03-07 23:00:00
4750,SNGRE,MANABI,EC13,MANTA,EC1308,TARQUI,EC130850,"(Barrio Jocay, Tarqui, La pradera)",-80.705395,-0.966408,La Costa,3/7/19,4:00:00 AM,3,7,2019,Rain,Strong current,0,0,0,0,0,0,0,0,1,0,,,,,,141.0,164.0,,,,,,7,5,7,164.0,141.0,5.0,2019-03-07 09:00:00
3733,Desinventar,MANABI,EC13,MANTA,EC1308,TARQUI,EC130850,Urbirios II,-80.723362,-0.978256,La Costa,1/20/17,5:35:00 PM,1,20,2017,Rain ,Strong current,0,0,0,0,0,0,0,0,1,0,,,,,1.0,,5.0,5.0,9.0,9.0,,,7,5,7,5.0,1.0,1.0,2017-01-20 22:35:00
3530,Desinventar,PICHINCHA,EC17,QUITO,EC1701,CALDERON (CARAPUNGO),EC170155,Calle PIO XII Junto a la Sede de Trans- San Juan,-78.425505,-0.063457,La Sierra,3/12/16,1:05:00 AM,3,12,2016,Rain ,Urban/ Surface runoff,0,0,0,0,1,1,0,0,0,0,,,,,,,,,,,,,7,6,7,,,,2016-03-12 06:05:00
4971,SNGRE,TUNGURAHUA,EC18,﻿SANTIAGO DE PILLARO,EC1808,﻿EMILIO MARIA TERAN (RUMIPAMBA),EC180852,"Baquerizo Moreno. Lagartococha, Crizpata, Esmeralda, Centro.",-78.50646,-1.229322,La Sierra,6/22/19,10:00:00 AM,6,22,2019,Rain,Strong current,0,0,0,0,0,0,0,0,1,0,,,,,,20.0,80.0,,,,10.0,,7,6,7,80.0,20.0,4.0,2019-06-22 15:00:00
5162,SNGRE_2021,TUNGURAHUA,EC18,AMBATO,EC1801,CUNCHIBAMBA,EC180167,"San Pablo, via Cunchipamba - Ambato",-78.585584,-1.133295,La Sierra,2/26/20,7:30:00 PM,2,26,2020,Rain/Overflow,Artificial waterway overflow/Surface runoff,0,0,1,0,1,0,0,0,0,0,,,,,7.0,12.0,48.0,,5.0,,1.5,0.67,7,6,7,48.0,12.0,3.0,2020-02-27 00:30:00
4224,Desinventar,COTOPAXI,EC05,SIGCHOS,EC0507,LAS PAMPAS,EC050753,"Las Juntas-Saguambi, via Sigchos - Las Pampas",-78.969154,-0.47116,La Sierra,4/25/17,8:30:00 AM,4,25,2017,,Strong current,0,0,0,0,0,0,0,0,1,0,,,,,7.0,,400.0,400.0,,,15.0,,7,6,7,400.0,7.0,5.0,2017-04-25 13:30:00
4525,SNGRE,ZAMORA CHINCHIPE,EC19,PALANDA,EC1908,EL PORVENIR DEL CARMEN,EC190851,Cumanda,-79.039815,-4.651522,La Sierra,10/16/18,6:00:00 PM,10,16,2018,Rain,Strong current,0,0,0,0,0,0,0,0,1,0,,,,,,,,,,11.0,,,7,6,7,,,,2018-10-16 23:00:00
4521,SNGRE,ZAMORA CHINCHIPE,EC19,PALANDA,EC1908,PALANDA,EC190850,San Vicente,-79.134705,-4.654456,La Sierra,10/8/18,6:00:00 PM,10,8,2018,Rain ,Strong current,0,0,0,0,0,0,0,0,1,0,,,,,,,,,,7.0,,,7,6,7,,,,2018-10-08 23:00:00
2532,Desinventar,SANTO DOMINGO DE LOS TSACHILAS,EC23,SANTO DOMINGO,EC2301,CHIGUILPE,EC230150,"Coop. Los Unificados, calle Bahia de Caraquez",-79.153328,-0.261864,La Costa,1/21/14,9:34:00 PM,1,21,2014,Rain,"Heavy precipitation/ Urban / Small stream overflow
Small stream overflow",1,0,0,1,0,1,0,0,0,0,,,,,1.0,,10.0,10.0,,,,,7,6,7,10.0,1.0,2.0,2014-01-22 02:34:00
2755,SNGRE,SANTO DOMINGO DE LOS TSACHILAS,EC23,SANTO DOMINGO,EC2301,RIO VERDE,EC230150,"Asentamiento Canaveral 1, calle Concepcion",-79.171686,-0.274843,La Costa,4/13/14,9:00:00 PM,4,13,2014,Rain,Strong current,0,0,0,0,0,0,0,0,1,0,,,,,,,6.0,,,,,,7,6,7,6.0,,2.0,2014-04-14 02:00:00
4064,Desinventar,GUAYAS,EC09,GNRAL. ANTONIO ELIZALDE,EC0927,GRAL. ANTONIO ELIZALDE (BUCAY),EC092750,Matilde Esther,-79.202225,-2.156294,La Costa,3/29/17,7:00:00 AM,3,29,2017,Rain / Overflow,Small stream overflow/ Short duration rain,0,1,0,1,0,0,0,0,0,0,,,,,12.0,,72.0,72.0,,,,,7,6,7,72.0,12.0,4.0,2017-03-29 12:00:00
5078,SNGRE_2021,LOS RIOS,EC12,MONTALVO,EC1203,LA ESMERALDA,EC120351,"Rctos. Los Beldacos, Las Maravillas",-79.276475,-1.702321,La Sierra,1/21/20,8:30:00 AM,1,21,2020,Rain/Overflow,Short duration rain/ River bank failure,0,1,0,0,0,0,0,1,0,0,,,,,32.0,,,92.0,,,1100.0,,7,6,7,92.0,32.0,4.0,2020-01-21 13:30:00
3970,SNGRE,LOS RIOS,EC12,BABAHOYO,EC1201,FEBRES CORDERO (LAS JUNTAS) (CAB. EN MATA DE CACAO),EC120153,Los Angeles y Islas Maria,-79.299727,-1.948879,La Costa,3/20/17,8:30:00 AM,3,20,2017,Overflow,Short duration flood,0,0,0,0,0,0,0,0,0,1,,,,,,,151.0,,,,,,7,6,7,151.0,,5.0,2017-03-20 13:30:00
5220,SNGRE_2021,MANABI,EC13,EL CARMEN,EC1304,EL CARMEN,EC130450,Barrio La Laguna,-79.456922,-0.273725,La Costa,3/15/20,8:57:00 PM,3,15,2020,Rain,Short duration flood,0,0,0,0,0,0,0,0,0,1,,,,,3.0,3.0,12.0,,,,,,7,6,7,12.0,3.0,3.0,2020-03-16 01:57:00
2515,Desinventar/SNGRE_2021,ESMERALDAS,EC08,QUININDE,EC0804,LA UNION,EC080455,Barrio Central,-79.467086,0.09631,La Costa,1/13/14,7:30:00 PM,1,13,2014,Rain,Strong current,0,0,0,0,0,0,0,0,1,0,,,,,,,,,,,,,7,6,7,,,,2014-01-14 00:30:00
4249,Desinventar,GUAYAS,EC09,MILAGRO,EC0910,ROBERTO ASTUDILLO (CAB EN CRUC,EC091054,Varios Sectores (San Miguel y Cien Camas),-79.510294,-2.168946,La Costa,5/10/17,7:00:00 PM,5,10,2017,Rain,Short duration flood,0,0,0,0,0,0,0,0,0,1,,,,,3.0,,20.0,20.0,,20.0,,,7,6,7,20.0,3.0,3.0,2017-05-11 00:00:00
4760,Desinventar,GUAYAS,EC09,ALFREDO BAQUERIZO MORENO,EC0902,ALFREDO BAQUERIZO MORENO (JUJA,EC090250,Las Dolores,-79.554815,-1.889399,La Costa,3/13/19,12:59:00 PM,3,13,2019,Rain / Overflow,Short duration flood,0,0,0,0,0,0,0,0,0,1,,,,,1.0,1.0,1.0,1.0,,,,,7,6,7,1.0,1.0,1.0,2019-03-13 17:59:00
4608,Desinventar,GUAYAS,EC09,ALFREDO BAQUERIZO MORENO,EC0902,ALFREDO BAQUERIZO MORENO (JUJA,EC090250,Barrio Primero de Mayo,-79.555375,-1.888813,La Costa,1/15/19,4:30:00 AM,1,15,2019,Rain,Short duration flood,0,0,0,0,0,0,0,0,0,1,,,,,1.0,1.0,3.0,3.0,,,,,7,6,7,3.0,1.0,1.0,2019-01-15 09:30:00
4756,Desinventar,GUAYAS,EC09,MILAGRO,EC0910,MILAGRO,EC091050,Sector Las Pinas Sur,-79.576503,-2.161464,La Costa,3/9/19,5:00:00 AM,3,9,2019,Rain,Short duration flood,0,0,0,0,0,0,0,0,0,1,,,,110.0,,110.0,241.0,241.0,,,,,7,6,7,241.0,110.0,5.0,2019-03-09 10:00:00
4759,Desinventar,GUAYAS,EC09,MILAGRO,EC0910,MILAGRO,EC091050,Sector San Miguel 2,-79.578432,-2.136232,La Costa,3/10/19,5:00:00 AM,3,10,2019,Rain,Short duration flood,0,0,0,0,0,0,0,0,0,1,,,,,37.0,37.0,88.0,88.0,,,,,7,6,7,88.0,37.0,4.0,2019-03-10 10:00:00
4704,Desinventar,GUAYAS,EC09,MILAGRO,EC0910,MILAGRO,EC091050,San Emilio,-79.583459,-2.115163,La Costa,3/3/19,5:00:00 AM,3,3,2019,Rain,Short duration flood,0,0,0,0,0,0,0,0,0,1,,,,,68.0,68.0,147.0,147.0,,,,,7,6,7,147.0,68.0,5.0,2019-03-03 10:00:00
4703,Desinventar,GUAYAS,EC09,MILAGRO,EC0910,MILAGRO,EC091050,Las Pozas de las Mercedes,-79.588246,-2.150178,La Costa,3/3/19,9:00:00 PM,3,3,2019,Rain,Short duration flood,0,0,0,0,0,0,0,0,0,1,,,,,60.0,60.0,132.0,132.0,,,,,7,6,7,132.0,60.0,5.0,2019-03-04 02:00:00
4643,SNGRE,GUAYAS,EC09,MILAGRO,EC0910,MILAGRO,EC091050,Sector Unida Sur y sector San Jose,-79.611191,-2.138288,La Costa,2/13/19,5:00:00 AM,2,13,2019,Rain,Short duration flood,0,0,0,0,0,0,0,0,0,1,,,,,,44.0,93.0,,,,,,7,6,7,93.0,44.0,4.0,2019-02-13 10:00:00
4755,Desinventar,GUAYAS,EC09,MILAGRO,EC0910,CHOBO,EC091051,Sector Nueva Unida Sur,-79.614494,-2.143718,La Costa,3/9/19,5:00:00 AM,3,9,2019,Rain,Short duration flood,0,0,0,0,0,0,0,0,0,1,,,,,40.0,40.0,88.0,88.0,,,,,7,6,7,88.0,40.0,4.0,2019-03-09 10:00:00
2732,Desinventar,ESMERALDAS,EC08,ESMERALDAS,EC0801,TACHINA,EC080166,Av. Velazco Ibarra entre 24 de Mayo y Esmeraldas,-79.628634,0.962618,La Costa,3/30/14,1:30:00 PM,3,30,2014,Rain ,Strong current,0,0,0,0,0,0,0,0,1,0,,,,,,,,,,,,,7,6,7,,,,2014-03-30 18:30:00
4042,Desinventar,GUAYAS,EC09,BALAO,EC0903,BALAO,EC090350,Recinto La Libertad,-79.71734,-2.950121,La Costa,3/27/17,1:05:00 PM,3,27,2017,,Strong current,0,0,0,0,0,0,0,0,1,0,,,,,,,,,,,800.0,,7,6,7,,,,2017-03-27 18:05:00
3020,Desinventar,AZUAY,EC01,CAMILO PONCE ENRIQUEZ,EC0115,CAMILO PONCE ENRIQUEZ,EC011550,Juventud Por  Sus Derechos,-79.720157,-3.082649,La Sierra,3/19/15,6:00:00 PM,3,19,2015,Rain / Overflow,Strong current,0,0,0,0,0,0,0,0,1,0,,,,,,,,,,,15.0,,7,6,7,,,,2015-03-19 23:00:00
3456,Desinventar,AZUAY,EC01,CAMILO PONCE ENRIQUEZ,EC0115,CAMILO PONCE ENRIQUEZ,EC011550,Varios Sectores,-79.746441,-3.062329,La Sierra,2/24/16,4:44:00 AM,2,24,2016,Rain / Overflow,Heavy precipitation/ Urban/ Small stream overflow,1,0,0,1,0,1,0,0,0,0,,,,,7.0,,28.0,28.0,,,,,7,6,7,28.0,7.0,3.0,2016-02-24 09:44:00
4863,Desinventar,LOJA,EC11,CELICA,EC1104,CELICA,EC110450,Las Pampas,-79.955886,-4.098733,La Sierra,3/22/19,8:18:00 PM,3,22,2019,Rain / Overflow,Urban/ Surface runoff,0,0,0,0,1,1,0,0,0,0,,,,,1.0,1.0,4.0,4.0,,,,,7,6,7,4.0,1.0,1.0,2019-03-23 01:18:00
4844,SNGRE,LOJA,EC11,PUYANGO,EC1110,ALAMOR,EC111050,Cango Nuevo y Cango Viejo,-79.985225,-4.021061,La Sierra,3/21/19,4:00:00 PM,3,21,2019,Rain,Urban/ Surface runoff,0,0,0,0,1,1,0,0,0,0,,,,,,7.0,25.0,3769.0,,,,,7,6,7,3769.0,7.0,,2019-03-21 21:00:00
3911,Desinventar,MANABI,EC13,JIPIJAPA,EC1306,JULCUY,EC130653,Varios sectores,-80.650032,-1.48248,La Costa,3/8/17,12:10:00 AM,3,8,2017,Rain ,Heavy precipitation/Small stream overflow/Urban,1,0,0,1,0,1,0,0,0,0,,,,,250.0,,1000.0,1000.0,,32.0,,,7,6,7,1000.0,250.0,6.0,2017-03-08 05:10:00
1768,SNGRE_2021,ORELLANA,EC22,LA JOYA DE LOS SACHAS,EC2203,LA JOYA DE LOS SACHAS,EC220350,Barrio Santa Rosa,-76.844166,-0.309125,El Oriente,11/18/12,2:00:00 AM,11,18,2012,Rain,Heavy precipitation/ Short duration rain/Urban,1,1,0,0,0,1,0,0,0,0,,,,,2.0,,20.0,,,,,,6,7,7,20.0,2.0,3.0,2012-11-18 07:00:00
2913,Desinventar,ORELLANA,EC22,LA JOYA DE LOS SACHAS,EC2203,LA JOYA DE LOS SACHAS,EC220350,Varios Barrios,-76.856326,-0.300158,El Oriente,12/10/14,3:00:00 AM,12,10,2014,Rain ,Heavy precipitation / Short duration rain,1,1,0,0,0,0,0,0,0,0,,,,,15.0,,,,,,,,5,7,7,,15.0,,2014-12-10 08:00:00
3198,SNGRE_2021,ORELLANA,EC22,LORETO,EC2204,SAN JOSE DE DAHUANO,EC220454,"Huataraco, Tio Yacu y La Paz",-77.375428,-0.7366294,La Sierra,5/28/15,6:30:00 AM,5,28,2015,Rain/ Overflow,Short duration rain,0,1,0,0,0,0,0,0,0,0,,,,,2.0,,,,,,,,3,7,7,,2.0,,2015-05-28 11:30:00
2908,Desinventar,PASTAZA,EC16,ARAJUNO,EC1604,ARAJUNO,EC160450,GAD del Canton Arajuno,-77.678739,-1.236951,La Sierra,11/15/14,5:00:00 PM,11,15,2014,Rain ,Heavy precipitation / Short duration rain,1,1,0,0,0,0,0,0,0,0,,,,,,,,,,,,,5,7,7,,,,2014-11-15 22:00:00
3244,Desinventar,NAPO,EC15,ARCHIDONA,EC1503,SAN PABLO DE USHPAYACU,EC150354,Nueva Estrella,-77.776015,-0.932154,La Sierra,9/29/15,3:00:00 PM,9,29,2015,Rain ,Heavy precipitation,1,0,0,0,0,0,0,0,0,0,,,,,1.0,,6.0,6.0,,,,,2,7,7,6.0,1.0,2.0,2015-09-29 20:00:00
3626,Desinventar,NAPO,EC15,ARCHIDONA,EC1503,ARCHIDONA,EC150350,Yawari Antonio Cabria San Agustin,-77.795777,-0.891934,La Sierra,5/9/16,1:00:00 AM,5,9,2016,Rain ,Heavy precipitation/ Short duration rain,1,1,0,0,0,0,0,0,0,0,,,,,3.0,,14.0,14.0,,,,,5,7,7,14.0,3.0,3.0,2016-05-09 06:00:00
3543,Desinventar,NAPO,EC15,ARCHIDONA,EC1503,ARCHIDONA,EC150350,Barrio Piedra Grande Y El Progreso,-77.800808,-0.906545,La Sierra,3/20/16,7:45:00 PM,3,20,2016,Rain ,Urban/,0,0,0,0,0,1,0,0,0,0,,,,,,,1.0,1.0,,,,,1,7,7,1.0,,1.0,2016-03-21 00:45:00
1740,SNGRE_2021,NAPO,EC15,TENA,EC1501,TENA,EC150150,Barrio Las Palmas (Calle Mimi Palacios y Ayahuasca,-77.808746,-0.977656,La Sierra,10/24/12,5:00:00 AM,10,24,2012,Rain,Heavy precipitation/ Short duration rain/Urban,1,1,0,0,0,1,0,0,0,0,,,,,1.0,,7.0,,,,,,6,7,7,7.0,1.0,2.0,2012-10-24 10:00:00
5354,SNGRE_2021,NAPO,EC15,ARCHIDONA,EC1503,ARCHIDONA,EC150350,"Barrio Las Maravillas y sector 
Via aSanta Elena",-77.812004,-0.908695,La Sierra,10/29/20,9:38:00 PM,10,29,2020,Rain,Short duration rain,0,1,0,0,0,0,0,0,0,0,,,,,3.0,3.0,11.0,,,,,,3,7,7,11.0,3.0,3.0,2020-10-30 02:38:00
5006,SNGRE_2021,NAPO,EC15,ARCHIDONA,EC1503,COTUNDO,EC150352,"Virgen de Guacamayo, Km 45, via Y de Narupa - Y de Baeza [E20-E45].",-77.814488,-0.6904176,La Sierra,9/14/19,10:20:00 AM,9,14,2019,Rain,Surface runoff,0,0,0,0,1,0,0,0,0,0,,,,,,,,,,,,,6,7,7,,,,2019-09-14 15:20:00
3482,Desinventar,NAPO,EC15,ARCHIDONA,EC1503,ARCHIDONA,EC150350,Santa Rita,-77.830143,-0.875469,La Sierra,3/3/16,10:00:00 AM,3,3,2016,Rain ,Short duration rain,0,1,0,0,0,0,0,0,0,0,,,,,2.0,,10.0,10.0,,,,,3,7,7,10.0,2.0,2.0,2016-03-03 15:00:00
4922,SNGRE_2021,NAPO,EC15,QUIJOS,EC1507,BAEZA,EC150750,"Sector El Mirador, via Y de Baeza - Y de Narupa [E20 - E45]",-77.871836,-0.4628078,La Sierra,4/21/19,8:30:00 PM,4,21,2019,Rain,Surface runoff,0,0,0,0,1,0,0,0,0,0,,,,,,,,,,,,,6,7,7,,,,2019-04-22 01:30:00
4336,SNGRE_2021,NAPO,EC15,QUIJOS,EC1507,BAEZA,EC150750,Arrayan - via Baeza- Tena [E20 - E45],-77.884338,-0.4635358,La Sierra,12/10/17,3:30:00 PM,12,10,2017,Rain,Surface runoff,0,0,0,0,1,0,0,0,0,0,,,,,,,,,,,,,6,7,7,,,,2017-12-10 20:30:00
5333,SNGRE_2021,NAPO,EC15,QUIJOS,EC1507,CUYUJA,EC150752,"Los Laureles, Km 60, via Y de Baeza - Papallacta [E20]",-77.971911,-0.430477,La Sierra,8/21/20,9:00:00 AM,8,21,2020,Rain,Surface runoff,0,0,0,0,1,0,0,0,0,0,,,,,,,,,,,,,6,7,7,,,,2020-08-21 14:00:00
5306,SNGRE_2021,NAPO,EC15,QUIJOS,EC1507,CUYUJA,EC150752,"Yahuana, via Y de Baeza - Papallacta [E20]",-77.973436,-0.4252701,La Sierra,6/21/20,2:40:00 AM,6,21,2020,Rain,Surface runoff,0,0,0,0,1,0,0,0,0,0,,,,,,,,,,,,,6,7,7,,,,2020-06-21 07:40:00
5332,SNGRE_2021,NAPO,EC15,QUIJOS,EC1507,CUYUJA,EC150752,"Yahuana, San Victor, via Y de Baeza - Papallacta [E20]",-77.973436,-0.4252701,La Sierra,8/20/20,12:50:00 PM,8,20,2020,Rain,Surface runoff,0,0,0,0,1,0,0,0,0,0,,,,,,,,,,,,,6,7,7,,,,2020-08-20 17:50:00
4964,SNGRE_2021,NAPO,EC15,QUIJOS,EC1507,CUYUJA,EC150752,"San Victor, km 66, via Baeza - Papallacta [E20]",-77.985069,-0.426406,La Sierra,6/20/19,8:49:00 AM,6,20,2019,Rain,Surface runoff,0,0,0,0,1,0,0,0,0,0,,,,,,,,,,,,,6,7,7,,,,2019-06-20 13:49:00
5018,SNGRE_2021,PASTAZA,EC16,PASTAZA,EC1601,PUYO,EC160150,Barrio La Isla,-77.993943,-1.4854808,La Sierra,10/20/19,12:13:00 AM,10,20,2019,Rain/ Overflow,Short duration flood,0,0,0,0,0,0,0,0,0,1,,,,,1.0,20.0,74.0,,,12.0,,,7,7,7,74.0,20.0,4.0,2019-10-20 05:13:00
5017,SNGRE_2021,PASTAZA,EC16,PASTAZA,EC1601,PUYO,EC160150,"Barrio Obrero, calle 4 de Enero",-77.997893,-1.483466,La Sierra,10/20/19,4:00:00 AM,10,20,2019,Rain,Short duration flood,0,0,0,0,0,0,0,0,0,1,,,,,,2.0,6.0,,,7.0,,,7,7,7,6.0,2.0,2.0,2019-10-20 09:00:00
4524,SNGRE,PASTAZA,EC16,PASTAZA,EC1601,PUYO,EC160150,"Barrio Cumanda, calles Juan Leon Mera  y Vicente Rocafuerte,  Cdla. Pastaza calles, Alpayaku e Indillama y Cdla. Pastaza, calles Copataza e Indillama. ",-77.9998,-1.492881,La Sierra,10/12/18,3:40:00 AM,10,12,2018,Rain,Heavy precipitation,1,0,0,0,0,0,0,0,0,0,,,,,,,,,,,,,2,7,7,,,,2018-10-12 08:40:00
2665,Desinventar,PASTAZA,EC16,PASTAZA,EC1601,PUYO,EC160150,Ciudad de Puyo,-78.001303,-1.490015,La Sierra,3/2/14,3:45:00 PM,3,2,2014,,Urban,0,0,0,0,0,1,0,0,0,0,,,,,,,,,,,,,1,7,7,,,,2014-03-02 20:45:00
3728,Desinventar,PASTAZA,EC16,PASTAZA,EC1601,PUYO,EC160150,Barrio El Dorado,-78.012607,-1.495731,La Sierra,1/20/17,12:10:00 AM,1,20,2017,Overflow,Surface runoff,0,0,0,0,1,0,0,0,0,0,,,,,1.0,,272.0,272.0,,,,,6,7,7,272.0,1.0,5.0,2017-01-20 05:10:00
3729,Desinventar,PASTAZA,EC16,PASTAZA,EC1601,PUYO,EC160150,Barrio La Isla ,-78.013241,-1.498162,La Sierra,1/20/17,1:30:00 AM,1,20,2017,Rain / Overflow,Short duration rain,0,1,0,0,0,0,0,0,0,0,,,,,4.0,,470.0,470.0,,,,,3,7,7,470.0,4.0,5.0,2017-01-20 06:30:00
4923,SNGRE,PASTAZA,EC16,PASTAZA,EC1601,PUYO,EC160150,Barrio el Recreo,-78.014587,-1.497353,La Sierra,4/21/19,3:49:00 AM,4,21,2019,Overflow,Surface runoff,0,0,0,0,1,0,0,0,0,0,,,,,,,,,,,,,6,7,7,,,,2019-04-21 08:49:00
2375,Desinventar/SNGRE_2021,CARCHI,EC04,MIRA,EC0404,MIRA (CHONTAHUASI),EC040450,Cabecera cantonal,-78.0411,0.551,La Sierra,5/3/13,4:30:00 PM,5,3,2013,Rain ,Heavy precipitation/ Short duration rain,1,1,0,0,0,0,0,0,0,0,,,,,20.0,,83.0,83.0,,12.0,,,5,7,7,83.0,20.0,4.0,2013-05-03 21:30:00
3681,Desinventar,PASTAZA,EC16,MERA,EC1602,SHELL,EC160252,Varios sectores de Shell.,-78.055892,-1.491048,La Sierra,12/29/16,10:00:00 PM,12,29,2016,Rain / Overflow,Heavy precipitation/ Short duration rain,1,1,0,0,0,0,0,0,0,0,,,,2.0,2.0,,77.0,77.0,7.0,,,,5,7,7,77.0,2.0,4.0,2016-12-30 03:00:00
2695,Desinventar,PASTAZA,EC16,MERA,EC1602,SHELL,EC160252,23 de Agosto,-78.05899,-1.499526,La Sierra,3/13/14,4:00:00 PM,3,13,2014,Rain ,Heavy precipitation/ Urban/ Short duration rain,1,1,0,0,0,1,0,0,0,0,,,,,3.0,,10.0,10.0,,,,,6,7,7,10.0,3.0,2.0,2014-03-13 21:00:00
3634,Desinventar,CARCHI,EC04,MIRA,EC0404,MIRA (CHONTAHUASI),EC040450,Varios sectores ,-78.060231,0.554037,La Sierra,5/30/16,5:30:00 PM,5,30,2016,Rain ,Heavy precipitation/ Urban ,1,0,0,0,0,1,0,0,0,0,,,,,43.0,,,,,,,,3,7,7,,43.0,,2016-05-30 22:30:00
1744,SNGRE_2021,PICHINCHA,EC17,PEDRO MONCAYO,EC1704,LA ESPERANZA,EC170451,Barrio el Rosario,-78.256864,0.056517,La Sierra,10/31/12,3:30:00 PM,10,31,2012,Rain/ Overflow,Heavy precipitation/ Artificial waterway overflow,1,0,1,0,0,0,0,0,0,0,,,,,1.0,,,,,,,,3,7,7,,1.0,,2012-10-31 20:30:00
1746,SNGRE_2021,PICHINCHA,EC17,PEDRO MONCAYO,EC1704,LA ESPERANZA,EC170451,Barrio Tomalon Central - Barrio El Rosario,-78.256864,0.056517,La Sierra,11/6/12,2:20:00 PM,11,6,2012,Rain/ Overflow,Heavy precipitation/ Artificial waterway overflow/ surface overflow,1,0,1,0,0,0,0,0,0,0,,,,,2.0,,10.0,,,,,,3,7,7,10.0,2.0,2.0,2012-11-06 19:20:00
5311,SNGRE_2021,TUNGURAHUA,EC18,BAÑOS DE AGUA SANTA,EC1802,ULBA,EC180254,"Rio Blanco, via Banos - Puyo [E-30].",-78.394177,-1.39622,La Sierra,6/21/20,6:00:00 PM,6,21,2020,Rain,Surface runoff,0,0,0,0,1,0,0,0,0,0,,,,,2.0,2.0,6.0,,,6.0,,,6,7,7,6.0,2.0,2.0,2020-06-21 23:00:00
5337,SNGRE_2021,TUNGURAHUA,EC18,BAÑOS DE AGUA SANTA,EC1802,ULBA,EC180254,Sector del Parque la Familia.,-78.394177,-1.39622,La Sierra,9/5/20,12:30:00 AM,9,5,2020,Rain,Surface runoff,0,0,0,0,1,0,0,0,0,0,,,,,1.0,4.0,13.0,,,1.0,,2.0,6,7,7,13.0,4.0,3.0,2020-09-05 05:30:00
3166,Desinventar,TUNGURAHUA,EC18,BAÑOS DE AGUA SANTA,EC1802,ULBA,EC180254,Sector de Chamana,-78.398703,-1.396891,La Sierra,4/26/15,10:00:00 AM,4,26,2015,Rain / Overflow,Heavy precipitation,1,0,0,0,0,0,0,0,0,0,,,,,1.0,,5.0,5.0,,,,,2,7,7,5.0,1.0,1.0,2015-04-26 15:00:00
4359,SNGRE_2021,TUNGURAHUA,EC18,BAÑOS DE AGUA SANTA,EC1802,BAÑOS DE AGUA SANTA,EC180250,"Pititig, via Ambato Banos [E30].",-78.4343,-1.4003863,La Sierra,1/21/18,9:30:00 AM,1,21,2018,Rain,surface runoff,0,0,0,0,1,0,0,0,0,0,,,,,,,,,,,,,6,7,7,,,,2018-01-21 14:30:00
5301,SNGRE_2021,TUNGURAHUA,EC18,BAÑOS DE AGUA SANTA,EC1802,BAÑOS DE AGUA SANTA,EC180250,"Juive Chico, via Juive Chico - Banos.",-78.448405,-1.403393,La Sierra,6/19/20,3:43:00 AM,6,19,2020,Rain,Surface runoff,0,0,0,0,1,0,0,0,0,0,,,,,,,,,,,,,6,7,7,,,,2020-06-19 08:43:00
4970,SNGRE_2021,TUNGURAHUA,EC18,PATATE,EC1805,PATATE,EC180550,"La Matriz, Los Manteles, La Libertad, La Suiza, El Cedro, Lomitas, Quindio, Loma Grande, Punapi, San Jorge, Cariacu, El Diviso",-78.4628,-1.3055,La Sierra,6/21/19,9:30:00 AM,6,21,2019,Rain/ Overflow,Surface runoff,0,0,0,0,1,0,0,0,0,0,,,,,,227.0,908.0,,,,17.0,2.0,6,7,7,908.0,227.0,6.0,2019-06-21 14:30:00
3942,Desinventar,TUNGURAHUA,EC18,PATATE,EC1805,PATATE,EC180550,Patio Bonito,-78.475868,-1.302867,La Sierra,3/16/17,4:33:00 PM,3,16,2017,Rain ,Artificial waterway overflow,0,0,1,0,0,0,0,0,0,0,,,,,1.0,,6.0,6.0,,6.0,,,1,7,7,6.0,1.0,2.0,2017-03-16 21:33:00
2348,SNGRE_2021,CHIMBORAZO,EC06,PENIPE,EC0609,BILBAO (CAB.EN QUILLUYACU),EC060956,Quebrada Romero,-78.4871,-1.4681,La Sierra,4/23/13,8:20:00 AM,4,23,2013,Rain/ Landslide,Surface runoff,0,0,0,0,1,0,0,0,0,0,,,,,,,,,,,,,6,7,7,,,,2013-04-23 13:20:00
5307,SNGRE_2021,TUNGURAHUA,EC18,PATATE,EC1805,PATATE,EC180550,"Punapi, via Patate-El triunfo.",-78.496942,-1.349676,La Sierra,6/21/20,9:00:00 AM,6,21,2020,Rain,Surface runoff,0,0,0,0,1,0,0,0,0,0,,,,,,,,,,,,,6,7,7,,,,2020-06-21 14:00:00
1755,SNGRE_2021,COTOPAXI,EC05,SALCEDO,EC0505,SAN MIGUEL,EC050550,"Barrio Chipoalo, Paradero Turistico "" Paraiso de Maria""",-78.501083,-1.026408,La Sierra,11/14/12,4:00:00 PM,11,14,2012,Rain,Urban/ Surface runoff,0,0,0,0,1,1,0,0,0,0,,,,,,,,,,,,,7,7,7,,,,2012-11-14 21:00:00
2903,Desinventar,COTOPAXI,EC05,SALCEDO,EC0505,SAN MIGUEL,EC050550,"Plazoleta San Antonio, Hosteria Los Molinos, Cuatro Esquinas",-78.501083,-1.026408,La Sierra,11/9/14,5:30:00 PM,11,9,2014,Rain,Heavy precipitation/ Short duration rain,1,1,0,0,0,0,0,0,0,0,,,,,,,,,,,,,5,7,7,,,,2014-11-09 22:30:00
4962,SNGRE,TUNGURAHUA,EC18,PATATE,EC1805,SUCRE (CAB. EN SUCRE-PATATE URCU),EC180550,Barrio Centro/Unidad Educativa Mariscal Antonio Jose de Sucre.,-78.506447,-1.312838,La Sierra,6/11/19,7:00:00 AM,6,11,2019,Rain,Artificial waterway overflow/ Urban,0,0,1,0,0,1,0,0,0,0,,,,,,,,,,,,,2,7,7,,,,2019-06-11 12:00:00
3242,SNGRE,TUNGURAHUA,EC18,PATATE,EC1805,PATATE,EC180550,Patio Bonito y el Mirador,-78.512269,-1.326224,La Sierra,7/30/15,4:39:00 PM,7,30,2015,Rain / Overflow,Heavy precipitation,1,0,0,0,0,0,0,0,0,0,,,,,,,,,,,,,2,7,7,,,,2015-07-30 21:39:00
4317,SNGRE_2021,TUNGURAHUA,EC18,SAN PEDRO DE PELILEO,EC1807,PELILEO CABECERA CANTONAL,EC180750,La Clementina - en la via a Salate.,-78.526667,-1.3504772,La Sierra,10/31/17,4:48:00 PM,10,31,2017,Rain,Surface runoff,0,0,0,0,1,0,0,0,0,0,,,,,,,,,,,,,6,7,7,,,,2017-10-31 21:48:00
4294,SNGRE_2021,CHIMBORAZO,EC06,GUANO,EC0607,LA PROVIDENCIA,EC060753,Pungal el Quinche via Penipe Riobamba [E490],-78.550332,-1.5898737,La Sierra,8/8/17,1:53:00 AM,8,8,2017,Overflow,Artificial waterway overflow/ Surface runoff,0,0,1,0,1,0,0,0,0,0,,,,,,,,,,,,,7,7,7,,,,2017-08-08 06:53:00
2922,SNGRE,TUNGURAHUA,EC18,SAN PEDRO DE PELILEO,EC1807,BOLIVAR,EC180752,Huambalito,-78.552043,-1.387388,La Sierra,12/30/14,2:30:00 AM,12,30,2014,Overflow,Artificial waterway overflow,0,0,1,0,0,0,0,0,0,0,,,,,,,,,,,,,1,7,7,,,,2014-12-30 07:30:00
3828,Desinventar,CHIMBORAZO,EC06,GUANO,EC0607,SANTA FE DE GALAN,EC060758,San Jose de Sabanag,-78.575611,-1.499269,La Sierra,2/12/17,6:30:00 PM,2,12,2017,Rain ,Heavy precipitation,1,0,0,0,0,0,0,0,0,0,,,,,1.0,,1.0,1.0,,,,,2,7,7,1.0,1.0,1.0,2017-02-12 23:30:00
3857,Desinventar,CHIMBORAZO,EC06,GUANO,EC0607,GUANO,EC060750,El Rosario (San Pedro de Las Habras),-78.646796,-1.641187,La Sierra,2/22/17,2:15:00 AM,2,22,2017,Rain / Overflow,Artificial waterway overflow,0,0,1,0,0,0,0,0,0,0,,,,,1.0,,4.0,4.0,,,,,1,7,7,4.0,1.0,1.0,2017-02-22 07:15:00
4213,Desinventar,CHIMBORAZO,EC06,GUANO,EC0607,LA MATRIZ,EC060750,Langos Chico,-78.647092,-1.63391,La Sierra,4/22/17,7:00:00 PM,4,22,2017,Rain ,Surface runoff,0,0,0,0,1,0,0,0,0,0,,,,,1.0,,5.0,5.0,,,,,6,7,7,5.0,1.0,1.0,2017-04-23 00:00:00
5037,SNGRE_2021,CHIMBORAZO,EC06,RIOBAMBA,EC0601,FLORES,EC060154,"El Obraje, Santa Ana de Yalligchi, Gompuene San Vicente, Gompuene Central.",-78.650304,-1.836914,La Sierra,11/11/19,5:00:00 PM,11,11,2019,Rain,Surface runoff,0,0,0,0,1,0,0,0,0,0,,,,,5.0,310.0,1240.0,,,,112.5,88.5,6,7,7,1240.0,310.0,6.0,2019-11-11 22:00:00
4907,SNGRE,CHIMBORAZO,EC06,GUANO,EC0607,LA MATRIZ,EC060750,Langos La Inmaculada,-78.65141,-1.6388,La Sierra,4/4/19,4:00:00 PM,4,4,2019,Rain / Overflow,Artificial waterway overflow/ Small stream overflow,0,0,1,1,0,0,0,0,0,0,,,,,,,4.0,,,,0.2,,5,7,7,4.0,,1.0,2019-04-04 21:00:00
3858,Desinventar,TUNGURAHUA,EC18,AMBATO,EC1801,JUAN BENIGNO VELA,EC180157,Patalo Alto San Miguel y San Pedro,-78.706817,-1.32164,La Sierra,2/22/17,12:00:00 PM,2,22,2017,Rain ,Heavy precipitation,1,0,0,0,0,0,0,0,0,0,,,,,,,40.0,40.0,,,21.0,8.0,2,7,7,40.0,,3.0,2017-02-22 17:00:00
2636,Desinventar,ZAMORA CHINCHIPE,EC19,YANTZAZA,EC1905,CHICANA,EC190551,Barrio la Union,-78.749189,-3.649128,La Sierra,2/21/14,2:00:00 AM,2,21,2014,Rain,Heavy precipitation/ Urban ,1,0,0,0,0,1,0,0,0,0,,,,,3.0,,15.0,15.0,,,,,3,7,7,15.0,3.0,3.0,2014-02-21 07:00:00
4289,SNGRE_2021,TUNGURAHUA,EC18,AMBATO,EC1801,PILAGUIN (PILAHUIN),EC180161,"San Isidro, Km 25 en la via Ambato-Guaranda [E41]",-78.757084,-1.3366477,La Sierra,7/25/17,4:42:00 PM,7,25,2017,Rain/ Overflow,Artificial waterway overflow/ Surface runoff,0,0,1,0,1,0,0,0,0,0,,,,,,,,,,,,,7,7,7,,,,2017-07-25 21:42:00
3648,SNGRE_2021,TUNGURAHUA,EC18,AMBATO,EC1801,PILAGUIN (PILAHUIN),EC180161,"Pilahuin Centro, Tamboloma, San Antonio, Llangahua, zona alta Pilahuin.",-78.7643,-1.3024909,La Sierra,7/9/16,12:00:00 AM,7,9,2016,Rain,Heavy precipitation,1,0,0,0,0,0,0,0,0,0,,,,,,,39.0,,,,68.0,66.0,2,7,7,39.0,,3.0,2016-07-09 05:00:00
2638,Desinventar/SNGRE_2021,ZAMORA CHINCHIPE,EC19,YANTZAZA,EC1905,CHICANA,EC190551,Barrio San Vicente de Caney,-78.777108,-3.692469,La Sierra,2/21/14,2:00:00 AM,2,21,2014,Rain / Overflow,Heavy precipitation / Short duration rain,1,1,0,0,0,0,0,0,0,0,,,,,21.0,,105.0,105.0,,,,,5,7,7,105.0,21.0,5.0,2014-02-21 07:00:00
4934,SNGRE_2021,CHIMBORAZO,EC06,ALAUSI,EC0602,TIXAN,EC060260,"Pueblo Viejo, via Riobamba - Cuenca [E35]",-78.80293,-2.1559895,La Sierra,5/5/19,2:12:00 AM,5,5,2019,Overflow,Artificial waterway overflow/Surface runoff,0,0,1,0,1,0,0,0,0,0,,,,,,,,,,,,,7,7,7,,,,2019-05-05 07:12:00
5184,SNGRE_2021,CHIMBORAZO,EC06,ALAUSI,EC0602,ALAUSI,EC060250,Barrio la Elegancia,-78.849959,-2.204616,La Sierra,2/29/20,2:30:00 PM,2,29,2020,Rain,Urban/ Surface runoff,0,0,0,0,1,1,0,0,0,0,,,,,,,,,,,,,7,7,7,,,,2020-02-29 19:30:00
3639,Desinventar/SNGRE_2021,CANAR,EC03,EL TAMBO,EC0305,EL TAMBO,EC030550,Coyoctor,-78.9114,-2.527325,La Sierra,6/23/16,9:20:00 AM,6,23,2016,,Urban,0,0,0,0,0,1,0,0,0,0,,,,,,,,,,,,,1,7,7,,,,2016-06-23 14:20:00
2479,Desinventar/SNGRE_2021,CANAR,EC03,EL TAMBO,EC0305,EL TAMBO,EC030550,Centro Parroquial,-78.9236,-2.5071,La Sierra,11/11/13,9:30:00 PM,11,11,2013,Rain ,Heavy precipitation/ Urban ,1,0,0,0,0,1,0,0,0,0,,,,,10.0,,,,,,,,3,7,7,,10.0,,2013-11-12 02:30:00
4708,SNGRE_2021,CANAR,EC03,CANAR,EC0303,EL TAMBO,EC030550,Chuichun - Nutri Leche,-78.953083,-2.491961,La Sierra,3/3/19,2:27:00 PM,3,3,2019,Rain / Landslide,Surface runoff,0,0,0,0,1,0,0,0,0,0,,,,,1.0,1.0,,6.0,,6.0,,,6,7,7,6.0,1.0,2.0,2019-03-03 19:27:00
3141,Desinventar,AZUAY,EC01,CUENCA,EC0101,SAN JOAQUIN,EC010163,Barabon Sect. Soldados,-79.074809,-2.902181,La Sierra,4/21/15,6:14:00 PM,4,21,2015,Overflow,Strong current,0,0,0,0,0,0,0,0,1,0,,,,,,,,,,,,,7,7,7,,,,2015-04-21 23:14:00
2170,Desinventar/SNGRE_2021,CANAR,EC03,CANAR,EC0303,GUALLETURO,EC030354,Zhuya,-79.0956,-2.5839,La Sierra,3/20/13,10:30:00 PM,3,20,2013,Rain / Overflow,Heavy precipitation,1,0,0,0,0,0,0,0,0,0,,,,,1.0,,5.0,5.0,,,,,2,7,7,5.0,1.0,1.0,2013-03-21 03:30:00
3161,SNGRE_2021,LOJA,EC11,LOJA,EC1101,JIMBILLA,EC110155,Shucos,-79.175607,-3.8301365,La Sierra,4/26/15,11:00:00 AM,4,26,2015,Rain,Surface runoff,0,0,0,0,1,0,0,0,0,0,,,,,,,,,,,,,6,7,7,,,,2015-04-26 16:00:00
2728,SNGRE,SANTO DOMINGO DE LOS TSACHILAS,EC23,SANTO DOMINGO,EC2301,RIO VERDE,EC230150,"Coop. El Proletariado, calle bellavista y calle 3",-79.182867,-0.346357,La Costa,3/30/14,7:10:00 AM,3,30,2014,Rain,Heavy precipitation/ Urban/ Short duration rain,1,1,0,0,0,1,0,0,0,0,,,,,,,6.0,,,,,,6,7,7,6.0,,2.0,2014-03-30 12:10:00
2729,SNGRE,SANTO DOMINGO DE LOS TSACHILAS,EC23,SANTO DOMINGO,EC2301,RIO VERDE,EC230150,Coop. El Proletariado sector 2,-79.182867,-0.346357,La Costa,3/30/14,7:20:00 AM,3,30,2014,Rain ,Heavy precipitation/ Urban/ Short duration rain,1,1,0,0,0,1,0,0,0,0,,,,,,,71.0,,,,31.25,11.25,6,7,7,71.0,,4.0,2014-03-30 12:20:00
2840,Desinventar,SANTO DOMINGO DE LOS TSACHILAS,EC23,SANTO DOMINGO,EC2301,RIO VERDE,EC230150,Coop. El Proletariado,-79.182867,-0.346357,La Costa,5/26/14,7:30:00 PM,5,26,2014,Rain ,Short duration rain,0,1,0,0,0,0,0,0,0,0,,,,,5.0,,23.0,23.0,,,,,3,7,7,23.0,5.0,3.0,2014-05-27 00:30:00
1938,SNGRE_2021,SANTO DOMINGO DE LOS TSACHILAS,EC23,SANTO DOMINGO,EC2301,RIO VERDE,EC230150,"Urb. Montebello, calle Carolina y Tsafique ",-79.1829,-0.3464,La Costa,2/26/13,3:30:00 PM,2,26,2013,Rain ,Heavy precipitation,1,0,0,0,0,0,0,0,0,0,,,,,1.0,,6.0,,,6.0,,,2,7,7,6.0,1.0,2.0,2013-02-26 20:30:00
2939,Desinventar,GUAYAS,EC09,GNRAL. ANTONIO ELIZALDE,EC0927,GRAL. ANTONIO ELIZALDE (BUCAY),EC092750,Fortuna Baja,-79.224606,-2.152839,La Costa,1/26/15,3:00:00 PM,1,26,2015,Rain / Overflow,Strong current,0,0,0,0,0,0,0,0,1,0,,,,,,,,,,,,,7,7,7,,,,2015-01-26 20:00:00
3379,Desinventar,PICHINCHA,EC17,PUERTO QUITO,EC1709,PUERTO QUITO,EC170950,San Pedro de Rio Blanco ,-79.239381,0.1556,La Costa,1/25/16,10:00:00 AM,1,25,2016,Rain / Overflow,Heavy precipitation,1,0,0,0,0,0,0,0,0,0,,,,4.0,17.0,,85.0,85.0,,,,,2,7,7,85.0,17.0,4.0,2016-01-25 15:00:00
2291,Desinventar/SNGRE_2021,PICHINCHA,EC17,PUERTO QUITO,EC1709,PUERTO QUITO,EC170950,Puerto Rico (A 7 km pasando el poblado de Puerto Quito,-79.2615,0.1534,La Costa,4/17/13,5:00:00 PM,4,17,2013,Rain ,Heavy precipitation/ Short duration rain,1,1,0,0,0,0,0,0,0,0,,,,,8.0,,25.0,25.0,,,,,5,7,7,25.0,8.0,3.0,2013-04-17 22:00:00
4066,Desinventar,GUAYAS,EC09,NARANJITO,EC0912,NARANJITO,EC091250,Varios sectores,-79.310724,-2.133264,La Costa,3/29/17,3:00:00 PM,3,29,2017,Rain / Overflow,Heavy precipitation/ Small Stream,1,0,0,0,0,0,0,0,0,0,,,,,1.0,,4.0,4.0,,,,,2,7,7,4.0,1.0,1.0,2017-03-29 20:00:00
3535,Desinventar,GUAYAS,EC09,NARANJITO,EC0912,NARANJITO,EC091250,Varios Sectores (Recintos La Providencia Jesus del Gran Pode,-79.327652,-2.123634,La Costa,3/13/16,6:19:00 AM,3,13,2016,Overflow,Strong current,0,0,0,0,0,0,0,0,1,0,,,,,10.0,,40.0,40.0,,,,,7,7,7,40.0,10.0,3.0,2016-03-13 11:19:00
4611,Desinventar,LOS RIOS,EC12,VALENCIA,EC1211,VALENCIA,EC121150,"Recinto Chipe, El Zapote - Las Piedras",-79.354546,-0.979777,La Costa,1/16/19,3:00:00 PM,1,16,2019,Rain,Short duration flood,0,0,0,0,0,0,0,0,0,1,,,,,,,,,,,,2.0,7,7,7,,,,2019-01-16 20:00:00
2119,Desinventar/SNGRE_2021,LOS RIOS,EC12,URDANETA,EC1206,RICAURTE,EC120651,Roblecito,-79.3751,-1.5631,La Costa,3/15/13,9:30:00 AM,3,15,2013,Rain/ Failure,Heavy precipitation/ River Bank Failure,1,0,0,0,0,0,0,1,0,0,,,,,4.0,,22.0,22.0,,,,,6,7,7,22.0,4.0,3.0,2013-03-15 14:30:00
2144,Desinventar/SNGRE_2021,LOS RIOS,EC12,URDANETA,EC1206,RICAURTE,EC120651,El Tesoro,-79.3751,-1.5631,La Costa,3/16/13,6:00:00 PM,3,16,2013,Rain / Overflow,Heavy precipitation,1,0,0,0,0,0,0,0,0,0,,,,,7.0,,20.0,20.0,,,,,2,7,7,20.0,7.0,3.0,2013-03-16 23:00:00
2208,Desinventar/SNGRE_2021,LOS RIOS,EC12,URDANETA,EC1206,RICAURTE,EC120651,Rcto  Castilla; La Victoria,-79.3751,-1.5631,La Costa,3/26/13,6:30:00 AM,3,26,2013,Rain ,Heavy precipitation/ Short duration rain,1,1,0,0,0,0,0,0,0,0,,,,,28.0,,102.0,102.0,,,,,5,7,7,102.0,28.0,5.0,2013-03-26 11:30:00
2516,Desinventar,LOS RIOS,EC12,URDANETA,EC1206,RICAURTE,EC120651,Chimborazo y 28 de Mayo Via Caluma,-79.375146,-1.56315,La Costa,1/15/14,5:00:00 PM,1,15,2014,Rain,Heavy precipitation/ Urban,1,0,0,0,0,1,0,0,0,0,,,,,,,,,,,,,3,7,7,,,,2014-01-15 22:00:00
2818,Desinventar,LOS RIOS,EC12,URDANETA,EC1206,RICAURTE,EC120651,Ricaurte,-79.375146,-1.56315,La Costa,5/11/14,8:30:00 AM,5,11,2014,Rain ,Heavy precipitation/ Urban ,1,0,0,0,0,1,0,0,0,0,,,,,,,,,,,,,3,7,7,,,,2014-05-11 13:30:00
3386,Desinventar,LOS RIOS,EC12,URDANETA,EC1206,RICAURTE,EC120651,28 de Mayo,-79.375146,-1.56315,La Costa,1/25/16,6:02:00 AM,1,25,2016,Rain ,Surface runoff,0,0,0,0,1,0,0,0,0,0,,,,,,,,,,,,,6,7,7,,,,2016-01-25 11:02:00
3611,Desinventar,LOS RIOS,EC12,URDANETA,EC1206,RICAURTE,EC120651,Rcto San Antonio ,-79.375146,-1.56315,La Costa,4/13/16,8:18:00 AM,4,13,2016,Rain / Overflow,Heavy precipitation/ Short duration rain,1,1,0,0,0,0,0,0,0,0,,,,,18.0,,72.0,72.0,,,,,5,7,7,72.0,18.0,4.0,2016-04-13 13:18:00
3861,Desinventar,LOS RIOS,EC12,URDANETA,EC1206,RICAURTE,EC120651,Manabi Chiquito,-79.375146,-1.56315,La Costa,2/22/17,9:00:00 AM,2,22,2017,Rain / Overflow,Heavy precipitation/ Short duration rain,1,1,0,0,0,0,0,0,0,0,,,,,13.0,,49.0,49.0,18.0,,135.0,25.0,5,7,7,49.0,13.0,3.0,2017-02-22 14:00:00
3990,SNGRE,LOS RIOS,EC12,URDANETA,EC1206,RICAURTE,EC120651,Recinto La Guapara,-79.375146,-1.56315,La Costa,3/23/17,11:31:00 AM,3,23,2017,Rain / Overflow,Heavy precipitation/ Short duration rain,1,1,0,0,0,0,0,0,0,0,,,,,,,148.0,,,,,,5,7,7,148.0,,5.0,2017-03-23 16:31:00
3540,Desinventar,LOS RIOS,EC12,BABAHOYO,EC1201,FEBRES CORDERO (LAS JUNTAS) (CAB. EN MATA DE CACAO),EC120153,Cdla. Los angeles y Cdla la Reveza,-79.409447,-1.889127,La Costa,3/14/16,6:41:00 AM,3,14,2016,Rain / Overflow,Heavy precipitation/ Short duration rain,1,1,0,0,0,0,0,0,0,0,,,,,65.0,,260.0,260.0,,9.0,,,5,7,7,260.0,65.0,5.0,2016-03-14 11:41:00
3507,Desinventar,AZUAY,EC01,PUCARA,EC0106,PUCARA,EC010650,Sarayunga,-79.463562,-3.222803,La Sierra,3/6/16,10:00:00 PM,3,6,2016,Rain / Overflow,Heavy precipitation/ Urban ,1,0,0,0,0,1,0,0,0,0,,,,,,,,,,,,,3,7,7,,,,2016-03-07 03:00:00
3264,Desinventar,LOS RIOS,EC12,QUEVEDO,EC1205,GUAYACAN,EC120550,San Jose Sur Calle 6 y la v,-79.492892,-1.032841,La Costa,11/24/15,4:10:00 AM,11,24,2015,Rain ,Heavy precipitation/ Short duration rain,1,1,0,0,0,0,0,0,0,0,,,,,1.0,,6.0,6.0,,6.0,,,5,7,7,6.0,1.0,2.0,2015-11-24 09:10:00
2702,Desinventar,LOJA,EC11,CALVAS,EC1102,EL LUCERO,EC110252,Barrio Centro Civico,-79.501411,-4.393563,La Sierra,3/25/14,8:00:00 PM,3,25,2014,Rain / Overflow,Heavy precipitation/ Small stream overflow,1,0,0,1,0,0,0,0,0,0,,,,,3.0,,15.0,15.0,,,,,6,7,7,15.0,3.0,3.0,2014-03-26 01:00:00
3931,Desinventar,LOS RIOS,EC12,QUEVEDO,EC1205,24 DE MAYO,EC120550,La Loreto,-79.507854,-1.025335,La Costa,3/14/17,6:10:00 PM,3,14,2017,Rain ,Heavy precipitation/ Short duration rain,1,1,0,0,0,0,0,0,0,0,,,,,52.0,,189.0,189.0,,,,,5,7,7,189.0,52.0,5.0,2017-03-14 23:10:00
3783,Desinventar,LOS RIOS,EC12,QUEVEDO,EC1205,GUAYACAN,EC120550,Emelgur,-79.533881,-1.063862,La Costa,2/6/17,7:30:00 AM,2,6,2017,Rain ,Heavy precipitation/ Short duration rain,1,1,0,0,0,0,0,0,0,0,,,,,1.0,,4.0,4.0,,4.0,,,5,7,7,4.0,1.0,1.0,2017-02-06 12:30:00
4553,SNGRE,GUAYAS,EC09,El Empalme,EC0908,VELASCO IBARRA (CAB. EL EMPALM,EC090850,Varios Sectores,-79.608097,-1.048319,La Costa,1/5/19,7:00:00 AM,1,5,2019,Rain,Heavy precipitation,1,0,0,0,0,0,0,0,0,0,,,,,,,,,,,90.0,,2,7,7,,,,2019-01-05 12:00:00
4807,SNGRE,EL ORO,EC07,PINAS,EC0710,CAPIRO (CAB. EN LA CAPILLA DE ,EC071051,Naranjo,-79.716113,-3.747193,La Sierra,3/18/19,9:30:00 PM,3,18,2019,Overflow,Strong current,0,0,0,0,0,0,0,0,1,0,,,,,,5.0,19.0,,,,,,7,7,7,19.0,5.0,3.0,2019-03-19 02:30:00
2788,Desinventar,GUAYAS,EC09,SAMBORONDON,EC0916,TARIFA,EC091651,Varios Sectores,-79.755109,-1.979282,La Costa,5/7/14,6:30:00 PM,5,7,2014,Rain,Heavy precipitation,1,0,0,0,0,0,0,0,0,0,,,,,,,,,,,,,2,7,7,,,,2014-05-07 23:30:00
2825,Desinventar,GUAYAS,EC09,SAMBORONDON,EC0916,TARIFA,EC091651,Riberas del Rio Babahoyo,-79.755173,-1.978242,La Costa,5/16/14,5:30:00 AM,5,16,2014,Rain / Overflow,Heavy precipitation/ Short duration rain,1,1,0,0,0,0,0,0,0,0,,,,,,,,,,,,,5,7,7,,,,2014-05-16 10:30:00
2826,Desinventar,GUAYAS,EC09,SAMBORONDON,EC0916,TARIFA,EC091651,Calles Jacinto Y Guayaquil,-79.755173,-1.978242,La Costa,5/16/14,5:30:00 AM,5,16,2014,Rain,Heavy precipitation/ Urban/ Short duration rain,1,1,0,0,0,1,0,0,0,0,,,,,,,,,,,,,6,7,7,,,,2014-05-16 10:30:00
4129,SNGRE,GUAYAS,EC09,SAMBORONDON,EC0916,SAMBORONDON CABECERA CANTONAL,EC091650,Recinto  Santo Domingo,-79.765467,-1.993655,La Costa,4/4/17,10:00:00 AM,4,4,2017,Rain ,Short duration rain,0,1,0,0,0,0,0,0,0,0,,,,,,,6.0,,,,,,3,7,7,6.0,,2.0,2017-04-04 15:00:00
3303,Desinventar,GUAYAS,EC09,DURAN,EC0907,ELOY ALFARO (DURAN),EC090750,Sector Ferroviaria - Colegio Bachillerato Duran,-79.780493,-2.233418,La Costa,1/19/16,3:30:00 AM,1,19,2016,Long duration rain ,Heavy precipitation,1,0,0,0,0,0,0,0,0,0,,,,,,,,,,,,,2,7,7,,,,2016-01-19 08:30:00
3745,Desinventar,GUAYAS,EC09,DURAN,EC0907,ELOY ALFARO (DURAN),EC090750,Coop. Hermano Gregorio (al lado de las villas del MIDUVI),-79.780493,-2.233418,La Costa,1/30/17,7:30:00 PM,1,30,2017,Rain,Short duration rain,0,1,0,0,0,0,0,0,0,0,,,,,3.0,,23.0,23.0,,,,,3,7,7,23.0,3.0,3.0,2017-01-31 00:30:00
3109,Desinventar,GUAYAS,EC09,DURAN,EC0907,EL RECREO,EC090750,Coop. Una Sola Fuerza Mz. C3 Solar 11.,-79.795729,-2.168141,La Costa,4/3/15,6:00:00 AM,4,3,2015,Rain / Overflow,Heavy precipitation,1,0,0,0,0,0,0,0,0,0,,,,,1.0,,4.0,4.0,,,,,2,7,7,4.0,1.0,1.0,2015-04-03 11:00:00
4860,Desinventar,GUAYAS,EC09,SALITRE,EC0919,EL SALITRE (LAS RAMAS),EC091950,Playones,-79.800519,-1.847826,La Costa,3/22/19,12:18:00 PM,3,22,2019,Rain / Overflow,Heavy precipitation/ Urban,1,0,0,0,0,1,0,0,0,0,,,,,38.0,38.0,152.0,152.0,,,,,3,7,7,152.0,38.0,5.0,2019-03-22 17:18:00
3777,Desinventar,GUAYAS,EC09,DURAN,EC0907,ELOY ALFARO (DURAN),EC090750,Cooperativa Una sola Fuerza Sector 3 mz. J21 sl.13,-79.804374,-2.171058,La Costa,2/4/17,11:00:00 PM,2,4,2017,Rain ,Heavy precipitation,1,0,0,0,0,0,0,0,0,0,,,,,1.0,,2.0,2.0,,,,,2,7,7,2.0,1.0,1.0,2017-02-05 04:00:00
5119,SNGRE_2021,GUAYAS,EC09,DURAN,EC0907,ELOY ALFARO (DURAN),EC090750,Varios Sectores,-79.80658,-2.1628307,La Costa,2/20/20,8:00:00 PM,2,20,2020,Rain,Heavy precipitation/Short duration rain/Urban,1,1,0,0,0,1,0,0,0,0,,,,,44.0,50.0,141.0,,,,,,6,7,7,141.0,50.0,5.0,2020-02-21 01:00:00
2972,SNGRE_2021,GUAYAS,EC09,SALITRE,EC0919,EL SALITRE (LAS RAMAS),EC091950,Sector Briseno,-79.816629,-1.861156,La Costa,2/11/15,8:00:00 AM,2,11,2015,Overflow,Urban/ Small stream overflow,0,0,0,1,0,1,0,0,0,0,,,,,,,8.0,,,,,,5,7,7,8.0,,2.0,2015-02-11 13:00:00
3417,Desinventar,GUAYAS,EC09,SALITRE,EC0919,EL SALITRE (LAS RAMAS),EC091950,Sector Briseno,-79.832622,-1.866717,La Costa,1/28/16,8:00:00 AM,1,28,2016,Rain / Overflow,Heavy precipitation/ Small stream overflow,1,0,0,1,0,0,0,0,0,0,,,,,22.0,,108.0,108.0,,,6.0,30.0,6,7,7,108.0,22.0,5.0,2016-01-28 13:00:00
3846,Desinventar,MANABI,EC13,FLAVIO ALFARO,EC1305,FLAVIO ALFARO,EC130550,La Codicia,-79.899077,-0.302956,La Costa,2/20/17,7:00:00 AM,2,20,2017,Rain ,Heavy precipitation/Urban/ Short duration rain,1,1,0,0,0,1,0,0,0,0,,,,,100.0,,400.0,400.0,,,,,6,7,7,400.0,100.0,5.0,2017-02-20 12:00:00
3371,Desinventar,MANABI,EC13,CHONE,EC1303,RICAURTE,EC130356,Garrapata,-79.951415,-0.554937,La Costa,1/25/16,10:00:00 AM,1,25,2016,Rain ,Heavy precipitation,1,0,0,0,0,0,0,0,0,0,,,,,,,,,,,22.0,,2,7,7,,,,2016-01-25 15:00:00
3425,Desinventar,MANABI,EC13,CHONE,EC1303,RICAURTE,EC130356,Garrapata ,-79.951415,-0.554937,La Costa,2/3/16,6:30:00 AM,2,3,2016,Rain ,Heavy precipitation,1,0,0,0,0,0,0,0,0,0,,,,,,,,,,,45.5,,2,7,7,,,,2016-02-03 11:30:00
3822,Desinventar,MANABI,EC13,CHONE,EC1303,RICAURTE,EC130356,Rio Grande y Rio Garrapata,-79.951415,-0.554937,La Costa,2/11/17,12:09:00 PM,2,11,2017,Rain / Overflow,Surface runoff,0,0,0,0,1,0,0,0,0,0,,,,3.0,17.0,,68.0,68.0,,,,,6,7,7,68.0,17.0,4.0,2017-02-11 17:09:00
3003,Desinventar,MANABI,EC13,CHONE,EC1303,SANTA RITA,EC130350,Varios sectores de la Parroquia.,-79.973813,-0.659334,La Costa,3/16/15,9:30:00 AM,3,16,2015,Rain / Overflow,Heavy precipitation/ Short duration rain,1,1,0,0,0,0,0,0,0,0,,,,,3.0,,15.0,15.0,,,2.0,,5,7,7,15.0,3.0,3.0,2015-03-16 14:30:00
4742,SNGRE,MANABI,EC13,CHONE,EC1303,RICAURTE,EC130356,"/ Garrapatilla, Rio Santo, Estrella, Levante",-80.040811,-0.640308,La Costa,3/7/19,10:00:00 AM,3,7,2019,Rain,Short duration rain,0,1,0,0,0,0,0,0,0,0,,,,,,50.0,200.0,,,18.0,,,3,7,7,200.0,50.0,5.0,2019-03-07 15:00:00
3810,Desinventar,MANABI,EC13,BOLIVAR,EC1302,QUIROGA,EC130252,Via Pichincha ,-80.055351,-0.919941,La Costa,2/9/17,11:52:00 AM,2,9,2017,Rain ,Surface runoff,0,0,0,0,1,0,0,0,0,0,,,,,,,,,,,,,6,7,7,,,,2017-02-09 16:52:00
3181,Desinventar,MANABI,EC13,PEDERNALES,EC1317,10 DE AGOSTO,EC131752,Cuaque - A 600 m del Rio Coaque,-80.080622,-0.17078,La Costa,5/13/15,7:35:00 PM,5,13,2015,Rain ,Heavy precipitation/ Short duration rain,1,1,0,0,0,0,0,0,0,0,,,,,1.0,,6.0,6.0,,,,,5,7,7,6.0,1.0,2.0,2015-05-14 00:35:00
3094,Desinventar,EL ORO,EC07,HUAQUILLAS,EC0707,HUAQUILLAS,EC070750,Cdla. Primero de Mayo,-80.202891,-3.4681,La Costa,3/29/15,3:12:00 AM,3,29,2015,Rain / Overflow,Heavy precipitation,1,0,0,0,0,0,0,0,0,0,,,,,45.0,,115.0,115.0,53.0,,,,2,7,7,115.0,45.0,5.0,2015-03-29 08:12:00
3464,Desinventar,EL ORO,EC07,HUAQUILLAS,EC0707,UNION LOJANA,EC070750,Ciudadela Luz y Vida ,-80.20925,-3.482695,La Costa,2/25/16,1:00:00 AM,2,25,2016,Rain ,Short duration rain,0,1,0,0,0,0,0,0,0,0,,,,,7.0,,32.0,32.0,,,,,3,7,7,32.0,7.0,3.0,2016-02-25 06:00:00
3842,Desinventar,MANABI,EC13,TOSAGUA,EC1315,ANGEL PEDRO GILER (LA ESTANCILLA),EC131552,Varios Sectores,-80.211564,-0.822955,La Costa,2/17/17,3:00:00 AM,2,17,2017,Rain / Overflow,Short duration rain,0,1,0,0,0,0,0,0,0,0,,,,,300.0,,1200.0,1200.0,,,,,3,7,7,1200.0,300.0,6.0,2017-02-17 08:00:00
5125,SNGRE_2021,EL ORO,EC07,HUAQUILLAS,EC0707,HUAQUILLAS,EC070750,"Varios sectores (1ero de Octubre, 9 de Octubre, 8 de Septiembre)",-80.222917,-3.476943,La Costa,2/21/20,1:01:00 AM,2,21,2020,Rain,Urban,0,0,0,0,0,1,0,0,0,0,,,,,11.0,7.0,33.0,,27.0,,,,1,7,7,33.0,11.0,3.0,2020-02-21 06:01:00
5118,SNGRE_2021,MANABI,EC13,JAMA,EC1320,JAMA,EC132050,"Varios sectores (Don Juan Campamento, Salima, Cruz Roja, Matal)",-80.232952,-0.13703,La Costa,2/20/20,5:30:00 AM,2,20,2020,Rain/Overflow,Short duration rain,0,1,0,0,0,0,0,0,0,0,,,,,40.0,25.0,114.0,,,114.0,,,3,7,7,114.0,40.0,5.0,2020-02-20 10:30:00
3320,Desinventar,MANABI,EC13,TOSAGUA,EC1315,ANGEL PEDRO GILER (LA ESTANCILLA),EC131552,Angel Pedro Giler ,-80.235101,-0.818002,La Costa,1/25/16,3:00:00 AM,1,25,2016,Rain ,Heavy precipitation/ Small stream overflow,1,0,0,1,0,0,0,0,0,0,,,,,,,,,,,10.0,5.0,6,7,7,,,,2016-01-25 08:00:00
4584,SNGRE,MANABI,EC13,SAN VICENTE,EC1322,SAN VICENTE,EC132250,Varios Sectores,-80.402064,-0.604432,La Costa,1/10/19,8:50:00 AM,1,10,2019,Rain,Heavy precipitation,1,0,0,0,0,0,0,0,0,0,,,,,,60.0,240.0,,,,,,2,7,7,240.0,60.0,5.0,2019-01-10 13:50:00
3785,Desinventar,MANABI,EC13,SAN VICENTE,EC1322,SAN VICENTE,EC132250,Varios Sectores,-80.40662,-0.597018,La Costa,2/6/17,6:00:00 AM,2,6,2017,Rain,heavy precipitation/ Urban / Short duration rain,1,1,0,0,0,1,0,0,0,0,,,,,600.0,,2000.0,2000.0,,,,,6,7,7,2000.0,600.0,6.0,2017-02-06 11:00:00
5335,SNGRE_2021,NAPO,EC15,QUIJOS,EC1507,SUMACO,EC150756,Riberas del rio Borja,-77.582984,-0.4820302,La Sierra,9/5/20,8:00:00 PM,9,5,2020,Overflow,Surface runoff,0,0,0,0,1,0,0,0,0,0,,,,,,,,,,,,,6,8,7,,,,2020-09-06 01:00:00
2498,SNGRE_2021,CARCHI,EC04,TULCAN,EC0401,EL CARMELO (EL PUN),EC040151,Cabecera Parroquial,-77.5943,0.6659,La Sierra,12/19/13,4:30:00 PM,12,19,2013,Rain ,Heavy precipitation/ Short duration rain,1,1,0,0,0,0,0,0,0,0,,,,,12.0,,7.0,,,,,,5,8,7,7.0,12.0,2.0,2013-12-19 21:30:00
2814,Desinventar,CARCHI,EC04,TULCAN,EC0401,EL CARMELO (EL PUN),EC040151,Playa Alta,-77.627973,0.655311,La Sierra,5/11/14,1:00:00 AM,5,11,2014,Overflow,Small stream overflow,0,0,0,1,0,0,0,0,0,0,,,,,2.0,,9.0,9.0,,,,,4,8,7,9.0,2.0,2.0,2014-05-11 06:00:00
3257,Desinventar,CARCHI,EC04,TULCAN,EC0401,TULCAN,EC040150,Calle Av. Orellana,-77.731547,0.818718,La Sierra,11/4/15,8:30:00 AM,11,4,2015,Rain ,Heavy precipitation/ Short duration rain,1,1,0,0,0,0,0,0,0,0,,,,,,,623.0,623.0,,,,,5,8,7,623.0,,6.0,2015-11-04 13:30:00
3036,Desinventar,CARCHI,EC04,MONTUFAR,EC0405,SAN GABRIEL,EC040550,El Capuli,-77.842563,0.615758,La Sierra,3/20/15,4:00:00 PM,3,20,2015,Rain / Overflow,Heavy precipitation/Short duration rain,1,1,0,0,0,0,0,0,0,0,,,,,3.0,,,,,,,,5,8,7,,3.0,,2015-03-20 21:00:00
2373,Desinventar/SNGRE_2021,CARCHI,EC04,MONTUFAR,EC0405,LA PAZ,EC040554,Barrio Santa Clara,-77.8692,0.5014,La Sierra,5/3/13,4:45:00 PM,5,3,2013,Rain ,Heavy precipitation/ Short duration rain,1,1,0,0,0,0,0,0,0,0,,,,,1.0,,7.0,7.0,,,,,5,8,7,7.0,1.0,2.0,2013-05-03 21:45:00
5305,SNGRE_2021,NAPO,EC15,QUIJOS,EC1507,COSANGA,EC150751,"Lodos Negros, via Y de Baeza - Y de Narupa [E20- E45]",-77.869613,-0.5728487,La Sierra,6/21/20,10:30:00 AM,6,21,2020,Rain,Surface runoff,0,0,0,0,1,0,0,0,0,0,,,,,,,,,,,,,6,8,7,,,,2020-06-21 15:30:00
4997,SNGRE_2021,NAPO,EC15,QUIJOS,EC1507,COSANGA,EC150751,"Los Cedros, via Y de Baeza - Y de Narupa [E20 - E45]",-77.87576,-0.5617878,La Sierra,7/23/19,10:45:00 AM,7,23,2019,Rain,Surface runoff,0,0,0,0,1,0,0,0,0,0,,,,,,,,,,,,,6,8,7,,,,2019-07-23 15:45:00
3130,Desinventar,CARCHI,EC04,BOLIVAR,EC0402,BOLIVAR,EC040250,Apaqui/Piquiucho/Caldera.,-77.892968,0.495167,La Sierra,4/17/15,3:45:00 PM,4,17,2015,Rain,Heavy precipitation/Short duration rain,1,1,0,0,0,0,0,0,0,0,,,,,12.0,,49.0,49.0,,,,,5,8,7,49.0,12.0,3.0,2015-04-17 20:45:00
2371,Desinventar/SNGRE_2021,CARCHI,EC04,BOLIVAR,EC0402,BOLIVAR,EC040250,Cabecera cantonal,-77.9036,0.5033,La Sierra,5/3/13,4:45:00 PM,5,3,2013,Rain ,Heavy precipitation / Short duration rain,1,1,0,0,0,0,0,0,0,0,,,,,13.0,,36.0,36.0,,,,,5,8,7,36.0,13.0,3.0,2013-05-03 21:45:00
1712,SNGRE_2021,IMBABURA,EC10,ANTONIO ANTE,EC1002,ANDRADE MARIN (LOURDES),EC100250,Barrio Santa Bernardita,-78.202852,0.303431,La Sierra,10/4/12,1:15:00 AM,10,4,2012,Rain/ Overflow,Heavy precipitation/ Artificial waterway overflow,1,0,1,0,0,0,0,0,0,0,,,,,1.0,,1.0,,,,,,3,8,7,1.0,1.0,1.0,2012-10-04 06:15:00
2313,Desinventar/SNGRE_2021,IMBABURA,EC10,ANTONIO ANTE,EC1002,ANDRADE MARIN (LOURDES),EC100250,Bolivar -Santa Bernardita los Ovalos,-78.2029,0.3034,La Sierra,4/20/13,1:10:00 AM,4,20,2013,Rain,Heavy precipitation/Short duration rain,1,1,0,0,0,0,0,0,0,0,,,,,4.0,,12.0,12.0,,,,,5,8,7,12.0,4.0,3.0,2013-04-20 06:10:00
4264,SNGRE,IMBABURA,EC10,ANTONIO ANTE,EC1002,SAN ROQUE,EC100254,El Cerotal,-78.218661,0.287761,La Sierra,5/16/17,3:30:00 PM,5,16,2017,Rain,Heavy precipitation/ Urban ,1,0,0,0,0,1,0,0,0,0,,,,,,,47.0,,,,,,3,8,7,47.0,,3.0,2017-05-16 20:30:00
3669,Desinventar,IMBABURA,EC10,ANTONIO ANTE,EC1002,SAN ROQUE,EC100254,La Merced,-78.238177,0.314054,La Sierra,11/11/16,3:00:00 PM,11,11,2016,Rain / Overflow,Heavy precipitation/ Artificial waterway overflow,1,0,1,0,0,0,0,0,0,0,,,,,2.0,,4.0,4.0,,,,,3,8,7,4.0,2.0,1.0,2016-11-11 20:00:00
4288,SNGRE_2021,TUNGURAHUA,EC18,BAÑOS DE AGUA SANTA,EC1802,RÍO NEGRO,EC180252,Colonia Los Llanganates,-78.263236,-1.3725985,La Sierra,7/22/17,11:38:00 AM,7,22,2017,Rain,Surface runoff,0,0,0,0,1,0,0,0,0,0,,,,,,,,,,,,,6,8,7,,,,2017-07-22 16:38:00
5038,SNGRE_2021,MORONA SANTIAGO,EC14,LIMON INDANZA,EC1403,GRAL. LEONIDAS PLAZA GUTIERREZ,EC140350,Varios sectores,-78.43139,-2.96671,La Sierra,11/14/19,11:18:00 PM,11,14,2019,Rain/ Overflow,Urban/ Small stream overflow,0,0,0,1,0,1,0,0,0,0,,2.0,,,5.0,5.0,20.0,,,,,,5,8,7,20.0,5.0,3.0,2019-11-15 04:18:00
5213,SNGRE_2021,PICHINCHA,EC17,QUITO,EC1701,AMAGUANA,EC170152,"Santa Isabel, calle Cacha y Foto",-78.48126,-0.3381448,La Sierra,3/12/20,6:52:00 PM,3,12,2020,Rain/Overflow,Artificial waterway overflow/Small stream overflow/Urban,0,0,1,1,0,1,0,0,0,0,,,,,1.0,,,,,,,,6,8,7,,1.0,,2020-03-12 23:52:00
4914,SNGRE,TUNGURAHUA,EC18,﻿SANTIAGO DE PILLARO,EC1808,SAN JOSE DE POALO,EC180856,"Barrio Santo Domingo, via San Jose de Poalo - El Censo",-78.482139,-1.122735,La Sierra,4/5/19,6:34:00 PM,4,5,2019,Rain,Surface runoff,0,0,0,0,1,0,0,0,0,0,,,,,,,,,,,,,6,8,7,,,,2019-04-05 23:34:00
2149,Desinventar/SNGRE_2021,PICHINCHA,EC17,QUITO,EC1701,AMAGUANA,EC170152,La Vaqueria y el centro de la poblacion de Amaguana,-78.5072,-0.3804,La Sierra,3/17/13,3:30:00 PM,3,17,2013,Rain ,Heavy precipitation/ Short duration rain,1,1,0,0,0,0,0,0,0,0,,,,,,,,,,,,,5,8,7,,,,2013-03-17 20:30:00
4221,Desinventar,PICHINCHA,EC17,QUITO,EC1701,AMAGUANA,EC170152,Calle Cesar Aguirre y Libertadores,-78.509909,-0.363584,La Sierra,4/25/17,4:10:00 PM,4,25,2017,Rain / Overflow,Small stream overflow,0,0,0,1,0,0,0,0,0,0,,,,,3.0,,10.0,10.0,,,,,4,8,7,10.0,3.0,2.0,2017-04-25 21:10:00
2179,Desinventar/SNGRE_2021,MORONA SANTIAGO,EC14,LIMON INDANZA,EC1403,GRAL. LEONIDAS PLAZA GUTIERREZ,EC140350,Centro de la ciudad,-78.5332,-2.9862,La Sierra,3/22/13,8:00:00 PM,3,22,2013,Rain,Heavy precipitation/ Urban,1,0,0,0,0,1,0,0,0,0,,,,,,,,,,,,,3,8,7,,,,2013-03-23 01:00:00
4899,SNGRE_2021,PICHINCHA,EC17,MEJIA,EC1703,CUTUGLAHUA,EC170353,Escuela - Santo Domingo / calle La Isla,-78.555606,-0.3834924,La Sierra,4/3/19,4:31:00 PM,4,3,2019,,Surface runoff,0,0,0,0,1,0,0,0,0,0,,,,,5.0,5.0,31.0,,,,,,6,8,7,31.0,5.0,3.0,2019-04-03 21:31:00
5055,SNGRE_2021,TUNGURAHUA,EC18,AMBATO,EC1801,IZAMBA,EC180156,"Parque Central Izamba, calles Alfonso Troya y Napoleon Tacoaman.",-78.586891,-1.228667,La Sierra,12/8/19,7:10:00 PM,12,8,2019,Rain,Heavy precipitation/ Urban,1,0,0,0,0,1,0,0,0,0,,,,,1.0,,,,2.0,,,,3,8,7,,1.0,,2019-12-09 00:10:00
3863,Desinventar,TUNGURAHUA,EC18,AMBATO,EC1801,IZAMBA,EC180156,Izamba/Av. Pedro Vascones y Rafael Darquea. ,-78.591148,-1.23017,La Sierra,2/23/17,5:47:00 PM,2,23,2017,Rain / Overflow,Heavy precipitation/ Artificial waterway overflow/ Short duration rain,1,1,1,0,0,0,0,0,0,0,,,,,3.0,,,,,,,,6,8,7,,3.0,,2017-02-23 22:47:00
4993,SNGRE,TUNGURAHUA,EC18,AMBATO,EC1801,ATAHUALPA (CHISALATA),EC180152,"El Pisque La Union, ref. a cinco cuadras de la Esforse en la via a Quito.",-78.598786,-1.206666,La Sierra,7/14/19,9:22:00 PM,7,14,2019,Rain / Overflow,Artificial waterway overflow/ Small stream overflow ,0,0,1,1,0,0,0,0,0,0,,,,,,,,,,,,,5,8,7,,,,2019-07-15 02:22:00
3010,Desinventar,TUNGURAHUA,EC18,CEVALLOS,EC1803,CEVALLOS,EC180350,Via a Cevallos- Barrio Agua Santa Av. 24 de Mayo.,-78.609376,-1.350812,La Sierra,3/18/15,12:17:00 PM,3,18,2015,Rain ,Heavy precipitation/ Artificial waterway overflow,1,0,1,0,0,0,0,0,0,0,,,,,,,,,,,,,3,8,7,,,,2015-03-18 17:17:00
3023,Desinventar,TUNGURAHUA,EC18,AMBATO,EC1801,HUACHI LORETO,EC180150,"Selva Alegre y Manuel Mateu, ref. Frente al conjunto habitac",-78.620393,-1.24578,La Sierra,3/19/15,3:57:00 PM,3,19,2015,Rain,Heavy precipitation/ Short duration rain,1,1,0,0,0,0,0,0,0,0,,,,,1.0,,,,,,,,5,8,7,,1.0,,2015-03-19 20:57:00
4956,SNGRE_2021,TUNGURAHUA,EC18,AMBATO,EC1801,HUACHI LORETO,EC180150,Calle Eugenio Espejo entre calle Milagro y Av. 12 de Noviembre,-78.623973,-1.242706,La Sierra,6/2/19,5:56:00 AM,6,2,2019,Rain,Surface runoff,0,0,0,0,1,0,0,0,0,0,,,,,,,,,,,,,6,8,7,,,,2019-06-02 10:56:00
3019,Desinventar,TUNGURAHUA,EC18,AMBATO,EC1801,AMBATO,EC180150,Calle Dr. Remigio Crespo Toral entre Marcos Montalvo y  Jorg,-78.641568,-1.261405,La Sierra,3/19/15,4:03:00 PM,3,19,2015,Rain,Heavy precipitation/ Short duration rain,1,1,0,0,0,0,0,0,0,0,,,,,2.0,,,,,,,,5,8,7,,2.0,,2015-03-19 21:03:00
5034,SNGRE_2021,TUNGURAHUA,EC18,AMBATO,EC1801,SAN BARTOLOME DE PINLLOG,EC180163,"Calle El Cacao y la Prolongacion de la calle Cronica, via Andiglata - Pinllo.",-78.644391,-1.224589,La Sierra,11/11/19,2:00:00 AM,11,11,2019,Rain,Surface runoff,0,0,0,0,1,0,0,0,0,0,,,,,,,,,,,,,6,8,7,,,,2019-11-11 07:00:00
3290,Desinventar,COTOPAXI,EC05,SAQUISILI,EC0506,SAQUISILI,EC050650,Barrio Miraflores,-78.665524,-0.830807,La Sierra,1/6/16,6:00:00 PM,1,6,2016,Rain,Short duration rain,0,1,0,0,0,0,0,0,0,0,,,,,2.0,,5.0,5.0,,,,,3,8,7,5.0,2.0,1.0,2016-01-06 23:00:00
1900,SNGRE_2021,CHIMBORAZO,EC06,RIOBAMBA,EC0601,LIZARZABURU,EC060150,Sector Media Luna; Calles Brasil y Gonzales; Sector de la Politecnica; Barrio Las Retamas; Calles Estiven Maranon y Fernando Sanchez de Lozada,-78.6746,-1.664,La Sierra,2/11/13,6:00:00 PM,2,11,2013,Rain ,Heavy precipitation/ Short duration rain/ Urban,1,1,0,0,0,1,0,0,0,0,1.0,,,,7.0,,35.0,,,,,,6,8,7,35.0,7.0,3.0,2013-02-11 23:00:00
4258,Desinventar,TUNGURAHUA,EC18,TISALEO,EC1809,TISALEO,EC180950,"Bellavista, Caserio Santa Lucia Arriba",-78.685245,-1.366394,La Sierra,5/15/17,4:00:00 PM,5,15,2017,Rain ,Surface runoff,0,0,0,0,1,0,0,0,0,0,,,,,1.0,,2.0,,,,,,6,8,7,2.0,1.0,1.0,2017-05-15 21:00:00
5089,SNGRE_2021,TUNGURAHUA,EC18,TISALEO,EC1809,QUINCHICOTO,EC180951,Santa Marianita y La Union,-78.696597,-1.382321,La Sierra,1/22/20,9:00:00 PM,1,22,2020,Rain,Surface runoff,0,0,0,0,1,0,0,0,0,0,,,,,9.0,13.0,49.0,,,33.0,1.16,,6,8,7,49.0,13.0,3.0,2020-01-23 02:00:00
5091,SNGRE_2021,COTOPAXI,EC05,SAQUISILI,EC0506,CANCHAGUA,EC050651,Calle Armando Soto y Enrique Ramos,-78.730564,-0.791017,La Sierra,1/24/20,5:00:00 PM,1,24,2020,Rain,Surface runoff,0,0,0,0,1,0,0,0,0,0,,,,,1.0,1.0,14.0,,,,,,6,8,7,14.0,1.0,3.0,2020-01-24 22:00:00
2495,SNGRE_2021,AZUAY,EC01,CHORDELEG,EC0111,CHORDELEG,EC011150,Centro Cantonal,-78.7771,-2.9246,La Sierra,12/10/13,9:15:00 AM,12,10,2013,Rain,Short duration rain,0,1,0,0,0,0,0,0,0,0,,,,,,,,,,,,,3,8,7,,,,2013-12-10 14:15:00
4900,SNGRE,AZUAY,EC01,GUALACEO,EC0103,GUALACEO,EC010350,Nushuncay,-78.797237,-2.909464,La Sierra,4/3/19,4:30:00 PM,4,3,2019,Rain,Small stream overflow,0,0,0,1,0,0,0,0,0,0,,,,,,3.0,7.0,,,7.0,,,4,8,7,7.0,3.0,2.0,2019-04-03 21:30:00
1715,SNGRE_2021,AZUAY,EC01,GUALACEO,EC0103,GUALACEO,EC010350,Urbano de Gualaceo,-78.799322,-2.894696,La Sierra,10/6/12,5:00:00 PM,10,6,2012,Rain/ Overflow,Heavy precipitation/ Urban,1,0,0,0,0,1,0,0,0,0,,,,,1.0,,,,,,,,3,8,7,,1.0,,2012-10-06 22:00:00
4896,Desinventar,AZUAY,EC01,GUALACEO,EC0103,GUALACEO,EC010350,Cristo Rey,-78.812475,-2.917714,La Sierra,4/2/19,3:30:00 PM,4,2,2019,Rain / Overflow,Small stream overflow,0,0,0,1,0,0,0,0,0,0,,,,,6.0,6.0,14.0,14.0,,,,,4,8,7,14.0,6.0,3.0,2019-04-02 20:30:00
3529,Desinventar,TUNGURAHUA,EC18,AMBATO,EC1801,PILAGUIN (PILAHUIN),EC180161,Echaleche ,-78.835429,-1.347051,La Sierra,3/10/16,12:55:00 AM,3,10,2016,Rain ,Short duration rain,0,1,0,0,0,0,0,0,0,0,,,,,1.0,,5.0,5.0,,,,,3,8,7,5.0,1.0,1.0,2016-03-10 05:55:00
2187,Desinventar/SNGRE_2021,CANAR,EC03,AZOGUES,EC0301,AZOGUES,EC030150,Calle Antonio Jose de Sucre y Camilo Ponce Enriquez,-78.8556,-2.7455,La Sierra,3/24/13,11:30:00 PM,3,24,2013,Rain ,Heavy precipitation/ Urban,1,0,0,0,0,1,0,0,0,0,,,,,,,,,,,,,3,8,7,,,,2013-03-25 04:30:00
1778,SNGRE_2021,CANAR,EC03,AZOGUES,EC0301,AZOGUES,EC030150,Centro de la ciudad,-78.855621,-2.745477,La Sierra,11/28/12,2:50:00 PM,11,28,2012,Rain,Heavy precipitation/ Short duration rain/Urban,1,1,0,0,0,1,0,0,0,0,,,,,5.0,,,,,,,,6,8,7,,5.0,,2012-11-28 19:50:00
5163,SNGRE_2021,CANAR,EC03,BIBLIAN,EC0302,BIBLIAN,EC030250,Entrada Feria de Ganado - Quebrada San Luis,-78.897271,-2.70667,La Sierra,2/26/20,4:29:00 PM,2,26,2020,Rain/Overflow,Small stream overflow,0,0,0,1,0,0,0,0,0,0,,,,,1.0,1.0,6.0,,,,,,4,8,7,6.0,1.0,2.0,2020-02-26 21:29:00
4692,Desinventar,CANAR,EC03,BIBLIAN,EC0302,TURUPAMBA,EC030253,Cochahuayco,-78.907899,-2.723763,La Sierra,2/26/19,3:28:00 PM,2,26,2019,Rain / Overflow,Small stream overflow,0,0,0,1,0,0,0,0,0,0,,,,,1.0,2.0,5.0,5.0,,,,,4,8,7,5.0,2.0,1.0,2019-02-26 20:28:00
1874,SNGRE_2021,CANAR,EC03,BIBLIAN,EC0302,BIBLIAN,EC030250,"Complejo Deportivo ""Los Chirijos""",-78.9083,-2.6656,La Sierra,2/4/13,4:30:00 PM,2,4,2013,Rain ,Heavy precipitation/ Short duration rain,1,1,0,0,0,0,0,0,0,0,,,,,,,,,,,,,5,8,7,,,,2013-02-04 21:30:00
2497,Desinventar/SNGRE_2021,CANAR,EC03,BIBLIAN,EC0302,BIBLIAN,EC030250,Centro Cantonal,-78.9083,-2.6656,La Sierra,12/18/13,3:31:00 PM,12,18,2013,Rain ,Heavy precipitation/ Urban ,1,0,0,0,0,1,0,0,0,0,,,,,,,,,,,,,3,8,7,,,,2013-12-18 20:31:00
1739,SNGRE_2021,ZAMORA CHINCHIPE,EC19,ZAMORA,EC1901,ZAMORA,EC190150,"Barrio La Peninsula, Escuela Luis Felipe Borja y el sector El Cati.",-78.988463,-4.186137,La Sierra,10/24/12,10:00:00 PM,10,24,2012,Rain,Heavy precipitation/ Short duration rain/Urban,1,1,0,0,0,1,0,0,0,0,,,,,,,,,,,,,6,8,7,,,,2012-10-25 03:00:00
4342,SNGRE/Desinventar,ZAMORA CHINCHIPE,EC19,ZAMORA,EC1901,ZAMORA,EC190150,Toscano (Parque Nacional Podocarpus),-78.988463,-4.186137,La Sierra,12/26/17,4:00:00 PM,12,26,2017,Rain / Overflow,Small stream overflow,0,0,0,1,0,0,0,0,0,0,,,7.0,,,,,,,,,,4,8,7,,,,2017-12-26 21:00:00
3574,Desinventar,BOLIVAR,EC02,SAN MIGUEL,EC0205,SAN MIGUEL,EC020550,Barrio America y Paraiso de los Andes,-79.041672,-1.711238,La Sierra,4/3/16,4:25:00 PM,4,3,2016,Rain,Heavy precipitation/ Urban ,1,0,0,0,0,1,0,0,0,0,,,,,12.0,,42.0,42.0,,,,,3,8,7,42.0,12.0,3.0,2016-04-03 21:25:00
1888,SNGRE_2021,CANAR,EC03,CANAR,EC0303,DUCUR,EC030363,UPC Ducur,-79.1741,-2.4667,La Sierra,2/9/13,3:00:00 AM,2,9,2013,Rain ,Heavy precipitation/ Short duration rain,1,1,0,0,0,0,0,0,0,0,,,,,,,,,,,,,5,8,7,,,,2013-02-09 08:00:00
2684,Desinventar,LOJA,EC11,LOJA,EC1101,VALLE,EC110150,La Inmaculada,-79.207274,-3.967514,La Sierra,3/8/14,1:00:00 PM,3,8,2014,Rain,Heavy precipitation/ Urban/ Short duration rain,1,1,0,0,0,1,0,0,0,0,,,,,14.0,,70.0,70.0,,,,,6,8,7,70.0,14.0,4.0,2014-03-08 18:00:00
1810,Desinventar/SNGRE_2021,LOJA,EC11,LOJA,EC1101,VALLE,EC110150,Jipiro Alto,-79.2104,-3.954,La Sierra,1/17/13,8:30:00 PM,1,17,2013,Rain,Heavy precipitation/ Short duration rain,1,1,0,0,0,0,0,0,0,0,,,,,1.0,,5.0,5.0,,5.0,,,5,8,7,5.0,1.0,1.0,2013-01-18 01:30:00
1809,Desinventar/SNGRE_2021,LOJA,EC11,LOJA,EC1101,VALLE,EC110150,San Cayetano,-79.2108,-3.9304,La Sierra,1/17/13,8:30:00 PM,1,17,2013,Rain,Heavy precipitation/ Urban,1,0,0,0,0,1,0,0,0,0,,,,,2.0,,10.0,10.0,,,,,3,8,7,10.0,2.0,2.0,2013-01-18 01:30:00
1844,Desinventar/SNGRE_2021,LOJA,EC11,LOJA,EC1101,VALLE,EC110150,Plaza del Valle; Jipiro Alto; Hipervalle; San Cayetano Bajo;,-79.2108,-3.9304,La Sierra,1/24/13,10:00:00 PM,1,24,2013,Rain,Heavy precipitation/ Urban / Short duration rain,1,1,0,0,0,1,0,0,0,0,,,,,,,,,,,,,6,8,7,,,,2013-01-25 03:00:00
1885,SNGRE_2021,LOJA,EC11,LOJA,EC1101,VALLE,EC110150,Consacola ,-79.2108,-3.9304,La Sierra,2/4/13,10:00:00 PM,2,4,2013,Rain,Heavy precipitation/ Short duration rain/ Urban,1,1,0,0,0,1,0,0,0,0,,,,,1.0,,4.0,,,,,,6,8,7,4.0,1.0,1.0,2013-02-05 03:00:00
1910,SNGRE_2021,LOJA,EC11,LOJA,EC1101,VALLE,EC110150,"Consacola, Las Pitas, Turunuma, Motupe, La Paz. ",-79.2108,-3.9304,La Sierra,2/13/13,10:30:00 PM,2,13,2013,Rain,Heavy precipitation/ Short duration rain/ Urban,1,1,0,0,0,1,0,0,0,0,,,,,,,,,,,,,6,8,7,,,,2013-02-14 03:30:00
2678,Desinventar,LOJA,EC11,LOJA,EC1101,VALLE,EC110150,Barrio La Banda y Sauces Norte,-79.210801,-3.930364,La Sierra,3/4/14,3:00:00 PM,3,4,2014,Rain,Heavy precipitation/ Urban/ Short duration rain,1,1,0,0,0,1,0,0,0,0,,,,,10.0,,55.0,55.0,,,,,6,8,7,55.0,10.0,4.0,2014-03-04 20:00:00
2871,Desinventar,LOJA,EC11,LOJA,EC1101,LOJA CABECERA CANTONAL Y CAPIT,EC110150,San Cayetano Bajo,-79.210801,-3.930364,La Sierra,10/9/14,5:44:00 PM,10,9,2014,Rain ,Heavy precipitation / Short duration rain,1,1,0,0,0,0,0,0,0,0,,,,,2.0,,5.0,5.0,,,,,5,8,7,5.0,2.0,1.0,2014-10-09 22:44:00
2873,Desinventar,LOJA,EC11,LOJA,EC1101,VALLE,EC110150,"Nueva Granada, La Banda, Ciudadela del Chofer, Las Pitas.",-79.210801,-3.930364,La Sierra,10/9/14,7:00:00 PM,10,9,2014,Rain,Heavy precipitation/ Urban,1,1,0,0,0,0,0,0,0,0,,,,,4.0,,15.0,15.0,,,,,5,8,7,15.0,4.0,3.0,2014-10-10 00:00:00
2895,Desinventar,LOJA,EC11,LOJA,EC1101,VALLE,EC110150,Barrio San Cayetano,-79.210801,-3.930364,La Sierra,10/25/14,5:30:00 PM,10,25,2014,Rain,Heavy precipitation/ Urban/ Short duration rain,1,1,0,0,0,1,0,0,0,0,,,,,4.0,,13.0,13.0,,,,,6,8,7,13.0,4.0,3.0,2014-10-25 22:30:00
4212,Desinventar,LOJA,EC11,LOJA,EC1101,VALLE,EC110150,Jipiro Alto,-79.210801,-3.930364,La Sierra,4/21/17,1:40:00 PM,4,21,2017,Rain / Overflow,Small stream overflow,0,0,0,1,0,0,0,0,0,0,,,,,2.0,,8.0,8.0,,,,,4,8,7,8.0,2.0,2.0,2017-04-21 18:40:00
1752,SNGRE_2021,LOJA,EC11,SARAGURO,EC1111,SARAGURO,EC111150,Centro de la Ciudad - Calle 31 de Diciembre entre Reinoso de Quito.,-79.233624,-3.635359,La Sierra,11/12/12,4:00:00 PM,11,12,2012,Rain,Heavy precipitation/ Short duration rain/Urban,1,1,0,0,0,1,0,0,0,0,,,,,1.0,,4.0,,,,,,6,8,7,4.0,1.0,1.0,2012-11-12 21:00:00
2191,Desinventar/SNGRE_2021,LOJA,EC11,SARAGURO,EC1111,SARAGURO,EC111150,Guayaquil y Reina De Quito,-79.2371,-3.621,La Sierra,3/24/13,4:00:00 PM,3,24,2013,Rain,Heavy precipitation/ Urban/ Short duration rain,1,1,0,0,0,1,0,0,0,0,,,,,2.0,,10.0,10.0,,,,,6,8,7,10.0,2.0,2.0,2013-03-24 21:00:00
2673,Desinventar,LOJA,EC11,SARAGURO,EC1111,SARAGURO,EC111150,Ilincho,-79.259069,-3.6377,La Sierra,3/3/14,11:10:00 AM,3,3,2014,Rain,Heavy precipitation/ Urban/ Short duration rain,1,1,0,0,0,1,0,0,0,0,,,,,2.0,,15.0,15.0,,,,,6,8,7,15.0,2.0,3.0,2014-03-03 16:10:00
2568,Desinventar,LOS RIOS,EC12,MONTALVO,EC1203,MONTALVO,EC120350,Varios Recintos,-79.281289,-1.785894,La Sierra,1/23/14,7:30:00 AM,1,23,2014,Rain ,Heavy precipitation / Short duration rain,1,1,0,0,0,0,0,0,0,0,,,,,,,205.0,205.0,3.0,,,,5,8,7,205.0,,5.0,2014-01-23 12:30:00
4386,Desinventar,BOLIVAR,EC02,ECHEANDIA,EC0204,ECHEANDIA,EC020450,Camaron,-79.296359,-1.442854,La Sierra,2/23/18,10:00:00 AM,2,23,2018,Rain / Overflow,Short duration rain,0,1,0,0,0,0,0,0,0,0,,,,,,,15.0,,10.0,,,,3,8,7,15.0,,3.0,2018-02-23 15:00:00
3875,Desinventar,LOS RIOS,EC12,MONTALVO,EC1203,MONTALVO,EC120350,Rcto. Las Balsas,-79.327892,-1.823181,La Costa,2/27/17,6:20:00 PM,2,27,2017,Rain / Overflow,Heavy precipitation/ Short duration rain,1,1,0,0,0,0,0,0,0,0,,,,,2.0,,14.0,14.0,,,,,5,8,7,14.0,2.0,3.0,2017-02-27 23:20:00
3859,Desinventar,LOS RIOS,EC12,MONTALVO,EC1203,MONTALVO,EC120350,"Caimito, Los Almendros, La Rosalia, La Maritza, 24 de Mayo, ",-79.333582,-1.849093,La Costa,2/22/17,7:00:00 AM,2,22,2017,Rain / Overflow,Heavy precipitation/ Short duration rain,1,1,0,0,0,0,0,0,0,0,,,,,87.0,,330.0,330.0,,,183.0,79.0,5,8,7,330.0,87.0,5.0,2017-02-22 12:00:00
2600,Desinventar/SNGRE_2021,LOJA,EC11,QUILANGA,EC1115,QUILANGA,EC111550,Centro de la Ciudad,-79.402016,-4.297137,La Sierra,2/4/14,6:30:00 PM,2,4,2014,Rain,Heavy precipitation/ Urban ,1,0,0,0,0,1,0,0,0,0,,,,,4.0,,20.0,20.0,,,,,3,8,7,20.0,4.0,3.0,2014-02-04 23:30:00
4529,SNGRE,EL ORO,EC07,PORTOVELO,EC0711,SALATI,EC071153,El Chunchi,-79.535756,-3.753267,La Sierra,11/16/18,7:44:00 PM,11,16,2018,Rain,Short duration rain,0,1,0,0,0,0,0,0,0,0,,,,,,,5.0,,,,,,3,8,7,5.0,,1.0,2018-11-17 00:44:00
2345,Desinventar/SNGRE_2021,LOS RIOS,EC12,PUEBLOVIEJO,EC1204,PUEBLOVIEJO,EC120450,Pto Pechiche Recinto El Limal,-79.541,-1.5544,La Costa,4/22/13,10:00:00 AM,4,22,2013,Rain ,Short duration rain,0,1,0,0,0,0,0,0,0,0,,,,,1.0,,4.0,4.0,,,,,3,8,7,4.0,1.0,1.0,2013-04-22 15:00:00
3996,Desinventar,LOJA,EC11,CALVAS,EC1102,CARIAMANGA,EC110250,"Varios Sectores (IV Centenario, Ciudadelas amazonas, Barrio ",-79.553778,-4.325042,La Sierra,3/24/17,7:00:00 PM,3,24,2017,Rain ,Small stream overflow,0,0,0,1,0,0,0,0,0,0,,,,6.0,54.0,,24.0,237.0,,76.0,,,4,8,7,237.0,54.0,5.0,2017-03-25 00:00:00
1728,SNGRE_2021,LOJA,EC11,CALVAS,EC1102,CARIAMANGA,EC110250,Barrio Central - Calle Clotario Paz,-79.573904,-4.361277,La Sierra,10/19/12,2:30:00 PM,10,19,2012,Rain,Heavy precipitation/ Short duration rain/Urban,1,1,0,0,0,1,0,0,0,0,,,,,1.0,,5.0,,,,,,6,8,7,5.0,1.0,1.0,2012-10-19 19:30:00
4769,SNGRE,GUAYAS,EC09,ALFREDO BAQUERIZO MORENO,EC0902,ALFREDO BAQUERIZO MORENO (JUJA,EC090250,Varios Sectores,-79.600501,-1.986528,La Costa,3/14/19,7:30:00 AM,3,14,2019,Rain / Overflow,Heavy precipitation/ Small stream overflow,1,0,0,1,0,0,0,0,0,0,,,,,,1029.0,3005.0,,,50.0,245.0,,6,8,7,3005.0,1029.0,,2019-03-14 12:30:00
1904,SNGRE_2021,EL ORO,EC07,PORTOVELO,EC0711,PORTOVELO,EC071150,Colegio 13 de mayo,-79.6086,-3.7255,La Sierra,2/12/13,12:30:00 AM,2,12,2013,Rain,Heavy precipitation / Urban,1,0,0,0,0,1,0,0,0,0,,,,,1.0,,4.0,,,,,,3,8,7,4.0,1.0,1.0,2013-02-12 05:30:00
1730,SNGRE_2021,LOJA,EC11,CALVAS,EC1102,CHILE,EC110250,Tierras Coloradas,-79.610964,-4.277781,La Sierra,10/19/12,3:00:00 PM,10,19,2012,Rain,Heavy precipitation/ Short duration rain/Urban,1,1,0,0,0,1,0,0,0,0,,,,,1.0,,3.0,,,,,,6,8,7,3.0,1.0,1.0,2012-10-19 20:00:00
4061,Desinventar,MANABI,EC13,FLAVIO ALFARO,EC1305,FLAVIO ALFARO,EC130550,Varios Sectores,-79.905697,-0.404666,La Costa,3/29/17,3:10:00 AM,3,29,2017,Rain / Overflow,Heavy precipitation/ Short duration rain,1,1,0,0,0,0,0,0,0,0,,,,,30.0,,80.0,120.0,,,,,5,8,7,120.0,30.0,5.0,2017-03-29 08:10:00
4931,SNGRE,MANABI,EC13,FLAVIO ALFARO,EC1305,FLAVIO ALFARO,EC130550,San Francisco De Novillo (Cab. En Novillo). Centro Parroquial,-79.905706,-0.40471,La Costa,4/30/19,1:00:00 AM,4,30,2019,Rain / Overflow,Surface runoff,0,0,0,0,1,0,0,0,0,0,,,,,,12.0,40.0,,,25.0,,,6,8,7,40.0,12.0,3.0,2019-04-30 06:00:00
3820,Desinventar,MANABI,EC13,FLAVIO ALFARO,EC1305,FLAVIO ALFARO,EC130550,Varios Sectores,-79.906326,-0.403237,La Costa,2/11/17,6:00:00 AM,2,11,2017,Rain / Overflow,Heavy precipitation/ Urban ,1,0,0,0,0,1,0,0,0,0,,,,,220.0,,880.0,880.0,,,,,3,8,7,880.0,220.0,6.0,2017-02-11 11:00:00
4731,SNGRE,MANABI,EC13,FLAVIO ALFARO,EC1305,FLAVIO ALFARO,EC130550,Varios Sectores,-79.908388,-0.405785,La Costa,3/7/19,7:00:00 AM,3,7,2019,Rain,Surface runoff,0,0,0,0,1,0,0,0,0,0,,,,,,43.0,149.0,,,186.0,,,6,8,7,149.0,43.0,5.0,2019-03-07 12:00:00
2973,Desinventar,GUAYAS,EC09,PALESTINA,EC0913,PALESTINA,EC091350,"Recinto El Carmen, Via El Carmen - La Corona",-79.915081,-1.647261,La Costa,2/11/15,9:00:00 PM,2,11,2015,Rain / Overflow,Small stream overflow,0,0,0,1,0,0,0,0,0,0,,,,,,,,,,,,,4,8,7,,,,2015-02-12 02:00:00
2074,Desinventar/SNGRE_2021,GUAYAS,EC09,PALESTINA,EC0913,PALESTINA,EC091350,Recinto Juanita de las Mercedes como referencia a 12 Km de v,-79.9193,-1.6368,La Costa,3/9/13,10:00:00 PM,3,9,2013,Rain,Heavy precipitation/ Short duration rain,1,1,0,0,0,0,0,0,0,0,,,,,,,,137.0,,,,,5,8,7,137.0,,5.0,2013-03-10 03:00:00
2024,Desinventar/SNGRE_2021,GUAYAS,EC09,PALESTINA,EC0913,PALESTINA,EC091350,Recinto El Pijio,-79.9197,-1.6507,La Costa,3/5/13,8:20:00 PM,3,5,2013,Rain,Heavy precipitation/ Short duration rain,1,1,0,0,0,0,0,0,0,0,,,,7.0,12.0,,,289.0,,,,,5,8,7,289.0,12.0,5.0,2013-03-06 01:20:00
4788,SNGRE,MANABI,EC13,CHONE,EC1303,CANUTO,EC130352,Via Tarugo,-80.070219,-0.776364,La Costa,3/17/19,2:00:00 PM,3,17,2019,Rain / Overflow,Surface runoff,0,0,0,0,1,0,0,0,0,0,,,,,,1.0,3.0,,,,1.0,,6,8,7,3.0,1.0,1.0,2019-03-17 19:00:00
3527,Desinventar,ZAMORA CHINCHIPE,EC19,YANTZAZA,EC1905,LOS ENCUENTROS,EC190553,Los Encuentros,-78.649576,-3.760811,La Sierra,3/10/16,3:00:00 PM,3,10,2016,Rain ,Urban/ Strong current,0,0,0,0,0,1,0,0,1,0,,,,,,,,,,,,,8,4,8,,,,2016-03-10 20:00:00
3780,Desinventar,GUAYAS,EC09,EMPALME,EC0908,VELASCO IBARRA (CAB. EL EMPALM,EC090850,Cooperativa Atilio Velez Aray sector 4 ,-79.6276,-1.049926,La Costa,2/5/17,2:15:00 AM,2,5,2017,Rain,Heavy precipitation/ Surface runoff,1,0,0,0,1,0,0,0,0,0,,,,,1.0,,3.0,3.0,,,,,8,4,8,3.0,1.0,1.0,2017-02-05 07:15:00
2805,SNGRE,GUAYAS,EC09,GUAYAQUIL,EC0901,TARQUI,EC090150,Colegio replica Vicente Rocafuerte ubicado en Socio Vivienda 1,-79.962874,-2.133547,La Costa,5/7/14,8:17:00 PM,5,7,2014,Rain,Heavy precipitation/ Surface runoff,1,0,0,0,1,0,0,0,0,0,,,,,,,,,,,,,8,4,8,,,,2014-05-08 01:17:00
3747,Desinventar,EL ORO,EC07,HUAQUILLAS,EC0707,HUAQUILLAS,EC070750,Cdla. Las Amazonas,-80.170761,-3.454229,La Costa,1/31/17,12:19:00 AM,1,31,2017,Rain,Urban/ Strong current,0,0,0,0,0,1,0,0,1,0,,,,,1.0,,8.0,8.0,,8.0,,,8,4,8,8.0,1.0,2.0,2017-01-31 05:19:00
4751,SNGRE,MANABI,EC13,TOSAGUA,EC1315,TOSAGUA,EC131550,Varios Sectores,-80.235072,-0.784074,La Costa,3/7/19,7:00:00 AM,3,7,2019,Rain / Overflow,Heavy precipitationv/ Surface runoff,1,0,0,0,1,0,0,0,0,0,,,,,,16.0,57.0,,,,,,8,4,8,57.0,16.0,4.0,2019-03-07 12:00:00
3318,Desinventar,MANABI,EC13,JIPIJAPA,EC1306,AMERICA,EC130651,Por El infocentro ,-80.474567,-1.442331,La Costa,1/25/16,5:00:00 AM,1,25,2016,Rain ,Heavy precipitation/ Surface runoff,1,0,0,0,1,0,0,0,0,0,,,,,,,,,,,,,8,4,8,,,,2016-01-25 10:00:00
1974,Desinventar/SNGRE_2021,MANABI,EC13,MANTA,EC1308,LOS ESTEROS,EC130850,La Victoria,-80.6832,-0.9579,La Costa,3/3/13,4:14:00 PM,3,3,2013,,Urban/ Strong current,0,0,0,0,0,1,0,0,1,0,,1.0,,,1.0,,4.0,4.0,,,,,8,4,8,4.0,1.0,1.0,2013-03-03 21:14:00
4058,Desinventar,PASTAZA,EC16,SANTA CLARA,EC1603,SANTA CLARA,EC160350,"Comunidad Chonta Yaku,  Perpetuo Socorro Km 39, Luz de Ameri",-77.930177,-1.266419,La Sierra,3/28/17,9:00:00 PM,3,28,2017,Rain / Overflow,Heavy precipitation/ Surface runoff,1,0,0,0,1,0,0,0,0,0,,,,,,,297.0,297.0,,,,,8,5,8,297.0,,5.0,2017-03-29 02:00:00
5358,SNGRE_2021,COTOPAXI,EC05,LATACUNGA,EC0501,LA MATRIZ,EC050150,Urb. Los Rosales,-78.60585,-0.931556,La Sierra,11/26/20,6:00:00 PM,11,26,2020,Rain/Overflow,Heavy precipitation/ Surface runoff,1,0,0,0,1,0,0,0,0,0,,,,,1.0,,,,,,,,8,5,8,,1.0,,2020-11-26 23:00:00
2892,Desinventar,COTOPAXI,EC05,LATACUNGA,EC0501,IGNACIO FLORES (PARQUE FLORES),EC050150,"Unidad Educativa Especializada ""Cotopaxi"" (Ignacio Flores) P",-78.60694,-0.953336,La Sierra,10/24/14,4:15:00 PM,10,24,2014,Rain,Urban/ Strong current,0,0,0,0,0,1,0,0,1,0,,,,,,,,,,,,,8,5,8,,,,2014-10-24 21:15:00
2720,Desinventar,ESMERALDAS,EC08,RIOVERDE,EC0807,MONTALVO (CAB EN HORQUETA),EC080754,Parque central,-79.288738,0.886507,La Costa,3/30/14,10:00:00 AM,3,30,2014,,Urban/ Strong current,0,0,0,0,0,1,0,0,1,0,,,,,1.0,,17.0,17.0,,,,,8,5,8,17.0,1.0,3.0,2014-03-30 15:00:00
4555,Desinventar,ESMERALDAS,EC08,RIOVERDE,EC0807,RIOVERDE,EC080750,Palestina,-79.425084,1.070054,La Costa,1/6/19,12:20:00 PM,1,6,2019,Rain,Heavy precipitationv/ Surface runoff,1,0,0,0,1,0,0,0,0,0,,,,,5.0,5.0,27.0,27.0,,,,,8,5,8,27.0,5.0,3.0,2019-01-06 17:20:00
4878,SNGRE,LOS RIOS,EC12,URDANETA,EC1206,RICAURTE,EC120651,"La Irene,San Antonio de Rio, Manabi Chiquito, La Julia, La Amelia,San Clara 1 y 2",-79.43785,-1.587014,La Costa,3/23/19,1:51:00 AM,3,23,2019,Overflow,Urban/ strong current,0,0,0,0,0,1,0,0,1,0,,,,,,260.0,1037.0,,,,2834.0,,8,5,8,1037.0,260.0,6.0,2019-03-23 06:51:00
3556,Desinventar,MANABI,EC13,PEDERNALES,EC1317,PEDERNALES,EC131750,Varios Sectores,-80.047053,0.071075,La Costa,3/30/16,7:00:00 AM,3,30,2016,Rain ,Heavy precipitation/ Surface runoff,1,0,0,0,1,0,0,0,0,0,,,,,,,,,,,,,8,5,8,,,,2016-03-30 12:00:00
3011,Desinventar,EL ORO,EC07,HUAQUILLAS,EC0707,HUAQUILLAS,EC070750,"Barrio Eloy Alfaro, a dos cuadras del cementerio general.",-80.14547,-3.435986,La Costa,3/18/15,10:37:00 PM,3,18,2015,Rain,Urban/ Strong current,0,0,0,0,0,1,0,0,1,0,,,,,1.0,,,,,,,,8,5,8,,1.0,,2015-03-19 03:37:00
3870,Desinventar,MANABI,EC13,JUNIN,EC1307,JUNIN,EC130750,El Palmar- Rio Frio ,-80.220025,-0.929289,La Costa,2/26/17,9:33:00 AM,2,26,2017,Rain ,Heavy precipitationv/ Surface runoff,1,0,0,0,1,0,0,0,0,0,,,,,120.0,,480.0,480.0,,,,,8,5,8,480.0,120.0,5.0,2017-02-26 14:33:00
3350,Desinventar,MANABI,EC13,MANTA,EC1308,MANTA,EC130850,La Pradera,-80.787826,-1.026737,La Costa,1/25/16,3:20:00 AM,1,25,2016,Rain ,Heavy precipitation/ Surface runoff,1,0,0,0,1,0,0,0,0,0,,,,,6.0,,20.0,20.0,,,,,8,5,8,20.0,6.0,3.0,2016-01-25 08:20:00
5060,SNGRE_2021,COTOPAXI,EC05,LATACUNGA,EC0501,ELOY ALFARO (SAN FELIPE),EC050150,Av. Iberoamericana,-78.629941,-0.923806,La Sierra,12/12/19,4:00:00 PM,12,12,2019,Rain,Heavy precipitation/ Surface runoff,1,0,0,0,1,0,0,0,0,0,,,,,,,,,,,,,8,6,8,,,,2019-12-12 21:00:00
4847,SNGRE,SANTO DOMINGO DE LOS TSACHILAS,EC23,SANTO DOMINGO,EC2301,BOMBOLI,EC230150,"Coop. Padres de Familia, Calle Ejercito Ecuatoriano parte trasera del UPC justo en las canchas.",-79.174426,-0.247745,La Costa,3/21/19,9:20:00 PM,3,21,2019,Rain,Heavy precipitationv/ Surface runoff,1,0,0,0,1,0,0,0,0,0,,,,,,1.0,7.0,,,,,,8,6,8,7.0,1.0,2.0,2019-03-22 02:20:00
2993,SNGRE,ESMERALDAS,EC08,RIOVERDE,EC0807,CHONTADURO,EC080751,La Y,-79.4232,0.929125,La Costa,3/1/15,4:39:00 AM,3,1,2015,Rain ,Heavy precipitationv/ Surface runoff,1,0,0,0,1,0,0,0,0,0,,,,,1.0,,5.0,,,,,,8,6,8,5.0,1.0,1.0,2015-03-01 09:39:00
3488,Desinventar,GUAYAS,EC09,NARANJITO,EC0912,NARANJITO,EC091250,Calles General Cordova y Acacias,-79.476128,-2.170446,La Costa,3/3/16,5:00:00 AM,3,3,2016,Rain ,Urban/ Strong current,0,0,0,0,0,1,0,0,1,0,,,,,3.0,,15.0,15.0,,,,,8,6,8,15.0,3.0,3.0,2016-03-03 10:00:00
3099,Desinventar,GUAYAS,EC09,MILAGRO,EC0910,MILAGRO,EC091050,San Miguel,-79.578414,-2.135915,La Costa,3/29/15,12:45:00 PM,3,29,2015,Rain,Urban/ Strong current,0,0,0,0,0,1,0,0,1,0,,,,,1.0,,5.0,5.0,5.0,,,,8,6,8,5.0,1.0,1.0,2015-03-29 17:45:00
3096,Desinventar,GUAYAS,EC09,MILAGRO,EC0910,MILAGRO,EC091050,Bellavista,-79.609925,-2.135628,La Costa,3/29/15,9:25:00 AM,3,29,2015,Rain,Urban/ Strong current,0,0,0,0,0,1,0,0,1,0,,,,,3.0,,16.0,16.0,16.0,,,,8,6,8,16.0,3.0,3.0,2015-03-29 14:25:00
2962,Desinventar,EL ORO,EC07,MACHALA,EC0701,EL RETIRO,EC070152,"Y del Enano, Km.11 via Machala-Pasaje a 1 Km. del rio Motuch",-79.958537,-3.356927,La Costa,2/8/15,10:00:00 PM,2,8,2015,Rain,Urban / Short duration flood,0,0,0,0,0,1,0,0,0,1,,,,,8.0,,40.0,40.0,,,,,8,6,8,40.0,8.0,3.0,2015-02-09 03:00:00
4059,Desinventar,MANABI,EC13,PORTOVIEJO,EC1301,ABDON CALDERON (SAN FRANCISCO),EC130151,Varios Sectores (  El Zapallo y Juan Dama),-80.339463,-1.031477,La Costa,3/29/17,8:30:00 AM,3,29,2017,Rain ,Heavy precipitationv/ Surface runoff,1,0,0,0,1,0,0,0,0,0,,,,,70.0,,280.0,280.0,,,,,8,6,8,280.0,70.0,5.0,2017-03-29 13:30:00
2610,Desinventar,NAPO,EC15,ARCHIDONA,EC1503,ARCHIDONA,EC150350,"Antonio Cabri, Piedra Grande, El Progreso, San Agustin, Las ",-77.823223,-0.897721,La Sierra,2/6/14,10:00:00 PM,2,6,2014,Rain ,Urban / Small stream overflow/ Short duration rain,0,1,0,1,0,1,0,0,0,0,,,,,5.0,,33.0,33.0,,,,,8,7,8,33.0,5.0,3.0,2014-02-07 03:00:00
2611,SNGRE_2021,NAPO,EC15,ARCHIDONA,EC1503,ARCHIDONA,EC150350,"Barrios: Antonio Cabri, Piedra Grande, El Progreso, San Agustin, Las Maravillas, 13 De Abril; Y Sectores Yahuari Y Lucian",-77.82322311,-0.8977215,La Sierra,2/6/14,10:00:00 PM,2,6,2014,Rain/ Overflow,Short duration rain/ Small stream overflow / Urban,0,1,0,1,0,1,0,0,0,0,,,,,5.0,,33.0,,,,,,8,7,8,33.0,5.0,3.0,2014-02-07 03:00:00
3525,Desinventar,PICHINCHA,EC17,CAYAMBE,EC1702,CANGAHUA,EC170252,Unidad Educativa Pisambillo,-78.146354,-0.090673,La Sierra,3/9/16,6:07:00 PM,3,9,2016,Rain ,Heavy precipitation/ Surface runoff,1,0,0,0,1,0,0,0,0,0,,,,,,,,,,,,,8,7,8,,,,2016-03-09 23:07:00
1753,SNGRE_2021,COTOPAXI,EC05,SALCEDO,EC0505,SAN MIGUEL,EC050550,La Tebaida,-78.501083,-1.026408,La Sierra,11/13/12,5:30:00 PM,11,13,2012,Rain,Heavy precipitation/ Surface runoff,1,0,0,0,1,0,0,0,0,0,,,,,1.0,,5.0,,,,,,8,7,8,5.0,1.0,1.0,2012-11-13 22:30:00
3677,Desinventar,MORONA SANTIAGO,EC14,SAN JUAN BOSCO,EC1408,SAN JUAN BOSCO,EC140850,Sector Santa Marianita de Kalaglas,-78.555524,-3.226895,La Sierra,12/23/16,4:23:00 PM,12,23,2016,Rain / Overflow,Heavy precipitation/ Surface runoff,1,0,0,0,1,0,0,0,0,0,,,,,10.0,,45.0,45.0,,,,,8,7,8,45.0,10.0,3.0,2016-12-23 21:23:00
4346,SNGRE_2021,CHIMBORAZO,EC06,RIOBAMBA,EC0601,LICTO,EC060156,"Verde Cruz de Pungalbug, via Riobamba-Macas [E-46]",-78.624342,-1.839765,La Sierra,12/30/17,3:50:00 PM,12,30,2017,Rain,Heavy precipitation/ Surface runoff,1,0,0,0,1,0,0,0,0,0,,,,,,,,,,,,,8,7,8,,,,2017-12-30 20:50:00
3025,SNGRE_2021,PICHINCHA,EC17,MEJIA,EC1703,MANUEL CORNEJO ASTORGA (TANDAPI),EC170355,Toda la parroquia,-78.833046,-0.4680348,La Sierra,3/19/15,9:00:00 PM,3,19,2015,Rain/ Landslides,Heavy precipitation/ Surface runoff,1,0,0,0,1,0,0,0,0,0,,,,,,,,,,,,,8,7,8,,,,2015-03-20 02:00:00
4706,SNGRE_2021,CHIMBORAZO,EC06,ALAUSI,EC0602,ALAUSI,EC060250,Barrio La Elegancia,-78.84392,-2.201326,La Sierra,3/3/19,11:00:00 PM,3,3,2019,Overflow,Urban/Artificial waterway overflow/ Surface runoff/ Urban,0,0,1,0,1,1,0,0,0,0,,,,,4.0,4.0,20.0,,7.0,17.0,11.5,2.0,8,7,8,20.0,4.0,3.0,2019-03-04 04:00:00
3508,Desinventar,SANTO DOMINGO DE LOS TSACHILAS,EC23,SANTO DOMINGO,EC2301,RIO VERDE,EC230150,Via Quevedo Km 5 Coop. 15 de Septiembre,-79.182867,-0.346357,La Costa,3/6/16,9:00:00 PM,3,6,2016,Rain,Urban/ Strong current,0,0,0,0,0,1,0,0,1,0,,1.0,,,1.0,,1.0,1.0,,,,,8,7,8,1.0,1.0,1.0,2016-03-07 02:00:00
3501,Desinventar,GUAYAS,EC09,DURAN,EC0907,ELOY ALFARO (DURAN),EC090750,Varios Sectores Rurales,-79.793104,-2.164963,La Costa,3/6/16,6:00:00 AM,3,6,2016,Long duration rain / Overflow,heavy precipitation/ Slope / Artificial waterway overflow / Small stream,1,0,1,0,0,0,1,0,0,0,,,,,685.0,,2740.0,2740.0,,,,,8,7,8,2740.0,685.0,,2016-03-06 11:00:00
1927,SNGRE_2021,MANABI,EC13,FLAVIO ALFARO,EC1305,FLAVIO ALFARO,EC130550,Cdla. Basurto,-79.8032,-0.3498,La Costa,2/23/13,9:00:00 PM,2,23,2013,Rain / Overflow,Urban/ Short duration flood,0,0,0,0,0,1,0,0,0,1,,,,,4.0,,14.0,,20.0,20.0,,,8,7,8,14.0,4.0,3.0,2013-02-24 02:00:00
3312,Desinventar,MANABI,EC13,SAN VICENTE,EC1322,SAN VICENTE,EC132250,Zona Urbana,-80.402143,-0.60449,La Costa,1/20/16,7:19:00 AM,1,20,2016,Rain ,Urban/ Strong current,0,0,0,0,0,1,0,0,1,0,,,,,,,,,,,,,8,7,8,,,,2016-01-20 12:19:00
4037,Desinventar,CARCHI,EC04,TULCAN,EC0401,TULCAN,EC040150,Calle Cayambe-Estadio del Sur,-77.736842,0.792407,La Sierra,3/26/17,7:30:00 PM,3,26,2017,Rain,Heavy precipitation,1,0,0,0,0,0,0,0,0,0,,,,,1.0,,4.0,4.0,,,,,2,8,8,4.0,1.0,1.0,2017-03-27 00:30:00
2449,Desinventar/SNGRE_2021,CARCHI,EC04,ESPEJO,EC0403,SAN ISIDRO,EC040353,Centro,-77.9858,0.6018,La Sierra,7/28/13,3:30:00 PM,7,28,2013,,Artificial waterway overflow,0,0,1,0,0,0,0,0,0,0,,,,,1.0,,7.0,7.0,,,,,1,8,8,7.0,1.0,2.0,2013-07-28 20:30:00
3619,Desinventar,MORONA SANTIAGO,EC14,LOGRONO,EC1410,YAUPI,EC141051,Puerto Chinkianas,-78.006984,-2.808854,La Sierra,4/28/16,11:00:00 AM,4,28,2016,Rain / Overflow,Heavy precipitation,1,0,0,0,0,0,0,0,0,0,,,,,3.0,,11.0,11.0,,,,,2,8,8,11.0,3.0,3.0,2016-04-28 16:00:00
4912,SNGRE,MORONA SANTIAGO,EC14,MORONA,EC1401,MACAS,EC140150,Varios Sectores,-78.119738,-2.300322,La Sierra,4/5/19,4:10:00 PM,4,5,2019,Rain,Urban,0,0,0,0,0,1,0,0,0,0,,,,,,,,,,,,,1,8,8,,,,2019-04-05 21:10:00
5130,SNGRE_2021,MORONA SANTIAGO,EC14,MORONA,EC1401,SAN ISIDRO,EC140156,Centro Parroquial,-78.162548,-2.2147,La Sierra,2/22/20,8:30:00 AM,2,22,2020,Rain/Overflow,Strong current,0,0,0,0,0,0,0,0,1,0,,,,1.0,2.0,5.0,21.0,,8.0,,1.0,,7,8,8,21.0,5.0,3.0,2020-02-22 13:30:00
2360,Desinventar/SNGRE_2021,IMBABURA,EC10,ANTONIO ANTE,EC1002,ANDRADE MARIN (LOURDES),EC100250,Santa Isabel   (calle principal),-78.2019,0.3097,La Sierra,4/25/13,12:50:00 PM,4,25,2013,Overflow,Artificial waterway overflow,0,0,1,0,0,0,0,0,0,0,,,,,1.0,,8.0,8.0,,,,,1,8,8,8.0,1.0,2.0,2013-04-25 17:50:00
2340,SNGRE_2021,IMBABURA,EC10,ANTONIO ANTE,EC1002,ANDRADE MARÍN (LOURDES),EC100250,Escuela Venezuela-Comunidad Santa Isabel,-78.2027,0.3132,La Sierra,4/22/13,9:00:00 AM,4,22,2013,Rain ,Heavy precipitation,1,0,0,0,0,0,0,0,0,0,,,,,,,,,,,,,2,8,8,,,,2013-04-22 14:00:00
2758,Desinventar,IMBABURA,EC10,ANTONIO ANTE,EC1002,ANDRADE MARIN (LOURDES),EC100250,Santa Bernardita,-78.214927,0.320635,La Sierra,4/16/14,3:30:00 AM,4,16,2014,Rain ,Heavy precipitation / Short duration rain / Small stream overflow,1,0,0,0,0,0,0,0,0,0,,,10.0,,,,,,,,,,2,8,8,,,,2014-04-16 08:30:00
2392,Desinventar/SNGRE_2021,IMBABURA,EC10,ANTONIO ANTE,EC1002,SAN ROQUE,EC100254,San Jose del Cerotal,-78.2264,0.2876,La Sierra,5/8/13,9:35:00 PM,5,8,2013,Rain ,Heavy precipitation,1,0,0,0,0,0,0,0,0,0,,1.0,,1.0,4.0,,11.0,14.0,11.0,,0.3,,2,8,8,14.0,4.0,3.0,2013-05-09 02:35:00
4312,Desinventar,MORONA SANTIAGO,EC14,LIMON INDANZA,EC1403,GRAL. LEONIDAS PLAZA GUTIERREZ,EC140350,Escuela Albino del Curto,-78.430808,-2.966718,La Sierra,10/25/17,10:00:00 PM,10,25,2017,Rain,Urban/ Surface runoff,0,0,0,0,1,1,0,0,0,0,,,,,,,,,,,,,7,8,8,,,,2017-10-26 03:00:00
2768,Desinventar,PICHINCHA,EC17,QUITO,EC1701,AMAGUANA,EC170152,"Valle de los Chillos, Llanoguayco, por la floristeria, en di",-78.480573,-0.348218,La Sierra,4/26/14,10:13:00 PM,4,26,2014,Rain ,Heavy precipitation,1,0,0,0,0,0,0,0,0,0,,,,,,,12.0,12.0,,,,,2,8,8,12.0,,3.0,2014-04-27 03:13:00
2543,Desinventar/SNGRE_2021,PICHINCHA,EC17,QUITO,EC1701,AMAGUANA,EC170152,Cuendina Tulipanes y Cuba Ref. Atras de la iglesia,-78.492627,-0.379977,La Sierra,1/22/14,3:58:00 PM,1,22,2014,Rain ,Strong current,0,0,0,0,0,0,0,0,1,0,,,,,5.0,,22.0,22.0,,,,,7,8,8,22.0,5.0,3.0,2014-01-22 20:58:00
4315,Desinventar,TUNGURAHUA,EC18,AMBATO,EC1801,PICAIGUA,EC180160,"Av. Bolivariana redondel de terremoto, ref. Frente a la gaso",-78.577989,-1.276606,La Sierra,10/27/17,10:05:00 AM,10,27,2017,,Urban,0,0,0,0,0,1,0,0,0,0,,,,,1.0,,3.0,3.0,,,,,1,8,8,3.0,1.0,1.0,2017-10-27 15:05:00
5336,SNGRE_2021,TUNGURAHUA,EC18,AMBATO,EC1801,PISHILATA,EC180150,"Tiugua, ref. Cuatro cuadras antes de la Iglesia.",-78.582606,-1.260329,La Sierra,9/5/20,4:11:00 AM,9,5,2020,Rain/Overflow,Artificial waterway overflow,0,0,1,0,0,0,0,0,0,0,,,,,1.0,,,,,,,,1,8,8,,1.0,,2020-09-05 09:11:00
2402,Desinventar/SNGRE_2021,TUNGURAHUA,EC18,AMBATO,EC1801,IZAMBA,EC180156,Barrio San Antonio,-78.5857,-1.2257,La Sierra,5/26/13,7:10:00 AM,5,26,2013,Overflow,Artificial waterway overflow,0,0,1,0,0,0,0,0,0,0,,,,,1.0,,,,,,,,1,8,8,,1.0,,2013-05-26 12:10:00
4518,Desinventar,TUNGURAHUA,EC18,AMBATO,EC1801,IZAMBA,EC180156,Ciro Penaherrera y Neptali Sancho. Ref. Atras de Sindicato d,-78.586258,-1.225059,La Sierra,9/16/18,10:20:00 PM,9,16,2018,Rain / Overflow,Artificial waterway overflow,0,0,1,0,0,0,0,0,0,0,,,,,,,,,,,,,1,8,8,,,,2018-09-17 03:20:00
3239,Desinventar,TUNGURAHUA,EC18,AMBATO,EC1801,IZAMBA,EC180156,Calle Rafael Darquea y Pedro Vasconez Urbanizacion La Granja,-78.591572,-1.227667,La Sierra,7/27/15,8:37:00 AM,7,27,2015,Rain / Overflow,Artificial waterway overflow,0,0,1,0,0,0,0,0,0,0,,,,,1.0,,5.0,5.0,,,,,1,8,8,5.0,1.0,1.0,2015-07-27 13:37:00
5001,SNGRE_2021,CHIMBORAZO,EC06,CHAMBO,EC0604,CHAMBO,EC060450,"Chambo, pasando el puente en las primeras casas.",-78.595073,-1.7325123,La Sierra,8/8/19,10:54:00 AM,8,8,2019,Overflow,Artificial waterway overflow/Surface runoff,0,0,1,0,1,0,0,0,0,0,,,,,,,,,,,,,7,8,8,,,,2019-08-08 15:54:00
4538,SNGRE,TUNGURAHUA,EC18,AMBATO,EC1801,ATAHUALPA (CHISALATA),EC180152,"Caserio Pisque La Union. Ref.
Junto a INARECROM",-78.595156,-1.20597,La Sierra,11/30/18,5:55:00 AM,11,30,2018,Overflow,Artificial waterway overflow,0,0,1,0,0,0,0,0,0,0,,,,,,,,,,,,,1,8,8,,,,2018-11-30 10:55:00
5326,SNGRE_2021,TUNGURAHUA,EC18,AMBATO,EC1801,PICAIGUA,EC180160,Terremoto. Ref tras el Estadio de Terremoto,-78.604247,-1.287005,La Sierra,7/13/20,9:16:00 AM,7,13,2020,Rain/Overflow,Artificial waterway overflow,0,0,1,0,0,0,0,0,0,0,,,,,1.0,12.0,48.0,,,,0.02,,1,8,8,48.0,12.0,3.0,2020-07-13 14:16:00
4255,Desinventar,TUNGURAHUA,EC18,AMBATO,EC1801,TOTORAS,EC180166,Barrio la Libertad,-78.606158,-1.314747,La Sierra,5/14/17,5:30:00 AM,5,14,2017,Rain ,Urban,0,0,0,0,0,1,0,0,0,0,,,,,7.0,,,,,,,,1,8,8,,7.0,,2017-05-14 10:30:00
3629,Desinventar,TUNGURAHUA,EC18,CEVALLOS,EC1803,CEVALLOS,EC180350,Barrio San Fernando,-78.610402,-1.364603,La Sierra,5/12/16,11:45:00 PM,5,12,2016,Overflow,Artificial waterway overflow,0,0,1,0,0,0,0,0,0,0,,,,,11.0,,41.0,41.0,,,0.02,,1,8,8,41.0,11.0,3.0,2016-05-13 04:45:00
2885,Desinventar,TUNGURAHUA,EC18,AMBATO,EC1801,HUACHI LORETO,EC180150,"Barrio  Nuevo Amanecer, en la subida a Huachi La Libertad po",-78.620284,-1.247504,La Sierra,10/13/14,11:37:00 AM,10,13,2014,Overflow,Artificial waterway overflow,0,0,1,0,0,0,0,0,0,0,,,,1.0,1.0,,3.0,5.0,,,,,1,8,8,5.0,1.0,1.0,2014-10-13 16:37:00
4954,SNGRE,TUNGURAHUA,EC18,AMBATO,EC1801,HUACHI LORETO,EC180150,Parque Sucre tras el estadio Bellavista.,-78.624094,-1.244099,La Sierra,5/29/19,5:07:00 AM,5,29,2019,Rain,Urban/ Strong current,0,0,0,0,0,1,0,0,1,0,,,,,,1.0,2.0,,,,,,8,8,8,2.0,1.0,1.0,2019-05-29 10:07:00
4326,SNGRE/Desinventar,TUNGURAHUA,EC18,AMBATO,EC1801,ATOCHA - FICOA,EC180150,"Atocha Alto, Ref. Subida a Laquigo.",-78.625441,-1.225844,La Sierra,11/20/17,3:00:00 AM,11,20,2017,Rain / Overflow,Artificial waterway overflow,0,0,1,0,0,0,0,0,0,0,,,,,1.0,,5.0,5.0,,,,,1,8,8,5.0,1.0,1.0,2017-11-20 08:00:00
3550,Desinventar,TUNGURAHUA,EC18,AMBATO,EC1801,MONTALVO,EC180158,Barrio Amazonas junto al canal de riego,-78.626933,-1.332168,La Sierra,3/28/16,6:30:00 PM,3,28,2016,Overflow,Artificial waterway overflow,0,0,1,0,0,0,0,0,0,0,,,,,1.0,,1.0,1.0,,,,,1,8,8,1.0,1.0,1.0,2016-03-28 23:30:00
4302,Desinventar,TUNGURAHUA,EC18,AMBATO,EC1801,MONTALVO,EC180158,Barrio Amazonas ref. Manzana de Oro nueva via inaugurada.,-78.628764,-1.323645,La Sierra,10/4/17,5:48:00 PM,10,4,2017,Overflow,Artificial waterway overflow,0,0,1,0,0,0,0,0,0,0,,,,,1.0,,1.0,1.0,,,,,1,8,8,1.0,1.0,1.0,2017-10-04 22:48:00
4235,Desinventar,TUNGURAHUA,EC18,AMBATO,EC1801,MONTALVO,EC180158,"Caserio Amazonas, ref. De la Iglesia Bautista cuatro casas a",-78.630042,-1.331014,La Sierra,4/29/17,5:33:00 AM,4,29,2017,Overflow,Artificial waterway overflow,0,0,1,0,0,0,0,0,0,0,,,,,1.0,,,1.0,,,,,1,8,8,1.0,1.0,1.0,2017-04-29 10:33:00
4754,SNGRE_2021,TUNGURAHUA,EC18,AMBATO,EC1801,CELIANO MONGE,EC180150,"Huachi El Belen, callejon S/N y calle Armando Hidrovo",-78.631435,-1.286413,La Sierra,3/9/19,8:52:00 AM,3,9,2019,Overflow,Artificial waterway overflow/ strong current,0,0,1,0,0,0,0,0,1,0,,,,,1.0,,1.0,,,,,,8,8,8,1.0,1.0,1.0,2019-03-09 13:52:00
2358,Desinventar/SNGRE_2021,TUNGURAHUA,EC18,AMBATO,EC1801,MONTALVO,EC180158,Caserio Palahua el Carmen (dos cuadras antes de llegar a la ,-78.6316,-1.3393,La Sierra,4/24/13,11:21:00 AM,4,24,2013,Overflow,Artificial waterway overflow,0,0,1,0,0,0,0,0,0,0,,,,,1.0,,,,,,,,1,8,8,,1.0,,2013-04-24 16:21:00
2879,Desinventar,TUNGURAHUA,EC18,AMBATO,EC1801,HUACHI CHICO,EC180150,Av. Atahualpa y calle Bernardo de Legarda ref. Por la gasoli,-78.632905,-1.285358,La Sierra,10/11/14,2:27:00 AM,10,11,2014,Overflow,Artificial waterway overflow,0,0,1,0,0,0,0,0,0,0,,,,,1.0,,6.0,6.0,,,,,1,8,8,6.0,1.0,2.0,2014-10-11 07:27:00
2165,Desinventar/SNGRE_2021,TUNGURAHUA,EC18,AMBATO,EC1801,ATOCHA - FICOA,EC180150,Ficoa,-78.6333,-1.2361,La Sierra,3/20/13,11:34:00 PM,3,20,2013,Rain ,Heavy precipitation,1,0,0,0,0,0,0,0,0,0,,,,,1.0,,5.0,5.0,,,,,2,8,8,5.0,1.0,1.0,2013-03-21 04:34:00
4293,SNGRE_2021,TUNGURAHUA,EC18,AMBATO,EC1801,CONSTANTINO FERNÁNDEZ (CAB. EN CULLITAHUA),EC180154,"Pondoa, via Constantino Fernandez- Samanga",-78.642506,-1.1924096,La Sierra,8/8/17,6:53:00 PM,8,8,2017,Rain/ Overflow,Artificial waterway overflow/ Surface runoff,0,0,1,0,1,0,0,0,0,0,,,,,,,,,,,,,7,8,8,,,,2017-08-08 23:53:00
3674,Desinventar,COTOPAXI,EC05,SAQUISILI,EC0506,SAQUISILI,EC050650,En el puente de los Manizales ,-78.66824,-0.822574,La Sierra,12/5/16,5:34:00 PM,12,5,2016,Overflow,Artificial waterway overflow,0,0,1,0,0,0,0,0,0,0,,,,,1.0,,6.0,6.0,,,,,1,8,8,6.0,1.0,2.0,2016-12-05 22:34:00
5082,SNGRE_2021,TUNGURAHUA,EC18,TISALEO,EC1809,TISALEO,EC180950,"Comuna Sta. Lucia Arriba-Barrio la Florida y Bellavista, Comuna santa Lucia Centro-Barrio Olimpico Comuna Santa Lucia la Libertad-Barrio el Porvenir, Agua Santa, Union y Progreso, San Juan",-78.66824,-1.367982,La Sierra,1/21/20,4:00:00 PM,1,21,2020,Rain/Overflow,Artificial waterway overflow/Surface runoff,0,0,1,0,1,0,0,0,0,0,,,,,18.0,36.0,143.0,,,71.0,13.05,2.01,7,8,8,143.0,36.0,5.0,2020-01-21 21:00:00
2874,Desinventar,COTOPAXI,EC05,SAQUISILI,EC0506,SAQUISILI,EC050650,Barrio Union Parlamentaria,-78.670684,-0.836523,La Sierra,10/9/14,3:00:00 PM,10,9,2014,Rain ,Urban/ Strong current,0,0,0,0,0,1,0,0,1,0,,,,,3.0,,12.0,12.0,,,,,8,8,8,12.0,3.0,3.0,2014-10-09 20:00:00
2175,Desinventar/SNGRE_2021,CHIMBORAZO,EC06,RIOBAMBA,EC0601,LIZARZABURU,EC060150,Milton Reyes,-78.6746,-1.664,La Sierra,3/20/13,5:30:00 PM,3,20,2013,Rain,Heavy precipitation,1,0,0,0,0,0,0,0,0,0,,,,,3.0,,15.0,15.0,,,,,2,8,8,15.0,3.0,3.0,2013-03-20 22:30:00
3650,Desinventar,TUNGURAHUA,EC18,AMBATO,EC1801,SANTA ROSA,EC180165,Barrio Venezuela REF Diagonal a la parada de taxis N.-43,-78.676315,-1.302458,La Sierra,7/21/16,11:00:00 AM,7,21,2016,,Strong current,0,0,0,0,0,0,0,0,1,0,,,,,2.0,,8.0,8.0,,,,,7,8,8,8.0,2.0,2.0,2016-07-21 16:00:00
2404,Desinventar/SNGRE_2021,CHIMBORAZO,EC06,RIOBAMBA,EC0601,LIZARZABURU,EC060150,La Primavera,-78.6775,-1.6547,La Sierra,5/26/13,8:00:00 AM,5,26,2013,Rain ,Urban/ Strong current,0,0,0,0,0,1,0,0,1,0,,,,,1.0,,6.0,6.0,,,,,8,8,8,6.0,1.0,2.0,2013-05-26 13:00:00
5064,SNGRE_2021,CHIMBORAZO,EC06,RIOBAMBA,EC0601,LIZARZABURU,EC060150,Avenidas Monsenor Leonidas Proano [E35] y Canonigo Ramos,-78.681829,-1.6465791,La Sierra,12/12/19,5:20:00 PM,12,12,2019,Rain,Heavy precipitation/ Surface runoff,1,0,0,0,1,0,0,0,0,0,,,,,,,,,,,,,8,8,8,,,,2019-12-12 22:20:00
1842,Desinventar/SNGRE_2021,COTOPAXI,EC05,PUJILI,EC0504,PUJILI,EC050450,Avenida Simon Bolivar; Barrio El Calvario sur; Av Velasco Ib,-78.6905,-0.9511,La Sierra,1/24/13,3:00:00 PM,1,24,2013,Rain ,Heavy precipitationv/ Surface runoff,1,0,0,0,1,0,0,0,0,0,,,,,47.0,,235.0,235.0,,,,,8,8,8,235.0,47.0,5.0,2013-01-24 20:00:00
2400,Desinventar/SNGRE_2021,COTOPAXI,EC05,SAQUISILI,EC0506,SAQUISILI,EC050650,Barrio Calicanto,-78.7215,-0.8241,La Sierra,5/21/13,5:30:00 PM,5,21,2013,Rain ,Heavy precipitation,1,0,0,0,0,0,0,0,0,0,,,,,1.0,,4.0,4.0,,,,,2,8,8,4.0,1.0,1.0,2013-05-21 22:30:00
1725,SNGRE_2021,COTOPAXI,EC05,PUJILI,EC0504,PUJILI,EC050450,Escuela Pedro Vicente Maldonado,-78.722812,-0.991477,La Sierra,10/17/12,3:00:00 PM,10,17,2012,Rain,Heavy precipitation,1,0,0,0,0,0,0,0,0,0,,,,,,,,,,,,,2,8,8,,,,2012-10-17 20:00:00
2513,Desinventar/SNGRE_2021,COTOPAXI,EC05,PUJILI,EC0504,PUJILI,EC050450,Yacubamba,-78.722812,-0.991477,La Sierra,1/7/14,6:00:00 PM,1,7,2014,Rain ,Heavy precipitationv/ Surface runoff,1,0,0,0,1,0,0,0,0,0,,,,,1.0,,6.0,6.0,,,,,8,8,8,6.0,1.0,2.0,2014-01-07 23:00:00
2915,Desinventar,COTOPAXI,EC05,PUJILI,EC0504,PUJILI,EC050450,San Antonio de Guantubamba,-78.743959,-0.975425,La Sierra,12/18/14,7:30:00 PM,12,18,2014,Rain ,Surface runoff/ Heavy precipitation,1,0,0,0,1,0,0,0,0,0,,,,,,,,,,,,,8,8,8,,,,2014-12-19 00:30:00
4291,Desinventar,AZUAY,EC01,GUALACEO,EC0103,GUALACEO,EC010350,Varios Sectores,-78.773462,-2.887115,La Sierra,7/26/17,7:00:00 AM,7,26,2017,Rain / Overflow,Urban,0,0,0,0,0,1,0,0,0,0,,,,1.0,59.0,,4.0,269.0,,4.0,,,1,8,8,269.0,59.0,5.0,2017-07-26 12:00:00
2817,Desinventar,PICHINCHA,EC17,SAN MIGUEL DE LOS BANCOS,EC1707,MINDO,EC170751,Sector Rio Cachulqui,-78.779323,-0.048204,La Sierra,5/11/14,11:00:00 PM,5,11,2014,Overflow,Strong current,0,0,0,0,0,0,0,0,1,0,,,,1.0,2.0,,8.0,15.0,,8.0,,,7,8,8,15.0,2.0,3.0,2014-05-12 04:00:00
2912,Desinventar,CANAR,EC03,AZOGUES,EC0301,AZOGUES,EC030150,San Miguel de Porotos,-78.851929,-2.748788,La Sierra,12/9/14,4:05:00 PM,12,9,2014,Rain ,Heavy precipitation,1,0,0,0,0,0,0,0,0,0,,,,,4.0,,16.0,16.0,,,,,2,8,8,16.0,4.0,3.0,2014-12-09 21:05:00
4222,Desinventar,CHIMBORAZO,EC06,CHUNCHI,EC0605,COMPUD,EC060552,Compud Cabecera Parroquial,-78.940526,-2.343193,La Sierra,4/25/17,3:00:00 PM,4,25,2017,Rain / Overflow,Artificial waterway overflow,0,0,1,0,0,0,0,0,0,0,,,,,1.0,,1.0,1.0,,,,,1,8,8,1.0,1.0,1.0,2017-04-25 20:00:00
3313,SNGRE_2021,BOLIVAR,EC02,CHIMBO,EC0203,SAN JOSE DE CHIMBO,EC020350,San Jose de Chimbo,-79.0326,-1.6795821,La Sierra,1/21/16,8:00:00 PM,1,21,2016,Rain,Heavy precipitation,1,0,0,0,0,0,0,0,0,0,,,,,,,,,,,,,2,8,8,,,,2016-01-22 01:00:00
4047,Desinventar,LOS RIOS,EC12,MONTALVO,EC1203,MONTALVO,EC120350,Rio Chico y San Vicente,-79.295109,-1.788864,La Sierra,3/27/17,5:30:00 AM,3,27,2017,Rain ,Heavy precipitation,1,0,0,0,0,0,0,0,0,0,,,,,36.0,,144.0,144.0,,,1014.0,,2,8,8,144.0,36.0,5.0,2017-03-27 10:30:00
3055,Desinventar,LOS RIOS,EC12,MONTALVO,EC1203,MONTALVO,EC120350,"Bocatoma, La Hernecia, Maravilla, San Pedro, San Jose, La Er",-79.302239,-1.846979,La Costa,3/21/15,7:28:00 AM,3,21,2015,Rain / Overflow,Heavy precipitation,1,0,0,0,0,0,0,0,0,0,,,,,13.0,,41.0,41.0,13.0,41.0,,,2,8,8,41.0,13.0,3.0,2015-03-21 12:28:00
5057,SNGRE_2021,EL ORO,EC07,PORTOVELO,EC0711,SALATI,EC071153,"Varios sectores (Ambocas, Pueblo Nuevo).",-79.532781,-3.754597,La Sierra,12/12/19,8:56:00 AM,12,12,2019,Rain/ Overflow,strong current,0,0,0,0,0,0,0,0,1,0,,,,,,,,75.0,,,,,7,8,8,75.0,,4.0,2019-12-12 13:56:00
4592,Desinventar,LOS RIOS,EC12,PUEBLOVIEJO,EC1204,SAN JUAN,EC120452,"Rcto. Norcorosal, Rcto. Los Troncos y Rcto. Las Casitas.",-79.570823,-1.622744,La Costa,1/11/19,3:00:00 PM,1,11,2019,Overflow,Short duration flood,0,0,0,0,0,0,0,0,0,1,,,,,10.0,10.0,30.0,30.0,,,,2.0,7,8,8,30.0,10.0,3.0,2019-01-11 20:00:00
3491,Desinventar,LOJA,EC11,CALVAS,EC1102,CARIAMANGA,EC110250,Barrio El Dorado,-79.573904,-4.361277,La Sierra,3/4/16,7:30:00 PM,3,4,2016,Rain ,Urban/ Surface runoff,0,0,0,0,1,1,0,0,0,0,,,,,2.0,,8.0,8.0,,,,,7,8,8,8.0,2.0,2.0,2016-03-05 00:30:00
3174,Desinventar,GUAYAS,EC09,ALFREDO BAQUERIZO MORENO,EC0902,ALFREDO BAQUERIZO MORENO (JUJA,EC090250,Recinto Tres Postes,-79.605182,-1.986724,La Costa,5/5/15,10:00:00 PM,5,5,2015,Rain,Heavy precipitation,1,0,0,0,0,0,0,0,0,0,,,,,,,,,,,,,2,8,8,,,,2015-05-06 03:00:00
2776,SNGRE,EL ORO,EC07,ZARUMA,EC0713,ZARUMA,EC071350,Eugenio Espejo,-79.611759,-3.692526,La Sierra,5/2/14,8:00:00 PM,5,2,2014,Rain ,Heavy precipitation/ Urban/ Strong current,1,0,0,0,0,0,0,0,0,0,,,,,,,14.0,,,,,,2,8,8,14.0,,3.0,2014-05-03 01:00:00
3080,Desinventar,EL ORO,EC07,PORTOVELO,EC0711,PORTOVELO,EC071150,"Ciudadelas: El Oro, La Florida, Las Malvinas, y 28 de Noviem",-79.619925,-3.721218,La Sierra,3/27/15,10:09:00 PM,3,27,2015,Rain / Overflow,Heavy precipitation,1,0,0,0,0,0,0,0,0,0,,,,,8.0,,9.0,9.0,9.0,,,,2,8,8,9.0,8.0,2.0,2015-03-28 03:09:00
4890,Desinventar,LOS RIOS,EC12,BABA,EC1202,ISLA DE BEJUCAL,EC120252,"Rctos. San Jose, La Ranfla, Jazmin, El Carbon, La Lolita, Si",-79.644121,-1.677859,La Costa,3/28/19,10:22:00 AM,3,28,2019,Rain / Overflow,Short duration flood,0,0,0,0,0,0,0,0,0,1,,,,,112.0,112.0,336.0,336.0,,,266.0,184.0,7,8,8,336.0,112.0,5.0,2019-03-28 15:22:00
4867,SNGRE,LOS RIOS,EC12,PALENQUE,EC1209,PALENQUE,EC120950,"Recintos. Vuelta larga, San Jose de la Tranca, La libertad, Pice",-79.672663,-1.278395,La Costa,3/22/19,10:03:00 PM,3,22,2019,Overflow,urban,0,0,0,0,0,1,0,0,0,0,,,,,,4.0,22.0,,,,66.0,,1,8,8,22.0,4.0,3.0,2019-03-23 03:03:00
4597,SNGRE,LOS RIOS,EC12,BABA,EC1202,GUARE,EC120251,Rctos: Santa Ana 1 y Santa Ana 2,-79.687551,-1.714101,La Costa,1/12/19,4:00:00 PM,1,12,2019,Rain,Short duration flood,0,0,0,0,0,0,0,0,0,1,,,,,,,,,,,26.0,,7,8,8,,,,2019-01-12 21:00:00
2363,Desinventar/SNGRE_2021,GUAYAS,EC09,DAULE,EC0906,JUAN BAUTISTA AGUIRRE (LOS TIN,EC090652,Recinto Sapanal  y Malecon de Parroquia Juan Bautista Aguirr,-79.8625,-1.877,La Costa,4/25/13,8:00:00 AM,4,25,2013,Rain / Overflow,Heavy precipitation,1,0,0,0,0,0,0,0,0,0,,,,,,,,,,,,,2,8,8,,,,2013-04-25 13:00:00
2063,Desinventar/SNGRE_2021,GUAYAS,EC09,PALESTINA,EC0913,PALESTINA,EC091350,Recinto Corona de Adentro,-79.8898,-1.704,La Costa,3/7/13,7:30:00 PM,3,7,2013,Rain,Heavy precipitation,1,0,0,0,0,0,0,0,0,0,,,,,,,113.0,113.0,,,,,2,8,8,113.0,,5.0,2013-03-08 00:30:00
2066,Desinventar/SNGRE_2021,GUAYAS,EC09,PALESTINA,EC0913,PALESTINA,EC091350,Recinto Juanita de las Mercedes,-79.9193,-1.6368,La Costa,3/7/13,10:00:00 PM,3,7,2013,Rain,Heavy precipitation,1,0,0,0,0,0,0,0,0,0,,,,,,,,,,,,,2,8,8,,,,2013-03-08 03:00:00
2253,Desinventar/SNGRE_2021,GUAYAS,EC09,PALESTINA,EC0913,PALESTINA,EC091350,Varios Recintos,-79.9193,-1.6368,La Costa,4/10/13,9:00:00 AM,4,10,2013,Rain,Heavy precipitation,1,0,0,0,0,0,0,0,0,0,,,,,,,,,,,,,2,8,8,,,,2013-04-10 14:00:00
3196,Desinventar,GUAYAS,EC09,PALESTINA,EC0913,PALESTINA,EC091350,Comunidad La Librada,-79.92385,-1.604071,La Costa,5/27/15,10:30:00 AM,5,27,2015,Rain,Strong current,0,0,0,0,0,0,0,0,1,0,,,,,,,,,,,,,7,8,8,,,,2015-05-27 15:30:00
3089,Desinventar,MANABI,EC13,PEDERNALES,EC1317,PEDERNALES,EC131750,La Violeta-Via Chamanga,-80.002194,0.083904,La Costa,3/28/15,7:00:00 AM,3,28,2015,Rain / Overflow,Heavy precipitation,1,0,0,0,0,0,0,0,0,0,,,,,3.0,,10.0,10.0,,,,,2,8,8,10.0,3.0,2.0,2015-03-28 12:00:00
234,SNGRE_2021,MANABI,EC13,CHONE,EC1303,CANUTO,EC130352,"Canuto (Rio Grande, Boca de Chorrera, Puente de Agua fria, La Juanita, Mocoral 1 y 2)",-80.11,-0.81,La Costa,3/15/10,5:00:00 PM,3,15,2010,Rain,strong current,0,0,0,0,0,0,0,0,1,0,,,,,,,,,,,,,7,8,8,,,,2010-03-15 22:00:00
3325,Desinventar,MANABI,EC13,CHONE,EC1303,CANUTO,EC130352,La Vainilla,-80.149231,-0.781085,La Costa,1/25/16,5:00:00 AM,1,25,2016,Rain ,Heavy precipitation,1,0,0,0,0,0,0,0,0,0,,,,,,,,,,,3.0,,2,8,8,,,,2016-01-25 10:00:00
5238,SNGRE_2021,CARCHI,EC04,SAN PEDRO DE HUACA,EC0406,HUACA,EC040650,Unidad Educativa Manuel Velasco,-77.7259,0.6338,La Sierra,4/14/20,3:50:00 PM,4,14,2020,Rain,Heavy precipitation/Short duration rain,1,1,0,0,0,0,0,0,0,0,,,,,,,,,,,,,5,9,8,,,,2020-04-14 20:50:00
4516,Desinventar,CARCHI,EC04,MONTUFAR,EC0405,PIARTAL,EC040555,Piartal,-77.766166,0.561452,La Sierra,9/5/18,9:00:00 AM,9,5,2018,Rain / Overflow,Heavy precipitation/ Artificial waterway overflow,1,0,1,0,0,0,0,0,0,0,,,,,3.0,,12.0,12.0,,,,,3,9,8,12.0,3.0,3.0,2018-09-05 14:00:00
2616,Desinventar/SNGRE_2021,NAPO,EC15,TENA,EC1501,TENA,EC150150,"Barrio: Aeropuerto No 2, Pepita de Oro, via Tena-Archidona (",-77.811793,-0.993274,La Sierra,2/6/14,10:00:00 PM,2,6,2014,Rain / Overflow,Small stream overflow/ Short duration rain,0,1,0,1,0,0,0,0,0,0,,,,,9.0,,29.0,29.0,,,,,7,9,8,29.0,9.0,3.0,2014-02-07 03:00:00
3865,Desinventar,NAPO,EC15,TENA,EC1501,SAN JUAN DE MUYUNA,EC150158,"Comunidad Muyuna, Cabanas Chuquitos, Cementerio Antiguo, Bar",-77.853714,-0.979459,La Sierra,2/24/17,4:30:00 AM,2,24,2017,Rain / Overflow,Heavy precipitation/ Short duration rain,1,1,0,0,0,0,0,0,0,0,,,,,,,,,,,,,5,9,8,,,,2017-02-24 09:30:00
4298,Desinventar,NAPO,EC15,TENA,EC1501,SAN JUAN DE MUYUNA,EC150158,"Lupi, San Francisco de Muyuna, San Pascual de Muyuna, San Pe",-77.85563,-0.97645,La Sierra,9/2/17,9:30:00 PM,9,2,2017,Rain / Overflow,Heavy precipitation/Small stream overflow,1,0,0,1,0,0,0,0,0,0,,,,,51.0,,225.0,225.0,,,45.0,,6,9,8,225.0,51.0,5.0,2017-09-03 02:30:00
5356,SNGRE_2021,NAPO,EC15,TENA,EC1501,PANO,EC150154,Pano,-77.864689,-1.018474,La Sierra,11/11/20,8:30:00 PM,11,11,2020,Rain/Overflow,Short duration rain,0,1,0,0,0,0,0,0,0,0,,,,,,,,,,,,,3,9,8,,,,2020-11-12 01:30:00
3132,Desinventar,IMBABURA,EC10,PIMAMPIRO,EC1005,PIMAMPIRO,EC100550,Chalguayacu.,-77.951956,0.42273,La Sierra,4/17/15,5:00:00 PM,4,17,2015,Rain / Overflow,Heavy precipitation/ Artificial waterway overflow/ Short duration rain,1,1,1,0,0,0,0,0,0,0,,,,,,,30.0,30.0,,,21.29,,6,9,8,30.0,,3.0,2015-04-17 22:00:00
4254,Desinventar,NAPO,EC15,QUIJOS,EC1507,COSANGA,EC150751,Santa Lucia de Bermejo,-77.959091,-0.578698,La Sierra,5/13/17,2:00:00 AM,5,13,2017,Rain / Overflow,Heavy precipitation/ Short duration rain,1,1,0,0,0,0,0,0,0,0,,,,,1.0,,16.0,16.0,,,,3.0,5,9,8,16.0,1.0,3.0,2017-05-13 07:00:00
4274,Desinventar,MORONA SANTIAGO,EC14,MORONA,EC1401,RIO BLANCO,EC140164,Playas de Arapicos,-78.378457,-2.379408,La Sierra,6/12/17,9:34:00 PM,6,12,2017,Rain ,Surface runoff,0,0,0,0,1,0,0,0,0,0,,,,,1.0,,7.0,9.0,,9.0,,,6,9,8,9.0,1.0,2.0,2017-06-13 02:34:00
4239,SNGRE,PICHINCHA,EC17,MEJIA,EC1703,ALOASI,EC170352,Barrio Centro. Calle Melchor Norona,-78.58352,-0.520107,La Sierra,5/3/17,10:17:00 PM,5,3,2017,Rain / Overflow,Heavy precipitation/ Artificial waterway overflow,1,0,1,0,0,0,0,0,0,0,,,,,,,1.0,,,1.0,,,3,9,8,1.0,,1.0,2017-05-04 03:17:00
5028,SNGRE_2021,PICHINCHA,EC17,MEJIA,EC1703,ALOASI,EC170352,Calles Victor Velasco y Antonio Jose de Sucre UE Aloasi,-78.588185,-0.5204657,La Sierra,11/3/19,2:43:00 PM,11,3,2019,Overflow,Artificial waterway overflow/ surface runoff,0,0,1,0,1,0,0,0,0,0,,,,,10.0,,,2319.0,14.0,,,,7,9,8,2319.0,10.0,,2019-11-03 19:43:00
4136,Desinventar,PICHINCHA,EC17,MEJIA,EC1703,ALOASI,EC170352,La Moya/Umbria,-78.594021,-0.516593,La Sierra,4/7/17,5:04:00 PM,4,7,2017,Rain / Overflow,Heavy precipitation/Small stream overflow,1,0,0,1,0,0,0,0,0,0,,,,,,,,,,,,,6,9,8,,,,2017-04-07 22:04:00
4902,SNGRE_2021,TUNGURAHUA,EC18,MOCHA,EC1804,MOCHA,EC180450,Barrio San Juan,-78.662186,-1.40555,La Sierra,4/3/19,2:20:00 AM,4,3,2019,Rain,Artificial waterway overflow/Surface runoff,0,0,1,0,1,0,0,0,0,0,,,,,1.0,1.0,3.0,,,,2.0,1.0,7,9,8,3.0,1.0,1.0,2019-04-03 07:20:00
5083,SNGRE_2021,TUNGURAHUA,EC18,MOCHA,EC1804,MOCHA,EC180450,"Unidad Educativa Vicente Anda Aguirre, Barrios San Juan, Cochalata, El Rey, Santa Marianita, La Estacion",-78.667244,-1.415843,La Sierra,1/22/20,9:30:00 PM,1,22,2020,Rain/Overflow,Artificial waterway overflow/Surface runoff,0,0,1,0,1,0,0,0,0,0,,,,,7.0,9.0,28.0,,,,1.5,0.4,7,9,8,28.0,9.0,3.0,2020-01-23 02:30:00
3561,Desinventar,TUNGURAHUA,EC18,AMBATO,EC1801,QUISAPINCHA (QUIZAPINCHA),EC180162,Andiglata ref. Por el parque El Huerto,-78.716495,-1.192557,La Sierra,4/1/16,11:35:00 PM,4,1,2016,Rain ,Surface runoff,0,0,0,0,1,0,0,0,0,0,,,,,7.0,,21.0,21.0,21.0,,,,6,9,8,21.0,7.0,3.0,2016-04-02 04:35:00
4345,SNGRE_2021,TUNGURAHUA,EC18,AMBATO,EC1801,PASA,EC180159,Via a Pasa Ref. 500 metros del Complejo de Tilulun.,-78.738653,-1.2404986,La Sierra,12/30/17,3:23:00 PM,12,30,2017,Rain,Surface runoff,0,0,0,0,1,0,0,0,0,0,,,,,,,,,,,,,6,9,8,,,,2017-12-30 20:23:00
3679,Desinventar,ZAMORA CHINCHIPE,EC19,ZAMORA,EC1901,SAN CARLOS DE LAS MINAS,EC190158,Nambija,-78.789726,-4.072143,La Sierra,12/28/16,11:00:00 AM,12,28,2016,Rain / Overflow,Strong current,0,0,0,0,0,0,0,0,1,0,,,,,,,,,,,,,7,9,8,,,,2016-12-28 16:00:00
3163,Desinventar/SNGRE_2021,ZAMORA CHINCHIPE,EC19,ZAMORA,EC1901,SAN CARLOS DE LAS MINAS,EC190158,Barrio Lucero,-78.789772,-4.0718358,La Sierra,4/26/15,10:00:00 AM,4,26,2015,Rain / Overflow,Small stream overflow,0,0,0,1,0,0,0,0,0,0,,,,,11.0,,45.0,45.0,,,,,4,9,8,45.0,11.0,3.0,2015-04-26 15:00:00
4311,SNGRE_2021,ZAMORA CHINCHIPE,EC19,ZAMORA,EC1901,SAN CARLOS DE LAS MINAS,EC190158,San Carlos (El Panteon),-78.814939,-4.026676,La Sierra,10/22/17,11:17:00 PM,10,22,2017,Rain,Surface runoff,0,0,0,0,1,0,0,0,0,0,,,,,,,,,,,,,6,9,8,,,,2017-10-23 04:17:00
2466,Desinventar/SNGRE_2021,ZAMORA CHINCHIPE,EC19,ZAMORA,EC1901,SAN CARLOS DE LAS MINAS,EC190158,San Carlos (a 100 mts del centro poblado),-78.8258,-4.0149,La Sierra,10/17/13,4:00:00 AM,10,17,2013,Long duration rain,Urban/ Heavy precipitation,1,0,0,0,0,1,0,0,0,0,,,,,,,,,,,,,3,9,8,,,,2013-10-17 09:00:00
3539,Desinventar,CHIMBORAZO,EC06,GUAMOTE,EC0606,PALMIRA,EC060652,Comunidad Tipin Chacallo ,-78.846592,-2.074838,La Sierra,3/13/16,3:00:00 PM,3,13,2016,Rain ,Small stream overflow,0,0,0,1,0,0,0,0,0,0,,,,,,,20.0,20.0,,,,,4,9,8,20.0,,3.0,2016-03-13 20:00:00
4321,SNGRE_2021,ZAMORA CHINCHIPE,EC19,ZAMORA,EC1901,GUADALUPE,EC190152,La Saquea,-78.912701,-3.869643,La Sierra,11/8/17,5:25:00 AM,11,8,2017,Rain,Surface runoff,0,0,0,0,1,0,0,0,0,0,,,,,,,,,,,,,6,9,8,,,,2017-11-08 10:25:00
3299,Desinventar,AZUAY,EC01,CUENCA,EC0101,RICAURTE,EC010162,Via Deleg-Daniel Duran,-78.964126,-2.863229,La Sierra,1/13/16,3:00:00 PM,1,13,2016,Rain / Overflow,Strong current,0,0,0,0,0,0,0,0,1,0,,,,,,,,,,,,,7,9,8,,,,2016-01-13 20:00:00
2919,Desinventar,AZUAY,EC01,CUENCA,EC0101,CHIQUINTAD,EC010155,Ochoa Leon,-78.985808,-2.834476,La Sierra,12/22/14,4:35:00 PM,12,22,2014,Rain ,Heavy precipitation/ Short duration rain,1,1,0,0,0,0,0,0,0,0,,,,,5.0,,4.0,4.0,,,,,5,9,8,4.0,5.0,1.0,2014-12-22 21:35:00
2196,SNGRE_2021,AZUAY,EC01,CUENCA,EC0101,HERMANO MIGUEL,EC010150,Puente de Las Monjas,-78.9862,-2.8668,La Sierra,3/25/13,3:10:00 PM,3,25,2013,Rain ,Heavy precipitation/ Urban,1,0,0,0,0,1,0,0,0,0,,,,,1.0,,,,,,,,3,9,8,,1.0,,2013-03-25 20:10:00
2195,Desinventar,AZUAY,EC01,CUENCA,EC0101,HERMANO MIGUEL,EC010150,Puente de Las Monjas,-78.98822,-2.86438,La Sierra,3/25/13,3:10:00 PM,3,25,2013,Rain ,Heavy precipitation / Urban,1,0,0,0,0,1,0,0,0,0,,,,,1.0,,,,,,,,3,9,8,,1.0,,2013-03-25 20:10:00
3046,Desinventar,CHIMBORAZO,EC06,PALLATANGA,EC0608,PALLATANGA,EC060850,Calle 24 de mayo.,-78.995963,-2.065951,La Sierra,3/20/15,5:00:00 AM,3,20,2015,Rain ,Urban/ Short duration rain,0,1,0,0,0,1,0,0,0,0,,,,,,,,,,,,,4,9,8,,,,2015-03-20 10:00:00
2917,Desinventar,AZUAY,EC01,CUENCA,EC0101,CHIQUINTAD,EC010155,Tres Esquinas,-78.999286,-2.819563,La Sierra,12/21/14,4:28:00 PM,12,21,2014,Rain ,Heavy precipitation/ Short duration rain,1,1,0,0,0,0,0,0,0,0,,,,,5.0,,14.0,14.0,,,,,5,9,8,14.0,5.0,3.0,2014-12-21 21:28:00
2780,Desinventar,AZUAY,EC01,CUENCA,EC0101,VICTORIA DEL PORTETE (IRQUIS),EC010171,Victoria del Portete,-79.063729,-3.061579,La Sierra,5/5/14,5:15:00 AM,5,5,2014,Rain / Overflow,Heavy precipitation/ Short duration rain,1,1,0,0,0,0,0,0,0,0,,,,,4.0,,,,,,,,5,9,8,,4.0,,2014-05-05 10:15:00
2464,Desinventar/SNGRE_2021,AZUAY,EC01,ONA,EC0110,SAN FELIPE DE OÑA,EC011050,Escuela Esther Ullauri,-79.1066,-3.5121,La Sierra,10/16/13,1:40:00 PM,10,16,2013,Rain ,Heavy precipitation/Short duration rain,1,1,0,0,0,0,0,0,0,0,,,,,,,,,,,,,5,9,8,,,,2013-10-16 18:40:00
1758,SNGRE_2021,LOJA,EC11,LOJA,EC1101,EL SAGRARIO,EC110150,"Calles 18 de Noviembre, Colon, Imbabura, Sucre, Bolivar, Bernardo Valdivieso, Olmedo y Juan Jose Pena - Centro de la ciudad.",-79.178025,-3.997432,La Sierra,11/15/12,12:10:00 PM,11,15,2012,Rain,Heavy precipitation/ Urban/ Short duration rain,1,1,0,0,0,1,0,0,0,0,,,,,,,,,,,,,6,9,8,,,,2012-11-15 17:10:00
2656,Desinventar/SNGRE_2021,LOJA,EC11,LOJA,EC1101,EL SAGRARIO,EC110150,Av. Emiliano Ortega y 10 de Agosto,-79.178025,-3.997432,La Sierra,3/1/14,6:00:00 AM,3,1,2014,Rain / Overflow,Heavy precipitation / Short duration rain,1,1,0,0,0,0,0,0,0,0,,,,,1.0,,,,,,,,5,9,8,,1.0,,2014-03-01 11:00:00
5054,SNGRE_2021,LOJA,EC11,LOJA,EC1101,VALLE,EC110150,"Jipiro Alto, El Paraiso",-79.187931,-3.9682936,La Sierra,12/7/19,4:57:00 PM,12,7,2019,Rain/ Overflow,Surface runoff,0,0,0,0,1,0,0,0,0,0,,,,,,,,,,,,,6,9,8,,,,2019-12-07 21:57:00
1804,Desinventar/SNGRE_2021,LOJA,EC11,LOJA,EC1101,SAN SEBASTIAN,EC110150,Los Operadores,-79.1885,-4.0603,La Sierra,1/17/13,8:30:00 PM,1,17,2013,Rain,Heavy precipitation/ Urban,1,0,0,0,0,1,0,0,0,0,,,,,1.0,,5.0,5.0,,,,,3,9,8,5.0,1.0,1.0,2013-01-18 01:30:00
1836,Desinventar/SNGRE_2021,LOJA,EC11,LOJA,EC1101,SAN SEBASTIAN,EC110150,Av Eduardo Kigman; Cabo Minacho; Escuela Alonso de Mercadill,-79.1885,-4.0603,La Sierra,1/24/13,10:00:00 PM,1,24,2013,Rain,Heavy precipitation/ Urban / Short duration rain,1,1,0,0,0,1,0,0,0,0,,,,,,,,,,,,,6,9,8,,,,2013-01-25 03:00:00
1878,SNGRE_2021,LOJA,EC11,LOJA,EC1101,SAN SEBASTIAN,EC110150,Los Cocos ,-79.1885,-4.0603,La Sierra,2/4/13,12:00:00 AM,2,4,2013,Rain,Heavy precipitation/ Short duration rain/ Urban,1,1,0,0,0,1,0,0,0,0,,,,,3.0,,15.0,,,,,,6,9,8,15.0,3.0,3.0,2013-02-04 05:00:00
1869,SNGRE_2021,LOJA,EC11,LOJA,EC1101,SAN SEBASTIAN,EC110150,Ciudad Alegria ,-79.1885,-4.0603,La Sierra,2/3/13,10:30:00 AM,2,3,2013,Rain,Heavy precipitation/ Short duration rain/ Urban,1,1,0,0,0,1,0,0,0,0,,,,,,,,,,,,,6,9,8,,,,2013-02-03 15:30:00
1764,SNGRE_2021,LOJA,EC11,LOJA,EC1101,SAN SEBASTIAN,EC110150,Calle Jose Joaquin de Olmedo - Tras el Fuerte Militar Cabo Mincho,-79.188536,-4.060267,La Sierra,11/15/12,12:10:00 PM,11,15,2012,Rain,Heavy precipitation/ Urban/ Short duration rain,1,1,0,0,0,1,0,0,0,0,,,,,1.0,,9.0,,,,,,6,9,8,9.0,1.0,2.0,2012-11-15 17:10:00
2657,Desinventar/SNGRE_2021,LOJA,EC11,LOJA,EC1101,SAN SEBASTIAN,EC110150,"La Argelia, La Tebaida y Esteban Godoy",-79.188536,-4.060267,La Sierra,3/1/14,5:30:00 AM,3,1,2014,Rain / Overflow,Heavy precipitation / Short duration rain,1,1,0,0,0,0,0,0,0,0,,,,,5.0,,,,,,,,5,9,8,,5.0,,2014-03-01 10:30:00
2664,Desinventar,LOJA,EC11,LOJA,EC1101,VALLE,EC110150,"Sauces Norte, Isaac Ordonez y Zona Militar.",-79.200161,-3.984317,La Sierra,3/1/14,6:00:00 AM,3,1,2014,Rain / Overflow,Heavy precipitation / Short duration rain,1,1,0,0,0,0,0,0,0,0,,,,,6.0,,,,,,,,5,9,8,,6.0,,2014-03-01 11:00:00
2897,Desinventar,LOJA,EC11,LOJA,EC1101,SAN SEBASTIAN,EC110150,Barrio Los Geranios,-79.202318,-4.022915,La Sierra,10/26/14,5:30:00 PM,10,26,2014,Rain,Heavy precipitation/ Urban/ Short duration rain,1,1,0,0,0,1,0,0,0,0,,,,,5.0,,20.0,20.0,,,,,6,9,8,20.0,5.0,3.0,2014-10-26 22:30:00
2737,Desinventar,LOJA,EC11,LOJA,EC1101,SAN SEBASTIAN,EC110150,La Tebaida y Esteban Godoy,-79.20709,-4.019345,La Sierra,4/3/14,3:00:00 PM,4,3,2014,Rain,Heavy precipitation/ Urban/ Short duration rain,1,1,0,0,0,1,0,0,0,0,,,,,8.0,,40.0,40.0,,,,,6,9,8,40.0,8.0,3.0,2014-04-03 20:00:00
5352,SNGRE_2021,LOJA,EC11,LOJA,EC1101,MALACATOS (VALLADOLID),EC110156,"Rumishitana, via Loja-Malacatos [E35]",-79.209399,-4.1554928,La Sierra,10/27/20,4:10:00 PM,10,27,2020,Rain,Surface runoff,0,0,0,0,1,0,0,0,0,0,,,,,,,,,,,,,6,9,8,,,,2020-10-27 21:10:00
2677,Desinventar,LOJA,EC11,LOJA,EC1101,SUCRE,EC110150,"Av. Occidental de Paso, Lojana de Turismo, Las Penas y Pedes",-79.212291,-3.991921,La Sierra,3/4/14,3:00:00 PM,3,4,2014,Rain,Heavy precipitation/ Urban/ Short duration rain,1,1,0,0,0,1,0,0,0,0,,,,,10.0,,50.0,50.0,,,,,6,9,8,50.0,10.0,3.0,2014-03-04 20:00:00
3083,Desinventar,LOJA,EC11,LOJA,EC1101,SUCRE,EC110150,"Turunuma, Clodoveo Jaramillo, Carigan,",-79.214321,-3.977168,La Sierra,3/27/15,3:30:00 AM,3,27,2015,Rain ,Surface runoff,0,0,0,0,1,0,0,0,0,0,,,,,6.0,,30.0,30.0,,,,,6,9,8,30.0,6.0,3.0,2015-03-27 08:30:00
2680,Desinventar,LOJA,EC11,SARAGURO,EC1111,URDANETA (PAQUISHAPA),EC111159,Canaro,-79.216526,-3.595153,La Sierra,3/5/14,12:30:00 PM,3,5,2014,Rain,Heavy precipitation / Short duration rain,1,1,0,0,0,0,0,0,0,0,,,,,,,,,,,,,5,9,8,,,,2014-03-05 17:30:00
1870,SNGRE_2021,LOJA,EC11,LOJA,EC1101,SAN SEBASTIAN,EC110150,Pucara,-79.2168,-4.017,La Sierra,2/3/13,9:10:00 AM,2,3,2013,Rain,Heavy precipitation/ Short duration rain/ Urban,1,1,0,0,0,1,0,0,0,0,,,,,1.0,,4.0,,,,,,6,9,8,4.0,1.0,1.0,2013-02-03 14:10:00
1806,Desinventar/SNGRE_2021,LOJA,EC11,LOJA,EC1101,SUCRE,EC110150,San Jose,-79.2233,-4.0116,La Sierra,1/17/13,8:30:00 PM,1,17,2013,Rain,Heavy precipitation/ Urban,1,0,0,0,0,1,0,0,0,0,,,,,3.0,,16.0,16.0,,,,,3,9,8,16.0,3.0,3.0,2013-01-18 01:30:00
2872,Desinventar,LOJA,EC11,LOJA,EC1101,SUCRE,EC110150,"Menfis Alto, El Bosque, Avenida de los Paltas, Daniel Alvare",-79.231126,-4.004947,La Sierra,10/9/14,5:44:00 PM,10,9,2014,Rain,Heavy precipitation/ Urban/ Short duration rain,1,1,0,0,0,1,0,0,0,0,,,,,5.0,,20.0,20.0,,,,,6,9,8,20.0,5.0,3.0,2014-10-09 22:44:00
1881,SNGRE_2021,LOJA,EC11,LOJA,EC1101,SUCRE,EC110150,Pedestal,-79.2364,-3.9856,La Sierra,2/4/13,12:00:00 AM,2,4,2013,Rain,Heavy precipitation/ Short duration rain/ Urban,1,1,0,0,0,1,0,0,0,0,,,,,2.0,,10.0,,,,,,6,9,8,10.0,2.0,2.0,2013-02-04 05:00:00
1882,SNGRE_2021,LOJA,EC11,LOJA,EC1101,SUCRE,EC110150,Celi Roman  ,-79.2364,-3.9856,La Sierra,2/4/13,11:00:00 PM,2,4,2013,Rain,Heavy precipitation/ Short duration rain/ Urban,1,1,0,0,0,1,0,0,0,0,,,,,2.0,,9.0,,,,,,6,9,8,9.0,2.0,2.0,2013-02-05 04:00:00
2894,Desinventar,LOJA,EC11,LOJA,EC1101,SUCRE,EC110150,"Barrio Son de los Andes, Ciudadela Los Operadores, Ciudadela",-79.236429,-3.985562,La Sierra,10/25/14,5:30:00 PM,10,25,2014,Rain,Heavy precipitation/ Urban/ Short duration rain,1,1,0,0,0,1,0,0,0,0,,,,,20.0,,65.0,65.0,,,,,6,9,8,65.0,20.0,4.0,2014-10-25 22:30:00
3672,Desinventar,LOJA,EC11,LOJA,EC1101,SUCRE,EC110150,Barrio El Dorado Alto,-79.236429,-3.985562,La Sierra,11/27/16,8:00:00 AM,11,27,2016,Rain ,Surface runoff,0,0,0,0,1,0,0,0,0,0,,,,,1.0,,1.0,1.0,,,,,6,9,8,1.0,1.0,1.0,2016-11-27 13:00:00
4070,Desinventar,LOJA,EC11,LOJA,EC1101,SANTIAGO,EC110159,Barrio Paquisha,-79.288144,-3.796761,La Sierra,3/29/17,8:00:00 AM,3,29,2017,Rain ,Surface runoff,0,0,0,0,1,0,0,0,0,0,,,,,1.0,,5.0,5.0,,,,,6,9,8,5.0,1.0,1.0,2017-03-29 13:00:00
3864,Desinventar,AZUAY,EC01,CUENCA,EC0101,MOLLETURO,EC010157,Luz y guia,-79.397208,-2.717509,La Sierra,2/24/17,10:00:00 AM,2,24,2017,Rain / Overflow,River bank failure,0,0,0,0,0,0,0,1,0,0,,,,,,,,,,,,,4,9,8,,,,2017-02-24 15:00:00
3590,Desinventar,LOS RIOS,EC12,VENTANAS,EC1207,ZAPOTAL,EC120752,Zapotillo,-79.40872,-1.359028,La Costa,4/10/16,6:50:00 AM,4,10,2016,Rain ,Heavy precipitation/ Short duration rain,1,1,0,0,0,0,0,0,0,0,,,,,1.0,,3.0,3.0,,3.0,,,5,9,8,3.0,1.0,1.0,2016-04-10 11:50:00
5215,SNGRE_2021,LOJA,EC11,SARAGURO,EC1111,MANU,EC111154,Escuela de Educacion Basica Natal Orellana,-79.4115,-3.4858619,La Sierra,3/12/20,8:00:00 AM,3,12,2020,Rain/ landslides,strong current,0,0,0,0,0,0,0,0,1,0,,,,,,,,,,,,,7,9,8,,,,2020-03-12 13:00:00
4527,SNGRE,LOJA,EC11,GONZANAMA,EC1107,GONZANAMA,EC110750,"San Pedro (La Cruz.), via San Pedro - Cariamanga [E69]",-79.44,-4.23,La Sierra,11/7/18,4:30:00 PM,11,7,2018,Rain,Strong current,0,0,0,0,0,0,0,0,1,0,,,,,,,7.0,,,,,,7,9,8,7.0,,2.0,2018-11-07 21:30:00
3090,Desinventar,EL ORO,EC07,ZARUMA,EC0713,SALVIAS,EC071359,Ortega Bajo,-79.54847,-3.637246,La Sierra,3/28/15,5:30:00 PM,3,28,2015,Rain / Overflow,Short duration flood,0,0,0,0,0,0,0,0,0,1,,,,,4.0,,19.0,19.0,,,,,7,9,8,19.0,4.0,3.0,2015-03-28 22:30:00
4406,Desinventar,LOS RIOS,EC12,PUEBLOVIEJO,EC1204,PUERTO PECHICHE,EC120451,El Atasco - via La Templanza,-79.567471,-1.414905,La Costa,3/2/18,4:30:00 AM,3,2,2018,Rain ,Short duration rain,0,1,0,0,0,0,0,0,0,0,,,,,,,,,,,,1.0,3,9,8,,,,2018-03-02 09:30:00
4148,Desinventar,ESMERALDAS,EC08,ESMERALDAS,EC0801,ESMERALDAS,EC080150,Isla Luis Vargas Torres,-79.640089,0.964368,La Costa,4/8/17,12:55:00 PM,4,8,2017,Rain,Heavy precipitation/Urban,1,0,0,0,0,1,0,0,0,0,,,,,40.0,,160.0,160.0,,,,,3,9,8,160.0,40.0,5.0,2017-04-08 17:55:00
3761,Desinventar,ESMERALDAS,EC08,ESMERALDAS,EC0801,ESMERALDAS,EC080150,SANTA MARTHA,-79.648929,0.970513,La Costa,2/2/17,6:00:00 AM,2,2,2017,Rain,Heavy precipitation/Short duration rain,1,1,0,0,0,0,0,0,0,0,,,,,158.0,,568.0,568.0,,,,,5,9,8,568.0,158.0,6.0,2017-02-02 11:00:00
3274,Desinventar,ESMERALDAS,EC08,ESMERALDAS,EC0801,ESMERALDAS,EC080150,Gustavo Becerra Entre Piedrahita Y 9 De Octubre,-79.663836,0.962932,La Costa,12/5/15,6:40:00 AM,12,5,2015,Rain ,Heavy precipitation / Urban,1,0,0,0,0,1,0,0,0,0,,,,,1.0,,3.0,3.0,,,,,3,9,8,3.0,1.0,1.0,2015-12-05 11:40:00
2335,Desinventar/SNGRE_2021,CARCHI,EC04,BOLIVAR,EC0402,SAN RAFAEL,EC040255,San Rafael,-77.911,0.4128,La Sierra,4/21/13,9:00:00 PM,4,21,2013,Rain,Heavy precipitation/ Short duration rain,1,1,0,0,0,0,0,0,0,0,,,,,4.0,,11.0,11.0,,,,,5,10,8,11.0,4.0,3.0,2013-04-22 02:00:00
3137,Desinventar,IMBABURA,EC10,IBARRA,EC1001,LA DOLOROSA DE PRIORATO,EC100150,Priorato.,-78.109837,0.382988,La Sierra,4/20/15,10:00:00 PM,4,20,2015,Rain / Overflow,Heavy precipitation/ Artificial waterway overflow/ Short duration rain,1,1,1,0,0,0,0,0,0,0,,,,,3.0,,21.0,21.0,11.0,21.0,,,6,10,8,21.0,3.0,3.0,2015-04-21 03:00:00
5042,SNGRE_2021,PICHINCHA,EC17,CAYAMBE,EC1702,CAYAMBE,EC170250,Comunidad Santa Isabel Via al Refugio- Juan Montalvo,-78.116751,0.0100722,La Sierra,11/18/19,4:49:00 PM,11,18,2019,Overflow,Artificial waterway overflow/ surface runoff,0,0,1,0,1,0,0,0,0,0,,,,,5.0,2.0,13.0,,,,,,7,10,8,13.0,5.0,3.0,2019-11-18 21:49:00
2835,Desinventar,IMBABURA,EC10,OTAVALO,EC1004,SAN PABLO,EC100457,El Chilco,-78.168599,0.207911,La Sierra,5/23/14,11:00:00 PM,5,23,2014,Rain,Heavy precipitation/ Short duration rain,1,1,0,0,0,0,0,0,0,0,,,,,1.0,,4.0,4.0,,,,,5,10,8,4.0,1.0,1.0,2014-05-24 04:00:00
4306,SNGRE_2021,PICHINCHA,EC17,QUITO,EC1701,EL QUINCHE,EC170160,Barrio San Jose del Quinche (Frente a la Quebrada Iguiniaro),-78.299375,-0.1232612,La Sierra,10/16/17,7:45:00 PM,10,16,2017,Rain/ Landslide,Surface runoff,0,0,0,0,1,0,0,0,0,0,,,,,,,,,,,,,6,10,8,,,,2017-10-17 00:45:00
5002,SNGRE_2021,TUNGURAHUA,EC18,BAÑOS DE AGUA SANTA,EC1802,RÍO VERDE,EC180253,"Por el tercer tunel, via Banos - Puyo [E30]",-78.299668,-1.40078,La Sierra,8/14/19,12:31:00 AM,8,14,2019,Rain,Surface runoff,0,0,0,0,1,0,0,0,0,0,,,,,,,,,,,,,6,10,8,,,,2019-08-14 05:31:00
3531,Desinventar,PICHINCHA,EC17,QUITO,EC1701,POMASQUI,EC170177,Urb. El Rosario,-78.447237,-0.027286,La Sierra,3/12/16,1:02:00 AM,3,12,2016,Rain ,Strong current,0,0,0,0,0,0,0,0,1,0,,,,,,,,,,,,,7,10,8,,,,2016-03-12 06:02:00
4519,Desinventar,PICHINCHA,EC17,QUITO,EC1701,COTOCOLLAO,EC170150,Diego Vasquez de Cepeda y Manta,-78.492384,-0.118704,La Sierra,9/16/18,6:07:00 PM,9,16,2018,Rain,Heavy precipitation/Short duration rain,1,1,0,0,0,0,0,0,0,0,,,,,2.0,,15.0,15.0,,,,,5,10,8,15.0,2.0,3.0,2018-09-16 23:07:00
4930,SNGRE_2021,PICHINCHA,EC17,QUITO,EC1701,QUITO,EC170150,Rumipamba- Calle Juan Diaz Oe9 y Antonio Sanchez,-78.502107,-0.1748642,La Sierra,4/27/19,4:31:00 PM,4,27,2019,Rain,Surface runoff,0,0,0,0,1,0,0,0,0,0,,,,,,,,,,,,,6,10,8,,,,2019-04-27 21:31:00
5004,SNGRE_2021,PICHINCHA,EC17,QUITO,EC1701,BELISARIO QUEVEDO,EC170150,Calle Humberto Albornoz,-78.512304,-0.1887467,La Sierra,9/4/19,4:40:00 AM,9,4,2019,Failure,Surface runoff,0,0,0,0,1,0,0,0,0,0,,,,,3.0,1.0,12.0,,,,,,6,10,8,12.0,3.0,3.0,2019-09-04 09:40:00
2841,Desinventar,PICHINCHA,EC17,QUITO,EC1701,EL CONDADO,EC170150,San Jose del Condado y Piedras Negras,-78.525491,-0.100973,La Sierra,6/4/14,3:00:00 AM,6,4,2014,,Strong current,0,0,0,0,0,0,0,0,1,0,,1.0,,,3.0,,15.0,15.0,,,,,7,10,8,15.0,3.0,3.0,2014-06-04 08:00:00
5359,SNGRE_2021,PICHINCHA,EC17,QUITO,EC1701,QUITO,EC170150,Calle Arenillas entre Zaruma y Huaquillas. Chilibulo,-78.533708,-0.2391147,La Sierra,11/28/20,1:21:00 PM,11,28,2020,Rain,Surface runoff,0,0,0,0,1,0,0,0,0,0,,,,,1.0,,,,,,,,6,10,8,,1.0,,2020-11-28 18:21:00
2274,Desinventar/SNGRE_2021,PICHINCHA,EC17,QUITO,EC1701,TURUBAMBA,EC170150,Caupicho; Calle Leonidas Doubles y Turubamba,-78.5343,-0.337,La Sierra,4/16/13,5:00:00 PM,4,16,2013,Rain ,Short duration rain/ Heavy precipitation,1,1,0,0,0,0,0,0,0,0,,,,,11.0,,,,,,,,5,10,8,,11.0,,2013-04-16 22:00:00
2772,Desinventar,PICHINCHA,EC17,QUITO,EC1701,SAN JUAN,EC170150,"UPC Miraflores Alto, La Cantera, Direccion: Bracamonte Y Jos",-78.53836,-0.198189,La Sierra,4/26/14,9:17:00 PM,4,26,2014,Rain/ Landslides,Urban / Slope,0,0,0,0,0,1,1,0,0,0,,,,,,,,,,,,,6,10,8,,,,2014-04-27 02:17:00
2394,Desinventar/SNGRE_2021,PICHINCHA,EC17,QUITO,EC1701,TURUBAMBA,EC170150,Caupicho Av Leonidas Dubles,-78.5411,-0.3278,La Sierra,5/8/13,8:30:00 PM,5,8,2013,Rain / Overflow,Heavy precipitation/ Small stream overflow,1,0,0,1,0,0,0,0,0,0,,,,,3.0,,,,,,,,6,10,8,,3.0,,2013-05-09 01:30:00
2905,Desinventar,PICHINCHA,EC17,QUITO,EC1701,GUAMANI,EC170150,"Prodesur, Camilo Orejuela y Pasaje 4",-78.57547,-0.336175,La Sierra,11/10/14,4:30:00 PM,11,10,2014,Rain ,Surface runoff,0,0,0,0,1,0,0,0,0,0,,,,,1.0,,7.0,7.0,,,,,6,10,8,7.0,1.0,2.0,2014-11-10 21:30:00
4542,Desinventar,TUNGURAHUA,EC18,MOCHA,EC1804,MOCHA,EC180450,Mauca Corral,-78.706307,-1.459092,La Sierra,12/4/18,4:00:00 PM,12,4,2018,Rain,Strong current,0,0,0,0,0,0,0,0,1,0,,,,,1.0,,5.0,5.0,,,6.0,,7,10,8,5.0,1.0,1.0,2018-12-04 21:00:00
4839,SNGRE,CHIMBORAZO,EC06,COLTA,EC0603,COLUMBE,EC060352,Comunidad Balda Lupaxi Bajo,-78.71228,-1.871731,La Sierra,3/20/19,3:15:00 PM,3,20,2019,Rain,Surface runoff,0,0,0,0,1,0,0,0,0,0,,,,,,,,,,,,,6,10,8,,,,2019-03-20 20:15:00
3721,Desinventar,CHIMBORAZO,EC06,RIOBAMBA,EC0601,CALPI,EC060152,Chiquitas,-78.778793,-1.659338,La Sierra,1/18/17,6:00:00 PM,1,18,2017,Rain / Overflow,Surface runoff,0,0,0,0,1,0,0,0,0,0,,,,,,,,,,,,,6,10,8,,,,2017-01-18 23:00:00
5240,SNGRE_2021,CHIMBORAZO,EC06,CHUNCHI,EC0605,CHUNCHI,EC060550,"Chaullabamba, Tagshana",-78.871572,-2.353325,La Sierra,4/15/20,6:00:00 AM,4,15,2020,Rain/Overflow,Artificial waterway overflow/Surface runoff,0,0,1,0,1,0,0,0,0,0,,,,,3.0,3.0,8.0,,,,,,7,10,8,8.0,3.0,2.0,2020-04-15 11:00:00
1649,Desinventar,AZUAY,EC01,CUENCA,EC0101,EL BATAN,EC010150,Coliseo Jefferson Perez,-79.01985,-2.89341,La Sierra,6/26/12,5:30:00 PM,6,26,2012,Overflow,Short duration flood,0,0,0,0,0,0,0,0,0,1,,,,,,,,,,,,,7,10,8,,,,2012-06-26 22:30:00
2881,Desinventar,AZUAY,EC01,CUENCA,EC0101,EL BATAN,EC010150,Puertas del Sol,-79.029025,-2.89192,La Sierra,10/11/14,9:34:00 PM,10,11,2014,Rain ,Heavy precipitation/ Short duration rain,1,1,0,0,0,0,0,0,0,0,,,,,4.0,,,,,,,,5,10,8,,4.0,,2014-10-12 02:34:00
2716,Desinventar,AZUAY,EC01,GIRON,EC0102,GIRON,EC010250,San Vicente de Pucucari,-79.14267,-3.151528,La Sierra,3/30/14,3:00:00 AM,3,30,2014,Rain / Overflow,Heavy precipitation/ Small stream overflow,1,0,0,1,0,0,0,0,0,0,,,,,,,,,,,,,6,10,8,,,,2014-03-30 08:00:00
1727,SNGRE_2021,AZUAY,EC01,CUENCA,EC0101,SAYAUSI,EC010165,Santa Maria,-79.170217,-2.800956,La Sierra,10/17/12,4:25:00 AM,10,17,2012,Rain/ Overflow,Urban/ Small stream overflow,0,0,0,1,0,1,0,0,0,0,,,,,30.0,,,,,,,,5,10,8,,30.0,,2012-10-17 09:25:00
2733,Desinventar,CANAR,EC03,CANAR,EC0303,SAN ANTONIO,EC030358,Patul centro,-79.216966,-2.69559,La Sierra,3/30/14,2:00:00 PM,3,30,2014,,Surface runoff,0,0,0,0,1,0,0,0,0,0,,,,,4.0,,10.0,10.0,6.0,,,,6,10,8,10.0,4.0,2.0,2014-03-30 19:00:00
2821,Desinventar,LOJA,EC11,LOJA,EC1101,QUINARA,EC110163,Quinara,-79.230213,-4.30948,La Sierra,5/12/14,6:42:00 AM,5,12,2014,Rain / Overflow,Heavy precipitation/ Small stream overflow,1,0,0,1,0,0,0,0,0,0,,,,,6.0,,27.0,27.0,6.0,,,,6,10,8,27.0,6.0,3.0,2014-05-12 11:42:00
1828,Desinventar/SNGRE_2021,LOJA,EC11,CATAMAYO,EC1103,CATAMAYO,EC110350,Calles Bolivar y 24 de Mayo,-79.348,-3.9681,La Sierra,1/24/13,8:00:00 PM,1,24,2013,Rain,Heavy precipitation/ Urban / Short duration rain,1,1,0,0,0,1,0,0,0,0,,,,,1.0,,4.0,4.0,,,,,6,10,8,4.0,1.0,1.0,2013-01-25 01:00:00
2460,Desinventar/SNGRE_2021,LOJA,EC11,CATAMAYO,EC1103,CATAMAYO,EC110350,Los Girasoles. 24 de Mayo. Isidro Ayora y Parque Central,-79.3586,-3.9853,La Sierra,10/16/13,4:00:00 PM,10,16,2013,Rain,Heavy precipitation/ Urban/ Short duration rain,1,1,0,0,0,1,0,0,0,0,,,,,10.0,,45.0,45.0,,,,,6,10,8,45.0,10.0,3.0,2013-10-16 21:00:00
2682,Desinventar,LOJA,EC11,LOJA,EC1101,GUALEL,EC110154,Bahin,-79.37408,-3.78184,La Sierra,3/6/14,2:00:00 PM,3,6,2014,Rain ,Heavy precipitation / Short duration rain,1,1,0,0,0,0,0,0,0,0,,,,,1.0,,,,,,,,5,10,8,,1.0,,2014-03-06 19:00:00
3695,Desinventar,ORELLANA,EC22,AGUARICO,EC2202,NUEVO ROCAFUERTE,EC220250,Sta. Teresita/ bello horizonte/ nvo. Rocafuerte sta. Rosa,-75.461489,-0.863821,El Oriente,1/7/17,3:34:00 AM,1,7,2017,Rain ,Heavy precipitation/Strong current,1,0,0,0,0,0,0,0,1,0,,,,,,,40.0,40.0,,,70.0,70.0,9,1,9,40.0,,3.0,2017-01-07 08:34:00
3702,Desinventar,ORELLANA,EC22,AGUARICO,EC2202,TIPUTINI,EC220254,Vicente Salazar/ Pando Chicta/ Boca Tiputini,-75.544585,-0.816147,El Oriente,1/7/17,3:34:00 AM,1,7,2017,Rain ,Heavy precipitation/Strong current,1,0,0,0,0,0,0,0,1,0,,,,,,,60.0,60.0,,,50.0,50.0,9,1,9,60.0,,4.0,2017-01-07 08:34:00
3701,Desinventar,ORELLANA,EC22,AGUARICO,EC2202,SANTA MARIA DE HUIRIRIMA,EC220253,Pto Quinche-San Vicente,-75.608095,-0.69816,El Oriente,1/7/17,3:34:00 AM,1,7,2017,Rain ,Heavy precipitation/Strong current,1,0,0,0,0,0,0,0,1,0,,,,,,,60.0,60.0,,,40.0,40.0,9,1,9,60.0,,4.0,2017-01-07 08:34:00
3642,Desinventar,SUCUMBIOS,EC21,CUYABENO,EC2107,CUYABENO,EC210751,Comunidad Sabalo,-75.668113,-0.355505,El Oriente,7/5/16,1:30:00 PM,7,5,2016,Rain ,Heavy precipitation/ Strong current,1,0,0,0,0,0,0,0,1,0,,,,1.0,,,,,4.0,,,,9,1,9,,,,2016-07-05 18:30:00
2778,Desinventar,PASTAZA,EC16,PASTAZA,EC1601,RIO TIGRE,EC160159,Conambo,-75.839508,-1.841913,El Oriente,5/2/14,10:00:00 PM,5,2,2014,Rain ,Heavy precipitation/ Strong current,1,0,0,0,0,0,0,0,1,0,,,,,3.0,,64.0,64.0,,,,,9,1,9,64.0,3.0,4.0,2014-05-03 03:00:00
2488,Desinventar/SNGRE_2021,SUCUMBIOS,EC21,LAGO AGRIO,EC2101,GENERAL FARFAN,EC210153,Km 7 (Via Colombia),-76.8372,0.2361,El Oriente,11/27/13,6:00:00 AM,11,27,2013,Rain / Overflow/ Failure,Heavy precipitation/ Short duration rain/ River Bank Failure,1,1,0,0,0,0,0,1,0,0,,,,,,,,,,,,,9,1,9,,,,2013-11-27 11:00:00
4944,SNGRE,ESMERALDAS,EC08,ELOY ALFARO,EC0802,BORBON,EC080253,"Varios sectores: (Recintos: Patere, Guapilar, Bellavista, San Agustin y San Francisco)",-79.017986,1.006503,La Costa,5/17/19,8:19:00 AM,5,17,2019,Rain / Overflow,Heavy precipitation/ Strong current,1,0,0,0,0,0,0,0,1,0,,,,,,55.0,216.0,,,,,,9,1,9,216.0,55.0,5.0,2019-05-17 13:19:00
2736,Desinventar,ESMERALDAS,EC08,RIOVERDE,EC0807,RIOVERDE,EC080750,La Invasion,-79.418926,1.069352,La Costa,4/3/14,3:00:00 PM,4,3,2014,Rain ,Heavy precipitation/ Strong current,1,0,0,0,0,0,0,0,1,0,,,,,1.0,,4.0,4.0,,,,,9,1,9,4.0,1.0,1.0,2014-04-03 20:00:00
4072,Desinventar,LOS RIOS,EC12,QUEVEDO,EC1205,SAN CRISTOBAL,EC120550,15 de Noviembre,-79.422023,-1.019262,La Costa,3/29/17,7:50:00 PM,3,29,2017,Rain ,Heavy precipitation / Short duration flood,1,0,0,0,0,0,0,0,0,1,,,,,6.0,,20.0,20.0,,,,,9,1,9,20.0,6.0,3.0,2017-03-30 00:50:00
3514,Desinventar,GUAYAS,EC09,CRNEL MARCELINO MARIDUENA,EC0923,CORONEL MARCELINO MARIDUENA (SAN CARLOS),EC092350,Varios Sectores (Barranco Alto La Marina Veinte Mil).,-79.45982,-2.240646,La Costa,3/7/16,6:00:00 AM,3,7,2016,Rain / Overflow,Heavy precipitation/ Strong current,1,0,0,0,0,0,0,0,1,0,,,,1.0,4.0,,19.0,19.0,,20.0,,,9,1,9,19.0,4.0,3.0,2016-03-07 11:00:00
2212,Desinventar/SNGRE_2021,GUAYAS,EC09,NARANJITO,EC0912,NARANJITO,EC091250,Cabecera Cantonal,-79.4835,-2.2152,La Costa,3/27/13,6:00:00 PM,3,27,2013,Rain / Overflow,Heavy precipitation/ Short duration rain/ Small stream overflow ,1,1,0,1,0,0,0,0,0,0,,,,,3.0,,10.0,10.0,,,,,9,1,9,10.0,3.0,2.0,2013-03-27 23:00:00
3406,Desinventar,ESMERALDAS,EC08,QUININDE,EC0804,VICHE,EC080454,RECINTO MALE,-79.538666,0.658465,La Costa,1/25/16,6:00:00 AM,1,25,2016,Rain ,Heavy precipitation/ Strong current,1,0,0,0,0,0,0,0,1,0,,,,3.0,18.0,,74.0,74.0,13.0,,,,9,1,9,74.0,18.0,4.0,2016-01-25 11:00:00
3340,Desinventar,ESMERALDAS,EC08,ESMERALDAS,EC0801,CHINCA,EC080154,VARIOS SECTORES,-79.561591,0.804315,La Costa,1/25/16,6:00:00 AM,1,25,2016,Rain / Overflow,Heavy precipitation/ Strong current,1,0,0,0,0,0,0,0,1,0,,,,2.0,13.0,,154.0,154.0,62.0,62.0,,,9,1,9,154.0,13.0,5.0,2016-01-25 11:00:00
3841,Desinventar,GUAYAS,EC09,GUAYAQUIL,EC0901,TENGUEL,EC090158,Padre Carlos Mantilla,-79.788027,-2.998012,La Costa,2/16/17,7:30:00 PM,2,16,2017,Rain,Heavy precipitation/Short duration flood,1,0,0,0,0,0,0,0,0,1,,,,,2.0,,6.0,6.0,,,,,9,1,9,6.0,2.0,2.0,2017-02-17 00:30:00
4368,Desinventar,GUAYAS,EC09,GUAYAQUIL,EC0901,TENGUEL,EC090158,El Limonal,-79.790445,-2.99948,La Costa,2/11/18,8:00:00 PM,2,11,2018,Rain ,Heavy precipitation/ Short duration flood,1,0,0,0,0,0,0,0,0,1,,,,,1.0,,7.0,7.0,,,,,9,1,9,7.0,1.0,2.0,2018-02-12 01:00:00
3484,Desinventar,GUAYAS,EC09,DURAN,EC0907,ELOY ALFARO (DURAN),EC090750,Varios Sectores,-79.823418,-2.170523,La Costa,3/3/16,7:00:00 PM,3,3,2016,Rain / Overflow,Heavy precipitation/ Strong current,1,0,0,0,0,0,0,0,1,0,,,,,3.0,,18.0,18.0,,,,,9,1,9,18.0,3.0,3.0,2016-03-04 00:00:00
5161,SNGRE_2021,GUAYAS,EC09,BALZAR,EC0904,BALZAR,EC090450,Varios sectores,-79.899679,-1.3664276,La Costa,2/26/20,12:00:00 AM,2,26,2020,Rain,Heavy precipitation/strong current,1,0,0,0,0,0,0,0,1,0,,,,,,,,,,,55.0,,9,1,9,,,,2020-02-26 05:00:00
2987,Desinventar,GUAYAS,EC09,GUAYAQUIL,EC0901,PASCUALES,EC090150,Monte Sinai y Flor de Bastion,-79.959415,-2.089619,La Costa,2/26/15,8:00:00 AM,2,26,2015,Rain / Overflow,Heavy precipitation/ Strong current,1,0,0,0,0,0,0,0,1,0,,,,,,,,,,80.0,,,9,1,9,,,,2015-02-26 13:00:00
3874,Desinventar,GUAYAS,EC09,DAULE,EC0906,DAULE,EC090650,Recinto Comejen,-79.97017,-1.877321,La Costa,2/27/17,3:07:00 PM,2,27,2017,Rain / Overflow,Heavy precipitation/ Strong current,1,0,0,0,0,0,0,0,1,0,,,,,32.0,,71.0,71.0,,,,,9,1,9,71.0,32.0,4.0,2017-02-27 20:07:00
4184,Desinventar,GUAYAS,EC09,DAULE,EC0906,DAULE,EC090650,Recinto Las Maravillas,-79.97017,-1.877321,La Costa,4/14/17,10:00:00 AM,4,14,2017,Rain / Overflow,Heavy precipitation/Short duration flood,1,0,0,0,0,0,0,0,0,1,,,,,36.0,,118.0,118.0,,,200.0,,9,1,9,118.0,36.0,5.0,2017-04-14 15:00:00
3710,Desinventar,GUAYAS,EC09,NOBOL,EC0925,NARCISA DE JESUS,EC092550,"Recinto Petrillo, Barrio Primavera",-80.012685,-1.914236,La Costa,1/10/17,7:00:00 AM,1,10,2017,Rain,Heavy precipitation/Short duration flood,1,0,0,0,0,0,0,0,0,1,,,,,4.0,,16.0,16.0,,,,,9,1,9,16.0,4.0,3.0,2017-01-10 12:00:00
3778,Desinventar,MANABI,EC13,ROCAFUERTE,EC1312,ROCAFUERTE,EC131250,El Resbalon,-80.441637,-0.968558,La Costa,2/4/17,9:59:00 PM,2,4,2017,Rain ,Heavy precipitation/ Strong current,1,0,0,0,0,0,0,0,1,0,,,,,1.0,,196.0,2.0,,,,,9,1,9,196.0,1.0,5.0,2017-02-05 02:59:00
3699,Desinventar,ORELLANA,EC22,LORETO,EC2204,SAN JOSE DE DAHUANO,EC220454,Cruz Chicta,-77.24704,-0.775697,El Oriente,1/7/17,3:34:00 AM,1,7,2017,Rain ,Heavy precipitation/Strong current,1,0,0,0,0,0,0,0,1,0,,,,,,,60.0,60.0,,,57.0,57.0,9,2,9,60.0,,4.0,2017-01-07 08:34:00
3289,Desinventar,SANTO DOMINGO DE LOS TSACHILAS,EC23,SANTO DOMINGO,EC2301,SANTO DOMINGO DE LOS COLORADOS,EC230150,Via a Aloag Santo Domingo km 88 Piso Tanti ,-79.062211,-0.293461,La Costa,1/6/16,7:27:00 AM,1,6,2016,Rain / Overflow,Heavy precipitation/ Short duration rain/ Small stream overflow ,1,1,0,1,0,0,0,0,0,0,,,,,,,,,,,,,9,2,9,,,,2016-01-06 12:27:00
2804,SNGRE,GUAYAS,EC09,GUAYAQUIL,EC0901,TARQUI,EC090150,Coop. Nueva Vision Mz. 445 y Mz. 443,-80.045331,-2.350555,La Costa,5/7/14,7:00:00 PM,5,7,2014,Rain,Heavy precipitation/ Strong current,1,0,0,0,0,0,0,0,1,0,,,,,,,41.0,,,,,,9,2,9,41.0,,3.0,2014-05-08 00:00:00
4204,Desinventar,GUAYAS,EC09,GUAYAQUIL,EC0901,TARQUI,EC090150,"Juan Montalvo, Cooperativa Julio Cartagena Mz 26 Solar 2",-80.045331,-2.350555,La Costa,4/19/17,3:12:00 PM,4,19,2017,Rain,Heavy precipitation/ Strong current,1,0,0,0,0,0,0,0,1,0,,,,,1.0,,24.0,24.0,,,,,9,2,9,24.0,1.0,3.0,2017-04-19 20:12:00
3815,Desinventar,GUAYAS,EC09,LOMAS DE SARGENTILLO,EC0924,LOMAS DE SARGENTILLO,EC092450,Barrio San Lorenzo,-80.091022,-1.873799,La Costa,2/10/17,6:09:00 AM,2,10,2017,Rain ,Heavy precipitation/Short duration flood,1,0,0,0,0,0,0,0,0,1,,,,,3.0,,12.0,12.0,,,,,9,2,9,12.0,3.0,3.0,2017-02-10 11:09:00
2692,Desinventar,ZAMORA CHINCHIPE,EC19,EL PANGUI,EC1906,EL PANGUI,EC190650,La Recta,-78.577358,-3.607097,La Sierra,3/12/14,12:30:00 PM,3,12,2014,Rain / Overflow,Heavy precipitation/ Small stream overflow / Short duration rain,1,1,0,1,0,0,0,0,0,0,,,,,5.0,,,,,,,,9,3,9,,5.0,,2014-03-12 17:30:00
2662,Desinventar/SNGRE_2021,ZAMORA CHINCHIPE,EC19,YANTZAZA,EC1905,YANTZAZA (YANZATZA),EC190550,Barrio San Sebastian,-78.77013,-3.832139,La Sierra,3/1/14,7:00:00 AM,3,1,2014,Rain / Overflow,Heavy precipitation / Short duration rain / Small stream overflow,1,1,0,1,0,0,0,0,0,0,,,,,4.0,,,,,,,,9,3,9,,4.0,,2014-03-01 12:00:00
4220,Desinventar,SANTO DOMINGO DE LOS TSACHILAS,EC23,SANTO DOMINGO,EC2301,SANTA MARIA DEL TOACHI,EC230157,Centro poblado  del Recinto union de Monte Nuevo,-79.231168,-0.641237,La Costa,4/24/17,11:10:00 PM,4,24,2017,Rain ,Heavy precipitation/ Strong current,1,0,0,0,0,0,0,0,1,0,,,,,1.0,,12.0,12.0,,,,,9,3,9,12.0,1.0,3.0,2017-04-25 04:10:00
2782,SNGRE,GUAYAS,EC09,EL TRIUNFO,EC0909,EL TRIUNFO,EC090950,El Triunfo      ,-79.360126,-2.294968,La Costa,5/7/14,4:40:00 PM,5,7,2014,Rain,Heavy precipitation/ Strong current,1,0,0,0,0,0,0,0,1,0,,,,,,,12.0,,5.0,,,,9,3,9,12.0,,3.0,2014-05-07 21:40:00
4648,Desinventar,LOS RIOS,EC12,BABAHOYO,EC1201,PIMOCHA,EC120154,La Delia y El Colarado,-79.543494,-1.705733,La Costa,2/17/19,12:34:00 PM,2,17,2019,Rain/ Failure,Heavy precipitation/ Short duration rain/ River Bank Failure,1,1,0,0,0,0,0,1,0,0,,1.0,,,112.0,112.0,414.0,414.0,,,,,9,3,9,414.0,112.0,5.0,2019-02-17 17:34:00
3867,Desinventar,GUAYAS,EC09,BALAO,EC0903,BALAO,EC090350,Recinto 24 de Mayo ,-79.734093,-2.892568,La Costa,2/26/17,11:00:00 PM,2,26,2017,Rain / Overflow,Heavy precipitation/ Short duration rain/ Small stream overflow ,1,1,0,1,0,0,0,0,0,0,,,,,5.0,,23.0,23.0,,,,,9,3,9,23.0,5.0,3.0,2017-02-27 04:00:00
4739,SNGRE,MANABI,EC13,PICHINCHA,EC1311,PICHINCHA,EC131150,Centro,-79.81901,-1.04687,La Costa,3/7/19,10:00:00 AM,3,7,2019,Rain,Short duration rain/ Surface runoff,0,1,0,0,1,0,0,0,0,0,,,,,,,,,,,,,9,3,9,,,,2019-03-07 15:00:00
3601,Desinventar,EL ORO,EC07,PINAS,EC0710,LA BOCANA,EC071052,ViA AL SECTOR LAS PALMAS,-79.902847,-3.701146,La Sierra,4/12/16,8:00:00 PM,4,12,2016,Rain / Overflow,Heavy precipitation/ Short duration rain/ Small stream overflow ,1,1,0,1,0,0,0,0,0,0,,,,,,,,,,,8.0,8.0,9,3,9,,,,2016-04-13 01:00:00
5146,SNGRE_2021,GUAYAS,EC09,PEDRO CARBO,EC0914,PEDRO CARBO,EC091450,Varios sectores de Pedro carbo,-80.237708,-1.8197455,La Costa,2/24/20,1:30:00 PM,2,24,2020,Rain/Overflow,Heavy precipitation/strong current,1,0,0,0,0,0,0,0,1,0,,,,,150.0,150.0,600.0,,,,,,9,3,9,600.0,150.0,6.0,2020-02-24 18:30:00
4176,Desinventar,BOLIVAR,EC02,CALUMA,EC0206,CALUMA,EC020650,Barrio San Jose,-79.257749,-1.630739,La Sierra,4/11/17,6:10:00 PM,4,11,2017,Rain / Overflow,Heavy precipitation/ Small stream overflow Short duration rain,1,1,0,1,0,0,0,0,0,0,,,,,,,,,,,,,9,4,9,,,,2017-04-11 23:10:00
4768,Desinventar,LOS RIOS,EC12,VALENCIA,EC1211,VALENCIA,EC121150,"Rcto. San Pedro de la Y, Rcto. San Simon",-79.34886,-0.950253,La Costa,3/13/19,1:00:00 PM,3,13,2019,Overflow,Heavy precipitation/ Short duration rain/ Small stream overflow ,1,1,0,1,0,0,0,0,0,0,,,,,58.0,58.0,174.0,174.0,,48.0,,,9,4,9,174.0,58.0,5.0,2019-03-13 18:00:00
2771,Desinventar,LOS RIOS,EC12,VALENCIA,EC1211,VALENCIA,EC121150,Recinto. San Simon - por la Federico Intriago,-79.35301,-0.952547,La Costa,4/26/14,7:00:00 AM,4,26,2014,Rain / Overflow,Heavy precipitation / Small stream overflow/ Short duration rain,1,1,0,1,0,0,0,0,0,0,,,,,,,36.0,,61.0,36.0,,,9,4,9,36.0,,3.0,2014-04-26 12:00:00
3408,Desinventar,ESMERALDAS,EC08,QUININDE,EC0804,VICHE,EC080454,VARIOS SECTORES (CHURA CHANCAMA ZAZIRA),-79.537853,0.657981,La Costa,1/25/16,6:00:00 AM,1,25,2016,Rain ,Heavy precipitation/ short duration flood,1,0,0,0,0,0,0,0,0,1,,,,,45.0,,203.0,203.0,43.0,,,,9,4,9,203.0,45.0,5.0,2016-01-25 11:00:00
2097,Desinventar/SNGRE_2021,LOJA,EC11,PINDAL,EC1114,PINDAL,EC111450,La Pampa,-80.1176,-4.1197,La Sierra,3/13/13,8:00:00 PM,3,13,2013,Rain / Overflow,Heavy precipitation/ Small stream overflow/ Short duration rain,1,1,0,1,0,0,0,0,0,0,,,,,2.0,,8.0,8.0,,,,,9,4,9,8.0,2.0,2.0,2013-03-14 01:00:00
3337,Desinventar,MANABI,EC13,JAMA,EC1320,JAMA,EC132050,Varios Sectores,-80.266464,-0.195768,La Costa,1/25/16,7:00:00 AM,1,25,2016,Rain ,Heavy precipitation/ short duration flood,1,0,0,0,0,0,0,0,0,1,,,,,,,,,,,,,9,4,9,,,,2016-01-25 12:00:00
4723,SNGRE,MANABI,EC13,SANTA ANA,EC1313,AYACUCHO,EC131351,Varios Sectores,-80.286356,-1.157755,La Costa,3/7/19,2:00:00 PM,3,7,2019,Rain / Overflow,Short duration rain/ Surface runoff,0,1,0,0,1,0,0,0,0,0,,,,,,200.0,800.0,,,2.0,,,9,4,9,800.0,200.0,6.0,2019-03-07 19:00:00
4387,Desinventar,MANABI,EC13,PORTOVIEJO,EC1301,COLON,EC130150,"Varios Sectores El Cady, Estancia Vieja, Pachinche Adentro",-80.38963,-1.130685,La Costa,2/23/18,4:51:00 AM,2,23,2018,Rain / Overflow,Short duration rain/ Surface runoff,0,1,0,0,1,0,0,0,0,0,,,,,10.0,,40.0,40.0,,,,,9,4,9,40.0,10.0,3.0,2018-02-23 09:51:00
3834,Desinventar,MANABI,EC13,PORTOVIEJO,EC1301,RIOCHICO (RIO CHICO),EC130155,El Bejuco,-80.417375,-0.995396,La Costa,2/15/17,4:00:00 PM,2,15,2017,Rain / Overflow,Heavy precipitation/Short duration rain/Small stream overflow,1,1,0,1,0,0,0,0,0,0,,,,,8.0,,35.0,35.0,,,,,9,4,9,35.0,8.0,3.0,2017-02-15 21:00:00
1864,SNGRE_2021,SANTA ELENA,EC24,SANTA ELENA,EC2401,SANTA ELENA,EC240150,Barrio Pacifico (faldas del cerro el tablazo carretera de la linea del oleoducto y calle Aurelio Lainez),-80.7067,-2.2216,La Costa,2/2/13,10:00:00 AM,2,2,2013,Rain,Heavy precipitation/ Short duration flood,1,0,0,0,0,0,0,0,0,1,,,,,1.0,,6.0,,,,,,9,4,9,6.0,1.0,2.0,2013-02-02 15:00:00
3636,Desinventar,SUCUMBIOS,EC21,SHUSHUFINDI,EC2104,SHUSHUFINDI,EC210450,Barrio El Cisne Calle Pto. Rico y Av. Rio Napo ,-76.640296,-0.196828,El Oriente,6/10/16,5:00:00 PM,6,10,2016,Rain ,Heavy precipitation/ Strong current,1,0,0,0,0,0,0,0,1,0,,,,1.0,,,,,,,,,9,5,9,,,,2016-06-10 22:00:00
2486,SNGRE_2021,PASTAZA,EC16,SANTA CLARA,EC1603,SANTA CLARA,EC160350,San Jorge - Rey de Oriente Km 46 de la via Puyo - Tena,-77.9335,-1.2789,La Sierra,11/26/13,1:00:00 AM,11,26,2013,Rain / Overflow,Heavy precipitation/ Short duration flood,1,0,0,0,0,0,0,0,0,1,,,,,20.0,,,,,,5.0,,9,5,9,,20.0,,2013-11-26 06:00:00
2721,Desinventar,ESMERALDAS,EC08,RIOVERDE,EC0807,MONTALVO (CAB EN HORQUETA),EC080754,Barrios: Ezequiel Tello y San Gregorio,-79.318822,1.012696,La Costa,3/30/14,12:13:00 PM,3,30,2014,Rain ,Heavy precipitation/ Urban/ Surface runoff,1,0,0,0,1,1,0,0,0,0,,,,,250.0,,750.0,750.0,,,,,9,5,9,750.0,250.0,6.0,2014-03-30 17:13:00
4843,SNGRE,SANTO DOMINGO DE LOS TSACHILAS,EC23,SANTO DOMINGO,EC2301,SANTO DOMINGO DE LOS COLORADOS,EC230150,"Recinto Nuevo Israel, entrada a Puerto Limon en supermercado Anita.",-79.355609,-0.245662,La Costa,3/20/19,10:40:00 PM,3,20,2019,Rain,Heavy precipitation / Short duration flood,1,0,0,0,0,0,0,0,0,1,,,,,,1.0,2.0,,,,,,9,5,9,2.0,1.0,1.0,2019-03-21 03:40:00
3709,Desinventar,LOS RIOS,EC12,BABAHOYO,EC1201,LA UNION,EC120155,Recinto La Esperanza y Recinto San Juan,-79.380431,-1.72047,La Costa,1/10/17,9:45:00 AM,1,10,2017,Rain ,Heavy precipitation/Short duration flood,1,0,0,0,0,0,0,0,0,1,,,,,25.0,,83.0,83.0,,,,,9,5,9,83.0,25.0,4.0,2017-01-10 14:45:00
3817,Desinventar,LOS RIOS,EC12,BABAHOYO,EC1201,LA UNION,EC120155,Recinto La Esperanza ,-79.380431,-1.72047,La Costa,2/10/17,6:45:00 PM,2,10,2017,Rain / Overflow,Heavy precipitation/Strong current,1,0,0,0,0,0,0,0,1,0,,,,,6.0,,20.0,62.0,,,,,9,5,9,62.0,6.0,4.0,2017-02-10 23:45:00
4391,Desinventar,LOS RIOS,EC12,URDANETA,EC1206,RICAURTE,EC120651,"Cdla.16 Noviembre, Las Quintas, El Puente",-79.468379,-1.568553,La Costa,2/24/18,11:42:00 AM,2,24,2018,Rain / Overflow/Failure,Heavy precipitation/ River bank failure / Short duration rain,1,1,0,0,0,0,0,1,0,0,,,,,6.0,,276.0,24.0,,4.0,,,9,5,9,276.0,6.0,5.0,2018-02-24 16:42:00
4394,Desinventar,LOS RIOS,EC12,URDANETA,EC1206,CATARAMA,EC120650,"Victoria, Santo Thomas, Manabi Chiquito y San Antonio- Se informa que debido a las fuertes lluvias de la madrugada ",-79.474502,-1.56503,La Costa,2/24/18,10:02:00 AM,2,24,2018,Rain / Overflow/Failure,Heavy precipitation/ River bank failure / Short duration rain,1,1,0,0,0,0,0,1,0,0,,,,,12.0,,711.0,42.0,,266.0,100.0,15.0,9,5,9,711.0,12.0,6.0,2018-02-24 15:02:00
4250,SNGRE,GUAYAS,EC09,SIMON BOLIVAR,EC0922,SIMON BOLIVAR,EC092250,"Varios Sectores (Miraflores, Los Laureles y San Jacinto)",-79.489001,-2.00214,La Costa,5/10/17,12:00:00 AM,5,10,2017,Rain / Overflow,Heavy precipitation/ Short duration flood,1,0,0,0,0,0,0,0,0,1,,,,,,,28.0,,,,,,9,5,9,28.0,,3.0,2017-05-10 05:00:00
2627,Desinventar/SNGRE_2021,ESMERALDAS,EC08,ESMERALDAS,EC0801,5 DE AGOSTO,EC080150,"Barrio 3 de Octubre (Tripa de Pollo), Barrio Caliente (calle",-79.667297,0.94021,La Costa,2/19/14,10:30:00 AM,2,19,2014,Rain ,Heavy precipitation/ Urban/ Surface runoff,1,0,0,0,1,1,0,0,0,0,,,,,15.0,,75.0,75.0,,,,,9,5,9,75.0,15.0,4.0,2014-02-19 15:30:00
4557,Desinventar,ESMERALDAS,EC08,ESMERALDAS,EC0801,SIMON PLATA TORRES,EC080150,50 Casas,-79.68999,0.923879,La Costa,1/6/19,5:00:00 AM,1,6,2019,Rain,Heavy precipitation/ Strong current,1,0,0,0,0,0,0,0,1,0,,,,1.0,,4.0,22.0,22.0,,,,,9,5,9,22.0,4.0,3.0,2019-01-06 10:00:00
5197,SNGRE_2021,ESMERALDAS,EC08,ESMERALDAS,EC0801,SIMON PLATA TORRES,EC080150,Gatazo,-79.713265,0.895207,La Costa,3/6/20,5:00:00 AM,3,6,2020,Rain,Heavy precipitation/strong current,1,0,0,0,0,0,0,0,1,0,,,,,36.0,36.0,149.0,,,,,,9,5,9,149.0,36.0,5.0,2020-03-06 10:00:00
3363,Desinventar,MANABI,EC13,PEDERNALES,EC1317,PEDERNALES,EC131750,Maria Luisa 5ta etapa ,-80.050198,0.073608,La Costa,1/25/16,11:00:00 AM,1,25,2016,Rain ,Heavy precipitation/ strong current,1,0,0,0,0,0,0,0,1,0,,,,,1.0,,,,,5.0,,,9,5,9,,1.0,,2016-01-25 16:00:00
3364,Desinventar,MANABI,EC13,PEDERNALES,EC1317,PEDERNALES,EC131750,Varios Sectores,-80.054735,0.070433,La Costa,1/25/16,7:00:00 AM,1,25,2016,Rain ,Heavy precipitation/ Short duration flood,1,0,0,0,0,0,0,0,0,1,,,,,,,,,,,,,9,5,9,,,,2016-01-25 12:00:00
3370,Desinventar,MANABI,EC13,BOLIVAR,EC1302,QUIROGA,EC130252,Centro ,-80.084426,-0.927159,La Costa,1/25/16,7:00:00 AM,1,25,2016,Rain ,Heavy precipitation/ Short duration flood,1,0,0,0,0,0,0,0,0,1,,,,,,,,,,,,,9,5,9,,,,2016-01-25 12:00:00
5275,SNGRE_2021,MANABI,EC13,CHONE,EC1303,CHONE,EC130350,"Via Chone-Canuto, Ciudadela La Victoria",-80.109357,-0.7140022,La Costa,5/11/20,11:00:00 PM,5,11,2020,Rain,Heavy precipitation/Short duration flood,1,0,0,0,0,0,0,0,0,1,,,,,1.0,1.0,5.0,,,,,,9,5,9,5.0,1.0,1.0,2020-05-12 04:00:00
3324,Desinventar,MANABI,EC13,BOLIVAR,EC1302,CALCETA,EC130250,Centro ,-80.17014,-0.839881,La Costa,1/25/16,7:00:00 AM,1,25,2016,Rain ,Heavy precipitation/ Short duration flood,1,0,0,0,0,0,0,0,0,1,,,,,,,,,,,,,9,5,9,,,,2016-01-25 12:00:00
3308,Desinventar,MANABI,EC13,MONTECRISTI,EC1309,LA PILA,EC130952,Varios Sectores( Pila la Laguna Santiago del Apostol Vidal P,-80.582717,-1.105488,La Costa,1/20/16,6:30:00 PM,1,20,2016,Rain ,Surface runoff/ Short duration rain,0,1,0,0,1,0,0,0,0,0,,,,,30.0,,120.0,120.0,,,,,9,5,9,120.0,30.0,5.0,2016-01-20 23:30:00
2958,Desinventar,MANABI,EC13,MONTECRISTI,EC1309,MONTECRISTI,EC130950,Santa Cecilia,-80.705423,-1.002699,La Costa,2/7/15,3:00:00 AM,2,7,2015,Rain ,Heavy precipitation/ Strong current,1,0,0,0,0,0,0,0,1,0,,,,,3.0,,14.0,14.0,,,,,9,5,9,14.0,3.0,3.0,2015-02-07 08:00:00
2454,Desinventar/SNGRE_2021,ORELLANA,EC22,LORETO,EC2204,SAN JOSE DE PAYAMINO,EC220453,Sector Rumiyacu,-77.319,-0.5153,El Oriente,10/5/13,10:00:00 AM,10,5,2013,Rain / Overflow,Heavy precipitation/ Strong current,1,0,0,0,0,0,0,0,1,0,,,,,9.0,,55.0,55.0,,,,,9,6,9,55.0,9.0,4.0,2013-10-05 15:00:00
2366,SNGRE_2021,SANTO DOMINGO DE LOS TSACHILAS,EC23,SANTO DOMINGO,EC2301,CHIGUILPE,EC230150,"Coop. Unificados, calle Gualaceo",-79.1513,-0.2658,La Costa,5/1/13,3:39:00 PM,5,1,2013,Rain ,Heavy precipitation/ Short duration flood,1,0,0,0,0,0,0,0,0,1,,,,,1.0,,3.0,,,,,,9,6,9,3.0,1.0,1.0,2013-05-01 20:39:00
3034,Desinventar,GUAYAS,EC09,GNRAL. ANTONIO ELIZALDE,EC0927,GRAL. ANTONIO ELIZALDE (BUCAY),EC092750,Recinto Matilde Esther,-79.158657,-2.164668,La Costa,3/20/15,2:50:00 AM,3,20,2015,Rain,Heavy precipitation/ Short duration flood,1,0,0,0,0,0,0,0,0,1,,,,,32.0,,84.0,84.0,,,,,9,6,9,84.0,32.0,4.0,2015-03-20 07:50:00
4546,Desinventar,SANTO DOMINGO DE LOS TSACHILAS,EC23,SANTO DOMINGO,EC2301,RIO VERDE,EC230150,"Coop. La Cadena, en el Bypass ingresando por la gallera, a u",-79.1683,-0.276047,La Costa,12/14/18,9:45:00 PM,12,14,2018,Rain,Heavy precipitation/ Strong current,1,0,0,0,0,0,0,0,1,0,,,,,1.0,,3.0,,,,,,9,6,9,3.0,1.0,1.0,2018-12-15 02:45:00
2361,SNGRE_2021,SANTO DOMINGO DE LOS TSACHILAS,EC23,SANTO DOMINGO,EC2301,BOMBOLI,EC230150,Juan Eulogio Paz y Mino calle 12 de Octubre y S/N,-79.1911,-0.2248,La Costa,4/25/13,8:25:00 PM,4,25,2013,Rain ,Heavy precipitation/ Short duration flood,1,0,0,0,0,0,0,0,0,1,,,,,1.0,,4.0,,,,,,9,6,9,4.0,1.0,1.0,2013-04-26 01:25:00
4853,SNGRE,SANTO DOMINGO DE LOS TSACHILAS,EC23,SANTO DOMINGO,EC2301,RIO VERDE,EC230150,"Coop. Villa Florida Union Nacional y Rio Verde, por el puente de barandas",-79.192478,-0.274019,La Costa,3/21/19,10:00:00 PM,3,21,2019,Rain,Heavy precipitation/ Urban/ Surface runoff,1,0,0,0,1,1,0,0,0,0,,,,,,2.0,7.0,,,,,,9,6,9,7.0,2.0,2.0,2019-03-22 03:00:00
4450,Desinventar,BOLIVAR,EC02,ECHEANDIA,EC0204,ECHEANDIA,EC020450,"San Jose Camaron, Barrio Bellavista",-79.245527,-1.432289,La Sierra,5/5/18,11:00:00 AM,5,5,2018,Rain / Overflow,Short duration rain/ Surface runoff ,0,1,0,0,1,0,0,0,0,0,,,,,1.0,,4.0,4.0,,,,,9,6,9,4.0,1.0,1.0,2018-05-05 16:00:00
2985,Desinventar,CANAR,EC03,LA TRONCAL,EC0304,LA TRONCAL,EC030450,Centro cantonal,-79.341417,-2.424349,La Costa,2/24/15,7:30:00 AM,2,24,2015,Rain / Overflow,Heavy precipitation/ Urban/ Surface runoff,1,0,0,0,1,1,0,0,0,0,,,,1.0,1.0,,,,,,,,9,6,9,,1.0,,2015-02-24 12:30:00
3881,Desinventar,GUAYAS,EC09,NARANJITO,EC0912,NARANJITO,EC091250,Calle Guayaquil y Simon Bolivar ,-79.472247,-2.168271,La Costa,2/28/17,10:51:00 PM,2,28,2017,Rain,Heavy precipitation/ Strong current,1,0,0,0,0,0,0,0,1,0,,,,,200.0,,800.0,800.0,,,,,9,6,9,800.0,200.0,6.0,2017-03-01 03:51:00
3082,Desinventar,GUAYAS,EC09,MILAGRO,EC0910,ROBERTO ASTUDILLO (CAB EN CRUC,EC091054,Recinto Vuelta de Piano,-79.509571,-2.142479,La Costa,3/27/15,9:15:00 AM,3,27,2015,Rain / Overflow,Heavy precipitation/ Strong current,1,0,0,0,0,0,0,0,1,0,,,,,1.0,,4.0,4.0,,,,,9,6,9,4.0,1.0,1.0,2015-03-27 14:15:00
4963,SNGRE,ESMERALDAS,EC08,QUININDE,EC0804,ROSA ZARATE (QUININDE),EC080450,Varios sectores (Pangolita y San Andres),-79.530165,0.398628,La Costa,6/15/19,6:30:00 PM,6,15,2019,Rain,Heavy precipitation/ Urban/ Surface runoff,1,0,0,0,1,1,0,0,0,0,,,,,,2.0,7.0,,,,,,9,6,9,7.0,2.0,2.0,2019-06-15 23:30:00
5080,SNGRE_2021,ESMERALDAS,EC08,QUININDE,EC0804,ROSA ZARATE (QUININDE),EC080450,Recinto Herrera,-79.578113,0.382672,La Costa,1/21/20,4:00:00 PM,1,21,2020,Overflow,Heavy precipitation/Short duration flood,1,0,0,0,0,0,0,0,0,1,,,,,60.0,60.0,240.0,,,,4.25,,9,6,9,240.0,60.0,5.0,2020-01-21 21:00:00
4672,SNGRE,GUAYAS,EC09,MILAGRO,EC0910,MILAGRO,EC091050,"Cdla. Bellavista, calle Medardo Angel Silva y Rio Pindo",-79.60584,-2.140273,La Costa,2/23/19,9:30:00 AM,2,23,2019,Rain,Heavy precipitation/ Short duration flood,1,0,0,0,0,0,0,0,0,1,,,,,,1.0,3.0,,,,,,9,6,9,3.0,1.0,1.0,2019-02-23 14:30:00
4233,SNGRE,GUAYAS,EC09,ALFREDO BAQUERIZO MORENO,EC0902,ALFREDO BAQUERIZO MORENO (JUJA,EC090250,Varios Sectores ,-79.61897,-1.912651,La Costa,4/27/17,10:00:00 AM,4,27,2017,Rain / Overflow,Heavy precipitation/Short duration flood,1,0,0,0,0,0,0,0,0,1,,,,,,,896.0,,,,,,9,6,9,896.0,,6.0,2017-04-27 15:00:00
3579,Desinventar,GUAYAS,EC09,EMPALME,EC0908,VELASCO IBARRA (CAB. EL EMPALM,EC090850,Barrio 2 de Mayo calles Salinas y Esteros,-79.638262,-1.038435,La Costa,4/4/16,9:46:00 PM,4,4,2016,Rain,Heavy precipitation/ Short duration flood,1,0,0,0,0,0,0,0,0,1,,,,,14.0,,,,,,,,9,6,9,,14.0,,2016-04-05 02:46:00
3347,Desinventar,ESMERALDAS,EC08,QUININDE,EC0804,CUBE,EC080451, 24 DE MAYO,-79.682226,0.53118,La Costa,1/25/16,6:00:00 AM,1,25,2016,Rain,Heavy precipitation/ Strong current,1,0,0,0,0,0,0,0,1,0,,,,,,,,,,,,,9,6,9,,,,2016-01-25 11:00:00
2711,Desinventar,ESMERALDAS,EC08,ATACAMES,EC0806,ATACAMES,EC080650,Barrio Nuevo Amanecer y 18 de Febrero,-79.836999,0.871256,La Costa,3/30/14,12:30:00 PM,3,30,2014,Rain ,Heavy precipitation/ Urban/ Surface runoff,1,0,0,0,1,1,0,0,0,0,,,,,3.0,,15.0,15.0,,,,,9,6,9,15.0,3.0,3.0,2014-03-30 17:30:00
3831,Desinventar,MANABI,EC13,PORTOVIEJO,EC1301,ABDON CALDERON (SAN FRANCISCO),EC130151,Juan Dama,-80.339463,-1.031477,La Costa,2/15/17,4:30:00 PM,2,15,2017,Rain / Overflow,Heavy precipitation/ Strong current,1,0,0,0,0,0,0,0,1,0,,,,1.0,50.0,,188.0,188.0,,,,,9,6,9,188.0,50.0,5.0,2017-02-15 21:30:00
3925,SNGRE,MANABI,EC13,ROCAFUERTE,EC1312,ROCAFUERTE,EC131250,Comunidad La Recta ,-80.413346,-0.903661,La Costa,3/10/17,8:00:00 PM,3,10,2017,Rain ,Heavy precipitation/ Short duration rain/ Small stream overflow ,1,1,0,1,0,0,0,0,0,0,,,,,,,200.0,,,,,,9,6,9,200.0,,5.0,2017-03-11 01:00:00
3346,Desinventar,MANABI,EC13,SUCRE,EC1314,LEONIDAS PLAZA GUTIERREZ,EC131450,Centro,-80.424025,-0.628476,La Costa,1/25/16,7:00:00 AM,1,25,2016,Rain ,Heavy precipitation/ Short duration flood,1,0,0,0,0,0,0,0,0,1,,,,,,,,,,,,,9,6,9,,,,2016-01-25 12:00:00
3323,Desinventar,MANABI,EC13,SUCRE,EC1314,BAHIA DE CARAQUEZ,EC131450,Varios Sectores,-80.427278,-0.61876,La Costa,1/25/16,7:00:00 AM,1,25,2016,Rain ,Heavy precipitation/ Short duration flood,1,0,0,0,0,0,0,0,0,1,,,,,,,,,,,,,9,6,9,,,,2016-01-25 12:00:00
3376,Desinventar,MANABI,EC13,ROCAFUERTE,EC1312,ROCAFUERTE,EC131250,Centro,-80.45207,-0.923235,La Costa,1/25/16,7:00:00 AM,1,25,2016,Rain ,Heavy precipitation/ Short duration flood,1,0,0,0,0,0,0,0,0,1,,,,,,,,,,,,,9,6,9,,,,2016-01-25 12:00:00
4182,Desinventar,PASTAZA,EC16,PASTAZA,EC1601,SIMON BOLIVAR (CAB EN MUSHULLA,EC160162,Comunidad Namak,-77.589672,-1.958877,La Sierra,4/13/17,1:00:00 AM,4,13,2017,Rain / Overflow,Heavy precipitation/ Strong current,1,0,0,0,0,0,0,0,1,0,,,,,,,56.0,56.0,,,,,9,7,9,56.0,,4.0,2017-04-13 06:00:00
1782,SNGRE_2021,NAPO,EC15,TENA,EC1501,TENA,EC150150,Via Tena-Puerto Napo (ESPEAM),-77.808746,-0.977656,La Sierra,11/29/12,4:30:00 PM,11,29,2012,Rain/ Overflow,Heavy precipitation/ Short duration rain/ Small stream overflow,1,1,0,1,0,0,0,0,0,0,,,,,2.0,,15.0,,,,,,9,7,9,15.0,2.0,3.0,2012-11-29 21:30:00
2815,Desinventar,PASTAZA,EC16,PASTAZA,EC1601,PUYO,EC160150,La Isla y Vascones Sevilla,-78.00718,-1.486138,La Sierra,5/11/14,9:26:00 PM,5,11,2014,Rain / Overflow,Heavy precipitation/ Strong current,1,0,0,0,0,0,0,0,1,0,,,,,,,,,,,,,9,7,9,,,,2014-05-12 02:26:00
2916,Desinventar,PASTAZA,EC16,PASTAZA,EC1601,FATIMA,EC160155,Simon Bolivar,-78.008993,-1.375319,La Sierra,12/20/14,10:30:00 AM,12,20,2014,Rain ,Heavy precipitation/ Strong current,1,0,0,0,0,0,0,0,1,0,,,,,,,17.0,16.0,,,,,9,7,9,17.0,,3.0,2014-12-20 15:30:00
4481,Desinventar,CARCHI,EC04,MIRA,EC0404,CONCEPCION,EC040451,Huagrabamba,-78.16,0.665926,La Sierra,6/3/18,2:00:00 PM,6,3,2018,Long duration rain ,Heavy precipitation/ Strong current,1,0,0,0,0,0,0,0,1,0,,,,,2.0,,4.0,4.0,,,,,9,7,9,4.0,2.0,1.0,2018-06-03 19:00:00
5073,SNGRE_2021,IMBABURA,EC10,SAN MIGUEL DE URCUQUI,EC1006,La Merced De Buenos Aires,EC100652,"El Salado, via San Pedro - El Porvenir",-78.344485,0.648858,La Sierra,1/2/20,4:00:00 AM,1,2,2020,Rain,Heavy precipitation/Urban/Surface runoff,1,0,0,0,1,1,0,0,0,0,,,,,,,,,,,,,9,7,9,,,,2020-01-02 09:00:00
3238,SNGRE_2021,TUNGURAHUA,EC18,BAÑOS DE AGUA SANTA,EC1802,BAÑOS DE AGUA SANTA,EC180250,Illuchi via las Antenas.,-78.42429,-1.392572,La Sierra,7/25/15,6:30:00 PM,7,25,2015,,Heavy precipitation/ Surface runoff/ Urban,1,0,0,0,1,1,0,0,0,0,,,,,,,,,,,,,9,7,9,,,,2015-07-25 23:30:00
3241,Desinventar,TUNGURAHUA,EC18,PATATE,EC1805,PATATE,EC180550,"Via a Leitillo, costado derecho 30 metros antes del puente g",-78.474674,-1.337854,La Sierra,7/30/15,4:39:00 PM,7,30,2015,Rain / Overflow,Heavy precipitation/ Strong current,1,0,0,0,0,0,0,0,1,0,,,,,,,3.0,3.0,,,,,9,7,9,3.0,,1.0,2015-07-30 21:39:00
2526,Desinventar/SNGRE_2021,CANAR,EC03,EL TAMBO,EC0305,EL TAMBO,EC030550,Chuichun,-78.953093,-2.492719,La Sierra,1/20/14,8:00:00 AM,1,20,2014,Rain ,Surface runoff / Short duration rain,0,1,0,0,1,0,0,0,0,0,,,,,,,,,,,,,9,7,9,,,,2014-01-20 13:00:00
2143,Desinventar/SNGRE_2021,LOS RIOS,EC12,URDANETA,EC1206,RICAURTE,EC120651,La Florentina,-79.3751,-1.5631,La Costa,3/16/13,5:00:00 PM,3,16,2013,Rain / Overflow,Heavy precipitation/ Short duration flood,1,0,0,0,0,0,0,0,0,1,,,,,21.0,,55.0,55.0,,,,,9,7,9,55.0,21.0,4.0,2013-03-16 22:00:00
3836,SNGRE,EL ORO,EC07,CHILLA,EC0705,CHILLA,EC070550,Playas de Daucay,-79.719249,-3.455734,La Sierra,2/16/17,6:00:00 PM,2,16,2017,Rain / Overflow,Heavy precipitation/ Strong current,1,0,0,0,0,0,0,0,1,0,,,,,,,31.0,,,4.0,,,9,7,9,31.0,,3.0,2017-02-16 23:00:00
3565,Desinventar,EL ORO,EC07,PASAJE,EC0709,CASACAY,EC070952,Casacay,-79.722554,-3.32364,La Costa,4/2/16,7:00:00 PM,4,2,2016,Rain / Overflow,Heavy precipitation/ strong current,1,0,0,0,0,0,0,0,1,0,,,,,,,1000.0,1000.0,,,,,9,7,9,1000.0,,6.0,2016-04-03 00:00:00
3917,Desinventar,GUAYAS,EC09,SAMBORONDON,EC0916,SAMBORONDON CABECERA CANTONAL,EC091650,Recinto Paula de Leon - El Chaparral.,-79.765467,-1.993655,La Costa,3/9/17,7:00:00 PM,3,9,2017,Rain / Overflow,Heavy precipitation/Strong current,1,0,0,0,0,0,0,0,1,0,,,,,1.0,,5.0,5.0,5.0,,,,9,7,9,5.0,1.0,1.0,2017-03-10 00:00:00
2784,SNGRE,GUAYAS,EC09,DURAN,EC0907,ELOY ALFARO (DURAN),EC090750,Coop 5 de Junio Mz H1,-79.780493,-2.233418,La Costa,5/7/14,9:00:00 PM,5,7,2014,Rain,Heavy precipitation/ Strong current,1,0,0,0,0,0,0,0,1,0,,,,,,,,,,,,,9,7,9,,,,2014-05-08 02:00:00
3776,Desinventar,GUAYAS,EC09,DURAN,EC0907,ELOY ALFARO (DURAN),EC090750,Coop. Una sola Fuerza 1 Mz. E1 Sl. 2 y Mz. E 1.2 Sl. 18,-79.780493,-2.233418,La Costa,2/4/17,11:30:00 AM,2,4,2017,Rain ,Heavy precipitation/Short duration flood,1,0,0,0,0,0,0,0,0,1,,,,,2.0,,7.0,7.0,,,,,9,7,9,7.0,2.0,2.0,2017-02-04 16:30:00
3670,Desinventar,CARCHI,EC04,TULCAN,EC0401,EL CARMELO (EL PUN),EC040151,El Obelisco Avenida Expreso Oriental,-77.613573,0.662294,La Sierra,11/12/16,10:00:00 PM,11,12,2016,Rain ,Heavy precipitation/ Strong current,1,0,0,0,0,0,0,0,1,0,,,,,1.0,,4.0,4.0,,,,,9,8,9,4.0,1.0,1.0,2016-11-13 03:00:00
4205,Desinventar,IMBABURA,EC10,ANTONIO ANTE,EC1002,SAN ROQUE,EC100254,La Esperanza,-78.233101,0.297452,La Sierra,4/19/17,6:00:00 AM,4,19,2017,Rain / Overflow,Heavy precipitation/ Artificial waterway overflow/ Surface runoff,1,0,1,0,1,0,0,0,0,0,,,,,2.0,,8.0,8.0,,,,,9,8,9,8.0,2.0,2.0,2017-04-19 11:00:00
2740,Desinventar,PICHINCHA,EC17,QUITO,EC1701,CONOCOTO,EC170156,Jose Maria Urbina e Isidro Ayora Ref: Colegio La Salle,-78.488996,-0.30817,La Sierra,4/4/14,5:44:00 PM,4,4,2014,Rain ,Heavy precipitation/ Strong current,1,0,0,0,0,0,0,0,1,0,,,,,,,,,,,,,9,8,9,,,,2014-04-04 22:44:00
3635,Desinventar,CHIMBORAZO,EC06,RIOBAMBA,EC0601,SAN LUIS,EC060161,La Inmaculada ,-78.620552,-1.705534,La Sierra,5/30/16,6:00:00 PM,5,30,2016,Rain ,Heavy precipitation/ Short duration rrain/ Strong current,1,0,0,0,0,0,0,0,1,0,,,,,8.0,,40.0,40.0,,,43.0,27.0,9,8,9,40.0,8.0,3.0,2016-05-30 23:00:00
3259,Desinventar,TUNGURAHUA,EC18,AMBATO,EC1801,HUACHI LORETO,EC180150,Atahualpa Villacres y Gustavo Lemos,-78.636667,-1.275761,La Sierra,11/7/15,2:40:00 PM,11,7,2015,Rain / Overflow,Heavy precipitation/ Urban/ Surface runoff,1,0,0,0,1,1,0,0,0,0,,,,,1.0,,2.0,2.0,,,,,9,8,9,2.0,1.0,1.0,2015-11-07 19:40:00
2996,Desinventar,COTOPAXI,EC05,SAQUISILI,EC0506,CHANTILIN,EC050652,Chantilin Grande ref. En la via a Saquisili por el puente pe,-78.647565,-0.855122,La Sierra,3/3/15,6:20:00 PM,3,3,2015,Rain / Overflow,Artificial waterway overflow/ Urban/ Strong current,0,0,1,0,0,1,0,0,1,0,,,,,,,,,,,,27.0,9,8,9,,,,2015-03-03 23:20:00
2994,Desinventar,COTOPAXI,EC05,SAQUISILI,EC0506,CHANTILIN,EC050652,"Barrio Calicanto, REF// a una cuadra de la cancha, cerca de ",-78.649739,-0.844137,La Sierra,3/2/15,5:10:00 PM,3,2,2015,Rain ,Heavy precipitation/ Strong current,1,0,0,0,0,0,0,0,1,0,,,,,6.0,,65.0,65.0,,,,,9,8,9,65.0,6.0,4.0,2015-03-02 22:10:00
5329,SNGRE_2021,TUNGURAHUA,EC18,TISALEO,EC1809,QUINCHICOTO,EC180951,Sector Santa Marianita,-78.691662,-1.379082,La Sierra,7/14/20,9:00:00 AM,7,14,2020,Rain,Heavy precipitation/strong current,1,0,0,0,0,0,0,0,1,0,,,,,1.0,1.0,3.0,,,,,,9,8,9,3.0,1.0,1.0,2020-07-14 14:00:00
2485,Desinventar/SNGRE_2021,CANAR,EC03,BIBLIAN,EC0302,JERUSALEN,EC030254,Cachigaluay,-78.9713,-2.6537,La Sierra,11/23/13,7:45:00 PM,11,23,2013,Rain ,Strong current/ Heavy precipitation,1,0,0,0,0,0,0,0,1,0,,,,,,,,,,,,,9,8,9,,,,2013-11-24 00:45:00
272,SNGRE_2021,BOLIVAR,EC02,CHIMBO,EC0203,SAN JOSE DE CHIMBO,EC020350,Calles Maldonado y Convencion de 1884,-79.03,-1.69,La Sierra,4/5/10,8:30:00 AM,4,5,2010,Rain/ landslide,Heavy precipitation/ strong current,1,0,0,0,0,0,0,0,1,0,,,,1.0,,,4.0,,,,,,9,8,9,4.0,,1.0,2010-04-05 13:30:00
2731,SNGRE_2021,COTOPAXI,EC05,LA MANA,EC0502,PUCAYACU,EC050252,"Comunidades Sandomo, Arapanes, Plaza De Ganado, Hacienda Munchipamba(Rio Cristal Y Quindigua)",-79.081271,-0.664603,La Sierra,3/30/14,6:23:00 AM,3,30,2014,Rain/ Overflow,Heavy precipitation / Short duration rain/ River bank failure,1,1,0,0,0,0,0,1,0,0,,,,,,,192.0,,,,,,9,8,9,192.0,,5.0,2014-03-30 11:23:00
4928,Desinventar,LOS RIOS,EC12,MONTALVO,EC1203,MONTALVO,EC120350,Recinto La Maritza,-79.287395,-1.787952,La Sierra,4/24/19,4:41:00 AM,4,24,2019,Rain / Overflow,Heavy precipitation / Short duration flood,1,0,0,0,0,0,0,0,0,1,,,,,4.0,4.0,20.0,20.0,,,,,9,8,9,20.0,4.0,3.0,2019-04-24 09:41:00
3065,Desinventar,EL ORO,EC07,PORTOVELO,EC0711,PORTOVELO,EC071150,El Paraiso - a 100 metros del Cementerio.,-79.592277,-3.724978,La Sierra,3/22/15,3:33:00 PM,3,22,2015,Rain ,Heavy precipitation/ Strong current,1,0,0,0,0,0,0,0,1,0,,,,,1.0,,9.0,9.0,9.0,,,,9,8,9,9.0,1.0,2.0,2015-03-22 20:33:00
4263,Desinventar,EL ORO,EC07,ZARUMA,EC0713,SINSAO,EC071358,Barrio Roma,-79.592852,-3.67069,La Sierra,5/16/17,5:50:00 AM,5,16,2017,Rain / Overflow,Heavy precipitation/ Short duration rain/ Small stream overflow ,1,1,0,1,0,0,0,0,0,0,,,,,,,,,,,,,9,8,9,,,,2017-05-16 10:50:00
4694,Desinventar,LOS RIOS,EC12,BABA,EC1202,BABA,EC120250,Rcto. La Hornilla,-79.681082,-1.780641,La Costa,2/27/19,11:37:00 AM,2,27,2019,Rain,Heavy precipitation/ Short duration flood,1,0,0,0,0,0,0,0,0,1,,,,,38.0,38.0,136.0,,,34.0,,,9,8,9,136.0,38.0,5.0,2019-02-27 16:37:00
4667,SNGRE,MANABI,EC13,FLAVIO ALFARO,EC1305,FLAVIO ALFARO,EC130550,San Francisco De Novillo (Cab. En Novillo). La Balza,-79.905706,-0.40471,La Costa,2/21/19,9:00:00 PM,2,21,2019,Rain / Overflow,Heavy precipitation/ Small stream overflow/ Short duration rain,1,1,0,1,0,0,0,0,0,0,,,,,,5.0,20.0,,,20.0,,,9,8,9,20.0,5.0,3.0,2019-02-22 02:00:00
4725,SNGRE,MANABI,EC13,CHONE,EC1303,CANUTO,EC130352,"Varios sectores (Olla Vieja, Hueso de Vaca, La Vainita, Bejuquillo, Baja Canuto, Via Ferrea, la Florida)",-80.139886,-0.792552,La Costa,3/7/19,10:00:00 AM,3,7,2019,Rain,Heavy precipitation / Strong current,1,0,0,0,0,0,0,0,1,0,,,,,,300.0,1200.0,,,45.0,199.5,,9,8,9,1200.0,300.0,6.0,2019-03-07 15:00:00
5061,SNGRE_2021,CARCHI,EC04,MONTUFAR,EC0405,CRISTOBAL COLON,EC040551,Sixal,-77.813279,0.607182,La Sierra,12/12/19,5:00:00 PM,12,12,2019,Rain,Heavy precipitation/ Surface runoff,1,0,0,0,1,0,0,0,0,0,,,,,14.0,14.0,44.0,,,,,,8,9,9,44.0,14.0,3.0,2019-12-12 22:00:00
3538,Desinventar,NAPO,EC15,TENA,EC1501,TENA,EC150150,Barrio Bellavista Bajo Barrio el Terere,-77.814261,-0.990607,La Sierra,3/13/16,10:00:00 AM,3,13,2016,Rain / Overflow,Heavy precipitation/ Short duration flood,1,0,0,0,0,0,0,0,0,1,,,,10.0,61.0,,317.0,317.0,60.0,60.0,21.0,8.0,9,9,9,317.0,61.0,5.0,2016-03-13 15:00:00
2331,Desinventar/SNGRE_2021,NAPO,EC15,TENA,EC1501,TENA,EC150150,Bajo Ongota,-77.8158,-1.0088,La Sierra,4/20/13,4:00:00 AM,4,20,2013,Rain / Overflow,Heavy precipitation,1,0,0,0,0,0,0,0,0,0,,,,,1.0,,8.0,8.0,,,,,2,9,9,8.0,1.0,2.0,2013-04-20 09:00:00
1852,Desinventar/SNGRE_2021,CARCHI,EC04,BOLIVAR,EC0402,SAN RAFAEL,EC040255,San Rafael,-77.9077,0.4275,La Sierra,1/29/13,2:00:00 AM,1,29,2013,Overflow,Artificial waterway overflow,0,0,1,0,0,0,0,0,0,0,,,,,1.0,,9.0,9.0,,,,,1,9,9,9.0,1.0,2.0,2013-01-29 07:00:00
3212,Desinventar,IMBABURA,EC10,IBARRA,EC1001,AMBUQUI,EC100151,El Chirimoyal,-78.008761,0.452007,La Sierra,6/20/15,12:00:00 PM,6,20,2015,Rain / Overflow,Heavy precipitation,1,0,0,0,0,0,0,0,0,0,,,,,1.0,,,,,,0.02,,2,9,9,,1.0,,2015-06-20 17:00:00
2388,Desinventar/SNGRE_2021,IMBABURA,EC10,OTAVALO,EC1004,SAN JUAN DE ILUMAN,EC100456,San Luis de Agualongo,-78.2298,0.2812,La Sierra,5/8/13,9:35:00 PM,5,8,2013,Rain ,Heavy precipitation,1,0,0,0,0,0,0,0,0,0,,,,,1.0,,10.0,10.0,,,,,2,9,9,10.0,1.0,2.0,2013-05-09 02:35:00
5046,SNGRE_2021,IMBABURA,EC10,OTAVALO,EC1004,SAN LUIS,EC100450,Barrio Santa Anita,-78.259739,0.223528,La Sierra,11/21/19,3:09:00 PM,11,21,2019,Rain,Heavy precipitation,1,0,0,0,0,0,0,0,0,0,,,,,1.0,1.0,9.0,,,,,,2,9,9,9.0,1.0,2.0,2019-11-21 20:09:00
5189,SNGRE_2021,IMBABURA,EC10,OTAVALO,EC1004,SAN LUIS,EC100450,Garcia Moreno entre Atahualpa y La Roca,-78.26275,0.224427,La Sierra,2/29/20,4:00:00 PM,2,29,2020,Rain,Heavy precipitation,1,0,0,0,0,0,0,0,0,0,,,,,1.0,1.0,2.0,,,,,,2,9,9,2.0,1.0,1.0,2020-02-29 21:00:00
5291,SNGRE_2021,IMBABURA,EC10,OTAVALO,EC1004,JORDAN,EC100450,San Eloy,-78.272507,0.25003,La Sierra,6/1/20,2:15:00 PM,6,1,2020,Rain,Heavy precipitation/strong current,1,0,0,0,0,0,0,0,1,0,,,,,6.0,6.0,21.0,,,,,,9,9,9,21.0,6.0,3.0,2020-06-01 19:15:00
4304,Desinventar/SNGRE_2021,IMBABURA,EC10,COTACACHI,EC1003,QUIROGA,EC100356,Domingo Sabio,-78.295099,0.27361825,La Sierra,10/9/17,5:45:00 PM,10,9,2017,Rain,Heavy precipitation,1,0,0,0,0,0,0,0,0,0,,,,,1.0,,,8.0,,,,,2,9,9,8.0,1.0,2.0,2017-10-09 22:45:00
2811,Desinventar,IMBABURA,EC10,OTAVALO,EC1004,SAN JOSE DE QUICHINCHE,EC100455,Via Quiroga,-78.350527,0.248229,La Sierra,5/10/14,3:15:00 PM,5,10,2014,Rain,Heavy precipitation,1,0,0,0,0,0,0,0,0,0,,,,,1.0,,,,,,,,2,9,9,,1.0,,2014-05-10 20:15:00
2781,Desinventar,PICHINCHA,EC17,RUMINAHUI,EC1705,SANGOLQUI,EC170550,Barrio Mushunan y Calle 3,-78.450007,-0.330295,La Sierra,5/6/14,4:30:00 PM,5,6,2014,Rain,Heavy precipitation/ Strong current,1,0,0,0,0,0,0,0,1,0,,,,,1.0,,6.0,6.0,,,,,9,9,9,6.0,1.0,2.0,2014-05-06 21:30:00
3334,Desinventar,IMBABURA,EC10,COTACACHI,EC1003,APUELA,EC100351,La Playa,-78.507486,0.360689,La Sierra,1/25/16,9:00:00 AM,1,25,2016,Rain / Overflow,Heavy precipitation/ Strong current,1,0,0,0,0,0,0,0,1,0,,,,,3.0,,20.0,20.0,6.0,20.0,,,9,9,9,20.0,3.0,3.0,2016-01-25 14:00:00
5092,SNGRE_2021,PICHINCHA,EC17,MEJIA,EC1703,MACHACHI,EC170350,San Alfonso-Obelisco de Aloag,-78.557236,-0.473241,La Sierra,1/24/20,8:00:00 PM,1,24,2020,Rain/Overflow,Urban,0,0,0,0,0,1,0,0,0,0,,,,,,,,,,,,,1,9,9,,,,2020-01-25 01:00:00
2285,Desinventar/SNGRE_2021,PICHINCHA,EC17,MEJIA,EC1703,MACHACHI,EC170350,Avenida Pablo Guarderas (entre las calles 23 de julio y del ,-78.5689,-0.509,La Sierra,4/17/13,3:35:00 PM,4,17,2013,Rain ,Heavy precipitation/ Surface runoff,1,0,0,0,1,0,0,0,0,0,,,,,2.0,,7.0,7.0,,,,,8,9,9,7.0,2.0,2.0,2013-04-17 20:35:00
2883,Desinventar,PICHINCHA,EC17,MEJIA,EC1703,ALOASI,EC170352,"Aloasi,  Calle Sucre camino hacia la Moya.",-78.585343,-0.518011,La Sierra,10/12/14,3:38:00 PM,10,12,2014,Overflow,Artificial waterway overflow,0,0,1,0,0,0,0,0,0,0,,,,,7.0,,28.0,28.0,,,,,1,9,9,28.0,7.0,3.0,2014-10-12 20:38:00
2686,Desinventar,TUNGURAHUA,EC18,QUERO,EC1806,QUERO,EC180650,"La Calera, Hualcangas, El Guanto.",-78.586982,-1.432964,La Sierra,3/10/14,1:00:00 PM,3,10,2014,Rain ,Heavy precipitation,1,0,0,0,0,0,0,0,0,0,,,,,,,120.0,120.0,,,180.0,330.0,2,9,9,120.0,,5.0,2014-03-10 18:00:00
1780,SNGRE_2021,CHIMBORAZO,EC06,GUANO,EC0607,LA MATRIZ,EC060750,Santa Teresita,-78.617888,-1.604179,La Sierra,11/29/12,5:00:00 PM,11,29,2012,Rain,Heavy precipitation,1,0,0,0,0,0,0,0,0,0,,,,,3.0,,17.0,,,,,,2,9,9,17.0,3.0,3.0,2012-11-29 22:00:00
2168,Desinventar/SNGRE_2021,CHIMBORAZO,EC06,GUANO,EC0607,EL ROSARIO,EC060750,San Pedro de las Abras,-78.6317,-1.6065,La Sierra,3/20/13,5:30:00 PM,3,20,2013,Rain,Heavy precipitation,1,0,0,0,0,0,0,0,0,0,,,,,39.0,,195.0,195.0,,,,,2,9,9,195.0,39.0,5.0,2013-03-20 22:30:00
2687,Desinventar,TUNGURAHUA,EC18,QUERO,EC1806,RUMIPAMBA,EC180651,"Rumipamba centro, Hipolongo, Pilco, Huangalo, Chocalo.",-78.632997,-1.421538,La Sierra,3/10/14,1:00:00 PM,3,10,2014,Rain ,Heavy precipitation,1,0,0,0,0,0,0,0,0,0,,,,,,,,,,,,230.0,2,9,9,,,,2014-03-10 18:00:00
3712,Desinventar,TUNGURAHUA,EC18,QUERO,EC1806,RUMIPAMBA,EC180651,Yayulihui Centro,-78.63413,-1.453093,La Sierra,1/10/17,4:12:00 PM,1,10,2017,Rain / Overflow,Artificial waterway overflow,0,0,1,0,0,0,0,0,0,0,,,,,,,,,,,0.2,,1,9,9,,,,2017-01-10 21:12:00
5063,SNGRE_2021,CHIMBORAZO,EC06,GUANO,EC0607,EL ROSARIO,EC060750,Varios sectores.,-78.646348,-1.600042,La Sierra,12/12/19,8:00:00 PM,12,12,2019,Rain,Heavy precipitation/ Surface runoff,1,0,0,0,1,0,0,0,0,0,,,,,,,,,,,,,8,9,9,,,,2019-12-13 01:00:00
3066,Desinventar,TUNGURAHUA,EC18,MOCHA,EC1804,MOCHA,EC180450,"Barrio El Calvario, a dos cuadras del estadio municipal en u",-78.66558,-1.406601,La Sierra,3/22/15,8:30:00 PM,3,22,2015,Overflow,Artificial waterway overflow,0,0,1,0,0,0,0,0,0,0,,,,,1.0,,1.0,1.0,,,,,1,9,9,1.0,1.0,1.0,2015-03-23 01:30:00
1723,SNGRE_2021,TUNGURAHUA,EC18,AMBATO,EC1801,QUISAPINCHA (QUIZAPINCHA),EC180162,La Bahia,-78.716495,-1.192557,La Sierra,10/12/12,4:00:00 AM,10,12,2012,Rain/ Overflow,Urban/ Artificial waterway overflow/ Surface runoff,0,0,1,0,1,1,0,0,0,0,,,,,10.0,,50.0,,,,,,8,9,9,50.0,10.0,3.0,2012-10-12 09:00:00
3930,Desinventar,CHIMBORAZO,EC06,COLTA,EC0603,SANTIAGO DE QUITO (CAB. EN SAN,EC060354,Junto a la Capilla por el puente,-78.742331,-1.74196,La Sierra,3/13/17,7:30:00 PM,3,13,2017,Overflow,Artificial waterway overflow,0,0,1,0,0,0,0,0,0,0,,,,,3.0,,9.0,9.0,,,,,1,9,9,9.0,3.0,2.0,2017-03-14 00:30:00
2691,Desinventar,CHIMBORAZO,EC06,COLTA,EC0603,SANTIAGO DE QUITO (CAB. EN SAN,EC060354,Unidad Educativa Santiago de Quito,-78.752604,-1.731097,La Sierra,3/11/14,7:00:00 PM,3,11,2014,Rain,Heavy precipitation,1,0,0,0,0,0,0,0,0,0,,,,,,,,,,,,,2,9,9,,,,2014-03-12 00:00:00
3455,Desinventar,ZAMORA CHINCHIPE,EC19,ZAMORA,EC1901,SAN CARLOS DE LAS MINAS,EC190158,Escuela Victor Manuel Penaherrera,-78.825056,-4.023765,La Sierra,2/23/16,7:45:00 AM,2,23,2016,Rain ,Urban/ Strong current,0,0,0,0,0,1,0,0,1,0,,,,,,,,,,,,,8,9,9,,,,2016-02-23 12:45:00
2426,Desinventar,AZUAY,EC01,CUENCA,EC0101,CUENCA,EC010150,Hermano Miguel,-78.9843,-2.8617,La Sierra,7/3/13,3:30:00 PM,7,3,2013,Rain,Heavy precipitation/ Strong current,1,0,0,0,0,0,0,0,1,0,,,,,2.0,,,,,,,,9,9,9,,2.0,,2013-07-03 20:30:00
1447,Desinventar,AZUAY,EC01,CUENCA,EC0101,CUENCA,EC010150,Ochoa Leon,-78.98493,-2.8338,La Sierra,4/4/12,2:00:00 PM,4,4,2012,Rain / Overflow,Heavy precipitation,1,0,0,0,0,0,0,0,0,0,,,,,1.0,,,1.0,,,,,2,9,9,1.0,1.0,1.0,2012-04-04 19:00:00
2409,Desinventar/SNGRE_2021,AZUAY,EC01,CUENCA,EC0101,HERMANO MIGUEL,EC010150,La Floresta,-78.9862,-2.8668,La Sierra,5/27/13,3:00:00 PM,5,27,2013,Rain,Heavy precipitation,1,0,0,0,0,0,0,0,0,0,,,,,2.0,,,,,,,,2,9,9,,2.0,,2013-05-27 20:00:00
2200,Desinventar/SNGRE_2021,AZUAY,EC01,CUENCA,EC0101,SININCAY,EC010167,Cruce del Carmen,-79.0174,-2.8502,La Sierra,3/25/13,3:10:00 PM,3,25,2013,Rain ,Heavy precipitation,1,0,0,0,0,0,0,0,0,0,,,,,1.0,,,,,,,,2,9,9,,1.0,,2013-03-25 20:10:00
2429,Desinventar/SNGRE_2021,AZUAY,EC01,CUENCA,EC0101,SININCAY,EC010167,Via Sinincay,-79.0174,-2.8502,La Sierra,7/3/13,2:30:00 PM,7,3,2013,Rain,Heavy precipitation,1,0,0,0,0,0,0,0,0,0,,,,,1.0,,,,,,,,2,9,9,,1.0,,2013-07-03 19:30:00
5173,SNGRE_2021,LOJA,EC11,LOJA,EC1101,SUCRE,EC110150,Escuela Miguel Riofrio,-79.211277,-4.0078909,La Sierra,2/27/20,8:00:00 AM,2,27,2020,Rain,Heavy precipitation,1,0,0,0,0,0,0,0,0,0,,,,,,,,,,,,,2,9,9,,,,2020-02-27 13:00:00
1848,Desinventar/SNGRE_2021,LOJA,EC11,LOJA,EC1101,SAN LUCAS,EC110157,Nueva Esperanza - Hierbabuena,-79.2692,-3.7616,La Sierra,1/25/13,12:30:00 PM,1,25,2013,Rain / Overflow,Heavy precipitation/ Small stream overflow/ Short duration rain,1,1,0,1,0,0,0,0,0,0,,,,,,,,,,,,,9,9,9,,,,2013-01-25 17:30:00
5210,SNGRE_2021,LOJA,EC11,SARAGURO,EC1111,MANU,EC111154,Centro de Manu,-79.404928,-3.4883839,La Sierra,3/11/20,7:00:00 PM,3,11,2020,Rain,Heavy precipitation,1,0,0,0,0,0,0,0,0,0,,,,,3.0,4.0,6.0,,,,,,2,9,9,6.0,4.0,2.0,2020-03-12 00:00:00
3362,Desinventar,LOS RIOS,EC12,MOCACHE,EC1212,MOCACHE,EC121250,San Ignacio,-79.548725,-1.161552,La Costa,1/25/16,6:02:00 AM,1,25,2016,Rain ,Heavy precipitation,1,0,0,0,0,0,0,0,0,0,,,,,3.0,,11.0,11.0,,,,,2,9,9,11.0,3.0,3.0,2016-01-25 11:02:00
4877,Desinventar,LOS RIOS,EC12,PUEBLOVIEJO,EC1204,PUERTO PECHICHE,EC120451,"El Limal, Rcto. La Florencia",-79.558197,-1.424918,La Costa,3/23/19,5:00:00 AM,3,23,2019,Rain,Urban / Short duration flood,0,0,0,0,0,1,0,0,0,1,,,,,76.0,76.0,243.0,243.0,,,,302.0,8,9,9,243.0,76.0,5.0,2019-03-23 10:00:00
5128,SNGRE_2021,ESMERALDAS,EC08,ESMERALDAS,EC0801,BARTOLOMÉ RUIZ (CESAR FRANCO C,EC080150,Barrio Santa Marta 1,-79.650976,0.969504,La Costa,2/22/20,10:05:00 PM,2,22,2020,Rain,Heavy precipitation,1,0,0,0,0,0,0,0,0,0,,,,,1.0,1.0,6.0,,,,,,2,9,9,6.0,1.0,2.0,2020-02-23 03:05:00
3317,Desinventar,ESMERALDAS,EC08,ESMERALDAS,EC0801,5 DE AGOSTO,EC080150,20 DE NOVIEMBRE,-79.658451,0.952834,La Costa,1/25/16,6:00:00 AM,1,25,2016,Rain,Heavy precipitation,1,0,0,0,0,0,0,0,0,0,,,,,19.0,,101.0,101.0,101.0,101.0,,,2,9,9,101.0,19.0,5.0,2016-01-25 11:00:00
4248,Desinventar,IMBABURA,EC10,IBARRA,EC1001,SAN FRANCISCO,EC100150,Varios Sectores,-78.074872,0.321559,La Sierra,5/10/17,1:00:00 AM,5,10,2017,Rain,Heavy precipitation/ Urban ,1,0,0,0,0,1,0,0,0,0,,,,,3.0,,13.0,13.0,,,,,3,10,9,13.0,3.0,3.0,2017-05-10 06:00:00
4262,Desinventar,IMBABURA,EC10,IBARRA,EC1001,SAN FRANCISCO,EC100150,Unidad Educativa Teodoro Gomez de la Torre - Mariano Suarez ,-78.074872,0.321559,La Sierra,5/16/17,3:30:00 PM,5,16,2017,Rain,Heavy precipitation/ Urban ,1,0,0,0,0,1,0,0,0,0,,,,,,,,,,,,,3,10,9,,,,2017-05-16 20:30:00
5045,SNGRE_2021,IMBABURA,EC10,IBARRA,EC1001,LA ESPERANZA,EC100154,Rumipamba,-78.108,0.279,La Sierra,11/21/19,5:00:00 AM,11,21,2019,Rain/ Overflow,Heavy precipitation/ Artificial waterway overflow,1,0,1,0,0,0,0,0,0,0,,,,,,,,,,,,,3,10,9,,,,2019-11-21 10:00:00
4260,SNGRE,IMBABURA,EC10,IBARRA,EC1001,LA DOLOROSA DE PRIORATO,EC100150,San Jose,-78.108184,0.389322,La Sierra,5/16/17,3:30:00 PM,5,16,2017,Rain,Heavy precipitation/ Urban ,1,0,0,0,0,1,0,0,0,0,,,,,,,9.0,,,,,,3,10,9,9.0,,2.0,2017-05-16 20:30:00
5010,SNGRE_2021,IMBABURA,EC10,IBARRA,EC1001,SAN ANTONIO,EC100157,Tanguarin - Calle El Progreso - Calle Monsenor Leonidas Proano,-78.1698,0.316,La Sierra,9/24/19,7:05:00 PM,9,24,2019,Rain/ Overflow,Artificial waterway overflow/ Heavy precipitation,1,0,1,0,0,0,0,0,0,0,,,,,2.0,2.0,8.0,,,,,,3,10,9,8.0,2.0,2.0,2019-09-25 00:05:00
5070,SNGRE_2021,TUNGURAHUA,EC18,BAÑOS DE AGUA SANTA,EC1802,RÍO VERDE,EC180253,"Santo Domingo, via a El Corazon",-78.303658,-1.390005,La Sierra,12/18/19,12:05:00 AM,12,18,2019,Rain,Heavy precipitation/ Surface runoff,1,0,0,0,1,0,0,0,0,0,,,,,,2.0,8.0,,,,,,8,10,9,8.0,2.0,2.0,2019-12-18 05:05:00
3233,SNGRE_2021,TUNGURAHUA,EC18,BAÑOS DE AGUA SANTA,EC1802,RÍO VERDE,EC180253,"Costado izquierdo pasando el puente de Rio Verde, via al Corazon ingresando 5 minutos en vehiculo.",-78.304286,-1.3908734,La Sierra,7/22/15,3:30:00 AM,7,22,2015,,Heavy precipitation/ Surface runoff,1,0,0,0,1,0,0,0,0,0,,,,,,,,,,,,,8,10,9,,,,2015-07-22 08:30:00
5350,SNGRE_2021,PICHINCHA,EC17,QUITO,EC1701,PIFO,EC170175,"Barrio El Corazon, Pasaje Amazonas",-78.326662,-0.246776,La Sierra,10/26/20,7:00:00 PM,10,26,2020,Rain/Overflow,Short duration rain/Artificial waterway overflow,0,1,1,0,0,0,0,0,0,0,,,,,1.0,1.0,5.0,,,,,,4,10,9,5.0,1.0,1.0,2020-10-27 00:00:00
2884,Desinventar,PICHINCHA,EC17,QUITO,EC1701,TABABELA,EC170183,Barrio El Vergel,-78.337046,-0.186181,La Sierra,10/12/14,9:19:00 PM,10,12,2014,Rain ,Short duration rain,0,1,0,0,0,0,0,0,0,0,,,,,2.0,,13.0,,,,,,3,10,9,13.0,2.0,3.0,2014-10-13 02:19:00
2352,Desinventar/SNGRE_2021,PICHINCHA,EC17,QUITO,EC1701,PONCEANO,EC170150,La Ofelia,-78.491,-0.1099,La Sierra,4/23/13,4:00:00 PM,4,23,2013,Rain,Heavy precipitation/ Urban,1,0,0,0,0,1,0,0,0,0,,,,,2.0,,10.0,10.0,,,,,3,10,9,10.0,2.0,2.0,2013-04-23 21:00:00
3980,SNGRE,PICHINCHA,EC17,QUITO,EC1701,LA ARGELIA,EC170150,Sector Lucha De Los Pobres - Escuela Francisco Javier Salazar; Calle 21 De Agosto. ,-78.533488,-0.285439,La Sierra,3/22/17,4:10:00 PM,3,22,2017,Rain / Overflow,Small stream overflow,0,0,0,1,0,0,0,0,0,0,,,,,,,1.0,,1.0,1.0,,,4,10,9,1.0,,1.0,2017-03-22 21:10:00
4314,SNGRE,PICHINCHA,EC17,QUITO,EC1701,QUITO,EC170150,SAN BARTOLO. Av. Mariscal Sucre y Quichuas,-78.539968,-0.253587,La Sierra,10/26/17,4:00:00 PM,10,26,2017,Rain ,Urban/ Short duration rain,0,1,0,0,0,1,0,0,0,0,,,,,,,3.0,,,,,,4,10,9,3.0,,1.0,2017-10-26 21:00:00
2770,Desinventar,PICHINCHA,EC17,QUITO,EC1701,LA ECUATORIANA,EC170150,"Barrio puertas del Sol, Calle B y Camilo Orejuela, junto a l",-78.564791,-0.311966,La Sierra,4/26/14,9:17:00 PM,4,26,2014,,Urban/ Strong current,0,0,0,0,0,1,0,0,1,0,,,,,5.0,,,,,,,,8,10,9,,5.0,,2014-04-27 02:17:00
4798,SNGRE,PICHINCHA,EC17,QUITO,EC1701,LLOA,EC170166,Chiriboga - Via antigua a Santo Domingo Km 50,-78.596551,-0.250687,La Sierra,3/17/19,1:17:00 AM,3,17,2019,Rain / Overflow,Small stream overflow,0,0,0,1,0,0,0,0,0,0,,,,,,,4.0,,,,,,4,10,9,4.0,,1.0,2019-03-17 06:17:00
3637,Desinventar,CHIMBORAZO,EC06,GUANO,EC0607,SAN ANDRES,EC060754,Parque Central Vivienda #702 ,-78.751401,-1.516518,La Sierra,6/10/16,3:15:00 AM,6,10,2016,Rain ,Heavy precipitation/ Urban ,1,0,0,0,0,1,0,0,0,0,,,,,4.0,,16.0,16.0,,,,,3,10,9,16.0,4.0,3.0,2016-06-10 08:15:00
1734,SNGRE_2021,AZUAY,EC01,CUENCA,EC0101,EL BATAN,EC010150,Feria Libre,-79.032028,-2.897798,La Sierra,10/21/12,1:49:00 PM,10,21,2012,Rain ,Heavy precipitation/ Urban,1,0,0,0,0,1,0,0,0,0,,,,,,,,,,,,,3,10,9,,,,2012-10-21 18:49:00
5228,SNGRE_2021,CANAR,EC03,SUSCAL,EC0307,SUSCAL,EC030750,Urbanizacion Antonio Paguay,-79.05407,-2.439292,La Sierra,3/20/20,8:00:00 AM,3,20,2020,Rain/Overflow,Small stream overflow,0,0,0,1,0,0,0,0,0,0,,,,,2.0,2.0,4.0,,,,,,4,10,9,4.0,2.0,1.0,2020-03-20 13:00:00
1726,Desinventar,AZUAY,EC01,CUENCA,EC0101,SAYAUSI,EC010165,Santa Maria,-79.07132,-2.87751,La Sierra,10/17/12,4:25:00 AM,10,17,2012,,Urban/ Strong current,0,0,0,0,0,1,0,0,1,0,,,,,30.0,,,,,,,,8,10,9,,30.0,,2012-10-17 09:25:00
1894,SNGRE_2021,AZUAY,EC01,CUENCA,EC0101,SAN JOAQUIN,EC010163,"Barabon,  tres puentes  ",-79.1882,-2.8982,La Sierra,2/9/13,9:30:00 AM,2,9,2013,Overflow,Short duration flood/ Urban,0,0,0,0,0,1,0,0,0,1,,,,,2.0,,,,,,,,8,10,9,,2.0,,2013-02-09 14:30:00
4089,SNGRE,LOJA,EC11,LOJA,EC1101,VILCABAMBA (VICTORIA),EC110161,Yamburara,-79.205613,-4.266778,La Sierra,3/31/17,6:00:00 PM,3,31,2017,Rain ,Small stream overflow,0,0,0,1,0,0,0,0,0,0,,,,,,,27.0,,,,,,4,10,9,27.0,,3.0,2017-03-31 23:00:00
4382,Desinventar,LOJA,EC11,LOJA,EC1101,GUALEL,EC110154,Musher,-79.363242,-3.790917,La Sierra,2/22/18,5:50:00 AM,2,22,2018,Rain / Overflow,Landslides/ Small stream overflow,0,0,0,1,0,0,0,0,0,0,,,,,,,,,,,,,4,10,9,,,,2018-02-22 10:50:00
3668,Desinventar,PASTAZA,EC16,ARAJUNO,EC1604,CURARAY,EC160451,Varias Comunidades,-76.965143,-1.372995,El Oriente,11/4/16,5:00:00 AM,11,4,2016,Rain / Overflow,Heavy precipitation/ Short duration rain/ Surface runoff,1,1,0,0,1,0,0,0,0,0,,,,,126.0,,651.0,651.0,,,,,10,1,10,651.0,126.0,6.0,2016-11-04 10:00:00
3288,Desinventar,ORELLANA,EC22,ORELLANA,EC2201,PTO. FCO. DE ORELLANA (EL COCA,EC220150,Varios Sectores. (Escuelas Presidente Tamayo 24 de Marzo y M,-76.998777,-0.466318,El Oriente,1/6/16,5:00:00 AM,1,6,2016,Rain,Heavy precipitation/ Urban/ Short duration rain/ Strong current,1,1,0,0,0,1,0,0,1,0,,,,,,,,,,,,,10,1,10,,,,2016-01-06 10:00:00
3249,Desinventar/SNGRE_2021,SUCUMBIOS,EC21,GONZALO PIZARRO,EC2102,LUMBAQUI,EC210250,Recinto Nuevo Paraiso Km 59 pasando la bomba de gasolina.,-77.366451,0.04982204,La Sierra,10/18/15,5:22:00 PM,10,18,2015,Rain / Overflow,Heavy precipitation/ Urban/ Short duration rain/ Small stream overflow/ Strong current,1,1,0,1,0,1,0,0,1,0,,,,,4.0,,6.0,6.0,,,,,10,1,10,6.0,4.0,2.0,2015-10-18 22:22:00
3219,Desinventar,NAPO,EC13,TENA,EC1501,AHUANO,EC150151,"Ahuano, Chonta Punta",-77.556974,-1.065281,La Sierra,7/17/15,4:00:00 AM,7,17,2015,Rain,Strong current/ Short duration rain,0,1,0,0,0,0,0,0,1,0,,,,,,,,,,,,,10,1,10,,,,2015-07-17 09:00:00
4440,Desinventar,NAPO,EC15,TENA,EC1501,AHUANO,EC150151,"La Punta, comunidad Mushuk Kausay",-77.559034,-1.060054,La Sierra,4/23/18,5:00:00 AM,4,23,2018,Rain / Overflow,Short duration flood/ Surface runoff,0,0,0,0,1,0,0,0,0,1,,,,,,,,,,,,1.0,10,1,10,,,,2018-04-23 10:00:00
2935,Desinventar,NAPO,EC15,TENA,EC1501,AHUANO,EC150151,Comunidad El Cristal,-77.579067,-1.064169,La Sierra,1/23/15,4:00:00 AM,1,23,2015,Rain / Overflow,Strong current /Short duration rain,0,1,0,0,0,0,0,0,1,0,,,,,5.0,,16.0,16.0,,,,,10,1,10,16.0,5.0,3.0,2015-01-23 09:00:00
4287,Desinventar,MORONA SANTIAGO,EC14,PALORA,EC1404,PALORA (METZERA),EC140450,Varios sectores de la ciudad,-77.965241,-1.70429,La Sierra,7/1/17,12:56:00 AM,7,1,2017,Rain / Overflow,Strong current/ Surface runoff,0,0,0,0,1,0,0,0,1,0,,,,,43.0,,115.0,115.0,,12.0,,0.5,10,1,10,115.0,43.0,5.0,2017-07-01 05:56:00
4338,SNGRE_2021,MORONA SANTIAGO,EC14,SAN JUAN BOSCO,EC1408,SANTIAGO DE PANANZA,EC140854,San Luis de Miachi,-78.454591,-3.206184,La Sierra,12/20/17,1:50:00 PM,12,20,2017,Rain/ Overflow,Small stream overflow/ Surface runoff,0,0,0,1,1,0,0,0,0,0,,,,,,,2.0,,,,,,10,1,10,2.0,,1.0,2017-12-20 18:50:00
4082,Desinventar,SANTO DOMINGO DE LOS TSACHILAS,EC23,SANTO DOMINGO,EC2301,VALLE HERMOSO,EC230155,Calle Guayaquil alado de la Iglesia Evangelica,-79.241868,-0.064804,La Costa,3/30/17,10:30:00 AM,3,30,2017,Rain ,Heavy precipitation/ Urban/ Strong current,1,0,0,0,0,1,0,0,1,0,,,,,2.0,,11.0,,,,,,10,1,10,11.0,2.0,3.0,2017-03-30 15:30:00
4275,SNGRE,ESMERALDAS,EC08,RIOVERDE,EC0807,RIOVERDE,EC080750,VARIOS SECTORES,-79.42084,1.069118,La Costa,6/16/17,6:20:00 AM,6,16,2017,Rain,Heavy precipitation/ Urban/ Short duration rain/ Strong current,1,1,0,0,0,1,0,0,1,0,,,,,,,1400.0,,,,,,10,1,10,1400.0,,6.0,2017-06-16 11:20:00
5105,SNGRE_2021,LOS RIOS,EC12,QUEVEDO,EC1205,SAN CARLOS,EC120553,Atras del Colegio Union Popular,-79.439234,-1.115576,La Costa,2/6/20,2:27:00 AM,2,6,2020,Rain,Heavy precipitation/Short duration rain/Short duration flood,1,1,0,0,0,0,0,0,0,1,,,,,3.0,3.0,10.0,,,,,,10,1,10,10.0,3.0,2.0,2020-02-06 07:27:00
3933,SNGRE,LOS RIOS,EC12,QUEVEDO,EC1205,SAN CAMILO,EC120550,Calle Mexico y la A,-79.460033,-1.030891,La Costa,3/14/17,5:50:00 PM,3,14,2017,Rain ,Heavy precipitation/ Short duration rain/ Short duration flood,1,1,0,0,0,0,0,0,0,1,,,,,,,4.0,,,,,,10,1,10,4.0,,1.0,2017-03-14 22:50:00
4939,Desinventar,LOS RIOS,EC12,QUEVEDO,EC1205,SAN CRISTOBAL,EC120550,Isla del Rio,-79.464619,-1.05194,La Costa,5/15/19,6:27:00 PM,5,15,2019,Rain,Heavy precipitation/ Urban/ Short duration rain/ Strong current/ Short duration flood,1,1,0,0,0,1,0,0,1,1,1.0,,,,,,,,,,,,10,1,10,,,,2019-05-15 23:27:00
3463,Desinventar,GUAYAS,EC09,NARANJAL,EC0911,SAN CARLOS,EC091152,Sector Luz de America,-79.472478,-2.544127,La Costa,2/25/16,7:00:00 AM,2,25,2016,Rain ,Urban/ Short duration rain/ Small stream overflow/ Strong current,0,1,0,1,0,1,0,0,1,0,,,,,,,,,,,,,10,1,10,,,,2016-02-25 12:00:00
3959,Desinventar,ESMERALDAS,EC08,QUININDE,EC0804,ROSA ZARATE (QUININDE),EC080450,VARIOS SECTORES,-79.473704,0.326835,La Costa,3/18/17,7:15:00 AM,3,18,2017,Rain,Heavy precipitation/Urban/Short duration flood/Short duration rain,1,1,0,0,0,1,0,0,0,1,,,,,398.0,,1592.0,1592.0,,,,,10,1,10,1592.0,398.0,6.0,2017-03-18 12:15:00
1763,SNGRE_2021,ESMERALDAS,EC08,QUININDE,EC0804,ROSA ZARATE (QUININDE),EC080450,Barrios asentados en zonas bajas de la parroquia,-79.521741,0.299329,La Costa,11/15/12,8:30:00 PM,11,15,2012,Rain,Heavy precipitation/ Short duration rain/ Short duration flood,1,1,0,0,0,0,0,0,0,1,,,,,40.0,,200.0,,,,,,10,1,10,200.0,40.0,5.0,2012-11-16 01:30:00
3920,Desinventar,GUAYAS,EC09,SAN JACINTO DE YAGUACHI,EC0920,GRAL. PEDRO J. MONTERO (BOLICH,EC092053,Rcto. La Violeta,-79.591505,-2.262706,La Costa,3/10/17,5:10:00 PM,3,10,2017,Rain / Overflow/Failure,Heavy precipitation/River bank failure/Short duration flood,1,0,0,0,0,0,0,1,0,1,,,,,50.0,,252.0,252.0,,,,,10,1,10,252.0,50.0,5.0,2017-03-10 22:10:00
3986,SNGRE,GUAYAS,EC09,GUAYAQUIL,EC0901,TENGUEL,EC090158,Barrio El Gallinazo,-79.790882,-2.995275,La Costa,3/23/17,11:37:00 AM,3,23,2017,Rain / Overflow,River bank failure/ Short duration flood,0,0,0,0,0,0,0,1,0,1,,,,,,,16.0,,,,,,10,1,10,16.0,,3.0,2017-03-23 16:37:00
3526,Desinventar,LOS RIOS,EC12,VINCES,EC1208,ANTONIO SOTOMAYOR (CAB. EN PLAYAS DE VINCES),EC120851,La California,-79.819676,-1.706922,La Costa,3/10/16,10:43:00 AM,3,10,2016,Rain / Overflow,Heavy precipitation/ Short duration rain/ Short duration flood,1,1,0,0,0,0,0,0,0,1,,,,,1.0,,3.0,3.0,,3.0,,,10,1,10,3.0,1.0,1.0,2016-03-10 15:43:00
1994,Desinventar/SNGRE_2021,GUAYAS,EC09,BALZAR,EC0904,BALZAR,EC090450,Recinto Chicompe; como referencia por la escuela Santos Zamb,-79.9073,-1.2902,La Costa,3/4/13,9:05:00 PM,3,4,2013,Rain / Overflow,Heavy precipitation/ Short duration rain/ Strong current,1,1,0,0,0,0,0,0,1,0,,,,,12.0,,1241.0,1241.0,,,,,10,1,10,1241.0,12.0,6.0,2013-03-05 02:05:00
3586,Desinventar,GUAYAS,EC09,BALZAR,EC0904,BALZAR,EC090450,Varios sectores (Barrio Amazonas Bella Alegria y 27 de Marzo,-79.909288,-1.367412,La Costa,4/10/16,10:20:00 AM,4,10,2016,Rain,Urban/ Small stream overflow/ Strong current,0,0,0,1,0,1,0,0,1,0,,,,,16.0,,64.0,64.0,,,,,10,1,10,64.0,16.0,4.0,2016-04-10 15:20:00
5106,SNGRE_2021,GUAYAS,EC09,GUAYAQUIL,EC0901,TARQUI,EC090150,Coop. Guerreros del Fortin Mz 1148 solar 21,-79.95774,-2.1212596,La Costa,2/7/20,5:15:00 PM,2,7,2020,Rain,Heavy precipitation/Short duration rain/strong current,1,1,0,0,0,0,0,0,1,0,,,,,1.0,1.0,4.0,,,,,,10,1,10,4.0,1.0,1.0,2020-02-07 22:15:00
5156,SNGRE_2021,GUAYAS,EC09,DAULE,EC0906,DAULE,EC090650,San Gabriel,-79.978775,-1.8650976,La Costa,2/25/20,2:00:00 PM,2,25,2020,Rain/Overflow,Heavy precipitation/Small stream overflow/strong current,1,0,0,1,0,0,0,0,1,0,,,,,50.0,50.0,200.0,,,,25.0,20.0,10,1,10,200.0,50.0,5.0,2020-02-25 19:00:00
3796,Desinventar,GUAYAS,EC09,COLIMES,EC0905,COLIMES,EC090550,Calles Sucre y Maximo Macias,-80.010592,-1.546104,La Costa,2/8/17,8:00:00 AM,2,8,2017,Rain,Heavy precipitation/ Short duration rain/ Short duration flood,1,1,0,0,0,0,0,0,0,1,,,,,4.0,,15.0,15.0,,,,,10,1,10,15.0,4.0,3.0,2017-02-08 13:00:00
3185,Desinventar,GUAYAS,EC09,ISIDRO AYORA,EC0928,ISIDRO AYORA,EC092850,Av. Juan Montalvo y Mariscal Sucre,-80.150234,-1.894377,La Costa,5/14/15,4:00:00 PM,5,14,2015,Rain ,Heavy precipitation/ Short duration rain/ Surface runoff,1,1,0,0,1,0,0,0,0,0,,,,,,,,,,,,,10,1,10,,,,2015-05-14 21:00:00
4165,SNGRE,MANABI,EC13,ROCAFUERTE,EC1312,ROCAFUERTE,EC131250,Varios sectores de la zona baja de Rocafuerte ,-80.448663,-0.928672,La Costa,4/9/17,5:30:00 AM,4,9,2017,Rain / Overflow,Heavy precipitation/ Strong current/ Short duration rain,1,1,0,0,0,0,0,0,1,0,1.0,,,,,,9996.0,,41.0,200.0,,,10,1,10,9996.0,,,2017-04-09 10:30:00
4613,Desinventar,MORONA SANTIAGO,EC14,SANTIAGO,EC1405,SANTIAGO DE MENDEZ,EC140550,Barrio 1ero. de Mayo,-78.31215,-2.724173,La Sierra,1/28/19,5:47:00 AM,1,28,2019,Rain / Overflow,Small stream overflow/ Surface runoff,0,0,0,1,1,0,0,0,0,0,,,,,11.0,9.0,36.0,36.0,,,,,10,2,10,36.0,11.0,3.0,2019-01-28 10:47:00
3420,Desinventar,SANTO DOMINGO DE LOS TSACHILAS,EC23,SANTO DOMINGO,EC2301,RIO TOACHI,EC230150,Coop. Brisas del colorado sector 1,-79.160744,-0.223525,La Costa,1/29/16,3:50:00 AM,1,29,2016,Rain,Heavy precipitation/ Urban/ Short duration rain/ Strong current,1,1,0,0,0,1,0,0,1,0,,,,,,,,,,,,,10,2,10,,,,2016-01-29 08:50:00
4441,Desinventar,ESMERALDAS,EC08,RIOVERDE,EC0807,CHUMUNDE,EC080752,Recinto Meribe,-79.394586,0.812824,La Costa,4/23/18,11:00:00 PM,4,23,2018,Rain / Overflow,Short duration rain/ Short duration flood,0,1,0,0,0,0,0,0,0,1,,,,,6.0,,32.0,32.0,,,,,10,2,10,32.0,6.0,3.0,2018-04-24 04:00:00
4449,Desinventar,LOS RIOS,EC12,VENTANAS,EC1207,10 DE NOVIEMBRE,EC120750,Calle Medardo Angel Silva entre Maria Isabel Fuga y Arturo C,-79.458371,-1.436341,La Costa,5/5/18,3:24:00 AM,5,5,2018,Rain ,Heavy precipitation/ Short duration rain/ Strong current/ Short duration flood,1,1,0,0,0,0,0,0,1,1,,,,,1.0,,2.0,2.0,,2.0,,,10,2,10,2.0,1.0,1.0,2018-05-05 08:24:00
4872,SNGRE,LOS RIOS,EC12,VENTANAS,EC1207,VENTANAS,EC120750,Chacarita. Recinto Trasmayo,-79.464568,-1.435825,La Costa,3/22/19,4:45:00 AM,3,22,2019,Rain / Overflow,Heavy precipitation/ Short duration rain/ Small stream overflow/ Short duration flood,1,1,0,1,0,0,0,0,0,1,,,,,,20.0,60.0,,,,,,10,2,10,60.0,20.0,4.0,2019-03-22 09:45:00
4698,Desinventar,LOS RIOS,EC12,BUENA FE,EC1210,SAN JACINTO DE BUENA FE CABECE,EC121050,7 de Agosto y Simon Parra,-79.481683,-0.900426,La Costa,2/28/19,9:50:00 PM,2,28,2019,Rain,Heavy precipitation/ Short duration rain/ Short duration flood,1,1,0,0,0,0,0,0,0,1,,,,,1.0,1.0,1.0,1.0,,,,,10,2,10,1.0,1.0,1.0,2019-03-01 02:50:00
4699,SNGRE,LOS RIOS,EC12,BUENA FE,EC1210,SAN JACINTO DE BUENA FE CABECE,EC121050,"Cooperativa 19 de Octubre , Nueva Esperanza, Fausto Jimenez, La Loma",-79.489823,-0.894029,La Costa,2/28/19,8:58:00 PM,2,28,2019,Rain,Heavy precipitation/ Short duration rain/ Short duration flood,1,1,0,0,0,0,0,0,0,1,,,,,,14.0,46.0,,,,,,10,2,10,46.0,14.0,3.0,2019-03-01 01:58:00
4761,Desinventar,LOS RIOS,EC12,BABA,EC1202,BABA,EC120250,El Sarten y Chontal,-79.716868,-1.773408,La Costa,3/13/19,9:47:00 AM,3,13,2019,Rain,Heavy precipitation/ Short duration rain/ Short duration flood,1,1,0,0,0,0,0,0,0,1,,,,,32.0,32.0,96.0,96.0,,3.0,,141.0,10,2,10,96.0,32.0,4.0,2019-03-13 14:47:00
5208,SNGRE_2021,LOS RIOS,EC12,VINCES,EC1208,VINCES,EC120850,Augusto Valencia,-79.744231,-1.567461,La Costa,3/9/20,10:07:00 AM,3,9,2020,Rain,Heavy precipitation/Short duration rain/Short duration flood,1,1,0,0,0,0,0,0,0,1,,,,,17.0,17.0,70.0,,,,,,10,2,10,70.0,17.0,4.0,2020-03-09 15:07:00
4828,Desinventar,GUAYAS,EC09,SALITRE,EC0919,GRAL. VERNAZA (DOS ESTEROS),EC091951,Recinto Bebo,-79.788934,-1.722099,La Costa,3/19/19,2:00:00 PM,3,19,2019,Overflow/ Failure,Strong current/River Bank Failure,0,0,0,0,0,0,0,1,1,0,,,,,34.0,34.0,96.0,96.0,,,,,10,2,10,96.0,34.0,4.0,2019-03-19 19:00:00
3936,SNGRE,GUAYAS,EC09,BALAO,EC0903,BALAO,EC090350,Barrio Las Brisas,-79.816468,-2.911283,La Costa,3/15/17,9:00:00 PM,3,15,2017,Rain / Overflow,Heavy precipitation/Artificial waterway overflow/Short duration flood,1,0,1,0,0,0,0,0,0,1,,,,,,,7.0,,,,,,10,2,10,7.0,,2.0,2017-03-16 02:00:00
4131,SNGRE,GUAYAS,EC09,BALAO,EC0903,BALAO,EC090350,Miraflores ,-79.820298,-2.91353,La Costa,4/5/17,2:00:00 AM,4,5,2017,Rain / Overflow,Artificial waterway overflow/ short duration rain / Short duration flood,0,1,1,0,0,0,0,0,0,1,,,,,,,8.0,,,,,,10,2,10,8.0,,2.0,2017-04-05 07:00:00
3542,Desinventar,GUAYAS,EC09,GUAYAQUIL,EC0901,TARQUI,EC090150,Monte Sinai Coop. Maria Paydar Bl. 10 Mz. 3 Sl. 14; Mz. 5 Sl,-80.045331,-2.350555,La Costa,3/15/16,2:30:00 PM,3,15,2016,Rain,Heavy precipitation/ Short duration rain/ Strong current,1,1,0,0,0,0,0,0,1,0,,,,,3.0,,11.0,11.0,,,,,10,2,10,11.0,3.0,3.0,2016-03-15 19:30:00
